"hep-ph/9507326","Frank Close","Claude Amsler and Frank Close","Is $f_0(1500)$ a Scalar Glueball?","11 figures; PS files or hard copy available from C Amsler","Phys.Rev.D53:295-311,1996","10.1103/PhysRevD.53.295","RAL-TR-95-003","hep-ph",,"  Following the discovery of two new scalar mesons, $f_0(1370)$ and $f_0(1500)$
at the Low Energy Antiproton Ring at CERN, we argue that the observed
properties of this pair are incompatible with them both being $\qqbar$ mesons.
We show instead that $f_0(1500)$ is compatible with the ground state glueball
expected around 1500 MeV mixed with the nearby states of the $0^{++}$
$Q\bar{Q}$ nonet. Tests of this hypothesis include the prediction of a further
scalar state, $f_0'(1500 - 1800)$ which couples strongly to $K\bar{K}$,
$\eta\eta$ and $\eta\eta'$. Signatures for a possible tensor glueball at $\sim
$2 GeV are also considered.
","[{""version"":""v1"",""created"":""Tue, 18 Jul 1995 11:45:00 GMT""}]","2008-11-26"
"hep-ph/9507327","Ezio Maina","E. Accomando, A. Ballestrero and E. Maina (U. of Torino)","Six--jet decay of off--shell WW pairs at $e^+ e^-$ colliders","8 LaTex pages, 7 figs tarred and compressed","Phys.Lett. B362 (1995) 141-147","10.1016/0370-2693(95)01167-O","DFTT 37/95","hep-ph",,"  Six--jet events via WW pairs, $e^+e^- \ar W^+W^- \ar q_1 \overline{q_1} q_2
\overline{q_2} g g$ are studied at tree level using helicity amplitudes. This
is the dominant production mechanism for six--jet final states at Lep II
energy. ISR effects are taken into account. Total production rates as a
function of $y_{cut}$ are given. The relevance of these processes for the issue
of colour reconnection is discussed. The cross section for five--jet production
via WW pairs at Lep II is also presented.
","[{""version"":""v1"",""created"":""Tue, 18 Jul 1995 10:43:51 GMT""}]","2009-10-28"
"hep-ph/9507328",,"Norberto N. Scoccola and Thomas D. Cohen","Nucleon electric polarizability in soliton models and the role of the
  seagull terms","LaTeX, 17 pages, no figures","Nucl.Phys. A596 (1996) 599-610","10.1016/0375-9474(95)00431-9","DOE/ER/40762-061, U. of MD PP\#96-001 and TAN-FNT-95-07","hep-ph",,"  The full Hamiltonian of the soliton models contains no electric seagull
terms. Here it is shown that if one restricts the fields to the collective
subspace then electric seagull terms are induced in the effective Hamiltonian.
These effective seagull contributions are consistent with gauge invariance.
They also reproduce the leading nonanalytic behavior of a large $N_c$ chiral
perturbation theory calculation of the electric polarizability.
","[{""version"":""v1"",""created"":""Tue, 18 Jul 1995 13:09:04 GMT""}]","2009-10-28"
"hep-ph/9507329","William Palmer","G. Kramer and W. Palmer","Electroweak and Strong Penguins in B^{\pm, 0}\to \pi\pi, \pi K and KK
  Decays","29 pages, latex/revtex, no figures","Phys.Rev. D52 (1995) 6411-6421","10.1103/PhysRevD.52.6411","DESY 95-131","hep-ph",,"  We calculate CP-violating rates and asymmetry parameters in charged and
neutral $B\to \pi\pi, \pi K$ and $\bar K K$ decays arising from the
interference of tree and penguin (strong and electroweak) amplitudes with
different strong and CKM phases. The perturbative strong (electroweak) phases
develop at order $\alpha_s$ ($\alpha_{em}$) from absorptive parts of one-loop
matrix elements of the next-to-leading (leading) logarithm corrected effective
Hamiltonian. The BSW model is used to estimate the hadronic matrix elements.
Based on this model, we find that the effect of strong phases and penguins is
substantial in most channels, drastic in many. However, a measurement of the
time dependence parameter $a_{\epsilon+\epsilon'}$ in the $\pi^+\pi^-$ channel
is only influenced at the 20\% level by the complication of the penguins.
Recent flavor sum rules developed for $B^{0,\pm} \rightarrow \pi\pi, \pi K, K
\bar K$ amplitudes are tested in this model. Some are well satisfied, others
badly violated, when electroweak penguins are included.
","[{""version"":""v1"",""created"":""Tue, 18 Jul 1995 14:13:13 GMT""}]","2009-10-28"
"hep-ph/9507330",,"Y. Srivastava, A. Widom and E. Sassaroli","Real and Virtual Strange Processes","11 pages, LaTex file, one uuencoded file for the 3 figures. The
  postcript file for the figures is also available on request. Talk presented
  by Y. Srivastava at the ``Workshop on Physics and Detectors for DAFNE"",
  Frascati, April 1995",,,,"hep-ph",,"  Following notions of quantum mechanics as interpreted by the Copenhagen
School, we make a distinction between measurements involving one or two virtual
K mesons. New predictions result for the period of K oscillations at the Phi
Factory.
","[{""version"":""v1"",""created"":""Tue, 18 Jul 1995 14:56:09 GMT""}]","2007-05-23"
"hep-th/9507087","Bireswar Basu-Mallick","B Basu-Mallick and Anjan Kundu","Algebraic aspect and construction of Lax operators in quantum integrable
  systems","8 pages, plain TEX, no figures","Mod. Phys. Lett. A10 (1995) 3113","10.1142/S0217732395003264","TIFR/TH/95-36","hep-th",,"  An algebraic construction more general and intimately connected with that of
Faddeev$^1$, along with its application for generating different classes of
quantum integrable models are summarised to complement the recent results of
ref. 1 ( L.D. Faddeev, {\it Int. J. Mod. Phys. } {\bf A10}, 1845 (1995) ).
","[{""version"":""v1"",""created"":""Mon, 17 Jul 1995 16:17:36 GMT""}]","2015-06-26"
"hep-th/9507090","Donam Youm","Mirjam Cvetic and Donam Youm","Dyonic BPS Saturated Black Holes of Heterotic String on a Six-Torus","10 pages, uses RevTex, improved version to appear in Rapid
  Communication of PRD","Phys.Rev.D53:584-588,1996","10.1103/PhysRevD.53.584","UPR-672-T","hep-th gr-qc",,"  Within effective heterotic superstring theory compactified on a six-torus we
derive minimum energy (supersymmetric), static, spherically symmetric
solutions, which are manifestly invariant under the target space $O(6,22)$ and
the strong-weak coupling $SL(2)$ duality symmetries with 28 electric and 28
magnetic charges subject to one constraint. The class of solutions with a
constant axion corresponds to dyonic configurations subject to two charge
constraints, with purely electric [or purely magnetic] and dyonic
configurations preserving ${1\over 2}$ and ${1\over 4}$ of $N=4$ supersymmetry,
respectively. General dyonic configurations in this class have a space-time of
extreme Reissner-Nordstr\"" om black holes while configurations with more
constrained charges have a null or a naked singularity.
","[{""version"":""v1"",""created"":""Tue, 18 Jul 1995 01:45:37 GMT""},{""version"":""v2"",""created"":""Sun, 5 Nov 1995 23:40:08 GMT""}]","2009-09-17"
"hep-th/9507091","Ahmed Azhari","A. Azhari and T.T. Truong","On the Sutherland's Integrability Condition for Two-Dimensional
  N-Particle Systems","13 pages,uses LATeX2e and epsf. File prepared using the uufiles
  package",,,"LMPM-95-AT,CERGY-95-AT","hep-th",,"  Following Sutherland's work on one-dimensional integrable systems we
formulate and study its two-dimensional version. Physically it expresses the
absence of true 3-body forces among an assembly of N particles leaving
exclusively effective 2-body interactions. This criterion may be a suitable
candidate for an integrability condition.
","[{""version"":""v1"",""created"":""Tue, 18 Jul 1995 13:03:23 GMT""}]","2007-05-23"
"math/9507211","Menachem Kojman","Menachem Kojman","On universal graphs without cliques or withour large bipartite graphs",,,,"Logic E-prints July 18, 1995","math.LO",,"  For every uncountable cardinal $\lambda$, suitable negations of the
Generalized Continuum Hypothesis imply:
  - For all infinite $\alpha$ and $\beta$, there is no universal
$K_{\alpha,\beta}$-free graphs in $\lambda$
  - For all $\alpha\ge 3$, there is no universal $K_\alpha$-free graph in
$\lambda$
  The instance $K_{\omega,\omega_1}$ for $\lambda=\aleph_1$ was settled by
Komjath and Pach from the principle $\diamondsuit(\omega_1)$.
","[{""version"":""v1"",""created"":""Tue, 18 Jul 1995 00:00:00 GMT""}]","2016-09-06"
"nucl-th/9507031","Sergey Efremov","S.V. Efremov and E.Ya. Paryev","Production of $K^-$-mesons in proton-proton and proton-nucleus
  interactions at various energies","14 pages, LaTeX, uses ws-art.sty. Figures can be requested from
  efremov@physics.rice.edu or looked up in the article above","Z.Phys. A348 (1994) 217-225; Phys.Atom.Nucl. 57 (1994) 532-541",,,"nucl-th",,"  The experimental data on the production of $K^-$-mesons in pp-collisions are
analyzed and a method of the unified description of these data in a broad
energy range for primary protons is proposed. The $K^-$-mesons production in
pA-collisions is considered. The simple formulas for inclusive cross sections
of the $K^-$ production in these collisions are given. The results of the
calculations by these formulas are compared with the available experimental
data.
","[{""version"":""v1"",""created"":""Mon, 17 Jul 1995 21:47:36 GMT""}]","2007-05-23"
"nucl-th/9507032","Georg Wagner","Georg Wagner, Alfons J. Buchmann, and Amand Faessler","Magnetic Moments of the Octet Baryons in a Chiral Quark Potential Model","13 pages, Latex, submitted to Phys. Lett. B, 1 figure","Phys.Lett. B359 (1995) 288-294","10.1016/0370-2693(95)01103-W",,"nucl-th",,"  In quark potential models, two--body current contributions to baryon magnetic
moments arise necessarily to satisfy the continuity equation for the
electromagnetic current. On the other hand, the naive additive quark model
predicts the experimental octet magnetic moments to within 5$\%$. We
demonstrate that consistently derived two--body current contributions to the
octet baryon magnetic moments are individually large, but tend to cancel each
other globally.
","[{""version"":""v1"",""created"":""Tue, 18 Jul 1995 09:53:36 GMT""}]","2009-10-28"
"patt-sol/9507003","Paul Umbanhowar","Francisco Melo (Departamento de Fisica, Universidad de Santiago), Paul
  Umbanhowar, and Harry L. Swinney (Center for Nonlinear Dynamics, University
  of Texas at Austin)","Hexagons, Kinks and Disorder in Oscillated Granular Layers","4 pages. The RevTeX file has a macro allowing various styles. The
  appropriate style is ""myprint"" which is the default",,"10.1103/PhysRevLett.75.3838","UT-CNLD-95.7","patt-sol nlin.PS",,"  Experiments on vertically oscillated granular layers in an evacuated
container reveal a sequence of well-defined pattern bifurcations as the
container acceleration is increased. Period doublings of the layer center of
mass motion and a parametric wave instability interact to produce hexagons and
more complicated patterns composed of distinct spatial domains of different
relative phase separated by kinks (phase discontinuities). Above a critical
acceleration, the layer becomes disordered in both space and time.
","[{""version"":""v1"",""created"":""Mon, 17 Jul 1995 17:58:54 GMT""}]","2009-10-28"
"q-alg/9507013",,"Chong-Sun Chu, Pei-Ming Ho and Bruno Zumino","The Braided Quantum 2-Sphere","14 pages","Mod.Phys.Lett. A11 (1996) 307-316","10.1142/S0217732396000357","LBL-37506, UCB-PTH-95/25","q-alg hep-th math.QA",,"  In a recent paper the quantum 2-sphere $S^2_q$ was described as a quantum
complex manifold. Here we consider several copies of $S^2_q$ and derive their
braiding commutation relations. The braiding is extended to the differential
and to the integral calculus on the spheres. A quantum analogue of the
classical anharmonic ratio of four points on the sphere is given, which is
invariant under the coaction of $SU_q(2)$.
","[{""version"":""v1"",""created"":""Mon, 17 Jul 1995 23:50:04 GMT""}]","2009-10-28"
"supr-con/9507005",,"C. Nappi (CNR Napoli, Italy), G.Filatrella (Dept. of Physics,
  Salerno), and S. Pagano(CNR Napoli, Italy)","Constants of motion in the dynamics of a 2N-junction SQUID","Figures available from the authors. Submitted to Phys. Lett. A",,"10.1016/0375-9601(95)00572-K",,"supr-con chao-dyn cond-mat.supr-con nlin.CD",,"  We show that a 2N junction SQUID (Superconducting QUantum Interference
Device) made of 2N overdamped, shunted, identical junctions may be described as
a system having only 6 degrees of freedom for any N > 2. This is achieved by
means of the reduction introduced by Watanabe and Strogatz (Physica D, Vol. 74,
(1994) p. 197) for series biased arrays. In our case 6 rather than 3 degrees of
freedom are necessary to describe the system, due to the requirement of phase
quantization along the superconducting loop constituting the device.
Generalization to multijunction parallel arrays is straightforward.
","[{""version"":""v1"",""created"":""Tue, 18 Jul 1995 14:16:21 GMT""}]","2009-10-28"
