"alg-geom/9512001","Richard Hain","Richard Hain","Infinitesimal presentations of the Torelli groups","55 pages, LaTeX2e, amsart.cls. Author supplied dvi file available
  from http://www.math.duke.edu/faculty/hain/",,,,"alg-geom math.AG",,"  This is a significant revision of the early version of this paper which was
posted last December. The speculative section has been removed in light of some
recent results of Morita and Kawazumi. Numerous typos have been fixed. The
companion paper ""The Hodge de Rham Theory of Relative Malcev Completion"" has
just been posted.
","[{""version"":""v1"",""created"":""Fri, 1 Dec 1995 21:49:54 GMT""},{""version"":""v2"",""created"":""Thu, 18 Jul 1996 23:03:13 GMT""}]","2008-02-03"
"astro-ph/9512002","Michael Rauch","Michael Rauch (Astronomy Dept., Caltech)","Warm Gas at High Redshift - Clues to Gravitational Structure Formation
  from Optical Spectroscopy of Lyman Alpha Absorption Systems","6 pages, gzipped postscript file (figures included) To appear in the
  proceedings of the conference on ""Cold Gas at High Redshift"", August 28-30th,
  1995, Hoogeveen, Holland",,"10.1007/978-94-009-1726-2_13",,"astro-ph",,"  We discuss the effects of gravitational collapse on the shape of absorption
line profiles for low column density (log N(HI) < 14) Lyman Alpha forest clouds
and argue by comparison with cosmological simulations that Lyman alpha forest
observations show the signs of ongoing gravitational structure formation at
high redshift. The departures of observed line profiles from thermal Voigt
profiles (caused by bulk motion of infalling gas and compressional heating) are
evident from the results of profile fitting as a correlation in velocity space
among pairs of components with discrepant Doppler parameters. This correlation
also allows us to qualitatively understand the meaning of the Doppler parameter
- column density (b vs. N(HI)) diagram for intergalactic gas.
","[{""version"":""v1"",""created"":""Fri, 1 Dec 1995 19:31:44 GMT""}]","2016-01-27"
"astro-ph/9512003","Craig Hogan","Craig J. Hogan (University of Washington)","Cosmic Deuterium and Baryon Density","PASP Latex, typos corrected","Publ.Astron.Soc.Pac. 99 (1995) 67",,,"astro-ph",,"  Quasar absorption lines now permit a direct probe of deuterium abundances in
primordial material, with the best current estimate $ (D/H)=1.9\pm 0.4 \times
10^{-4}$. If this is the universal primordial abundance $(D/H)_p$, Standard Big
Bang Nucleosynthesis yields an estimate of the mean cosmic density of baryons,
$\eta_{10}= 1.7\pm 0.2$ or $ \Omega_b h^2= 6.2\pm 0.8\times 10^{-3}$, leading
to SBBN predictions in excellent agreement with estimates of primordial
abundances of helium-4 and lithium-7. Lower values of $(D/H)_p$ derived from
Galactic chemical evolution models may instead be a sign of destruction of
deuterium and helium-3 in stars. The inferred baryon density is compared with
known baryons in stars and neutral gas; about two thirds of the baryons are in
some still-unobserved form such as ionized gas or compact objects. Galaxy
dynamical mass estimates reveal the need for primarily nonbaryonic dark matter
in galaxy halos. Galaxy cluster dynamics imply that the total density of this
dark matter, while twenty or more times the baryon density, is still well below
the critical value, unless both baryons and galaxies are concentrated in galaxy
clusters relative to the dark matter.
","[{""version"":""v1"",""created"":""Fri, 1 Dec 1995 19:43:03 GMT""},{""version"":""v2"",""created"":""Tue, 5 Dec 1995 17:25:17 GMT""},{""version"":""v3"",""created"":""Wed, 6 Dec 1995 17:42:11 GMT""}]","2008-02-03"
"astro-ph/9512004","Craig Hogan","M. Rugers and C. J. Hogan (University of Washington)","Confirmation of high deuterium abundance in QSO absorbers","15 pages, AAS Latex, final version, to appear in ApJ Letters","Astrophys.J.459:L1-L4,1996","10.1086/309931",,"astro-ph",,"  We present a new analysis of a Keck spectrum of Q0014+813, with a new model
of the $z=3.32$ absorbing cloud. We fit Lyman series absorption of the dominant
HI components, including components identified with hydrogen and associated
deuterium at two discrete velocities, with thermal line broadening of each
species. The deuterium features are too narrow to be interlopers, and the good
agreement in temperature and redshift with their hydrogen counterparts confirms
the identification as deuterium. The abundance is measured to be $D/H$ $ = 1.9
\pm 0.5$ and $1.9 \pm 0.4 \times 10^{-4}$ in the two components, with an
independent lower limit of D/H $> 1.3 \times 10^{-4}$ for the sum, derived from
the Lyman Limit opacity. The impact on cosmological theory is briefly
discussed.
","[{""version"":""v1"",""created"":""Fri, 1 Dec 1995 20:00:27 GMT""},{""version"":""v2"",""created"":""Tue, 19 Dec 1995 19:14:52 GMT""}]","2009-10-28"
"astro-ph/9512005","Ted von Hippel","Ted von Hippel (University of Wisconsin, USA)","Main Sequence Masses and Radii from Gravitational Redshifts","7 pages, latex, no figures, to be published in ApJ Letters",,"10.1086/309911",,"astro-ph",,"  Modern instrumentation makes it possible to measure the mass to radius ratio
for main sequence stars in open clusters from gravitational redshifts. For
stars where independent information is available for either the mass or the
radius, this application of general relativity directly determines the other
quantity. Applicable examples are: 1) measuring the radii of solar metallicity
main sequence stars for which the mass - luminosity relation is well known, 2)
measuring the radii for stars where model atmospheres can be used to determine
the surface gravity (the mass to radius squared ratio), 3) refining the mass -
radius relation for main sequence stars, and 4) measuring the change in radius
as stars evolve off the main sequence and up the giant branch.
","[{""version"":""v1"",""created"":""Sat, 2 Dec 1995 01:31:10 GMT""}]","2009-10-28"
"astro-ph/9512006","Dave Cottingham","D. J. Fixsen, E. S. Cheng, D. A. Cottingham, W. C. Folz, C. A. Inman,
  M. S. Kowitt, S. S. Meyer, L. A. Page, J. L. Puchalla, J. E. Ruhl, and R. F.
  Silverberg","A Balloon-Borne Millimeter-Wave Telescope for Cosmic Microwave
  Background Anisotropy Measurements","37 pages, 15 figures, uses BoxedEPS.tex","ApJ 470 63 (1996)","10.1086/177850",,"astro-ph",,"  We report on the characteristics and design details of the Medium Scale
Anisotropy Measurement (MSAM), a millimeter-wave, balloon-borne telescope that
has been used to observe anisotropy in the Cosmic Microwave Background
Radiation (CMBR) on 0\fdg5 angular scales. The gondola is capable of
determining and maintaining absolute orientation to a few arcminutes during a
one-night flight. Emphasis is placed on the optical and pointing performance as
well as the weight and power budgets. We also discuss the total balloon/gondola
mechanical system. The pendulation from this system is a ubiquitous
perturbation on the pointing system. A detailed understanding in these areas is
needed for developing the next generation of balloon-borne instruments.
","[{""version"":""v1"",""created"":""Sat, 2 Dec 1995 03:55:56 GMT""}]","2009-10-28"
"atom-ph/9512001",,"T. Negadi and M. Kibler","The Periodic Table in Flatland","18 pages, Latex File, to be published in Int. J. Quantum Chem",,,"LYCEN 9506","atom-ph chem-ph physics.atom-ph quant-ph",,"  The $D$-dimensional Coulomb system serves as a starting point for generating
generalized atomic shells. These shells are ordered according to a generalized
Madelung rule in $D$ dimensions. This rule together with an {\it Aufbau
Prinzip} is applied to produce a $D$-dimensional periodic table. A model is
developed to rationalize the ordering of the shells predicted by the
generalized Madelung rule. This model is based on the introduction of an
Hamiltonian, invariant under the $q$-deformed algebra $U_q($so$(D))$, that
breaks down the SO($D+1$) dynamical symmetry of the hydrogen atom in $D$
dimensions. The $D=2$ case (Flatland) is investigated with some details. It is
shown that the neutral atoms and the (moderately) positive ions correspond to
the values $q=0.8$ and $q=1$, respectively, of the deformation parameter $q$.
","[{""version"":""v1"",""created"":""Sat, 2 Dec 1995 09:38:27 GMT""}]","2008-02-03"
"cond-mat/9512008","Edward Shuryak","E.V.Shuryak (Department of Physics, State Univ of NY at Stony Brook)","Bose Condensate made of Atoms with Attractive Interaction is Metastable","Replacement is supposed to get figures in place",,,,"cond-mat",,"  Recent experiments with trapped cooled atoms have produced evidences for
  Bose-Einstein condensation. Among the atoms used are $^7Li$ ones, with
attractive low energy interaction. Stability of their condensate is studied,
with a conclusion that for a number of atoms below the critical value there
exist a metastable minimum, separated from collapse by a potential barrier. The
lifetime due to tunneling is estimated: it is unlikely to happen in the present
experiment. Although in experimental conditions most of the atoms are not in
the condensate, we argue that they only slightly affect the stability
conditions for the condensate evaluated at T=0.
","[{""version"":""v1"",""created"":""Fri, 1 Dec 1995 20:47:13 GMT""},{""version"":""v2"",""created"":""Mon, 4 Dec 1995 20:25:34 GMT""},{""version"":""v3"",""created"":""Tue, 5 Dec 1995 20:48:07 GMT""}]","2016-08-31"
"cond-mat/9512009","Eugene A. Demler","Eugene Demler, Shou-Cheng Zhang, Nejat Bulut and Douglas J. Scalapino","A new class of collective excitations of the Hubbard model I: $\eta$
  excitation of the negative--$U$ model","30 pages, revtex 3.0 and epsf.sty (optional), 13 PostScript figures.
  Submitted to Phys. Rev. B. Minor changes, typos corrected, references added","IJMP B 10, 2137 (1996)","10.1142/S0217979296000982","SU-ITP \#95/32","cond-mat",,"  In this series of papers we present a detailed study of the
particle--particle collective excitations of the Hubbard model, and their
contribution to the density and spin excitation spectrum. In the first paper,
we shall investigate the singlet particle--particle pair with momentum
$(\pi,\pi)$, the $\eta$ particle, of the negative--$U$ Hubbard model. We review
three previously obtained theorems about the $\eta$ particle and develop a
self-consistent linear response theory which takes into account its
contribution to the density excitation spectrum in the superconducting state.
We show that this self--consistent theory agrees with the exact theorems as
well as the results of numerical Monte Carlo simulations.
","[{""version"":""v1"",""created"":""Sat, 2 Dec 1995 06:27:12 GMT""},{""version"":""v2"",""created"":""Thu, 21 Dec 1995 21:32:00 GMT""}]","2009-10-28"
"cond-mat/9512010","Michael Stone","Michael Stone","The Magnus Force on Skyrmions in Ferromagnets and the Quantum Hall
  Effect","Plain TeX, 13 pages",,"10.1103/PhysRevB.53.16573",,"cond-mat",,"  The topological solitons, or ``skyrmions'', in a planar ferromagnet
experience a Magnus force proportional to the product of their velocity and the
surrounding magnetization. It has been suggested that the charged
quasiparticles near filling factor $\nu=1$ in the $GaAs$ quantum Hall effect
are skyrmions. If so we might expect this spin-induced Magnus force to act on
the quasiparticles in addition to the Lorentz force they experience because of
their charge. We show that this is not the case, and that the Magnus and
Lorentz forces are merely different descriptions of the same physical effect.
","[{""version"":""v1"",""created"":""Sat, 2 Dec 1995 11:24:50 GMT""}]","2016-08-31"
"cond-mat/9512016","Vladan Celebonovic","V.Celebonovic ( Inst.of Physics,Beograd,Yugoslavia)","The chemical potential of the electron gas on a one dimensional lattice","4 pages,plain TeX,presented at the 9 National Congress of Yugoslav
  Physicists,held in May 1995.,and published in the proceedings.The author can
  be contacted at: vladanc@mrsys1.mr-net.co.yu",,,,"cond-mat",,"  The chemical potential of the electron gas on a one-dimensional lattice is
determined within the discrete Hubbard model. The result will have applications
in studies of transport properties of quasi one-dimensional organic conductors
such as the Bechgaard salts.
","[{""version"":""v1"",""created"":""Sat, 2 Dec 1995 15:17:35 GMT""}]","2007-05-23"
"gr-qc/9512003","Beverly Berger","Beverly K. Berger","Numerical Investigation of Singularities","Based on GR14 talk. 21 pages, Latex, 5 figures in separate file
  gr14.uu. Uses sprocl.sty, psfig.sty",,,,"gr-qc",,"  Numerical exploration of the properties of singularities could, in principle,
yield detailed understanding of their nature in physically realistic cases.
Examples of numerical investigations into the formation of naked singularities,
critical behavior in collapse, passage through the Cauchy horizon, chaos of the
Mixmaster singularity, and singularities in spatially inhomogeneous
cosmololgies are discussed.
","[{""version"":""v1"",""created"":""Fri, 1 Dec 1995 20:11:23 GMT""}]","2007-05-23"
"gr-qc/9512004","Beverly Berger","Beverly K. Berger","Numerical Investigation of Cosmological Singularities","Based on lectures given at WE-Heraeus-Seminar on Relativity and
  Scientific Computing. 24 pages, Latex, 9 figures in separate file BHfigs.uu,
  uses psfig.tex",,,,"gr-qc",,"  We describe a numerical approach to address the BKL conjecture that the
generic cosmological singularity is locally Mixmaster-like. We consider
application of a symplectic PDE solver to three models of increasing
complexity--spatially homogeneous (vacuum) Mixmaster cosmologies where we
compare the symplectic ODE solver to a Runge-Kutta one, the (plane symmetric,
vacuum) Gowdy universe on $T^3 \times R$ whose dynamical degrees of freedom
satisfy nonlinearly coupled PDE's in one spatial dimension and time, and U(1)
symmetric, vacuum cosmologies on $T^3 \times R$ which are the simplest
spatially inhomogeneous universes in which local Mixmaster dynamics is allowed.
","[{""version"":""v1"",""created"":""Fri, 1 Dec 1995 21:25:19 GMT""}]","2007-05-23"
"gr-qc/9512005","Beverly Berger","Beverly K. Berger","Comment on the chaotic singularity in some magnetic Bianchi VI$_0$
  cosmologies","8 pages, Revtex, no figures","Class.Quant.Grav. 13 (1996) 1273-1276","10.1088/0264-9381/13/5/036",,"gr-qc",,"  Description of the magnetic Bianchi VI$_0$ cosmologies of LeBlanc, Kerr, and
Wainwright in the formalisms both of Belinskii, Khalatnikov, and Lifshitz, and
of Misner allows qualitative understanding of the Mixmaster-like singularity in
those models.
","[{""version"":""v1"",""created"":""Fri, 1 Dec 1995 21:31:48 GMT""}]","2009-10-28"
"hep-ex/9512002",,"Daniel M. Kaplan (Illinois Institute of Technology)","Charm2000: A >10^8-charm experiment for the turn of the millennium","10 pages, 3 PostScript figures","Nucl.Phys.Proc.Suppl. 50 (1996) 260-271","10.1016/0920-5632(96)00401-X","IIT-HEP-95/7","hep-ex",,"  I discuss the physics reach of a fixed-target charm experiment which can
reconstruct >10^8 charm decays, three orders of magnitude beyond the largest
extant sample. Such an experiment may run at Fermilab shortly after the Year
2000. In addition to ""programmatic"" charm physics such as spectroscopy,
lifetimes, and tests of QCD, this ""Charm2000"" experiment will have significant
sensitivity to new physics in the areas of CP violation, flavor-changing
neutral-current and lepton-number-violating decays, and mixing, and could
observe direct CP violation in Cabibbo-suppressed decays at the level predicted
by the Standard Model.
","[{""version"":""v1"",""created"":""Fri, 1 Dec 1995 21:16:13 GMT""}]","2009-10-28"
"hep-lat/9512002","Christian Holm","Christian Holm and Wolfhard Janke (FU-Berlin and JGU Mainz)","Ising Spins on a Gravitating Sphere","13 pages, self unpacking uuencoded PostScript file, including all the
  figures. Paper also available at http://www.physik.fu-berlin.de/~holm/","Phys.Lett. B375 (1996) 69-74","10.1016/0370-2693(96)00199-2","FUB-HEP 18/95 and KOMA-95-81","hep-lat",,"  We investigated numerically an Ising model coupled to two-dimensional
Euclidean gravity with spherical topology, using Regge calculus with the $dl/l$
path-integral measure to discretize the gravitational interaction. Previous
studies of this system with toroidal topology have shown that the critical
behavior of the Ising model remains in the flat-space Onsager universality
class, contrary to the predictions of conformal field theory and matrix models.
Implementing the spherical topology as triangulated surfaces of
three-dimensional cubes, we find again strong evidence that the critical
exponents of the Ising transition are consistent with the Onsager values, and
that KPZ exponents are definitely excluded.
","[{""version"":""v1"",""created"":""Fri, 1 Dec 1995 17:58:22 GMT""}]","2009-10-28"
"hep-ph/9512208","Stefano Forte","Stefano Forte and Richard D. Ball","Universality and Scaling in Perturbative QCD at Small x","35 pages, TeX with epsf, 12 figures in compressed postscript","Acta Phys.Polon.B26:2097-2134,1995",,"CERN-TH/95-323, Edinburgh 95/560","hep-ph",,"  We present a pedagogical review of the universal scaling properties displayed
by the structure function F_2 at small x and large Q^2 as measured at HERA. We
first describe the derivation of the double asymptotic scaling of F_2 from the
leading-order Altarelli-Parisi equations of perturbative QCD. Universal
next-to-leading order corrections to scaling are also derived. We explain why
the universal scaling behaviour is spoiled when the initial distributions rise
too steeply by considering the nonsinglet distribution F_2^p-F_2^n as an
explicit example. We then examine the stability of double scaling to the
inclusion of higher order singularities, explaining how the perturbative
expansion at small x can be reorganized in such a way that each order is given
by the sum of a convergent series of contributions which are of arbitrarily
high order in the coupling. The wave-like nature of perturbative evolution is
then shown to persist throughout almost all the small x region, giving rise
asymptotically to double scaling for a wide class of boundary conditions.
","[{""version"":""v1"",""created"":""Fri, 1 Dec 1995 18:03:56 GMT""}]","2014-11-17"
"hep-ph/9512209","Jean-Rene Cudell","J.R. Cudell (Liege U.)","A Review of the Soft Pomeron","Latex document, 8 pages, no figures. Invited talk at the
  International Europhysics Conference on High Energy Physics (HEP 95), 27 Jul
  - 2 Aug 1995 , Brussels, Belgium",,,"Brown-HET-1024, TA-530; McGill/95-57","hep-ph",,"  Soft pomeron fits reproduce all zero-Q2 data for light quarks, but run into
problems at HERA for heavy mesons and for high Q2, and at the Tevatron for W
diffractive production. I review the basic properties of the soft pomeron, and
outline the possibilities which have been considered to account for the new
data.
","[{""version"":""v1"",""created"":""Fri, 1 Dec 1995 17:15:16 GMT""}]","2007-05-23"
"hep-ph/9512210","Wolf-Dieter Nowak","Wolf-Dieter Nowak (DESY - Zeuthen)","Measurement of Singly Polarized p + N(pol) Collisions at HERA","Contribution to the Proceedings of the 'Workshop on the Prospects of
  Spin Physics at HERA', held at DESY-Zeuthen, August 28-31, 1995 Proceedings
  volume to be published as DESY 95-200, report on p.145 Figures are uuencoded
  in 'prep1195.uu': 6 pages as six '.eps' files",,,"DESY--Zeuthen 95--06, Internal Report, December 1995","hep-ph",,"  A summary is given on the physics potential of measuring singly polarized
proton--nucleon collisions using a polarized internal target in the 820 GeV
HERA proton beam. This summary is based upon talks given at the 2nd Meeting on
'Possible Measurements of Singly Polarized p + p(pol) and p + n(pol) Collisions
at HERA' which was held at DESY Zeuthen from August 31 to September 2, 1995 as
a follow-up to the 'Workshop on the Prospects of Spin Physics at HERA.
","[{""version"":""v1"",""created"":""Fri, 1 Dec 1995 20:14:50 GMT""}]","2007-05-23"
"hep-ph/9512211","Tony Gherghetta","Katherine Freese, Tony Gherghetta and Hideyuki Umeda","Moduli Inflation with Large Scale Structure Produced by Topological
  Defects","12 pages, plain TeX; Comments and references added, version to appear
  in Phys. Rev. D","Phys.Rev. D54 (1996) 6083-6087","10.1103/PhysRevD.54.6083","UM-AC-95-11","hep-ph astro-ph",,"  It is tempting to inflate along one of the many flat directions that arise in
supersymmetric theories. The required flatness of the potential to obtain
sufficient inflation and to not overproduce density fluctuations occurs
naturally. However, the density perturbations (in the case of a single moduli
field) that arise from inflaton quantum fluctuations are too small for
structure formation. Here we propose that topological defects (such as cosmic
strings), which arise during a phase transition near the end of moduli
inflation can provide an alternative source of structure. The strings produced
will be `fat', yet have the usual evolution by the time of nucleosynthesis.
Possible models are discussed.
","[{""version"":""v1"",""created"":""Fri, 1 Dec 1995 21:44:59 GMT""},{""version"":""v2"",""created"":""Tue, 8 Oct 1996 18:43:04 GMT""}]","2009-10-28"
"hep-ph/9512212",,"Edmond L. Berger and Harry Contopanagos","Top Quark Production Dynamics in QCD","12 pages. Latex file plus 8 ps files of figures submitted altogther
  in uuencoded form; Invited talk presented by E. L. Berger at the
  International Symposium on Heavy Flavor and Electroweak Theory, Beijing,
  August 16 - 19, 1995",,,"ANL-HEP-CP-95-85","hep-ph",,"  A calculation of the total cross section for top quark production in
hadron-hadron collisions is presented based on an all-orders perturbative
resummation of initial-state gluon radiative contributions to the basic quantum
chromodynamics subprocesses. Principal-value resummation is used to evaluate
all relevant large threshold contributions. In this method there are no
arbitrary infrared cutoffs, and the perturbative regime of applicability is
well defined, two attributes that significantly reduce the estimated
uncertainty of the results. For $p\bar{p}$ collisions at center-of-mass energy
$\sqrt{s}=1.8$ TeV and a top mass of 175 GeV, we obtain
$\sigma(t\bar{t})=5.52^{+0.07}_{-0.45} pb$, in agreement with experiment.
Predicted cross sections are provided as a function of top mass in $p\bar{p}$
collisions at $\sqrt{s}=2.0$ TeV and in $p p$ collisions at CERN LHC energies.
","[{""version"":""v1"",""created"":""Fri, 1 Dec 1995 22:42:47 GMT""},{""version"":""v2"",""created"":""Tue, 5 Dec 1995 00:25:48 GMT""}]","2008-02-03"
"hep-ph/9512214","Pierre Valin","Kyungsik Kang (Brown University) and Pierre Valin (Universite de
  Montreal)","Remarks on the UA4/2 d\sigma/dt and on the Asymptotic \sigma_T(s)
  Behavior","5 pages, latex, figure available from author K. Kang at
  kang@het.brown.edu","Proceedings of VIth Blois Workshop (20-24 June 1995)",,"BROWN-HET-1007, BROWN-TA-525","hep-ph",,"  We find that the UA4/2 measurements on the real part of the forward $p \bar
p$ scattering amplitude and total cross section are consistent with each other
and also with the standard picture of the Pomeron of either ${\it ln} ^2 s$ or
${\it ln} s$ type. However the asymptotic $\sigma _T (s)$ behavior obtained
from the {\it ad hoc} parametrization fit to the $p \bar p$ total cross
sections as quoted in the Review of Particle Properties is consistent with the
analysis of the class of the analytic amplitude models that contain the ${\it
ln} ^2 s$ type Pomeron term.
","[{""version"":""v1"",""created"":""Sat, 2 Dec 1995 09:17:58 GMT""},{""version"":""v2"",""created"":""Wed, 6 Dec 1995 09:18:16 GMT""}]","2008-02-03"
"hep-th/9512002",,"L.V. Belvedere, R.L.P.G. Amaral and N. A. Lemos","Canonical Transformations in a Higher-Derivative Field Theory","12 pages, LaTex","Z.Phys. C66 (1995) 613","10.1007/BF01579636",,"hep-th",,"  It has been suggested that the chiral symmetry can be implemented only in
classical Lagrangians containing higher covariant derivatives of odd order.
Contrary to this belief, it is shown that one can construct an exactly soluble
two-dimensional higher-derivative fermionic quantum field theory containing
only derivatives of even order whose classical Lagrangian exhibits chiral-gauge
invariance. The original field solution is expressed in terms of usual Dirac
spinors through a canonical transformation, whose generating function allows
the determination of the new Hamiltonian. It is emphasized that the original
and transformed Hamiltonians are different because the mapping from the old to
the new canonical variables depends explicitly on time. The violation of
cluster decomposition is discussed and the general Wightman functions
satisfying the positive-definiteness condition are obtained.
","[{""version"":""v1"",""created"":""Fri, 1 Dec 1995 16:10:06 GMT""}]","2015-06-26"
"hep-th/9512003","Roger Brooks","Roger Brooks","The Physics Inside Topological Quantum Field Theories","LaTeX, 7 pages","Class.Quant.Grav.14:L87-L91,1997","10.1088/0264-9381/14/5/003","SU-ITP-95-28, MIT-CTP-2491","hep-th",,"  We show that the equations of motion defined over a specific field space are
realizable as operator conditions in the physical sector of a generalized Floer
theory defined over that field space. The ghosts associated with such a
construction are found not to be dynamical. This construction is applied to
gravity on a four dimensional manifold, $M$; whereupon, we obtain Einstein's
equations via surgery, along $M$, in a five-dimensional topological quantum
field theory.
","[{""version"":""v1"",""created"":""Fri, 1 Dec 1995 18:29:21 GMT""}]","2010-04-06"
