"hep-th/9512004","Emilian Dudas","E. Dudas","Holomorphy and dynamical scales in supersymmetric gauge theories","14 pages, LaTeX","Phys.Lett. B375 (1996) 189-195","10.1016/0370-2693(96)00247-X","SPhT T95/123","hep-th",,"  New recent results in supersymmetric gauge theories based on holomorphy and
symmetry considerations are extended to the case where the gauge coupling
constant is given by the real part of a chiral superfield. We assume here that
its dynamics can be described by an effective quantum field theory. Then its
vacuum expectation value is a function of the other coupling constants, viewed
as chiral background superfields. This functional dependence can be determined
exactly and satisfies highly non-trivial consistency checks.
","[{""version"":""v1"",""created"":""Fri, 1 Dec 1995 19:52:52 GMT""}]","2009-10-28"
"nucl-th/9512002",,"R.C. Hwa","Charm Correlation as a Diagnostic Probe of Quark Matter","12 pages, no figures","Phys.Rev.Lett. 77 (1996) 227-230","10.1103/PhysRevLett.77.227","OITS-592","nucl-th hep-ph",,"  The use of correlation between two open-charm mesons is suggested to give
information about the nature of the medium created in heavy-ion collisions.
Insensitivity to the charm production rate is achieved by measuring normalized
cumulant. The acollinearity of the D momenta in the transverse plane is a
measure of the medium effect. Its dependence on nuclear size or E_T provides a
signature for the formation of quark matter.
","[{""version"":""v1"",""created"":""Fri, 1 Dec 1995 16:42:07 GMT""}]","2009-10-28"
"nucl-th/9512003","Takashi Nakatsukasa","Takashi Nakatsukasa, Kenichi Matsuyanagi, Shoujirou Mizutori and
  Yoshifumi R. Shimizu","Microscopic Structure of High-Spin Vibrational Excitations in
  Superdeformed 190,192,194Hg","22 pages, REVTeX, 12 postscript figures are available on request","Phys.Rev.C53:2213-2226,1996","10.1103/PhysRevC.53.2213","TASCC-P-95-37","nucl-th",,"  Microscopic RPA calculations based on the cranked shell model are performed
to investigate the quadrupole and octupole correlations for excited
superdeformed bands in 190Hg, 192Hg, and 194Hg. The K=2 octupole vibrations are
predicted to be the lowest excitation modes at zero rotational frequency. At
finite frequency, however, the interplay between rotation and vibrations
produces different effects depending on neutron number: The lowest octupole
phonon is rotationally aligned in 190Hg, is crossed by the aligned
two-quasiparticle bands in 192Hg, and retains the K=2 octupole vibrational
character up to the highest frequency in 194Hg. The gamma vibrations are
predicted to be higher in energy and less collective than the octupole
vibrations. From a comparison with the experimental dynamic moments of inertia,
a new interpretation of the observed excited bands invoking the K=2 octupole
vibrations is proposed, which suggests those octupole vibrations may be
prevalent in SD Hg nuclei.
","[{""version"":""v1"",""created"":""Fri, 1 Dec 1995 22:07:24 GMT""}]","2008-11-26"
"q-alg/9512002","Thang T. A. Le","Thang T. Q. Le, Jun Murakami and Tomotada Ohtsuki","On a Universal Invariant of 3-Manifolds","33 pages, Ams-LaTex, a ready postcript file of the paper is available
  at http://www.math.buffalo.edu/~letu/",,,,"q-alg math.QA",,"  We construct an invariant of 3-manifolds using a modification of the
Kontsevich integral and Kirby's calculus. This invariant, as expected in
perturbative Chern-Simon theory, takes values in the algebra of oriented
3-valent graphs. This algebra is a Hopf algebra, graded by half the number of
vertices in 3-valent graphs. The degree 1 term of the invariant coincides with
Casson-Walker-Lescop invariant. The degree $n$ term is constructed out of the
universal Vassiliev invariant of links of degree less than or equal to $(l+1)n$
where $l$ is the number of link components.
","[{""version"":""v1"",""created"":""Fri, 1 Dec 1995 18:15:28 GMT""}]","2008-02-03"
