"adap-org/9501005","Tsuyoshi Mizuguchi","Tsuyoshi Mizuguchi and Masaki Sano (Research Institute of Electrical
  Communication Tohoku University, Sendai 980-77, Japan)","Proportion Regulation in Globally Coupled Nonlinear Systems","11 pages (revtex format) and 5 figures (PostScript).",,"10.1103/PhysRevLett.75.966",,"adap-org nlin.AO",,"  As a model of proportion regulation in differentiation process of biological
system, globally coupled activator-inhibitor systems are studied. Formation and
destabilization of one and two cluster state are predicted analytically.
Numerical simulations show that the proportion of units of clusters is chosen
within a finite range and it is selected depend on the initial condition.
","[{""version"":""v1"",""created"":""Wed, 1 Feb 1995 10:59:00 GMT""}]","2015-06-30"
"alg-geom/9502001",,"David B. Jaffe and Daniel Ruberman","A sextic surface cannot have 66 nodes","19 pages; the body of the paper is distributed as a compressed
  postscript file at ftp://mathlab03.unl.edu/pub/faculty/jaffe/sextic.Z The
  paper will print nicely on a 600 dpi printer; on lower resolution printers,
  one picture will be blurred. Hard copy is available from the authors:
  jaffe@cpthree.unl.edu, ruberman@maths.ox.ac.uk",,,,"alg-geom math.AG",,"  Let S be a surface in complex projective 3-space, having only nodes as
singularities. Suppose that S has degree 6. We show that the maximum number of
nodes which S can have is 65.
  An abbreviated history of this is as follows. Basset showed that S can have
at most 66 nodes. Catanese and Ceresa and Stagnaro constructed sextic surfaces
having 64 nodes. Barth has recently exhibited a 65 node sextic surface. We
complete the story by showing that S cannot have 66 nodes.
  Let f: S~ --> S be a minimal resolution of singularities. A set N of nodes on
S is even if there exists a divisor Q on S~ such that 2Q ~ f^{-1}(N). We show
that a nonempty even set of nodes on S must have size 24, 32, 40, 56, or 64.
This result is key to showing the nonexistence of the 66 node sextic.
  We do not know if a sextic surface can have an even node set of size 56 or
64. The existence or nonexistence of large even node sets is related to the
following vanishing problem. Let S be a normal surface of degree s in CP^3. Let
D be a Weil divisor on S such that D is Q-rationally equivalent to rH, for some
r \in \Q. Under what circumstances do we have H^1(O_S(D)) = 0? For instance,
this holds when r < 0. For s=4 and r=0, H^1 can be nonzero. For s=6 and r=0, if
a 56 or 64 node even set exists, then H^1 can be nonzero. The vanishing of H^1
is also related to linear normality, quadric normality, etc. of set-theoretic
complete intersections in P^3.
","[{""version"":""v1"",""created"":""Wed, 1 Feb 1995 14:41:10 GMT""}]","2008-02-03"
"astro-ph/9501114","Konrad Kuijken","Konrad Kuijken & Michael R. Merrifield","ESTABLISHING THE CONNECTION BETWEEN PEANUT-SHAPED BULGES AND GALACTIC
  BARS","Plain TeX (8 p) + 3 postscript figures. uuencoded, gzipped tar file.
  (420MB). Accepted for ApJLett.","Astrophys.J. 443 (1995) L13","10.1086/187824",,"astro-ph",,"  It has been suggested that the peanut-shaped bulges seen in some edge-on disk
galaxies are due to the presence of a central bar. Although bars cannot be
detected photometrically in edge-on galaxies, we show that barred potentials
produce a strong kinematic signature in the form of double-peaked line-of-sight
velocity distributions with a characteristic ``figure-of-eight'' variation with
radius. We have obtained spectroscopic observations of two edge-on galaxies
with peanut-shaped bulges (NGC~5746 and NGC~5965), and they reveal exactly such
line-of-sight velocity distributions in both their gaseous (emission line) and
their stellar (absorption line) components. These observations provide strong
observational evidence that peanut-shaped bulges are a by-product of bar
formation.
","[{""version"":""v1"",""created"":""Tue, 31 Jan 1995 17:27:43 GMT""}]","2016-08-30"
"astro-ph/9501115","Enrique Gaztanaga","Enrique Gazta\~naga, Rupert Croft and Gavin Dalton","Variance, Skewness & Kurtosis: results from the APM Cluster Redshift
  Survey and model predictions","12 pages PostScript, 12 figures","Mon.Not.Roy.Astron.Soc. 276 (1995) 336","10.1093/mnras/276.1.336",,"astro-ph",,"  We estimate the variance $\xibar_2$, the skewness $\xibar_3$ and the kurtosis
$\xibar_4$ in the distribution of density fluctuations in a complete sample
from the APM Cluster Redshift Survey with 339 clusters and a mean depth $ \sim
250\Mpc$. We are able to measure the statistics of fluctuations in spheres of
radius $R \simeq 5-80 \Mpc$, with reasonable errorbars. The statistics in the
cluster distribution follow the hierarchical pattern
$\xibar_J=S_J~\xibar_2^{J-1}$ with $S_J$ roughly constant, $S_3 \simeq 2$ and
$S_4 \sim 8$. We analyse the distribution of clusters taken from N-body
simulations of different dark matter models. The results are compared with an
alternative method of simulating clusters which uses the truncated Zel'dovich
approximation. We argue that this alternative method is not reliable enough for
making quantitative predictions of $\xibar$. The N-body simulation results
follow similar hierarchical relations to the observations, with $S_J$ almost
unaffected by redshift distortions from peculiar motions. The standard
$\Omega=1$ Cold Dark Matter (CDM) model is inconsistent with either the second,
third or fourth order statistics at all scales. However both a hybrid Mixed
Dark Matter model and a low density CDM variant agree with the $\xibar_J$
observations.
","[{""version"":""v1"",""created"":""Tue, 31 Jan 1995 18:39:53 GMT""}]","2015-06-24"
"astro-ph/9501116",,"Yun Wang (Fermilab)","Simple Analytical Methods for Computing the Gravity-Wave Contribution to
  the Cosmic Background Radiation Anisotropy","The Boltzmann curve is updated, which leads to small corrections.
  LaTeX, 15 pages, 6 figures available via anonymous ftp at
  ftp://fnas08.fnal.gov/pub/Personal/ywang/","Phys.Rev. D53 (1996) 639-644","10.1103/PhysRevD.53.639","FERMILAB-Pub-95/013-A","astro-ph hep-ph",,"  We present two simple analytical methods for computing the gravity wave
contribution to the cosmic background radiation (CBR) anisotropy in
inflationary models; one method uses a time-dependent transfer function, the
other method uses an approximate gravity-wave mode function which is a simple
combination of the lowest order spherical Bessel functions. We compare the CBR
anisotropy tensor multipole spectrum computed using our methods with the
previous result of the highly accurate numerical method, the ``Boltzmann''
method. Our time-dependent transfer function is more accurate than the
time-independent transfer function found by Turner, White, and Lidsey; however,
we find that the transfer function method is only good for $l \la 120$. Using
our approximate gravity-wave mode function, we obtain much better accuracy; the
tensor multipole spectrum we find differs by less than 2\% for $l \la 50$, less
than 10\% for $l \la 120$, and less than 20\% for $l \leq 300$ from the
``Boltzmann'' result. Our approximate graviton mode function should be quite
useful in studying tensor perturbations from inflationary models.
","[{""version"":""v1"",""created"":""Tue, 31 Jan 1995 23:09:26 GMT""},{""version"":""v2"",""created"":""Mon, 7 Aug 1995 20:01:53 GMT""}]","2009-10-28"
"astro-ph/9502001","Tsvi Piran","Ehud Cohen and Tsvi Piran","The Distribution Of Cosmological $\gamma$-ray Bursts","9 pages, uuencoded file, 4 figures included, can also be obtained
  from ftp://shemesh.fiz.huji.ac.il or at <http://shemesh.fiz.huji.ac.il/>
  (Accepted for publication in the Astrophysical Journal Letters)","Astrophys.J. 444 (1995) L25","10.1086/187851",,"astro-ph",,"  We compare the burst distribution of the new (2B) BATSE catalogue to a
cosmological distribution. The observed distribution agrees well with a
cosmological one, however, it is insensitive to cosmological parameters such as
$\O$ and $\Lambda$. The bursts are not necessarily standard candles and their
luminosity can vary by up to a factor of ten. The maximal red shift, $\zm$, of
bursts longer than 2 sec is $2.1^{+1.}_{-.7}$ (assuming no evolution). The
present data is insufficient to determine maximal red shift, $\zm$, of bursts
shorter than 2 sec.
","[{""version"":""v1"",""created"":""Wed, 1 Feb 1995 14:14:07 GMT""}]","2009-10-28"
"chao-dyn/9501020","Dr. Bao-Wen Li. Camtp.","Baowen Li and Marko Robnik (Center for Applied Mathematics and
  Theoretical Physics University of Maribor, Krekova 2, SLO-62000 Maribor,
  Slovenia)","Geometry of high-lying eigenfunctions in a plane billiard system having
  mixed type classical dynamics","23 pages, file in plain LaTeX, 9 figures upon request submitted to J.
  Phys. A. Math. Gen. in October 1994","J. Phys. A: Math. Gen. 28 (1995) 2799","10.1088/0305-4470/28/10/012","CAMTP/94-8","chao-dyn nlin.CD",,"  In this work we study the geometrical properties of the high-lying
eigenfunctions (200,000 and above) which are deep in the semiclassical regime.
The system we are analyzing is the billiard system inside the region defined by
the quadratic (complex) conformal map $w = z + \lambda z^{2}$ of the unit disk
$|z| \le 1$ as introduced by Robnik (1983), with the shape parameter value
$\lambda = 0.15$, so that the billiard is still convex and has KAM-type
classical dynamics, where regular and irregular regions of classical motion
coexist in the classical phase space. By inspecting 100 and by showing 36
consecutive numerically calculated eigenfunctions we reach the following
conclusions: (1) Percival's (1973) conjectured classification in regular and
irregular states works well: the mixed type states ""living"" on regular {\em
and} irregular regions disappear in the semiclassical limit. (2) The irregular
(chaotic) states can be strongly localized due to the slow classical diffusion,
but become fully extended in the semiclassical limit when the break time
becomes sufficiently large with respect to the classical diffusion time. (3)
Almost all states can be clearly associated with some relevant classical object
like invariant torus, cantorus or periodic orbits. This paper is largely
qualitative but deep in the semiclassical limit and as such it is a prelude to
our next paper which is quantitative and numerically massive but at about ten
times lower energies.
","[{""version"":""v1"",""created"":""Wed, 1 Feb 1995 10:23:49 GMT""}]","2009-10-28"
"chao-dyn/9501021","Dr. Bao-Wen Li. Camtp.","Baowen Li and Marko (Robnik Center for Applied Mathematics and
  Theoretical Physics University of Maribor, Krekova 2, SLO-62000 Maribor,
  Slovenia)","Separating the regular and irregular energy levels and their statistics
  in Hamiltonian system with mixed classical dynamics","20 pages, file in plain LaTeX, 7 figures upon request submitted to J.
  Phys. A. Math. Gen. in December 1994","J. Phys. A.: Mathe. Gen. 28 (1995) 4843","10.1088/0305-4470/28/17/017","CAMTP/94-10","chao-dyn nlin.CD",,"  We look at the high-lying eigenstates (from the 10,001st to the 13,000th) in
the Robnik billiard (defined as a quadratic conformal map of the unit disk)
with the shape parameter $\lambda=0.15$. All the 3,000 eigenstates have been
numerically calculated and examined in the configuration space and in the phase
space which - in comparison with the classical phase space - enabled a clear
cut classification of energy levels into regular and irregular. This is the
first successful separation of energy levels based on purely dynamical rather
than special geometrical symmetry properties. We calculate the fractional
measure of regular levels as $\rho_1=0.365\pm 0.01$ which is in remarkable
agreement with the classical estimate $\rho_1=0.360\pm 0.001$. This finding
confirms the Percival's (1973) classification scheme, the assumption in
Berry-Robnik (1984) theory and the rigorous result by Lazutkin (1981,1991). The
regular levels obey the Poissonian statistics quite well whereas the irregular
sequence exhibits the fractional power law level repulsion and globally
Brody-like statistics with $\beta = 0.286\pm0.001$. This is due to the strong
localization of irregular eigenstates in the classically chaotic regions.
Therefore in the entire spectrum we see that the Berry-Robnik regime is not yet
fully established so that the level spacing distribution is correctly captured
by the Berry-Robnik-Brody distribution (Prosen and Robnik 1994).
","[{""version"":""v1"",""created"":""Wed, 1 Feb 1995 10:25:34 GMT""}]","2009-10-28"
"chao-dyn/9501022","Dr. Bao-Wen Li. Camtp.","Baowen Li and Marko Robnik (Center for Applied Mathematics and
  Theoretical Physics University of Maribor, Krekova 2, SLO-62000 Maribor,
  Slovenia)","SUPPLEMENT TO THE PAPER: Separating the regular and irregular energy
  levels and their statistics in Hamiltonian system with mixed classical
  dynamics","4 pages, file in plain LaTeX, 17 figures upon request",,,"CAMTP/94-11","chao-dyn nlin.CD",,"  As a technical supplement to the above mentioned paper we present 192
consecutive eigenstates for the Robnik billiard with the shape parameter
$\lambda=0.15$ from 10,001st to 10,192nd, by showing the plots in the
configuration space and in the phase space. The latter is smoothed projection
of the Wigner function onto the surface of section. By comparison with the
classical SOS plots we thus examine all eigenstates and classify them in
regular and irregular: There are 70 regular states and 122 irregular states,
thus giving the estimate of the relative measure of the regular component
$\rho_1=0.365$, which is in excellent agreement with the classical value
$\rho_1=0.360$ calculated and reported by Prosen and Robnik (1993).
","[{""version"":""v1"",""created"":""Wed, 1 Feb 1995 10:29:44 GMT""}]","2008-02-03"
"chao-dyn/9501023","Per Dahlqvist","Per Dahlqvist (Royal Institute of Technology, Stockholm)","On the duality between periodic orbit statistics and quantum level
  statistics","8 pages LaTeX",,"10.1088/0305-4470/28/17/009",,"chao-dyn nlin.CD",,"  We discuss consequences of a recent observation that the sequence of periodic
orbits in a chaotic billiard behaves like a poissonian stochastic process on
small scales. This enables the semiclassical form factor $K_{sc}(\tau)$ to
agree with predictions of random matrix theories for other than infinitesimal
$\tau$ in the semiclassical limit.
","[{""version"":""v1"",""created"":""Wed, 1 Feb 1995 15:28:26 GMT""}]","2009-10-28"
"chao-dyn/9501024","Niall Whelan","B.Lauritzen and N.D. Whelan (Niels Bohr Institute)","Weyl Expansion for Symmetric Potentials","Four of the five figures are appended as a postscript file. The fifth
  figure is available by snail mail.","Ann. Phys. 244 (1995), p.112.","10.1006/aphy.1995.1109",,"chao-dyn nlin.CD",,"  We present a semiclassical expansion of the smooth part of the density of
states in potentials with some form of symmetry. The density of states of each
irreducible representation is separately evaluated using the Wigner transforms
of the projection operators. For discrete symmetries the expansion yields a
formally exact but asymptotic series in $\hbar$, while for the rotational
$SO(n)$ symmetries the expansion requires averaging over angular momentum as
well as energy. A numerical example is given in two dimensions, in which we
calculate the leading terms of the Weyl expansion as well as the leading
periodic orbit contributions to the symmetry reduced level density.
","[{""version"":""v1"",""created"":""Wed, 1 Feb 1995 15:32:44 GMT""}]","2016-08-31"
"cond-mat/9501137","Pablo","P Biscari & G Parisi","Replica Symmetry Breaking in the Random Replicant Model","12 pages, TeX, 5 postscript figures are avalaible upon request,
  submitted to Journal of Physics A: Mathematical and General",,"10.1088/0305-4470/28/17/006",,"cond-mat",,"  We study the statistical mechanics of a model describing the coevolution of
species interacting in a random way. We find that at high competition replica
symmetry is broken. We solve the model in the approximation of one step replica
symmetry breaking and we compare our findings with accurate numerical
simulations.
","[{""version"":""v1"",""created"":""Tue, 31 Jan 1995 17:17:16 GMT""}]","2009-10-28"
"cond-mat/9501138","George Kirczenow","C. Barnes, B. L Johnson, G. Kirczenow","Introducing Directionality to Anderson Localization: The Transport
  Properties of Quantum Railroads","revtex 3.0. See Can.J.Phys.72,559(1994) or contact
  chwb101@cus.cam.ac.uk for figures.",,,,"cond-mat",,"  We present a study of the transport properties of a general class of quantum
mechanical waveguides: Quantum Railroads (QRR). These waveguides are
characterised by having a different number of adiabatic modes which carry
current in one direction along the waveguide to the opposite direction; for
example N forward modes and M reverse modes. Just as Anderson localization is a
characteristic of the disordered N=M case and the quantum Hall effect a
characteristic of the M=0 case we find that a mixed effect, DIRECTED
localization, is a characteristic of QRR's. We find that in any QRR there are
always |N-M| perfectly transmitted effective adiabatic modes with the remainder
being subject to multiple scattering and interference effects characteristic of
the N=M case.
","[{""version"":""v1"",""created"":""Tue, 31 Jan 1995 19:58:19 GMT""}]","2016-08-31"
"cond-mat/9501139","Victor M. Yakovenko","Anatoley T. Zheleznyak and Victor M. Yakovenko","``Hot Spots'' in Quasi-One-Dimensional Organic Conductors","Self-unpacking single PostScript file (4 pages) which includes 7
  figures. Request hardcopy if you encounter problems. (No changes to the body
  of the paper in the revised version: just cond-mat number inserted at top.)","Synthetic Metals 70 (1995) 1005",,"U of Maryland Physics Preprint PP 95-012, Condensed Matter Preprint
  CM 911","cond-mat",,"  Distribution of the electron scattering rate on the Fermi surface of a
quasi-one-dimensional conductor is calculated for the electron-electron umklapp
interaction. We find that in certain regions on the Fermi surface the
scattering rate is anomalously high. The reason for the existence of these
``hot spots'' is analogous to the appearance of the van Hove singularities in
the density of states. We employ a generalized $\tau$-approximation (where the
scattering integral in the Boltzmann equation is replaced by the scattering
time which depends on the position at the Fermi surface) to study the
dependence of the electric resistance on the amplitude and the orientation of a
magnetic field. We find that the ``hot spots'' do not produce a considerable
magnetoresistance or commensurability effects at the so-called ``magic
angles''.
","[{""version"":""v1"",""created"":""Wed, 1 Feb 1995 02:12:53 GMT""},{""version"":""v2"",""created"":""Wed, 1 Feb 1995 18:31:13 GMT""}]","2008-02-03"
"gr-qc/9502001",,"Sean A. Hayward","COMMENT ON ``BOUNDARY CONDITIONS FOR THE SCALAR FIELD IN THE PRESENCE OF
  SIGNATURE CHANGE''","4 pages. TeX.",,,,"gr-qc",,"  Fundamental errors exist in the above-mentioned article, which attempts to
justify previous erroneous claims concerning signature change. In the simplest
example, the authors' proposed ``solutions'' do not satisfy the relevant
equation, as may be checked by substitution. These ``solutions'' are also
different to the authors' originally proposed ``solutions'', which also do not
satisfy the equation. The variational equations obtained from the authors'
``actions'' are singular at the change of signature. The authors'
``distributional field equations'' are manifestly ill defined.
","[{""version"":""v1"",""created"":""Wed, 1 Feb 1995 08:24:13 GMT""}]","2016-08-31"
"gr-qc/9502002","Jun'ichi Yokoyama","Alexei A. Starobinsky and Jun'ichi Yokoyama (YITP Kyoto U.)","Density fluctuations in Brans-Dicke inflation","13 pages RevTeX file","Proc. Fourth Workshop on General Relativity and Gravitation eds.
  K. Nakao et al (Kyoto University, 1995) 381.",,"YITP/U-95-2","gr-qc astro-ph",,"  Spectrum of density perturbations in the Universe generated from
quantum-gravitational fluctuations in slow-roll-over inflationary scenarios
with the Brans-Dicke gravity is calculated. It is shown that after inflation
the isocurvature mode of perturbations may be neglected as compared to the
adiabatic mode, and that an amplitude of the latter mode is not significantly
different from that in the Einstein gravity. However, the account of the
isocurvature mode is necessary to obtain the quantitatively correct spectrum of
adiabatic perturbations.
","[{""version"":""v1"",""created"":""Wed, 1 Feb 1995 08:47:35 GMT""}]","2016-08-31"
"gr-qc/9502003","Maria Guimaraes","M. E. X. Guimar\~aes (Lab. Gravitation et Cosmologie Relativistes,
  Paris, France)","Vacuum Polarization at Finite Temperature around a Magnetic Flux Cosmic
  String","22 pages, latex, no figures","Class.Quant.Grav.12:1705-1714,1995","10.1088/0264-9381/12/7/012","GCR - 95 - 02 - 01","gr-qc hep-th",,"  We consider a general situation where a charged massive scalar field
$\phi(x)$ at finite temperature interacts with a magnetic flux cosmic string.
We determine a general expression for the Euclidean thermal Green's function of
the massive scalar field and a handy expression for a massless scalar field.
With this result, we evaluate the thermal average $<\phi^{2}(x)>$ and the
thermal average of the energy-momentum tensor of a nonconformal massless scalar
field.
","[{""version"":""v1"",""created"":""Wed, 1 Feb 1995 10:34:36 GMT""}]","2010-04-06"
"gr-qc/9502004","Robert Graham","Andras Csordas, Robert Graham","Supersymmetric minisuperspace with non-vanishing fermion number","4 pages","Phys.Rev.Lett. 74 (1995) 4129-4132","10.1103/PhysRevLett.74.4129",,"gr-qc",,"  The Lagrangean of $N=1$ supergravity is dimensionally reduced to one
(time-like) dimension assuming spatial homogeneity of any Bianchi type within
class A of the classification of Ellis and McCallum. The algebra of the
supersymmetry generators, the Lorentz generators, the diffeomorphism generators
and the Hamiltonian generator is determined and found to close. In contrast to
earlier work, infinitely many physical states with non-vanishing even fermion
number are found to exist in these models, indicating that minisuperspace
models in supergravity may be just as useful as in pure gravity.
","[{""version"":""v1"",""created"":""Wed, 1 Feb 1995 10:41:12 GMT""}]","2016-08-31"
"gr-qc/9502005","Frank Gronwald","Frank Gronwald","ON NON-RIEMANNIAN PARALLEL TRANSPORT IN REGGE CALCULUS","12 pages, Plain-TEX, two figures (available from the author)","Class.Quant.Grav.12:1181-1190,1995","10.1088/0264-9381/12/5/009","CPP-94-38","gr-qc",,"  We discuss the possibility of incorporating non-Riemannian parallel transport
into Regge calculus. It is shown that every Regge lattice is locally equivalent
to a space of constant curvature. Therefore well known-concepts of differential
geometry imply the definition of an arbitrary linear affine connection on a
Regge lattice.
","[{""version"":""v1"",""created"":""Wed, 1 Feb 1995 11:21:31 GMT""}]","2010-04-06"
"gr-qc/9502006","Renate Loll","R. Loll (INFN, Florence)","NON-PERTURBATIVE SOLUTIONS FOR LATTICE QUANTUM GRAVITY","26 pages, 2 figures (postscript, compressed and uuencoded), TeX, Jan
  95","Nucl.Phys.B444:619-640,1995","10.1016/0550-3213(95)00184-T","DFF 220/01/95","gr-qc hep-th",,"  We propose a new, discretized model for the study of 3+1-dimensional
canonical quantum gravity, based on the classical $SL(2,\C)$-connection
formulation. The discretization takes place on a topological $N^3$- lattice
with periodic boundary conditions. All operators and wave functions are
constructed from one-dimensional link variables, which are regarded as the
fundamental building blocks of the theory. The kinematical Hilbert space is
spanned by polynomials of certain Wilson loops on the lattice and is manifestly
gauge- and diffeomorphism- invariant. The discretized quantum Hamiltonian $\hat
H$ maps this space into itself. We find a large sector of solutions to the
discretized Wheeler-DeWitt equation $\hat H\psi=0$, which are labelled by
single and multiple Polyakov loops. These states have a finite norm with
respect to a natural scalar product on the space of holomorphic
$SL(2,\C)$-Wilson loops. We also investigate the existence of further solutions
for the case of the $1^3$-lattice. - Our results provide for the first time a
rigorous, regularized framework for studying non-perturbative quantum gravity.
","[{""version"":""v1"",""created"":""Wed, 1 Feb 1995 12:56:21 GMT""}]","2010-11-01"
"hep-ex/9502001","Xing Zhi-Zhong","Zhi-zhong Xing","Time Dependence of Coherent $P^{0}\bar{P}^{0}$ Decays and CP Violation
  at Asymmetric $B$ Factories","13 Latex pages including 3 figures","Phys.Rev.D53:204-212,1996","10.1103/PhysRevD.53.204","LMU-22/94","hep-ex",,"  A generic formalism is presented for the time-dependent or time-integrated
decays of any coherent $P^{0}\bar{P}^{0}$ system ($P^{0} = K^{0}, D^{0},
B^{0}_{d}$, or $B^{0}_{s}$). To meet various possible measurements at
asymmetric $B$ factories, we reanalyze some typical signals of CP violation in
the coherent $B^{0}_{d}\bar{B}^ {0}_{d}$ transitions. The advantage of proper
time cuts is illustrated for measuring mixing parameters and CP violation. We
show that the direct and indirect CP asymmetries are distinguishable in neutral
B decays to CP eigenstates. The possibility to detect the CP- forbidden
processes at the $\Upsilon (4S)$ resonance is explored in some detail.
","[{""version"":""v1"",""created"":""Wed, 1 Feb 1995 08:04:30 GMT""}]","2010-11-01"
