"hep-th/9502004",,"R. N. Lee and A. I. Milstein","Quasiclassical Green function and Delbruck scattering in a screened
  Coulomb field","11 pages, LATEX, no figures",,"10.1016/0375-9601(95)00055-8","BUDKERINP 94-97","hep-th",,"  A simple integral representation is derived for the quasiclassical Green
function of the Dirac equation in an arbitrary spherically-symmetric decreasing
external field. The consideration is based on the use of the quasiclassical
radial wave functions with the main contribution of large angular momenta taken
into account. The Green function obtained is applied to the calculation of the
Delbruck scattering amplitudes in a screened Coulomb field.
","[{""version"":""v1"",""created"":""Wed, 1 Feb 1995 07:27:53 GMT""}]","2009-10-28"
"hep-th/9502005","Henning Wissowski","Wulf Boettger, Henning Wissowski, Hans A. Kastrup","Constructing solutions of Hamilton-Jacobi equations for 2 D fields with
  one component by means of Baecklund transformations","LaTeX, 44 pages, 3 figures, submitted to: Journal of Mathematical
  Physics; replaced due to mailer problems","J.Math.Phys. 44 (2003) 263-301","10.1063/1.1526451","PITHA 63/94","hep-th cond-mat funct-an gr-qc math.FA",,"  The Hamilton-Jacobi formalism generalized to 2-dimensional field theories
according to Lepage's canonical framework is applied to several relativistic
real scalar fields, e.g. massless and massive Klein-Gordon, Sinh and
Sine-Gordon, Liouville and $\phi^4$ theories. The relations between the
Euler-Lagrange and the Hamilton-Jacobi equations are discussed in DeDonder and
Weyl's and the corresponding wave fronts are calculated in Carath\'eodory's
formulation. Unlike mechanics we have to impose certain integrability
conditions on the velocity fields to guarantee the transversality relations and
especially the dynamical equivalence between Hamilton-Jacobi wave fronts and
families of extremals embedded therein. B\""acklund Transformations play a
crucial role in solving the resulting system of coupled nonlinear PDEs.
","[{""version"":""v1"",""created"":""Wed, 1 Feb 1995 07:33:51 GMT""},{""version"":""v2"",""created"":""Thu, 2 Feb 1995 11:38:03 GMT""},{""version"":""v3"",""created"":""Fri, 3 Feb 1995 10:00:43 GMT""}]","2016-09-06"
"hep-th/9502006",,"Guido Cognola, Luciano Vanzo and Sergio Zerbini","ONE-LOOP QUANTUM CORRECTIONS TO THE ENTROPY FOR A 4-DIMENSIONAL ETERNAL
  BLACK HOLE","9 pages Latex, -- Latex problems have been eliminated","Class.Quant.Grav.12:1927-1936,1995","10.1088/0264-9381/12/8/010","UTF 342","hep-th",,"  The first quantum corrections to the free energy for an eternal 4-dimensional
black hole is investigated at one-loop level, in the large mass limit of the
black hole, making use of the conformal techniques related to the optical
metric. The quadratic and logarithmic divergences as well as a finite part
associated with the first quantum correction to the entropy are obtained at a
generic temperature. It is argued that, at the Hawking temperature, the horizon
divergences of the internal energy should cancel. Some comments on the
divergences of the entropy are also presented.
","[{""version"":""v1"",""created"":""Wed, 1 Feb 1995 10:08:22 GMT""},{""version"":""v2"",""created"":""Thu, 2 Feb 1995 10:27:47 GMT""}]","2010-04-06"
"math/9502236","Andreas Seeger","Anthony Carbery, Andreas Seeger","Homogeneous Fourier multipliers of Marcinkiewicz type","28 pages. The online version of the journal issue provided by the
  current publisher has faulty typesetting. A 1995 posting on arXiv shows only
  7 pages. We therefore post the original preprint version of the paper","Arkiv f\""or Matematik, 33 (1995), no. 1, 45-80",,,"math.FA math.CA","http://arxiv.org/licenses/nonexclusive-distrib/1.0/","  This 1995 paper contains a sharp version of the classical Marcinkiewicz
multiplier theorem for the class of homogeneous Fourier multipliers in two
dimensions; here a one-dimensional Marcinkiewicz condition is sufficient.
Examples are given to show that the straightforward extension of this statement
to higher dimensions does not hold. We provide appropriate versions in higher
dimensions which rely on a Fefferman-Stein weighted norm inequality for a
relevant C\'ordoba type square function. The proof of this inequality is given
by an early version of an induction on scales argument. For $p<1$ we prove a
multiplier theorem on product-type $H^p$-spaces.
","[{""version"":""v1"",""created"":""Wed, 1 Feb 1995 00:00:00 GMT""},{""version"":""v2"",""created"":""Sun, 26 Apr 2020 12:40:47 GMT""}]","2020-04-29"
"mtrl-th/9502001",,"Jorge Berger and Joseph E. Avron (Technion)","A Classification Scheme for Toroidal Molecules","Latex, 41 pages, 18 figs upon request. Accepted for publication in J.
  Chem. Soc. - Faraday Trans",,,,"mtrl-th cond-mat.mtrl-sci",,"  We construct a class of periodic tilings of the plane, which corresponds to
toroidal arrangements of trivalent atoms, with pentagonal, hexagonal and
heptagonal rings. Each tiling is characterized by a set of four integers and
determines a toroidal molecule. The tiling rules are motivated by geometric
considerations and the tiling patterns are rich enough to describe a wide class
of toroidal carbon molecules, with a broad range of shapes and numbers of
atoms. The molecular dimensions are simply related to the integers that
determine the tiling. The configurational energy and the delocalisation energy
of several molecules obtained in this way were computed for Tersoff and
H\""uckel models. The results indicate that many of these molecules are not
strained, and may be expected to be stable. We studied the influence of size on
the H\""{u}ckel spectrum: it bears both similarities and differences as compared
with the case of tubules.
","[{""version"":""v1"",""created"":""Wed, 1 Feb 1995 12:22:40 GMT""},{""version"":""v2"",""created"":""Wed, 12 Jul 1995 05:52:29 GMT""}]","2008-02-03"
"q-alg/9501032","Tanya Khovanova","Joseph Bernstein","Sacler lectures","plain TeX, 18 pages, no figures",,,"IAS 897-92","q-alg math.QA",,"  The series of three lectures given at Tel-Aviv University in 1992:
  1. Tensor categories.
  2. Quantum groups.
  3. Topological (quantum) field theories.
  Published as the preprint IAS 897-92 of Tel-Aviv University and The Mortimer
and Raymond Sacler Institute of Advanced Studies.
","[{""version"":""v1"",""created"":""Tue, 31 Jan 1995 22:42:06 GMT""}]","2008-02-03"
"q-alg/9502001",,"V.K. Dobrev, P. Truini and L.C. Biedenharn,","Representation Theory Approach to the Polynomial Solutions of q -
  Difference Equations : U_q(sl(3)) and Beyond,","uuencoded Z-compressed .tar file containing two ps files,","J.Math.Phys. 35 (1994) 6058-6075","10.1063/1.530728","J. Math. Phys. 35 (1994) 6058-6075, (also as preprint ASI-TPA/7/94,
  GEF-Th-1/94, DOE-ER40757-043 \& CPP-94-11 (March 1994)).","q-alg math.QA",,"  A new approach to the theory of polynomial solutions of q - difference
equations is proposed. The approach is based on the representation theory of
simple Lie algebras and their q - deformations and is presented here for
U_q(sl(n)). First a q - difference realization of U_q(sl(n)) in terms of
n(n-1)/2 commuting variables and depending on n-1 complex representation
parameters r_i, is constructed. From this realization lowest weight modules
(LWM) are obtained which are studied in detail for the case n=3 (the well known
n=2 case is also recovered). All reducible LWM are found and the polynomial
bases of their invariant irreducible subrepresentations are explicitly given.
This also gives a classification of the quasi-exactly solvable operators in the
present setting. The invariant subspaces are obtained as solutions of certain
invariant q - difference equations, i.e., these are kernels of invariant q -
difference operators, which are also explicitly given. Such operators were not
used until now in the theory of polynomial solutions. Finally the states in all
subrepresentations are depicted graphically via the so called Newton diagrams.
","[{""version"":""v1"",""created"":""Wed, 1 Feb 1995 07:16:38 GMT""}]","2016-09-08"
"q-alg/9502002","Ziemowit Popowicz","G.E.Arutuynov (Moscow, Russia), A.P.Isaev (Dubna, Russia), Z.Popowicz
  (Wroclaw, Poland)","Poincare'-Birkhoff-Witt property for bicovariant differential algebras
  on simple quantum groups","12 pages,latex","J.Phys.A28:4349-4359,1995","10.1088/0305-4470/28/15/015",,"q-alg math.QA",,"  We investigate the possibility to construct bicovariant differential calculi
on quantum groups SO_q(N) and Sp_q(N) as a quantization of an underlying
bicovariant bracket.We show that, opposite to GL(N) and SL(N)-cases, neither of
possible graded SO- and Sp- bicovariant brackets (associated with a
quasitriangular r-matrices) obey the Jacobi identity when the differential
forms are Lie algebra- valued. The absence of a classical Poisson structure
gives an indication that differential algebras describing bicovariant
differential calculi on quantum orthogonal and symplectic groups are not of
Poincar'e- Birkhoff- -Witt type.
","[{""version"":""v1"",""created"":""Wed, 1 Feb 1995 07:07:39 GMT""}]","2011-07-19"
"quant-ph/9502001",,"T. Calarco, R. Onofrio","Optimal Measurements of Magnetic Flux in Superconducting Circuits and
  Macroscopic Quantum Mechanics","11 pages (no figures), to be published in Physics Letters A","Phys. Lett. A 198 (1995) 279","10.1016/0375-9601(94)01020-U","DFPD 95/GP/01","quant-ph",,"  A model of repeated quantum measurements of magnetic flux in superconducting
circuits manifesting tunneling is discussed. The perturbation due to the
previous measurements of magnetic flux is always present unless quantum
nondemolition measurements are performed. By replacing the classical notion of
noninvasivity with this condition, temporal Bell-like inequalities allows one
to test the observability at the macroscopic level of the conflict between
realism and quantum theory.
","[{""version"":""v1"",""created"":""Wed, 1 Feb 1995 11:11:32 GMT""}]","2009-10-28"
