"hep-ph/9502230","Morgan","A.G. Morgan","Second Order Fermions in Gauge Theories","13 Pages LaTeX with 4 PostScript figures attached (figures may be
  included with epsfig.sty). Complete paper may be found at
  http://newton.physics.ucla.edu:80/~morgan/2nd.html","Phys.Lett. B351 (1995) 249-256","10.1016/0370-2693(95)00377-W","UCLA/95/TEP/3","hep-ph",,"  The second order formalism for fermions provides a description of fermions
that is very similar to that of scalars. We demonstrate that this second order
formalism is equivalent to the standard Dirac formalism. We do so in terms of
the conventional fermionic Feynman rules. The second order formalism has
previously proven useful for the computation of fermion loops, here we describe
how the corresponding rules can be applied to the calculation of amplitudes
involving external fermions, including tree-level processes and processes with
more than one fermion line. We comment on the supersymmetric identities
relating fermions and scalars and the associated simplifications to
perturbative calculations that are then more transparent.
","[{""version"":""v1"",""created"":""Mon, 6 Feb 1995 04:35:36 GMT""}]","2016-09-01"
"hep-ph/9502231","Jungil Lee","C. S. Kim (Yonsei Univ.), Jungil Lee, H. S. Song (Seoul National
  Univ., Seoul, Korea)","INVESTIGATION OF $WW\gamma$ COUPLINGS","17 pages, need epsfig.sty file",,,"SNUTP 95-010","hep-ph",,"  We investigated how measurements of weak boson production at high energy $ep$
and $e\gamma$ collisions can provide important information on anomalous
$WW\gamma$ couplings. We also considerd the sinlge muon production through the
virtual $W$-decay at the Pohang Light Source (PLS) facility, and found this
process is not adequate to be detected at the PLS until a large luminosity
($\sim 10^{33}$/sec/cm$^2$) Free Electron Laser is installed.
","[{""version"":""v1"",""created"":""Mon, 6 Feb 1995 07:01:18 GMT""},{""version"":""v2"",""created"":""Wed, 8 Feb 1995 03:22:11 GMT""}]","2016-09-01"
"hep-ph/9502232","R. Ramachandran","R. Ramachandran","Spin Puzzle in Nucleon","12 pages, latex file with one figure (Fig file to be sent separately)",,,"imsc/94-95/54, IC/94/261","hep-ph",,"  The object of this brief review is to reconcile different points of view on
how the spin of proton is made up from its constituents. On the basis of naive
quark model with flavour symmetry such as isospin or SU(3) one finds a static
description. On the contrary the local SU(3) colour symmetry gives a dynamical
view. Both these views are contrasted and the role of U(1) axial anomaly and
the ambiguity for the measurable spin content is discussed.
","[{""version"":""v1"",""created"":""Mon, 6 Feb 1995 07:20:34 GMT""},{""version"":""v2"",""created"":""Tue, 7 Feb 1995 04:49:33 GMT""}]","2016-09-01"
"hep-ph/9502233","Vladimir A. Saleev","V.A.Saleev","CHARM CONTENT OF A PHOTON AND $J/\psi$ PHOTOPRODUCTION AT HIGH ENERGIES","LaTeX, 8 pages, 5 figs not included (available via mail on request)",,,"SSU-HEP-95/01","hep-ph",,"  A study of the $J/\psi$-meson production at large transverse momentum in high
energy $\gamma p$ collisions via the charm quark excitation in a photon is
presented. Based on perturbative QCD and the nonrelativistic quark model, our
calculation demonstrates that the charm content of a photon may be very
important for the $J/\psi$ photoproduction at the large transverse momentum. It
is shown that at HERA energies $J/\psi$ production via the subprocess $cg\to
J/\si c$ dominates over the resolved photon contribution via the subprocess
$gg\to J/\psi g$ at $p_{\bot}>3$ GeV/c and over the direct photon-gluon fusion
contribution at $p_{bot}>10$ GeV/c.
","[{""version"":""v1"",""created"":""Mon, 6 Feb 1995 08:01:02 GMT""},{""version"":""v2"",""created"":""Mon, 13 Mar 1995 09:57:59 GMT""}]","2016-09-01"
"hep-ph/9502234",,"K. Sailer, A. Sch\""afer, and W. Greiner","Effect of the Haar measure on the finite temperature effective potential
  of $SU(2)$ Yang-Mills theory","3 pages, LATEX, 1 figure, figure available upon request","Phys.Lett. B350 (1995) 234-237","10.1016/0370-2693(95)00346-M","KLTE-DTP/1995/1","hep-ph",,"  Including the Haar measure we show that the effective potential of the
regularized SU(2) Yang-Mills theory has a minimum at vanishing Wilson-line
$W=0$ for strong coupling, whereas it develops two degenerate minima close to
$W=\pm 1$ for weak coupling. This suggests that the non-abelian character of
$SU(2)$ as contained in the Haar measure might be responsible for confinement.
","[{""version"":""v1"",""created"":""Mon, 6 Feb 1995 13:42:55 GMT""}]","2016-09-01"
"hep-ph/9502235","Xiang Qian Luo","Qi-Zhou Chen, Xiang-Qian Luo, Shuo-Hong Guo, Xi-Yang Fang","Glueball Masses in QCD_3","8 pages plus 2 figures, encoded with uufiles.","Phys.Lett. B348 (1995) 560-564","10.1016/0370-2693(95)00162-E","HLRZ-94-40, to appear in Physics Letters B.","hep-ph",,"  We discuss how to extract the spectroscopy of quantum chromodynamics (QCD) in
the pure gauge sector from the Hamiltonian lattice field theory approach. The
recently developed truncated eigenvalue equation method is applied to the
estimation of the scalar glueball $0^{++}$ and $0^{--}$ masses in the
(2+1)-dimensional case. These masses reach the constant values in a scaling
region as required by the renormalizability.
","[{""version"":""v1"",""created"":""Mon, 6 Feb 1995 14:05:47 GMT""}]","2016-09-01"
"hep-ph/9502236","Lev F. M.","Felix M. Lev","Qualitative Consideration Of The Effect Of Binding In Deep Inelastic
  Scattering","6 pages, LaTeX.",,,,"hep-ph",,"  In our recent paper (hep-ph/9501348) we argued that the Bjorken variable $x$
in deep inelastic scattering cannot be interpreted as the light cone momentum
fraction $\xi$ even in the Bjorken limit and in zero order of the perturbation
theory. The purpose of the present paper is to qualitatively explain this fact
using only a few simplest kinematical relations.
","[{""version"":""v1"",""created"":""Mon, 6 Feb 1995 15:34:53 GMT""}]","2016-09-01"
"hep-th/9502029","Kanno","Hiroaki Kanno and Y\H{u}ji Ohta","Topological Strings with Scaling Violation and Toda Lattice Hierarchy","27 pages, latex, no figures","Nucl.Phys.B442:179-204,1995","10.1016/S0550-3213(95)00138-7",,"hep-th",,"  We show that there is a series of topological string theories whose
integrable structure is described by the Toda lattice hierarchy. The monodromy
group of the Frobenius manifold for the matter sector is an extension of the
affine Weyl group $\widetilde W (A_N^{(1)})$ introduced by Dubrovin. These
models are generalizations of the topological $CP^1$ string theory with scaling
violation. The logarithmic Hamiltonians generate flows for the puncture
operator and its descendants. We derive the string equation from the
constraints on the Lax and the Orlov operators. The constraints are of
different type from those for the $c=1$ string theory. Higher genus expansion
is obtained by considering the Lax operator in matrix form.
","[{""version"":""v1"",""created"":""Mon, 6 Feb 1995 01:55:06 GMT""}]","2010-11-01"
"hep-th/9502030","Robert Marnelius","Igor Batalin, Robert Marnelius","Completely anticanonical form of Sp(2)-symmetric Lagrangian quantization","7 pages,latexfile","Phys.Lett. B350 (1995) 44-48","10.1016/0370-2693(95)00333-G","ITP-G\""oteborg 94-30","hep-th",,"  The Sp(2)-symmetric Lagrangian quantization scheme is represented in a
completely anticanonical form. Antifields are assigned to all field variables
including former ""parametric"" ones \pi^{Aa}. The antibrackets (F, G)^a as well
as the operators \triangle^a and V^a are extended to include the new
anticanonical pairs \pi^{Aa}, \bar{\phi}_A. A new version of the gauge fixing
mechanism in the Lagrangian effective action is proposed. The corresponding
functional integral is shown to be gauge independent.
","[{""version"":""v1"",""created"":""Mon, 6 Feb 1995 11:59:18 GMT""}]","2016-09-06"
"hep-th/9502031","Alexei Semikhatov","I Batalin, R Marnelius, A Semikhatov","Triplectic Quantization: A Geometrically Covariant Description of the
  Sp(2)-symmetric Lagrangian Formalism","Revised version -- our treatment in Section 5 has been extended and
  several pedagogical notes inserted in Sections 2--4; more references added.","Nucl.Phys. B446 (1995) 249-285","10.1016/0550-3213(95)00176-S","ITP G\""oteborg 94-31","hep-th",,"  A geometric description is given for the Sp(2) covariant version of the
field-antifield quantization of general constrained systems in the Lagrangian
formalism. We develop differential geometry on manifolds in which a basic set
of coordinates (`fields') have two superpartners (`antifields'). The
quantization on such a triplectic manifold requires introducing several
specific differential-geometric objects, whose properties we study. These
objects are then used to impose a set of generalized master-equations that
ensure gauge-independence of the path integral. The theory thus quantized is
shown to extend to a level-1 theory formulated on a manifold that includes
antifields to the Lagrange multipliers. We also observe intriguing relations
between triplectic and ordinary symplectic geometry.
","[{""version"":""v1"",""created"":""Mon, 6 Feb 1995 10:28:01 GMT""},{""version"":""v2"",""created"":""Sun, 26 Feb 1995 22:38:48 GMT""},{""version"":""v3"",""created"":""Mon, 27 Feb 1995 21:57:40 GMT""}]","2013-07-31"
"hep-th/9502032",,"M. C. Diamantini, P. Sodano, C. A. Trugenberger","Self Duality and Oblique Confinement in Planar Gauge Theories","32 pages, harvmac","Nucl.Phys. B448 (1995) 505-532","10.1016/0550-3213(95)00252-N","UGVA-DPT 1994/11-88 and DFUPG 98/94","hep-th cond-mat",,"  We investigate the non-perturbative structure of two planar $Z_p \times Z_p$
lattice gauge models and discuss their relevance to two-dimensional condensed
matter systems and Josephson junction arrays. Both models involve two compact
U(1) gauge fields with Chern-Simons interactions, which break the symmetry down
to $Z_p \times Z_p$. By identifying the relevant topological excitations
(instantons) and their interactions we determine the phase structure of the
models. Our results match observed quantum phase transitions in Josephson
junction arrays and suggest also the possibility of {\it oblique confining
ground states} corresponding to quantum Hall regimes for either charges or
vortices.
","[{""version"":""v1"",""created"":""Mon, 6 Feb 1995 10:06:47 GMT""}]","2009-10-28"
"hep-th/9502033",,"Olivier Piguet","On the Role of Vector Supersymmetry in Topological Field Theory","17 pages, latex, no figures. Talk given at the ``XV Encontro Nacional
  de Fisica de Particulas e Campos'', Angra dos Reis, Brazil, October 1994.",,,"UGVA-DPT 1995/02-880","hep-th",,"  Vector supersymmetry is typical of topological field theory. Its role in the
construction of gauge invariant quantities is explained, as well as its role in
the cancellation of the ultraviolet divergences. The example of the
Chern-Simons theory in three dimensions is treated in details.
","[{""version"":""v1"",""created"":""Mon, 6 Feb 1995 12:39:19 GMT""}]","2016-09-06"
"hep-th/9502034","Xiang Qian Luo","Qi-Zhou Chen, Xiang-Qian Luo, Shuo-Hong Guo","QCD_3 Vacum Wave Function","10 pages plus 3 figures, encoded with uufiles.","Phys.Lett. B341 (1995) 349-354","10.1016/0370-2693(94)01403-Y","HLRZ-94-25, published in Physics Letters B341 (1995) 349-354.","hep-th",,"  We investigate quantum chromodynamics in 2+1 dimensions ($\rm{QCD}_3$) using
the Hamiltonian lattice field theory approach. The long wavelength structure of
the ground state, which is closely related to the confinement phenomenon, is
analyzed and its vacuum wave function is evaluated by means of the recently
developed truncated eigenvalue equation method. The third order estimations
show nice scaling for the physical quantities.
","[{""version"":""v1"",""created"":""Mon, 6 Feb 1995 14:01:43 GMT""}]","2016-09-06"
"hep-th/9502035",,"S. De Bievre, M. Degli Esposti, R. Giachetti","QUANTIZATION OF A CLASS OF PIECEWISE AFFINE TRANSFORMATIONS ON THE TORUS","no. 28 pages in AMSTEX","Commun.Math.Phys. 176 (1996) 73-94","10.1007/BF02099363",,"hep-th",,"  We present a unified framework for the quantization of a family of discrete
dynamical systems of varying degrees of ""chaoticity"". The systems to be
quantized are piecewise affine maps on the two-torus, viewed as phase space,
and include the automorphisms, translations and skew translations. We then
treat some discontinuous transformations such as the Baker map and the
sawtooth-like maps. Our approach extends some ideas from geometric quantization
and it is both conceptually and calculationally simple.
","[{""version"":""v1"",""created"":""Mon, 6 Feb 1995 15:51:50 GMT""}]","2009-10-28"
"nucl-th/9502014",,"C.H. Chen, C.L. Wu, D.H. Feng, A. Arima","Inverted Pairing and Excitation Induced by Quadrupole-Quadrupole
  Interaction","Submitted to Phys. Rev. Lett",,,,"nucl-th",,"  In this paper, eit is shown for a single-$j$ shell that the intrinsic
excitations induced by the quadrupole-quadrupole interaction can be viewed as
that due to the inverted surface-delta interaction whose multipole-pairing
component with the largest spin is the dominant term and is attractive. This
allow us to trace the origin of the recently introduced optimum pair
description of rotation and leads naturally to analytical expressions for the
rotational energies for the various bands in a single $j$-shell with the
quadrupole-quadrupole interaction.
","[{""version"":""v1"",""created"":""Mon, 6 Feb 1995 05:25:10 GMT""}]","2007-05-23"
"nucl-th/9502015","Jouni A. Niskanen","J.A. Niskanen (University of Helsinki)","Comment on ""Role of heavy meson exchange in near threshold N N --> d pi""","7 pages, figures by fax or mail from janiskanen@phcu.helsinki.fi","Phys.Rev.C53:526-528,1996","10.1103/PhysRevC.53.526","HU-TFT-95-6","nucl-th",,"  In a recent paper by C. J. Horowitz (Phys. Rev. C {\bf 48}, 2920 (1993)) a
heavy meson exchange is incorporated into threshold NN --> d pi to enhance the
grossly underestimated cross section. However, that calculation uses an
unjustified assumption on the initial and final momenta, which causes an
overestimate of this effect by a factor of 3--4. I point out that the inclusion
of the Delta(1232) isobar increases the cross section significantly even at
threshold.
","[{""version"":""v1"",""created"":""Mon, 6 Feb 1995 11:03:15 GMT""}]","2016-09-08"
"patt-sol/9502001",,"V. S. Gerdjikov (Institute of Nuclear Research and Nuclear Energy,
  Sofia 1784, Bulgaria) and N. A. Kostov (Institute of Electronics, Sofia 1784,
  Bulgaria)","INVERSE SCATTERING TRANSFORM ANALYSIS OF STOKES-ANTI-STOKES STIMULATED
  RAMAN SCATTERING","16 pages, LaTeX, no figures",,"10.1103/PhysRevA.54.4339","INRNE Preprint TH--94/8","patt-sol nlin.PS",,"  Zakharov-Shabat--Ablowitz-Kaup-Newel-Segur representation for
Stokes-anti-Stokes stimulated Raman scattering is proposed. Periodical waves,
solitons and self-similarity solutions are derived. Transient and bright
threshold solitons are discussed.
","[{""version"":""v1"",""created"":""Mon, 6 Feb 1995 12:19:04 GMT""}]","2016-09-08"
"q-alg/9502006","Alexander A. Voronov","M. Flato, M. Gerstenhaber, A. A. Voronov","Cohomology and Deformation of Leibniz Pairs","15 pages",,"10.1007/BF00739377",,"q-alg math.QA",,"  Cohomology and deformation theories are developed for Poisson algebras
starting with the more general concept of a Leibniz pair, namely of an
associative algebra $A$ together with a Lie algebra $L$ mapped into the
derivations of $A$. A bicomplex (with both Hochschild and Chevalley-Eilenberg
cohomologies) is essential.
","[{""version"":""v1"",""created"":""Mon, 6 Feb 1995 00:17:57 GMT""}]","2016-09-08"
