"alg-geom/9502004","Masanori Kobayashi","Masanori Kobayashi","Duality of Weights, Mirror Symmetry and Arnold's Strange Duality","22 pages, AmSTeX2.1",,,,"alg-geom math.AG",,"  A notion of duality of weight systems which corresponds to Batyrev's toric
mirror symmetry is given. Explicit duality on the (1,1)-cohomology of K3
surfaces which are minimal models of toric hypersurfaces is constructed using
monomial divisor mirror map of Aspinwall-Greene-Morrison. It is shown that
Arnold's strange duality for exceptional unimodal singularities reduces to this
duality.
","[{""version"":""v1"",""created"":""Mon, 6 Feb 1995 13:41:10 GMT""}]","2008-02-03"
"astro-ph/9502022","Hans J. Haubold","H.J. Haubold and A.M. Mathai","Solar Structure in terms of Gauss' Hypergeometric Function","Invited Paper (A.M.Mathai) at the Fourth UN/ESA Workshop on Basic
  Space Science, Cairo, Egypt, July 1994, 10 pages LaTeX,4 figures available on
  request","Astrophys. Space Sci. 228:77-86,1995","10.1007/BF00984968","Accepted for publication in Astrophysics and Space Science","astro-ph",,"  Hydrostatic equilibrium and energy conservation determine the conditions in
the gravitationally stabilized solar fusion reactor. We assume a matter density
distribution varying non- linearly through the central region of the Sun. The
analytic solutions of the differential equations of mass conservation,
hydrostatic equilibrium, and energy conservation, together with the equation of
state of the perfect gas and a nuclear energy generation rate
$\epsilon=\epsilon_0\rho^nT^m$, are given in terms of Gauss' hypergeometric
function. This model for the structure of the Sun gives the run of density,
mass pressure, temperature, and nuclear energy generation through the central
region of the Sun. Because of the assumption of a matter density distribution,
the conditions of hydrostatic equilibrium and energy conservation are separated
from the mode of energy transport in the Sun.
","[{""version"":""v1"",""created"":""Sun, 5 Feb 1995 21:02:02 GMT""}]","2011-03-17"
"astro-ph/9502023","Luigi Guzzo","C.A. Collins, L. Guzzo, R.C. Nichol, S.L. Lumsden","The EDSGC - VII: The Edinburgh-Milano Cluster Redshift Survey","9 ps pages of text, plus 17 ps pages of tables, all in a uuencoded-
  compressed tarfile. 7 ps figures in a separate file. Accepted for publication
  in MNRAS. Milano Preprint Series in Astrophysics, # TBD.",,,,"astro-ph",,"  We present the redshifts of the galaxies and galaxy clusters which form the
Edinburgh--Milano (EM) cluster redshift survey. A total of 777 galaxy redshifts
have been measured in 94 clusters extracted from the digitised Edinburgh Durham
Cluster Catalogue. We also present the radial velocity dispersions for 37
clusters. Observational and data reduction techniques are discussed in detail,
together with the strategy adopted to determine the mean redshift of a cluster
and to identify and discard plausible phantom clusters. Some 10% of our
clusters show heavy contamination, indicating that projection is a serious
problem for optically selected rich clusters. The median velocity dispersion
estimated for a sub--sample of richness R \geq 1 clusters is 742 \pm63 km/sec
From a simple comparison with Omega=1 Cold Dark Matter models of structure
formation, these results favour a biasing parameter b=1.6-2.0 and are
inconsistent with a bias outside of the range b=1.3-2.5.
","[{""version"":""v1"",""created"":""Mon, 6 Feb 1995 02:01:20 GMT""}]","2016-08-30"
"astro-ph/9502024","Paul Steinhardt","Paul J. Steinhardt (University of Pennsylvania)","Cosmology at the Crossroads","44 pages (without figures), 13 figures, 2 tables; figures available
  by ftp and announcing SOFTWARE analysis package and current table of exp't.
  bandpowers available thru Penn Cosmology Home Page:
  http://dept.physics.upenn.edu/~www/astro-cosmo/ (for more details, read
  Comment at head of LaTeX file)",,,,"astro-ph gr-qc hep-th",,"  Observational tests during the next decade may determine if the evolution of
the Universe can be understood from fundamental physical principles, or if
special initial conditions, coincidences, and new, untestable physical laws
must be invoked. The inflationary model of the Universe is an important example
of a predictive cosmological theory based on physical principles. In this talk,
we discuss the distinctive fingerprint that inflation leaves on the cosmic
microwave background anisotropy. We then suggest a series of five milestone
experimental tests of the microwave background which could determine the
validity of the inflationary hypothesis within the next decade.
  The paper is a Review based on a Plenary talk given at the Snowmass Workshop
on Particle Astrophysics and Cosmology, 1995 It will appear in the Proceedings
edited by E. Kolb and R.Peccei. Software package for computing filter functions
and band power estimates available thru world-wide-web at
http://dept.physics.upenn.edu/~www/astro-cosmo/ .
","[{""version"":""v1"",""created"":""Mon, 6 Feb 1995 02:02:57 GMT""}]","2016-08-30"
"astro-ph/9502025","Helene Di Nella","Helene Di Nella and Georges Paturel (Observatoire de Lyon, France)","Possible Connexion Between Large Scale Structures","Paper presented at the ASA meeting in Canberra in July 1994,
  referreed and accepted for publication in the Proceedings of Astronomical
  Society of Australia in 1995, volume 12. 4 pages, 3 figures.",,,,"astro-ph",,"  From the Lyon-Meudon Extragalactic Database LEDA, we constructed a sample of
27,000 galaxies with radial velocities smaller than 15,000 km s$^{-1}$. From
this first sample we selected the 5,683 largest galaxies which constitute a
sample complete up to the diameter limit $D_{25}=1.6'$. This sub-sample has
been used to search for the most populated plane. The result is that the plane
defined by the pole ($l=52 \deg$; $b=16 \deg$) contains twice as many galaxies
as would be found for randomly distributed galaxies. This plane is not far from
the supergalactic plane. Then, the distribution of galaxies is studied in this
plane by using the radial velocity as an estimate of the distance. An excess of
galaxies appears at a distance of about 70 Mpc. We discuss the reality of this
density enhancement which could result from selection effects.
","[{""version"":""v1"",""created"":""Mon, 6 Feb 1995 07:04:38 GMT""}]","2016-08-30"
"astro-ph/9502026",,"Lars Brostrom, Sven Mannervik (Atomic Physics, Stockholm University),
  Peder Royen (Phys Dept, Stockholm University) and Anders Wannstrom (Phys
  Dept, Uppsala University)","Measurement of isotope shift in Eu II","12 pages, in press for Physica Scripta, in swetex",,"10.1088/0031-8949/51/3/008",,"astro-ph",,"  The isotope shift between singly-charged ^<151>Eu and ^<153>Eu in the
4f^7(^8S^o)6s^9S_4-4f^7(^8S^o)6p_1/2>(J=4) transition at 4129 A has been
measured using fast ion beam-laser technique. This Eu line has attracted
interest in connection with efforts of obtaining a cosmochronometer based on
observed Th/Eu abundance ratios. Knowledge of the isotope shift is of
importance in order to check that contaminations from line blends do not
contribute to the line intensity of Eu II. The measured value of the isotope
shift -0.1527(2) cm-1 (= -4578 MHz) is consistent with the old spectroscopic
value of Krebs and Winkler -0.1503(25) cm-1 using a Fabry Perot interferometer,
while the accuracy is improved substantially.
","[{""version"":""v1"",""created"":""Mon, 6 Feb 1995 10:21:56 GMT""}]","2009-10-28"
"astro-ph/9502027","Tal Alexander","Tal Alexander (Tel-Aviv University)","The Signature of Microlensing in QSO Variability-Redshift Correlations","Self-unpacking, uuencoded postscript file, 10 pages with 7 figures
  included. Accepted for publication by the MNRAS.",,"10.1093/mnras/274.3.909","WO-SIA 61","astro-ph",,"  A recently discovered inverse correlation between QSO redshift and long-term
continuum variability timescales was suggested to be the signature of
microlensing on cosmological scales (Hawkins 1993). A general theoretical
method for calculating such correlations is presented and applied to various
lensing scenarios in the framework of $\Lambda = 0$ Friedmann cosmologies. It
is shown that the observed timescales can be strongly influenced by the
observational limitations: the finite duration of the monitoring campaign and
the finite photometric sensitivity. In most scenarios the timescales increase
with source redshift, $z_s$, although slower than the $1+z_s$ time dilation
expected of intrinsic variability. A decrease can be obtained for an extended
source observed with moderate sensitivity. In this case, only lenses no further
away than several hundreds Mpc participate in the lensing. The resulting
optical depth is too small to explain the common long-term QSO variability
unless an extremely high local lens density is assumed. These results do not
support the idea that the reported inverse correlation can be attributed to
microlensing of a uniform QSO sample by a uniform distribution of lenses. The
possibility of using observations at various wavelengths and QSO samples at
various positions to identify microlensing in QSO variability is also
discussed.
","[{""version"":""v1"",""created"":""Mon, 6 Feb 1995 11:19:07 GMT""}]","2015-06-24"
"astro-ph/9502028","Fred Rasio","Frederic A. Rasio (IAS, Princeton)","THE MINIMUM MASS RATIO OF W URSAE MAJORIS BINARIES","uuencoded compressed postscript, 8 pages incl. one figure, to appear
  in ApJ Letters.","Astrophys.J. 444 (1995) L41","10.1086/187855","IASSNS AST 95/11","astro-ph",,"  The minimum mass ratio for tidal stability of a contact binary containing two
unevolved main-sequence stars is calculated to be $\qmin\simeq0.09$ in the case
of a mostly radiative primary, and is higher if an appreciable fraction of the
mass lies in a convective envelope. At least one observed system, AW UMa, has a
mass ratio just below this value ($q=0.075$), implying, if the system is
stable, that the primary must be slightly evolved and must have a very shallow
convective envelope. Contact binaries with mass ratios significantly below that
of AW UMa should not be observed, since they are tidally unstable and quickly
merge into a single, rapidly rotating object, on a timescale
$\sim10^3$--$10^4\,$yr.
","[{""version"":""v1"",""created"":""Mon, 6 Feb 1995 15:05:13 GMT""}]","2016-08-30"
"chao-dyn/9502004","Xavier de Hemptinne","X. de Hemptinne","The ambiguous meaning of irreversibility","Latex, 4 pages","Reprinted from J. Tech. Phys. (Poland) 38 (1997) 231-234",,,"chao-dyn nlin.CD",,"  Irreversibility of spontaneous macroscopic dynamics and its asymmetry with
respect to the sign reversal of the variable $t$ is usually interpreted as a
genuine property of complex isolated systems. Discussion of the kinetics
involved in Joule's experiment concerning spontaneous expansion of a gas shows
that the isolation hypothesis results from ambiguous definitions of a number of
keywords. Whereas Poincar\'{e}'s apparent irreversibility result from
conservative Hamiltonian dynamics, full relaxation implies interaction with the
outside world. Only the latter process leads to entropy change.
","[{""version"":""v1"",""created"":""Mon, 6 Feb 1995 10:14:17 GMT""},{""version"":""v2"",""created"":""Sat, 30 Jan 1999 18:34:38 GMT""}]","2008-02-03"
"chao-dyn/9502005","Kai T. Hansen","Kai T. Hansen (University of Freiburg), Predrag Cvitanovic (Niels Bohr
  Institute Copenhagen)","Symbolic Dynamics and Markov Partitions for the Stadium Billiard","31 pages PostScript uuencoded with figures",,,,"chao-dyn nlin.CD",,"  We investigate the Bunimovich stadium dynamics and find that in the limit of
infinitely long stadium the symbolic dynamics is a subshift of finite type. For
a stadium of finite length the Markov partitions are infinite, but the
inadmissible symbol sequences can be determined exactly by means of the
appropriate pruning front. We outline a construction of a sequence of finite
Markov graph approximations by means of approximate pruning fronts with finite
numbers of steps.
","[{""version"":""v1"",""created"":""Mon, 6 Feb 1995 14:38:24 GMT""}]","2016-08-31"
"chao-dyn/9502006","Kai T. Hansen","Kai T. Hansen (University of Freiburg)","Bifurcations and Complete Chaos for the Diamagnetic Kepler Problem","15 pages PostScript uuencoded with figures",,"10.1103/PhysRevE.51.1838",,"chao-dyn nlin.CD",,"  We describe the structure of bifurcations in the unbounded classical
Diamagnetic Kepler problem. We conjecture that this system does not have any
stable orbits and that the non-wandering set is described by a complete trinary
symbolic dynamics for scaled energies larger then $\epsilon_c=0.328782\ldots$.
","[{""version"":""v1"",""created"":""Mon, 6 Feb 1995 15:07:12 GMT""}]","2016-08-31"
"cmp-lg/9502003","Gregor Erbach","Gregor Erbach (Universitaet des Saarlandes, Comptational Linguistics
  Dept.)","ProFIT: Prolog with Features, Inheritance and Templates","8 pages, LaTeX, eaclap.sty",,,"CLAUS Report 42","cmp-lg cs.CL",,"  ProFIT is an extension of Standard Prolog with Features, Inheritance and
Templates. ProFIT allows the programmer or grammar developer to declare an
inheritance hierarchy, features and templates. Sorted feature terms can be used
in ProFIT programs together with Prolog terms to provide a clearer description
language for linguistic structures. ProFIT compiles all sorted feature terms
into a Prolog term representation, so that the built-in Prolog term unification
can be used for the unification of sorted feature structures, and no special
unification algorithm is needed. ProFIT programs are compiled into Prolog
programs, so that no meta-interpreter is needed for their execution. ProFIT
thus provides a direct step from grammars developed with sorted feature terms
to Prolog programs usable for practical NLP systems.
","[{""version"":""v1"",""created"":""Sun, 5 Feb 1995 17:22:23 GMT""}]","2016-08-31"
"cmp-lg/9502004","Gregor Erbach","Gregor Erbach (University of the Saarland, Comptational Linguistics
  Dept.)","Bottom-Up Earley Deduction","7 pages, LaTeX, eaclap.sty","Proceedings of COLING 94, pages 796-802",,"CLAUS Report 39","cmp-lg cs.CL",,"  We propose a bottom-up variant of Earley deduction. Bottom-up deduction is
preferable to top-down deduction because it allows incremental processing (even
for head-driven grammars), it is data-driven, no subsumption check is needed,
and preference values attached to lexical items can be used to guide best-first
search. We discuss the scanning step for bottom-up Earley deduction and
indexing schemes that help avoid useless deduction steps.
","[{""version"":""v1"",""created"":""Sun, 5 Feb 1995 16:59:05 GMT""}]","2016-08-31"
"cond-mat/9502020","Frithjof Anders","F B Anders","An Enhanced Perturbational Study on Spectral Properties of the Anderson
  Model","19 pages, ReVTeX, no figures. 17 Postscript figures available on the
  WWW at http://spy.fkp.physik.th-darmstadt.de/~frithjof/","J.Phys Condens.Matter 7 (1995) 2801","10.1088/0953-8984/7/14/018",,"cond-mat",,"  The infinite-$U$ single impurity Anderson model for rare earth alloys is
examined with a new set of self-consistent coupled integral equations, which
can be embedded in the large $N$ expansion scheme ($N$ is the local spin
degeneracy). The finite temperature impurity density of states (DOS) and the
spin-fluctuation spectra are calculated exactly up to the order $O(1/N^2)$. The
presented conserving approximation goes well beyond the $1/N$-approximation
({\em NCA}) and maintains local Fermi-liquid properties down to very low
temperatures. The position of the low lying Abrikosov-Suhl resonance (ASR) in
the impurity DOS is in accordance with Friedel's sum rule. For $N=2$ its shift
toward the chemical potential, compared to the {\em NCA}, can be traced back to
the influence of the vertex corrections. The width and height of the ASR is
governed by the universal low temperature energy scale $T_K$. Temperature and
degeneracy $N$-dependence of the static magnetic susceptibility is found in
excellent agreement with the Bethe-Ansatz results. Threshold exponents of the
local propagators are discussed. Resonant level regime ($N=1$) and intermediate
valence regime ($|\epsilon_f| <\Delta$) of the model are thoroughly
investigated as a critical test of the quality of the approximation. Some
applications to the Anderson lattice model are pointed out.
","[{""version"":""v1"",""created"":""Mon, 6 Feb 1995 08:32:59 GMT""}]","2009-10-28"
"cond-mat/9502022","Alexei Tsvelik","A. M. Tsvelik","Existence of Low-Temperature Critical Regime in 1D Luttinger Liquid with
  a Weak Link","6 pages, latex, no figures",,"10.1088/0305-4470/28/23/005",,"cond-mat",,"  The exact solution of the boundary sine-Gordon model is studied in the region
where the scaling dimension of the boundary field $1 < \Delta < 1$. It is shown
that at $\Delta > 2/3$ the infrared fixed point belongs to the universality
class of the underscreened anisotropic Kondo model. The boundary contribution
to the specific heat scales as $C \sim T^{2\Delta^{-1} - 2}$ at small
temperatures.
","[{""version"":""v1"",""created"":""Mon, 6 Feb 1995 10:45:24 GMT""}]","2009-10-28"
"cond-mat/9502023","Alexei Tsvelik","D. Shelton and A. M. Tsvelik","Superconducting Instability in a 1D lattice of Berry Phase Molecules","6 pages, latex, no figures",,,,"cond-mat",,"  We study the 1D model of conduction electrons interacting with local vibronic
modes. States in the conduction band are two-fold degenerate both in orbital
index and spin. It is shown that such 1D system has a strong tendency to
superconductivity. The superconducting pairing originates from coupling of two
charge density waves; the scaling dimension of the order parameter is close to
1/4.
","[{""version"":""v1"",""created"":""Mon, 6 Feb 1995 12:29:33 GMT""}]","2007-05-23"
"cond-mat/9502024","Philip Solovej","E. H. Lieb and J. P. Solovej and J. Yngvason","The Ground States of Large Quantum Dots in Magnetic Fields","57 pages, Plain tex, 5 figures in separate uufile",,"10.1103/PhysRevB.51.10646","QDOTS-EHLJPSJY-3-Feb-94","cond-mat",,"  The quantum mechanical ground state of a 2D $N$-electron system in a
confining potential $V(x)=Kv(x)$ ($K$ is a coupling constant) and a homogeneous
magnetic field $B$ is studied in the high density limit $N\to\infty$, $K\to
\infty$ with $K/N$ fixed. It is proved that the ground state energy and
electronic density can be computed {\it exactly} in this limit by minimizing
simple functionals of the density. There are three such functionals depending
on the way $B/N$ varies as $N\to\infty$: A 2D Thomas-Fermi (TF) theory applies
in the case $B/N\to 0$; if $B/N\to{\rm const.}\neq 0$ the correct limit theory
is a modified $B$-dependent TF model, and the case $B/N\to\infty$ is described
by a ``classical'' continuum electrostatic theory. For homogeneous potentials
this last model describes also the weak coupling limit $K/N\to 0$ for arbitrary
$B$. Important steps in the proof are the derivation of a new Lieb-Thirring
inequality for the sum of eigenvalues of single particle Hamiltonians in 2D
with magnetic fields, and an estimation of the exchange-correlation energy. For
this last estimate we study a model of classical point charges with
electrostatic interactions that provides a lower bound for the true quantum
mechanical energy.
","[{""version"":""v1"",""created"":""Mon, 6 Feb 1995 14:45:56 GMT""}]","2009-10-28"
"cond-mat/9502027","Arianna Montorsi","Arianna Montorsi, and David K. Campbell","Rigorous results on superconducting ground states for attractive
  extended Hubbard models","12 pages",,"10.1103/PhysRevB.53.5153",,"cond-mat",,"  We show that the exact ground state for a class of extended Hubbard models
including bond-charge, exchange, and pair-hopping terms, is the Yang
""eta-paired"" state for any non-vanishing value of the pair-hopping amplitude,
at least when the on-site Coulomb interaction is attractive enough and the
remaining physical parameters satisfy a single constraint. The ground state is
thus rigorously superconducting. Our result holds on a bipartite lattice in any
dimension, at any band filling, and for arbitrary electron hopping.
","[{""version"":""v1"",""created"":""Mon, 6 Feb 1995 15:54:00 GMT""}]","2009-10-28"
"dg-ga/9502003","Uwe Semmelmann","A. Moroianu and U. Semmelmann","K\""ahlerian Killing Spinors, Complex Contact Structures and Twistor
  Spaces","7 pages, LaTeX format, no figures","C. R. Math. Acad. Sci. Paris 323, 57-61 (1996)",,,"dg-ga math.DG",,"  We collect our recent results ([5] and [8]) and we get the equivalence of the
three notions of the title under some conditions. We then use this equivalence
in order to prove some consequences about Sasakian manifolds, complex almost
contact structures and complex k-contact structures.
","[{""version"":""v1"",""created"":""Sun, 5 Feb 1995 20:28:13 GMT""}]","2019-01-08"
"gr-qc/9502012","Baburova O. V.","O. V. Babourova, B. N. Frolov, M. Yu. Koroliov (Department of
  Mathematics, Moscow State Pedagogical University)","Peculiarities of Matter Motion in Metric-Affine Gravitational Theory","6 pages",,,"EFI-95-02","gr-qc",,"  On the basis of the Lie derivative method in a metric-affine space-time it is
shown that in the metric-affine gravitational theory the energy-momentum
conservation law and therefore the equations of the matter motion are the
consequence (as in the GR) of the gravitational field equations. The possi-
bility of the detection of the space-time non-metric properties is discussed.
","[{""version"":""v1"",""created"":""Mon, 6 Feb 1995 13:50:00 GMT""}]","2007-05-23"
"hep-lat/9502005","Jaekwon Kim","Jae-Kwon Kim","Scaling behavior of the four-point renormalized coupling constant in the
  two dimensional O(2) and O(3) non-linear sigma models","10pages; RevTex; 1 figure available upon request from
  kimj@physics.ucla.edu; to appear in Phys. Lett. B","Phys.Lett. B345 (1995) 469-472","10.1016/0370-2693(94)01640-X",,"hep-lat",,"  We report thermodynamic values of four-point renormalized coupling constant
calculated by Monte Carlo simulations in the continuum limits of the lattice
versions of the two-dimensional O(2) and O(3) non-linear sigma models. In each
case the critical index of the coupling constant vanishes, which leads to
hyperscaling (non-triviality).
","[{""version"":""v1"",""created"":""Mon, 6 Feb 1995 08:12:45 GMT""}]","2016-08-31"
"hep-ph/9502225",,"Ehab Malkawi and C.--P.Yuan","Effects of a heavy top quark on low energy data using the electroweak
  chiral Lagrangian","Minor changes made including the title. 27 pages in Latex, 8
  uuencoded PS figures in a seperate "".uu"" file. To appear in Phys. Rev. D.","Phys.Rev. D52 (1995) 472-483","10.1103/PhysRevD.52.472","MSUHEP-50107","hep-ph",,"  We study large top quark mass effects on low energy physics in the chiral
Lagrangian formulated electroweak theories. We show that these radiative
corrections can be easily obtained from a set of Feynman diagrams involving
only the scalar Goldstone bosons and the fermions when the contributions of the
order $g$ (the weak coupling) are ignored. Using CERN LEP and SLAC Linear
Collider (SLC) data we constrain on the nonstandard couplings, which might
originate from the spontaneous symmetry-breaking sector, of the top quark to
the electroweak gauge bosons.
","[{""version"":""v1"",""created"":""Sun, 5 Feb 1995 19:09:59 GMT""},{""version"":""v2"",""created"":""Mon, 3 Apr 1995 22:18:34 GMT""}]","2009-10-28"
"hep-ph/9502226","Silas Beane","Silas R. Beane (Duke University)","Can a pseudo-symmetry solve the cosmological constant problem?","Changes in language (including new title), and assorted perestroika.
  One new consequence of conjecture. 10 pages, uuencoded Postscript file. To
  appear in Phys.Lett.b","Phys.Lett. B358 (1995) 203","10.1016/0370-2693(95)00992-T","DUKE-TH-95-84","hep-ph hep-th",,"  A general no-go theorem dampens hope that the cosmological constant problem
can be solved by a local symmetry mechanism. The possibility is considered here
that this no-go theorem can be avoided by a pseudo-symmetry. A simple
macroscopic effective field theory is constructed which admits an enhanced
pseudo-symmetry in the absence of a cosmological term. It is pointed out that
this pseudo-symmetry is an exact classical invariance of superstrings. The
conjecture that this pseudo-symmetry survives in the quantum theory has several
interesting consequences.
","[{""version"":""v1"",""created"":""Sun, 5 Feb 1995 22:02:48 GMT""},{""version"":""v2"",""created"":""Thu, 31 Aug 1995 15:34:03 GMT""}]","2009-10-28"
"hep-ph/9502227","Richard Lebed","Elizabeth Jenkins and Richard F. Lebed","Baryon Mass Splittings in the 1/N_c Expansion","17 pages, LaTeX","Phys.Rev.D52:282-294,1995","10.1103/PhysRevD.52.282","UCSD/PTH 95-01","hep-ph",,"  The $I=0,1,2,3$ mass splittings of the spin-$1/2$ octet and spin-$3/2$
decuplet baryons are analyzed in the $1/\N$ expansion combined with
perturbative flavor breaking. We show there is considerable experimental
evidence that the baryon masses satisfy the hierarchy predicted by this
expansion. Since flavor symmetry-breaking suppression factors alone are not
sufficient to describe the observed hierarchy, we conclude that there is firm
evidence for the $1/\N$ expansion in the baryon masses. Our analysis differs
from non-relativistic $SU(6)$.
","[{""version"":""v1"",""created"":""Mon, 6 Feb 1995 00:31:14 GMT""}]","2016-09-01"
