"hep-th/9502114","Wtkim","Won T. Kim, Julian Lee, and Young Jai Park","Stability Analysis of the Dilatonic Black Hole in Two Dimensions","10 pages, LaTex, no figures","Phys.Lett. B347 (1995) 217-221","10.1016/0370-2693(95)00054-O","SNUTP 94-110","hep-th",,"  We explicitly show that the net number of degrees of freedom in the
two-dimensional dilaton gravity is zero through the Hamiltonian constraint
analysis. This implies that the local space-time dependent physical excitations
do not exist. From the linear perturbation around the black hole background, we
explicitly prove that the exponentially growing mode with time is in fact
eliminated outside the horizon. Therefore, the two-dimensional dilation gravity
is essentially stable.
","[{""version"":""v1"",""created"":""Sat, 18 Feb 1995 06:57:14 GMT""}]","2016-09-06"
"hep-th/9502115","Wtkim","Won T. Kim and Julian Lee","Hawking Radiation and Energy Conservation in an Evaporating Black Hole","17 pages, LaTex, 3 figures available on request.","Phys.Rev. D52 (1995) 2232-2238","10.1103/PhysRevD.52.2232","SNUTP 95-006","hep-th",,"  We define the Bondi energy for two-dimensional dilatonic gravity theories by
generalizing the known expression of the ADM energy. We show that our
definition of the Bondi energy is exactly the ADM energy minus the radiation
energy at null infinity. An explicit calculation is done for the evaporating
black hole in the RST model with the Strominger's ghost decoupling term. It is
shown that the infalling matter energy is completely recovered through the
Hawking radiation and the thunderpop.
","[{""version"":""v1"",""created"":""Sat, 18 Feb 1995 06:57:57 GMT""}]","2016-09-06"
"math/9502229",,"Hans J. Haubold, Arak Mathai Mathai","Solar structure in terms of Gauss' hypergeometric function",,,,"OP-SF 18 Feb 1995","math.CA astro-ph",,"  Hydrostatic equilibrium and energy conservation determine the conditions in
the gravitationally stabilized solar fusion reactor. We assume a matter density
distribution varying non-linearly through the central region of the Sun. The
analytic solutions of the differential equations of mass conservation,
hydrostatic equilibrium, and energy conservation, together with the equation of
state of the perfect gas and a nuclear energy generation rate
$\epsilon=\epsilon_0 \rho^nT^m$, are given in terms of Gauss' hypergeometric
function. This model for the structure of the Sun gives the run of density,
mass, pressure, temperature, and nuclear energy generation through the central
region of the Sun. Because of the assumption of a matter density distribution,
the conditions of hydrostatic equilibrium and energy conservation are separated
from the mode of energy transport in the Sun.
","[{""version"":""v1"",""created"":""Sat, 18 Feb 1995 00:00:00 GMT""}]","2016-09-06"
"q-alg/9502011",,"Susumu Ariki (Tokyo U.of Mercantile Marine), Tatsuhiro Nakajima and
  Hiro-Fumi Yamada (Tokyo Metropolitan U.)","Weight Vectors of the Basic A_1^(1)-Module and the Littlewood-Richardson
  Rule","February 1995, 7pages, Using AMS-TeX",,"10.1088/0305-4470/28/13/001",,"q-alg math.QA",,"  The basic representation of $\A$ is studied. The weight vectors are
represented in terms of Schur functions. A suitable base of any weight space is
given. Littlewood-Richardson rule appears in the linear relations among weight
vectors.
","[{""version"":""v1"",""created"":""Sat, 18 Feb 1995 08:08:18 GMT""}]","2009-10-28"
"quant-ph/9502017","Krzysztof Wodkiewicz","K. Wodkiewicz","Nonlocal and local ghost fields in quantum correlations.","15 pages, REVTEX, 4 figures in encapsulated postscript can be
  obtained from the author.",,"10.1080/00107519508222148",,"quant-ph",,"  Einstein Podolsky Rosen quantum correlations are discussed from the
perspective of a ghost field introduced by Einstein. The concepts of ghost
field, hidden variables, local reality and the Bell inequality are reviewed. In
the framework of the correlated singlet state, it is shown that quantum
mechanics can be cast in a way that has the form of either nonpositive and
local ghost field or a positive and nonlocal ghost field.
","[{""version"":""v1"",""created"":""Fri, 17 Feb 1995 20:37:52 GMT""}]","2016-09-08"
