"hep-ph/9502366","Antonio Pich","A. Pich","Chiral Perturbation Theory","57 pages, plain Tex, 4 figures included in a separate file (uses
  epsf.tex)","Rept.Prog.Phys.58:563-610,1995","10.1088/0034-4885/58/6/001","FTUV/95-4 , IFIC/95-4","hep-ph",,"  An introduction to the basic ideas and methods of Chiral Perturbation Theory
is presented. Several phenomenological applications of the effective Lagrangian
technique to strong, electromagnetic and weak interactions are discussed.
","[{""version"":""v1"",""created"":""Wed, 22 Feb 1995 14:19:34 GMT""}]","2010-11-01"
"hep-ph/9502369",,"J-L. Ballot (Institut de Physique Nucl\'eaire, Orsay - France), M.R.
  Robilotta (Instituto de F\'isica, USP - Brazil), and C.A. da Rocha (Instituto
  de F\'isica Te\'orica, IFT - Brazil)","TWO-PION EXCHANGE NUCLEAR POTENTIAL - CHIRAL CANCELLATIONS","REVTEX style, 5 pages, 3 PostScrip figures compressed, tarred and
  uuencoded","Int.J.Mod.Phys. E6 (1997) 83-88","10.1142/S0218301397000056","IFT-P.014/95, IFUSP/P-1140","hep-ph nucl-th",,"  We show that chiral symmetry is responsible for large cancellations in the
two-pion exchange nucleon-nucleon interaction, which are similar to those
occuring in free pion-nucleon scattering.
","[{""version"":""v1"",""created"":""Wed, 22 Feb 1995 15:43:18 GMT""},{""version"":""v2"",""created"":""Thu, 23 Feb 1995 12:24:53 GMT""}]","2016-08-15"
"hep-ph/9502371","Carlos A. da Rocha","C.A. da Rocha (Instituto de F\'isica Te\'orica, IFT - Brazil) and M.R.
  Robilotta (Instituto de F\'isica - USP - Brazil)","CHIRAL BACKGROUND FOR THE TWO PION EXCHANGE NUCLEAR POTENTIAL: A
  PARAMETRIZED VERSION","REVTEX style, 16 pages, 5 PostScript figures compressed, tarred and
  uuencoded","Phys.Rev.C52:531-538,1995","10.1103/PhysRevC.52.531","IFT-P.015/95, IFUSP/P-1139","hep-ph nucl-th",,"  We argue that the minimal chiral background for the two-pion exchange
nucleon-nucleon interaction has nowadays a rather firm conceptual basis, which
entitles it to become a standard ingredient of any modern potential. In order
to facilitate applications, we present a parametrized version of a
configuration space potential derived previously. We then use it to assess the
phenomenological contents of some existing NN potentials.
","[{""version"":""v1"",""created"":""Wed, 22 Feb 1995 15:33:08 GMT""},{""version"":""v2"",""created"":""Thu, 23 Feb 1995 12:22:03 GMT""}]","2016-08-15"
"hep-th/9502127",,"T. Fujiwara, Y. Igarashi, R. Kuriki and T. Tabei","BFV-BRST Quantization of 2D Supergravity","39 pages, LaTeX, no figures","Phys.Rev. D53 (1996) 852-869","10.1103/PhysRevD.53.852","YITP-U-95-5","hep-th",,"  Two-dimensional supergravity theory is quantized as an anomalous gauge
theory. In the Batalin-Fradkin (BF) formalism, the anomaly-canceling
super-Liouville fields are introduced to identify the original second-class
constrained system with a gauge-fixed version of a first-class system. The
BFV-BRST quantization applies to formulate the theory in the most general class
of gauges. A local effective action constructed in the configuration space
contains two super-Liouville actions; one is a noncovariant but local
functional written only in terms of 2D supergravity fields, and the other
contains the super-Liouville fields canceling the super-Weyl anomaly. Auxiliary
fields for the Liouville and the gravity super-multiplets are introduced to
make the BRST algebra close off-shell. Inclusion of them turns out to be
essentially important especially in the super-lightcone gauge-fixing, where the
super-curvature equations ($\dl^3_-g_{++} =\dl^2_-\chi_{++}=0$) are obtained as
a result of BRST invariance of the theory. Our approach reveals the origin of
the graded-SL(2,R) current algebra symmetry in a transparent manner.
","[{""version"":""v1"",""created"":""Wed, 22 Feb 1995 05:02:09 GMT""}]","2016-09-06"
"hep-th/9502128","Flad","M. Knecht, R. Pasquier, J.Y. Pasquier","Painlev\'e analysis and integrability properties of a $2+1$
  nonrelativistic field theory.","14 pages, LaTeX, IPNO/TH 95-05, LPTHE-ORSAY 95-06.","J.Math.Phys. 36 (1995) 4181-4191","10.1063/1.530954",,"hep-th",,"  A model for planar phenomena introduced by Jackiw and Pi and described by a
Lagrangian including a Chern-Simons term is considered. The associated
equations of motion, among which a 2+1 gauged nonlinear Schr\""odinger equation,
are rewritten into a gauge independent form involving the modulus of the matter
field. Application of a Painlev\'e analysis, as adapted to partial differential
equations by Weiss, Tabor and Carnevale, shows up resonance values that are all
integer. However, compatibility conditions need be considered which cannot be
satisfied consistently in general. Such a result suggests that the examined
equations are not integrable, but provides tools for the investigation of the
integrability of different reductions. This in particular puts forward the
familiar integrable Liouville and 1+1 nonlinear Schr\""odinger equations.
","[{""version"":""v1"",""created"":""Wed, 22 Feb 1995 10:53:33 GMT""}]","2016-09-06"
"hep-th/9502129","Julio Abad","J. Abad and M.Rios","Non-diagonal solutions to reflection equations in $su(n)$ spin chains","9 pages, PlainTex , two figures uuencoded, Harvmac.","Phys.Lett.B352:92-95,1995","10.1016/0370-2693(95)00450-Y","DFTUZ 95-05","hep-th",,"  The reflection equations in a $su(3)$ spin chain with open boundary
conditions are analyzed. We find non diagonal solutions to the boundary
matrices. The corresponding hamiltonian is given. The solutions are generalized
to $su(n)$.
","[{""version"":""v1"",""created"":""Wed, 22 Feb 1995 11:56:28 GMT""},{""version"":""v2"",""created"":""Thu, 23 Feb 1995 17:13:37 GMT""}]","2014-11-18"
"hep-th/9502130",,"M.Gasperini, M.Giovannini, K.A.Meissner and G.Veneziano","EVOLUTION OF A STRING NETWORK IN BACKGROUNDS WITH ROLLING HORIZONS","19 pages, plain tex, no figures, to appear in ""String gravity and
  physics at the Planck energy scale"" (World Scientific, Singapore, 1995)","Nucl.Phys.Proc.Suppl. 45B-C (1996) 207-216",,"CERN-TH/95-40","hep-th gr-qc",,"  We discuss the temporal variation of the equation of state of a classical
string network, evolving in a background in which the Hubble radius 1/H shrinks
to a minimum and then re-expands to infinity. We also present a method to look
for self-consistent non-vacuum string backgrounds, correponding to the
simultaneous solution of the gravi-dilaton backgrounds equations and of the
string equations of motion.
","[{""version"":""v1"",""created"":""Wed, 22 Feb 1995 11:00:24 GMT""}]","2016-09-06"
"hep-th/9502131","Emili Elizalde","E. Elizalde S.D. Odintsov and A. Romeo","Renormalization Group Properties of Higher-Derivative Quantum Gravity
  with Matter in $4-\varepsilon$ Dimensions","Shortened, LaTeX, 2 figures","Nucl.Phys.B462:315-332,1996","10.1016/0550-3213(95)00674-5","CEAB 95/2-18","hep-th",,"  We investigate the phase structure and the infrared properties of
higher-derivative quantum gravity (QG) with matter, in $4-\varepsilon$
dimensions. The renormalization group (RG) equations in $4-\varepsilon$
dimensions are analysed for the following types of matter: the
$f\varphi^4$-theory, the $O(N) \varphi^4$-theory, scalar electrodynamics, and
the $SU(2)$ model with scalars. New fixed points for the scalar coupling appear
---one of which is IR stable--- being some of them induced by QG. The IR stable
fixed point perturbed by QG leads to a second-order phase transition for the
theory at non-zero temperature. The RG improved effective potential in the
$SU(2)$ theory (which can be considered as the confining phase of the standard
model) is calculated at nonzero temperature and it is shown that its shape is
clearly influenced by QG.
","[{""version"":""v1"",""created"":""Wed, 22 Feb 1995 14:31:09 GMT""},{""version"":""v2"",""created"":""Wed, 10 Jan 1996 14:58:46 GMT""}]","2009-09-25"
"math/9502207","Valentin Ferenczi","Valentin Ferenczi","Operators on subspaces of hereditarily indecomposable Banach spaces",,,,"Banach Archive 2/21/95","math.FA",,"  A space $X$ is said to be hereditarily indecomposable if no two (infinite
dimensional) subspaces of $X$ are in a direct sum. In this paper, we show that
if $X$ is a complex hereditarily indecomposable Banach space, then every
operator from a subspace $Y$ of $X$ to $X$ is of the form $\lambda I + S$,
where $I$ is the inclusion map and $S$ is strictly singular.
","[{""version"":""v1"",""created"":""Tue, 21 Feb 1995 16:19:04 GMT""}]","2009-09-25"
"math/9502209","J. Brian Conrey","J. Brian Conrey, David W. Farmer","An extension of Hecke's converse theorem",,,,"MSRI 1995-025; OSU Math 1995-3","math.NT math.CV",,"  Associated to a newform $f(z)$ is a Dirichlet series $L_f(s)$ with functional
equation and Euler product. Hecke showed that if the Dirichlet series $F(s)$
has a functional equation of the appropriate form, then $F(s)=L_f(s)$ for some
holomorphic newform $f(z)$ on $\Gamma(1)$. Weil extended this result to
$\Gamma_0(N)$ under an assumption on the twists of $F(s)$ by Dirichlet
characters. We show that, at least for small $N$, the assumption on twists can
be replaced by an assumption on the local factors of the Euler product of
$F(s)$.
","[{""version"":""v1"",""created"":""Wed, 22 Feb 1995 00:00:00 GMT""}]","2016-09-06"
"mtrl-th/9502005","Bulbul Chakraborty","Bulbul Chakraborty","Static displacements and chemical correlations in alloys","12 pages",,"10.1209/0295-5075/30/9/005","BRCM-95-4","mtrl-th cond-mat.mtrl-sci",,"  Recent experiments in metallic solid solutions have revealed interesting
correlations between static pair-displacements and the ordering behavior of
these alloys. This paper discusses a simple theoretical model which
successfully explains these observations and which provides a natural framework
for analyzing experimental measurements of pair-displacements and chemical
correlations in solid solutions. The utility and scope of this model is
demonstrated by analyzing results of experiments on $Ni-Fe$ and $Cr-Fe$ alloys
and results of simulations of $Cu-Au$ and $Cu-Ag$ alloys.
","[{""version"":""v1"",""created"":""Wed, 22 Feb 1995 15:43:02 GMT""}]","2016-09-07"
"nucl-ex/9502002",,"B. Crowell, P. Chowdhury, D.J. Blumenthal, S.J. Freeman, C.J. Lister,
  M.P. Carpenter, R.G. Henry, R.V.F. Janssens, T.L. Khoo, T. Lauritsen, Y.
  Liang, F. Soramel and I.G. Bearden","High-K Isomers in 176W and Mechanisms of K-Violation","47 pages, Latex; postscript figures available at
  http://www.phy.anl.gov/bgo/bc/w176/w176.html; submitted to Phys. Rev. C, 6
  Feb 1995","Phys.Rev.C53:1173-1190,1996","10.1103/PhysRevC.53.1173",,"nucl-ex nucl-th",,"  An isomer, with t1/2 = 35 +- 10 ns and J, Kpi = 14, 14+, has been observed in
the nucleus 176W using the reaction 150Nd(30Si,4n) at a beam energy of 133 MeV.
The isomer exhibits an unusual pattern of decay in which the _majority_ of the
flux proceeds directly to states with <K>=0, bypassing available levels of
intermediate K. This severe breakdown of normal K-selection rules in 176W is
compared with recent observations of K-violation in neighboring nuclei, within
the framework of proposed theoretical approaches. The available data on these
K-violating decays seem to have a consistent explanation in models of K-mixing
which include large-amplitude fluctuations of the nuclear shape.
","[{""version"":""v1"",""created"":""Tue, 21 Feb 1995 21:11:40 GMT""}]","2016-09-08"
"nucl-th/9502038",,"Gordon Baym, B. Bl\""attel, L. L. Frankfurt, H. Heiselberg, and M.
  Strikman","Correlations and Fluctuations in High-Energy Nuclear Collisions","30 pages, in Revtex, plus 4 figures. Figures and preprint can be
  obtained by mailing address to: heiselberg@nbi.dk","Phys.Rev.C52:1604-1617,1995","10.1103/PhysRevC.52.1604",,"nucl-th hep-ph",,"  Nucleon correlations in the target and projectile nuclei are shown to reduce
significantly the fluctuations in multiple nucleon-nucleon collisions, total
multiplicity and transverse energy in relativistic heavy-ion collisions, in
particular for heavy projectile and target. The interplay between cross-section
fluctuations, from color transparency and opacity, and nuclear correlations is
calculated and found to be able to account for large fluctuations in transverse
energy spectra. Numerical implementation of correlations and cross-section
fluctuations in Monte-Carlo codes is discussed.
","[{""version"":""v1"",""created"":""Wed, 22 Feb 1995 14:44:32 GMT""}]","2016-09-08"
"q-alg/9502015","Drazen Adamovic","Drazen Adamovic","Some Rational Vertex Algebras","14 pages, AMSTEX","Glasnik Matemati\v cki Vol.29(49) (1994), 25-40",,,"q-alg math.QA",,"  Let $L((n-\tfrac 3 2)\Lambda_0)$, $n \in \Bbb N$, be a vertex operator
algebra associated to the irreducible highest weight module $L((n-\tfrac 3
2)\Lambda_0)$ for a symplectic affine Lie algebra. We find a complete set of
irreducible modules for $L((n-\tfrac 3 2)\Lambda_0)$ and show that every module
for $L((n-\tfrac 3 2)\Lambda_0)$ from the category $\Cal O$ is completely
reducible.
","[{""version"":""v1"",""created"":""Wed, 22 Feb 1995 10:00:51 GMT""},{""version"":""v2"",""created"":""Mon, 21 Sep 1998 17:07:23 GMT""}]","2008-02-03"
