"hep-ph/9502402","Cliff Burgess","P. Bamert, C. P. Burgess and I. Maksymyk","THE SENSITIVITY TO NEW PHYSICS OF A LEP SCAN IN 1995","Plain TeX, 9 pages, no figures. We have streamlined our presentation
  by omitting observables of our Class B. All else is completely unchanged.","Phys.Lett. B352 (1995) 372-375","10.1016/0370-2693(95)00541-R","McGill-95/07, NEIP-95-02, UTTG-06-95.","hep-ph hep-ex",,"  We study the implications of possible off-peak measurements in the 1995 LEP
run, in regard to probing physics beyond the Standard Model. To do so, we
determine the accuracy with which various nonstandard couplings can be expected
to be measured in the three different scan scenarios recently discussed by
Clarke and Wyatt. We find that each scan scenario allows greater sensitivity to
a different set of new physics couplings. Oblique parameters are best measured
with the longest scan, while nonstandard fermion couplings to the Z tend to be
better constrained (albeit only marginally) if all of the 1995 LEP measurements
are taken on the Z peak.
","[{""version"":""v1"",""created"":""Mon, 27 Feb 1995 20:51:19 GMT""},{""version"":""v2"",""created"":""Wed, 8 Mar 1995 16:49:09 GMT""}]","2016-09-01"
"hep-ph/9502404",,"M. Thunman (Uppsala University) G. Ingelman (Uppsala University) P.
  Gondolo (LPTHE, Universite' de Paris VI-VII)","A Monte Carlo Calculation of Atmospheric Muon and Neutrino Fluxes","4 pages, uuencoded and gziped ps-file","Nucl.Phys.Proc.Suppl.43:274-277,1995","10.1016/0920-5632(95)00489-V","TSL/ISV-95-0112","hep-ph",,"  Production of muons and neutrinos in cosmic ray interactions with the
atmosphere has been investigated with a cascade simulation program based on
Lund Monte Carlo programs. The resulting `conventional' muon and neutrino
fluxes (from $\pi ,K$ decays) agree well with earlier calculations, whereas the
improved charm particle treatment used in this study gives significantly lower
`prompt' fluxes compared to earlier estimates. This implies better prospects
for detecting very high energy neutrinos from cosmic sources.
","[{""version"":""v1"",""created"":""Tue, 28 Feb 1995 09:47:00 GMT""}]","2010-11-01"
"hep-ph/9502405","Bernd J. Schroers","R.A. Leese, N.S. Manton and B.J. Schroers","Attractive Channel Skyrmions and the Deuteron","38 pages, latex, 9 figures","Nucl.Phys. B442 (1995) 228-267","10.1016/0550-3213(95)00052-6","DTP 94-47, NI 94037","hep-ph hep-th nucl-th",,"  The deuteron is described as a quantum state on a ten-dimensional manifold
$M_{10}$ of Skyrme fields of degree two, which are obtained by calculating the
holonomy of $SU(2)$ instantons. The manifold $M_{10}$ includes both toroidal
configurations of minimal energy and configurations which are approximately the
product of two Skyrmions in the most attractive relative orientation. The
quantum Hamiltonian is of the form $-\Delta +V$, where $\Delta$ is the
covariant Laplace operator on $M_{10}$ and $V$ is the potential which $M_{10}$
inherits from the Skyrme potential energy functional. Quantum states are
complex-valued functions on the double cover of $M_{10}$ satisfying certain
constraints. There is a unique bound state with the quantum numbers of the
deuteron, and its binding energy is approximately 6 MeV. Some of the deuteron's
electrostatic and magnetostatic properties are also calculated and compared
with experiment.
","[{""version"":""v1"",""created"":""Tue, 28 Feb 1995 11:48:36 GMT""}]","2016-09-01"
"hep-ph/9502406",,"E.A. Kuraev, Z.K. Silagadze","Once more about the $\omega \to 3\pi$ contact term","13 pages, LaTex, without some figures. To appear in Yad. Fiz.","Phys.Atom.Nucl.58:1589-1596,1995; Yad.Fiz.58N9:1687-1694,1995",,"BUDKERINP 93-52 (Novosibirsk)","hep-ph",,"  The manifestations of the $\omega \to 3\pi$ contact term and its unitary
partners are investigated in the framework of the chiral effective lagrangian
theory with vector mesons. We conclude that nowadays the existence and
magnitude of the contact term can be extracted neither from theory, nor
experiment. The theoretical uncertainty is caused by the one-loop corrections.
Some speculations about them lead to the generalized KSRF relation
$\frac{f_\pi^2g^2_{\rho \pi \pi}}{m_\rho^2}=\frac{m_K}{2\sqrt{2} \pi f_\pi}$.
","[{""version"":""v1"",""created"":""Tue, 28 Feb 1995 13:11:56 GMT""}]","2019-08-15"
"hep-ph/9502407",,"S.V.Goloskokov, S.P.Kuleshov, O.V.Selyugin","Supercritical Pomeron and eikonal representation of the diffraction
  scattering amplitude","LaTex text of the article + 1 Fig.1 in LaTex form","Mod.Phys.Lett. A10 (1995) 1959-1968","10.1142/S0217732395002106","IPNO/TH 95-12 FEBRUARY 1995","hep-ph",,"  The intercept of the supercritical Pomeron is examined with the use of
different forms of the scattering amplitudes of the bare Pomeron. The
one-to-one correspondence between the eikonal phase and the ratio of the
elastic and total cross section is shown. Based on new experimental data of the
CDF Collaboration, the intercept and power of the logarithmic growth of the
bare and total Pomeron amplitude are analyzed. It is shown that as a result of
the eikonalization procedure, the bare QCD Pomeron becomes compatible with
experiment.
","[{""version"":""v1"",""created"":""Tue, 28 Feb 1995 10:03:57 GMT""},{""version"":""v2"",""created"":""Wed, 1 Mar 1995 14:09:15 GMT""}]","2016-09-01"
"hep-ph/9502408","Kuang-Ta Chao","K.T. Chao","$\xi(2230)$ is likely to be a glueball","6 pages in Latex, talk presented at the CCAST Workshop on Tau-Charm
  Factory, Beijing, November 1994","Commun.Theor.Phys.24:373-376,1995","10.1088/0253-6102/24/3/373","PUTP-94-26","hep-ph",,"  On the basis of the recent results of $\xi(2230)\rightarrow \pi^+\pi^-, p\bar
p$ and $\xi(2230)\rightarrow K^+K^-,~K_SK_S$, measured by the BES Collaboration
in $J/\psi$ radiative decays, combined with the PS185 experiment of $p\bar
p\rightarrow \xi(2230)\rightarrow K\bar K$, we argue that because of its very
narrow partial decay widths to $\pi\pi$ and $K\bar K$ ( less than $1~MeV$ ),
its large production rate in $J/\psi$ radiative decays, and its flavor-
symmetric couplings to $\pi\pi$ and $K\bar K$, the $\xi(2230)$ is very likely
to be a $J^{PC}=(even)^{++}$ glueball.
","[{""version"":""v1"",""created"":""Tue, 28 Feb 1995 09:25:48 GMT""}]","2018-01-17"
"hep-ph/9502409","Kuang-Ta Chao","Y.B. Ding, K.T. Chao, and D.H. Qin","Possible effects of color screening and large string tension in heavy
  quarkonium spectrum","11 pages in Latex","Phys.Rev.D51:5064-5068,1995","10.1103/PhysRevD.51.5064","PUTP-94-08, to appear in Phys.Rev.D.","hep-ph",,"  Possible effects of the color screened confinement potential are
investigated. Color screened linear potential with a large string tension
$T=(0.26-0.32)GeV^2$ is suggested by a study of the $c\bar c$ and $b\bar b$
spectra. The $\psi (4160)$ and $\psi (4415)$ are respectively assigned as the
$\psi (4S)$-dominated and the $\psi (5S)$ $c\bar c$ states. Satisfactory
results for the masses and leptonic widths (with QCD radiative corrections) of
$c\bar c$ and $b\bar b$ states are obtained.
","[{""version"":""v1"",""created"":""Tue, 28 Feb 1995 09:02:46 GMT""}]","2016-09-01"
"hep-ph/9502410","Kuang-Ta Chao","N.G. Chen and K.T. Chao","The quark axial vector coupling and heavy meson decays","11 pages in Latex","Phys.Lett. B345 (1995) 67-73","10.1016/0370-2693(94)01578-Z","PUTP-94-10, to appear in Phys. Lett. B.","hep-ph",,"  Form factors and decay widths for $D^{\ast}\rightarrow D \gamma$ and
$D^{\ast}\rightarrow D \pi$ decays are estimated in a relativistic constituent
quark model. Relativistic corrections due to light quarks are found to be
substantial and to suppress the vector and axial vector form factors. The CLEO
experimental value of $R^0_{\gamma}\equiv \Gamma (D^{\ast 0}\rightarrow D^{0}
\gamma)/ \Gamma (D^{\ast 0}\rightarrow D^{0} \pi^{0})=0.572\pm 0.057\pm 0.081$
is used to determine the quark axial vector coupling $g_A$, which is found to
be $0.6-0.8$ for $m_u=(350-200) MeV$ correspondingly, as compared with the
chiral model result $g_{A}= 0.8-0.9$. The heavy meson-pion strong coupling $g$
is found to be $0.4-0.6$, much smaller than $g=1$ which is expected in the
large $N_{C}$ and nonrelativistic limit, but consistent with some heavy hadron
chiral theory and QCD sum rule results. The failure of nonrelativistic
treatment for the light quark in the heavy meson decays is also emphasized.
","[{""version"":""v1"",""created"":""Tue, 28 Feb 1995 09:08:52 GMT""}]","2016-09-01"
"hep-ph/9502411","Kuang-Ta Chao","J.Tang, J.H.Liu, and K.T.Chao","Hadronic matrix elements and radiative $B\to K^{*}\gamma$ decay","17 pages in Latex","Phys.Rev. D51 (1995) 3501-3509","10.1103/PhysRevD.51.3501","PUTP-94-06 (revised),to appear in Phys.Rev.D.","hep-ph",,"  Within the standard model, we calculate the radiative $B\rightarrow
K^{\star}\gamma$ decay rate based on a Bethe-Salpeter description for the meson
wave functions and the hadronic matrix elements. With a reasonable choice of
parameters the branching ratio BR($B \rightarrow K^{\star}\gamma$) is found to
be $(3.8-4.6)\times 10^{-5}$, which is in agreement with the CLEO experimental
data. We also find with $m_{b}=5.12 GeV$ the ratio $R\equiv {\Gamma
(B\rightarrow K^{\star}\gamma )}/{\Gamma (b\rightarrow s\gamma )}=(10-12)\%$,
which can be slightly larger if a smaller $m_{b}$ is chosen. In this approach,
the light degrees of freedom in mesons are treated as light constituent quarks
with relativistic kinematics, and the form factors in the decay amplitude are
essentially determined by the relativistic kenematics and the overlap of wave
functions of the initial and final state mesons. Due to the large recoil
momentum of the $K^{\star}$ meson at the $B$ meson rest frame, the form factors
are sensitive to the overlap integral of the meson wave functions, which are
determined dynamically by a QCD-motivated inter-quark potential. Relativistic
effects on the meson wave functions mainly due to the Breit-Fermi interactions
are found to be significant in determining the decay rate.
","[{""version"":""v1"",""created"":""Tue, 28 Feb 1995 09:02:24 GMT""}]","2016-09-01"
"hep-ph/9502412",,"B.L.Ioffe, A.Oganesian","Gluon Distributions in Real and Virtual Photon and the Photon Structure
  Function","25 pages, 19 figs. can be received by request","Z.Phys. C69 (1995) 119-130",,"ITEP-15 (1995)","hep-ph",,"  Gluon distributions in real and virtual photons are calculated using
evolution equations in the NLO approximation. The quark distributions in the
photon determined on the basis of the QCD sum rule approach in ref.[1] are
taken as an input. It is shown that gluon distribution in the photon can be
reliably determined up to $x = 0.03 \div 0.05$ much lower than the
corresponding values in the case of quark distributions.Two variants of the
calculations are considered: (1) it is assumed that there are no intrinsic
gluons in the photon at some low normalization point $Q^2 = Q^2_0 \sim 1
GeV^2$; (2) it is assumed that gluonic content of the photon at low $Q^2_0$ is
described by gluonic content of vector mesons $\rho, \omega, \varphi$. The
gluon distributions in these two variants appear to be different. This fact
permits one to clarify the origin of nonperturbative gluonic content of the
photon by comparing the results with experiment. Structure functions $F_2(x)$
for real and virual photon are calculated and it is shown that in the region $x
\geq 0.2$ where QCD approach is valid, there is a good agreement with
experiment.
","[{""version"":""v1"",""created"":""Tue, 28 Feb 1995 14:59:01 GMT""}]","2019-08-17"
"hep-ph/9502413",,"G.H.Arakelyan, P.E.Volkovitsky","Charmed particle production in hadron-hadron collision","Latex,19 pages, 12figs. can be received by request","Z.Phys. A353 (1995) 87-101","10.1007/BF01297731","YERPHI-1435(5)-95","hep-ph",,"  In the framework of Quark--Gluon--String Model developed recently in ITEP we
calculate spectra of charmed particles $D$, $D_s$, $\Lambda_c$, $\Xi_c$,
$\Omega_c$ in hadron--hadron collisions taking into account the decays of
$S$--wave resonances like $D^*$, $D^*_s$, $\Sigma_c$, $\Sigma^*_c$, $\Xi^*_c$,
$\Xi'_c$, and $\Omega^*_c$. We describe the bulk of the existing data on $D$,
$D^*$, and $\Lambda_c$ production in $\pi p$ and $pp$ collisions and predict
the yield of charmed particles in $\Sigma^-p$ and $\Xi^-p$ reactions at hyperon
beam energies of $340\;GeV/c$ and $600\;GeV/c$. Because of significant
production of baryon resonances our predictions for unfavored fragmentation
differ from predictions of other models which do not take resonance production
into account.
","[{""version"":""v1"",""created"":""Tue, 28 Feb 1995 15:56:15 GMT""}]","2019-08-17"
"hep-ph/9502414","My Account","J. Lopez, D. Nanopoulos, and A. Zichichi","A string no-scale supergravity model and its experimental consequences","10 pages, LaTeX, 3 figures (included)","Phys.Rev.D52:4178-4182,1995","10.1103/PhysRevD.52.4178","CTP-TAMU-06/95","hep-ph hep-th",,"  We propose a string-derived model based on the gauge group $SU(5)\times U(1)$
which satisfies the stringent constraints from no-scale supergravity, allows
gauge coupling unification at the string scale, and entails previously
unexplored correlations among various sectors of the model. All supersymmetric
observables are given in terms of a single mass parameter with self-consistency
of the model determining the rest, including $\tan\beta=2.2-2.3$ and
$m_t\approx175\GeV$. A small non-universality of the scalar masses at the
string scale produces a downward shift in the right-handed slepton masses at
the electroweak scale, such that for $m_{1/2}\gsim180\GeV$ these particles
become lighter than the lightest neutralino. This cutoff in the parameter space
entails the imminent discovery of charginos at the Tevatron via trilepton
events ($m_{\chi^\pm_1}<90\GeV$). Also, the lightest Higgs boson
($m_h<90\GeV$), the lightest chargino, and the right-handed sleptons
($m_{\tilde\ell_R}<50\GeV$) should be readily observable at LEPII. We also
discuss the model predictions for $B(b\to s\gamma)$, $(g-2)_\mu$, $R_b$, and
the prospects for direct neutralino dark matter detection.
","[{""version"":""v1"",""created"":""Tue, 28 Feb 1995 15:16:41 GMT""}]","2016-09-01"
"hep-th/9502147",,"A. Brandhuber, S. Emery, K. Landsteiner and M. Schweda","The three-dimensional BF Model with Cosmological Term in the Axial Gauge","one reference added, transmission errors corrected","Helv.Phys.Acta 68 (1995) 126-138",,,"hep-th",,"  We quantize the three-dimensional $BF$-model using axial gauge conditions.
Exploiting the rich symmetry-structure of the model we show that the
Green-functions correspond to tree graphs and can be obtained as the unique
solution of the Ward-Identities. Furthermore, we will show that the theory can
be uniquely determined by symmetry considerations without the need of an action
principle.
","[{""version"":""v1"",""created"":""Mon, 27 Feb 1995 17:17:01 GMT""},{""version"":""v2"",""created"":""Tue, 7 Mar 1995 14:56:08 GMT""}]","2016-09-06"
"hep-th/9502152","Kalmykov M. Yu","M. Yu. Kalmykov","Gauge and parametrization dependencies of the one-loop counterterms in
  the Einstein gravity.","14 pages in LATEX (Some references added)","Class.Quant.Grav.12:1401-1412,1995","10.1088/0264-9381/12/6/007",,"hep-th gr-qc",,"  The parametrization and gauge dependencies of the one-loop counterterms on
the mass-shell in the Einstein gravity are investigated. The physical meaning
of the loop calculation results on the mass shell and the parametrization
dependence of the renormgroup functions in the nonrenormalizable theories are
discussed.
","[{""version"":""v1"",""created"":""Mon, 27 Feb 1995 22:36:54 GMT""},{""version"":""v2"",""created"":""Wed, 29 Mar 1995 15:49:45 GMT""},{""version"":""v3"",""created"":""Thu, 30 Mar 1995 11:16:58 GMT""}]","2010-04-06"
"hep-th/9502153","Ioannis Giannakis","Ioannis Giannakis, D. V. Nanopoulos and Kajia Yuan,","Number of Generations in Free Fermionic String Models,","17 pages, Plain Tex, no figures.","Phys. Rev. D 52, 1026 (1995)","10.1103/PhysRevD.52.1026",,"hep-th hep-ph",,"  In string theory there seems to be an intimate connection between spacetime
and world-sheet physics. Following this line of thought we investigate the
family problem in a particular class of string solutions, namely the free
fermionic string models. We find that the number of generations $N_g$ is
related to the index of the supersymmetry generator of the underlying $N=2$
internal superconformal field theory which is always present in any $N=1$
spacetime supersymmetric string vacuum. We also derive a formula for the index
and thus for the number of generations which is sensitive to the boundary
condition assignments of the internal fermions and to certain coefficients
which determine the weight with which each spin-structure of the model
contributes to the one-loop partition function. Finally we apply our formula to
several realistic string models in order to derive $N_g$ and we verify our
results by constructing explicitly the massless spectrum of these string
models.
","[{""version"":""v1"",""created"":""Tue, 28 Feb 1995 00:13:03 GMT""}]","2016-08-24"
"hep-th/9502154",,"V. I. Man'ko, G. Marmo, and F. Zaccaria","q-NONLINEARITY, DEFORMATIONS AND PLANCK DISTRIBUTION","21 pages, LATEX",,,"Naples University Preprint INFN-IV-49/94, DSF-T-49/94","hep-th",,"  q-deformed nonlinear field equations are constructed including Klein-Gordon
and Maxwell equations. The q-deformation is interpreted as mathematical
structure describing specific nonlinearity for which frequency of vibration
exponentially depends on the energy
","[{""version"":""v1"",""created"":""Mon, 27 Feb 1995 17:23:37 GMT""}]","2016-09-06"
"hep-th/9502156","Lorenzo Magnea","P. Di Vecchia, A. Lerda, L. Magnea, R. Marotta","Gauge theory renormalizations from the open bosonic string","14 pages, latex, no figures","Phys.Lett.B351:445-454,1995","10.1016/0370-2693(95)00414-G","DFTT 17/95, NORDITA 95/13-P","hep-th hep-ph",,"  We present a unified point of view on the different methods available in the
literature to extract gauge theory renormalization constants from the
low-energy limit of string theory. The Bern-Kosower method, based on an
off-shell continuation of string theory amplitudes, and the construction of
low-energy string theory effective actions for gauge particles, can both be
understood in terms of strings interacting with background gauge fields, and
thus reproduce, in the low-energy limit, the field theory results of the
background field method. We present in particular a consistent off-shell
continuation of the one-loop gluon amplitudes in the open bosonic string that
reproduces exactly the results of the background field method in the Feynman
gauge.
","[{""version"":""v1"",""created"":""Tue, 28 Feb 1995 09:39:38 GMT""}]","2008-11-26"
"hep-th/9502157","Manfred Stingl","M. Stingl (University of Muenster, Germany)","A Systematic Extended Iterative Solution for QCD","48 pages (figures included). Scope of replacement: correction of a
  technical defect; no changes in content","Z.Phys.A353:423-445,1996","10.1007/BF01285154","MS-TPI-94-13","hep-th",,"  An outline is given of an extended perturbative solution of Euclidean QCD
which systematically accounts for a class of nonperturbative effects, while
allowing renormalization by the perturbative counterterms. Proper vertices
Gamma are approximated by a double sequence Gamma[r,p], with r the degree of
rational approximation w.r.t. the QCD mass scale Lambda, nonanalytic in the
coupling g, and p the order of perturbative corrections in g-squared,
calculated from Gamma[r,0] - rather than from the perturbative Feynman rules
Gamma(0)(pert) - as a starting point. The mechanism allowing the
nonperturbative terms to reproduce themselves in the Dyson-Schwinger equations
preserves perturbative renormalizability and is tied to the divergence
structure of the theory. As a result, it restricts the self-consistency problem
for the Gamma[r,0] rigorously - i.e. without decoupling approximations - to the
superficially divergent vertices. An interesting aspect of the scheme is that
rational-function sequences for the propagators allow subsequences describing
short-lived excitations. The method is calculational, in that it allows known
techniques of loop computation to be used while dealing with integrands of
truly nonperturbative content.
","[{""version"":""v1"",""created"":""Tue, 28 Feb 1995 11:31:38 GMT""},{""version"":""v2"",""created"":""Sat, 30 Dec 1995 09:50:40 GMT""},{""version"":""v3"",""created"":""Tue, 29 Oct 1996 09:32:38 GMT""}]","2014-11-18"
"hep-th/9502158","Shinji Hamamoto","Shinji HAMAMOTO (Toyama Univ.)","Gauging Higher Derivatives","12 pages, LaTex.","Prog.Theor.Phys. 94 (1995) 105-116","10.1143/ptp/94.1.105",,"hep-th",,"  The usual prescription for constructing gauge-invariant Lagrangian is
generalized to the case where a Lagrangian contains second derivatives of
fields as well as first derivatives. Symmetric tensor fields in addition to the
usual vector fields are introduced as gauge fields. Covariant derivatives and
gauge-field strengths are determined.
","[{""version"":""v1"",""created"":""Tue, 28 Feb 1995 13:16:00 GMT""}]","2017-02-01"
"hep-th/9502159","Shogo Tanimura","Shogo Tanimura","Topology and Inequivalent Quantizations of Abelian Sigma Model","4 pages, Latex (proceedings of Second Pasific Winter School for
  Theoretical Physics held at Sorak Mountain in Korea in January 1995)",,,"DPNU-95-06","hep-th",,"  The abelian sigma model in (1+1) dimensions is a field theoretical model
which has a field $ \phi : S^1 \to S^1 $. An algebra of the quantum field is
defined respecting the topological aspect of the model. It is shown that the
zero-mode has an infinite number of inequivalent quantizations. It is also
shown that when a central extension is introduced into the algebra, the winding
operator and the momenta operators satisfy anomalous commutators.
","[{""version"":""v1"",""created"":""Tue, 28 Feb 1995 14:04:42 GMT""}]","2016-09-06"
"hep-th/9502160","Wolfgang Eholzer","Wolfgang Eholzer","Fusion Algebras and Characters of Rational Conformal Field Theories","87 pages, AMS TeX, one postscript figure, one exceptional case added
  to Main theorem 2, some typos corrected",,,"PhD thesis, BONN-IR-95-10","hep-th",,"  We introduce the notion of (nondegenerate) strongly-modular fusion algebras.
Here strongly-modular means that the fusion algebra is induced via Verlinde's
formula by a representation of the modular group whose kernel contains a
congruence subgroup. Furthermore, nondegenerate means that the conformal
dimensions of possibly underlying rational conformal field theories do not
differ by integers. Our first main result is the classification of all
strongly-modular fusion algebras of dimension two, three and four and the
classification of all nondegenerate strongly-modular fusion algebras of
dimension less than 24. Secondly, we show that the conformal characters of
various rational models of W-algebras can be determined from the mere knowledge
of the central charge and the set of conformal dimensions. We also describe how
to actually construct conformal characters by using theta series associated to
certain lattices. On our way we develop several tools for studying
representations of the modular group on spaces of modular functions. These
methods, applied here only to certain rational conformal field theories, are in
general useful for the analysis rational models.
","[{""version"":""v1"",""created"":""Tue, 28 Feb 1995 15:08:19 GMT""},{""version"":""v2"",""created"":""Mon, 8 May 1995 07:00:27 GMT""}]","2009-09-25"
"hep-th/9502162","D'Hoker","Eric D'Hoker","Invariant Effective Actions, Cohomology of Homogeneous Spaces and
  Anomalies","30 pages, Plain TeX, no figures.","Nucl.Phys. B451 (1995) 725-748","10.1016/0550-3213(95)00265-T","UCLA/95/TEP/5","hep-th hep-ph",,"  We construct the most general local effective actions for Goldstone boson
fields associated with spontaneous symmetry breakdown from a group $G$ to a
subgroup $H$. In a preceding paper, it was shown that any $G$-invariant term in
the action, which results from a non-invariant Lagrangian density, corresponds
to a non-trivial generator of the de Rham cohomology classes of $G/H$. Here, we
present an explicit construction of all the generators of this cohomology for
any coset space $G/H$ and compact, connected group $G$. Generators contributing
to actions in 4-dimensional space-time arise either as products of generators
of lower degree such as the Goldstone-Wilczek current, or are of the
Wess-Zumino-Witten type. The latter arise if and only if $G$ has a non-zero
$G$-invariant symmetric $d$-symbol, which vanishes when restricted to the
subgroup $H$, i.e. when $G$ has anomalous representations in which $H$ is
embedded in an anomaly free way. Coupling of additional gauge fields leads to
actions whose gauge variation coincides with the chiral anomaly, which is
carried here by Goldstone boson fields at tree level. Generators contributing
to actions in 3-dimensional space-time arise as Chern-Simons terms evaluated on
connections that are composites of the Goldstone field.
","[{""version"":""v1"",""created"":""Tue, 28 Feb 1995 02:28:40 GMT""}]","2016-09-06"
"hep-th/9502164","Giovanni Felder","Giovanni Felder, Alexander Varchenko","Remarks on the structure constants of the Verlinde algebra associated to
  $sl_3$","5 pages, AmsTeX, 1 figure available on request","Lett.Math.Phys.37:167-171,1996","10.1007/BF00416019",,"hep-th",,"  The structure constants $N_{\lambda, \mu}^{\mu+\nu}$ of the $sl_2$ Verlinde
algebra as functions of $\mu$ either vanish or can be expressed after a change
of variable as the weight function of an irreducible representation of $sl_2$.
We give a similar formula in the $sl_3$ case.
","[{""version"":""v1"",""created"":""Tue, 28 Feb 1995 13:03:10 GMT""}]","2016-09-06"
