"hep-th/9502165","Giovanni Felder","Giovanni Felder and Alexander Varchenko","Integral representation of solutions of the elliptic
  Knizhnik--Zamolodchikov--Bernard equations","12 pages, AmsLaTex; some misprints were corrected","Int. Math. Res. Notices (1995) 221-233",,,"hep-th",,"  We give an integral representation of solutions of the elliptic
Knizhnik-Zamolodchikov-Bernard equations for arbitrary simple Lie algebras. If
the level is a positive integer, we obtain formulas for conformal blocks of the
WZW model on a torus. The asymptotics of our solutions at critical level gives
eigenfunctions of Euler-Calogero-Moser integrable $N$-body systems. As a
by-product, we obtain some remarkable integral identities involving classical
theta functions.
","[{""version"":""v1"",""created"":""Tue, 28 Feb 1995 13:05:04 GMT""},{""version"":""v2"",""created"":""Fri, 19 May 1995 05:35:40 GMT""}]","2008-02-03"
"nucl-th/9502045","Ulrich Mosel","U. Mosel (University of Giessen)","Dilepton Production in Elementary Processes on the Nucleon","Figures available from author by fax",,"10.1142/9789814447195_0006","UGI-95-02","nucl-th hep-ph",,"  We study elementary processes for production of dileptons from nucleons,
either through NN bremsstrahlung or through photon-induced reactions. We
emphasize the dependence of the expected cross-sections on the electromagnetic
formfactor of the nucleon in the time-like regime and point out that the
mentioned reactions can provide important information on the validity of vector
meson dominance for the nucleon. We also study the off-shell dependence of the
formfactors.
","[{""version"":""v1"",""created"":""Tue, 28 Feb 1995 09:45:01 GMT""}]","2016-11-03"
"nucl-th/9502046",,"R.Anni and G.Co'","Mean-field description of nuclear charge density distributions.","15 pages, TeX, 7 figures available upon request",,"10.1016/0375-9474(95)00067-B","UNI-LE-FIS-TH-02-95-1 (to appear in Nucl. Phys. A)","nucl-th",,"  We propose a method to extract nuclear charge distributions from elastic
electron scattering data based upon a mean field approach. The nuclear charge
distributions are generated by solving the Schroedinger equation with a
mean-field potential expanded in terms of Hermite functions. The coefficients
of the potential are changed in order to obtain the best fit with the cross
section data. Applications to the $^{12}C$, $^{16}O$ $^{40}Ca$ and $^{208}Pb$
nuclei are presented.
","[{""version"":""v1"",""created"":""Tue, 28 Feb 1995 13:32:57 GMT""}]","2016-09-08"
"q-alg/9502019","Mariano A. del Olmo","A. Ballesteros, F.J. Herranz, M.A. del Olmo and M. Santander","A New Null-Plane Quantum Poincare Algebra","13 pages, LaTeX","Phys.Lett. B351 (1995) 137-145","10.1016/0370-2693(95)00386-Y","UVA/950201","q-alg math.QA",,"  A new quantum deformation, which we call null-plane, of the (3+1) Poincar\'e
algebra is obtained. The algebraic properties of the classical null-plane
description are generalized to this quantum deformation. In particular, the
classical isotopy subalgebra of the null-plane is deformed into a Hopf
subalgebra, and deformed spin operators having classical commutation rules can
be defined. Quantum Hamiltonian, mass and position operators are studied, and
the null-plane evolution is expressed in terms of a deformed Schr\""odinger
equation.
","[{""version"":""v1"",""created"":""Tue, 28 Feb 1995 12:19:51 GMT""}]","2009-10-28"
"quant-ph/9502027","Hagen Kleinert","H. Kleinert and I. Mustapic (Institut f\""ur Theoretische Physik Freie
  Universit\""at Berlin)","Decay Rates of Metastable States in Cubic Potential by Variational
  Perturbation Theory",,"Int.J.Mod.Phys.A11:4383-4400,1996","10.1142/S0217751X96002029",,"quant-ph",,"  Variational perturbation theory is used to determine the decay rates of
metastable states across a cubic barrier of arbitrary height. For high
barriers, a variational resummation procedure is applied to the complex energy
eigenvalues obtained from a WKB expansion; for low barriers, the variational
resummation procedure converts the non-Borel-summable
Rayleigh-Schr\""o\-din\-ger expansion into an exponentially fast convergent one.
The results in the two regimes match and yield very accurate imaginary parts of
the energy eigenvalues. This is demonstrated by comparison with the complex
eigenvalues from solutions of the Schr\""odinger equation via the
complex-coordinate rotation method.
","[{""version"":""v1"",""created"":""Tue, 28 Feb 1995 07:51:23 GMT""}]","2016-08-15"
"supr-con/9502003","Oleg Sushkov","M.Yu. Kuchiev and O. P. Sushkov","Two-hole bound states in modified t-J model","LaTeX 9 pages",,"10.1103/PhysRevB.52.12977",,"supr-con cond-mat.supr-con",,"  We consider modified $t-J$ model with minimum of single-hole dispersion at
the points $(0,\pm \pi)$, $(\pm \pi,0)$. It is shown that two holes on
antiferromagnetic background produce a bound state which properties strongly
differs from the states known in the unmodified $t-J$ model. The bound state is
d-wave, it has four nodes on the face of the magnetic Brillouin zone. However,
in the coordinate representation it looks like as usual s-wave.
","[{""version"":""v1"",""created"":""Tue, 28 Feb 1995 02:54:56 GMT""}]","2016-09-08"
