"math/9504230","Greg Kuperberg","Greg Kuperberg","A volume-preserving counterexample to the Seifert conjecture",,"Comment. Math. Helv. 71 (1996), no. 1, 70-97",,"Kuperberg migration 11/2004","math.DS",,"  We prove that every 3-manifold possesses a $C^1$, volume-preserving flow with
no fixed points and no closed trajectories. The main construction is a
volume-preserving version of the Schweitzer plug. We also prove that every
3-manifold possesses a volume-preserving, $C^\infty$ flow with discrete closed
trajectories and no fixed points (as well as a PL flow with the same geometry),
which is needed for the first result. The proof uses a Dehn-twisted Wilson-type
plug which also preserves volume.
","[{""version"":""v1"",""created"":""Sat, 29 Apr 1995 00:00:00 GMT""}]","2009-09-25"
