"nucl-th/9503009",,"L.C. Liu, Q. Haider, and J.T. Londergan","Composite vertices that lead to soft form factors","REVTex, 19 pages, 5 figs(to be provided on request)","Phys.Rev.C51:3427-3434,1995","10.1103/PhysRevC.51.3427","LA-UR-95-0003 (Los Alamos Nat'l Laboratory)","nucl-th",,"  The momentum-space cut-off parameter $\Lambda$ of hadronic vertex functions
is studied in this paper. We use a composite model where we can measure the
contributions of intermediate particle propagations to $\Lambda$. We show that
in many cases a composite vertex function has a much smaller cut-off than its
constituent vertices, particularly when light constituents such as pions are
present in the intermediate state. This suggests that composite
meson-baryon-baryon vertex functions are rather soft, i.e., they have \Lambda
considerably less than 1 GeV. We discuss the origin of this softening of form
factors as well as the implications of our findings on the modeling of nuclear
reactions.
","[{""version"":""v1"",""created"":""Thu, 9 Mar 1995 17:09:48 GMT""}]","2016-09-08"
"nucl-th/9503010",,"C. Alexandrou and F. K. Diakonos","Nonperturbative treatment of the N-body system with dynamical mesons","35 pages PostScript","Z.Phys. A353 (1995) 149-165","10.1007/BF01295893","UCY-PHY-94/9","nucl-th",,"  The variational approach, used by Feynman in the study of the polaron
problem, is generalized to treat a system of N non-relativistic particles
interacting with scalar and vector mesons. After integrating out the meson
fields in the path integral formulation we perform a variational calculation
for the effective N-body two-time action to obtain the energy and the mass of
the system. The interplay of self energies and exchange terms in attaining
binding and saturation is examined. We estimate the size of the particles in
the medium and give the mean number of mesons as a function of N.
","[{""version"":""v1"",""created"":""Thu, 9 Mar 1995 16:31:34 GMT""}]","2015-06-26"
"nucl-th/9503011",,"Ulf-G. Mei{\ss}ner, E. Oset, A. Pich","CHIRAL SYMMETRY CONSTRAINTS ON THE $K^+$ INTERACTION WITH THE NUCLEAR
  PION CLOUD","11 pp, LaTeX file, 4 figures (appended as compressed tar files, uses
  epsf.sty)","Phys.Lett. B353 (1995) 161-167","10.1016/0370-2693(95)00592-9","FTUV/95-11, IFIC/95-11 and TK 95 06","nucl-th hep-ph",,"  The real part of the $K^{+}$ selfenergy for the interaction of the $K^{+}$
with the pion nuclear cloud is evaluated in lowest order of chiral perturbation
theory and is found to be exactly zero in symmetric nuclear matter. This
removes uncertainties in that quantity found in former phenomenological
analyses and is supported by present experimental data on $K^{+}$ nucleus
scattering.
","[{""version"":""v1"",""created"":""Fri, 10 Mar 1995 13:54:07 GMT""}]","2016-09-08"
"q-alg/9503004",,"M. Bordemann, M. Brischle, C. Emmrich, S. Waldmann","Phase Space Reduction for Star-Products: An Explicit Construction for
  CP^n","LaTeX, 17 pages",,"10.1007/BF00714403","FR-THEP-95/6","q-alg dg-ga hep-th math.DG math.QA",,"  We derive a closed formula for a star-product on complex projective space and
on the domain $SU(n+1)/S(U(1)\times U(n))$ using a completely elementary
construction: Starting from the standard star-product of Wick type on $C^{n+1}
\setminus \{ 0 \}$ and performing a quantum analogue of Marsden-Weinstein
reduction, we can give an easy algebraic description of this star-product.
Moreover, going over to a modified star-product on $C^{n+1} \setminus \{ 0 \}$,
obtained by an equivalence transformation, this description can be even further
simplified, allowing the explicit computation of a closed formula for the
star-product on $\CP^n$ which can easily transferred to the domain
$SU(n+1)/S(U(1)\times U(n))$.
","[{""version"":""v1"",""created"":""Thu, 9 Mar 1995 21:46:21 GMT""}]","2016-09-08"
"quant-ph/9503013","K. Berndl","K. Berndl, D. D\""urr (LMU Munich), S. Goldstein (Rutgers), G. Peruzzi
  (Florence), and N. Zangh\`{\i} (Genova)","On the Global Existence of Bohmian Mechanics","35 pages, LaTex","Commun.Math.Phys. 173 (1995) 647-674","10.1007/BF02101660","gk-mp-9408/8 (To appear in Comm. Math. Phys.)","quant-ph",,"  We show that the particle motion in Bohmian mechanics, given by the solution
of an ordinary differential equation, exists globally: For a large class of
potentials the singularities of the velocity field and infinity will not be
reached in finite time for typical initial values. A substantial part of the
analysis is based on the probabilistic significance of the quantum flux. We
elucidate the connection between the conditions necessary for global existence
and the self-adjointness of the Schr\""odinger Hamiltonian.
","[{""version"":""v1"",""created"":""Thu, 9 Mar 1995 17:58:58 GMT""}]","2016-08-15"
