"alg-geom/9503003","Viacheslav Nikulin","Viacheslav V. Nikulin","Reflection groups in hyperbolic spaces and the denominator formula for
  Lorentzian Kac--Moody Lie algebras","Some corrections in Sects. 2.1, 2.2 were done. They don't reflect on
  results and ideas. 31 pages, no figures. AMSTeX",,"10.1070/IM1996v060n02ABEH000072",,"alg-geom hep-th math.AG math.QA q-alg",,"  This is a continuation of our ""Lecture on Kac--Moody Lie algebras of the
arithmetic type"" \cite{25}.
  We consider hyperbolic (i.e. signature $(n,1)$) integral symmetric bilinear
form $S:M\times M \to {\Bbb Z}$ (i.e. hyperbolic lattice), reflection group
$W\subset W(S)$, fundamental polyhedron $\Cal M$ of $W$ and an acceptable
(corresponding to twisting coefficients) set $P({\Cal M})\subset M$ of vectors
orthogonal to faces of $\Cal M$ (simple roots). One can construct the
corresponding Lorentzian Kac--Moody Lie algebra ${\goth g}={\goth
g}^{\prime\prime}(A(S,W,P({\Cal M})))$ which is graded by $M$.
  We show that $\goth g$ has good behavior of imaginary roots, its denominator
formula is defined in a natural domain and has good automorphic properties if
and only if $\goth g$ has so called {\it restricted arithmetic type}. We show
that every finitely generated (i.e. $P({\Cal M})$ is finite) algebra ${\goth
g}^{\prime\prime}(A(S,W_1,P({\Cal M}_1)))$ may be embedded to ${\goth
g}^{\prime\prime}(A(S,W,P({\Cal M})))$ of the restricted arithmetic type. Thus,
Lorentzian Kac--Moody Lie algebras of the restricted arithmetic type is a
natural class to study.
  Lorentzian Kac--Moody Lie algebras of the restricted arithmetic type have the
best automorphic properties for the denominator function if they have {\it a
lattice Weyl vector $\rho$}. Lorentzian Kac--Moody Lie algebras of the
restricted arithmetic type with generalized lattice Weyl vector $\rho$ are
called {\it elliptic}
","[{""version"":""v1"",""created"":""Fri, 10 Mar 1995 12:35:58 GMT""},{""version"":""v2"",""created"":""Sat, 11 Mar 1995 11:33:20 GMT""},{""version"":""v3"",""created"":""Mon, 20 Mar 1995 10:17:42 GMT""},{""version"":""v4"",""created"":""Mon, 27 Mar 1995 11:59:57 GMT""},{""version"":""v5"",""created"":""Sun, 17 Sep 1995 18:19:44 GMT""},{""version"":""v6"",""created"":""Sat, 14 Oct 1995 18:25:43 GMT""}]","2015-06-24"
"astro-ph/9503041","Randall Splinter","R.J. Splinter (University of Kentucky)","A Nested Grid Particle-Mesh Code for High Resolution Simulations of
  Gravitational Instability in Cosmology","13 pages, 10 figures included, uses mn.sty & epsf.sty. Accepted by
  MNRAS. This is the final refereed version","Mon.Not.Roy.Astron.Soc. 281 (1996) 281","10.1093/mnras/281.1.281",,"astro-ph",,"  I describe a nested-grid particle-mesh (NGPM) code designed to study
gravitational instability in three-dimensions. The code is based upon a
standard PM code. Within the parent grid I am able to define smaller sub-grids
allowing us to substantially extend the dynamical range in mass and length. I
treat the fields on the parent grid as background fields and utilize a one-way
interactive meshing. Waves on the coarse parent grid are allowed to enter and
exit the subgrid, but waves from the subgrid are precluded from effecting the
dynamics of the parent grid. On the parent grid the potential is computed using
a standard multiple Fourier transform technique. On the subgrid I use a Fourier
transform technique to compute the subgrid potential at high resolution. I
impose quasi-isolated boundary conditions on the subgrid using the standard
method for generating isolated boundary conditions, but rather than using the
isolated Green function I use the Ewald method to compute a Green function on
the subgrid which possesses the full periodicity of the parent grid. I present
a detailed discussion of my methodology and a series of code tests.
","[{""version"":""v1"",""created"":""Fri, 10 Mar 1995 01:00:30 GMT""},{""version"":""v2"",""created"":""Mon, 3 Jun 1996 11:17:52 GMT""}]","2015-06-24"
"astro-ph/9503042","Edmund Bertschinger","Robert C. Ferrell and Edmund Bertschinger","A Parallel Processing Algorithm for Computing Short-Range Particle
  Forces with Inhomogeneous Particle Distributions","8 pages of uuencoded compressed postscript, figures included, to be
  published in Proceedings of the 1995 Society for Computer Simulation
  Multiconference, April 1995.",,,"GC3-031","astro-ph comp-gas nlin.CG",,"  We present a computational algorithm for computing short range forces between
particles. The algorithm has two distinguishing features. First, it is
optimized for multi-processor computers, and will use as many processors as are
available. Second, it is optimized for inhomogeneous, dynamic particle
distributions; for any distribution the computational load is distributed
evenly to all processors, and the communication time is less than 15\% of the
total run time.
  In this talk we present our new algorithm. We developed the program for a
grand-challenge problem in cosmology, simulation of the formation of
large-scale structure in the universe. This simulation, run on the Thinking
Machines Corporation CM-5, uses the particle-particle/particle-mesh (PPPM)
\cite{hock_east} algorithm. The particle-particle phase is computed using the
algorithm we describe in this paper. We discuss this and other applications.
","[{""version"":""v1"",""created"":""Fri, 10 Mar 1995 03:11:27 GMT""}]","2008-02-03"
"astro-ph/9503043","Michal Jaroszynski","M. Jaroszynski (Warsaw Obs.) and B. Paczynski (Princeton Obs.)","DIFFRACTION EFFECTS IN MICROLENSING OF Q2237+0305","10 pages, plain TEX file, no figures. Submitted to ApJ postscript
  available at by anonymous ftp at
  ftp://astro.princeton.edu/library/preprint/pop615.ps.Z",,"10.1086/176593","Princeton POPe615","astro-ph",,"  Geometrical optics provides an excellent description for quasar images
crossing caustics which are formed by gravitational microlensing of objects
like Q2237+0305. Within this approximation the source size can be estimated
from the maximum magnification reached at caustic crossings. We evaluate the
limitations imposed by diffraction on caustics using the formalism developed by
Ulmer & Goodman (1995). Close to a caustic a new characteristic length, smaller
that the Fresnel length, enters the problem, limiting the angular resolution to
about 0.2 pico arcsecond, or equivalently about 3*10^9 cm at the source. To
achieve this resolution the brightness must be monitored at time intervals of a
few seconds. If a significant fraction of quasar luminosity comes from sources
smaller than those limits then interference effects would make the observed
intensity oscillate, in a close analogy with a two slit experiment. The
characteristic period of such oscillations is expected to be about one tenth of
a minute. If such oscillations are detected then photometry carried out at a
single site may permit the determination of the caustic transverse velocity,
and therefore may permit a direct conversion of the time units of brightness
variations to the linear units at the source. Subject headings: Gravitational
lensing - dark matter - quasars: structure -quasars: Q2237+0305
","[{""version"":""v1"",""created"":""Fri, 10 Mar 1995 10:03:47 GMT""}]","2016-08-30"
"astro-ph/9503044","Ulrich Lindner","Ulrich Lindner, Jaan Einasto, Maret Einasto, Wolfram Freudling, Klaus
  Fricke, Erik Tago","The Structure of Supervoids -- I: Void Hierarchy in the Northern Local
  Supervoid","21 Pages, uuencoded postscript (text only) , postscript with all
  figures included is available on request or at
  http://www.uni-sw.gwdg.de/~ulindner/preprints.html or anonymous ftp at
  ftp://eden.uni-sw.gwdg.de/incoming/ulindner/nlv.ps.gz )",,,,"astro-ph",,"  Supervoids are regions in the local Universe which do not contain rich
clusters of galaxies. We have studied the closest example, the Northern Local
Void, situated between the Local, Coma, and the Hercules superclusters. We find
that this supervoid is not empty, but it contains small galaxy systems and poor
clusters of galaxies. We study the cosmography of this void by analyzing the
distribution of poor clusters of galaxies, elliptical and other galaxies in two
projections. We present a catalogue of voids, defined by galaxies of different
morphological type and luminosity, and analyze mean diameters of voids in
different environments. The sizes of voids and the properties of void walls are
related. Voids defined by poor clusters of galaxies and by bright elliptical
galaxies have a mean diameter of up to 40 h-1 Mpc. Faint late-type galaxies
divide these voids into smaller voids. The faintest galaxies we can study are
outlining voids with mean diameters of about 8 h-1 Mpc. Voids located in a
high-density environment are smaller than voids in low-density regions. This
analysis shows that voids form a hierarchical system.
","[{""version"":""v1"",""created"":""Fri, 10 Mar 1995 12:41:37 GMT""}]","2016-08-30"
"astro-ph/9503045","Reuven Ramaty","R. Ramaty and R. E. Lingenfelter","Astrophysical Gamma Ray Emission Lines","Plain TEX file, 28 pages with 14 figures available upon e-mail
  request to ramaty@pair.lheavx.gsfc.nasa.gov. In press, 1995, in The Analysis
  of Emission Lines, eds. R. E. Williams and M. Livio, (Cambridge: Cambridge
  Univ. Press), based on an invited talk at the Analysis of Emission Lines
  Conference, Space Telescope Science Institute, May 1994.",,,,"astro-ph",,"  We review the wide range of astrophysical observations of gamma ray emission
lines and we discuss their implications. We consider line emission from solar
flares, the Orion molecular cloud complex, supernovae 1987A and 1991T, the
supernova remnants Cas A and Vela, the interstellar medium, the Galactic center
region and several Galactic black hole candidates. The observations have
important, and often unique, implications on particle acceleration, star
formation, processes of nucleosynthesis, Galactic evolution and compact object
physics.
","[{""version"":""v1"",""created"":""Fri, 10 Mar 1995 14:27:51 GMT""}]","2016-08-30"
"cmp-lg/9503011","J. Mcmahon","John McMahon and F.J.Smith (Queen's University, Belfast)","Improving Statistical Language Model Performance with Automatically
  Generated Word Hierarchies","17 Page Paper. Self-extracting PostScript File",,,,"cmp-lg cs.CL",,"  An automatic word classification system has been designed which processes
word unigram and bigram frequency statistics extracted from a corpus of natural
language utterances. The system implements a binary top-down form of word
clustering which employs an average class mutual information metric. Resulting
classifications are hierarchical, allowing variable class granularity. Words
are represented as structural tags --- unique $n$-bit numbers the most
significant bit-patterns of which incorporate class information. Access to a
structural tag immediately provides access to all classification levels for the
corresponding word. The classification system has successfully revealed some of
the structure of English, from the phonemic to the semantic level. The system
has been compared --- directly and indirectly --- with other recent word
classification systems. Class based interpolated language models have been
constructed to exploit the extra information supplied by the classifications
and some experiments have shown that the new models improve model performance.
","[{""version"":""v1"",""created"":""Thu, 9 Mar 1995 21:07:06 GMT""}]","2016-08-31"
"cmp-lg/9503012","Partha Niyogi","Partha Niyogi and Robert C. Berwick (MIT)","A Note on Zipf's Law, Natural Languages, and Noncoding DNA regions","compressed uuencoded postscript file: 14 pages",,,"MIT CBCL Memo No. 118","cmp-lg cs.CL q-bio",,"  In Phys. Rev. Letters (73:2, 5 Dec. 94), Mantegna et al. conclude on the
basis of Zipf rank frequency data that noncoding DNA sequence regions are more
like natural languages than coding regions. We argue on the contrary that an
empirical fit to Zipf's ``law'' cannot be used as a criterion for similarity to
natural languages. Although DNA is a presumably an ``organized system of
signs'' in Mandelbrot's (1961) sense, an observation of statistical features of
the sort presented in the Mantegna et al. paper does not shed light on the
similarity between DNA's ``grammar'' and natural language grammars, just as the
observation of exact Zipf-like behavior cannot distinguish between the
underlying processes of tossing an $M$ sided die or a finite-state branching
process.
","[{""version"":""v1"",""created"":""Thu, 9 Mar 1995 20:08:39 GMT""}]","2009-09-25"
"comp-gas/9503002","Olivier Tribel","Olivier Tribel and Jean Pierre Boon","Lattice gas with ``interaction potential''","12 pages LaTeX, figures available on demand (otribel@ulb.ac.be)",,"10.1007/BF02179984",,"comp-gas nlin.CG",,"  We present an extension of a simple automaton model to incorporate non-local
interactions extending over a spatial range in lattice gases. {}From the
viewpoint of Statistical Mechanics, the lattice gas with interaction range may
serve as a prototype for non-ideal gas behavior. {}From the density
fluctuations correlation function, we obtain a quantity which is identified as
a potential of mean force. Equilibrium and transport properties are computed
theoretically and by numerical simulations to establish the validity of the
model at macroscopic scale.
","[{""version"":""v1"",""created"":""Fri, 10 Mar 1995 14:11:16 GMT""}]","2016-08-31"
"cond-mat/9503052","Axel Muller-Groeling","K. Frahm, A. Mueller-Groeling, J.-L. Pichard and D. Weinmann","Scaling in Interaction-Assisted Coherent Transport","4 pages, revtex, four figures available on request from
  amg@amoco.saclay.cea.fr",,"10.1209/0295-5075/31/3/008",,"cond-mat",,"  The pair localization length $L_2$ of two interacting electrons in
one--dimensional disordered systems is studied numerically. Using two direct
approaches, we find $L_2 \propto L_1^{\alpha}$, where $L_1$ is the one-electron
localization length and $\alpha \approx 1.65$. This demonstrates the
enhancement effect proposed by Shepelyansky, but the value of $\alpha$ differs
from previous estimates ($\alpha=2$) in the disorder range considered. We
explain this discrepancy using a scaling picture recently introduced by Imry
and taking into account a more accurate distribution than previously assumed
for the overlap of one-electron wavefunctions.
","[{""version"":""v1"",""created"":""Thu, 9 Mar 1995 16:05:43 GMT""}]","2016-08-31"
"cond-mat/9503053","Kikuo Harigaya","Kikuo Harigaya, Yukihiro Shimoi, Shuji Abe","Excitons in soliton and bipolaron lattice states of doped Peierls
  systems","See http://www.etl.go.jp/People/harigaya/ 1) The pointers which link
  to physics related WWW sites - especially in Japan - are summarized in the
  ""WWW for Physics"" section: http://www.etl.go.jp/People/harigaya/PHYS_WWW.html
  2) The obtained PHYS-FAQ documents (related to the fj.sci.physics - fj means
  'from Japan' -) and several useful pointers are listed in the ""Physics Forum""
  section: http://www.etl.go.jp/People/harigaya/PHYS_FAQ.html","Mol. Cryst. Liq. Cryst., 267 (1995) 329-334",,,"cond-mat chem-ph mtrl-th",,"  Exciton effects on soliton and bipolaron lattice states are investigated
using an electron-lattice Peierls model with long-range Coulomb interactions.
The Hartree-Fock (HF) approximation and the single-excitation
configuration-interaction (single-CI) method are used to obtain optical
absorption spectra. We discuss the following properties: (1) The attraction
between the excited electron and the remaining hole makes the excitation energy
smaller when the correlations are taken into account by the single-CI. The
oscillator strengths of the lower excited states become relatively larger than
in the HF calculations. (2) We look at variations of relative oscillator
strengths of two or three kinds of excitons described by the single-CI. While
the excess-electron concentration is small, the ratio of the oscillator
strengths of the exciton with the lowest energy, which is calculated against
the total electronic excitation oscillator strengths, increases almost
linearly. The oscillator strengths accumulate at this exciton as the
concentration increases.
","[{""version"":""v1"",""created"":""Thu, 9 Mar 1995 16:21:41 GMT""}]","2007-05-23"
"cond-mat/9503054",,"J. Beenen and D.M. Edwards (Imperial College London)","Superconductivity in the two dimensional Hubbard Model.","REVTeX, 35 pages, including 19 PostScript figures numbered 1a to 11.
  Uses epsf.sty (included). Everything in uuencoded gz-compressed .tar file,
  (self-unpacking, see header). Submitted to Phys. Rev. B (24-2-95)",,"10.1103/PhysRevB.52.13636",,"cond-mat supr-con",,"  Quasiparticle bands of the two-dimensional Hubbard model are calculated using
the Roth two-pole approximation to the one particle Green's function. Excellent
agreement is obtained with recent Monte Carlo calculations, including an
anomalous volume of the Fermi surface near half-filling, which can possibly be
explained in terms of a breakdown of Fermi liquid theory. The calculated bands
are very flat around the (pi,0) points of the Brillouin zone in agreement with
photoemission measurements of cuprate superconductors. With doping there is a
shift in spectral weight from the upper band to the lower band. The Roth method
is extended to deal with superconductivity within a four-pole approximation
allowing electron-hole mixing. It is shown that triplet p-wave pairing never
occurs. Singlet d_{x^2-y^2}-wave pairing is strongly favoured and optimal
doping occurs when the van Hove singularity, corresponding to the flat band
part, lies at the Fermi level. Nearest neighbour antiferromagnetic correlations
play an important role in flattening the bands near the Fermi level and in
favouring superconductivity. However the mechanism for superconductivity is a
local one, in contrast to spin fluctuation exchange models. For reasonable
values of the hopping parameter the transition temperature T_c is in the range
10-100K. The optimum doping delta_c lies between 0.14 and 0.25, depending on
the ratio U/t. The gap equation has a BCS-like form and (2*Delta_{max})/(kT_c)
~ 4.
","[{""version"":""v1"",""created"":""Thu, 9 Mar 1995 16:42:55 GMT""}]","2016-08-31"
"cond-mat/9503055","Shiwei Zhang","Shiwei Zhang, J. Carlson, and J.E. Gubernatis","A Constrained Path Quantum Monte Carlo Method for Fermion Ground States","uuencoded compressed postscript file. 5 pages with 1 figure. accepted
  by PRL.","Phys. Rev. Lett. 74, 3652 (1995)","10.1103/PhysRevLett.74.3652","LA-UR-95-0064","cond-mat",,"  We propose a new quantum Monte Carlo algorithm to compute fermion
ground-state properties. The ground state is projected from an initial
wavefunction by a branching random walk in an over-complete basis space of
Slater determinants. By constraining the determinants according to a trial
wavefunction $|\Psi_T \rangle$, we remove the exponential decay of
signal-to-noise ratio characteristic of the sign problem. The method is
variational and is exact if $|\Psi_T\rangle$ is exact. We report results on the
two-dimensional Hubbard model up to size $16\times 16$, for various electron
fillings and interaction strengths.
","[{""version"":""v1"",""created"":""Fri, 10 Mar 1995 06:26:15 GMT""}]","2016-08-31"
"cond-mat/9503057","Kurt Broderix","Kurt Broderix, Dirk Hundertmark, Werner Kirsch, Hajo Leschke","The Fate of Lifshitz Tails in Magnetic Fields","19 pages LaTeX","Journal of Statistical Physics 80 (1995) 1-22","10.1007/BF02178350",,"cond-mat",,"  We investigate the integrated density of states of the Schr\""odinger operator
in the Euclidean plane with a perpendicular constant magnetic field and a
random potential. For a Poisson random potential with a non-negative
algebraically decaying single-impurity potential we prove that the leading
asymptotic behaviour for small energies is always given by the corresponding
classical result in contrast to the case of vanishing magnetic field. We also
show that the integrated density of states of the operator restricted to the
eigenspace of any Landau level exhibits the same behaviour. For the lowest
Landau level, this is in sharp contrast to the case of a Poisson random
potential with a delta-function impurity potential.
","[{""version"":""v1"",""created"":""Fri, 10 Mar 1995 12:59:48 GMT""}]","2015-06-25"
"cond-mat/9503058","Mario Feingold","Mario Feingold (Dept. of Physics, Ben-Gurion University), Yshai
  Avishai (Dept. of Physics, Ben-Gurion University), and Richard Berkovits
  (Dept. of Physics, Bar-Ilan University )","Spectral Statistics in the Lowest Landau Band","9 pages, uuencoded compressed Postscript including 6 figures,
  submitted to Phys. Rev. B.",,"10.1103/PhysRevB.52.8400",,"cond-mat chao-dyn nlin.CD",,"  We study the spectral statistics in the center of the lowest Landau band of a
2D disordered system with smooth potential and strong transverse magnetic
field. Due to the finite size of the system, the energy range in which there
are extended states is finite as well. The behavior in this range can be viewed
as the analogue of the Anderson metal-insulator transition for the case of the
Hall system. Accordingly, we verify recent predictions regarding the exponent
of the asymptotic power law of $\Sigma^2 (\bar N)$, $\gamma$, and that of the
stretched exponential dominating the large $s$ behavior of the spacings
distribution, $\alpha$. Both the relations, $\alpha = 1- \gamma$, and $\gamma =
1 - {1\over{\nu d}}$ where $\nu$ is the critical exponent of the localization
length and $d$ is the dimension, are found to hold within the accuracy of our
computations. However, we find that none of several possible models of the
entire spacings distribution correctly describes our situation. Finally, for
very large $\bar N$, $\bar N > 60$, we find a new regime in which $\Sigma^2
(\bar N)$ behaves as a power law with an unexpectedly large power, $\gamma_1 =
1.38 \pm 0.02$.
","[{""version"":""v1"",""created"":""Fri, 10 Mar 1995 14:20:05 GMT""}]","2016-08-31"
"hep-ex/9503007","Larry Nodulman","The CDF Collaboration","Measurement of the W Boson Mass","13 pages for letter, URL:
  http://www-cdf.fnal.gov/physics/pub95/cdf2928_wmass_prl_subm.ps, article
  submitted to PRD is apparently to long to post, see URL:
  http://www-cdf.fnal.gov/physics/pub95/cdf2975_wmass_prd_subm.ps","Phys.Rev.Lett.75:11-16,1995","10.1103/PhysRevLett.75.11","FERMILAB-PUB-95/035-E.","hep-ex",,"  We present a measurement of the mass of the $W$ boson using data collected
with the CDF detector during the 1992-93 collider run at the Fermilab Tevatron.
A fit to the transverse mass spectrum of a sample of 3268 {\mbox{$W \rightarrow
\mu\nu$}} events recorded in an integrated luminosity of 19.7 pb$^{-1}$ gives a
mass $M_{W}^{\mu}=80.310\pm0.205\mbox{~(stat.)}\pm0.130\mbox{~(syst.)} \
\mbox{GeV/c}^{2}$. A fit to the transverse mass spectrum of a sample of 5718
{\mbox{$W \rightarrow e\nu$}} events recorded in 18.2 pb$^{-1}$ gives a mass
$M_{W}^{e}=80.490\pm0.145\mbox{~(stat.)}\pm0.175\mbox{~(syst.)} \
\mbox{GeV/c}^{2}$. Combining the electron and muon results, accounting for
correlated uncertainties, yields a mass $M_{W}=80.410\pm0.180 \
\mbox{GeV/c}^{2}$.
","[{""version"":""v1"",""created"":""Thu, 9 Mar 1995 22:25:08 GMT""}]","2012-08-27"
"hep-ex/9503008","Michael Procario","Michael Procario","Charm from Hyperonsin the Future: Fermilab Experiment 781","Consists of 8 pages plus 4 figures (uuencoded postscript appended).
  Uses REVTEX and psfig macros. Postscript verison is available from
  http://www-hep.phys.cmu.edu:8001/~procario/cmu-hep-95-01.ps","Frascati Phys.Ser. 3 (1994) 157-165",,"CMU-HEP 95-01","hep-ex",,"  Recent results from CERN experiment WA89 have shown that charmed baryons and
particularly charmed-strange baryons have a significant cross section in
$\Sigma^-$ beams. Fermilab experiment 781, which is currently under
construction, will utilize this fact to pursue a broad program of high
statistics studies of charmed baryons in the next Fermilab fixed target run.
","[{""version"":""v1"",""created"":""Fri, 10 Mar 1995 00:07:25 GMT""}]","2016-08-31"
"hep-lat/9503010","Frithjof Karsch","Frithjof Karsch (Fakult\""at f\""ur Physik, Universit\""at Bielefeld)","The Phase Transition to the Quark Gluon Plasma: Recent Results from
  Lattice Calculations","15 pages, PS-file, plenary talk given at Quark Matter 95, Monterey","Nucl.Phys.A590:367c-382c,1995","10.1016/0375-9474(95)00248-Y","BI-TP 95/11","hep-lat",,"  We will discuss here some of the recent results obtained from lattice
simulations of QCD at non-zero temperature. Such calculations aim at a
quantitative understanding of the thermodynamics of strongly interacting matter
in equilibrium. We concentrate on a discussion of the equation of state, the
chiral transition in two-flavour QCD and hadronic properties related to chiral
symmetry restoration in the vicinity of $T_c$.
","[{""version"":""v1"",""created"":""Fri, 10 Mar 1995 14:41:51 GMT""}]","2010-11-01"
