"alg-geom/9503020","Olivier Debarre","Olivier Debarre","Th\'eor\`emes De Connexit\'e Pour Les Produits D'Espaces Projectifs et
  Les Grassmanniennes","In French, 24 pages. The file originally submitted was corrupted.
  This one should work fine. PlainTeX v 1.2 with amssym.def and amssym",,,,"alg-geom math.AG",,"  Let $G$ be the Grassmannian $G(d,n)$, let $X$ and $Y$ be complete irreducible
varieties, and let $X\rightarrow G$ and $Y\rightarrow G$ be morphisms. Hansen
proved that $X \times_G Y$ is connected when $codim f(X) + codim g(Y) < n$. We
show that the conclusion holds under the often weaker hypothesis
$f(X).g(Y).T\ne 0$, where $T$ is the class of $G(d,n-1)$ in $G$.
  We prove similar results when $G$ is a product of projective spaces. In
particular, if $D$ is an irreducible subvariety of $P^n\times P^n$ of dimension
$n$ which dominates both factors, and if $X$ is complete irreducible, with a
morphism $f: X \rightarrow P^n\times P^n$ such that $dim f(X) >n$, $f^{-1}(D)$
is connected. This extends the classical Fulton-Hansen connectedness theorem.
These results illustrate Fulton and Lazarsfeld's idea that connectedness should
be a numerical property.
","[{""version"":""v1"",""created"":""Tue, 28 Mar 1995 07:25:28 GMT""},{""version"":""v2"",""created"":""Wed, 29 Mar 1995 10:10:07 GMT""}]","2015-06-30"
"alg-geom/9503021","Nitin Nitsure","Nitin Nitsure and Claude Sabbah","Moduli of pre-$\cal D$-modules, perverse sheaves and the Riemann-Hilbert
  morphism -I","LaTeX, 28 pages",,,,"alg-geom math.AG",,"  We construct a moduli scheme for semistable pre-$\D$-modules with prescribed
singularities and numerical data on a smooth projective variety. These
pre-$\D$-modules are to be viewed as regular holonomic $\D$-modules with `level
structure'. We also construct a moduli scheme for perverse sheaves on the
variety with prescribed singularities and other numerical data, and represent
the de Rham functor (which gives the Riemann-Hilbert correspondence) by an
analytic morphism between the two moduli schemes.
","[{""version"":""v1"",""created"":""Tue, 28 Mar 1995 11:35:00 GMT""}]","2008-02-03"
"astro-ph/9503101","Karl Glazebrook","Karl Glazebrook, Richard Ellis, Basilio Santiago (Institute of
  Astronomy, Cambridge) and Richard Griffiths (Johns Hopkins University)","The morphological identification of the rapidly evolving population of
  faint galaxies","MNRAS submitted, 6 pages, UUencoded compressed Postscript file,
  including figures. Postscript also available from
  http://www.ast.cam.ac.uk/~kgb/papers.html","Mon.Not.Roy.Astron.Soc. 275 (1995) L19","10.1093/mnras/275.1.L19",,"astro-ph",,"  The excess numbers of blue galaxies at faint magnitudes are a long-standing
cosmological puzzle. We present new number-magnitude counts as a function of
galactic morphology from the first deep fields of the Cycle 4 Hubble Space
Telescope {\it Medium Deep Survey} project. From a sample of 301 galaxies we
define counts for elliptical, spiral and irregular/peculiar galaxies to $I=22$.
We find two principal results. Firstly the elliptical and spiral galaxy counts
both follow the predictions of high-normalisation no-evolution models at all
magnitudes, indicating that regular Hubble types evolve only slowly to $z\sim
0.5$. Secondly we find that irregular/peculiar galaxies, including
multiple-peaked, possibly merging, objects, have a very steep number-magnitude
relation and greatly exceed predictions based on proportions in local surveys.
These systems make up half the total counts by $I=22$ and imply the
rapidly-evolving component of the faint galaxy population has been identified.
","[{""version"":""v1"",""created"":""Tue, 28 Mar 1995 14:18:00 GMT""},{""version"":""v2"",""created"":""Tue, 28 Mar 1995 15:07:00 GMT""}]","2016-06-08"
"astro-ph/9503102","Gary Bernstein","G. M. Bernstein, R. C. Nichol, J. A. Tyson, M. P. Ulmer, and D.
  Wittman","The Luminosity Function of the Coma Cluster Core for -25<M_R<-11","Submitted to AJ. Self-unpacking version of AASTeX source for 45p text
  and Postscript for Figures 3--8. Compressed postscript of 50p manuscript with
  all Figures embedded is available at
  ftp://astro.lsa.umich.edu/pub/get/comalf.tar.Z",,"10.1086/117624",,"astro-ph",,"  We determine the luminosity function (LF) of galaxies in the core of the Coma
cluster for M_R<=-11.4 (assuming H_0=75 km/s/Mpc), a magnitude regime
previously explored only in the Local Group. Objects are counted in a deep CCD
image of Coma having RMS noise of 27.7 R mag~arcsec$^{-2}$. A correction for
objects in the foreground or background of the Coma cluster---and the
uncertainty in this correction---are determined from images of five other
high-latitude fields, carefully matched to the Coma image in both resolution
and noise level. Accurate counts of Coma cluster members are obtained as faint
as R=25.5, or M_R=-9.4. The LF for galaxies is well fit by a power law
dN/dL\propto L^\alpha, with \alpha=-1.42\pm0.05, over the range
-19.4<M_R<-11.4; faintward of this range, the galaxies are unresolved and
indistinguishable from globular clusters, but the data are consistent with an
extrapolation of the power law. Surface brightness biases are minimized since
galaxies are not subjected to morphological selection, and the limiting
detection isophote is 27.6 R mag~arcsec$^{-2}$. We find the typical
$M_R\approx-12$ Coma cluster galaxy to have an exponential scale length
$\approx200$~pc, similar to Local Group galaxies of comparable magnitude. These
extreme dwarf galaxies show a surface density increasing towards the giant
elliptical NGC~4874 as $r^{-1.3}$, similar to the diffuse light and globular
cluster distributions. The luminosity in the detected dwarf galaxies is at most
a few percent of the total diffuse light of the giant galaxies in the cluster,
and the contribution of the dwarfs to the mass of the cluster is likely
negligible as well.
","[{""version"":""v1"",""created"":""Tue, 28 Mar 1995 14:48:41 GMT""}]","2009-10-28"
"astro-ph/9503104","David Syer","D. Syer and S. Tremaine, (CITA)","Lattice Stellar Dynamics","Accepted for publication in Monthly Notices. 18 pages, compressed
  PostScript, also available from http://www.cita.utoronto.ca/~syer/papers/","Mon.Not.Roy.Astron.Soc. 276 (1995) 467","10.1093/mnras/276.2.467","syer95-1","astro-ph",,"  We describe a technique for solving the combined collisionless Boltzmann and
Poisson equations in a discretised, or lattice, phase space. The time and the
positions and velocities of `particles' take on integer values, and the forces
are rounded to the nearest integer. The equations of motion are symplectic. In
the limit of high resolution, the lattice equations become the usual
integro-differential equations of stellar dynamics. The technique complements
other tools for solving those equations approximately, such as $N$-body
simulation, or techniques based on phase-space grids. Equilibria are found in a
variety of shapes and sizes. They are true equilibria in the sense that they do
not evolve with time, even slowly, unlike existing $N$-body approximations to
stellar systems, which are subject to two-body relaxation. They can also be
`tailor-made' in the sense that the mass distribution is constrained to be
close to some pre-specified function. Their principal limitation is the amount
of memory required to store the lattice, which in practice restricts the
technique to modeling systems with a high degree of symmetry. We also develop a
method for analysing the linear stability of collisionless systems, based on
lattice equilibria as an unperturbed model.
","[{""version"":""v1"",""created"":""Tue, 28 Mar 1995 15:45:16 GMT""}]","2015-06-24"
"astro-ph/9503107","Steve Allen, IoA","S.W. Allen, A.C. Fabian, A.C. Edge, H. Bohringer, D.A. White","Cooling flows, central galaxy--cluster alignments, X-ray absorption and
  dust","MNRAS accepted. 15 pages compressed, uuencoded postscript including
  figures and tables.",,"10.1093/mnras/275.3.741",,"astro-ph",,"  We present the analysis of pointed ROSAT PSPC observations of five of the
most luminous, intermediate redshift ($0.1 < z < 0.15$) clusters of galaxies
detected in the ROSAT All-Sky Survey. The PSPC data are combined with optical
CCD images and spectra to examine the relationship between clusters and their
central cluster galaxies (CCGs). Abell 1068, Abell 1361 and Abell 1664 contain
three of the most optically line-luminous CCGs known. The PSPC X-ray data show
that these galaxies lie at the centres of massive (200 -- 400 solar masses per
year) cooling flows. The alignment between CCGs and their host clusters has
been investigated. For those clusters with cooling flows, the position angles
of the X-ray emission from the clusters and the optical emission from the CCGs
agrees within 5 degrees. For the one probable non-cooling flow cluster in the
sample, Abell 2208, the alignment is significantly poorer. We examine the
evidence for intrinsic X-ray absorption in the clusters. The X-ray spectra for
Abell 1068 and Abell 1664 show that the cooling flows in these clusters are
intrinsically absorbed by equivalent hydrogen column densities $\geq 10^{21}
atom cm$^{-2}$. The optical spectra of the CCGs in these clusters exhibit
substantial intrinsic reddening, at levels consistent with the X-ray absorption
results if standard dust to gas ratios are assumed.
","[{""version"":""v1"",""created"":""Tue, 28 Mar 1995 14:48:25 GMT""}]","2015-06-24"
"cond-mat/9503138","Kun Yang","Kun Yang and A.H. MacDonald","Charged Pseudospin Textures in Double-Layer Quantum Hall Systems with
  Spontaneous Interlayer Coherence","12 pages, RevTex 3.0, 2 figures available upon request","Phys. Rev. B 51, 17247 (1995).","10.1103/PhysRevB.51.17247","IUCM95-009","cond-mat",,"  We report on a Hartree-Fock approximation study of the meron
pseudospin-texture excitations of the broken-symmetry incompressible ground
states of double-layer quantum Hall states at $\nu =1$. We have obtained
results for meron core energies and core sizes. We use these to estimate the
charge gap which determines the activation energy for dissipation in the
quantum Hall effect.
","[{""version"":""v1"",""created"":""Mon, 27 Mar 1995 16:03:00 GMT""}]","2009-10-28"
"cond-mat/9503139","E. G. Klepfish","E. Abraham, I.M. Barbour, P.H. Cullen, E.G. Klepfish, E.R. Pike and
  Sarben Sarkar","Singularity of the density of states in the two-dimensional Hubbard
  model from finite size scaling of Yang-Lee zeros","8 pages, Revtex",,"10.1103/PhysRevB.53.7704",,"cond-mat hep-lat",,"  A finite size scaling is applied to the Yang-Lee zeros of the grand canonical
partition function for the 2-D Hubbard model in the complex chemical potential
plane. The logarithmic scaling of the imaginary part of the zeros with the
system size indicates a singular dependence of the carrier density on the
chemical potential. Our analysis points to a second-order phase transition with
critical exponent ${1\over \delta}={1\over 2}\pm {1\over 3}$ which leads to a
divergence of the electronic susceptibility. We interprete these results as
reflecting singular behaviour of the density of states in the quasiparticle
spectrum.
","[{""version"":""v1"",""created"":""Mon, 27 Mar 1995 18:04:32 GMT""}]","2009-10-28"
"cond-mat/9503140","Sergey Kravchenko","J. E. Furneaux, S. V. Kravchenko, Whitney Mason, G. E. Bowker, and V.
  M. Pudalov","DESTRUCTION OF THE QUANTUM HALL EFFECT WITH INCREASING DISORDER","REVTeX file; 4 postscript figures on request; to appear in PRB",,"10.1103/PhysRevB.51.17227","OU-CO-95-01-30","cond-mat",,"  We report experimental studies of disorder-induced transitions between
quantum-Hall, metallic, and insulating states in a very dilute two-dimensional
electron system in silicon at a magnetic field corresponding to Landau level
filling factor $\nu=1$. At low disorder, the lowest extended state at $\nu=1$
is below the Fermi energy so that the system is in the quantum Hall state. Our
data show that with increasing disorder (but at constant electron density and
magnetic field), the extended state DOES NOT DISAPPEAR BUT FLOATS UP IN ENERGY
SO THAT THE SYSTEM BECOMES INSULATING. As the extended state crosses the Fermi
energy, the conductivity $\sigma_{xx}\sim e^2/2h$ has temperature dependence
characteristic of a metallic system.
","[{""version"":""v1"",""created"":""Mon, 27 Mar 1995 18:10:06 GMT""}]","2009-10-28"
"cond-mat/9503141","Anton V. Andreev","A. V. Andreev and B. L. Altshuler (MIT and NECI)","Spectral Statistics Beyond Random Matrix Theory","Uuencoded file with two eps figures, 10 pages.",,"10.1103/PhysRevLett.75.902",,"cond-mat",,"  Using a nonperturbative approach we examine the large frequency asymptotics
of the two-point level density correlator in weakly disordered metallic grains.
This allows us to study the behavior of the two-level structure factor close to
the Heisenberg time. We find that the singularities (present for random matrix
ensembles) are washed out in a grain with a finite conductance. The results are
nonuniversal (they depend on the shape of the grain and on its conductance),
though they suggest a generalization for any system with finite Heisenberg
time.
","[{""version"":""v1"",""created"":""Mon, 27 Mar 1995 22:49:26 GMT""}]","2016-08-31"
"cond-mat/9503142","Holger Frahm","F.H.L. Essler, H. Frahm, A.R. Its and V.E.K. Korepin","Integro-Difference Equation for a correlation function of the
  spin-${1\over2}$ Heisenberg XXZ chain","14 pages, latex+epsf, 1 figure","Nucl.Phys. B446 (1995) 448-460","10.1016/0550-3213(95)00263-R","BONN-TH-95-06, ITP-UH-10/95, ITP-SB-94-71","cond-mat hep-th nlin.SI solv-int",,"  We consider the Ferromagnetic-String-Formation-Probability correlation
function (FSFP) for the spin-$1\over 2$ Heisenberg XXZ chain. We construct a
completely integrable system of integro-difference equations (IDE), which has
the FSFP as a $\tau$-function. We derive the associated Riemann-Hilbert problem
and obtain the large distance asymptotics of the FSFP correlator in some
limiting cases.
","[{""version"":""v1"",""created"":""Tue, 28 Mar 1995 07:59:03 GMT""},{""version"":""v2"",""created"":""Wed, 29 Mar 1995 07:41:44 GMT""}]","2009-10-28"
"cond-mat/9503143","Alexander Sokol","N. Elstner, A. Sokol, R.R.P. Singh, M. Greven, and R.J. Birgeneau","Spin Dependence of Correlations in Two-Dimensional Quantum Heisenberg
  Antiferromagnets","5 pages, REVTeX file. PostScript file for the paper with embedded
  figures available via WWW at http://xxx.lanl.gov/ps/cond-mat/9503143 .","Physical Review Letters 75, 938 (1995)","10.1103/PhysRevLett.75.938",,"cond-mat",,"  We present a series expansion study of spin-S square-lattice Heisenberg
antiferromagnets. The numerical data are in excellent agreement with recent
neutron scattering measurements. Our key result is that the correlation length
for S>1/2 strongly deviates from the exact T->0 (renormalized classical, or RC)
scaling prediction for all experimentally and numerically accessible
temperatures. We note basic trends with S of the experimental and series
expansion correlation length data and propose a scaling crossover scenario to
explain them.
","[{""version"":""v1"",""created"":""Tue, 28 Mar 1995 08:03:18 GMT""}]","2009-10-28"
"cond-mat/9503144","Marc Mezard","J.P. Bouchaud, M. Mezard and G. Parisi","SCALING AND INTERMITTENCY IN BURGERS' TURBULENCE","35 pages latex, 4 ps figures in separate uufiles package.",,"10.1103/PhysRevE.52.3656","LPTENS 95/12","cond-mat chao-dyn nlin.CD",,"  We use the mapping between Burgers' equation and the problem of a directed
polymer in a random medium in order to study the fully developped turbulence in
the $N$ dimensional forced Burgers' equation. The stirring force corresponds to
a quenched (spatio temporal) random potential for the polymer. The properties
of the inertial regime are deduced from a study of the directed polymer on
length scales smaller than the correlation length of the potential. From this
study we propose an Ansatz for the velocity field in the large Reynolds number
limit of the forced Burgers' equation in $N$ dimensions. This Ansatz allows us
to compute exactly the full probability distribution of the velocity difference
$u(r)$ between points separated by a distance $r$ much smaller than the
correlation length of the forcing. We find that the moments $<u^q(r)>$ scale as
$r^{\zeta(q)}$ with $\zeta(q) \equiv 1$ for all $q \geq 1$. This strong
`intermittency' is related to the large scale singularities of the velocity
field, which is concentrated on a $N-1$ dimensional froth-like structure.
","[{""version"":""v1"",""created"":""Tue, 28 Mar 1995 09:14:19 GMT""}]","2009-10-28"
"cond-mat/9503145","Nigel Wilding","Nigel B. Wilding","Critical point and coexistence curve properties of the Lennard-Jones
  fluid: A finite-size scaling study","9 Pages Revtex. 8 encapsulated ps figures as separate uuencoded,
  gzipped tar file. To appear in Phys. Rev. E. Full paper also available from
  http://moses.physik.uni-mainz.de/",,"10.1103/PhysRevE.52.602","KOMA-94-55","cond-mat chem-ph",,"  Monte Carlo simulations within the grand canonical ensemble are used to
explore the liquid-vapour coexistence curve and critical point properties of
the Lennard-Jones fluid. Attention is focused on the joint distribution of
density and energy fluctuations at coexistence. In the vicinity of the critical
point, this distribution is analysed using mixed-field finite-size scaling
techniques aided by histogram reweighting methods. The analysis yields highly
accurate estimates of the critical point parameters, as well as exposing the
size and character of corrections to scaling. In the sub-critical coexistence
region the density distribution is obtained by combining multicanonical
simulations with histogram reweighting techniques. It is demonstrated that this
procedure permits an efficient and accurate mapping of the coexistence curve,
even deep within the two phase region.
","[{""version"":""v1"",""created"":""Tue, 28 Mar 1995 11:56:14 GMT""}]","2009-10-28"
"cond-mat/9503146","Rudolf Podgornik","R.Podgornik (Laboratory of Structural Biology, Division of Computer
  Research and Technology, National Institutes of Health, Bethesda, MD)","Orientational Ordering of Polymers on a Fluctuating Flexible Surface","LaTeX, 11 pages",,"10.1103/PhysRevE.52.5170","LSB/1995/1","cond-mat",,"  Arguments are presented to the effect that embedding semi-flexible (wormlike)
ideal polymers into a fluctuating, flexible surface leads to an effective
attractive orientational interaction between polymer segments that precipitates
an orientational ordering transition of the polymer chains on the surface even
in the case of otherwise ideal (non-interacting) chains. The orientational
interaction is analogous to the (zero order) Casimir force and is due to the
energy change in surface conformational fluctuations in the presence of
embedded semi-flexible chains.
","[{""version"":""v1"",""created"":""Tue, 28 Mar 1995 14:27:47 GMT""}]","2009-10-28"
"cond-mat/9503147","Leo Radzihovsky","Leo Radzihovsky","Theory of a Continuous H$_{c2}$ Normal-to-Superconducting Transition","4 pages, self-unpacking uuencoded compressed postscript file with a
  figure already inside text; to appear in Phys. Rev. Lett.",,"10.1103/PhysRevLett.74.4722","University of Chicago preprint","cond-mat",,"  I study the $H_{c2}$ transition within the Ginzburg-Landau model, with
$m$-component order parameter $\psi_i$. I find a renormalized fixed point free
energy, exact in $m\rightarrow\infty$ limit, suggestive of a $2$nd-order
transition in contrast to a general belief of a $1$st-order transition. The
thermal fluctuations for $H\neq 0$ force one to consider an infinite set of
marginally relevant operators for $d<d_{uc}=6$. I find $d_{lc}=4$, predicting
that the ODLRO does not survive thermal fluctuations in $d=2,3$. The result is
a solution to a critical fixed point that was found to be inaccessible within
$\epsilon=6-d$-expansion, previously considered in E.Brezin, D.R.Nelson,
A.Thiaville, Phys.Rev.B {\bf 31}, 7124 (1985), and was interpreted as a
$1$st-order transition.
","[{""version"":""v1"",""created"":""Tue, 28 Mar 1995 15:15:48 GMT""}]","2009-10-28"
"cond-mat/9503150","Heinz Schulz","H. J. Schulz","Fermi liquids and non--Fermi liquids","1994 Les Houches lecture notes, 59 pages, RexTeX 3.0, uuencoded,
  together with postscript figures, needs epsf, you want to compile
  houches_send.tex (small corrections to original submission)","in ""Proceedings of Les Houches Summer School LXI"", ed. E.
  Akkermans, G. Montambaux, J. Pichard, et J. Zinn-Justin (Elsevier, Amsterdam,
  1995), p.533",,,"cond-mat",,"  Contents
  I. Introduction
  II. Fermi Liquids
  III. Renormalization group for interacting fermions
  IV. Luttinger liquids
  V. Transport in a Luttinger liquid
  VI. The Bethe ansatz: a pedestrian introduction
  VII. Conclusion and outlook
","[{""version"":""v1"",""created"":""Tue, 28 Mar 1995 13:31:22 GMT""},{""version"":""v2"",""created"":""Fri, 31 Mar 1995 15:33:58 GMT""}]","2008-02-03"
"dg-ga/9503011","V. Pestov","Vladimir Pestov","Analytic subsets of Hilbert spaces","6 pp., AmS TeX 2.1 source file",,,"RP-95-157, Dept Maths, Victoria University of Wellington, Mar 1995","dg-ga math.DG",,"  We show that every complete metric space is homeomorphic to the precise locus
of zeros of an entire analytic map from a Hilbert space to a Banach space. As a
corollary, every complete separable metric space is homeomorphic to the precise
locus of zeros of an entire analytic map between two separable complex Hilbert
spaces. AmS TeX 2.1.
","[{""version"":""v1"",""created"":""Tue, 28 Mar 1995 11:44:04 GMT""}]","2008-02-03"
"dg-ga/9503012",,"Sergey A. Merkulov","Geometry of Kodaira moduli spaces","10 pages, LaTeX","Proc. Amer. Math. Soc. 124 (1996), 1499-1506.",,,"dg-ga math.DG",,"  A general theorem on the existence of natural torsion-free affine connections
on a complete family of compact complex submanifolds in a complex manifold is
proved. Applications to twistor theory are discussed.
","[{""version"":""v1"",""created"":""Tue, 28 Mar 1995 13:21:15 GMT""}]","2008-02-03"
"dg-ga/9503013","Alexander Reznikov","Alexander G. Reznikov","Fundamental Group of Self-Dual Four-Manifolds with Positive Scalar
  Curvature","plain TEX; mathchar.tex and definiti.tex are available from dg-ga,
  and vanilla.sty follows the paper",,,,"dg-ga math.DG",,"  Main Theorem (3.3): Let $M$ be a compact four-dimensional manifold either
with curvature, positive on complex isotropic two-planes, or self-dual of
positive scalar curvature. If $\pi_1 (M)$ admits a nontrivial unitary
representation, and $M$ is orientable, then there exists a surjective
homomorphism from $\pi_1 (M)$ on $\bbz$.
  Corollary: If $\pi_1 (M)$ is finite, then either $\pi_1 (M) = 1$, or $\pi_1
(M) = \bbz_2$.
  Observe that finitely presented groups which do not admit a nontrivial
unitary representation, are extremely rare (see 3.4).
","[{""version"":""v1"",""created"":""Tue, 28 Mar 1995 13:55:10 GMT""}]","2016-08-31"
"gr-qc/9503051","Renate Loll","R. Loll (INFN, Florence)","QUANTUM ASPECTS OF 2+1 GRAVITY","24 pages, TeX, Mar 95; contribution to the JMP special issue on
  ""Quantum geometry and diffeomorphism invariant quantum field theory""","J.Math.Phys.36:6494-6509,1995","10.1063/1.531253","DFF 223/03/95","gr-qc hep-th",,"  We review and systematize recent attempts to canonically quantize general
relativity in 2+1 dimensions, defined on space-times $\R\times\Sigma^g$, where
$\Sigma^g$ is a compact Riemann surface of genus $g$. The emphasis is on
quantizations of the classical connection formulation, which use Wilson loops
as their basic observables, but also results from the ADM formulation are
summarized. We evaluate the progress and discuss the possible quantum
(in)equivalence of the various approaches.
","[{""version"":""v1"",""created"":""Mon, 27 Mar 1995 16:47:58 GMT""}]","2010-11-01"
