"gr-qc/9503052","Vivek Iyer","Vivek Iyer and Robert M. Wald","A comparison of Noether charge and Euclidean methods for Computing the
  Entropy of Stationary Black Holes","29 pages (double-spaced) latex","Phys.Rev. D52 (1995) 4430-4439","10.1103/PhysRevD.52.4430",,"gr-qc hep-th",,"  The entropy of stationary black holes has recently been calculated by a
number of different approaches. Here we compare the Noether charge approach
(defined for any diffeomorphism invariant Lagrangian theory) with various
Euclidean methods, specifically, (i) the microcanonical ensemble approach of
Brown and York, (ii) the closely related approach of Ba\~nados, Teitelboim, and
Zanelli which ultimately expresses black hole entropy in terms of the Hilbert
action surface term, (iii) another formula of Ba\~nados, Teitelboim and Zanelli
(also used by Susskind and Uglum) which views black hole entropy as conjugate
to a conical deficit angle, and (iv) the pair creation approach of Garfinkle,
Giddings, and Strominger. All of these approaches have a more restrictive
domain of applicability than the Noether charge approach. Specifically,
approaches (i) and (ii) appear to be restricted to a class of theories
satisfying certain properties listed in section 2; approach (iii) appears to
require the Lagrangian density to be linear in the curvature; and approach (iv)
requires the existence of suitable instanton solutions. However, we show that
within their domains of applicability, all of these approaches yield results in
agreement with the Noether charge approach. In the course of our analysis, we
generalize the definition of Brown and York's quasilocal energy to a much more
general class of diffeomorphism invariant, Lagrangian theories of gravity. In
an appendix, we show that in an arbitrary diffeomorphism invariant theory of
gravity, the ``volume term"" in the ``off-shell"" Hamiltonian associated with a
time evolution vector field $t^a$ always can be expressed as the spatial
integral of $t^a {\cal C}_a$, where ${\cal C}_a = 0$ are the constraints
associated with the diffeomorphism invariance.
","[{""version"":""v1"",""created"":""Mon, 27 Mar 1995 20:25:29 GMT""}]","2009-10-28"
"hep-lat/9503024","Alan Sokal","Tereza Mendes and Alan D. Sokal","Multi-Grid Monte Carlo. IV. One-Dimensional $O(4)$-Symmetric Nonlinear
  $\sigma$-Model","377866 bytes Postscript, 16 pages, includes figures","Phys.Rev. D53 (1996) 3438-3444","10.1103/PhysRevD.53.3438","NYU-TH-95/03/04","hep-lat",,"  We study the dynamic critical behavior of the multi-grid Monte Carlo (MGMC)
algorithm with piecewise-constant interpolation and a W-cycle, applied to the
one-dimensional $O(4)$-symmetric nonlinear $\sigma$-model [= $SU(2)$ principal
chiral model], on lattices from $L=128$ to $L=16384$. Our data for the
integrated autocorrelation time $\tau_{int,{\cal M}^2}$ are well fit by a
logarithmic growth. We have no idea why the critical slowing-down is not
completely eliminated.
","[{""version"":""v1"",""created"":""Mon, 27 Mar 1995 22:34:55 GMT""}]","2009-10-28"
"hep-ph/9503443","Andreas Dabelstein","A. Dabelstein","Fermionic decays of neutral MSSM Higgs bosons at the one-loop level","31 pages, 6 figures","Nucl.Phys.B456:25-56,1995","10.1016/0550-3213(95)00523-2","KA-THEP-4-1995","hep-ph",,"  The results of a complete one-loop calculation for the fermionic decay width
h^0, H^0, A^0 -> f bar(f) of the neutral MSSM Higgs bosons are presented and
the dominant light Higgs decay channel h^0 -> b bar(b) is discussed in detail.
The enhancement of the partial decay width h^0 -> b bar(b) compared to the
standard Higgs decay is shown for pseudoscalar masses M_A < 300 GeV. Simpler
approximation formulae for the Higgs decays are given and their quality is
discussed by introducing an effective neutral scalar mixing angle
sin(alpha)_eff. Finally the Higgs branching ratios in b bar(b), c bar(c), tau^+
tau^- are calculated.
","[{""version"":""v1"",""created"":""Mon, 27 Mar 1995 16:00:39 GMT""}]","2008-12-22"
"hep-ph/9503444","Andrzej Czarnecki","Andrzej Czarnecki","Two-loop Light Quark Corrections To The Top Width","Dedicated to Professor K. Zalewski to honor his 60th Birthday,
  submitted to Acta Phys. Polonica, 5 pages, latex, postscript file including
  figures is available via anonymous ftp at (129.13.102.139) as
  ftp://ttpux2.physik.uni-karlsruhe.de/ttp95-15/ttp95-15.ps or via www at
  http://ttpux2.physik.uni-karlsruhe.de/cgi-bin/preprints/","Acta Phys.Polon.B26:845-849,1995",,"TTP95-15","hep-ph",,"  A method of computing two-loop fermionic contributions to the width of a
heavy quark is described. An analytical formula for this effect in the limit of
mass of the quark much larger than the decay products is obtained for the first
time. The result confirms previous numerical studies.
","[{""version"":""v1"",""created"":""Mon, 27 Mar 1995 17:04:29 GMT""}]","2011-03-02"
"hep-ph/9503445","Stephen Martin","Chris Kolda and Stephen P. Martin","Low-energy supersymmetry with D-term contributions to scalar masses","28 pages, plain TeX, 12 figures appended as uuencoded file.
  Additional constraints from flat directions imposed on parameter space;
  figures 6 and 8 slightly modified; references added","Phys.Rev. D53 (1996) 3871-3883","10.1103/PhysRevD.53.3871","UM-TH-95-08","hep-ph",,"  We investigate how the predictions of the Minimal Supersymmetric Standard
Model are modified by D-term contributions to soft scalar masses, which arise
whenever the rank of the gauge group at very high energies is greater than
four. We give a parameterization of the most general such contributions that
can occur when the unbroken gauge symmetry is an arbitrary subgroup of E_6, and
show how the D-term contributions leave their imprint on physics at ordinary
energies. We impose experimental constraints on the resulting parameter space
and discuss some features of the resulting supersymmetric spectrum which differ
from the predictions obtained with universal boundary conditions on scalar
masses near the Planck scale. These include relations between squark and
slepton masses; the behavior of $\sin^2 (\beta-\alpha)$ (which determines the
production cross-section for the lightest Higgs scalar boson at an e+e-
collider) and the mass of the pseudoscalar Higgs bosons; R_b [the ratio
$\Gamma(Z -> b\overline b)/\Gamma(Z -> hadrons)$; and mass differences between
charginos and neutralinos.
","[{""version"":""v1"",""created"":""Mon, 27 Mar 1995 18:14:47 GMT""},{""version"":""v2"",""created"":""Wed, 26 Apr 1995 16:26:57 GMT""}]","2009-10-28"
"hep-ph/9503446","Levan Surguladze","I.M.DREMIN and A.V.LEONIDOV","THEORETICAL SEARCH FOR COLLECTIVE EFFECTS IN MULTIPARTICLE PRODUCTION","35 pages, LATEX, 3 Figs. (not included)","Usp.Fiz.Nauk.165:759-772,1995","10.1070/PU1995v038n07ABEH000095","-TD-8/95","hep-ph",,"  The properties of QCD vacuum and the confinement of quarks and gluons
certainly influence the multiparticle production processes. Some
phenomenological attempts of the consideration of related collective effects
and the possibilities of their experimental detection are briefly discussed in
this review. We consider in particular the correlation characteristics of pion
systems, statistical and hydrodynamical analogies, the problem of phase
transition from a quark-gluon plasma to a multipion state and the possible
modifications of the evolution of the quark-gluon jets. The presentation is
somewhat simplified and could be interesting for those only entering the field.
","[{""version"":""v1"",""created"":""Mon, 27 Mar 1995 18:18:10 GMT""}]","2014-11-17"
"hep-ph/9503447","Paul Frampton","Paul H. Frampton and B. Charles Rasco","Dilepton Production in High Luminosity Multi-GeV Electron Scattering","9 pages latex, 5 figures not included (captions only)","Phys.Rev.Lett. 75 (1995) 1899-1902","10.1103/PhysRevLett.75.1899","IFP-711-UNC","hep-ph",,"  We consider the production of a 300GeV dilepton in very intense 4GeV electron
scattering off of a lead target. The production cross-section and angular
distribution of the resulting muons are calculated. There occur several such
events per year, and their detection is rendered feasible by measurement of
$e^+\mu^-\mu^-$ angular correlations.
","[{""version"":""v1"",""created"":""Mon, 27 Mar 1995 18:53:53 GMT""}]","2009-10-28"
"hep-ph/9503448",,"M. H. Friedman, Y. Srivastava and A. Widom","FERMIONS IN AN EXTERNAL SU(2) MAGNETIC FIELD","7 pages, Latex","J.Phys.G23:1061-1064,1997","10.1088/0954-3899/23/9/005","NUB 3114, March 1995","hep-ph",,"  We consider Fermions in a constant and uniform external $SU(2)$ magnetic
field. We find that the results for the energy levels depend on the choice of
gauge potential. Choosing a Landau type gauge potential yields his results. On
the other hand in another gauge potential, one obtains a different continuous
eigenvalue spectrum.
","[{""version"":""v1"",""created"":""Mon, 27 Mar 1995 20:07:28 GMT""}]","2008-11-26"
"hep-ph/9503449","Jin","Jin Dai, J.F. Gunion and R. Vega","SEARCHING FOR HIGGS BOSONS ON LHC USING $b$-TAGGING","Talk presented at BEYOUND THE STANDARD MODEL IV conference; Taho
  City, 12/19/94, 3 pages.",,,,"hep-ph",,"  We demonstrate that the detection of the SM and MSSM Higgs bosons will be
possible at the LHC via $t\anti t b\anti b$ and $b\anti b b\anti b$ final
state, provided $b$-tagging can be performed with good efficiency and purity.
","[{""version"":""v1"",""created"":""Mon, 27 Mar 1995 21:16:32 GMT""}]","2007-05-23"
"hep-ph/9503450",,"Nichol Brummer, Imperial College, London","Experimental momentum spectra of identified hadrons at $e^+e^-$
  colliders compared to QCD calculations","9 pages latex, 7 eps figures and total ps file","Z.Phys.C66:367-374,1995","10.1007/BF01556361","Imperial College preprint IC/HEP/95-02","hep-ph",,"  Experimental data on the shape of hadronic momentum spectra are compared to
theoretical predictions in the context of calculations in the Modified Leading
Log Approximation (MLLA), under the assumption of Local Parton Hadron Duality
(LPHD).
  Considered are experimental measurements at $e^+e^-$-colliders of $\xi_p^*$,
the position of the maximum in the distribution of $\xi_p=\log(1/x_p)$, where
$x_p=p/p_{beam}$. The parameter $\xi_p^*$ is determined for various hadrons at
various centre of mass energies. The dependence on the hadron type poses some
interesting questions about the process of hadron-formation. The dependence of
$\xi^*_p$ on the centre of mass energy is seen to be described adequately by
perturbation theory. A quantitative check of LPHD + MLLA is possible by
extracting a value of $\alpha_s$ from an overall fit to the scaling behaviour
of $\xi^*_p$.
","[{""version"":""v1"",""created"":""Mon, 27 Mar 1995 20:53:08 GMT""},{""version"":""v2"",""created"":""Tue, 28 Mar 1995 15:34:59 GMT""}]","2010-11-01"
"hep-ph/9503451","Giovanni Amelino-Camelia","G. Amelino-Camelia (MIT)","Effective Potential Improvements, $\epsilon$-expansions, and the
  Electroweak Phase Transition","4 pages, LaTex (requires espcrc2.sty which is appended). Contribution
  to the Proceedings of Trends in Astroparticle Physics","Nucl.Phys.Proc.Suppl. 43 (1995) 278-281","10.1016/0920-5632(95)00490-Z","MIT-CTP-2419/INFN-NA-94-36","hep-ph",,"  Two recently proposed approaches to the study of the electroweak phase
transition are discussed.
","[{""version"":""v1"",""created"":""Mon, 27 Mar 1995 22:17:09 GMT""}]","2009-10-28"
"hep-ph/9503452","Giovanni Amelino-Camelia","G. Amelino-Camelia (MIT), O. Pisanti (Univ. Napoli), L. Rosa (Univ.
  Napoli)","SO(10): a possible Scenario for new Physics in the Neutrino Sector and
  Baryogenesis","4 pages, LaTex (requires espcrc2.sty which is appended). Contribution
  to the Proceedings of Trends in Astroparticle Physics","Nucl.Phys.Proc.Suppl. 43 (1995) 86-89","10.1016/0920-5632(95)00458-L","MIT-CTP-2420","hep-ph",,"  The implications on neutrino physics and on the dynamical generation of the
baryonic asymmetry of a class of $SO(10)$ non-supersymmetric models are
discussed.
","[{""version"":""v1"",""created"":""Mon, 27 Mar 1995 22:23:28 GMT""}]","2009-10-28"
"hep-ph/9503453","David Bowser-Chao","P. Agrawal, D. Bowser-Chao, and J. Pumplin","Optimized Top Quark Analysis with the Decision Tree","17 pages, uses revtex macros, postscript figures in .uu format, or
  available from the Authors.","Phys.Rev. D52 (1995) 6309-6315","10.1103/PhysRevD.52.6309","MSU-HEP/50327","hep-ph",,"  We present an optimized and physically motivated method for separating top
quark signal events from background events at the Tevatron. For the top quark
signal $t\bar t \to e/\mu + 4$ jets, we show how to reject all but $25\%$ of
the background in a data sample while retaining $80\%$ of the signal, without
introducing bias into the subsequent mass measurement. The technique used is
the Binary Decision Tree. Combining this highly efficient procedure for signal
identification with a novel algorithm for top quark reconstruction, we propose
a powerful new way to measure the top quark mass.
","[{""version"":""v1"",""created"":""Tue, 28 Mar 1995 01:55:42 GMT""},{""version"":""v2"",""created"":""Tue, 28 Mar 1995 16:11:01 GMT""}]","2009-10-28"
"hep-ph/9503454","Herbert Dreiner","A. H. Chamseddine and Herbi Dreiner (ETH-Zurich)","Anomaly-Free Gauged $U(1)'$ in Local Supersymmetry and Baryon-Number
  Violation","16 pages, latex, no figures","Nucl.Phys. B447 (1995) 195-210","10.1016/0550-3213(95)00253-O","ETH-TH/95-06","hep-ph hep-th",,"  The supersymmetric extension of the standard model suffers from a problem of
baryon-number violation. Discrete (and global) symmetries introduced to protect
the proton are unstable under gravitational effects. We add a gauged $U(1)_X$
to the standard model gauge group $G_{SM}$ and require it to be anomaly-free.
As new (chiral) superfields we only allow $G_{SM}$-singlets in order to
maintain the good unification predictions. We find the most general set of
solutions for the rational singlet charges. We embed our models in {\it local}
supersymmetry and study the breaking of supersymmetry and $U(1)_X$ to determine
$M_X$. We determine the full non-renormalizable and gauge invariant Lagrangian
for the different solutions. We expect any effective theory to contain baryon-
and lepton-number violating terms of dimension four suppressed by powers of
$M_X/M_{Pl}$. The power is predicted by the $U(1)_X$ charges. We find
consistency with the experimental bounds on the proton lifetime and on the
neutrino masses. We also expect all supersymmetric models to have an unstable
but longlived lightest supersymmetric particle. Consistency with underground
experiments on upward going muons leads to stricter constraints than the proton
decay experiments. These are barely satisfied.
","[{""version"":""v1"",""created"":""Tue, 28 Mar 1995 13:09:00 GMT""}]","2009-10-28"
"hep-ph/9503455","Georges Leontaris","E. G. Floratos, G. K. Leontaris","Analytic Approach to the MSSM Mass Spectrum in the Large Tan$\beta$
  Regime","LaTeX - file, 32pp, 3 figures (uuencoded), Revised Version, (to
  appear in Nucl. Phys. B)","Nucl.Phys.B452:471-495,1995","10.1016/0550-3213(95)00417-Q",,"hep-ph",,"  In various unified extensions of the Minimal Supersymmetric Standard Model,
the Yukawa couplings of the third generation are predicted to be of the same
order. As a result, low energy measured mass ratios, require large ratios of
the standard model Higgs vacuum expectation values, corresponding to a large
value of the parameter $tan\beta$. We present analytic solutions for the Yukawa
couplings and the Higgs and third generation squark masses, in the case of
large top and bottom Yukawa couplings. We examine regions of these Yukawas
which give predictions for the top mass compatible with the present
experimentally determined top mass and provide useful approximate formulae for
the scalars. We discuss the implications on the Radiative Symmetry Breaking
mechanism and derive constraints on the undetermined initial conditions of the
scalars.
","[{""version"":""v1"",""created"":""Tue, 28 Mar 1995 13:21:30 GMT""},{""version"":""v2"",""created"":""Tue, 22 Aug 1995 17:37:52 GMT""}]","2011-01-27"
"hep-th/9503184","Sumit Das","Sumit R. Das and Spenta R. Wadia (Tata Institute)","Quark Confinement and Dual Representation in 2+1 Dimensional Pure
  Yang-Mills Theory","26 pages, RevTex, Title changed, a new section added, the discussion
  on stability of dressed monopole expanded. Version to appear in Physical
  Review D","Phys.Rev. D53 (1996) 5856-5865","10.1103/PhysRevD.53.5856","TIFR-TH/94-42","hep-th",,"  We study the quark confinement problem in 2+1 dimensional pure Yang-Mills
theory using euclidean instanton methods. The instantons are regularized and
dressed Wu-Yang monopoles. The dressing of a monopole is due to the mean field
of the rest of the monopoles. We argue that such configurations are stable to
small perturbations unlike the case of singular, undressed monopoles. Using
exact non-perturbative results for the 3-dim. Coulomb gas, where Debye
screening holds for arbitrarily low temperatures, we show in a self-consistent
way that a mass gap is dynamically generated in the gauge theory. The mass gap
also determines the size of the monopoles. In a sense the pure Yang-Mills
theory generates a dynamical Higgs effect. We also identify the disorder
operator of the model in terms of the Sine-Gordon field of the Coulomb gas.
","[{""version"":""v1"",""created"":""Mon, 27 Mar 1995 21:02:46 GMT""},{""version"":""v2"",""created"":""Tue, 11 Apr 1995 19:52:12 GMT""},{""version"":""v3"",""created"":""Thu, 29 Feb 1996 11:11:09 GMT""}]","2009-10-28"
"hep-th/9503186","Stephen Hsu","Nick Evans, Stephen D.H. Hsu and Myckola Schwetz","Exact Results in Softly Broken Supersymmetric Models","13 pages, latex; expanded references and discussion of D terms","Phys.Lett. B355 (1995) 475-480","10.1016/0370-2693(95)00778-J","YCTP-P8-95","hep-th hep-ph",,"  We show how recent exact results in supersymmetric theories can be extended
to models which include {\it explicit} soft supersymmetry breaking terms. We
thus derive new exact results for non-supersymmetric models.
","[{""version"":""v1"",""created"":""Mon, 27 Mar 1995 22:48:44 GMT""},{""version"":""v2"",""created"":""Sat, 29 Apr 1995 19:01:26 GMT""}]","2009-10-28"
"hep-th/9503187","R. Kantowski","H. T. Cho and R. Kantowski","Gauge Independent Trace Anomaly for Gravitons","19 pages, additional references and title change","Phys.Rev.D52:4600-4608,1995","10.1103/PhysRevD.52.4600","OKHEP-95-03","hep-th",,"  We show that the trace anomaly for gravitons calculated using the usual
effective action formalism depends on the choice of gauge when the background
spacetime is not a solution of the classical equation of motion, that is, when
off-shell. We then use the gauge independent Vilkovisky-DeWitt effective action
to restore gauge independence to the off-shell case. Additionally we explicitly
evaluate trace anomalies for some N-sphere background spacetimes.
","[{""version"":""v1"",""created"":""Mon, 27 Mar 1995 19:29:29 GMT""},{""version"":""v2"",""created"":""Tue, 18 Jul 1995 17:22:24 GMT""}]","2010-11-01"
"hep-th/9503188","R. Kantowski","H. T. Cho and R. Kantowski","Zeta-Functions for Non-Minimal Operators","26 pages, additional references","Phys.Rev. D52 (1995) 4588-4599","10.1103/PhysRevD.52.4588","OKHEP-95-02","hep-th",,"  We evaluate zeta-functions $\zeta(s)$ at $s=0$ for invariant non-minimal
2nd-order vector and tensor operators defined on maximally symmetric even
dimensional spaces. We decompose the operators into their irreducible parts and
obtain their corresponding eigenvalues. Using these eigenvalues, we are able to
explicitly calculate $\zeta(0)$ for the cases of Euclidean spaces and
$N$-spheres. In the $N$-sphere case, we make use of the Euler-Maclaurin formula
to develop asymptotic expansions for the required sums. The resulting
$\zeta(0)$ values for dimensions 2 to 10 are given in the Appendix.
","[{""version"":""v1"",""created"":""Mon, 27 Mar 1995 19:39:54 GMT""},{""version"":""v2"",""created"":""Tue, 18 Jul 1995 17:22:31 GMT""}]","2009-10-28"
"hep-th/9503189","Chris Lassig","C. C. Lassig and G. C. Joshi","An Octonionic Gauge Theory","14 pages, Revtex","Chaos Solitons Fractals 7 (1996) 769-775",,"UM-P-95/09; RCHEP-95/05","hep-th hep-ph",,"  The nonassociativity of the octonion algebra necessitates a bimodule
representation, in which each element is represented by a left and a right
multiplier. This representation can then be used to generate gauge
transformations for the purpose of constructing a field theory symmetric under
a gauged octonion algebra, the nonassociativity of which appears as a failure
of the representation to close, and hence produces new interactions in the
gauge field kinetic term of the symmetric Lagrangian.
","[{""version"":""v1"",""created"":""Tue, 28 Mar 1995 01:00:45 GMT""}]","2007-05-23"
"hep-th/9503190","Ryuichi Nakayama","Ryuichi Nakayama and Toshiya Suzuki","Integrability of Schwinger-Dyson Equations in 2D Quantum Gravity and c <
  1 Non-critical String Field Theory","15 pages, Latex, 4 figures","Phys.Lett. B354 (1995) 69-77","10.1016/0370-2693(95)00615-R","EPHOU-95002, HUPS-94-5","hep-th",,"  We investigate the integrability of the Schwinger-Dyson equations in $c = 1 -
\frac{6}{m(m+1)}$ string field theory which were proposed by Ikehara et al as
the continuum limit of the Schwinger-Dyson equations of the matrix chain model.
We show the continuum Schwinger-Dyson equations generate a closed algebra. This
algebra contains Virasoro algebra but does not coincide with $W_{\infty}$
algebra. We include in the Schwinger-Dyson equations a new process of removing
from the loop boundaries the operator ${\cal H}(\sigma)$ which locally changes
the spin configuration. We also derive the string field Hamiltonian from the
continuum Schwinger-Dyson equations. Its form is universal for all $c = 1 -
\frac{6}{m(m+1)}$ string theories.
","[{""version"":""v1"",""created"":""Tue, 28 Mar 1995 06:23:46 GMT""}]","2009-10-28"
"hep-th/9503191","Azizollah Shafiekhani","W.-S. Chung and A. Shafiekhani","Free Field Representation of $osp(2|1)$ and $U_q(osp(2|1))$ and N=1
  (q-)Superstring Correlation Functions","10 pages, LaTex, no figures, New section has been added; to be
  published in Phys. Lett. B","Phys.Lett. B381 (1996) 68-72","10.1016/0370-2693(96)00550-3","IPM-95-078","hep-th",,"  The free field realization of irreducible representations of $\os$ is
constructed, by a unified and systematic scheme. The $q$-analog of this unified
scheme is used to construct $q$-free field realization of irreducible
representations of $\uos$. By using these realization, the two point function
of $N=1$ superconformal (q-superconformal) model based on $\os$ ($\uos$)
symmetry have been calculated.
","[{""version"":""v1"",""created"":""Tue, 28 Mar 1995 13:21:52 GMT""},{""version"":""v2"",""created"":""Mon, 20 May 1996 14:27:42 GMT""}]","2015-06-26"
"hep-th/9503192","Manfred Schweda","S. Emery, O. Moritsch, M. Schweda, T. Sommer, H. Zerrouki","Local gravitational supersymmetry of Chern-Simons theory in the vielbein
  formalism","19 pages in LaTeX, without figures","Helv.Phys.Acta 68 (1995) 167-186",,"TUW 95-05","hep-th",,"  We discuss the Chern-Simons theory in three-dimensional curved space-time in
the vielbein formalism. Due to the additional presence of the local Lorentz
symmetry, beside the diffeomorphisms, we will include a local gravitational
supersymmetry (superdiffeomorphisms and super-Lorentz transformations), which
allows us to show the perturbative finiteness at all orders.
","[{""version"":""v1"",""created"":""Tue, 28 Mar 1995 08:28:24 GMT""}]","2007-05-23"
"hep-th/9503193","Henneaux M.","S. Deser and M. Henneaux","Gauge Properties of Conserved Currents in Abelian Versus Nonabelian
  Theories","latex, 9 pages","Mod.Phys.Lett.A10:991-996,1995","10.1142/S0217732395001095","CERN-TH/95-60, BRX-TH-373, ULB-TH-95/04","hep-th",,"  We clarify the physical origin of the difference between gauge properties of
conserved currents in abelian and nonabelian theories. In the latter, but not
in the former, such currents can always be written on shell as gauge invariants
modulo identically conserved, superpotential, terms. For the ``isotopic"" vector
and the stress tensor currents of spins 1 and 2 respectively, we explain this
difference by the fact that the non-abelian theories are just the self-coupled
versions of the abelian ones using these currents as sources. More precisely,
we indicate how the self-coupling turns the non-invariantizable abelian
conserved currents into (on-shell) superpotentials. The fate of other conserved
currents is also discussed.
","[{""version"":""v1"",""created"":""Tue, 28 Mar 1995 08:32:45 GMT""}]","2008-11-26"
