"hep-th/9503194","Jose Luis Cortes","Jos\'e Luis Cort\'es, Elena Rivas and Luis Vel\'azquez","Extended Dualization: a method for the Bosonization of Anomalous Fermion
  Systems in Arbitrary Dimension","Revised version including major changes in section 3, to be published
  in Phys. Rev. D","Phys.Rev.D53:5952-5962,1996","10.1103/PhysRevD.53.5952",,"hep-th",,"  The technique of extended dualization developed in this paper is used to
bosonize quantized fermion systems in arbitrary dimension $D$ in the low energy
regime. In its original (minimal) form, dualization is restricted to models
wherein it is possible to define a dynamical quantized conserved charge. We
generalize the usual dualization prescription to include systems with dynamical
non--conserved quantum currents. Bosonization based on this extended
dualization requires the introduction of an additional rank $0$ (scalar) field
together with the usual antisymmetric tensor field of rank $(D-2)$. Our
generalized dualization prescription permits one to clearly distinguish the
arbitrariness in the bosonization from the arbitrariness in the quantization of
the system. We study the bosonization of four--fermion interactions with large
mass in arbitrary dimension. First, we observe that dualization permits one to
formally bosonize these models by invoking the bosonization of the free massive
Dirac fermion and adding some extra model--dependent bosonic terms. Secondly,
we explore the potential of extended dualization by considering the particular
case of \underbar{chiral} four--fermion interactions. Here minimal dualization
is inadequate for calculating the extra bosonic terms. We demonstrate the
utility of extended dualization by successfully completing the bosonization of
this chiral model. Finally, we consider two examples in two dimensions which
illuminate the utility of using extended dualization by showing how
quantization ambiguities in a fermionic theory propagate into the bosonized
version. An explicit parametrization of the quantization ambiguities of the
chiral current in the Chiral Schwinger model is obtained. Similarly, for the
sine--Gordon interaction in the massive Thirring model the quantization
","[{""version"":""v1"",""created"":""Tue, 28 Mar 1995 07:49:43 GMT""},{""version"":""v2"",""created"":""Thu, 28 Mar 1996 14:44:58 GMT""}]","2011-07-19"
"hep-th/9503195","Dept of Theor. Phys.","P.M.Lavrov, A.A.Reshetnyak","One-loop effective action for Einstein gravity in special background
  gauge","17 pages, Latex, no figures","Phys.Lett.B351:105-110,1995","10.1016/0370-2693(95)00398-5","TSU QFTD 11\95","hep-th",,"  The one-loop effective action for Einstein gravity in a special one-parameter
background gauge is calculated up to first order in a gauge parameter. It is
shown that the effective action does not depend upon the gauge parameter on
shell.
","[{""version"":""v1"",""created"":""Tue, 28 Mar 1995 11:37:02 GMT""}]","2010-11-01"
"hep-th/9503197","Dept of Theor. Phys.","P.M.Lavrov, P.Yu.Moshin and A.A.Reshetnyak","IRREDUCIBLE GAUGE THEORIES IN THE FRAMEWORK OF THE Sp(2)-COVARIANT
  QUANTIZATION METHOD","35 pages, Latex, no figures","Int.J.Mod.Phys. A11 (1996) 3097-3126",,"TSU QFTD 10\95","hep-th",,"  Irreducible gauge theories in both the Lagrangian and Hamiltonian versions of
the Sp(2)-covariant quantization method are studied. Solutions to generating
equations are obtained in the form of expansions in power series of ghost and
auxiliary variables up to the 3d order inclusively.
","[{""version"":""v1"",""created"":""Tue, 28 Mar 1995 11:42:13 GMT""}]","2007-05-23"
"hep-th/9503198","Jean-Loup Gervais","E. Cremmer, J.-L. Gervais, J. Schnittger","Operator Coproduct-Realization of Quantum Group Transformations in Two
  Dimensional Gravity, I.","33 pages, latex, no figures","Commun.Math.Phys. 178 (1996) 147","10.1007/BF02104913","CERN-TH/95-48, LPTENS-95/11","hep-th math.QA q-alg",,"  A simple connection between the universal $R$ matrix of $U_q(sl(2))$ (for
spins $\demi$ and $J$) and the required form of the co-product action of the
Hilbert space generators of the quantum group symmetry is put forward. This
gives an explicit operator realization of the co-product action on the
covariant operators. It allows us to derive the quantum group covariance of the
fusion and braiding matrices, although it is of a new type: the generators
depend upon worldsheet variables, and obey a new central extension of
$U_q(sl(2))$ realized by (what we call) fixed point commutation relations. This
is explained by showing that the link between the algebra of field
transformations and that of the co-product generators is much weaker than
previously thought. The central charges of our extended $U_q(sl(2))$ algebra,
which includes the Liouville zero-mode momentum in a nontrivial way are related
to Virasoro-descendants of unity. We also show how our approach can be used to
derive the Hopf algebra structure of the extended quantum-group symmetry
$U_q(sl(2))\odot U_{\qhat}(sl(2))$ related to the presence of both of the
screening charges of 2D gravity.
","[{""version"":""v1"",""created"":""Tue, 28 Mar 1995 14:01:24 GMT""}]","2009-10-28"
"nucl-th/9503024","Dirk Rischke","Miklos Gyulassy","Quark Matter 95: Concluding Remarks","14 pages, latex, 9 uuencoded figures, revised text","Nucl.Phys.A590:431c-448c,1995","10.1016/0375-9474(95)00251-U",,"nucl-th hep-ph",,"  Highlights of Quark Matter 95 are discussed.
","[{""version"":""v1"",""created"":""Mon, 27 Mar 1995 21:52:08 GMT""},{""version"":""v2"",""created"":""Mon, 3 Apr 1995 22:23:22 GMT""}]","2009-10-09"
"nucl-th/9503025","Herbert Muether","A. Polls, H. M\""uther and W.H. Dickhoff","Short-Range Correlations and the One-Body Density Matrix in Finite
  Nuclei","13 pages, RevTeX, 5 figures added",,"10.1016/0375-9474(95)00380-J","TU-95-0328","nucl-th",,"  The effects of short-range correlations derived from a realistic
meson-exchange potential on the single-particle density matrix in finite nuclei
are investigated by analyzing the one-body density in terms of the natural
orbits. Basic features of these natural orbits and their spectral distributions
are discussed. For many observables it seems to be sufficient to approximate
the one-body density matrix in terms of those natural orbits, which exhibit the
largest occupation probabilities. For the investigation of the high-momentum
components in the single-particle density, however, it is important to take
into account natural orbits with small occupation probabilities, originating
from the single-particle Green function at large negative energies.
","[{""version"":""v1"",""created"":""Tue, 28 Mar 1995 07:28:01 GMT""}]","2016-09-08"
"quant-ph/9503020","Olavo Leopoldino Da Silva Filho","L.S.F. Olavo","Quantum Mechanics as a Classical Theory I: Non-relativistic Theory","Same contents as the previously submitted paper but written in
  standard LaTex style. Submitted to Rev. Mod. Phys. 24 pages.",,,,"quant-ph",,"  The objective of this series of three papers is to axiomatically derive
quantum mechanics from classical mechanics and two other basic axioms. In this
first paper, Schreodinger's equation for the density matrix is fist obtained
and from it Schroedinger's equation for the wave functions is derived. The
momentum and position operators acting upon the density matrix are defined and
it is then demonstrated that they commute. Pauli's equation for the density
matrix is also obtained. A statistical potential formally identical to the
quantum potential of Bohm's hidden variable theory is introduced, and this
quantum potential is reinterpreted through the formalism here proposed. It is
shown that, for dispersion free {\it ensembles% }, Schroedinger's equation for
the density matrix is equivalent to Newton's equations. A general non-ambiguous
procedure for the construction of operators which act upon the density matrix
is presented. It is also shown how these operators can be reduced to those
which act upon the wave functions.
","[{""version"":""v1"",""created"":""Tue, 28 Mar 1995 13:43:47 GMT""},{""version"":""v2"",""created"":""Fri, 31 Mar 1995 17:32:37 GMT""},{""version"":""v3"",""created"":""Sat, 1 Apr 1995 20:00:15 GMT""}]","2008-02-03"
"quant-ph/9503021","Olavo Leopoldino Da Silva Filho","L.S.F. Olavo","Quantum Mechanics as a Classical Theory II: Relativistic Theory","Same contents as the previously submitted paper but written in
  standard LaTex style. Submitted to Rev. Mod. Phys. 12 pages.",,,,"quant-ph",,"  In this article, the axioms presented in the first one are reformulated
according to the special theory of relativity. Using these axioms, quantum
mechanic's relativistic equations are obtained in the presence of
electromagnetic fields for both the density function and the probability
amplitude. It is shown that, within the present theory's scope, Dirac's second
order equation should be considered the fundamental one in spite of the first
order equation. A relativistic expression is obtained for the statistical
potential. Axioms are again altered and made compatible with the general theory
of relativity. These postulates, together with the idea of the statistical
potential, allow us to obtain a general relativistic quantum theory for {\it
ensembles} composed of single particle systems.
","[{""version"":""v1"",""created"":""Tue, 28 Mar 1995 13:44:42 GMT""},{""version"":""v2"",""created"":""Fri, 31 Mar 1995 17:33:13 GMT""}]","2008-02-03"
"quant-ph/9503022","Olavo Leopoldino Da Silva Filho","L.S.F. Olavo","Quantum Mechanics as a Classical Theory III: Epistemology","Same contents as the previously submitted paper but written in
  standard LaTex style. Submitted to Rev. Mod. Phys. 16 pages.",,,,"quant-ph",,"  The two previous papers developed quantum mechanical formalism from classical
mechanics and two additional postulates. In the first paper it was also shown
that the uncertainty relations possess no ontological validity and only reflect
the formalism's limitations. In this paper, a Realist Interpretation of quantum
mechanics based on these results is elaborated and compared to the Copenhagen
Interpretation. We demonstrate that von Neumann's proof of the impossibility of
a hidden variable theory is not correct, independently of Bell's argumentation.
A local hidden variable theory is found for non-relativistic quantum mechanics,
which is nothing else than newtonian mechanics itself. We prove that Bell's
theorem does not imply in a non-locality of quantum mechanics, and also
demonstrate that Bohm's theory cannot be considered a true hidden variable
theory.
","[{""version"":""v1"",""created"":""Tue, 28 Mar 1995 13:45:43 GMT""},{""version"":""v2"",""created"":""Fri, 31 Mar 1995 17:34:12 GMT""}]","2008-02-03"
"quant-ph/9503023",,"Lajos Diosi","Quantum dynamics with two Planck constants and the semiclassical limit","9 pages, LaTex",,,,"quant-ph",,"  The mathematical possibility of coupling two quantum dynamic systems having
two different Planck constants, respectively, is investigated. It turns out
that such canonical dynamics are always irreversible. Semiclassical dynamics is
obtained by letting one of the two Planck constants go to zero. This
semiclassical dynamics will preserve positivity, as expected, so an improvement
of the earlier proposals by Aleksandrov and by Boucher and Traschen is
achieved. Coupling of quantized matter to gravity is illustrated by a
simplistic example.
","[{""version"":""v1"",""created"":""Tue, 28 Mar 1995 15:51:00 GMT""}]","2007-05-23"
"quant-ph/9503024","Olavo Leopoldino Da Silva Filho","L.S.F. Olavo","Quantum Mechanics as a Classical Theory IV: The Negative Mass Conjecture","Same contents as the previously submitted paper byt written in
  standard LaTex style. 21 pages.",,,,"quant-ph",,"  The following two papers form a natural development of a previous series of
three articles on the foundations of quantum mechanics; they are intended to
take the theory there developed to its utmost logical and epistemological
consequences. We show in the first paper that relativistic quantum mechanics
might accommodate without ambiguities the notion of negative masses. To achieve
this, we rewrite all of its formalism for integer and half integer spin
particles and present the world revealed by this conjecture. We also base the
theory on the second order Klein-Gordon's and Dirac's equations and show that
they can be stated with only positive definite energies. In the second paper we
show that the general relativistic quantum mechanics derived in paper II of
this series supports this conjecture.
","[{""version"":""v1"",""created"":""Tue, 28 Mar 1995 14:19:18 GMT""},{""version"":""v2"",""created"":""Fri, 31 Mar 1995 17:35:08 GMT""}]","2008-02-03"
"quant-ph/9503025","Olavo Leopoldino Da Silva Filho","L.S.F. Olavo","Quantum Mechanics as a Classical Theory V: The Quantum Schwartzchild
  Problem","Same contents as the previously submitted paper but written in
  standard LaTex style. 14 pages.",,,,"quant-ph",,"  In this continuation paper, we apply the general relativistic quantum theory
for one particle systems, derived in paper II of this series, to a simple
problem: the quantum Schwartzchild problem, where one particle of mass {\it m%
} gravitates around a massive body. The results thus obtained reveal that, in
the realm of such a theory, the negative mass conjecture we made in paper IV of
this series is, indeed, adequate. It is shown that gravitation is responsible
for the loss of energy quantization. We relate this property with the ideas of
irreversibility and time arrow.
","[{""version"":""v1"",""created"":""Tue, 28 Mar 1995 14:19:41 GMT""},{""version"":""v2"",""created"":""Fri, 31 Mar 1995 17:35:40 GMT""}]","2008-02-03"
