"q-alg/9503017","Ting Guo Ho","P. Crehan, T.G. Ho","Geometry of Deformed Boson Algebras","20 pages, latex",,"10.1142/S0129055X96000342",,"q-alg math.QA",,"  Phase-space realisations of an infinite parameter family of quantum
deformations of the boson algebra in which the $q$-- and the $qp$--deformed
algebras arise as special cases are studied. Quantum and classical models for
the corresponding deformed oscillators are provided. The deformation parameters
are identified with coefficients of non-linear terms in the normal forms
expansion of a family of classical Hamiltonian systems. These quantum
deformations are trivial in the sense that they correspond to non-unitary
transformations of the Weyl algebra. They are non-trivial in the sense that the
deformed commutators consistently quantise a class of non-canonical classical
Poisson structures.
","[{""version"":""v1"",""created"":""Thu, 30 Mar 1995 08:17:57 GMT""}]","2009-10-28"
