"cond-mat/9510172","Leo Radzihovsky","Leo Radzihovsky and John Toner","A New Phase of Tethered Membranes: Tubules","4 pages, self-unpacking uuencoded compressed postscript file with
  figures already inside text; unpacking instructions are at the top of file.
  To appear in Phys. Rev. Lett. November (1995)",,"10.1103/PhysRevLett.75.4752","University of Colorado, University of Oregon preprints","cond-mat",,"  We show that fluctuating tethered membranes with {\it any} intrinsic
anisotropy unavoidably exhibit a new phase between the previously predicted
``flat'' and ``crumpled'' phases, in high spatial dimensions $d$ where the
crumpled phase exists. In this new ""tubule"" phase, the membrane is crumpled in
one direction but extended nearly straight in the other. Its average thickness
is $R_G\sim L^{\nu_t}$ with $L$ the intrinsic size of the membrane. This phase
is more likely to persist down to $d=3$ than the crumpled phase. In Flory
theory, the universal exponent $\nu_t=3/4$, which we conjecture is an exact
result. We study the elasticity and fluctuations of the tubule state, and the
transitions into it.
","[{""version"":""v1"",""created"":""Wed, 1 Nov 1995 02:30:09 GMT""}]","2009-10-28"
"cond-mat/9510173","Hyuncheol Lee","H. C. Lee and P. B. Wiegmann","Coherent versus Incoherent Transport in Layered Doped Mott Insulators","RevTex, 21 pages, no figures. Submitted to Phys. Rev. B","Phys. Rev. B 53, 11817 (1996)","10.1103/PhysRevB.53.11817",,"cond-mat",,"  There exist strong experimental evidences for the dimensional cross-over from
two to three dimensions as \lan compounds are overdoped. In this paper we
describe the dimensional cross-over of the layered correlated metal in the
gauge theory framework. In particular, we obtain the anomalous exponent 3/2 for
the temperature dependence of resistivity observed in overdoped \lan.
","[{""version"":""v1"",""created"":""Wed, 1 Nov 1995 03:07:21 GMT""}]","2009-10-28"
"cond-mat/9511001","Noh Jaedong","Jae Dong Noh and Doochul Kim (Seoul National University)","Finite-size scaling and the toroidal partition function of the critical
  asymmetric six-vertex model","19 pages, 5 Postscript figure files in the form of uuencoded
  compressed tar file",,"10.1103/PhysRevE.53.3225","SNUTP 95-112","cond-mat",,"  Finite-size corrections to the energy levels of the asymmetric six-vertex
model transfer matrix are considered using the Bethe ansatz solution for the
critical region. The non-universal complex anisotropy factor is related to the
bulk susceptibilities. The universal Gaussian coupling constant $g$ is also
related to the bulk susceptibilities as $g=2H^{-1/2}/\pi$, $H$ being the
Hessian of the bulk free energy surface viewed as a function of the two fields.
The modular covariant toroidal partition function is derived in the form of the
modified Coulombic partition function which embodies the effect of
incommensurability through two mismatch parameters. The effect of twisted
boundary conditions is also considered.
","[{""version"":""v1"",""created"":""Wed, 1 Nov 1995 08:14:57 GMT""}]","2009-10-28"
"cond-mat/9511002","Igor Lukyanchuk","P. Saint-Gregoire, I. Luk'yanchuk, E.Snoeck, C.Roucau, V. Janovec
  (GDPC, Univ. MontpellierII, France; Landau Inst. for Theor. Phys., Moscow;
  CEMES-LOE, Toulouse, France; Univ. of Technology, Liberec Czech Republic)","New Incommensurate Elongated-Triangle Phase in Quartz","4 pages revtex file +3 uuencoded compressed postscript figures","JETP Lett. 64, 410 (1996)","10.1134/1.567212",,"cond-mat",,"  We present for the first time the evidence for a thermodynamically stable
incommensurate elongated-triangle ($ELT$) phase in quartz observed by
transmission electron microscopy at structural $\alpha -\beta $ transition. The
phase sequence on cooling is: uniform $\beta $ phase - stripe incommensurate
phase (ferroelastic) - incommensurate equilateral-triangle ($EQT$) phase
(ferroelectric) - incommensurate $ELT$ (ferroelectric and ferroelastic) -
uniform $\alpha $ phase. The $ELT$ blocks could be responsible for the large
light scattering in the vicinity of $\alpha-\beta$ transition.
","[{""version"":""v1"",""created"":""Wed, 1 Nov 1995 12:02:55 GMT""},{""version"":""v2"",""created"":""Fri, 3 Nov 1995 13:35:53 GMT""}]","2008-02-03"
"cs/9511101",,"S. B. Huffman, J. E. Laird","Flexibly Instructable Agents","See http://www.jair.org/ for any accompanying files","Journal of Artificial Intelligence Research, Vol 3, (1995),
  271-324",,,"cs.AI",,"  This paper presents an approach to learning from situated, interactive
tutorial instruction within an ongoing agent. Tutorial instruction is a
flexible (and thus powerful) paradigm for teaching tasks because it allows an
instructor to communicate whatever types of knowledge an agent might need in
whatever situations might arise. To support this flexibility, however, the
agent must be able to learn multiple kinds of knowledge from a broad range of
instructional interactions. Our approach, called situated explanation, achieves
such learning through a combination of analytic and inductive techniques. It
combines a form of explanation-based learning that is situated for each
instruction with a full suite of contextually guided responses to incomplete
explanations. The approach is implemented in an agent called Instructo-Soar
that learns hierarchies of new tasks and other domain knowledge from
interactive natural language instructions. Instructo-Soar meets three key
requirements of flexible instructability that distinguish it from previous
systems: (1) it can take known or unknown commands at any instruction point;
(2) it can handle instructions that apply to either its current situation or to
a hypothetical situation specified in language (as in, for instance,
conditional instructions); and (3) it can learn, from instructions, each class
of knowledge it uses to perform tasks.
","[{""version"":""v1"",""created"":""Wed, 1 Nov 1995 00:00:00 GMT""}]","2014-11-17"
"dg-ga/9510010","Dan Burghelea","D.Burghelea (Ohio State University),L.Friedlander (University of
  Arizona), T.Kappeler (Ohio State University)","Torsions for manifolds with boundary and glueing formulas","58 pages, amstex",,,,"dg-ga math.DG",,"  We extend the definition of analytic and Reidemeister torsion from closed
compact Riemannian manifolds to compact Riemannian manifolds with boundary $(M,
\partial M)$, given a flat bundle $\Cal F$ of $\Cal A$-Hilbert modules of
finite type and a decomposition of the boundary $\partial M =\partial_- M \cup
\partial_+ M$ into disjoint components. In particular we extend the $L-2$
analytic and Reidemeister torsions to compact manifolds with boundary. If the
system $(M,\partial_-M, \partial_+M, \Cal F)$ is of determinant class we
compute the quotient of the analytic and the Reidemeister torsion and prove
glueing formulas for both of them. In particular we answer positively
Conjecture 7.6 in [LL]
","[{""version"":""v1"",""created"":""Tue, 31 Oct 1995 23:53:19 GMT""}]","2008-02-03"
"gr-qc/9510063","Chris Isham","Chris Isham","Structural Issues in Quantum Gravity","42 pages, latex, no figures. Writeup of GR14 plenary lecture",,,"IMPERIAL/TP/95-96/07","gr-qc hep-th quant-ph",,"  A discursive, non-technical, analysis is made of some of the basic issues
that arise in almost any approach to quantum gravity, and of how these issues
stand in relation to recent developments in the field. Specific topics include
the applicability of the conceptual and mathematical structures of both
classical general relativity and standard quantum theory. This discussion is
preceded by a short history of the last twenty-five years of research in
quantum gravity, and concludes with speculations on what a future theory might
look like.
","[{""version"":""v1"",""created"":""Tue, 31 Oct 1995 22:45:43 GMT""}]","2007-05-23"
"gr-qc/9510067",,"Marco Litterio, Leszek M. Soko{\l}owski, Zdzis{\l}aw A. Golda, Luca
  Amendola and Andrzej Dyrek","Anisotropic Inflation from Extra Dimensions","LaTeX, 11 pages, 5 figures available via fax on request to
  litterio@astrom.astro.it, submitted to Phys. Lett. B","Phys.Lett. B382 (1996) 45-52","10.1016/0370-2693(96)00361-9",,"gr-qc",,"  Vacuum multidimensional cosmological models with internal spaces being
compact $n$-dimensional Lie group manifolds are considered. Products of
3-spheres and $SU(3)$ manifold (a novelty in cosmology) are studied. It turns
out that the dynamical evolution of the internal space drives an accelerated
expansion of the external world (power law inflation). This generic solution
(attractor in a phase space) is determined by the Lie group space without any
fine tuning or arbitrary inflaton potentials. Matter in the four dimensions
appears in the form of a number of scalar fields representing anisotropic scale
factors for the internal space. Along the attractor solution the volume of the
internal space grows logarithmically in time. This simple and natural model
should be completed by mechanisms terminating the inflationary evolution and
transforming the geometric scalar fields into ordinary particles.
","[{""version"":""v1"",""created"":""Tue, 31 Oct 1995 16:25:07 GMT""}]","2009-10-28"
"gr-qc/9510068","Gabriel Nagy","Oscar A. Reula and Gabriel B. Nagy","A causal statistical family of dissipative divergence type fluids","LaTex, documentstyle{article}","J.Phys.A30:1695-1709,1997","10.1088/0305-4470/30/5/030",,"gr-qc",,"  In this paper we investigate some properties, including causality, of a
particular class of relativistic dissipative fluid theories of divergence type.
This set is defined as those theories coming from a statistical description of
matter, in the sense that the three tensor fields appearing in the theory can
be expressed as the three first momenta of a suitable distribution function. In
this set of theories the causality condition for the resulting system of
hyperbolic partial differential equations is very simple and allow to identify
a subclass of manifestly causal theories, which are so for all states outside
equilibrium for which the theory preserves this statistical interpretation
condition. This subclass includes the usual equilibrium distributions, namely
Boltzmann, Bose or Fermi distributions, according to the statistics used,
suitably generalized outside equilibrium. Therefore this gives a simple proof
that they are causal in a neighborhood of equilibrium. We also find a bigger
set of dissipative divergence type theories which are only pseudo-statistical,
in the sense that the third rank tensor of the fluid theory has the symmetry
and trace properties of a third momentum of an statistical distribution, but
the energy-momentum tensor, while having the form of a second momentum
distribution, it is so for a different distribution function. This set also
contains a subclass (including the one already mentioned) of manifestly causal
theories.
","[{""version"":""v1"",""created"":""Tue, 31 Oct 1995 17:30:43 GMT""}]","2008-11-26"
"gr-qc/9510069","Kevin Chan","Kevin C.K. Chan and Robert B. Mann","Spinning Black Holes in (2+1)-dimensional String and Dilaton Gravity","8 pages, Latex, statements about mass of 2+1 Hirschmann and Welch
  magnetic solution corrected, in press in Phys. Lett. B","Phys.Lett.B371:199-205,1996","10.1016/0370-2693(95)01609-0","WATPHYS-TH95/04","gr-qc",,"  We present a new class of spinning black hole solutions in
$(2+1)$-dimensional general relativity minimally coupled to a dilaton with
potential $e^{b\phi}\Lambda$. When $b=4$, the corresponding spinning black hole
is a solution of low energy $(2+1)$-dimensional string gravity. Apart from the
limiting case of the $BTZ$ black hole, these spinning black holes have no inner
horizon and a curvature singularity only at the origin. We compute the mass and
angular momentum parameters of the solutions at spatial infinity, as well as
their temperature and entropy.
","[{""version"":""v1"",""created"":""Tue, 31 Oct 1995 20:13:55 GMT""},{""version"":""v2"",""created"":""Thu, 14 Dec 1995 19:42:45 GMT""}]","2014-11-17"
"gr-qc/9510070","Robert Mann","C. Alvarez and R.B. Mann","The Equivalence Principle and g-2 Experiments","4 pages, latex, epsf, 1 figure","Phys.Lett. B409 (1997) 83-87","10.1016/S0370-2693(97)00801-0","WATPHYS-TH95/06","gr-qc hep-ph",,"  We consider the possibility of using measurements of anomalous magnetic
moments of elementary particles as a possible test of the Einstein Equivalence
Principle (EEP). For the class non-metric theories of gravity described by the
\tmu formalism we find several novel mechanisms for breaking the EEP, and
discuss the possibilities of setting new empirical constraints on such effects.
","[{""version"":""v1"",""created"":""Tue, 31 Oct 1995 18:11:49 GMT""}]","2009-10-28"
"gr-qc/9510071",,"L.H. Ford and Thomas A. Roman","Quantum Field Theory Constrains Traversable Wormhole Geometries","26 pages, plain LaTex","Phys.Rev. D53 (1996) 5496-5507","10.1103/PhysRevD.53.5496","TUTP-95-4","gr-qc",,"  Recently a bound on negative energy densities in four-dimensional Minkowski
spacetime was derived for a minimally coupled, quantized, massless, scalar
field in an arbitrary quantum state. The bound has the form of an uncertainty
principle-type constraint on the magnitude and duration of the negative energy
density seen by a timelike geodesic observer. When spacetime is curved and/or
has boundaries, we argue that the bound should hold in regions small compared
to the minimum local characteristic radius of curvature or the distance to any
boundaries, since spacetime can be considered approximately Minkowski on these
scales. We apply the bound to the stress-energy of static traversable wormhole
spacetimes. Our analysis implies that either the wormhole must be only a little
larger than Planck size or that there is a large discrepancy in the length
scales which characterize the wormhole. In the latter case, the negative energy
must typically be concentrated in a thin band many orders of magnitude smaller
than the throat size. These results would seem to make the existence of
macroscopic traversable wormholes very improbable.
","[{""version"":""v1"",""created"":""Tue, 31 Oct 1995 23:42:50 GMT""}]","2009-10-28"
"gr-qc/9511001","Edgardo Salomon Cheb Terrab","E.S. Cheb-Terrab, K. von Bulow (Symb. Comp. Group, DFT-UERJ, Brazil)","Analytical Solving of Partial Differential Equations using Symbolic
  Computing","6 pages, LaTeX, to be published in the Proceedings of ""Computing in
  High Energy Physics"" (CHEP-1995), World Scientific Publishing Co.
  Soft-package: file pdetools, available at ftp://152.92.4.69/pdetools/",,"10.1142/9789814447188_0149","IF-UERJ-95-20","gr-qc funct-an hep-th math.FA",,"  This work presents a brief discussion and a plan towards the analytical
solving of Partial Differential Equations (PDEs) using symbolic computing, as
well as an implementation of part of this plan as the PDEtools software-package
of commands.
","[{""version"":""v1"",""created"":""Wed, 1 Nov 1995 03:32:29 GMT""}]","2016-03-23"
"hep-lat/9510053","Dong Chen","Dong Chen","Excited states in the full QCD hadron spectrum on a $16^3 \times 40$
  lattice","Contribution to Lattice 95. 4 pages. Compressed, uuencoded postscript
  file. Send questions to dch@cuphyf.columbia.edu","Nucl.Phys.Proc.Suppl. 47 (1996) 382-385","10.1016/0920-5632(96)00079-5","CU-TP-718","hep-lat",,"  We report the hadron mass spectrum obtained on a $16^3 \times 40$ lattice at
$\beta = 5.7$ using two flavors of staggered fermions with $m a = 0.01$. We
calculate the masses of excited states that have the same quantum numbers as
the $\pi$, $\rho$ and $N$. They are obtained by a combined analysis of the
hadron correlators from sources of size $16^3$ and $8^3$. We also report on the
hadron spectrum for a wide range of valence quark masses.
","[{""version"":""v1"",""created"":""Tue, 31 Oct 1995 17:55:33 GMT""}]","2009-10-28"
"hep-lat/9510054","Chulwoo Jung","Chulwoo Jung","Analysis of saddle-point configurations in 3-dimensional SU(2) gauge
  theory","Contribution to Lattice 95. 4 pages. Compressed, uuencoded postscript
  file. Send questions to chulwoo@cuphyb.phys.columbia.edu","Nucl.Phys.Proc.Suppl. 47 (1996) 310-313","10.1016/0920-5632(96)00063-1","CU-TP-716","hep-lat",,"  We discuss the properties of a class of saddle point solutions in SU(2) in
three dimensions (SU$(2)_3$), exhibiting localized peaks in the action. These
configurations are generated by deterministic cooling and extremizing
algorithms from analytic configurations. They share some characteristics with
cooled and extremized Monte Carlo generated lattices. We have investigated
physical behavior such as the string tension by averaging over this class of
saddle point configurations. We have also measured the eigenvalues for harmonic
fluctuations around these configurations.
","[{""version"":""v1"",""created"":""Tue, 31 Oct 1995 18:40:15 GMT""}]","2015-06-25"
"hep-lat/9511001","Herbert Neuberger","Herbert Neuberger (Rutgers University)","A Lecture on Chiral Fermions","16 pages, plain TeX",,,"RU-95-79","hep-lat hep-ph hep-th",,"  This is an informal and approximate transcription of a talk presented at the
DESY workshop, September 27--29, 1995. The basic message is that real and long
overdue progress is taking place on the problem of regulating
non--perturbatively chiral gauge theories. Several approaches are reviewed with
emphasis on the overlap and some of the questions raised about it. No claim for
completeness or objectivity is made.
","[{""version"":""v1"",""created"":""Wed, 1 Nov 1995 15:42:16 GMT""}]","2007-05-23"
"hep-ph/9510455",,"S. Dawson and G. Valencia","Limits on Non-Standard Top Quark Couplings from Electroweak Measurements","9 pages, uses epsf.sty","Phys.Rev. D53 (1996) 1721-1724","10.1103/PhysRevD.53.1721","BNL-61907, ISU-HET-95-4","hep-ph",,"  We calculate the typical size of loop corrections to electroweak observables
arising from non-standard $Z {\overline t } t$ and $W t b$ vertices. We use an
effective Lagrangian formalism based on the electroweak gauge group
$SU(2)_L\times U(1)_Y \rightarrow U(1)_{EM}$. Limits on the non-standard model
top quark couplings from electroweak observables are presented and compared
with previously obtained limits.
","[{""version"":""v1"",""created"":""Tue, 31 Oct 1995 16:44:53 GMT""}]","2009-10-28"
"hep-ph/9510456",,"Axel Kwiatkowski (LBNL, Berkeley), Matthias Steinhauser (TTP, Univ.
  Karlsruhe)","The $\msbar$ Renormalized Bottom Mass of Order ${\cal O}(\alpha_s G_F
  M_t^2)$ and its Application to $\Gamma(H\to b\bar{b})$","16 pages, LATEX, uses epsfig.sty, 15 figures included as uuencoded,
  gzipped, tarred postscript files. The complete postscript file, including
  figures, is available via anonymous ftp at
  ftp://ttpux2.physik.uni-karlsruhe.de/ttp95-35/ttp95-35.ps (129.13.102.139) or
  via www at http://ttpux2.physik.uni-karlsruhe.de/cgi-bin/preprints/
  (TTP95-35) and at http://theor1.lbl.gov/www/theorgroup/papers/37881.ps",,,"TTP95-35, LBNL-37881","hep-ph",,"  The renormalized mass of the bottom quark is calculated at the two loop level
to order ${\cal O}(\alpha_s G_F M_t^2)$ in the $\msbar$ renormalization scheme.
Different strategies for the computation are outlined. The result is applied to
the partial decay rate $\Gamma(H\rightarrow b\bar{b})$ of the Higgs boson into
bottom quarks. Expressing the width in terms of the running mass instead of the
bottom pole mass allows to treat the ${\cal O}(\alpha_s G_F M_t^2)$ radiative
corrections on the same footing as is commonly used in pure QCD calculations.
The numerical values for the corrections are given and the sizes of different
contributions are compared.
","[{""version"":""v1"",""created"":""Tue, 31 Oct 1995 17:36:16 GMT""}]","2007-05-23"
"hep-ph/9510457","Ed Stoeffhaas","V. Barger, S. Fleming, and R.J.N. Phillips","Double gluon fragmentation to $J/\psi$ pairs at the Tevatron","Revtex, 11 pages, one postscript figure. Compressed postscript file
  of text with figure available at
  http://phenom.physics.wisc.edu/pub/preprints/1995/madph-95-911.ps.Z or at
  ftp://phenom.physics.wisc.edu/pub/preprints/1995/madph-95-911.ps.Z","Phys.Lett.B371:111-116,1996","10.1016/0370-2693(95)01592-2","madph-95-911, RAL-TR-95-062","hep-ph",,"  It has been proposed that the large cross sections for prompt $\psi$,
$\psi'$, and $\chi_c$ production at the Fermilab Tevatron $p\bar p$ collider
can be explained by a dominant color-octet term in the fragmentation function
for a gluon to split into quarkonium. We show that this mechanism makes
testable predictions for double-quarkonium $\psi\psi$, $\psi\psi'$,
$\psi\chi_c$, $\psi\Upsilon$ and $\psi\chi_b$ production, as well as for $W
\psi$ production, using color-octet matrix elements previously determined from
charmonium production data. The $\psi\psi$ signal would already be measurable
at the Tevatron, while the $\psi\chi_c$ and $W\psi$ signals would be on the
edge of present detectability.
","[{""version"":""v1"",""created"":""Tue, 31 Oct 1995 19:12:48 GMT""}]","2009-09-15"
"hep-ph/9510458",,"Xerxes Tata (University of Hawaii)","Supersymmetry Phenomenology: A Microreview","7 pages LaTeX file, no figures. Needs sprocl.sty which can be
  obtained from the server. Talk presented at 1995 EPS Conference, Brussels,
  Belgium. A postscript file of the paper can be obtained via anonymous ftp at
  ftp://hep.fsu.edu/preprints/tata/brussels.ps",,,"UH-511-834-95","hep-ph",,"  We briefly review the current status and future prospects for supersymmetry
searches at colliders, and discuss strategies by which further information
about sparticle properties may be obtained at the LHC.
","[{""version"":""v1"",""created"":""Tue, 31 Oct 1995 21:42:20 GMT""}]","2007-05-23"
"hep-ph/9510459","Valeri Dvoeglazov","Valeri V. Dvoeglazov (Zacatecas U., Zac., M\'exico)","Majorana -- like models in the physics of neutral particles","LaTeX file, 16pp., kapproc.sty . Reported at the XXX Escuela Latino
  Americana de F\'{\i}sica, M\'exico city (July 17- August 4, 1995); the Int.
  Conference on the Theory of the Electron, ICTE'95, Cuautitl\'an, M\'exico
  (Sept. 27-29, 1995) and at the XXXVIII Congreso Nacional de la SMF,
  Zacatecas, M\'exico (Oct. 16-20, 1995)","Adv.Appl.Clifford Algebras 7S:303-319,1997",,"EFUAZ FT-95-20","hep-ph",,"  Due to the standard electroweak model we have become accustomed to think
about a neutrino $\nu$ and its antineutrino $\bar \nu$ as distinct particles.
However, it has long been recognized that the apparent distinction between them
may be only an illusion. Implying these words of Prof. B. Kayser we give an
alternative insight in the physics of neutral particles (neutrino and photon).
The proposed formalism which is based on the Majorana ideas could also be
useful for deeper understanding of the nature of electron.
","[{""version"":""v1"",""created"":""Tue, 31 Oct 1995 17:59:48 GMT""}]","2011-04-15"
"hep-ph/9510460","F. Steffens","F. M. Steffens and A. W. Thomas","The Role of Strange and Charm Quarks in the Nucleon Spin Structure
  Function","23 pages, 7 uuencoded figures, accepted for publication in Phys. Rev.
  D","Phys.Rev.D53:1191-1198,1996","10.1103/PhysRevD.53.1191","ADP-95-38/T192","hep-ph",,"  We perform an analysis of the relation between the factorization scale and
the masses of the quarks in the calculation of the hard gluon coefficient in
polarized deep inelastic scattering. Particular attention is paid to the role
of strange and charm quarks at finite momentum transfer. It is found that for
the momentum transfer of the present experiments, the contribution from the
charm quark is significant.
","[{""version"":""v1"",""created"":""Wed, 1 Nov 1995 05:10:03 GMT""}]","2010-03-26"
"hep-ph/9510461","Masahiro Kawasaki","M. Kawasaki(ICRR, Univ. of Tokyo), T. Moroi (LBL, UC Berkeley) and T.
  Yanagida (Dept.of Physics, Univ. of Tokyo)","Can Decaying Particles Raise the Upperbound on the Peccei-Quinn Scale?","8 pages, no figures","Phys.Lett. B383 (1996) 313-316","10.1016/0370-2693(96)00743-5","ICRR-Report-345-95-11, UT-730","hep-ph astro-ph",,"  We have reexamine the effect of entropy production on the cosmic axion
density and find that the Peccei-Quinn scale $F_a$ larger than about
$10^{15}$~GeV is not allowed even if large entropy is produced by the decays of
coherent oscillations or non-relativistic massive particles. We stress that
this result is independent of the details of models for the decaying particles.
","[{""version"":""v1"",""created"":""Wed, 1 Nov 1995 05:48:40 GMT""}]","2009-10-28"
"hep-ph/9510462","Sergey Goloskokov","S.V.Goloskokov (BLTP JINR, Dubna, Russia)","Study of Single-Spin Asymmetry in Diffractive High- $p_t$-Jet Production","10 pages, Latex, 3 PS figures in one uuencode compressed file, talk
  at 2nd Meeting on Possible Measurements of Singly Polarized pp and pn
  Collisions at HERA (DESY-IfH Zeuthen, Aug 31- Sep 2, 1995)",,,,"hep-ph",,"  It is shown that the transverse single spin asymmetry in polarized
diffractive $Q \bar Q$ production depends strongly on the spin structure of the
pomeron coupling. It is concluded that the spin properties of quark-pomeron and
proton-pomeron vertices can be studied in future HERA-N experiments.
","[{""version"":""v1"",""created"":""Tue, 31 Oct 1995 20:17:05 GMT""}]","2007-05-23"
