"hep-ph/9511201","Tomohiro Inagaki","Tomohiro Inagaki","Phase Structure of a Four-Fermion Theory at Finite Temperature and
  Chemical Potential","12 pages, uses LaTeX, eepic.sty",,,"HUPD-9527","hep-ph",,"  We discuss the chiral symmetry restoration at high temperature and chemical
potential for a four-fermion interaction theory in arbitrary dimensions ($2\leq
D<4$). To investigate the ground state of the theory we calculate the effective
potential and the gap equation using the method of the $1/N$ expansion. We
study the phase structure at finite temperature and chemical potential and show
critical curves which divide the symmetric and asymmetric phase. We find that
the first and second order phase transition coexist for $2\leq D \leq 3$
depending on the value of the temperature and chemical potential. On the other
hand only the second order phase transition is realized for $3<D<4$. We also
present the critical behavior of the dynamically generated fermion mass. (Talk
presented at the Fourth International Workshop on Thermal Field Theory and
Their Application, Dalian, P. R. China, 5--10 August, 1995.)
","[{""version"":""v1"",""created"":""Wed, 1 Nov 1995 07:15:56 GMT""}]","2007-05-23"
"hep-ph/9511202","Dr. Peter A. Henning","P.A.Henning, K.Nakamura and Y.Yamanaka","Thermal Field Theory in Non-Equilibrium States","15 pages, latex, 2 figures, also available at
  ftp://tpri6c.gsi.de/pub/phenning/hny95/ or at
  http://www.gsi.de/~phenning/tft.html Dedicated to the memory of Hiroomi
  Umezawa",,"10.1142/S0217979296000696","GSI-Preprint 95-69","hep-ph",,"  Conventional transport theory is not really applicable to non-equilibrium
systems which exhibit strong quantum effects. We present two different
approaches to overcome this problem. Firstly we point out how transport
equations may be derived that incorporate a nontrivial spectral function as a
typical quantum effect, and test this approach in a toy model of a strongly
interacting degenerate plasma. Secondly we explore a path to include
non-equilibrium effects into quantum field theory through momentum mixing
transformations in Fock space. Although the two approaches are completely
orthogonal, they lead to the same coherent conclusion.
","[{""version"":""v1"",""created"":""Wed, 1 Nov 1995 09:01:12 GMT""}]","2015-06-25"
"hep-ph/9511203","Sergio Lupia","F. Becattini (Firenze Univ. & INFN, Firenze), A. Giovannini (Torino
  Univ. & INFN, Torino), S. Lupia (Max-Planck-Inst., Muenchen)","Multiplicity distributions in a thermodynamical model of hadron
  production in $e^+e^-$ collisions","15 pages, LaTeX file, uses epsfig.sty and cite.sty, 3 figures added
  as uu-encoded g-zipped tarred eps-files","Z.Phys.C72:491-496,1996","10.1007/s002880050269","DFF 233/10/1995, DFTT 64/95, MPI-PhT/95-105","hep-ph",,"  Predictions of a thermodynamical model of hadron production for multiplicity
distributions in $e^+e^-$ annihilations at LEP and PEP-PETRA centre of mass
energies are shown. The production process is described as a two-step process
in which primary hadrons emitted from the thermal source decay into final
observable particles. The final charged tracks multiplicity distributions turn
out to be of Negative Binomial type and are in quite good agreement with
experimental observations. The average number of clans calculated from fitted
Negative Binomial coincides with the average number of primary hadrons
predicted by the thermodynamical model, suggesting that clans should be
identified with primary hadrons.
","[{""version"":""v1"",""created"":""Wed, 1 Nov 1995 08:57:54 GMT""}]","2008-11-26"
"hep-th/9510231","Arne Lykke Larsen","V. Frolov, S. Hendy and A.L. Larsen","How to Create a 2-D Black Hole","Change of format, no change in content","Phys.Rev.D54:5093-5102,1996","10.1103/PhysRevD.54.5093","ALBERTA-THY-27-95","hep-th gr-qc",,"  The interaction of a cosmic string with a four-dimensional stationary black
hole is considered. If a part of an infinitely long string passes close to a
black hole it can be captured. The final stationary configurations of such
captured strings are investigated. A uniqueness theorem is proved, namely it is
shown that the minimal 2-D surface $\Sigma$ describing a captured stationary
string coincides with a {\it principal Killing surface}, i.e. a surface formed
by Killing trajectories passing through a principal null ray of the Kerr-Newman
geometry. Geometrical properties of principal Killing surfaces are investigated
and it is shown that the internal geometry of $\Sigma$ coincides with the
geometry of a 2-D black or white hole ({\it string hole}). The equations for
propagation of string perturbations are shown to be identical with the
equations for a coupled pair of scalar fields 'living' in the spacetime of a
2-D string hole. Some interesting features of physics of 2-D string holes are
described. In particular, it is shown that the existence of the extra
dimensions of the surrounding spacetime makes interaction possible between the
interior and exterior of a string black hole; from the point of view of the 2-D
geometry this interaction is acausal. Possible application of this result to
the information loss puzzle is briefly discussed.
","[{""version"":""v1"",""created"":""Wed, 1 Nov 1995 01:48:28 GMT""},{""version"":""v2"",""created"":""Tue, 21 Nov 1995 00:30:30 GMT""}]","2011-07-19"
"hep-th/9510233","Debashis Ghoshal","Debashis Ghoshal","Notes on a singular Landau-Ginzburg family","16 pages in harvmac (b)","Phys.Lett.B381:113-120,1996","10.1016/0370-2693(96)00538-2","MRI-PHY/21/95, TIFR-TH/95-52","hep-th",,"  We study some properties of a singular Landau-Ginzburg family characterized
by the multi-variable superpotential $W=-X^{-1}(Y_1Y_2)^{n-1} + {1\over n}
(Y_1Y_2)^n - Y_3Y_4$. We will argue that (the infra-red limit of) this theory
describes the topological degrees of freedom of the $c=1$ string compactified
at $n$ times the self-dual radius. We also briefly comment on the possible
realization of these line singularities as singularities of Calabi-Yau
manifolds.
","[{""version"":""v1"",""created"":""Tue, 31 Oct 1995 21:48:07 GMT""}]","2010-12-03"
"hep-th/9510234","Paul Aspinwall","Paul S. Aspinwall, Jan Louis","On the Ubiquity of K3 Fibrations in String Duality","LateX, 16 pages, 1 figure, minor corrections, reference added","Phys.Lett. B369 (1996) 233-242","10.1016/0370-2693(95)01541-8","CLNS-95/1369, LMU-TPW 95-16","hep-th",,"  We consider the general case of N=2 dual pairs of type IIA/heterotic string
theories in four dimensions. We show that if the type IIA string in this pair
can be viewed as having been compactified on a Calabi-Yau manifold in the usual
way then this manifold must be of the form of a K3 fibration. We also see how
the bound on the rank of the gauge group of the perturbative heterotic string
has a natural interpretation on the type IIA side.
","[{""version"":""v1"",""created"":""Tue, 31 Oct 1995 16:34:38 GMT""},{""version"":""v2"",""created"":""Wed, 22 Nov 1995 16:05:15 GMT""}]","2019-08-15"
"hep-th/9510235","Chand Devchand","Ch. Devchand and V. Ogievetsky","Conserved currents for unconventional supersymmetric couplings of
  self-dual gauge fields","6 pages, latex file","Phys.Lett. B367 (1996) 140-144","10.1016/0370-2693(95)01422-5",,"hep-th",,"  Self-dual gauge potentials admit supersymmetric couplings to higher-spin
fields satisfying interacting forms of the first order Dirac--Fierz equation.
The interactions are governed by conserved currents determined by
supersymmetry. These super-self-dual Yang-Mills systems provide on-shell
supermultiplets of arbitrarily extended super-Poincar\'e algebras; classical
consistency not setting any limit on the extension N. We explicitly display
equations of motion up to the $N=6$ extension. The stress tensor, which
vanishes for the $N\le 3$ self-duality equations, not only gets resurrected
when $N=4$, but is then a member of a conserved multiplet of gauge-invariant
tensors.
","[{""version"":""v1"",""created"":""Tue, 31 Oct 1995 22:54:27 GMT""}]","2009-10-28"
"hep-th/9510236","Juan Mateos Guilarte","Juan Mateos Guilarte","Light Monopoles, Electric Vortices and Instantons","9 pages, latex","Phys.Lett. B366 (1996) 174","10.1016/0370-2693(95)01319-9",,"hep-th",,"  The physics of the bare Seiberg-Witten action, without supersymmetric
partners, is considered in the framework of standard Quantum Field Theory. The
topological analysis related to the solutions of the Seiberg-Witten equations
is performed and the phase structure of the model is analysed.
","[{""version"":""v1"",""created"":""Tue, 31 Oct 1995 17:23:19 GMT""},{""version"":""v2"",""created"":""Thu, 2 Nov 1995 09:55:28 GMT""}]","2015-06-26"
"hep-th/9510237","Valeri Dvoeglazov","Valeri V. Dvoeglazov (Zacatecas U., M\'exico)","Significance of the Spinorial Basis in the Quantum Theory","LaTeX file (sprocl.sty), additional mydef.sty is attached in the end.
  4pp. Reported at the IV Wigner Symposium","Hadronic J.Suppl.10:349,1995",,"EFUAZ FT-95-17","hep-th",,"  Problems connected with a choice of the spinorial basis in the $(j,0)\oplus
(0,j)$ representation space are discussed. As shown it has profound
significance in the relativistic quantum theory. From the methodological
viewpoint this fact is related with the important dynamical role played by
space-time symmetries for all kind of interactions.
","[{""version"":""v1"",""created"":""Tue, 31 Oct 1995 17:57:27 GMT""}]","2011-04-15"
"hep-th/9510238","Valeri Dvoeglazov","Valeri V. Dvoeglazov (Zacatecas U., M\'exico)","Fermion-Fermion and Boson-Boson Amplitudes: Surprising Similarities","LaTeX file (sprocl.sty), 4pp. Presented at the IV Wigner Symp","Hadronic J.Suppl.10:359,1995",,"EFUAZ FT-95-18","hep-th",,"  Amplitudes for boson-boson and fermion-boson interactions are calculated in
the second order of perturbation theory in the Lobachevsky space. An essential
ingredient of the used model is the Weinberg's $2(2j+1)$ component formalism
for describing a particle of spin $j$, recently developed substantially. The
boson-boson amplitude is then compared with the two-fermion amplitude obtained
by Skachkov long ago on the ground of the hamiltonian formulation of quantum
field theory on the mass hyperboloid, $p_0^2 -{\vec p}^{2}=M^2$, proposed by
Kadyshevsky. The parametrization of the amplitudes by means of the momentum
transfer in the Lobachevsky space leads to same spin structures in the
expressions of $T$ matrices for the fermion and the boson cases. However,
certain differences are found. Possible physical applications are discussed.
","[{""version"":""v1"",""created"":""Tue, 31 Oct 1995 17:59:15 GMT""}]","2011-04-15"
"hep-th/9510239","Dr M. Siva Kumar","V. Narayanan and M. Sivakumar (School of Physics, University of
  Hyderabad, Hyderabad, India)","On the $W$-algebra in the Calegero-Sutherland model using the Exchange
  operators","Plain Tex, no figures, 13 pages","Mod.Phys.Lett. A11 (1996) 763-774","10.1142/S0217732396000771",,"hep-th",,"  We study the $W_\infty$ algebra in the Calegero-Sutherland model using the
exchange operators. The presence of all the sub-algebras of $W_\infty$ is shown
in this model. A simplified proof for this algebra, in the symmetric ordered
basics, is given. It is pointed out that the algebra contains in general,
nonlinear terms. Possible connection to the nonlinear $W_\infty$ is discussed.
","[{""version"":""v1"",""created"":""Tue, 31 Oct 1995 19:49:23 GMT""}]","2015-06-26"
"hep-th/9510240",,"Ken Halpern and Kerson Huang (Massachusetts Institute of Technology)","Non-Trivial Directions for Scalar Fields","UUencoded LaTex, 15 pages + 3 postscript figures","Phys.Rev. D53 (1996) 3252-3259","10.1103/PhysRevD.53.3252","CTP #2477","hep-th",,"  We study the eigenvectors of the renormalization-group matrix for scalar
fields at the Gaussian fixed point, and find that that there exist ``relevant''
directions in parameter space. They correspond to theories with exponential
potentials that are nontrivial and asymptotically free. All other potentials,
including polynomial potentials, are ``irrelevant,'' and lead to trivial
theories. Away from the Gaussian fixed point, renormalization does not induce
derivative couplings, but it generates non-local interactions.
","[{""version"":""v1"",""created"":""Tue, 31 Oct 1995 18:24:40 GMT""}]","2009-10-28"
"hep-th/9510241","Shyamoli Chaudhuri","Shyamoli Chaudhuri, George Hockney, and Joseph D. Lykken","Three Generations in the Fermionic Construction","harvmac, 51 pages","Nucl.Phys. B469 (1996) 357-386","10.1016/0550-3213(96)00142-3",,"hep-th",,"  We obtain three generation SU(3)_c X SU(2)_L X U(1)_Y string models in all of
the exactly solvable (0,2) constructions sampled by fermionization. None of
these examples, including those that are symmetric abelian orbifolds, rely on
the Z_2 X Z_2 orbifold underlying the NAHE basis. We present the first known
three generation models for which the hypercharge normalization, k_1, takes
values smaller than that obtained from an SU(5) embedding, thus lowering the
effective gauge coupling unification scale. All of the models contain
fractional electrically charged and vectorlike exotic matter that could survive
in the light spectrum.
","[{""version"":""v1"",""created"":""Tue, 31 Oct 1995 22:58:29 GMT""},{""version"":""v2"",""created"":""Wed, 1 Nov 1995 05:28:36 GMT""}]","2009-10-28"
"hep-th/9510242","Nam SoonKeon","Changhyun Ahn and Soonkeon Nam","Yangian Symmetries in the $SU(N)_1$ WZW Model and the
  Calogero-Sutherland Model","12 pages, Latex; Errors in the previous version are corrected and new
  results on spinons are included","Phys.Lett.B378:107-112,1996","10.1016/0370-2693(96)00402-9","SNUTP/95-113","hep-th cond-mat",,"  We study the $SU(N)$, level $1$ Wess-Zumino-Witten model, with affine primary
fields as spinon fields of fundamental representation. By evaluating the action
of the Yangian generators $Q_{0}^{a}, Q_{1}^{a}$ and the Hamiltonian $H_2$ on
two spinon states we get a new connection between this conformal field theory
and the Calogero-Sutherland model with $SU(N)$ spin. This connection clearly
confirms the need for the $W_3$ generator in $H_2$ and an additional term in
the $Q^{a}_{1}$. We also evaluate some energy spectra of $H_2$, by acting it on
multi-spinon states.
","[{""version"":""v1"",""created"":""Wed, 1 Nov 1995 06:53:59 GMT""},{""version"":""v2"",""created"":""Fri, 17 Nov 1995 05:20:03 GMT""}]","2010-02-05"
"hep-th/9511001",,"M.Koseki, R.Kuriki","Quantization of 2D Abelian Gauge Theory without the Kinetic Term of
  Gauge Field as Anomalous Gauge Theory","LaTex, 17pages",,,,"hep-th",,"  The massless Schwinger model without the kinetic term of gauge field has
gauge anomaly. We quantize the model as an anomalous gauge theory in the most
general class of gauge conditions. We show that the gauge field becomes a
dynamical variable because of gauge anomaly.
","[{""version"":""v1"",""created"":""Wed, 1 Nov 1995 09:30:04 GMT""},{""version"":""v2"",""created"":""Mon, 6 Nov 1995 07:46:13 GMT""},{""version"":""v3"",""created"":""Wed, 8 Nov 1995 00:32:44 GMT""}]","2008-02-03"
"hep-th/9511004","Stefan Mashkevich","Stefan Mashkevich (Kiev, Oslo)","Finite-size anyons and perturbation theory","18 pages (RevTex) + 4 PS figures (all included); a new section on
  equation of state added","Phys.Rev. D54 (1996) 6537-6543","10.1103/PhysRevD.54.6537",,"hep-th cond-mat",,"  We address the problem of finite-size anyons, i.e., composites of charges and
finite radius magnetic flux tubes. Making perturbative calculations in this
problem meets certain difficulties reminiscent of those in the problem of
pointlike anyons. We show how to circumvent these difficulties for anyons of
arbitrary spin. The case of spin 1/2 is special because it allows for a direct
application of perturbation theory, while for any other spin, a redefinition of
the wave function is necessary. We apply the perturbative algorithm to the
N-body problem, derive the first-order equation of state and discuss some
examples.
","[{""version"":""v1"",""created"":""Wed, 1 Nov 1995 14:13:46 GMT""},{""version"":""v2"",""created"":""Sun, 12 Nov 1995 20:02:37 GMT""},{""version"":""v3"",""created"":""Sat, 9 Nov 1996 04:07:16 GMT""}]","2009-10-28"
"math/9511206",,"Narcisse Randrianantoanina","Complemented copies of $\ell_1$ in spaces of vector valued measures and
  applications",,,,"Banach Archive 11/1/95","math.FA",,"  Let $X$ be a Banach space and $(\Omega,\Sigma)$ be a measure space. We
provide a characterization of sequences in the space of $X$-valued countably
additive measures on $\Omega,\Sigma)$ of bounded variation that generate
complemented copies of $\ell_1$. As application, we prove that if a dual Banach
space $E^*$ has Pe\l czy\'nski's property (V*) then so does the space of
$E^*$-valued countably additive measures with bounded variation. Another
application, we show that for a Banach space $X$, the space $\ell_\infty(X)$
contains a complemented copy of $\ell_1$ if and only if $X$ contains all
$\ell_1^n$ uniformly complemented.
","[{""version"":""v1"",""created"":""Wed, 1 Nov 1995 00:00:00 GMT""}]","2016-09-06"
"mtrl-th/9511001","Bernd Kohler","Shobhana Narasimhan, Matthias Scheffler","Unusually Large Thermal Expansion of Ag(111)","RevTeX, 4 pages, 4 figures in uufiles format",,,,"mtrl-th cond-mat.mtrl-sci",,"  We investigate the thermal behavior of the (111) surface of silver, using
phonon frequencies obtained from ab initio total energy calculations, and
anharmonic effects treated within a quasiharmonic approximation. Our results
reproduce the experimental observation of a large and anomalous increase in the
surface thermal expansion at high temperatures [P. Statiris et al., Phys. Rev.
Lett. 72, 3574 (1994)]. Surprisingly, we find that this increase can be
attributed to a rapid softening of the in-plane phonon frequencies, rather than
due to the anharmonicity of the out-of-plane surface phonon modes. This
provides evidence for a new mechanism for the enhancement of surface
anharmonicity. A comparison with Al(111) shows that the two surfaces behave
quite differently, with no evidence for such anomalous behavior on Al(111).
","[{""version"":""v1"",""created"":""Wed, 1 Nov 1995 08:36:21 GMT""}]","2008-02-03"
"mtrl-th/9511002","Bernd Kohler","Bernd Kohler, Steffen Wilke, Matthias Scheffler, Robert Kouba, Claudia
  Ambrosch-Draxl","Force calculation and atomic-structure optimization for the
  full-potential linearized augmented plane-wave code WIEN","submitted to Comp. Phys. Commun., 27 pages, 3 figures",,"10.1016/0010-4655(95)00139-5",,"mtrl-th cond-mat.mtrl-sci",,"  Following the approach of Yu, Singh, and Krakauer [Phys. Rev. B 43 (1991)
6411] we extended the linearized augmented plane wave code WIEN of Blaha,
Schwarz, and coworkers by the evaluation of forces. In this paper we describe
the approach, demonstrate the high accuracy of the force calculation, and use
them for an efficient geometry optimization of poly-atomic systems.
","[{""version"":""v1"",""created"":""Wed, 1 Nov 1995 09:30:02 GMT""}]","2009-10-28"
"mtrl-th/9511003","Gian-Marco Rignanese","G.-M. Rignanese, J.-M. Beuken, J.-P. Michenaud, and X. Gonze","Parallelisation of algorithms for ab initio computation of material
  properties","Published in the Proceedings of the 7th European Convex Users'
  Conference (ECUC '95), 17 pages (figures included)",,,,"mtrl-th cond-mat.mtrl-sci",,"  Parallel algorithms for ab initio calculations of vibrations modes of solids
are presented and implemented under PVM. Load balancing and communication
problems are dealt with in order to increase parallelism efficiency. For
accurate time measurements, synchronisation of processes must be achieved. The
results obtained by working with 1,2,4 and 8 processors of a Convex MetaSeries
computer are presented, showing a very good efficiency. Further parallelisation
of the codes (involving a three-dimensional Fast Fourier Transform) with
compiler directives on a Convex Exemplar, is discussed.
","[{""version"":""v1"",""created"":""Wed, 1 Nov 1995 15:18:37 GMT""}]","2008-02-03"
"mtrl-th/9511004","Bernd Kohler","Steffen Wilke, Matthias Scheffler","Potential Energy Surface for H_2 Dissociation over Pd(100)","RevTeX, 8 pages, 5 figures in uufiles format",,"10.1103/PhysRevB.53.4926",,"mtrl-th cond-mat.mtrl-sci",,"  The potential energy surface (PES) of dissociative adsorption of H_2 on
Pd(100) is investigated using density functional theory and the full-potential
linear augmented plane wave (FP-LAPW) method. Several dissociation pathways are
identified which have a vanishing energy barrier. A pronounced dependence of
the potential energy on ``cartwheel'' rotations of the molecular axis is found.
The calculated PES shows no indication of the presence of a precursor state in
front of the surface. Both results indicate that steering effects determine the
observed decrease of the sticking coefficient at low energies of the H_2
molecules. We show that the topology of the PES is related to the dependence of
the covalent H(s)-Pd(d) interactions on the orientation of the H_2 molecule.
","[{""version"":""v1"",""created"":""Wed, 1 Nov 1995 15:45:09 GMT""},{""version"":""v2"",""created"":""Thu, 2 Nov 1995 07:53:40 GMT""}]","2009-10-28"
"nucl-ex/9510004","Dan Fox","D. Fox, D. R. Bowman, G. C. Ball, A. Galindo-Uribarri, E. Hagberg, D.
  Horn, L. Beaulieu and Y. Larochelle","Calibration of Plastic Phoswich Detectors for Charged Particle Detection","17 pages, 5 figures","Nucl. Instrum. Meth. A374 (1996) 63","10.1016/0168-9002(95)01505-1","TASCC-P-95-24","nucl-ex",,"  The response of an array of plastic phoswich detectors to ions of $1\le Z\le
18$ has been measured from $E/A$=12 to 72 MeV. The detector response has been
parameterized by a three parameter fit which includes both quenching and high
energy delta-ray effects. The fits have a mean variation of $\le 4\%$ with
respect to the data.
","[{""version"":""v1"",""created"":""Tue, 31 Oct 1995 17:39:24 GMT""},{""version"":""v2"",""created"":""Wed, 1 Nov 1995 14:06:57 GMT""},{""version"":""v3"",""created"":""Thu, 2 Nov 1995 14:22:38 GMT""}]","2009-10-28"
"nucl-th/9510061",,"Lutz Jaede and Heinrich Viktor v. Geramb (Theoretische Kernphysik
  Universitaet Hamburg)","NN Potentials from Nonlinear Quantum Field Theory","16 pages, PostScript file",,,,"nucl-th",,"  We investigate self-interacting scalar, pseudoscalar and vector meson fields
and their influence on NN interactions. Due to the self--interaction one has to
solve nonlinear field equations which allow solitary wave solutions. A
propability amplitude for the propagation of these solutions is calculated
which can be applied in a One-Boson-Exchange Potential (OBEP). Using proper
normalization as an alternative to the usual renormalization scheme one obtains
amplitudes with the same momentum dependence as the conventional
Feynman-propagators multiplied with the form factors of the Bonn-B OBEP. From
this the usage of form factors might be replaced by the application of solitary
wave exchange. In addition the parameters entering the different meson
propagators show a connection in form of a simple scaling law which relates all
parameters to the pion self-interaction coupling constant.
","[{""version"":""v1"",""created"":""Tue, 31 Oct 1995 16:21:48 GMT""}]","2007-05-23"
"nucl-th/9510063","Marco Radici, -Pavia","A. Bianconi and M. Radici","The (e,e'p) Reaction and the Transition to the Eikonal Regime","LaTeX, 9 pages, 4 figures uuencoded separately, submitted to Physical
  Review C - Rapid Communications","Phys.Rev.C53:563-566,1996","10.1103/PhysRevC.53.563",,"nucl-th",,"  The reliability of the models describing the Final-State Interactions (FSI)
in (e,e$'$p) scattering at high proton energies is an important issue in view
of the experiments planned at CEBAF. One of the most popular approaches
adopted, the Glauber method, involves the linearization of the wave equation
for the ejected proton travelling through the residual nucleus. We have studied
the consequences of such an assumption for the case of the
$^{12}\mathrm{C(e,e}'\mathrm{p)}^{11}\hbox{\rm B}^*$ reaction at high proton
momenta by comparing the results with the predictions obtained when the
second-order differential equation for the proton wave is solved exactly for
each partial wave. We find that the two methods give well-correlated angular
distributions for momenta in the range 1-4 GeV/c, i.e. for kinematics relevant
to the transition to the eikonal regime.
","[{""version"":""v1"",""created"":""Tue, 31 Oct 1995 18:46:07 GMT""}]","2008-11-26"
"nucl-th/9510064","Derek Leinweber","Xuemin Jin and Derek B. Leinweber","Valid QCD Sum Rules for Vector Mesons in Nuclear Matter","20 page RevTeX Manuscript with embedded figures. This and related
  papers may also be obtained from http://www.phys.washington.edu/~derek/","Phys.Rev.C52:3344-3352,1995","10.1103/PhysRevC.52.3344","TRI-PP-95-40","nucl-th hep-ph",,"  QCD sum rules for vector mesons (rho, omega, phi) in nuclear matter are
reexamined with an emphasis on the reliability of various sum rules. Monitoring
the continuum contribution and the convergence of the operator product
expansion plays a crucial role in determining the validity of a sum rule. The
uncertainties arising from less than precise knowledge of the condensate values
and other input parameters are analyzed via a Monte-Carlo error analysis. Our
analysis leaves no doubt that vector-meson masses decrease with increasing
density. This resolves the current debate over the behavior of the vector-meson
masses and the sum rules to be used in extracting vector meson properties in
nuclear matter. We find a ratio of rho-meson masses of $m_{\rho^*}/m_\rho =
0.78\pm0.08$ at nuclear matter saturation density.
","[{""version"":""v1"",""created"":""Tue, 31 Oct 1995 19:08:18 GMT""}]","2008-11-26"
