"nucl-th/9510065","Akira Ono","Akira Ono and Hisashi Horiuchi","Statistical properties of antisymmetrized molecular dynamics for
  non-nucleon-emission and nucleon-emission processes","20 pages, LaTeX with revtex and epsf, uuenocded postscript figures,
  postscript version available at http://pearl.scphys.kyoto-u.ac.jp/~ono/","Phys.Rev.C53:2341-2351,1996","10.1103/PhysRevC.53.2341","RIKEN-AF-NP-214","nucl-th",,"  Statistical properties of the antisymmetrized molecular dynamics (AMD) are
classical in the case of nucleon emission processes, while they are quantum
mechanical for the processes without nucleon emission. We first clarify that
there coexist mutually opposite two statistics in the AMD framework: One is the
classical statistics of the motion of wave packet centroids and the other is
the quantum statistics of the motion of wave packets which is described by the
AMD wave function. We prove the classical statistics of wave packet centroids
by using the framework of the microcanonical ensemble of the nuclear system. We
show that the quantum statistics of wave packets emerges from the classical
statistics of wave packet centroids. It is emphasized that the temperature of
the classical statistics of wave packet centroids is different from the
temperature of the quantum statistics of wave packets. We then explain that the
statistical properties of AMD for nucleon emission processes are classical
because nucleon emission processes in AMD are described by the motion of wave
packet centroids. When we improve the description of the nucleon emission
process so as to take into account the momentum fluctuation due to the wave
packet spread, the AMD statistical properties for nucleon emission processes
change drastically into quantum statistics. Our study of nucleon emission
processes can be conversely regarded as giving another kind of proof of the
fact that the statistics of wave packets is quantum mechanical while that of
wave packet centroids is classical.
","[{""version"":""v1"",""created"":""Wed, 1 Nov 1995 07:01:49 GMT""}]","2008-11-26"
"quant-ph/9511001","Nicholas Landsman","N.P. Landsman (DAMTP, Cambridge)","Classical behaviour in quantum mechanics: a transition probability
  approach","LaTeX, 11 pages",,"10.1142/S0217979296000647",,"quant-ph",,"  A formalism is developed for describing approximate classical behaviour in
finite (but possibly large) quantum systems. This is done in terms of a
structure common to classical and quantum mechanics, viz. a Poisson space with
a transition probability. Both the limit where Planck's constant goes to zero
in a fixed finite system and the limit where the size of the system goes to
infinity are incorporated. In either case, classical behaviour is seen only for
certain observables and in a restricted class of states.
","[{""version"":""v1"",""created"":""Wed, 1 Nov 1995 14:59:09 GMT""}]","2015-06-26"
