"gr-qc/9511008",,"G. Giachetta and G.Sardanashvily","Stress-Energy-Momentum of Affine-Metric Gravity. Generalized Komar
  Superportential","12 pp, LaTeX file","Class.Quant.Grav.13:L67-L72,1996","10.1088/0264-9381/13/6/001","MPH/CAM/104/95","gr-qc hep-th",,"  In case of the Einstein's gravitation theory and its first order Palatini
reformulation, the stress-energy-momentum of gravity has been proved to reduce
to the Komar superpotential. We generalize this result to the affine-metric
theory of gravity in case of general connections and arbitrary Lagrangian
densities invariant under general covariant transformations. In this case, the
stress-energy-momentum of gravity comes to the generalized Komar superpotential
depending on a Lagrangian density in a precise way.
","[{""version"":""v1"",""created"":""Thu, 2 Nov 1995 16:55:21 GMT""}]","2010-04-06"
"gr-qc/9511011","Viqar Husain","Viqar Husain","Exact solutions for null fluid collapse","11 pages, RevTeX","Phys.Rev. D53 (1996) 1759-1762","10.1103/PhysRevD.53.R1759","CGPG-95/10-3","gr-qc hep-th",,"  Exact non-static spherically symmetric solutions of the Einstein equations
for a null fluid source with pressure $P$ and density $\rho$ related by $P =
k\rho^a$ are given. The $a=1$ metrics are asymptotically flat for $1/2<k\le 1$
and cosmological for $0<k<1/2$. The $k=1$ metric is the known charged Vaidya
solution. In general the metrics have multiple apparent horizons. In the long
time limit, the asymptotically flat metrics are hairy black hole solutions that
`fall between' the Schwarzschild and Reissner-Nordstrom metrics.
","[{""version"":""v1"",""created"":""Fri, 3 Nov 1995 00:42:20 GMT""}]","2009-10-28"
"gr-qc/9511012","Robert Mann","J.D.E. Creighton and R.B. Mann","Thermodynamics of Dilatonic Black Holes in $n$ Dimensions","27 pages, latex, uses amstex",,,"WATPHYS TH-95/08","gr-qc hep-th",,"  We present a formalism for studying the thermodynamics of black holes in
dilaton gravity. The thermodynamic variables are defined on a quasilocal
surface surrounding the black hole system and are obtained from a general class
of Lagrangians involving a dilaton. The formalism thus accommodates a large
number of possible theories and black hole spacetimes. Many of the
thermodynamic quantities are identified from the contribution of the action on
the quasilocal boundary. The entropy is found using path integral techniques,
and a first law of thermodynamics is obtained. As an illustration, we calculate
the thermodynamic quantities for two black hole solutions in $(1+1)$
dimensions: one obtained from a string inspired theory and the other being a
Liouville black hole in the ``$R=\kappa T$'' theory with a Liouville field.
","[{""version"":""v1"",""created"":""Fri, 3 Nov 1995 00:48:54 GMT""}]","2007-05-23"
"gr-qc/9511013","Haret Rosu","H.C. Rosu","Moebius Inverse Problem for Distorted Black Holes","2+10 Latex pages, corrected and updated version of Nuovo Cimento B
  108, 1333 (1993), no figures, accompanying file is gr-qc/9408039",,,,"gr-qc",,"  Hawking ``thermal'' radiation could be a means to detect black holes of
micron sizes, which may be hovering through the universe. We consider these
micro-black holes to be distorted by the presence of some distribution of
matter representing a convolution factor for their Hawking radiation. One may
hope to determine from their Hawking signals the temperature distribution of
their material shells by the inverse black body problem. In 1990, Nan-xian Chen
has used a so-called modified M\""{o}bius transform to solve the inverse black
body problem. We discuss and apply this technique to Hawking radiation of
distorted micro-black holes. Some comments on supersymmetric applications of
M\""{o}bius function and transform are also added.
","[{""version"":""v1"",""created"":""Fri, 3 Nov 1995 02:23:00 GMT""}]","2007-05-23"
"gr-qc/9511014","Jerzy Kowalski-Glikman","J. Kowalski - Glikman","Quantum Potential and Quantum Gravity","12 pages LaTeX, to appear in From Field Theory to Quantum Groups.
  Birthday volume dedicated to Jerzy Lukierski, World Scientific",,"10.1142/9789812830425_0015",,"gr-qc",,"  The quantum potential approach makes it possible to construct a complementary
picture of quantum mechanical evolution which reminds classical equation of
motion. The only difference as compared to equations of motion for the
underlying classical system is the presence of an additional potential term
being a functional of the real part of the wavefunction. In the present paper
this approach is applied to the quantum theory of gravity based on Wheeler --
De Witt equation. We describe the derivation of the `quantum Einstein equation'
and discuss the new features of their solutions.
","[{""version"":""v1"",""created"":""Fri, 3 Nov 1995 14:18:50 GMT""}]","2016-11-03"
"gr-qc/9511015","Maria Guimaraes","M. E. X. Guimar\~aes","Cosmic String in Scalar-Tensor Gravity","15 pages, LATEX, no figures",,,"GRC 95/11/01","gr-qc hep-th",,"  The gravitational properties of a local cosmic string in the framework of
scalar-tensor gravity are examined. We find the metric in the weak-field
approximation and we show that, contrary to the General Relativity case, the
cosmic string in scalar-tensor gravitation exerces a force on non-relativistic,
neutral test particle. This force is proportional to the derivative of the
conformal factor $A^{2}(\phi)$ and it is always attractive. Moreover, this
force could have played an important role at the Early Universe, although
nowadays it can be neglegible. It is also shown that the angular separation
$\delta\varphi$ remains unaltered for scalar-tensor cosmic strings.
","[{""version"":""v1"",""created"":""Fri, 3 Nov 1995 14:49:13 GMT""}]","2007-05-23"
"gr-qc/9511016","Steve F. Rippl","Steve Rippl, Carlos Romero and Reza Tavakol","$D$-Dimensional Gravity from $(D+1)$ Dimensions","11 pages, latex, published in CQG vol. 12 no. 10","Class.Quant.Grav. 12 (1995) 2411-2422","10.1088/0264-9381/12/10/004",,"gr-qc",,"  We generalise Wesson's procedure, whereby vacuum $(4+1)-$dimensional field
equations give rise to $(3+1)-$dimensional equations with sources, to arbitrary
dimensions. We then employ this generalisation to relate the usual
$(3+1)-$dimensional vacuum field equations to $(2+1)-$dimensional field
equations with sources and derive the analogues of the classes of solutions
obtained by Ponce de Leon. This way of viewing lower dimensional gravity
theories can be of importance in establishing a relationship between such
theories and the usual 4-dimensional general relativity, as well as giving a
way of producing exact solutions in $(2+1)$ dimensions that are naturally
related to the vacuum $(3+1)-$dimensional solutions. An outcome of this
correspondence, regarding the nature of lower dimensional gravity, is that the
intuitions obtained in $(3+1)$ dimensions may not be automatically
transportable to lower dimensions.
  We also extend a number of physically motivated solutions studied by Wesson
and Ponce de Leon to $(D+1)$ dimensions and employ the equivalence between the
$(D+1)$ Kaluza-Klein theories with empty $D-$dimensional Brans-Dicke theories
(with $\omega=0$) to throw some light on the solutions derived by these
authors.
","[{""version"":""v1"",""created"":""Fri, 3 Nov 1995 14:08:16 GMT""}]","2016-08-31"
"hep-lat/9511003","Luis Antonio Fernandez","H. G. Ballesteros, L. A. Fernandez, V. Martin-Mayor and A. Munoz
  Sudupe (Dept. de Fisica Teorica I, Universidad Complutense de Madrid, Spain)","New Universality Class in three dimensions: the Antiferromagnetic $RP^2$
  model","10 pages, 2 Postscript figures. Revised version: references added","Phys.Lett. B378 (1996) 207-212","10.1016/0370-2693(96)00358-9",,"hep-lat cond-mat",,"  We present the results of a Monte Carlo simulation of the $RP^2$ model in
three dimensions with negative coupling. We observe a second order phase
transition between the disordered phase and an antiferromagnetic, unfrustrated,
ordered one. We measure, with a Finite Size Scaling analysis, the thermal
exponent, obtaining $\nu=0.784(8)$. We have found two magnetic-type relevant
operators whose related $\eta$ exponents are $0.038(2)$ and $1.338(8)$
respectively.
","[{""version"":""v1"",""created"":""Thu, 2 Nov 1995 16:19:04 GMT""},{""version"":""v2"",""created"":""Tue, 7 Nov 1995 10:59:57 GMT""}]","2009-10-28"
"hep-lat/9511004","Martin Hasenbusch","M. Hasenbusch and R.R. Horgan","Tests of the continuum limit for the $SO(4)$ Principal Chiral Model and
  the prediction for $\L_\MS$","27 pages , 1 Postscript-file, uuencoded","Phys.Rev. D53 (1996) 5075-5089","10.1103/PhysRevD.53.5075","DAMTP 95-61","hep-lat",,"  We investigate the continuum limit in $SO(N)$ Principal Chiral Models
concentrating in detail on the $SO(4)$ model and its covering group
SU(2)xSU(2). We compute the mass gap in terms of Lambda_MS and compare with the
prediction of Hollowood of $m/\L_\MS = 3.8716$. We use the finite-size scaling
method of L\""uscher et al. to deduce $m/\L_\MS$ and find that for the $SO(4)$
model the computed result of $m/\L_\MS \sim 14$ is in strong disagreement with
theory but that a similar analysis of the SU(2)xSU(2) yields excellent
agreement with theory. We conjecture that for $SO(4)$ violations of the
finite-size scaling assumption are severe forthe values of the correlation
length, $\xi$, investigated and that our attempts to extrapolate the results to
zero lattice spacing, although plausible, are erroneous. Conversely, the
finite-size scaling violations in the SU(2)xSU(2) simulation are consistent
with perturbation theory and the computed $beta-$function agrees well with the
3-loop approximation for couplings evaluated at scales $L/a \le \xi$, where
$\xi$ is measured in units of the lattice spacing, $a$. We conjecture that
lattice vortex artifacts in the $SO(4)$ model are responsible for delaying the
onset of the continuum limit until much larger correlation lengths are achieved
notwithstanding the apparent onset of scaling. Results for the mass spectrum
for SO(N) m, N=8,10 are given whose comparison with theory gives plausible
support to our ideas.
","[{""version"":""v1"",""created"":""Thu, 2 Nov 1995 17:46:10 GMT""}]","2009-10-28"
"hep-lat/9511005","Erich Focht","E. Focht, J. Jersak and J. Paul","Interplay of universality classes in a three-dimensional Yukawa model","24 pp. LaTeX 2e src, needs psfig.sty","Phys.Rev.D53:4616-4627,1996","10.1103/PhysRevD.53.4616","Juelich HLRZ 46/95","hep-lat",,"  We investigate numerically on the lattice the interplay of universality
classes of the three-dimensional Yukawa model with U(1) chiral symmetry, using
the Binder method of finite size scaling. At zero Yukawa coupling the scaling
related to the magnetic Wilson--Fisher fixed point is confirmed. At
sufficiently strong Yukawa coupling the dominance of the chiral fixed point
associated with the 3D Gross--Neveu model is observed for various values of the
coupling parameters, including infinite scalar selfcoupling. In both cases the
Binder method works consistently in a broad range of lattice sizes. However,
when the Yukawa coupling is decreased the finite size behavior gets complicated
and the Binder method gives inconsistent results for different lattice sizes.
This signals a cross-over between the universality classes of the two fixed
points.
","[{""version"":""v1"",""created"":""Fri, 3 Nov 1995 14:56:50 GMT""}]","2014-11-17"
"hep-ph/9511213","Jonathan Bagger","Jonathan A. Bagger","Destabilizing Divergences in Supergravity Theories","Invited Talk presented at SUSY-95, Ecole Polytechnique, Palaiseau,
  France, 15-19 May 1995",,,"JHU-TIPAC-95025","hep-ph hep-th",,"  We study the stability of the gauge hierarchy in hidden-sector supergravity
theories. We show that a destabilizing tadpole can appear if a theory has a
gauge- and global-symmetry singlet with renormalizable couplings to the visible
fields. We also find a quadratically divergent two-loop contribution to the
supersymmetric effective potential. This term illustrates the difficulty of
using the ""LHC mechanism"" to control quadratic divergences in theories with
Planck-scale vevs.
","[{""version"":""v1"",""created"":""Thu, 2 Nov 1995 18:29:29 GMT""}]","2007-05-23"
"hep-ph/9511214","Boris Kopeliovich","B. Kopeliovich (Heidelberg), J. Nemchik and E. Predazzi (Torino)","Hadronization in Nuclear Environment and Electroproduction of Leading
  Hadrons","5 pages, latex file and 4 uuencoded figures; Invited talk given by B.
  Kopeliovich at the ELFE Workshop, Cambridge, 22-29 July, 1995",,,,"hep-ph nucl-th",,"  Radiative energy loss of a highly virtual quark originating from a
deep-inelastic electron scattering plays a crucial role in production of
leading hadrons off nuclei. The density of energy loss for gluon radiation
turns out to be time- and energy--dependent in inclusive hadron production.
Important phenomena involved are Sudakov's suppression of no radiation of that
part of gluon spectrum, which is forbidden by energy conservation, and color
transparency, which suppresses the final state interaction of the produced
colorless wave packet. We model the soft part of hadronization, which usually
is supposed to be due to the color strings, using also the gluon radiation and
nicely reproduce the string parameters. Our parameter-free calculations provide
a good agreement with available data on $z_h$-dependence of the quark
fragmentation function in vacuum, as well as $\nu$-, $z_h$- and
$Q^2$-dependence of nuclear effects. We come to the conclusion that the energy
range of ELFE - HERMES is most sensitive to the underlying dynamics of
hadronization provided that nuclear targets are used.
","[{""version"":""v1"",""created"":""Thu, 2 Nov 1995 20:34:20 GMT""}]","2007-05-23"
"hep-ph/9511215","Boris Kopeliovich","J. Huefner (Heidelberg U.), B. Kopeliovich (MPI-K, Heidelberg) and J.
  Nemchik (INFN, Torino)","The Role of the Coherence Length in Exclusive Electroproduction of
  Vector Mesons off Nuclei","5 pages, latex file and 6 uuencoded figures; Invited talk given by B.
  Kopeliovich at the ELFE Workshop, Cambridge, 22-29 July, 1995",,,,"hep-ph nucl-th",,"  The variation of the coherence length $l_c=2\nu/(Q^2+m_V^2)$ in virtual
photoproduction of vector mesons off nuclei as a function of the photon energy
$\nu$ or virtuality $Q^2$ results in dramatic changes in the values of the
nuclear transparency. Color transparency effects can be easily mixed up with
the effects of the coherence length in incoherent photoproduction on nuclei.
","[{""version"":""v1"",""created"":""Thu, 2 Nov 1995 20:34:43 GMT""}]","2007-05-23"
"hep-ph/9511217","Basim Kamal","B. Kamal","QCD Corrections to Spin Dependent Drell-Yan and a Global Subtraction
  Scheme","18 pages, 8 figures in 1 postscript file","Phys.Rev. D53 (1996) 1142-1152","10.1103/PhysRevD.53.1142","McGill-95-48","hep-ph",,"  We present QCD corrections to the Drell-Yan process in the transversely
polarized, longitudinally polarized and unpolarized cases. The analytical
results are presented in a form valid for all $n$-dimensional regularization
schemes. A universal mass factorization scheme is presented in which the
results reduce to those of dimensional reduction. The connection between the
parton distributions and fragmentation functions of dimensional reduction and
those of dimensional regularization is elucidated in a simple manner. Numerical
results are presented for proton-proton collisions at energies relevant to RHIC
(Relativistic Heavy Ion Collider). The perturbative stability of the transverse
and longitudinal asymmetries is investigated.
","[{""version"":""v1"",""created"":""Thu, 2 Nov 1995 22:44:39 GMT""}]","2009-10-28"
"hep-ph/9511218","Ann Nelson","Ann E. Nelson","New Issues In Low Energy Dynamical Supersymmetry Breaking","8 pages, uses ptptex, invited talk given at the Yukawa International
  Seminar, August 1995","Prog.Theor.Phys.Suppl.123:365-372,1996","10.1143/PTPS.123.365","UW-PTH/95-17","hep-ph",,"  Comparatively simple models, with low energy structure similar to that of the
MSSM, but with far fewer arbitrary parameters, can be constructed in which
supersymmetry is dynamically broken at low energies. The phenomenology of these
models is somewhat different than that of the usual scenario with supersymmetry
broken in a hidden sector.
","[{""version"":""v1"",""created"":""Thu, 2 Nov 1995 23:43:06 GMT""}]","2011-04-15"
"hep-ph/9511219",,"E. Farhi, J. Goldstone, A. Lue and K. Rajagopal","Collision Induced Decays of Electroweak Solitons: Fermion Number
  Violation with Two and Few Initial Particles","64 pages, revtex, epsf, all figures included. Revised version.
  Section V replaced with a corrected version. Qualitative conclusions
  unchanged. Numerical value of one exponent has changed","Phys.Rev. D54 (1996) 5336-5360","10.1103/PhysRevD.54.5336","CTP-2483, HUTP-95-A039","hep-ph hep-th",,"  We consider a variant of the standard electroweak theory in which the Higgs
sector has been modified so that there is a classically stable weak scale
soliton. We explore fermion number violating processes which involve soliton
decay. A soliton can decay by tunnelling under the sphaleron barrier, or the
decay can be collision induced if the energy is sufficient for the barrier to
be traversed. We present a classical solution to the Minkowski space equations
of motion in which a soliton is kicked over the barrier by an incoming pulse.
This pulse corresponds to a quantum coherent state with mean number of $W$
quanta $\sim 2.5/g^2$ where $g$ is the $SU(2)$ gauge coupling constant. We also
give a self-contained treatment of the relationship between classical
solutions, including those in which solitons are destroyed, and tree-level
quantum amplitudes. Furthermore, we consider a limit in which we can reliably
estimate the amplitude for soliton decay induced by collision with a single
$W$-boson. This amplitude depends on $g$ like $\exp (-cg^{-1/3})$, and is
larger than that for spontaneous decay via tunnelling in the same limit.
Finally we show that in soliton decays, light $SU(2)_L$ doublet fermions are
anomalously produced. Thus we have a calculation of a two body process with
energy above the sphaleron barrier in which fermion number is violated.
","[{""version"":""v1"",""created"":""Fri, 3 Nov 1995 00:14:11 GMT""},{""version"":""v2"",""created"":""Fri, 26 Jul 1996 23:39:23 GMT""}]","2009-10-28"
"hep-ph/9511220","Robert Mann","J.R. Mureika and R.B. Mann","Mass or Gravitationally Induced Neutrino Oscillations? -- A Comparison
  of $\B$ Neutrino Flux Spectra in a Three--Generation Framework","14 pages, latex, epsf, 5 figures; to appear in Phys Lett B","Phys.Lett. B368 (1996) 112-118","10.1016/0370-2693(95)01489-6","WATPHYS-TH95/07","hep-ph gr-qc",,"  Both gravitational and mass induced neutrino oscillation mechanisms provide
possible resolutions to the Solar Neutrino Problem. The distinguishing feature
between the two mechanisms is their dependence on the neutrino energy. We
investigate the implications of this by computing the $\B$ neutrino spectrum as
determined from each mechanism using a realistic three--flavor evolution model.
We find that in the limit of small $\tetau$ mixing angle, the differences are
significant enough to observe in future solar neutrino experiments.
","[{""version"":""v1"",""created"":""Fri, 3 Nov 1995 01:01:33 GMT""}]","2009-10-28"
"hep-ph/9511221",,"Z.G. Berezhiani, A.D. Dolgov and R.N. Mohapatra","Asymmetric Inflationary Reheating and the Nature of Mirror Universe","13 pages, LATEX, no figures (slight textual changes, few references
  added)","Phys.Lett.B375:26-36,1996","10.1016/0370-2693(96)00219-5","INFN-FE 16-95, UMD-PP-96-15, IFIC/95-64, FTUV/95-61","hep-ph astro-ph",,"  The existence of a shadow world (or mirror universe) with matter and forces
identical to that of the visible world but interacting with the latter only via
gravity can be motivated by superstring theories as well as by recent attempts
to understand the nature of a sterile neutrino needed if all known neutrino
data are to be consistent with each other. A simple way to reconcile the
constraints of big bang nucleosynthesis in such a theory is to postulate that
the reheating temperature after inflation in the mirror universe is lower than
that in the visible one. We have constructed explicit models that realize this
proposal and have shown that the asymmetric reheating can be related to a
difference of the electroweak symmetry breaking scales in the two sectors,
which is needed for a solution of the neutrino puzzles in this picture.
Cosmological implications of the mirror matter are also discussed.
","[{""version"":""v1"",""created"":""Fri, 3 Nov 1995 00:03:09 GMT""},{""version"":""v2"",""created"":""Sun, 19 Nov 1995 12:19:16 GMT""}]","2008-11-26"
"hep-ph/9511222","Shoichi Sasaki Rcnp","Shoichi Sasaki(RCNP), Hideo Suganuma(RCNP) and Hiroshi Toki(RCNP)","Chiral Symmetry Restoration at Finite Temperature in the Dual
  Ginzburg-Landau Theory","Talk presented by S. Sasaki at 7th International Conference on 'the
  Structure of Baryons (Baryons '95)', Oct. 3 - 7, 1995, Santa Fe, New Mexico,
  4 pages, latex. (4 figures - available on request from
  ssasaki@miho.rcnp.osaka-u.ac.jp)",,,,"hep-ph",,"  We study the relation between QCD-monopole condensation and dynamical
chiral-symmetry breaking in the dual Ginzburg-Landau Theory, which realizes the
color confinement due to the dual Meissner effect. Solving the Schwinger-Dyson
equation at finite temperature numerically, we find the chiral symmetry is
restored at high temperature. The critical temperature of the chiral symmetry
restoration is strongly correlated with the string tension.
","[{""version"":""v1"",""created"":""Fri, 3 Nov 1995 05:21:02 GMT""},{""version"":""v2"",""created"":""Tue, 7 Nov 1995 02:50:29 GMT""}]","2009-09-25"
"hep-ph/9511223","Shoichi Midorikawa","M. Honda, T. Kajita, K. Kasahara, and S. Midorikawa","Atmospheric Neutrinos","8 pages, PTPTEX.sty, to appear in Proceedings of YKIS '95, From the
  Standard Model to Grand Unified Theories","Prog.Theor.Phys.Suppl.123:483-490,1996","10.1143/PTPS.123.483",,"hep-ph",,"  The atmospheric neutrino-flux is calculated over the wide energy range from 1
GeV to 3,000 GeV for the study of neutrino-physics using the data from
underground neutrino-detectors. The uncertainty of atmospheric neutrino-flux is
also discussed. A brief comment is made to interpret the anomaly in terms of
neutrino oscillations.
","[{""version"":""v1"",""created"":""Fri, 3 Nov 1995 07:16:24 GMT""},{""version"":""v2"",""created"":""Sat, 4 Nov 1995 04:18:11 GMT""},{""version"":""v3"",""created"":""Mon, 6 Nov 1995 08:44:49 GMT""}]","2011-04-15"
"hep-ph/9511224","Z. Hioki","Zenr\=o Hioki","Structure of Electroweak Radiative Corrections","16 pages, latex, 1 figure (drawn on latex), Lecture at the XIX
  International School on Theoretical Physics ``Particle Physics and
  Astrophysics in the Standard Model and Beyond"", Bystra, Poland, September
  19-26, 1995","Acta Phys.Polon.B27:1569-1579,1996",,"TOKUSHIMA 95-05","hep-ph",,"  Looking into the inside of radiative corrections is an interesting subject as
a deeper study of the standard electroweak theory after its remarkable success
in the precision analyses. I will discuss here a test of ``structure"" of the EW
radiative corrections to the weak-boson masses, and show that we can now
analyze several different parts separately.
","[{""version"":""v1"",""created"":""Fri, 3 Nov 1995 10:15:09 GMT""}]","2011-01-13"
"hep-ph/9511225","Patrick Peter","B. Carter","How About Vortons ?","10 pages, plain TeX. Contribution to the Session on (non baryonic)
  Dark Matter in Cosmology, XXXth Rencontres de Moriond, January, 1995",,,,"hep-ph",,"  It has been suggested that cosmological dark matter may include a population
of vortons (meaning small centrifugally stabilised cosmic string loops) as an
outcome of (non-standard) electroweak symmetry breaking. The implications for
this conjecture of recent theoretical progress on superconducting string theory
are discussed, particularly in relation to problems of stability. It is
tentatively concluded that if the underlying field theory provides a carrier
field with mass not too far below that of the relevant Higgs mass (which may be
a few hundred G.e.V.) electroweak string formation may conceivably produce
enough vortons (with an extended mass distribution peaking perhaps at several
hundred T.e.V.) to provide a marginally significant dark matter contribution.
","[{""version"":""v1"",""created"":""Fri, 3 Nov 1995 10:56:08 GMT""}]","2007-05-23"
"hep-ph/9511226","Roberto Ugoccioni","R. Ugoccioni (Lund Univ.), A. Giovannini (Torino Univ. and INFN,
  Torino) and S. Lupia (Max-Planck-Inst. Muenchen)","Clan Structure in Rapidity Intervals","Talk presented by R. Ugoccioni at XXV Multiparticle Dynamics, Stara
  Lesna, Slovakia, Sept. 1995. LaTeX with epsfig, 11 pages, 3 figures.
  Postscript file available through
  http://www.thep.lu.se/tf2/hep/article.hep.html",,,"LU TP 95-28, DFTT 65/95, MPI-PhT/95-106","hep-ph",,"  We present a cascading model for a single jet, inspired to QCD and to the
phenomenological analysis of multiplicity distributions. The model, describing
as it does a two dimensional evolution in virtuality and rapidity, allows
analytical predictions for clan analysis parameters to be made.
","[{""version"":""v1"",""created"":""Fri, 3 Nov 1995 14:18:52 GMT""}]","2007-05-23"
