"hep-th/9511010",,"J.M. Roman and R. Tarrach (U. Barcelona)","The regulated four parameter one dimensional point interaction","17 pages, no figures, Tex file","J.Phys.A29:6073-6086,1996","10.1088/0305-4470/29/18/033","UB-ECM-PF-95/21","hep-th",,"  The general four parameter point interaction in one dimensional quantum
mechanics is regulated. It allows the exact solution, but not the perturbative
one. We conjecture that this is due to the interaction not being asymptotically
free. We then propose a different breakup of unperturbed theory and
interaction, which now is asymptotically free but leads to the same physics.
The corresponding regulated potential can be solved both exactly and
perturbatively, in agreement with the conjecture.
","[{""version"":""v1"",""created"":""Thu, 2 Nov 1995 16:21:02 GMT""}]","2008-11-26"
"hep-th/9511013",,"L. Frappat, A. Sciarrino, S. Sciuto, P. Sorba","Anyonic Realization of the Quantum Affine Lie Algebra U_q(A_N)","13p LaTeX Document (should be run twice)","Phys.Lett.B369:313-324,1996","10.1016/0370-2693(95)01518-3","ENSLAPP-AL-552/95, DSF-T-40/95, DFTT-60/95","hep-th math.QA q-alg",,"  We give a realization of quantum affine Lie algebra $U_q(\hat A_{N-1})$ in
terms of anyons defined on a two-dimensional lattice, the deformation parameter
$q$ being related to the statistical parameter $\nu$ of the anyons by $q =
e^{i\pi\nu}$. In the limit of the deformation parameter going to one we recover
the Feingold-Frenkel fermionic construction of undeformed affine Lie algebra.
","[{""version"":""v1"",""created"":""Thu, 2 Nov 1995 16:40:52 GMT""}]","2008-11-26"
"hep-th/9511014","Reinhard Oehme","Reinhard Oehme","Superconvergence, Confinement and Duality","Talk presented at the International Workshop on High Energy Physics,
  Novy Svit, Crimea, September 1995. To be published in the Proceedings. 15
  pages, Latex",,,"EFI 95-45, MPI Ph/95-102","hep-th hep-ph",,"  Arguments for the confinement of transverse gauge field excitations, which
are based upon superconvergence relations of the propagator, and upon the BRST
algebra, are reviewed and applied to supersymmetric models. They are shown to
be in agreement with recent results obtained as a consequence of holomorphy and
duality in certain $N=1$ SUSY models. The significance of the one loop
anomalous dimension of the gauge field in the Landau gauge is emphasized. For
the models considered, it is shown to be proportional, with negative relative
sign, to the one loop coefficient of the renormalization group function for the
{\it dual map} of the original theory.
","[{""version"":""v1"",""created"":""Thu, 2 Nov 1995 19:23:11 GMT""}]","2007-05-23"
"hep-th/9511015","Cornwall","John M. Cornwall and Bryce Yan","String Tension and Chern-Simons Fluctuations in the Vortex Vacuum of d=3
  Gauge Theory","Latex, 35 pages, 2 .eps figures in a uuencoded file","Phys.Rev. D53 (1996) 4638-4649","10.1103/PhysRevD.53.4638","UCLA/95/TEP/36","hep-th",,"  Based on a model of the d=3 SU(2) pure gauge theory vacuum as a
monopole-vortex condensate, we give a quantitative (if model-dependent)
estimate of the relation between the string tension and a gauge-invariant
measure of the Chern-Simons susceptibility, due to vortex linkages, in the
absence of a Chern-Simons term in the action. We also give relations among
these quantities and the vacuum energy and gauge-boson mass. Both the
susceptibility and the string tension come from the same physics: The topology
of linking, twisting, and writhing of closed vortex strings. The closed-vortex
string is described via a complex scalar field theory whose action has a
precisely-specified functional form, inferred from previous work giving the
exact form of a gauge-theory effective potential at low momentum. Applications
to high-T phenomena, including B+L anomalous violation, are mentioned.
","[{""version"":""v1"",""created"":""Thu, 2 Nov 1995 20:00:35 GMT""}]","2009-10-28"
"hep-th/9511016",,"Rulin Xiu (Lyman Lab of Physics, Harvard Univ. Cambridge, MA)","One-loop Correction and the Dilaton Runaway Problem","19 pages","Phys. Rev. D 55, 5075 (1997)","10.1103/PhysRevD.55.5075","HUTP-95/A040","hep-th",,"  We examine the one-loop vacuum structure of an effective theory of gaugino
condensation coupled to the dilaton for string models in which the gauge
coupling constant does not receive string threshold corrections. The new
ingredients in our treatment are that we take into account the one-loop
correction to the dilaton K\""ahler potential and we use a formulation which
includes a chiral field $H$ corresponding to the gaugino bilinear. We find
through explicit calculation that supersymmetry in the Yang-Mills sector is
broken by gaugino condensation.
  The dilaton and $H$ field have masses on the order of the gaugino
condensation scale independently of the dilaton VEV. Although the calculation
performed here is at best a model of the full gaugino condensation dynamics,
the result shows that the one-loop correction to the dilaton K\""ahler potential
as well as the detailed dynamics at the gaugino condensation scale may play an
important role in solving the dilaton runaway problem.
","[{""version"":""v1"",""created"":""Thu, 2 Nov 1995 16:05:31 GMT""}]","2016-08-24"
"hep-th/9511017",,"M. Billo' (SISSA)","R-symmetry of heterotic N=2 supergravities","11 pages, plain LaTex. To Appear in the Proceedings of the conference
  ``Gauge theories, applied supersymmetry and quantum gravity'', Leuven, July
  1995",,,,"hep-th",,"  The topological twist of N=2, D=4 matter-coupled supergravities requires a
suitable R-symmetry. This symmetry is realised in the effective supergravities
arising at tree level from certain heterotic compactifications. The set of
instanton equations (topological gauge-fixings) is thus obtained. The
conditions that R-symmetry should satisfy also when these theories are replaced
by their ``exact'' quantum-corrected counterparts are investigated.
","[{""version"":""v1"",""created"":""Fri, 3 Nov 1995 09:07:10 GMT""}]","2007-05-23"
"hep-th/9511019","Bernard de Wit","B. de Wit","Special geometry and perturbative analysis of $N=2$ heterotic vacua","LateX using wstwocl, 5 pp. To appear in Procs. of the EPS95
  Conference, Brussels",,,"THU-95/30","hep-th",,"  The requirement of target-space duality and the use of nonrenormalization
theorems lead to strong constraints on the perturbative prepotential that
encodes the low-energy effective action of $N=2$ heterotic superstring vacua.
The analysis is done in the context of special geometry, which governs the
couplings of the vector multiplets. The presentation is kept at an introductory
level.
","[{""version"":""v1"",""created"":""Fri, 3 Nov 1995 11:31:39 GMT""}]","2007-05-23"
"hep-th/9511020","Klaus Bering Larsen","K. Bering","From Hamiltonian to Lagrangian Sp(2) BRST Quantization","13 pages, LaTeX","Mod.Phys.Lett. A11 (1996) 499-513","10.1142/S0217732396000540","UUITP-18/95","hep-th",,"  We give a formal proof of the equivalence of Hamiltonian and Lagrangian BRST
quantization. This is done for a generic $Sp(2)$-symmetric theory using flat
(Darboux) coordinates. A new quantum master equation is derived in a
Hamiltonian setting which contains all the Hamiltonian fields and momenta of a
given theory.
","[{""version"":""v1"",""created"":""Fri, 3 Nov 1995 11:45:24 GMT""}]","2015-06-26"
"nucl-th/9511002",,"E.M. Henley, W-Y.P. Hwang, and L.S. Kisslinger","The Weak Parity-Violating Pion-Nucleon Coupling (Revised)","13 pages, uses LaTex; figures can be obtained from any of the
  authors: Henley@phys.washington.edu, Kisslinger@kelvin. phys.cmu.edu,
  Hwang@mitlns.mit.edu","Phys.Lett.B367:21-27,1996; Erratum-ibid.B440:449,1998","10.1016/0370-2693(95)01403-9",,"nucl-th",,"  We use QCD sum rules to obtain the weak parity-violating pion-nucleon
coupling constant $f_{\pi NN}$. We find that $f_{\pi NN}\approx 2\times
10^{-8}$, about an order of magnitude smaller than the ``best estimates'' based
on quark models. This result follows from the cancellation between perturbative
and nonperturbative QCD processes not found in quark models, but explicit in
the QCD sum rule method. Our result is consistent with the experimental upper
limit found from $^{18}$F parity-violating measurements.
","[{""version"":""v1"",""created"":""Thu, 2 Nov 1995 19:08:57 GMT""}]","2014-11-18"
"nucl-th/9511003","David Blaschke","D. Blaschke, Yu.L. Kalinovsky, G. Roepke, S. Schmidt, M.K. Volkov","1/N_c- expansion of the quark condensate at finite temperature","19 pages, REVTeX, 5 figures","Phys.Rev.C53:2394-2400,1996","10.1103/PhysRevC.53.2394","MPG-VT-UR 52/95","nucl-th",,"  Previously the quark and meson properties in a many quark system at finite
temperature have been studied within effective QCD approaches in the Hartree
approximation. In the present paper we consider the influence of the mesonic
correlations on the quark self-energy and on the quark propagator within a
systematic $1/N_c$- expansion. Using a general separable ansatz for the
nonlocal interaction, we derive a selfconsistent equation for the $1/N_c$
correction to the quark propagator. For a separable model with cut-off
formfactor, we obtain a decrease of the condensate of the order of 20\% at zero
temperature. A lowering the critical temperature for the onset of the chiral
restoration transition due to the inclusion of mesonic correlations is obtained
what seems to be closer to the results from lattice calculations.
","[{""version"":""v1"",""created"":""Fri, 3 Nov 1995 14:55:18 GMT""},{""version"":""v2"",""created"":""Sun, 21 Jan 1996 23:04:49 GMT""}]","2008-11-26"
"quant-ph/9511003","Isaac Chuang","I. L. Chuang and R. Laflamme","Quantum Error Correction by Coding","11 pages RevTeX + 2 figures in postscript; Please see
  http://feynman.stanford.edu/qcomp/ for figures.",,,,"quant-ph",,"  Recent progress in quantum cryptography and quantum computers has given hope
to their imminent practical realization. An essential element at the heart of
the application of these quantum systems is a quantum error correction scheme.
We propose a new technique based on the use of coding in order to detect and
correct errors due to imperfect transmission lines in quantum cryptography or
memories in quantum computers. We give a particular example of how to detect a
decohered qubit in order to transmit or preserve with high fidelity the
original qubit.
","[{""version"":""v1"",""created"":""Fri, 3 Nov 1995 09:45:25 GMT""}]","2007-05-23"
"solv-int/9510011","Basile Grammaticos","A. Ramani and B. Grammaticos","Discrete Painleve equations: coalescences, limits and degeneracies","PlainTeX",,"10.1016/0378-4371(95)00439-4",,"solv-int nlin.SI",,"  Starting from the standard form of the five discrete Painlev\'e equations we
show how one can obtain (through appropriate limits) a host of new equations
which are also the discrete analogues of the continuous Painlev\'e equations. A
particularly interesting technique is the one based on the assumption that some
simplification takes place in the autonomous form of the mapping following
which the deautonomization leads to a new $n$-dependence and introduces more
new discrete Painlev\'e equations.
","[{""version"":""v1"",""created"":""Thu, 2 Nov 1995 16:46:04 GMT""}]","2015-06-26"
"solv-int/9510012","Wen-Xiu Ma","Wen-Xiu Ma, Benno Fuchssteiner and Walter Oevel (Paderborn University,
  Germany)","A three-by-three matrix spectral problem for AKNS hierarchy and its
  binary Nonlinearization","21pages, in Latex",,"10.1016/S0378-4371(96)00225-7",,"solv-int hep-th nlin.SI",,"  A three-by-three matrix spectral problem for AKNS soliton hierarchy is
proposed and the corresponding Bargmann symmetry constraint involved in Lax
pairs and adjoint Lax pairs is discussed. The resulting nonlinearized Lax
systems possess classical Hamiltonian structures, in which the nonlinearized
spatial system is intimately related to stationary AKNS flows. These
nonlinearized Lax systems also lead to a sort of involutive solutions to each
AKNS soliton equation.
","[{""version"":""v1"",""created"":""Thu, 2 Nov 1995 22:35:37 GMT""}]","2015-06-26"
