"astro-ph/9511023","N. Wex","N. Wex, J. Gil, M. Sendyk","Microlensing of pulsar radiation in the Galactic Center","12 pages, uuencoded gzip compressed PostScript, 8 figures included.
  To appear in Astronomy & Astrophysics",,,,"astro-ph",,"  We investigate the possibility of identifying massive objects (lenses) in the
Galactic Center region (GC) by means of pulsar timing. The well known intensity
change due to microlensing is found to be less important. For typical stellar
masses, the flux magnification can be significant only if the lens passes very
close to the pulsar--Earth axis. We show that in the case of a pulsar the time
varying travel-time delay, which is observable because of the pulsating nature
of pulsar radiation, is a much more powerful tool to investigate mass
distributions in the GC. We find that a travel-time delay is measurable even
for rather large distances between the lens and the pulsar--Earth axis.
  The time varying travel-time delay can be used to determine the mass of the
lens and the ratio of the transverse velocity to the minimum impact parameter.
Based on Monte Carlo simulations of synthetic data sets we give the expected
accuracies in the parameter determination for various masses.
  We argue that pulsars found behind the very center of our Galaxy would
provide an excellent opportunity to test the mass distribution in the Galactic
nucleus, and therefore to distinguish between a super massive black hole (SMBH)
and a super-dense star cluster (SDSC) within the central 0.1 pc.
","[{""version"":""v1"",""created"":""Sun, 5 Nov 1995 17:51:58 GMT""}]","2016-08-30"
"astro-ph/9511024","Jurjen Kamphuis","J.J. Kamphuis, D. Sijbring and T.S. van Albada (Kapteyn Astronomical
  Institute)","Global HI profiles of spiral galaxies","A LATEX file without figures. The postscript version including all
  the figures can be retrieved from http://www.astro.rug.nl:80/~secr/ Accepted
  for publication in Astronomy & Astrophysics Suppl. Series",,,"185","astro-ph",,"  In this paper we present short HI synthesis observations of 57 galaxies
without HI information in the RC3. These are a by-product of a large survey
with the WSRT of the neutral hydrogen gas in spiral and irregular galaxies.
Global profiles and related quantities are given for the 42 detected galaxies
and upper limits for the remaining 15. A number of galaxies have low values of
HI mass-to-blue luminosity ratio.
","[{""version"":""v1"",""created"":""Mon, 6 Nov 1995 14:36:04 GMT""}]","2007-05-23"
"comp-gas/9511002","David Wolf","David Wolf (Los Alamos, University of Texas)","Mutual Information as a Bayesian Measure of Independence",,,,,"comp-gas nlin.CG",,"  The problem of hypothesis testing is examined from both the historical and
Bayesian points of view in the case that sampling is from an underlying joint
probability distribution and the hypotheses tested for are those of
independence and dependence of the underlying distribution. Exact results for
the Bayesian method are provided. Asymptotic Bayesian results and historical
method test quantities are compared, and historical method quantities are
interpreted in terms of clearly defined Bayesian quantities. The asymptotic
Bayesian test relies upon a statistic that is primarily mutual information.
","[{""version"":""v1"",""created"":""Mon, 6 Nov 1995 11:34:38 GMT""}]","2008-02-03"
"cond-mat/9511023","V. Ponomorenko","Vadim Ponomarenko","Kondo resonance in the case of strong Coulomb screening","4 pages, Latex, 1 Postcript figure in a separate file, to appear in
  Proceedings of the ISQM-Tokyo '95, Quantum Coherence and Decoherence. Ed.
  Y.A.Ono, Elsevier",,,,"cond-mat",,"  The effect of Coulomb screening on the magnetic impurity behavior is
analysed. Two types of the behavior corresponding to either integer or
fractional occupation numbers of the low lying magnetic level are described.
The features in the dependence of the resistivity on the magnetic field
specific for these regimes are predicted.
","[{""version"":""v1"",""created"":""Sun, 5 Nov 1995 17:40:45 GMT""}]","2007-05-23"
"cond-mat/9511024","V. Ponomorenko","Vadim Ponomarenko","Dynamics of Inhomogeneous Tomonaga-Luttinger Liquid Wire","10 pages with 2 figures, RevTex, developed variant of
  cond-mat/9507089 published in Phys. Rev. B 52, R8666 (95)",,"10.1103/PhysRevB.52.R8666",,"cond-mat",,"  Dynamics of the 1D electron transport between two reservoirs are studied
based on the inhomogeneous Tomonaga- Luttinger Liquid (ITLL) model in the case
when the effect of the electron backscattering on the impurities is negligible.
The inhomogeneities of the interaction lead to a charge wave reflection. This
effect supposes a special behavior of the transport characteristics at the
microwave frequencies. New features are predicted in the current noise spectrum
and in the a.c. current- frequency dependence. Knowledge of them may be very
useful to identify experimental setup with the one specified by the ITLL model.
","[{""version"":""v1"",""created"":""Sun, 5 Nov 1995 17:58:50 GMT""}]","2015-06-25"
"cond-mat/9511025","Peter Olmsted","Peter D. Olmsted (Univerisity of Michigan) and Eugene M. Terentjev
  (Cavendish Laboratory, Cambridge University)","Mean-Field Nematic--Smectic-{\sl A} Transition in a Random Polymer
  Network","12 pages, REVTEX, 1 figure using epsf","Physical Review E 53 (1996) 2444-2453","10.1103/PhysRevE.53.2444",,"cond-mat",,"  Liquid crystal elastomers present a rich combination of effects associated
with orientational symmetry breaking and the underlying rubber elasticity. In
this work we focus on the effect of the network on the nematic--smectic-{\sl A}
transition, exploring the additional translational symmetry breaking in these
elastomers. We incorporate the crosslinks as a random field in a microscopic
picture, thus expressing the degree to which the smectic order is locally
frozen with respect to the network. We predict a modification of the NA
transition, notably that it can be treated at the mean-field level (type-I
system), due to the coupling with elastic degrees of freedom. There is a shift
in the transition temperature $T_{\scriptscriptstyle NA}$, a suppression of the
Halperin-Lubensky-Ma (HLM) effect (thus recovering the mean-field continuous
transition to the smectic state), and a new tri-critical point, depending on
the conditions of network formation. When the nematic phase possesses `soft
elasticity', the NA transition becomes of first order due to the coupling with
soft phonons in the network. We also discuss the microscopic origin of
phenomenological long-wavelength coupling between smectic phase and elastic
strain.
","[{""version"":""v1"",""created"":""Sun, 5 Nov 1995 22:15:32 GMT""}]","2009-10-28"
"cond-mat/9511026","Shmuel Gurvitz","S. A. Gurvitz and Ya. S. Prager","Microscopic derivation of rate equations for quantum transport","27 pages, 5 Figures. addendum - additional term is found to be
  present in the rate equations, which does not appear in the ordinary Bloch
  equations","Phys.Rev. B53 (1996) 15932","10.1103/PhysRevB.53.15932","WIS-95/52/Oct-PH","cond-mat quant-ph",,"  It is shown that under certain conditions the resonant transport in
mesoscopic systems can be described by modified (quantum) rate equations, which
resemble the optical Bloch equations with some additional terms. Detailed
microscopic derivation from the many-body Schr\""odinger equation is presented.
Special attention is paid to the Coulomb blockade and quantum coherence effects
in coupled quantum dot systems. The distinction between classical and quantum
descriptions of resonant transport is clearly manifested in the modified rate
equations.
","[{""version"":""v1"",""created"":""Mon, 6 Nov 1995 09:13:30 GMT""},{""version"":""v2"",""created"":""Tue, 16 Jan 1996 10:42:13 GMT""}]","2009-10-28"
"cond-mat/9511027","Mario Palumbo","L.J. Buchholtz, Mario Palumbo, D. Rainer, and J.A. Sauls","Thermodynamics of a d-wave Superconductor Near a Surface","12 pages of revtex text with 12 compressed and encoded figures. To
  appear in J. Low Temp. Phys., December, 1995",,"10.1007/BF00754525",,"cond-mat",,"  We study the properties of an anisotropically paired superconductor in the
presence of a specularly reflecting surface. The bulk stable phase of the
superconducting order parameter is taken to have $d_{x^2-y^2}$ symmetry.
Contributions by order parameter components of different symmetries vanish in
the bulk, but may enter in the vicinity of a wall. We calculate the
self-consistent order parameter and surface free energy within the
quasiclassical formulation of superconductivity. We discuss, in particular, the
dependence of these quantities on the degree of order parameter mixing and the
surface to lattice orientation. Knowledge of the thermodynamically stable order
parameter near a surface is a necessary precondition for calculating measurable
surface properties which we present in a companion paper.
","[{""version"":""v1"",""created"":""Mon, 6 Nov 1995 10:56:24 GMT""}]","2009-10-28"
"cond-mat/9511028","Mario Palumbo","L.J. Buchholtz, Mario Palumbo, D. Rainer, and J.A. Sauls","The Effect of Surfaces on the Tunneling Density of States of an
  Anisotropically Paired Superconductor","14 pages of revtex text with 11 compressed and encoded figures. To
  appear in J. Low Temp. Phys., December, 1995",,"10.1007/BF00754526",,"cond-mat",,"  We present calculations of the tunneling density of states in an
anisotropically paired superconductor for two different sample geometries: a
semi-infinite system with a single specular wall, and a slab of finite
thickness and infinite lateral extent. In both cases we are interested in the
effects of surface pair breaking on the tunneling spectrum. We take the stable
bulk phase to be of $d_{x^2-y^2}$ symmetry. Our calculations are performed
within two different band structure environments: an isotropic cylindrical
Fermi surface with a bulk order parameter of the form $\Delta\sim k_x^2-k_y^2$,
and a nontrivial tight-binding Fermi surface with the order parameter structure
coming from an anti-ferromagnetic spin-fluctuation model. In each case we find
additional structures in the energy spectrum coming from the surface layer.
These structures are sensitive to the orientation of the surface with respect
to the crystal lattice, and have their origins in the detailed form of the
momentum and spatial dependence of the order parameter. By means of tunneling
spectroscopy, one can obtain information on both the anisotropy of the energy
gap, $|\Delta(\p)|$, as well as on the phase of the order parameter,
$\Delta(\p) = |\Delta(\p)|e^{i\varphi(\p)}$.
","[{""version"":""v1"",""created"":""Mon, 6 Nov 1995 10:57:28 GMT""}]","2009-10-28"
"cond-mat/9511029","Albrecht","Marc Albrecht and Frederic Mila","Spin Gap in CaV4O9: a Large S Appraoch","a little mistake has been corrected, figure 4 is added",,,,"cond-mat",,"  We study the stability of the 4-site plaquette order in a model recently
introduced by Katoh and Imada to explain the spin gap in CaV4O9. We show that
all relevant types of order can be described within the framework of Schwinger
boson mean fiel theory, and we make predictions regarding their relative
stability. The results are compared to exact diagonalisation of finite cluster.
","[{""version"":""v1"",""created"":""Mon, 6 Nov 1995 14:37:00 GMT""},{""version"":""v2"",""created"":""Mon, 13 Nov 1995 13:20:21 GMT""}]","2008-02-03"
"cond-mat/9511030","Ken J. E. Vos","K. J. E. Vos and R. J. Gooding","Theory of a single Oxygen hole propagating in Sr_2CuO_2Cl_2: the spin of
  the quasiparticles in CuO_2 planes","18 pages, RevTeX, 4 Postscript figures. uuencoded. Submitted to Z.
  Phys. B",,"10.1007/s002570050183",,"cond-mat",,"  Recent photoemission experiments have measured E vs. k for a single hole
propa- gating in antiferromagnetically aligned Sr_2CuO_2Cl_2. Comparisons with
(i) the t - t' - J model, for which the carrier is a spinless vacancy, and (ii)
a strong-coupling version of the three-band Emery model, for which the carrier
is a S = 1/2 hole moving on the Oxygen sublattice, have demonstrated that if
one wishes to describe the quasiparticle throughout the entire first Brillouin
zone the three-band model is superior. Here we present a new variational wave
func- tion for a single Oxygen hole in the three-band model: it utilizes a
classical representation of the antiferromagnetically ordered Cu-spin
background but explicitly includes the quantum fluctuations of the lowest
energy doublet of the Cu-O-Cu bond containing the Oxygen hole. We find that
this wave function leads to a quasiparticle dispersion for physical exchange
and hopping parame- ters that is in excellent agreement with the measured ARPES
data. We also obtain the average spin of the Oxygen hole, and thus deduce that
this spin is only quenched to zero at certain wave vectors, helping to explain
the inadequacy of the t - t' - J model to match the experimentally observed
disper- sion relation everywhere in the first Brillouin zone.
","[{""version"":""v1"",""created"":""Mon, 6 Nov 1995 14:55:59 GMT""}]","2009-10-28"
"gr-qc/9511017","N. Wex","Norbert Wex (Max-Planck-Society, Research Unit ""Theory of
  Gravitation"")","New limits on the violation of the Strong Equivalence Principle in
  strong field regimes","6 pages, PostScript, 2 figures included. Submitted to Astronomy &
  Astrophysics. replaced by accepted version (minor corrections)",,,,"gr-qc astro-ph",,"  The Strong Equivalence Principle (SEP) demands, besides the validity of the
Einstein Equivalence Principle, that all self-gravitating bodies feel the same
acceleration in an external gravitational field. It has been found that metric
theories of gravity other that than general relativity typically predict a
violation of the SEP. In case of the Earth-Moon system (weak field system) this
violation is called the Nordtvedt effect. It has been shown by Damour and
Sch\""afer, that small-eccentricity long-orbital-period binary pulsars with a
white dwarf companion provide excellent conditions to test the SEP in strong
field regimes. Based on newly discovered binary pulsars this paper investigates
a possible violation of the SEP in strong field regimes. New limits with an
improved confidence level are presented. The results of this paper lead to
constrains on the combination $\epsilon/2-\zeta$ of the only two
(post)$^2$-Newtonian parameters $\epsilon$ and $\zeta$ that arise from the
(post)$^2$-Newtonian approximation of the tensor-multi-scalar theory of Damour
and Esposito-Far{\`e}se.
","[{""version"":""v1"",""created"":""Sun, 5 Nov 1995 18:07:58 GMT""},{""version"":""v2"",""created"":""Sat, 29 Jun 1996 23:42:12 GMT""}]","2008-02-03"
"gr-qc/9511018","Cenalo Vaz","Cenalo Vaz and Louis Witten","Do Naked Singularities Form?","7 pages (21 Kb), PHYZZX. Revised version to appear in Class. & Quant.
  Grav. Letts. A discussion of the consistency of the Sine-Gordon model is
  included","Class.Quant.Grav.13:L59-L65,1996","10.1088/0264-9381/13/5/004","UATP-95/03","gr-qc",,"  A naked singularity is formed by the collapse of a Sine-Gordon soliton in 1+1
dimensional dilaton gravity with a negative cosmological constant. We examine
the quantum stress tensor resulting from the formation of the singularity.
Consistent boundary conditions require that the incoming soliton is accompanied
by a flux of incoming radiation across past null infinity, but neglecting the
back reaction of the spacetime leads to the absurd conclusion that the total
energy entering the system by the time the observer is able to receive
information from the singularity is infinite. We conclude that the back
reaction must prevent the formation of the naked singularity.
","[{""version"":""v1"",""created"":""Sun, 5 Nov 1995 19:59:40 GMT""},{""version"":""v2"",""created"":""Tue, 12 Mar 1996 22:01:06 GMT""}]","2010-04-06"
"gr-qc/9511019","Ugo Moschella","J. Bros and U. Moschella","Two-point Functions and Quantum Fields in de Sitter Universe","51 p, uuencoded, LaTex, epsf, 2 figures included","Rev.Math.Phys. 8 (1996) 327-392","10.1142/S0129055X96000123","Saclay preprint SPhT 94/160, to appear in Rev. Math. Phys","gr-qc",,"  We present a theory of general two-point functions and of generalized free
fields in d-dimensional de Sitter space-time which closely parallels the
corresponding minkowskian theory. The usual spectral condition is now replaced
by a certain geodesic spectral condition, equivalent to a precise thermal
characterization of the corresponding ``vacuum''states. Our method is based on
the geometry of the complex de Sitter space-time and on the introduction of a
class of holomorphic functions on this manifold, called perikernels, which
reproduce mutatis mutandis the structural properties of the two-point
correlation functions of the minkowskian quantum field theory. The theory
contains as basic elementary case the linear massive field models in their
``preferred'' representation. The latter are described by the introduction of
de Sitter plane waves in their tube domains which lead to a new integral
representation of the two-point functions and to a Fourier-Laplace type
transformation on the hyperboloid. The Hilbert space structure of these
theories is then analysed by using this transformation. In particular we show
the Reeh-Schlieder property. For general two-point functions, a substitute to
the Wick rotation is defined both in complex space-time and in the complex mass
variable, and substantial results concerning the derivation of Kallen-Lehmann
type representation are obtained.
","[{""version"":""v1"",""created"":""Mon, 6 Nov 1995 12:06:08 GMT""}]","2015-06-25"
"gr-qc/9511020","Matej Pavi","Matej Pavsic","The Embedding Model of Induced Gravity with Bosonic Sources","11 pages","Grav.Cosmol. 2 (1996) 1-6",,,"gr-qc",,"  We consider a theory in which spacetime is an n-dimensional surface $V_n$
embedded in an $N$-dimensional space $V_N$. In order to enable also the
Kaluza-Klein approach we admit $n > 4$. The dynamics is given by the minimal
surface action in a curved embedding space. The latter is taken, in our
specific model, as being a conformally flat space. In the quantization of the
model we start from a generalization of the Howe-Tucker action which depends on
the embedding variables ${\eta}^a (x)$ and the (intrinsic) induced metric
$g_{\mu \nu}$ on $V_n$. If in the path integral we perform only the functional
integration over ${\eta}^a (x)$, we obtain the effective action which
functionally depends on $g_{\mu \nu}$ and contains the Ricci scalar $R$ and its
higher orders $R^2$ etc. But due to our special choice of the conformal factor
in $V_N$ enterig our original action, it turns out that the effective action
contains also the source term. The latter is in general that of a
$p$-dimensional membrane ($p$-brane); in particular we consider the case of a
point particle. Thus, starting from the basic fields ${\eta}^a (x)$, we induce
not only the kinetic term for $g_{\mu \nu}$, but also the ""matter"" source term.
","[{""version"":""v1"",""created"":""Mon, 6 Nov 1995 14:17:54 GMT""},{""version"":""v2"",""created"":""Tue, 7 Nov 1995 12:32:50 GMT""}]","2008-02-03"
"gr-qc/9511021","Azreg-Ainou Mustapha","Mustapha Azreg-Ainou","Solutions Stationnaires en Th\'eorie de Kaluza-Klein","Minor errors corrected. 120 pages, LaTeX, no figures. A thesis
  submitted in conformity with the requirements for the degree of Docteur
  Es-Sciences at the Institut Non Lin\'eaire de Nice (INLN), France",,,,"gr-qc",,"  Kaluza-Klein theory is a 5-dimensional Einstein general relativity; it has
the interest of describing on an equal footing the laws of gravitation and
electromagnetism in a geometrically unified way. We present it in Chapter 1,
and we generalize it by adding to the equations of the theory the Lanczos
tensor (endowed with the same physical properties as the Einstein tensor but
quadratic with respect to the Riemann tensor.) One has obtained in the last
decade all the spherically symmetric 2-stationary solutions (independent of
time and of the extra coordinate) of the ``special"" Kaluza-Klein theory. The
study of the stability of these solutions against radial excitations is carried
out in Chapter 2. We begin by presenting the spherically symmetric 2-static
solutions; then we write and separate the perturbation-linearized equations of
the 5-metric. The problem of stability against small oscillations is reduced to
an eigenvalue problem which we discuss in detail in the static-solution
parameter space. We show that regular solutions of non-vanishing finite energy
(Kaluza-Klein solitons) --with non-euclidean spatial topology-- are stable. A
broad class of singular solutions, containing among others the Schwarzschild
solution, are also stable. Finally our stability results are compared to those
obtained previously by Tomimatsu for a less broad class of solutions. We search
in Chapter 3 for other exact stationary solutions, endowed this time with
cylindrical symmetry, thus actually 4-stationary (depending on only one
spacelike coordinate). First we obtain by a systematic study all the
4-stationary solutions of the special theory, some of which are interpreted as
neutral or charged distributional cosmic string sources. We generalize these
solutions in a following section by considering the Lanczos tensor, and we find
","[{""version"":""v1"",""created"":""Mon, 6 Nov 1995 15:14:10 GMT""},{""version"":""v2"",""created"":""Thu, 21 Dec 1995 13:41:47 GMT""}]","2008-02-03"
"hep-lat/9511007","Poul Henrik Damgaard","P.H. Damgaard, J. Greensite and M. Hasenbusch","Deconfinement, Screening and Abelian Projection at Finite Temperature","LaTeX, 9 postscript figures, 13 pages",,,"NBI-HE-95-35","hep-lat",,"  The behavior of static sources transforming according to different
irreducible representations of the gauge group is studied in the context of
finite temperature lattice gauge theory. We combine analytical and numerical
approaches to extract information about confinement and screening both at low
temperatures, and around the deconfinement phase transition. The idea that
abelian projection in the Maximally Abelian Gauge reproduces the most important
features of confinement and screening is tested at a quantitative level in
these finite-T theories. Our results show that while this abelian projection
provides correct qualitative features, it fails at a detailed quantitative
level.
","[{""version"":""v1"",""created"":""Mon, 6 Nov 1995 09:50:23 GMT""}]","2007-05-23"
"hep-ph/9511241","John Elwood","John K. Elwood (California Institute of Technology)","Excited Charmed Baryon Decays and Their Implications for Fragmentation
  Parameters","23 Pages, including 6 figs., in TeX; uses harvmac.tex, epsf.tex, and
  tables.tex","Phys.Rev. D53 (1996) 4866-4874","10.1103/PhysRevD.53.4866","CALT-68-2027","hep-ph",,"  The production of the excited charmed baryon doublet $\Lambda_c^*$ via
fragmentation is studied. An analysis of the subsequent hadronic decays of the
doublet within the framework of heavy hadron chiral perturbation theory
produces expressions for both the angular distribution of the decay products
and the polarization of the final state heavy baryon in terms of various
nonperturbative fragmentation parameters. Future experimental investigation of
this system will determine these parameters. In addition, recent experimental
results are shown to fix one of the parameters in the heavy hadron chiral
Lagrangian.
","[{""version"":""v1"",""created"":""Sun, 5 Nov 1995 23:43:11 GMT""}]","2009-10-28"
"hep-ph/9511242","German Valencia","G. Valencia","Theoretical Aspects of CP Violation in Hyperon Decays","4 pages LaTeX. Talk presented at Baryons'95",,,"ISU-HET-95-8","hep-ph",,"  I review the estimate of the CP violating asymmetry $A(\Lambda^0_-)$ within
the standard model. I then review the estimate of the upper bound on this
asymmetry that arises from measurements of CP violation in kaon decays.
","[{""version"":""v1"",""created"":""Sun, 5 Nov 1995 23:57:07 GMT""}]","2007-05-23"
"hep-ph/9511243","Janos Polonyi","J. Polonyi","Confinement and renormalization","Lecture delivered at the Enrico Fermi School of Physics, 37 pages,
  LATEX",,,,"hep-ph",,"  The haaron gas description is reviewed for the QCD vacuum. The role of
non-renormalizable operators is emphasised in the mechanism which generates the
string tension. Additional examples are mentioned where certain
non-renormalizable operators of the bare lagrangian turn out to be important at
finite energy scale.
","[{""version"":""v1"",""created"":""Mon, 6 Nov 1995 10:02:23 GMT""}]","2007-05-23"
"hep-ph/9511244",,"A. Dobado and J. Morales","A note on the GG-->PI 0 PI 0 reaction in the 1/N expansion of ChPT","16 pages, LaTeX","Phys.Lett. B365 (1996) 264-274","10.1016/0370-2693(95)01240-0",,"hep-ph",,"  In this work we present the results of a complete calculation of the $\gamma
  \gamma\rightarrow \pi^0\pi^0$ amplitude to leading order in the large $N$
approximation ($N$ being the number of Goldstone bosons) up to order
$m^2_{\pi}/F^2$. The amplitude turns to be proportional to that of
$\pi^+\pi^-\rightarrow \pi^0\pi^0$. In spite of the fact that this
factorization property cannot hold in general (as it was recently pointed out
by Morgan and Penington), it appears here since in the large $N$ limit only the
$I=J=0$ channel contributes to the $\gamma \gamma\rightarrow \pi^0\pi^0$
reaction. Moreover it seems to be a reasonable approximation in
  this case since it is possible to reproduce, as a prediction, the
experimental data starting from a one-parameter fit of the $\pi\pi$ scattering
data.
","[{""version"":""v1"",""created"":""Mon, 6 Nov 1995 08:17:14 GMT""}]","2016-09-01"
