"hep-ph/9511245","Marcelo Moraes Guzzo","V.M. Aquino, J. Bellandi and M.M. Guzzo","On mixing angles and resonances in three neutrino oscillations in matter","14 pages, revtex, 4 figures in 4 post script files appended in the
  end of the text","Braz.J.Phys. 27 (1997) 384-391",,,"hep-ph",,"  We find exact analytical expressions for mixing angles in matter in the
context of three generation neutrino oscillations in matter to discuss the role
of resonances in this phenomenon. We show that some knowledge from conventional
two neutrino MSW effect, which has been extended to approximated solutions to
three neutrino oscillations, has to be abandoned in this exact approach. We
observe that maximal values for the mixing angles in matter are found in
nonresonant regions and stationary phases do not coincide anymore with
resonances in this simple extension of the MSW effect. We present a general way
to identify a resonance and discuss what we can physically expect in these
regions.
","[{""version"":""v1"",""created"":""Mon, 6 Nov 1995 12:42:49 GMT""}]","2007-05-23"
"hep-ph/9511247","David Persson","David Persson","Electron Thermal Self-Energy in a Magnetic Field","9 pages,1 postscript figure using mathfig",,,"Goteborg ITP 95-30","hep-ph",,"  Using the general form of the static energy solutions to the Dirac equation
with a magnetic field, we calculate a general self-energy matrix in the
Furry-picture. In the limit of high temperatures, but even higher magnetic
fields, a self-consistent dispersion relation is solved. In contrast to the
high temperature limit, this merely results in a small mass shift. The electron
anomalous magnetic moment is calculated. The contribution from thermal fermions
is found to be different from the corresponding contribution using perturbation
theory and plane-wave external states. In the low temperature limit the
self-energy is shown to exhibit de Haas--van Alphen oscillations. In the limit
of low temperatures and high densities, the self-energy becomes very large.
","[{""version"":""v1"",""created"":""Mon, 6 Nov 1995 14:12:48 GMT""}]","2007-05-23"
"hep-ph/9511248","Laura Reina","Laura Reina (Brookhaven National Laboratory)","Signals from Flavor Changing Interactions in Extended Models","2 pages, latex file, gzip-compressed and uuencoded; invited talk at
  the European Physical Society Conference on High Energy Physics, Brussels,
  July 1995; to be published in the proceedings",,,,"hep-ph",,"  In the contest of a Two Higgs Doublet Model without flavor conservation, the
presence of Flavor Changing Neutral Scalar Currents may affect in particular
the couplings of the top quark. Some ideas on how to look for new signals from
Flavor Changing Interactions at the next generation of lepton colliders are
presented.
","[{""version"":""v1"",""created"":""Mon, 6 Nov 1995 15:20:04 GMT""}]","2007-05-23"
"hep-ph/9511249","Gottfried Holzwarth","Gottfried Holzwarth (Universitaet-GH-Siegen)","Baryons as Solitons in Effective Chiral Field Theories","15 pages (RevTeX), 6 uuencoded figures, Lecture presented at the
  International School of Nuclear Physics, 17th Course: ""Quarks in Hadrons and
  Nuclei""at the Ettore Majorana Centre, Erice, Italy, September 19th-27th, 1995","Prog.Part.Nucl.Phys.36:161-176,1996","10.1016/0146-6410(96)00021-X",,"hep-ph nucl-th",,"  This lecture comprises some recent developments concerning the description of
baryons as topological solitons in effective chiral meson theories. In the
first part one-loop corrections to the classical tree approximation are
discussed. This involves renormalization of low-energy coupling constants and
evaluation of the finite next-to-leading-order terms in the $1/N_c$ expansion.
Recent results for various nucleon observables are presented. In the second
part electromagnetic nucleon form factors (FFs) with relativistic corrections
are evaluated in a chiral soliton model including vector mesons. The magnetic
FF $G_M^p$ is shown to agree well with new SLAC data for spacelike $Q^2$ up to
30(GeV/c)$^2$ if superconvergence is enforced. The electric FF $G_E^p$ is
dominated by a zero in the few (GeV/c)$^2$ region. The third part describes how
to extract the strong $\pi NN$ form factor from chiral soliton models, taking
due care of the local metric created by the presence of the soliton. When used
in a one-boson-exchange model for the nucleon-nucleon (NN) interaction,
deuteron properties and phase parameters of NN scattering are reproduced as
well as in conventional NN models that apply a hard monopole form factor at the
$\pi NN$ vertex.
","[{""version"":""v1"",""created"":""Mon, 6 Nov 1995 15:17:33 GMT""}]","2011-04-15"
"hep-th/9511032",,"A. Astashkevich","On the structure of Verma module over Virasoro and Neveu-Schwarz
  algebras","41 pages, LaTeX","Commun.Math.Phys. 186 (1997) 531-562","10.1007/s002200050119",,"hep-th",,"  In the paper we present a different proof of the theorem of B. L. Feigin and
D. B. Fuchs about the structure of Verma modules over Virasoro algebra. We
state some new results about the structure of Verma modules over Neveu-Schwarz.
The proof has thwo advantages: first, it is simplier in the most interesting
cases (for example in the so called minimal models), second, it can be
generalized for Neveu-Schwarz algebra for some class of Verma modules.
","[{""version"":""v1"",""created"":""Mon, 6 Nov 1995 02:02:11 GMT""}]","2016-09-06"
"hep-th/9511033","Taichiro Kugo","Taichiro Kugo","The Universal Renormalization Factors Z_1/Z_3 and Color Confinement
  Condition in Non-Abelian Gauge Theory","11 pages + 1 uuencoded eps figure, LaTeX",,,"KUNS-1368","hep-th",,"  The ratio Z_1/Z_3 of vertex and wave-function renormalization factors, which
is universal (i.e., matter-independent), is shown to equal 1+u which gives the
residue of the scalar pole $\propto p_\mu p_\nu /p^2$ of 2-point function <
D_\mu c D_\nu \bar c >. This relation is interesting since 1+u=0 has been known
to give a sufficient condition for color confinement. We also give an argument
that, when 1+u=0 holds, it will be realized by the disappearance of the
massless gauge boson pole and is related with the restoration of a certain
``local gauge symmetry"" as was discussed by Hata. (Talk given at International
Symposium on BRS Symmetry, Sept.~18 -- 22, 1995, Kyoto.)
","[{""version"":""v1"",""created"":""Mon, 6 Nov 1995 07:15:35 GMT""}]","2007-05-23"
"hep-th/9511034",,"Rolf Tarrach (U. of Barcelona)","Mode dependent field renormalization and triviality","14 pages, no figures, TeX file","Phys.Lett. B367 (1996) 249-253","10.1016/0370-2693(95)01438-1","UB-ECM-PF-95/18","hep-th",,"  We critically analyze the introduction of an independent zero momentum mode
field renormalization for Phi4. It leads to an infrared divergent effective
action. It does not achieve its purpose: triviality still gives massless
particles in the broken phase in the continuum limit. It leads to an effective
potential which is not the low energy limit of the effective action.
","[{""version"":""v1"",""created"":""Mon, 6 Nov 1995 09:49:35 GMT""}]","2009-10-28"
"hep-th/9511035","Yukinari Sumino","Y. Sumino (Tohoku University)","New Method for Exact Calculation of Green Functions in Scalar Field
  Theory","PostScript file of Figures is attached in the end. Search for the
  strings ""cut here""","Prog.Theor.Phys. 95 (1996) 389-407","10.1143/PTP.95.389","TU-492","hep-th hep-ph",,"  We present a new method for calculating the Green functions for a lattice
scalar field theory in $D$ dimensions with arbitrary potential $V(\phi)$. The
method for non-perturbative evaluation of Green functions for $D \! = \! 1$ is
generalized to higher dimensions. We define ``hole functions''
$A^{(i)}~(i=0,1,2,\cdots,N \! -\! 1)$ from which one can construct $N$-point
Green functions. We derive characteristic equations of $A^{(i)}$ that form a
{\it finite closed} set of coupled local equations. It is shown that the Green
functions constructed from the solutions to the characteristic equations
satisfy the Dyson-Schwinger equations. To fix the boundary conditions of
$A^{(i)}$, a prescription is given for selecting the vacuum state at the
boundaries.
","[{""version"":""v1"",""created"":""Mon, 6 Nov 1995 11:15:29 GMT""}]","2009-10-28"
"hep-th/9511037",,"J.M.F. Labastida","Topological Quantum Field Theory: A Progress Report","latex, 17 pages, talk given at the IV Fall Workshop on Differential
  Geometry and its Applications, 1995",,,"USC-FT-26-95","hep-th alg-geom math.AG math.QA q-alg",,"  A brief introduction to Topological Quantum Field Theory as well as a
description of recent progress made in the field is presented. I concentrate
mainly on the connection between Chern-Simons gauge theory and Vassiliev
invariants, and Donaldson theory and its generalizations and Seiberg-Witten
invariants. Emphasis is made on the usefulness of these relations to obtain
explicit expressions for topological invariants, and on the universal structure
underlying both systems.
","[{""version"":""v1"",""created"":""Mon, 6 Nov 1995 08:25:13 GMT""}]","2008-02-03"
"hep-th/9511041","Paul Mansfield","Paul Mansfield and Jiannis Pachos","The O(N) sigma-model Laplacian","7 pages, latex","Phys.Lett. B365 (1996) 169-174","10.1016/0370-2693(95)01333-4","DTP 95/45","hep-th",,"  For fields that vary slowly on the scale of the lightest mass the logarithm
of the vacuum functional of a massive quantum field theory can be expanded in
terms of local functionals satisfying a form of the Schr\""odinger equation, the
principal ingredient of which is a regulated functional Laplacian. We construct
to leading order a Laplacian for the O(N) sigma-model that acts on such local
functionals. It is determined by imposing rotational invariance in the internal
space together with closure of the Poincar\'e algebra.
","[{""version"":""v1"",""created"":""Mon, 6 Nov 1995 14:13:46 GMT""}]","2009-10-28"
"hep-th/9511042",,"M. Temple-Raston","The redshift in Hubble's constant","13 pages, LaTeX","Int.J.Theor.Phys. 36 (1997) 249-258",,,"hep-th astro-ph",,"  A generalisation to electrodynamics and Yang-Mills theory is presented that
permits computation of the speed of light. The model presented herewithin
indicates that the speed of light in vacuo is not a universal constant. This
may be relevant to the current debate in astronomy over large values of the
Hubble constant obtained through the use of the latest generation of ground and
space-based telescopes. An experiment is proposed based on Compton scattering
to measure deviations in the speed of light.
","[{""version"":""v1"",""created"":""Mon, 6 Nov 1995 12:16:10 GMT""}]","2007-05-23"
"nucl-th/9511006","Mitko Gaidarov","A.N. Antonov, S.S. Dimitrova, M.K. Gaidarov, M.V. Stoitsov, M.E.
  Grypeos, S.E. Massen, K.N. Ypsilantis","Consistent Construction of Realistic One-Body Density Matrix in Nuclei","18 pages, LaTeX file, to be published in Nuclear Physics A","Nucl.Phys.A597:163-176,1996","10.1016/0375-9474(95)00435-1",,"nucl-th",,"  A phenomenological method based on the natural orbital representation is
applied to construct the ground state one-body density matrix which describes
correctly both density and momentum distributions in $^{4}He$, $^{16}O$ and
$^{40}Ca$ nuclei. The parameters of the matrix are fixed by a best fit to the
experimental density distribution and to the correlated nucleon momentum
distribution. The method allows the natural orbitals, the occupation
probabilities and the depletion of the Fermi sea to be obtained. Ground-state
characteristics of $^{4}He$, $^{16}O$ and $^{40}Ca$ nuclei, such as rms radii
and mean kinetic energies are calculated, as well.
","[{""version"":""v1"",""created"":""Mon, 6 Nov 1995 11:12:19 GMT""}]","2008-11-26"
"q-alg/9511003","Edward Frenkel","Edward Frenkel","Deformations of the KdV hierarchy and related soliton equations","19 pages, AMSLATEX",,,,"q-alg hep-th math.QA",,"  We define hierarchies of differential--q-difference equations, which are
q-deformations of the equations of the generalized KdV hierarchies. We show
that these hierarchies are bihamiltonian, one of the hamiltonian structures
being that of the q-deformed classical W-algebra of sl(N), defined by
Reshetikhin and the author. We also find q-deformations of the mKdV hierarchies
and the affine Toda equations.
","[{""version"":""v1"",""created"":""Mon, 6 Nov 1995 02:27:33 GMT""}]","2008-02-03"
"quant-ph/9511005","Lev Vaidman","Yakir Aharonov, Lev Vaidman","About Position Measurements Which Do Not Show the Bohmian Particle
  Position","13 pages, LaTeX, 4 figures, contribution to ""Bohmian Mechanics and
  Quantum Theory: An Appraisal,"" edited by J.T. Cushing, A. Fine, and S.
  Goldstein (Kluwer, to appear)",,,"TAUP 2301-95","quant-ph",,"  ``Weak'', ``protective'', and ``delayed observation'' measurements are
analyzed in the framework of the Bohm interpretation of quantum theory. It is
argued that the above varieties of measurements manifest some difficulties of
the Bohm interpretation since they show that Bohmian trajectories behave not as
we would expect from a classical type model.
","[{""version"":""v1"",""created"":""Mon, 6 Nov 1995 09:26:54 GMT""}]","2007-05-23"
