"astro-ph/9511050","Andrea Biviano","A. Biviano, P. Katgert, A. Mazure, M. Moles, R. den Hartog, P. Focardi","The Kinematics of Emission-Line Galaxies in Clusters from ENACS","gzipped postscript file; to appear in the proceedings of the
  international workshop: ""Observational Cosmology: from Galaxies to Galaxy
  Systems"", Sesto, Italy, 4-7 July 1995, special issue of Astrophysical Letters
  and Communications, G.C.C.Palumbo ed",,,,"astro-ph",,"  Summary - By using the data from the ESO Nearby Abell Cluster Survey (ENACS),
we have studied the properties of emission-line galaxies (ELG) in clusters. The
fraction of ELG in clusters is 16~\%; this fraction is slightly dependent on
the cluster velocity dispersion, being larger for ``colder'' systems. ELG tend
to occur more frequently than other cluster galaxies in substructures. However,
only a minor cluster fraction has an ELG population with a mean velocity
significantly different from that of the overall cluster population. The
velocity distribution of cluster ELG is broader than that of the other cluster
galaxies, which translates in a larger observed velocity dispersion. The
velocity distribution for ELG in the inner cluster regions suggests that ELG
are on mostly radial orbits.
","[{""version"":""v1"",""created"":""Mon, 13 Nov 1995 12:08:51 GMT""}]","2007-05-23"
"astro-ph/9511051","Andrea Biviano","P. Katgert, A. Mazure, J. Perea, R. den Hartog, et al","The ESO Nearby Abell Cluster Survey. I. Description of the Dataset and
  Definition of Physical Systems","accepted by A&A; LateX file (no figures). Complete uuencoded
  Z-compressed postscript file available via anonymous ftp at
  ftp://strw.leidenuniv.nl/pub/katgert/paper1.uu (132.229.80.1), or at
  ftp://lasm0b.astrsp-mrs.fr/amazure/papers/enacs1.uu (193.50.128.3) (VMS
  server)","Astron.Astrophys. 310 (1996) 8",,,"astro-ph",,"  Summary - We describe the results of the ESO Key-programme on `Structure and
Dynamics of Rich Galaxy Clusters' (or ENACS). The final database contains a
total of 5634 galaxies in the directions of 107 clusters from the ACO catalogue
with richness $R\ge 1$ and mean redshifts $z \le 0.1$. Of the 5634 redshifts,
4465 are based on absorption lines only, 583 on emission lines only and 586 on
both. The overall reliability of the 5634 accepted redshifts is 0.98. For 5615
galaxies an $R_{25}$ magnitude was obtained. We discuss various methods for
defining the compact, physically relevant systems in the 107 `pencil-beam'
surveys. We have chosen to apply a fixed velocity gap of 1000 km/s to separate
galaxies that do not form part of the same system. With this gap size, systems
are not broken up into sub-systems, and field galaxies are hardly linked to the
systems. We present the mean redshifts of the 220 systems (with at least 4
members) identified in the 107 pencil beam surveys. On average, about 75~\% of
the 5634 galaxies are in the largest system found in the direction of the rich
Abell cluster candidate. Half of the 25~\% of galaxies outside the largest
system belong to a secondary system along the same line of sight. For about
90~\% of the nearby rich Abell cluster candidates studied here we find a
redshift system that either contains more than half of the total number of
redshifts, or that has at least two times as many redshifts as the next largest
system.
","[{""version"":""v1"",""created"":""Mon, 13 Nov 1995 11:02:29 GMT""}]","2007-05-23"
"astro-ph/9511052","Andrea Biviano","A. Mazure, P. Katgert, R. den Hartog, A. Biviano et al","The ESO Nearby Abell Cluster Survey. II. The Distribution of Velocity
  Dispersions of Rich Galaxy Clusters","accepted by A&A; LateX file (no figures). Complete uuencoded
  Z-compressed postscript file available via anonymous ftp at
  ftp://strw.leidenuniv.nl/pub/katgert/paper2.uu (132.229.80.1), or at
  ftp://lasm0b.astrsp-mrs.fr/amazure/papers/enacs2.uu (193.50.128.3) (VMS
  server)","Astron.Astrophys. 310 (1996) 31",,,"astro-ph",,"  Summary - By combining the 5634 redshifts from the ESO Nearby Abell Cluster
Survey (the ENACS) with another 1000 redshifts from the literature we are able
to study the distribution of velocity dispersions for a volume-limited sample
of 128 $R_{\rm ACO} \geq 1$ clusters, out to a redshift $z=0.1$, in a solid
angle of 2.55 sr centered on the South Galactic Pole. In deriving velocity
dispersions we apply a new, physically motivated method for removing fore- and
background galaxies. We discuss in detail the completeness of the cluster
sample for which we derive the distribution of cluster velocity dispersions.
The large apparent spread between velocity dispersion and richness must be
largely intrinsic. A consequence of the very broad relation between richness
and velocity dispersion is that all cluster samples complete in richness are
biased against low dispersions. For the richness limit of our sample this bias
operates below about 800 km/sec. Above 800 km/s, our distribution of global
velocity dispersions is free from systematic errors and biases, and agrees very
well with the most recent determination of the distribution of cluster X-ray
temperatures. Therefore, we conclude that X-ray temperature and velocity
dispersion distributions statistically measure the same cluster property. We
stress the need for model predictions that produce exactly the same information
as provided by the observations, for a sample of model clusters with a richness
limit that mimics that of the sample of observed clusters.
","[{""version"":""v1"",""created"":""Mon, 13 Nov 1995 11:10:24 GMT""}]","2007-05-23"
"astro-ph/9511053","Il Greco","V. Kolokotronis, M. Plionis, P. Coles, S. Borgani and L. Moscardini","Sampling Effects on Cosmological Dipoles","11 pages + 5 figures, all uuencoded, gziped and tarred postscript
  files. Accepted for publication in MNRAS",,"10.1093/mnras/280.1.186",,"astro-ph",,"  We use numerical simulations to investigate the behaviour of the dipole
moment of the spatial distribution of different kinds of mass tracers. We
select density peaks of the simulated matter distribution with mean separations
of 38 and 30 $h^{-1}$ Mpc to represent two samples of rich clusters of
galaxies. We extract, from the same simulations, samples selected to mimic the
full 3D galaxy distribution of IR galaxies, and the flux--limited IRAS and QDOT
galaxy samples. We compare the dipole moments of these ``galaxy'' and
``cluster'' samples in order to assess the effects of sampling uncertainties
and shot--noise on the relationship between the ``true'' underlying galaxy
dipole and the dipoles obtained for clusters and for the flux--limited galaxy
samples. The results of this analysis demonstrate that the dipoles of both the
IRAS and QDOT--like catalogues should trace the full 3D dipole shape fairly
accurately, with the loss however of about 15--20$\%$ of the total 3D dipole
amplitude. Furthermore, using a simple argument based on linear perturbation
theory, on the linear biasing assumption and on the amplitude of the cluster
dipole relative to that of galaxies, we can estimate their relative biasing
factors quite accurately and in agreement with results obtained by other
methods.
","[{""version"":""v1"",""created"":""Mon, 13 Nov 1995 12:51:33 GMT""}]","2015-06-24"
"astro-ph/9511057","Andrew Liddle","Andrew R Liddle, David H Lyth, R K Schaefer, Q Shafi and Pedro T P
  Viana","Pursuing Parameters for Critical Density Dark Matter Models","19 pages LaTeX file (uses mn.sty). Figures *not* included due to
  length. We strongly recommend obtaining the full paper, either by WWW at
  http://star-www.maps.susx.ac.uk/papers/lsstru_papers.html (UK) or
  http://www.bartol.udel.edu/~bob/papers (US), or by e-mailing ARL. Final
  version, to appear MNRAS. Main revision is update to four-year COBE data.
  Miscellaneous other changes and reference updates. No significant changes to
  principal conclusions","Mon.Not.Roy.Astron.Soc.281:531,1996","10.1093/mnras/281.2.531","SUSSEX-AST 95/11-3, BA-95-52","astro-ph hep-ph",,"  We present an extensive comparison of models of structure formation with
observations, based on linear and quasi-linear theory. We assume a critical
matter density, and study both cold dark matter models and cold plus hot dark
matter models. We explore a wide range of parameters, by varying the fraction
of hot dark matter $\Omega_{\nu}$, the Hubble parameter $h$ and the spectral
index of density perturbations $n$, and allowing for the possibility of
gravitational waves from inflation influencing large-angle microwave background
anisotropies. New calculations are made of the transfer functions describing
the linear power spectrum, with special emphasis on improving the accuracy on
short scales where there are strong constraints. For assessing early object
formation, the transfer functions are explicitly evaluated at the appropriate
redshift. The observations considered are the four-year {\it COBE} observations
of microwave background anisotropies, peculiar velocity flows, the galaxy
correlation function, and the abundances of galaxy clusters, quasars and damped
Lyman alpha systems. Each observation is interpreted in terms of the power
spectrum filtered by a top-hat window function. We find that there remains a
viable region of parameter space for critical-density models when all the dark
matter is cold, though $h$ must be less than 0.5 before any fit is found and
$n$ significantly below unity is preferred. Once a hot dark matter component is
invoked, a wide parameter space is acceptable, including $n\simeq 1$. The
allowed region is characterized by $\Omega_\nu \la 0.35$ and $0.60 \la n \la
1.25$, at 95 per cent confidence on at least one piece of data. There is no
useful lower bound on $h$, and for curious combinations of the other parameters
it is possible to fit the data with $h$ as high as 0.65.
","[{""version"":""v1"",""created"":""Mon, 13 Nov 1995 14:57:39 GMT""},{""version"":""v2"",""created"":""Thu, 18 Apr 1996 09:28:55 GMT""}]","2015-06-24"
"cmp-lg/9511002","Chris Brew","Chris Brew (Language Technology Group, HCRC, Edinburgh)","Letting the Cat out of the Bag: Generation for Shake-and-Bake MT","9 pages, published in proceedings of COLING-92, gzipped postscript",,,,"cmp-lg cs.CL",,"  Describes an algorithm for the generation phase of a Shake-and-Bake Machine
Translation system. Since the problem is NP-complete, it is unlikely that the
algorithm will be efficient in all cases, but for the cases tested it offers an
improvement over Whitelock's previously published algorithm. The work was
carried out while the author was employed at Sharp Laboratories of Europe Ltd.
","[{""version"":""v1"",""created"":""Mon, 13 Nov 1995 12:13:15 GMT""}]","2008-02-03"
"cond-mat/9511054","Lev Ioffe","L. B. Ioffe, A. J. Millis","Effect of van Hove Singularities on a Spin Liquid","11 pages, 4 Postscript figures in a separate file",,"10.1103/PhysRevB.54.3645",,"cond-mat",,"  We determine the properties and leading instabilities of a spin liquid with a
Fermi surface passing near a van Hove singularity. Our study is motivated by
recent photoemission experiments on high $T_c$ cuprates in which it is found
that for the optimally doped material the experimental Fermi surface passes
near a van Hove singularity, while for underdoped materials, a pseudogap in the
electron spectral function is formed in the vicinity of the van Hove point. We
show theoretically that proximity to the van Hove singularity suppresses the
inelastic scattering due to the gauge field and permits the formation of a
d-wave RVB state in which the gap exists only near the van Hove points while
finite regions of the Fermi surface remain gapless. This $d$-wave pairing
provides a natural explanation of the pseudogap observed in photoemission. We
also discuss the relation of the pseudogap observed in the spectral function to
the pseudogaps observed in the magnetic susceptibility.
","[{""version"":""v1"",""created"":""Sun, 12 Nov 1995 23:51:57 GMT""}]","2009-10-28"
"cond-mat/9511055","Yukinori Ohta","K. Tsutsui, Y. Ohta, R. Eder, S. Maekawa, E. Dagotto, and J. Riera","Heavy Quasiparticles in the Anderson Lattice Model","RevTex. Figures available upon request. To appear in PRL",,"10.1103/PhysRevLett.76.279",,"cond-mat",,"  An exact-diagonalization technique on small clusters is used to study the
dynamics of the one-dimensional symmetric Anderson lattice model. Our
calculated excitation spectra reproduce key features expected for an infinite
Kondo lattice such as nearly localized low-energy spin excitations and extended
regions of `heavy-quasiparticle' bands. We show that, in contrast to the
hybridization picture, low-energy spin excitations of the nearly-localized
$f$-electron system play a key role in the formation of an almost
dispersionless low-energy band of heavy quasiparticles.
","[{""version"":""v1"",""created"":""Mon, 13 Nov 1995 09:21:01 GMT""}]","2009-10-28"
"cond-mat/9511056",,"T.Miyazaki, I.Nakamura, and D.Yoshioka","Bi-layer Heisenberg model studied by the Schwinger-boson
  Gutzwiller-projection method","19 pages(including figure captions) RevTex3.0, 10 figures, available
  upon request","Phys. Rev. B 53 (1996) 12206","10.1103/PhysRevB.53.12206","Bilay11-95","cond-mat",,"  A two-dimensional bi-layer, square lattice Heisenberg model with different
intraplane($J_{\parallel}$) and interplane($J_{\perp}$) couplings is
investigated. The model is first solved in the Schwinger boson mean-field
approximation. %It is shown that order-disorder transition occurs as the
interplane Coupling %is increased. The critical ratio is $J_{\perp/\p=4.48J$
Then the solution is Gutzwiller projected to satisfy the local constraint that
there should be only one boson at each site. For these wave functions, we
perform variational Monte Carlo simulation up to $24 \times 24 \times 2$ sites.
It is shown that the N\'eel order is destroyed as the interplane coupling is
increased. The obtained critical value, $J_{\perp}/J_{\parallel}=3.51$, is
smaller than that by the mean-field theory. Excitation spectrum is calculated
by a single mode approximation. It is shown that energy gap develops once the
N\'eel order is destroyed.
","[{""version"":""v1"",""created"":""Mon, 13 Nov 1995 10:38:11 GMT""}]","2009-10-28"
"cond-mat/9511057","P. Dalmas de Reotier","P. Dalmas de R\'eotier, A. Huxley, A. Yaouanc, J. Flouquet, P.
  Bonville, P. Imbert, P. Pari, P.C.M. Gubbens and A.M. Mulders","Absence of zero field muon spin relaxation induced by superconductivity
  in the B phase of UPt$_3$","4 pages, REVTeX 3.0, 2 PostScript figures","Phys. Lett. A 205 (1995) 239","10.1016/0375-9601(95)00548-H",,"cond-mat",,"  We present muon spin relaxation measurements performed on crystals of the
heavy fermion superconductor UPt$_3$. In zero applied field, contrary to a
previous report, we do not observe an increase of the internal magnetic field
in the lower superconducting phase (the B phase). Our result gives an
experimental upper bound of the magnetic field that could be associated with
the superconducting state.
","[{""version"":""v1"",""created"":""Mon, 13 Nov 1995 09:50:05 GMT""}]","2009-10-28"
"cond-mat/9511058","Subir Sachdev","Kedar Damle, Satya Majumdar and Subir Sachdev (Yale University)","Phase ordering kinetics of the Bose gas","10 pages; revised presentation, but no additional results","Phys.Rev. A54 (1996) 5037-5041","10.1103/PhysRevA.54.5037",,"cond-mat atom-ph",,"  We study the approach to equilibrium of a Bose gas to a superfluid state. We
point out that dynamic scaling, characteristic of far from equilibrium
phase-ordering systems, should hold. We stress the importance of a
non-dissipative Josephson precession term in driving the system to a new
universality class. A model of coarsening in dimension $d=2$, involving a
quench between two temperatures below the equilibrium superfluid transition
temperature ($T_c$), is exactly solved and demonstrates the relevance of the
Josephson term. Numerical results on quenches from above $T_c$ in $d=2,3$
provide evidence for the scaling picture postulated.
","[{""version"":""v1"",""created"":""Mon, 13 Nov 1995 14:10:05 GMT""},{""version"":""v2"",""created"":""Thu, 28 Mar 1996 22:57:13 GMT""}]","2009-10-28"
"gr-qc/9511037","Kim Sang Pyo","Sang Pyo Kim (Department of Physics, Kunsan National University,
  Kunsan, Korea)","Unitarity Condition on Quantum Fields in Semiclassical Gravity","11 pages of Latex file, Revtex","Phys.Lett. A205 (1995) 359","10.1016/0375-9601(95)00584-P","KNU-TH26(Mar, 1995)","gr-qc",,"  The condition for the unitarity of a quantum field is investigated in
semiclassical gravity from the Wheeler-DeWitt equation. It is found that the
quantum field preserves unitarity asymptotically in the Lorentzian universe,
but does not preserve unitarity completely in the Euclidean universe. In
particular we obtain a very simple matter field equation in the basis of the
generalized invariant of the matter field Hamiltonian whose asymptotic solution
is found explicitly.
","[{""version"":""v1"",""created"":""Mon, 13 Nov 1995 07:36:06 GMT""}]","2009-10-28"
"gr-qc/9511038","Kim Sang Pyo","Sang Pyo Kim (Department of Physics, Kunsan National University,
  Korea)","New Asymptotic Expanstion Method for the Wheeler-DeWitt Equation","24 pages of Latex file, revtex","Phys.Rev.D52:3382-3391,1995","10.1103/PhysRevD.52.3382","KNU-TH25 (Feb, 1995)","gr-qc",,"  A new asymptotic expansion method is developed to separate the Wheeler-DeWitt
equation into the time-dependent Schr\""{o}dinger equation for a matter field
and the Einstein-Hamilton-Jacobi equation for the gravitational field including
the quantum back-reaction of the matter field. In particular, the nonadiabatic
basis of the generalized invariant for the matter field Hamiltonian separates
the Wheeler-DeWitt equation completely in the asymptotic limit of $m_p^2$
approaching infinity. The higher order quantum corrections of the gravity to
the matter field are found. The new asymptotic expansion method is valid
throughout all regions of superspace compared with other expansion methods with
a certain limited region of validity. We apply the new asymptotic expansion
method to the minimal FRW universe.
","[{""version"":""v1"",""created"":""Mon, 13 Nov 1995 07:26:29 GMT""}]","2011-07-19"
"hep-ex/9511005","Stephane Willocq","The SLD Collaboration","Measurement of the Average $B$-Hadron Lifetime in $Z^{0}$ Decays","10 pages, uuencoded gzip-compressed postscript (79 kB)","Phys.Rev.Lett.75:3624-3628,1995","10.1103/PhysRevLett.75.3624","SLAC-PUB-95-6976","hep-ex",,"  We report a measurement of the average $B$-hadron lifetime using data
collected with the SLD detector at the SLC in 1993. An inclusive analysis
selected three-dimensional vertices with $B$-hadron lifetime information in a
sample of 50k $Z^{0}$ decays. A lifetime of $1.564\pm0.030\,(\rm stat)\pm
0.037\,(\rm syst)$~ps was extracted from the decay length distribution of these
vertices using a binned maximum-likelihood method.
","[{""version"":""v1"",""created"":""Mon, 13 Nov 1995 04:21:08 GMT""}]","2012-08-27"
"hep-ex/9511006","Aharon Levy","Aharon Levy","Soft interactions at high energy","18 pages, latex 27 figures appended as uuencoded file. Uses
  wstwocl.sty and epsfig.sty. Rapporteur talk given at the International
  Europhysics Conference on High Energy Physics, Brussels, July 27-Aug 2, 1995",,,"DESY 95-204","hep-ex",,"  Soft interactions are not easily disentangled from hard ones. In an
operational definition of soft and hard processes one finds that at presently
analyzed scales there is an interplay of soft and hard processes. As the scale
increases, so does the amount of hard processes. So far, nothing is as soft nor
as hard as we would like.
","[{""version"":""v1"",""created"":""Sun, 12 Nov 1995 16:04:00 GMT""},{""version"":""v2"",""created"":""Mon, 13 Nov 1995 18:26:40 GMT""}]","2008-02-03"
"hep-lat/9511017","Peter Weisz","Peter Weisz (MPI, Munich)","Lattice Investigations of the Running Coupling","uuencoded postscript file",,"10.1016/0920-5632(96)00033-3",,"hep-lat",,"  A review of investigations of running couplings using lattice techniques is
given. This includes i) studies of the running of particular non-perturbatively
defined renormalized couplings in pure gauge theories over a range of energies,
and ii) how estimates of $\alpha_{\overline{MS}}(m_Z)$ in lattice QCD are
presently obtained.
","[{""version"":""v1"",""created"":""Mon, 13 Nov 1995 09:36:33 GMT""}]","2009-10-28"
"hep-ph/9511299","Nikolai Kochelev","N.I.Kochelev","Instanton contribution to the quark distribution functions","16 pages, 6 figures; Talk presented at 2nd Meeting on Possible
  Measurements of Singly Polarized pp and pn Collisions at HERA, DESY-Zeithen,
  August 31-September 1, 1995",,,,"hep-ph nucl-th",,"  The instanton contribution to the quark distribution functions in the nucleon
is estimated. It is shown, that taking into account the instanton induced
interaction between quarks allows to explain the anomalous violation of the
Ellis-Jaffe and Gottfried sum rules. The spin-dependent structure functions
$g_1^p(x)$, $g_1^n(x)$, $g_1^d(x)$ are calculated in the framework of the
instanton model of the QCD vacuum.
","[{""version"":""v1"",""created"":""Sun, 12 Nov 1995 16:58:38 GMT""}]","2007-05-23"
"hep-ph/9511301",,"Keiichi Akama","Compositeness Condition at the Next-to-Leading Order in the
  Nambu-Jona-Lasinio Model","11 pages, revtex, 1 figure","Phys.Rev.Lett. 76 (1996) 184-187","10.1103/PhysRevLett.76.184",,"hep-ph",,"  We investigate the compositeness condition in four dimensions at the
non-trivial order (next-to-leading order in $1/N$ with the number $N$ of the
colors), taking the Nambu-Jona-Lasinio model as an example. In spite of its
non-renormalizability, the compositeness condition can be successfully derived
and solved in compact forms. The resultant problems are discussed.
","[{""version"":""v1"",""created"":""Mon, 13 Nov 1995 08:48:26 GMT""}]","2009-10-28"
"hep-ph/9511302","Grzegorz Wilk","M.Szczekowski and G.Wilk","Universal Mass Dependence for Particle Production Rates in $e^+e^-$,
  $pp$ and $AA$ Collisions from the Quark-Gluon Plasma Perspective","LaTex file, 8 pages, hard copies of 3 (multiple) figures available on
  request to szczekow@cernvm.cer.ch or wilk@fuw.edu.pl. PROCSLA.STY file
  appended at the end of the LaTeX file for convenience",,"10.1016/0370-2693(96)00217-1","SINS preprint: PVI and PVIII/1995-25","hep-ph nucl-th",,"  It is demonstrated that universal mass dependence for meson and baryon
inclusive cross-sections advocated recently in $e^+e^-$ annihilation and in
hadronic reactions is consistent also with heavy ion collisions data and can
therefore be used as a reference for quark-gluon plasma studies.
","[{""version"":""v1"",""created"":""Mon, 13 Nov 1995 15:07:33 GMT""}]","2009-10-28"
"hep-ph/9511303","Igor Dremin","I.M. Dremin","QCD and experiment on multiplicity distributions","9 pages, LATEX, no Figures",,,"Talk at 2nd Rencontres du Vietnam (the abbreviated version to be
  published in the proceedings)","hep-ph",,"  The solution of QCD equations for generating functions of {\it parton}
multiplicity distributions reveals new peculiar features of cumulant moments
oscillating as functions of their rank. It happens that experimental data on
{\it hadron} multiplicity distributions in $e^{+}e^{-}, hh, AA$ collisions
possess the similar features. However, the ""more regular"" models like $\lambda
\phi ^3$ behave in a different way. Evolution of the moments at smaller phase
space bins and zeros of the truncated generating functions are briefly
discussed.
","[{""version"":""v1"",""created"":""Mon, 13 Nov 1995 14:56:56 GMT""}]","2007-05-23"
"hep-ph/9511304","Myriam Mondragon C.","Jisuke Kubo, Myriam Mondragon and George Zoupanos","The Top-Bottom Hierarchy from Gauge-Yukawa Unification","13 pages, LaTeX and epsf package, Postscript figures. To be published
  in the proceedings of the Yukawa International Seminar '95","Prog.Theor.Phys.Suppl.123:127-136,1996","10.1143/PTPS.123.127","KANAZAWA-95-18, HD-THEP-95-50","hep-ph",,"  The idea of Gauge-Yukawa Unification (GYU) based on the principle of
reduction of couplings is elucidated. We show how the observed top-bottom mass
hierarchy can be explained in terms of supersymmetric GYU by considering an
example of the minimal supersymmetric GUT.
","[{""version"":""v1"",""created"":""Mon, 13 Nov 1995 15:01:46 GMT""}]","2011-01-27"
"hep-th/9511076","Emil Vinteler","E.Vinteler","Star--Matrix Models","15 pages, Latex (to appear in Mod.Phys.Lett.)","Mod.Phys.Lett. A10 (1995) 2709-2725","10.1142/S0217732395002842","SISSA-ISAS 92/95/EP","hep-th",,"  The star-matrix models are difficult to solve due to the multiple powers of
the Vandermonde determinants in the partition function. We apply to these
models a modified Q-matrix approach and we get results consistent with those
obtained by other methods.As examples we study the inhomogenous gaussian model
on Bethe tree and matrix $q$-Potts-like model. For the last model in the
special cases $q=2$ and $q=3$, we write down explicit formulas which
determinate the critical behaviour of the system.For $q=2$ we argue that the
critical behaviour is indeed that of the Ising model on the $\phi^3$ lattice.
","[{""version"":""v1"",""created"":""Sun, 12 Nov 1995 17:19:51 GMT""}]","2015-06-26"
