"hep-th/9511077",,"Alexander Belopolsky and Barton Zwiebach","Who changes the string coupling ?","34 pages, phyzzx","Nucl.Phys. B472 (1996) 109-138","10.1016/0550-3213(96)00203-9","MIT-CTP-2450","hep-th",,"  In general bosonic closed string backgrounds the ghost-dilaton is not the
only state in the semi-relative BRST cohomology that can change the
dimensionless string coupling. This fact is used to establish complete dilaton
theorems in closed string field theory. The ghost-dilaton, however, is the
crucial state: for backgrounds where it becomes BRST trivial we prove that the
string coupling becomes an unobservable parameter of the string action. For
backgrounds where the matter CFT includes free uncompactified bosons we
introduce a refined BRST problem by including the zero-modes ""x"" of the bosons
as legal operators on the complex. We argue that string field theory can be
defined on this enlarged complex and that its BRST cohomology captures
accurately the notion of a string background. In this complex the ghost-dilaton
appears to be the only BRST-physical state changing the string coupling.
","[{""version"":""v1"",""created"":""Sun, 12 Nov 1995 22:15:33 GMT""}]","2009-10-28"
"hep-th/9511078","Bill McGlinn","W.D.McGlinn (University of Notre Dame,U of Notre Dame),
  L.O'Raifeartaigh (Dublin Institute for Advanced Studies), S. Sen (Trinity
  College, Dublin) R.D. Sorkin (Syracuse University)","Morse Theory and the Topology of Configuration Space",,"Int.J.Mod.Phys. A11 (1996) 823-844","10.1142/S0217751X96000377",,"hep-th",,"  The first and second homology groups are computed for configuration spaces of
framed three-dimensional point particles with annihilation included, when up to
two particles and an antiparticle are present.
","[{""version"":""v1"",""created"":""Sun, 12 Nov 1995 21:32:12 GMT""},{""version"":""v2"",""created"":""Mon, 18 Dec 1995 22:02:52 GMT""},{""version"":""v3"",""created"":""Tue, 19 Dec 1995 18:43:36 GMT""}]","2009-10-28"
"hep-th/9511079","Paul Townsend","E. Bergshoeff, M.B. Green, G. Papadopoulos and P.K. Townsend","The IIA super-eightbrane","Phyzxx. 16 pp",,,"R/95/55 and UG-12/95","hep-th",,"  We present a version of ten-dimensional IIA supergravity containing a 9-form
potential for which the field equations are equivalent to those of the
standard, massless, IIA theory for vanishing 10-form field strength, $F_{10}$,
and to those of the `massive' IIA theory for non-vanishing $F_{10}$. We exhibit
a multi 8-brane solution of this theory which preserves half the supersymmetry.
We propose this solution as the effective field theory realization of the
Dirichlet 8-brane of type IIA superstring theory.
","[{""version"":""v1"",""created"":""Sun, 12 Nov 1995 21:51:36 GMT""}]","2007-05-23"
"hep-th/9511080","M. B. Green","Gary W. Gibbons, Michael B. Green and Malcolm J. Perry","Instantons and seven-branes in type IIB superstring theory","PHYZZX macros. 13 pages. Final version as it will appear in Phys.
  Lett. B (typos corrected)","Phys.Lett.B370:37-44,1996","10.1016/0370-2693(95)01565-5","DAMTP/R95-56","hep-th",,"  Instanton and seven-brane solutions of type IIB supergravity carrying charges
in the Ramond-Ramond sector are constructed. The singular seven-brane has a
quantized \RR \ \lq magnetic' charge whereas its dual is the instanton, which
is non-singular in the string frame and has an associated {\it global} \lq
electric' charge. The product of these charges is constrained by a Dirac
quantization condition. The instanton has the form of a space-time wormhole in
the string frame, and is responsible for the non-conservation of the Noether
current.
","[{""version"":""v1"",""created"":""Mon, 13 Nov 1995 00:37:00 GMT""},{""version"":""v2"",""created"":""Sun, 19 Nov 1995 17:57:25 GMT""},{""version"":""v3"",""created"":""Mon, 15 Jan 1996 14:05:53 GMT""}]","2009-10-07"
"hep-th/9511081","Armen Nersessian","A. Nersessian","Antibrackets and non-Abelian equivariant cohomology","6 pages","Mod.Phys.Lett. A10 (1995) 3043-3050","10.1142/S0217732395003173",,"hep-th",,"  The Weil algebra of a semisimple Lie group and an exterior algebra of a
symplectic manifold possess antibrackets. They are applied to formulate the
models of non--abelian equivariant cohomologies.
","[{""version"":""v1"",""created"":""Mon, 13 Nov 1995 14:34:10 GMT""}]","2015-06-26"
"hep-th/9511082","Kim Sang Pyo","Sang Pyo Kim (Department of Physics, Kunsan National University,
  Kunsan, Korea)","Nonequilibrium Quantum Scalar Fields in Cosmology","10 pages of Latex file to appear in the Proceedings of the Fourth
  International Workshop on Thermal Field Theories and Their Applications,
  Dalian China, 1995",,,"KNU-TH31","hep-th",,"  We elaborate further the functional Schr\""{o}dinger-picture approach to the
quantum field in curved spacetimes using the generalized invariant method and
construct explicitly the Fock space, which we relate with the thermal field
theory. We apply the method to a free massive scalar field in the de Sitter
spacetime, and find the exact quantum states, construct the Fock space, and
evaluate the two-point function and correlation function.
","[{""version"":""v1"",""created"":""Mon, 13 Nov 1995 07:49:17 GMT""}]","2007-05-23"
"hep-th/9511083",,"Robert J. Budzynski (Institute of Theoretical Physics, Warsaw
  University)","Remarks on tree-level topological string theories","LaTeX2e, 8 pages","Acta Phys.Polon. B28 (1997) 2027-2037",,"IFT/19/95","hep-th",,"  A few observations concerning topological string theories at the string-tree
level are presented: (1) The tree-level, large phase space solution of an
arbitrary model is expressed in terms of a variational problem, with an
``action'' equal, at the solution, to the one-point function of the puncture
operator, and found by solving equations of Gauss-Manin type; (2) For $A_k$
Landau-Ginzburg models, an extension to large phase space of the usual residue
formula for three-point functions is given.
","[{""version"":""v1"",""created"":""Mon, 13 Nov 1995 10:25:57 GMT""}]","2007-05-23"
"hep-th/9511085","Joachim Maeder","J. Maeder and W. Ruehl","Greensite-Halpern stabilization of $A_k$ singularities in the $N \to
  \infty$ limit","LaTeX, 9 pages, no figures",,,"KL-TH 95/24","hep-th",,"  The Greensite-Halpern method of stabilizing bottomless Euclidean actions is
applied to zerodimensional O(N) sigma models with unstable $A_k$ singularities
in the $N = \infty$ limit.
","[{""version"":""v1"",""created"":""Mon, 13 Nov 1995 13:29:09 GMT""},{""version"":""v2"",""created"":""Mon, 13 Nov 1995 14:59:06 GMT""},{""version"":""v3"",""created"":""Thu, 16 Nov 1995 10:05:00 GMT""}]","2008-02-03"
"hep-th/9511086",,"Fabio Zwirner (CERN-TH and INFN,Padua)","Supersymmetry and gauge symmetry breaking with naturally vanishing
  vacuum energy","plain LATEX, no figures, 11 pages",,,"CERN-TH/95-292","hep-th",,"  We review the construction of $N=1$ supergravity models where the Higgs and
super-Higgs effects are simultaneously realized, with naturally vanishing
classical vacuum energy and goldstino components along gauge-non-singlet
directions: this situation is likely to occur in the effective theories of
realistic string models. (Invited talk presented at SUSY--95, Palaiseau,
France, 15--19 May 1995)
","[{""version"":""v1"",""created"":""Mon, 13 Nov 1995 15:51:40 GMT""}]","2007-05-23"
"hep-th/9511091",,"Ashok Das and Shibaji Roy","The Zero Curvature Formulation of TB, sTB Hierarchy and Topological
  Algebras","15 pages, plain Latex, no figures","Mod.Phys.Lett. A11 (1996) 1317-1330","10.1142/S0217732396001326","UR-1445, US-FT-28/95","hep-th",,"  A particular dispersive generalization of long water wave equation in $1+1$
dimensions, which is important in the study of matrix models without scaling
limit, known as two--Boson (TB) equation, as well as the associated hierarchy
has been derived from the zero curvature condition on the gauge group
$SL(2,R)\otimes U(1)$. The supersymmetric extension of the two--Boson (sTB)
hierarchy has similarly been derived from the zero curvature condition
associated with the gauge supergroup $OSp(2|2)$. Topological algebras arise
naturally as the second Hamiltonian structure of these classical integrable
systems, indicating a close relationship of these models with 2d topological
field theories.
","[{""version"":""v1"",""created"":""Mon, 13 Nov 1995 10:52:12 GMT""}]","2015-06-26"
"math/9511209",,"T. Y. Lam, K. H. Leung","On vanishing sums for roots of unity",,,,"MSRI 1995-082","math.NT",,"  Consider the $m$-th roots of unity in {\bf C}, where $m>0$ is an integer. We
address the following question: For what values of $n$ can one find $n$ such
$m$-th roots of unity (with repetitions allowed) adding up to zero? We prove
that the answer is exactly the set of linear combinations with non-negative
integer coefficients of the prime factors of $m$.
","[{""version"":""v1"",""created"":""Mon, 13 Nov 1995 00:00:00 GMT""}]","2008-02-03"
"math/9511210",,"Carroll Guillory","Douglas Algebras That Have No Maximal Subalgebra and No Minimal
  Superalgebra",,,,"MSRI 1995-083","math.CV math.OA",,"  We give several examples of Douglas Algebras that do not have any maximal
subalgebra. We find a condition on these algebras that guarantees that some do
not have any minimal superalgebra. We also show that if $A$ is the only maximal
subalgebra of a Douglas algebra $B$, then the algebra $A$ does not have any
maximal subalgebra.
","[{""version"":""v1"",""created"":""Mon, 13 Nov 1995 00:00:00 GMT""}]","2016-09-06"
"nucl-th/9511015","Christine Sauermann","C. Sauermann, B.L. Friman and W. N\""orenberg","Photoproduction of $\eta$-mesons off protons and deuterons","5 latex pages, 3 postscript figures uuencoded A shorter version will
  be published in proceedings of the Sixth International Symposium on
  Meson-Nucleon-Physics and the Structure of the Nucleon, Blaubeuren,
  Germany,10-14 July 1995","PiN Newslett.10:147-149,1995",,,"nucl-th hep-ph",,"  An effective field theory with hadrons and photons is constructed, where the
hadronic parameters are determined by fitting elastic $\pi$N scattering data.
The predicted pion-induced $\eta$-production on the nucleon agrees well with
the data. The hadronic model is then used to describe the final-state
interaction in photoinduced processes. We present a consistent description of
pion photoproduction in the E$_0^+$-channel and of the total cross sections for
photoinduced $\eta$-production on the proton as well as on the deuteron.
","[{""version"":""v1"",""created"":""Mon, 13 Nov 1995 06:53:10 GMT""}]","2011-04-15"
"quant-ph/9511013","Kim Sang Pyo","Jung Kon Kim, Sang Pyo Kim (Department of Physics, Kunsan National
  University, Korea)","Group Theoretical Approach to the Coherent and the Squeeze States of a
  Time-Dependent Harmonic Oscillator with a Singular Term","22 pages of Latex file","J.Korean Phys.Soc. 28 (1995) 7",,,"quant-ph",,"  For a time-dependent harmonic oscillator with an inverse squared singular
term, we find the generalized invariant using the Lie algebra of $SU(2)$ and
construct the number-type eigenstates and the coherent states using the
spectrum-generating Lie algebra of $SU(1,1)$. We obtain the evolution operator
in both of the Lie algebras. The number-type eigenstates and the coherent
states are constructed group-theoretically for both the time-independent and
the time-dependent harmonic oscillators with the singular term. It is shown
that the squeeze operator transforms unitarily the time-dependent basis of the
spectrum-generating Lie algebra of $SU(1,1)$ for the generalized invariant, and
thereby evolves the initial vacuum into a final coherent vacuum.
","[{""version"":""v1"",""created"":""Mon, 13 Nov 1995 07:13:13 GMT""}]","2007-05-23"
"quant-ph/9511014","Arlen Anderson","Arlen Anderson","Coupling ``Classical'' and Quantum Variables","Latex, 16 pp. This is a contribution to the proceedings of the 4th
  Drexel Symposium on Quantum Nonintegrability, Drexel University, Sep. 1994",,,"UNC-IFP 95-514","quant-ph gr-qc",,"  Experimentally, certain degrees of freedom may appear classical because their
quantum fluctuations are smaller than the experimental error associated with
measuring them. An approximation to a fully quantum theory is described in
which the self-interference of such ``quasiclassical'' variables is neglected
so that they behave classically when not coupled to other quantum variables.
Coupling to quantum variables can lead to evolution in which quasiclassical
variables do not have definite values, but values which are correlated to the
state of the quantum variables. A mathematical description implementing this
backreaction of the quantum variables on the quasiclassical variables is
critically discussed.
","[{""version"":""v1"",""created"":""Mon, 13 Nov 1995 13:04:49 GMT""}]","2007-05-23"
