"alg-geom/9511007","Victor Ginzburg","Victor Ginzburg","Perverse sheaves on a Loop group and Langlands' duality","89 pages, several LaTeX errors fixed",,,,"alg-geom hep-th math.AG math.QA q-alg",,"  An intrinsic construction of the tensor category of finite dimensional
representations of the Langlands dual group of G in terms of a tensor category
of perverse sheaves on the loop group, LG, is given. The construction is
applied to the study of the topology of the affine Grassmannian of G and to
establishing a Langlands type correspondence for ""automorphic"" sheaves on the
moduli space of G-bundles.
","[{""version"":""v1"",""created"":""Mon, 13 Nov 1995 23:09:20 GMT""},{""version"":""v2"",""created"":""Mon, 27 Nov 1995 17:33:58 GMT""},{""version"":""v3"",""created"":""Fri, 5 Apr 1996 13:20:31 GMT""},{""version"":""v4"",""created"":""Mon, 20 Nov 2000 00:19:31 GMT""}]","2008-02-03"
"astro-ph/9511054","Fred Rasio","Frederic A. Rasio (MIT), Mario Livio (STScI)","On the Formation and Evolution of Common Envelope Systems","uses AAS latex macros v4, 36 pages with figures, submitted to ApJ,
  complete postscript also available at http://ensor.mit.edu/~rasio/papers",,"10.1086/177975",,"astro-ph",,"  We discuss the formation of a common envelope system following dynamically
unstable mass transfer in a close binary, and the subsequent dynamical
evolution and final fate of the envelope. We base our discussion on new
three-dimensional SPH calculations that we have performed for a close binary
system containing a $4\,M_\odot$ red giant with a $0.7\,M_\odot$ main-sequence
star companion. The initial parameters are chosen to model the formation of a
system resembling V~471~Tau, a typical progenitor of a cataclysmic variable
binary. In our highest-resolution calculation, we find evidence for a
corotating region of gas around the central binary. This is in agreement with
the theoretical model proposed by Meyer \& Meyer-Hofmeister (1979) for the
evolution of common envelope systems, in which this central corotating region
is coupled to the envelope through viscous angular momentum transport only. We
also find evidence that the envelope is convectively unstable, in which case
the viscous dissipation time could be as short as $\sim100$ dynamical times,
leading to rapid ejection of the envelope. For V~471~Tau, our results, and the
observed parameters of the system, are entirely consistent with rapid envelope
ejection on a timescale $\sim1\,$yr and an efficiency parameter
$\alpha_{CE}\simeq1$.
","[{""version"":""v1"",""created"":""Mon, 13 Nov 1995 16:43:03 GMT""}]","2009-10-28"
"astro-ph/9511055","Juan I. Collar","J. I. Collar (Univ. of South Carolina)","Comments on ""Limits on Dark Matter Using Ancient Mica""","Compressed PostScript (filename.ps.Z), 3 pages, no figures","Phys.Rev.Lett.76:331,1996","10.1103/PhysRevLett.76.331","JICUSC-95-7","astro-ph hep-ph",,"  To appear in Phys. Rev. Lett. together with the author's Reply.
","[{""version"":""v1"",""created"":""Mon, 13 Nov 1995 19:20:04 GMT""}]","2008-11-26"
"astro-ph/9511056","Rennan Bar-Kana","Rennan Bar-Kana (Physics Dept., MIT, Cambridge, MA)","Effect of Large-Scale Structure on Multiply Imaged Sources","Latex, 20 pages, 3 PostScript figures, to appear in ApJ Sept. 10,
  1996, substantially revised","Astrophys.J. 468 (1996) 17","10.1086/177666",,"astro-ph",,"  We study the effects of large-scale density fluctuations on strong
gravitational lensing. Previous studies have focused mostly on weak lensing,
since large-scale structure alone cannot produce multiple images. When a galaxy
or cluster acts as a primary lens, however, we find that large-scale structure
can produce asymmetric shear of the same order as the lens itself. Indeed, this
may explain the origin of the large shear found in lens models in conflict with
the small ellipticity of the observed galaxy light distributions. We show that
large-scale structure changes the lens equation to the form of a generalized
quadrupole lens, which affects lens reconstruction. Large-scale structure also
changes the angular diameter distance at a given redshift. The precise value
depends on the lens and source redshifts and on the large-scale structure power
spectrum, but the induced $1\sigma$ uncertainty in determinations of the Hubble
constant from measurements of time delays is of order $5-10 \%$. If
observations of lensing can constrain the magnitude of the shear which is due
to large-scale structure, it would provide a direct probe of the overall
amplitude of mass fluctuations.
","[{""version"":""v1"",""created"":""Mon, 13 Nov 1995 21:23:26 GMT""},{""version"":""v2"",""created"":""Mon, 1 Apr 1996 04:40:08 GMT""}]","2009-10-28"
"astro-ph/9511058",,"Richard G Bower (Univ. Durham, UK)","The Influence of Environmental Effects on Galaxy Formation","14 pages + 2 figures (uuencoded, gzipped postscript) To appear in the
  Dahlem Conference Proceedings 'The Evolution of the Universe'",,,,"astro-ph",,"  These notes collect together current work on the effect of the environment on
galaxy formation and evolution. They are broken into four distinct parts. The
first deals with the observational debate surrounding the question of whether
galaxies are initially created the same and have only recently been modified by
their environment, or whether galaxy formation itself is strongly perturbed by
the local neighbourhood. The second section deals with observations of distant
galaxy clusters. These provide direct evidence that some galaxies, at least,
have changed substantially over the last 5~Gyr. The third and fourth parts look
at theoretical work on this theme. They study models for the origin of the
density--morphology relation, and the impact of environmentally modulated
galaxy formation on the large-scale structure of the universe.
","[{""version"":""v1"",""created"":""Tue, 14 Nov 1995 10:06:58 GMT""}]","2007-05-23"
"astro-ph/9511059","Chris Reynolds","R.R. Ross and A.C. Fabian","The spectra of accretion discs in low-mass X-ray binaries","6 pages (including figures) uuencoded compressed postscript file.
  Submitted for publication in Monthly Notices of the Royal Astronomical
  Society",,"10.1093/mnras/281.2.637",,"astro-ph",,"  We present self-consistent models for the radiative transfer in
Shakura-Sunyaev accretion discs in bright low-mass X-ray binaries (LMXB). Our
calculations include the full effects of incoherent Compton scattering and the
vertical temperature structure within the disc, as well as the effects of
Doppler blurring and gravitational redshift. We find that the observed X-ray
spectra are well fit by exponentially cutoff power-law models. The difference
between the observed total spectrum and our calculated disc spectrum should
reveal the spectrum of the disc/neutron star boundary layer and other emitting
regions considered to be present in LMXB.
","[{""version"":""v1"",""created"":""Tue, 14 Nov 1995 12:42:58 GMT""}]","2015-06-24"
"astro-ph/9511060","Chris Reynolds","A.C. Fabian and R. Terlevich","X-ray detection of SN1988Z with the ROSAT HRI","4 pages (including figures) uuencoded compressed postscript file.
  Submitted for publication in Monthly Notices of the Royal Astronomical
  Society",,,,"astro-ph",,"  We report the detection of SN1988Z in X-rays with the ROSAT High Resolution
Imager. The inferred X-ray luminosity of about $10^{41}\ergps$ can be well
explained by assuming that the supernova occurred in a dense circumstellar
medium, consistent with optical observations. SN1988Z is the most distant
supernova yet detected in X-rays.
","[{""version"":""v1"",""created"":""Tue, 14 Nov 1995 12:57:30 GMT""}]","2007-05-23"
"atom-ph/9511001",,"R. Barbier and M. Kibler","On the Use of Quantum Algebras in Rotation-Vibration Spectroscopy","10 pages, Latex File, published in Modern Group Theoretical Methods
  in Physics, J. Bertrand et al. (eds.), Kluwer Academic Publishers (1995),
  27-36",,,"LYCEN 9521","atom-ph chem-ph math.QA nucl-th physics.atom-ph q-alg",,"  A two-parameter deformation of the Lie algebra u$_2$ is used, in conjunction
with the rotor system and the oscillator system, to generate a model for
rotation-vibration spectroscopy of molecules and nuclei.
","[{""version"":""v1"",""created"":""Mon, 13 Nov 1995 16:44:13 GMT""}]","2008-02-03"
"cond-mat/9511059","Karol Kalna","K. Kalna, M. Mosko, and F. M. Peeters","Electron capture in GaAs quantum wells via electron-electron and optic
  phonon scattering","5 pages, standard LaTeX file + 5 PostScript figures (tarred,
  compressed and uuencoded) or by request from elekarol@savba.savba.sk,
  accepted to Appl. Phys. Lett",,"10.1063/1.116207",,"cond-mat",,"  Electron capture times in a separate confinement quantum well (QW) structure
with finite electron density are calculated for electron-electron (e-e) and
electron-polar optic phonon (e-pop) scattering. We find that the capture time
oscillates as function of the QW width for both processes with the same period,
but with very different amplitudes. For an electron density of 10^11 cm^-2 the
e-e capture time is 10-1000 times larger than the e-pop capture time except for
QW widths near the resonance minima, where it is only 2-3 times larger. With
increasing electron density the e-e capture time decreases and near the
resonance becomes smaller than the e-pop capture time. Our e-e capture time
values are two-to-three orders of magnitude larger than previous results of
Blom et al. [Appl. Phys. Lett. 62, 1490 (1993)]. The role of the e-e capture in
QW lasers is therefore readdressed.
","[{""version"":""v1"",""created"":""Mon, 13 Nov 1995 16:16:51 GMT""},{""version"":""v2"",""created"":""Wed, 15 Nov 1995 08:24:39 GMT""}]","2009-10-28"
"cond-mat/9511060","Marcus Kollar","Marcus Kollar, Rainer Strack and Dieter~Vollhardt","Ferromagnetism in Correlated Electron Systems: Generalization of
  Nagaoka's Theorem","13 pages, uuencoded postscript, includes 1 table and 2 figures",,"10.1103/PhysRevB.53.9225","RWTH/ITP-C 3/95","cond-mat",,"  Nagaoka's theorem on ferromagnetism in the Hubbard model with one electron
less than half filling is generalized to the case where all possible
nearest-neighbor Coulomb interactions (the density-density interaction $V$,
bond-charge interaction $X$, exchange interaction $F$, and hopping of double
occupancies $F'$) are included. It is shown that for ferromagnetic exchange
coupling ($F>0$) ground states with maximum spin are stable already at finite
Hubbard interaction $U>U_c$. For non-bipartite lattices this requires a hopping
amplitude $t\leq0$. For vanishing $F$ one obtains $U_c\to\infty$ as in
Nagaoka's theorem. This shows that the exchange interaction $F$ is important
for stabilizing ferromagnetism at finite $U$. Only in the special case $X=t$
the ferromagnetic state is stable even for $F=0$, provided the lattice allows
the hole to move around loops.
","[{""version"":""v1"",""created"":""Mon, 13 Nov 1995 17:16:40 GMT""}]","2009-10-28"
"cond-mat/9511061","Ian McDonald","I. A. McDonald and F. D. M. Haldane","Topological Phase Transition in the $\nu=2/3$ Quantum Hall Effect","11 pages, REVTEX v3.0, 7 figures",,"10.1103/PhysRevB.53.15845",,"cond-mat",,"  The double layer $\nu=2/3$ fractional quantum Hall system is studied using
the edge state formalism and finite-size diagonalization subject to periodic
boundary conditions. Transitions between three different ground states are
observed as the separation as well as the tunneling between the two layers is
varied. Experimental consequences are discussed.
","[{""version"":""v1"",""created"":""Tue, 14 Nov 1995 03:13:56 GMT""}]","2009-10-28"
"cond-mat/9511062","Mats Jonson","A. Kadigrobov, R. Shekhter, and M. Jonson","Excess Resistance Effect in a Normal Metal Contacting a Superconductor","3 pages, 2 postscript figures all in uuencoded format","Physica B218, 134 (1996)","10.1016/0921-4526(95)00577-3","APR 95-41","cond-mat",,"  In relatively pure normal samples contacting a superconductor we consider the
excess resistance effect (that is a decrease of the total electrical resistance
of the sample after transition of the superconducting part into the normal
state) and determine conditions under which the effect arises.
","[{""version"":""v1"",""created"":""Tue, 14 Nov 1995 10:55:29 GMT""}]","2009-10-28"
"cond-mat/9511063",,"Fabio Bagarello","Applications of Wavelets to Quantum Mechanics: a Pedagogical Example","23 pages, Latex file, Accepted by Journal of Physics A",,"10.1088/0305-4470/29/3/011",,"cond-mat",,"  We discuss in many details two quantum mechanical models of planar electrons
which are very much related to the Fractional Quantum Hall Effect. In
particular, we discuss the localization properties of the trial ground states
of the models starting from considerations on the numerical results on the
energy. We conclude that wavelet theory can be conveniently used in the
description of the system. Finally we suggest applications of our results to
the Fractional Quantum Hall Effect.
","[{""version"":""v1"",""created"":""Tue, 14 Nov 1995 12:46:01 GMT""}]","2009-10-28"
"cond-mat/9511064","Thomas Obermeier","Thomas Obermeier, Thomas Pruschke, Joachim Keller","Properties of the t-J Model in the Dynamical Mean Field Theory:
  One-Particle Properties in the Antiferromagnetic Phase","15 pages, LaTeX, 6 uuencoded postscript figures, submitted for
  publication in Annalen der Physik",,,,"cond-mat",,"  We study the one-particle properties of the t-J model within the framework of
Vollhardt's dynamical mean field theory. By introducing an AB - sublattice
structure we explicitely allow for a broken symmetry for the spin degrees of
freedom and are thus able to calculate the one-particle spectral function in
the antiferromagnetic phase. We observe surprisingly rich structures in the
one-particle density of states for T<T_N at finite doping up to 15\%. These
structures can be related to the well known results for one single hole in the
N\'eel background. We are thus able to establish the relevance of this at a
first sight academic limit to physical properties of the t-J model with a
finite density of holes in the thermodynamical limit.
","[{""version"":""v1"",""created"":""Tue, 14 Nov 1995 13:28:52 GMT""}]","2007-05-23"
"cond-mat/9511065","Mauro S. Ferreira","M. S. Ferreira, J. d'Albuquerque e Castro, D. M. Edwards and J. Mathon","Non-RKKY oscillations of exchange coupling in magnetic multilayers","14 pages, REVTEX, including 4 figures",,,,"cond-mat",,"  It is shown how the exchange coupling between two ferromagnetic planes
embedded in an infinite non-magnetic metal, regarded as a function of the
distance between the planes, may contain important components which oscillate
with periods not predicted by RKKY theory. The interesting case of a FCC(110)
structure with a Cu-like Fermi surface is discussed in detail.
","[{""version"":""v1"",""created"":""Tue, 14 Nov 1995 14:34:46 GMT""}]","2007-05-23"
"gr-qc/9511039","Zoltan Perjes","Z. Perj\'es (KFKI Research Institute for Particle and Nuclear Physics,
  Hungary), A. Kom\'arik (E\""otv\""os University, Hungary)","Perturbations of a Universe Filled with Dust and Radiation","9 pp, typeset in latex","Int.J.Theor.Phys. 34 (1995) 2275-2284","10.1007/BF00673842",,"gr-qc",,"  A first-order perturbation approach to $k=0$ Friedmann cosmologies filled
with dust and radiation is developed. Adopting the coordinate gauge comoving
with the perturbed matter, and neglecting the vorticity of the radiation, a
pair of coupled equations is obtained for the trace $h$ of the metric
perturbations and for the velocity potential $v$. A power series solution with
upwards cutoff exists such that the leading terms for large values of the
dimensionless time $\xi$ agree with the relatively growing terms of the dust
solution of Sachs and Wolfe.
","[{""version"":""v1"",""created"":""Mon, 13 Nov 1995 16:20:00 GMT""}]","2009-10-28"
"gr-qc/9511040",,"G. Giachetta and G.Sardanashvily","Stress-Energy-Momentum Tensors in Lagrangian Field Theory. Part 2.
  Gravitational Superpotential","25 pp, LaTeX file",,,"MPH/CAM/108/95","gr-qc hep-th",,"  Our investigation of differential conservation laws in Lagrangian field
theory is based on the first variational formula which provides the canonical
decomposition of the Lie derivative of a Lagrangian density by a projectable
vector field on a bundle (Part 1: gr-qc/9510061). If a Lagrangian density is
invariant under a certain class of bundle isomorphisms, its Lie derivative by
the associated vector fields vanishes and the corresponding differential
conservation laws take place. If these vector fields depend on derivatives of
parameters of bundle transformations, the conserved current reduces to a
superpotential. This Part of the work is devoted to gravitational
superpotentials. The invariance of a gravitational Lagrangian density under
general covariant transformations leads to the stress-energy-momentum
conservation law where the energy-momentum flow of gravity reduces to the
corresponding generalized Komar superpotential. The associated energy-momentum
(pseudo) tensor can be defined and calculated on solutions of metric and
affine-metric gravitational models.
","[{""version"":""v1"",""created"":""Tue, 14 Nov 1995 10:26:18 GMT""}]","2007-05-23"
"gr-qc/9511042","Jorge Pullin","Rodolfo Gambini, Jorge Pullin","A rigorous solution of the quantum Einstein equations","4 pages, Revtex, four figures included with epsf","Phys.Rev.D54:5935-5938,1996","10.1103/PhysRevD.54.5935","CGPG-95/11-2","gr-qc hep-lat hep-th math.QA q-alg",,"  We show that the second coefficient of the Conway knot polynomial is
annihilated by the Hamiltonian constraint of canonically quantized general
relativity in the loop representation. The calculations are carried out in a
fully regularized lattice framework. Crucial to the calculation is the explicit
form of the skein relations of the second coefficient, which relate it to the
Gauss linking number. Contrary to the lengthy formal continuum calculation, the
rigorous lattice version can be summarized in a few pictures.
","[{""version"":""v1"",""created"":""Tue, 14 Nov 1995 15:11:25 GMT""}]","2009-12-30"
"hep-ph/9511305",,"R. Barbieri, A. Romanino and A. Strumia","Electric dipole moments as signals of supersymmetric unification","6 pages with all figures included","Phys.Lett.B369:283-288,1996","10.1016/0370-2693(95)01531-0","IFUP -- TH 65/95","hep-ph",,"  If supersymmetric unification is true, we show how the combined effort of
several experiments under way to try to measure an electric dipole moment of
the electron or of the neutron has a significant chance not only of producing a
positive signal but also of providing crucial information to understand the
physical origin of the signal itself.
","[{""version"":""v1"",""created"":""Mon, 13 Nov 1995 18:30:31 GMT""}]","2009-10-09"
"hep-ph/9511306","Alexander Belyaev","A. Belyaev, E. Boos L. Dudko, A. Pukhov (Institute of Nuclear Physics,
  Moscow State University)","W+2jets production at Tevatron -- VECBOS and CompHEP comparison","8 pages including 4 figures as a gzipped postscript file",,,"D0 Note 2784, November 13, 1995","hep-ph",,"  Results of calculation of all subprocesses in proton-antiproton collisions
which contribute to the W+2jets final state are presented at Tevatron energy.
The calculation has been carried out by means of the CompHEP software package.
A detail comparison with VECBOS generator results for cross sections and
various distributions shows an agreement at the level of Monte-Carlo accuracy.
Therefore the additional independent check of VECBOS generator has been done.
In complement to the VECBOS generator a new generator based on CompHEP allows
to study individual subprocesses like $Wb\bar{b}$ or $Wc\bar{c}$. The last
point is important, for instance, for study $Wb\bar{b}$ part of the background
for single top or Standard Model Higgs signal at Tevatron.
","[{""version"":""v1"",""created"":""Tue, 14 Nov 1995 00:40:16 GMT""},{""version"":""v2"",""created"":""Thu, 16 Nov 1995 02:43:40 GMT""}]","2008-02-03"
"hep-ph/9511307",,"Rulin Xiu","The Derivation of $M_{GUT}=10^{16}GeV$ from A String Model","9 pages",,,"HUTP-95/A040","hep-ph",,"  We propose that gaugino condensation in the hidden sector may dynamically
induce intermediate gauge symmetry breaking and specify the compactification
scale. We also show that this scheme makes possible affine level one grand
unified string models with gauge breaking scale $M_{\rm GUT} \sim 10^{16}$ GeV.
$T$-duality plays a crucial role in making this scheme possible, even though it
is spontaneously broken. We also discuss the generation of the large mass
hierarchy between the string scale and the electroweak scale and the solution
of the dilaton runaway problem in this scheme.
","[{""version"":""v1"",""created"":""Mon, 13 Nov 1995 18:53:28 GMT""}]","2007-05-23"
"hep-ph/9511308",,"A. Ballestrero, V.A. Khoze, E. Maina, S. Moretti and W.J. Stirling","$e^+e^- \to b\bar b W^+W^-$ events at the Next Linear Collider: colour
  structure of top signal and irreducible background","14 pages, Latex, 8 figures uuencoded, complete ps file available via
  anonymous ftp at:
  ftp://axpc.hep.phy.cam.ac.uk/disk$alpha1:[public.hep9514]CAVENDISH_9514.ps
  http://www.hep.phy.cam.ac.uk/theory/papers/index.html","Z.Phys. C72 (1996) 71-78","10.1007/s002880050224","DFTT 03/95, DTP/95/08, Cavendish-HEP-95/14","hep-ph",,"  We examine the colour structure and charged particle yield for both the $t
\bar t$ signal and the irreducible background processes contributing to
\eebbww\ production close to the \ttb\ threshold. The charged particle
multiplicity for the various components of the cross section is computed as a
function of several kinematic variables. Our study may have important
implications for recently proposed studies of interconnection phenomena in
\ttb\ production at high--energy $e^+e^-$ colliders
","[{""version"":""v1"",""created"":""Mon, 13 Nov 1995 17:47:07 GMT""},{""version"":""v2"",""created"":""Tue, 14 Nov 1995 12:05:15 GMT""}]","2015-06-25"
"hep-ph/9511309","David Brahm","David E. Brahm, James Walden (CMU)","Large-N_c Relations Among Isgur-Wise Functions","6 pages, LaTeX, 3 figures using epsf.tex. More detailed analysis, but
  the result is unchanged","Mod.Phys.Lett. A12 (1997) 357-362","10.1142/S0217732397000364","CMU-HEP95-21","hep-ph nucl-th",,"  We investigate the relations that must hold among baryonic Isgur-Wise
functions $\eta_i$ in the large-N_c limit from unitarity constraints, and
compare to those found by Chow using the Skyrme model [or SU(4)]. Given the
exponential dropoff of the $\eta_i$ away from threshold, unitarity requires
only that the usual normalization conditions hold at w=1, and that
$\eta=\eta_1$ near threshold. Our results are consistent with, but less
powerful than, the Skyrme model relations.
","[{""version"":""v1"",""created"":""Mon, 13 Nov 1995 23:09:31 GMT""},{""version"":""v2"",""created"":""Fri, 22 Mar 1996 02:55:36 GMT""}]","2009-10-28"
"hep-ph/9511310",,"K.Melnikov","Two-loop $O(N_f\alpha _s^2)$ correction to the decay width of the Higgs
  boson to two massive fermions","Latex, 18 pages, 4 uuencoded figures, some misprints in formulas are
  corrected","Phys.Rev. D53 (1996) 5020-5027","10.1103/PhysRevD.53.5020","MZ-TH-95-30","hep-ph",,"  We present an analytical calculation of additional real or virtual radiation
of the light fermion pair in the fermionic decay of the Higgs boson $ H \to
f_1\bar f_1$ for arbitrary ratios of the Higgs boson mass to the $f_1$ fermion
mass.
  This result gives us a value of the $O(N_f \alpha _s^2)$ radiative correction
to the inclusive decay rate $ H \to f_1\bar f_1$. Using this result in the
framework of the Brodsky-Mackenzie-Lepage scheme, we discuss the scale setting
in the one-loop QCD correction to the decay width $ H \to f_1\bar f_1$ for
arbitrary relation between the Higgs boson and fermion masses.
","[{""version"":""v1"",""created"":""Mon, 13 Nov 1995 16:44:11 GMT""},{""version"":""v2"",""created"":""Sun, 10 Dec 1995 14:59:28 GMT""}]","2009-10-28"
"hep-ph/9511311","Fredrick Olness","Ruibin Meng, Fredrick I. Olness, Davison E. Soper","Semi-Inclusive Deeply Inelastic Scattering at Small q_T","RevTeX format, 32 pages, 15 uuencoded figures with epsf.tex","Phys.Rev.D54:1919-1935,1996","10.1103/PhysRevD.54.1919","CTEQ-409","hep-ph",,"  Measurement of the distribution of hadronic energy in the final state in
deeply inelastic electron scattering at HERA can provide a good test of our
understanding of perturbative QCD. For this purpose, we consider the energy
distribution function, which can be computed without needing final state parton
fragmentation functions. We compute this distribution function for finite
transverse momentum q_T at order alpha_s, and use the results to sum the
perturbation series to obtain a result valid for both large and small values of
transverse momentum.
","[{""version"":""v1"",""created"":""Tue, 14 Nov 1995 04:08:49 GMT""}]","2014-11-17"
