"hep-ph/9511417",,"S. Esposito (1) and G. Capone (2) ((1) I.N.F.N. Sezione di Napoli, (2)
  Univ. Inst. Antwerpen, Dept. Natuurkunde)","Neutrino propagation in a medium with a magnetic field","21 pages, Latex, 7 figures available upon request (4 of which
  available as Postscript files); to be published in Zeitschrift fur Physik C","Z.Phys.C70:55-64,1996","10.1007/s002880050080","INFN-NA-IV$-95/28","hep-ph astro-ph",,"  We study the properties of neutrinos propagating in an isotropic magnetized
medium in the two physical approximations of degenerate Fermi gas and classical
plasma. The dispersion relation shows that, for peculiar configurations of the
magnetic field, neutrinos can propagate freely as in vacuum, also for very
large density; this result can be very important in the study of supernova
evolution. For mixed neutrinos, the presence of a magnetic field can alter
significatively MSW oscillations, and for particular configurations of the
field the resonance condition no longer occurs. Furthermore, on the contrary to
that happens in non-magnetized media, spatial dispersion arises and neutrino
trajectory can be in principle deviated; however a simple estimate shows that
this deviation is not detectable.
","[{""version"":""v1"",""created"":""Mon, 27 Nov 1995 08:01:45 GMT""}]","2009-09-25"
"hep-ph/9511418","Leonid Glozman","L. Ya. Glozman","Baryon Spectrum and Chiral Dynamics","12 pages + 1 fig., LaTeX, fig. is available from author, to appear in
  Proceedings of the Int. School of Nucl. Physics: Quarks in Hadrons and Nuclei
  (Erice, 19-27 September, 1995) - Progr. Part. Nucl. Phys., v. 36 (1996)","Prog.Part.Nucl.Phys.36:275-288,1996","10.1016/0146-6410(96)00031-2","UNIGRAZ-UTP 16-11-95","hep-ph",,"  New results on baryon structure and spectrum developed in collaboration with
Dan Riska [1-4] are reported. The main idea is that beyond the chiral symmetry
spontaneous breaking scale light and strange baryons should be considered as
systems of three constituent quarks with an effective confining interaction and
a chiral interaction that is mediated by the octet of Goldstone bosons
(pseudoscalar mesons) between the constituent quarks.
","[{""version"":""v1"",""created"":""Mon, 27 Nov 1995 12:50:01 GMT""}]","2014-11-17"
"hep-ph/9511420","Piet Mulders","A.M. Kotzinian and P.J. Mulders","Longitudinal quark polarization in transversely polarized nucleons","10 pages RevTeX, 3 Figures","Phys.Rev.D54:1229-1232,1996","10.1103/PhysRevD.54.1229","NIKHEF 95-059, YERPHI-1455(25)-95","hep-ph",,"  Accounting for transverse momenta of the quarks, a longitudinal quark spin
asymmetry exists in a transversely polarized nucleon target. The relevant
leading quark distribution $g_{1T}(x,k_T^2)$ can be measured in the
semi-inclusive deep-inelastic scattering. The average $k_T^2$ weighted
distribution function $g^{(1)}_{1T}$ can be obtained directly from the
inclusive measurement of $g_2$.
","[{""version"":""v1"",""created"":""Mon, 27 Nov 1995 14:34:21 GMT""}]","2014-11-17"
"hep-ph/9511422","Eric S. Swanson","Adam Szczepaniak, Eric S. Swanson, Chueng-Ryong Ji, and Stephen R.
  Cotanch","Glueball Spectroscopy in a Relativistic Many-Body Approach to Hadron
  Structure","12 pages, 1 uuencoded ps figure, RevTex","Phys.Rev.Lett. 76 (1996) 2011-2014","10.1103/PhysRevLett.76.2011",,"hep-ph hep-lat",,"  A comprehensive, relativistic many-body approach to hadron structure is
advanced based on the Coulomb gauge QCD Hamiltonian. Our method incorporates
standard many-body techniques which render the approximations amenable to
systematic improvement. Using BCS variational methods, dynamic chiral symmetry
breaking naturally emerges and both quarks and gluons acquire constituent
masses. Gluonia are studied both in the valence and in the collective, random
phase approximations. Using representative values for the strong coupling
constant and string tension, calculated quenched glueball masses are found to
be in remarkable agreement with lattice gauge theory.
","[{""version"":""v1"",""created"":""Mon, 27 Nov 1995 15:34:32 GMT""}]","2009-10-28"
"hep-th/9511185","Gregory Moore","A. Losev, G. Moore, N. Nekrasov, S. Shatashvili","Central Extensions of Gauge Groups Revisited","7 pages, harvmac. References added",,,"PUPT-1568,ITEP-TH.10/95,YCTP-P18-95","hep-th alg-geom math.AG",,"  We present an explicit construction for the central extension of the group
$\Map(X, G)$ where $X$ is a compact manifold and $G$ is a Lie group. If $X$ is
a complex curve we obtain a simple construction of the extension by the Picard
variety $\Pic(X)$. The construction is easily adapted to the extension of
$\Aut(E)$, the gauge group of automorphisms of a nontrivial vector bundle $E$.
","[{""version"":""v1"",""created"":""Mon, 27 Nov 1995 03:56:08 GMT""},{""version"":""v2"",""created"":""Thu, 21 Dec 1995 04:09:35 GMT""}]","2008-02-03"
"hep-th/9511186","Hiroshi Ishikawa","Hiroshi Ishikawa (YITP, Kyoto Univ.)","On the equivalence of fermionic string to bosonic string in two
  dimensions","13 pages, latex","Phys.Lett. B385 (1996) 117-124","10.1016/0370-2693(96)00850-7","YITP-95-11","hep-th",,"  Two-dimensional fermionic string theory is shown to have a structure of
topological model, which is isomorphic to a tensor product of two topological
ghost systems independent of each other. One of them is identified with $c=1$
bosonic string theory while the other has trivial physical contents. This fact
enables us to regard two-dimensional fermionic string theory as an embedding of
$c=1$ bosonic string theory in the moduli space of fermionic string theories.
Upon this embedding, the discrete states of $c=1$ string theory are mapped to
those of fermionic string theory, which is considered to be the origin of the
similarity between the physical spectra of these two theories. We also discuss
a novel BRST operator associated with this topological structure.
","[{""version"":""v1"",""created"":""Mon, 27 Nov 1995 05:40:17 GMT""}]","2009-10-28"
"hep-th/9511187","Itzhak Bars","Itzhak Bars","Solution of the SL(2,R) string in curved spacetime","LaTeX, 18 pages",,,"USC-95/HEP-B3","hep-th",,"  The SL(2,R) WZW model, one of the simplest models for strings propagating in
curved space time, was believed to be non-unitary in the algebraic treatment
involving affine current algebra. It is shown that this was an error that
resulted from neglecting a zero mode that must be included to describe the
correct physics of non-compact WZW models. In the presence of the zero mode the
mass-shell condition is altered and unitarity is restored. The correct
currents, including the zero mode, have logarithmic cuts on the worldsheet.
This has physical consequences for the spectrum because a combination of zero
modes must be quantized in order to impose periodic boundary conditions on mass
shell in the physical sector. To arrive at these results and to solve the model
completely, the SL(2,R) WZW model is quantized in a free field formalism that
differs from previous ones in that the fields and the currents are Hermitean,
there are cuts, and there is a new term that could be present more generally,
but is excluded in the WZW model.
","[{""version"":""v1"",""created"":""Mon, 27 Nov 1995 09:32:06 GMT""}]","2007-05-23"
"hep-th/9511189","Jose Sande Lemos","Jos\'e P.S. Lemos, Vilson T. Zanchin","The Three-Dimensional BTZ Black Hole as a Cylindrical System in
  Four-Dimensional General Relativity","Latex, 9 pages","Phys.Rev. D53 (1996) 4684-4686","10.1103/PhysRevD.53.4684",,"hep-th gr-qc",,"  It is shown how to transform the three dimensional BTZ black hole into a four
dimensional cylindrical black hole (i.e., black string) in general relativity.
This process is identical to the transformation of a point particle in three
dimensions into a straight cosmic string in four dimensions.
","[{""version"":""v1"",""created"":""Mon, 27 Nov 1995 09:56:27 GMT""}]","2009-10-28"
"hep-th/9511190",,"Miguel A. Martin-Delgado and German Sierra","The Renormalization Group Method and Quantum Groups: the postman always
  rings twice","LATEX file, 21 pages, no figures. To appear in ""From Field Theory to
  Quantum Groups"", World Scientific. Proceedings to honor J.Lukierski in his
  60th birthday",,"10.1142/9789812830425_0007","UCM-CSIC-10-95","hep-th cond-mat math.QA q-alg",,"  We review some of our recent results concerning the relationship between the
Real-Space Renormalization Group method and Quantum Groups. We show this
relation by applying real-space RG methods to study two quantum group invariant
Hamiltonians, that of the XXZ model and the Ising model in a transverse field
(ITF) defined in an open chain with appropriate boundary terms. The quantum
group symmetry is preserved under the RG transformation except for the
appearence of a quantum group anomalous term which vanishes in the classical
case. This is called {\em the quantum group anomaly}. We derive the new qRG
equations for the XXZ model and show that the RG-flow diagram obtained in this
fashion exhibits the correct line of critical points that the exact model has.
In the ITF model the qRG-flow equations coincide with the tensor product
decomposition of cyclic irreps of $SU_q(2)$ with $q^4=1$.
","[{""version"":""v1"",""created"":""Mon, 27 Nov 1995 10:52:50 GMT""}]","2016-11-03"
"hep-th/9511191","Elcio Abdalla","E. Abdalla, M.C.B. Abdalla and K.D. Rothe","Massive Two-Dimensional Quantum Chromodynamics","13 pages, plain tex; some misprints have been corrected",,,"CERN-TH/95-310, IC/385","hep-th",,"  In this work we study the zero-charge sector of massive two-dimensional
Quantum Chromodynamics in the decoupled formulation. We find that some general
features of the massless theory, concerning the constraints and the right- and
left-moving character of the corresponding BRST currents, survive in the
massive case. The implications for the integrability properties previously
valid in the massless case, and the structure of the Hilbert space are
discussed.
","[{""version"":""v1"",""created"":""Mon, 27 Nov 1995 10:32:52 GMT""},{""version"":""v2"",""created"":""Tue, 12 Dec 1995 13:03:16 GMT""}]","2008-02-03"
"hep-th/9511192","Gerald Dunne","Gerald Dunne and Theodore Hall (U. Connecticut)","Inhomogeneous Condensates in Planar QED","13 pp, LaTeX, no figures; to appear in Phys. Rev. D","Phys.Rev. D53 (1996) 2220-2226","10.1103/PhysRevD.53.2220","UCONN-95-21","hep-th",,"  We study the formation of vacuum condensates in $2+1$ dimensional QED in the
presence of inhomogeneous background magnetic fields. For a large class of
magnetic fields, the condensate is shown to be proportional to the
inhomogeneous magnetic field, in the large flux limit. This may be viewed as a
{\it local} form of the {\it integrated} degeneracy-flux relation of Aharonov
and Casher.
","[{""version"":""v1"",""created"":""Mon, 27 Nov 1995 15:07:27 GMT""}]","2009-10-28"
"math/9511212",,"Yurii I. Lyubarskii, Kristian Seip","Complete interpolating sequences for Paley-Wiener spaces and
  Muckenhoupt's $(A_p)$ condition",,,,"MSRI 1995-085","math.FA",,"  We describe the complete interpolating sequences for the Paley-Wiener spaces
$L^p_\pi$ ($1<p<\infty$) in terms of Muckenhoupt's $(A_p)$ condition. For
$p=2$, this description coincides with those given by Pavlov (1979), Nikol'skii
(1980), and Minkin (1992) of the unconditional bases of complex exponentials in
$L^2(-\pi,\pi)$. While the techniques of these authors are linked to the
Hilbert space geometry of $L^2_\pi$, our method of proof is based on turning
the problem into one about boundedness of the Hilbert transform in certain
weighted $L^p$ spaces of functions and sequences.
","[{""version"":""v1"",""created"":""Mon, 27 Nov 1995 00:00:00 GMT""}]","2016-09-06"
"q-alg/9511023","Phung Ho Hai","Phung Ho Hai","On The Structure of Quantum Super Groups GL$_q(m|n)$","19 pages, Latex file with amstex style","Journal of Algebra, 211, 363-383 (1999)",,,"q-alg math.QA",,"  We show that a quantum super matrix in standard format is invertible if and
only if its block matrices of even entries are invertible. We prove the
q-analog of the well-known formula for the Berezinian.
","[{""version"":""v1"",""created"":""Mon, 27 Nov 1995 01:45:26 GMT""},{""version"":""v2"",""created"":""Tue, 28 Nov 1995 17:19:21 GMT""},{""version"":""v3"",""created"":""Wed, 29 Nov 1995 19:23:17 GMT""},{""version"":""v4"",""created"":""Mon, 4 Jan 1999 17:03:24 GMT""}]","2008-02-03"
"q-alg/9511024","Andrew Kricker","A.Kricker, B.Spence and I.Aitchison","Cabling the Vassiliev Invariants","LaTeX2e, 31 pages. This version to appear in the Journal of Knot
  Theory and it's Ramifications",,,"QMW-PH-95-32, UM-P-95-112","q-alg math.QA",,"  We characterise the cabling operations on the weight systems of finite type
knot invariants. The eigenvectors and eigenvalues of this family of operations
are described over the cable eigenbasis. The action of immanent weight systems
on general Feynman diagrams is considered, and the highest eigenvalue cabling
eigenvectors are shown to be dual to the immanent weight systems. Using these
results, we prove a recent conjecture of Bar-Natan and Garoufalidis on cablings
of weight systems.
","[{""version"":""v1"",""created"":""Mon, 27 Nov 1995 05:39:46 GMT""},{""version"":""v2"",""created"":""Tue, 16 Jan 1996 12:08:51 GMT""},{""version"":""v3"",""created"":""Sat, 20 Jan 1996 22:35:19 GMT""},{""version"":""v4"",""created"":""Tue, 4 Feb 1997 05:03:07 GMT""}]","2008-02-03"
"q-alg/9511025","Lev Rozansky","L. Rozansky","On Finite Type Invariants of Links and Rational Homology Spheres Derived
  from the Jones Polynomial and Witten-Reshetikhin-Turaev Invariant","25 pages, no figures, LaTeX (an appendix with the sketch of the proof
  of Reshetikhin's formula is added)",,,,"q-alg math.QA",,"  We present a mathematically clean review of our previous results on 1/K
expansion of the colored Jones polynomial and on perturbative invariants of 3d
rational homology spheres. We also prove that perturbative invariants defined
through the stationary phase surgery formula are invariant under Kirby moves.
","[{""version"":""v1"",""created"":""Mon, 27 Nov 1995 06:13:21 GMT""},{""version"":""v2"",""created"":""Mon, 19 Feb 1996 21:42:01 GMT""}]","2008-02-03"
"q-alg/9511026","Christoph Schweigert","J""urgen Fuchs, Bert Schellekens, Christoph Schweigert","Twining characters, orbit Lie algebras, and fixed point resolution","Latex, 24 pages. Slightly extended version of lectures by J. Fuchs at
  a workshop in Razlog (Bulgaria) in August 1995",,,"DESY 95-222, NIKHEF/95-062, IHES/P/95/97","q-alg hep-th math.QA",,"  We describe the resolution of field identification fixed points in coset
conformal field theories in terms of representation spaces of the coset chiral
algebra. A necessary ingredient from the representation theory of Kac Moody
algebras is the recently developed theory of twining characters and orbit Lie
algebras, as applied to automorphisms representing identification currents.
","[{""version"":""v1"",""created"":""Mon, 27 Nov 1995 15:36:25 GMT""}]","2008-02-03"
"quant-ph/9511039","Olavo Leopoldino Da Silva Filho","L.S.F.Olavo","Quantum Mechanics as a Classical Theory IX: The Formation of Operators
  and Quantum Phase-Space Densities","Standard LaTex, 15 pages, 4 figures",,,"UnB-009","quant-ph",,"  In our previous papers we were interested in making a reconstruction of
quantum mechanics according to classical mechanics. In this paper we suspend
this program for a while and turn our attention to a theme in the frontier of
quantum mechanics itself---that is, the formation of operators. We then
investigate all the subtleties involved in forming operators from their
classical counterparts. We show, using the formalism of quantum phase-space
distributions, that our formation method, which is equivalent to Weyl's rule,
gives the correct answer. Since this method implies that eigenstates are not
dispersion-free we argue for modifications in the orthodox view. Many
properties of the quantum phase-space distributions are also investigated and
discussed in the realm of our classical approach. We then strengthen the
conclusions of our previous papers that quantum mechanics is merely an
extremely good approximation of classical statistical mechanics performed upon
the configuration space.
","[{""version"":""v1"",""created"":""Mon, 27 Nov 1995 13:29:26 GMT""}]","2007-05-23"
