"cond-mat/9509035","Regis Melin","R. Melin, J.C. Angles d'Auriac, P. Chandra and B. Doucot","Glassy Behavior in the Ferromagnetic Ising Model on a Cayley Tree","32 pages, submitted to J. Phys A, figures available on request",,"10.1088/0305-4470/29/18/011",,"cond-mat",,"  We present a detailed study of the nearest-neighbor ferromagnetic Ising model
on a Cayley tree. In the limit of zero field, the system displays glassy
behavior below a crossover temperature, $T_g$, that scales inversely with the
logarithm of the number of generations; thus $T_g$ is inversely proportional to
the logarithm of the logarithm of the number of sites. Non-Gaussian
magnetization distributions are observed for $T < T_g$, reminiscent of that
associated with the central spin of the Edwards-Anderson model on the same
tree; furthermore a dynamical study indicates metastability, long relaxation
times and ageing consistent with the development of glassy behavior for a
finite but macroscopic number of sites.
","[{""version"":""v1"",""created"":""Thu, 7 Sep 1995 07:00:31 GMT""}]","2009-10-28"
"cond-mat/9509036","Dominique Mouhanna","P. Azaria, P. Lecheminant, D.mouhanna","The massive $CP^{N-1}$ model for frustrated spin systems","55 pages, Latex","Nucl.Phys. B455 (1995) 648-684","10.1016/0550-3213(95)00514-S","PAR-LPTHE 95-34","cond-mat hep-th",,"  We study the classical ${SU(N)\otimes U(1)/SU(N-1)\otimes U(1)}$ Non Linear
Sigma model which is the continuous low energy effective field theory for $N$
component frustrated spin systems. The $\beta$ functions for the two coupling
constants of this model are calculated around two dimensions at two loop order
in a low temperature expansion. Our study is completed by a large $N$ analysis
of the model. The $\beta$ functions for the coupling constants and the mass gap
are calculated in all dimensions between 2 and 4 at order ${1/N}$. As a main
result we show that the standard procedure at the basis of the $1/N$ expansion
leads to results that partially contradict those of the weak coupling analysis.
We finally present the procedure that reconciles the weak coupling and large
$N$ analysis, giving a consistent picture of the expected scaling of frustrated
magnets.
","[{""version"":""v1"",""created"":""Thu, 7 Sep 1995 09:59:29 GMT""}]","2009-10-28"
"cond-mat/9509041","Harek Haugerud","H. Haugerud and F. Ravndal","Bose-Einstein condensation in the harmonic oscillator potential","3 pages, latex, no figures",,,,"cond-mat",,"  The Bose-Einstein condensation of a dilute gas of rubidium-87 atoms was
achieved by cooling a small number of atoms in a magnetic trap. The effective
potential of the trap is to lowest order harmonic and under these conditions we
estimate the critical temperature and the heat capacity of an ideal gas of Bose
particles. Previously this has been estimated within the semiclassical
approximation. However, because of the small number of atoms, the resulting
$T_c$ deviates slightly from our result obtained by exact numerical
calculations. For the gap of the heat capacity at the transition point the
deviation is $20\%$.
","[{""version"":""v1"",""created"":""Thu, 7 Sep 1995 14:15:49 GMT""}]","2007-05-23"
"gr-qc/9509012","R. R. Caldwell","R. R. Caldwell & Paul Casper","Formation of Black Holes from Collapsed Cosmic String Loops","uuencoded, compressed postscript; 20 pages including 7 figures","Phys.Rev. D53 (1996) 3002-3010","10.1103/PhysRevD.53.3002","DAMTP-R95/41, WISC-MILW-95-TH-18","gr-qc astro-ph",,"  The fraction of cosmic string loops which collapse to form black holes is
estimated using a set of realistic loops generated by loop fragmentation. The
smallest radius sphere into which each cosmic string loop may fit is obtained
by monitoring the loop through one period of oscillation. For a loop with
invariant length $L$ which contracts to within a sphere of radius $R$, the
minimum mass-per-unit length $\mu_{\rm min}$ necessary for the cosmic string
loop to form a black hole according to the hoop conjecture is $\mu_{\rm min} =
R /(2 G L)$. Analyzing $25,576$ loops, we obtain the empirical estimate $f_{\rm
BH} = 10^{4.9\pm 0.2} (G\mu)^{4.1 \pm 0.1}$ for the fraction of cosmic string
loops which collapse to form black holes as a function of the mass-per-unit
length $\mu$ in the range $10^{-3} \lesssim G\mu \lesssim 3 \times 10^{-2}$. We
use this power law to extrapolate to $G\mu \sim 10^{-6}$, obtaining the
fraction $f_{\rm BH}$ of physically interesting cosmic string loops which
collapse to form black holes within one oscillation period of formation.
Comparing this fraction with the observational bounds on a population of
evaporating black holes, we obtain the limit $G\mu \le 3.1 (\pm 0.7) \times
10^{-6}$ on the cosmic string mass-per-unit-length. This limit is consistent
with all other observational bounds.
","[{""version"":""v1"",""created"":""Wed, 6 Sep 1995 16:35:44 GMT""}]","2009-10-28"
"hep-lat/9509008","Sinya Aoki","S. Aoki","On the phase structure of QCD with Wilson fermions","14 pages (6 figures), latex (epsf style-file needed), talk presented
  at ''QCD on massively parallel computers'' (Yamagata, Japan, March 16-18
  1995)","Prog.Theor.Phys.Suppl.122:179-186,1996","10.1143/PTPS.122.179","UTHEP-318","hep-lat",,"  The phase structure of lattice QCD with Wilson fermions is discussed.
Analytic and numerical evidences are given for the spontaneous breaking of
parity and flavor symmetry, which naturally explains the existence of the
massless pion at the critical hopping parameter $K_c$ without recourse to the
chiral symmetry absent in the Wilson fermion formulation. New numerical
evidences are also presented for the multiple structure of the critical lines
in the weak coupling region. A connection between the phase structure and the
finite temperature phase transition is briefly mentioned.
","[{""version"":""v1"",""created"":""Thu, 7 Sep 1995 04:36:27 GMT""}]","2008-11-26"
"hep-ph/9509238","Sergey Goloskokov","S.V.Goloskokov (BLTP, JINR, Dubna, Russia)","Spin asymmetries in lepton-proton and proton-proton diffractive
  reactions","8 pages, uuencode PS-file with 5 figures. Represented at the Workshop
  ""Prospects of Spin Physics at HERA"", Zeuthen, August 28-31, 1995",,,,"hep-ph",,"  It is shown that the longitudinal double spin asymmetry $A_{ll}$ in polarized
diffractive $Q \bar Q$ production depends strongly on the spin structure of the
quark-pomeron vertex. Relevant experiments will be possible at HERA with a
polarized proton beam.
","[{""version"":""v1"",""created"":""Wed, 6 Sep 1995 19:49:36 GMT""}]","2007-05-23"
"hep-ph/9509239","Davison Soper","Arjun Berera and Davison E. Soper","Behavior of Diffractive Parton Distribution Functions","35 pages, REVTEX, uses epsf.tex to insert figures; with 11 figures in
  encapsulated postscript form, which epsf.tex will insert","Phys.Rev.D53:6162-6179,1996","10.1103/PhysRevD.53.6162","PSU/TH/163 and OITS 581","hep-ph",,"  Diffractive parton distribution functions give the probability to find a
parton in a hadron if the hadron is diffractively scattered. We provide an
operator definition of these functions and discuss their relation to
diffractive deeply inelastic scattering and to photoproduction of jets at HERA.
We perform a calculation in the style of ``constituent counting rules'' for the
behavior of these functions when the detected parton carries almost all of the
longitudinal momentum transferred from the scattered hadron.
","[{""version"":""v1"",""created"":""Wed, 6 Sep 1995 19:47:17 GMT""}]","2014-11-17"
"hep-ph/9509240",,"John F. Donoghue and Jusak Tandean","Global anomalies and the gauge-boson equivalence theorem","11 pages, revtex, no figures, to appear in Phys. Lett. B","Phys.Lett. B361 (1995) 69-73","10.1016/0370-2693(95)01154-I","UMHEP-421","hep-ph",,"  We discuss the various resolutions which have been suggested in the
literature for the way that the equivalence theorem can be satisfied in
theories with global anomalies. We provide a model-independent proof for the
resolution originally suggested in the context of a toy model by Kilgore.
","[{""version"":""v1"",""created"":""Wed, 6 Sep 1995 18:48:42 GMT""}]","2009-10-28"
"hep-ph/9509241","Anupam Singh","Anupam Singh (current address: Physics Dept. UCSB)","Field Theoretical Methods in Cosmology","116 pages, LaTeX; 39 Figures available on request from
  watson@cmphys.phys.cmu.edu",,,"CMU Ph.D. Thesis","hep-ph astro-ph gr-qc hep-th",,"  To optimally utilize all the exciting cosmological data coming in we need to
sharpen also the theoretical tools available to cosmologists. One such
indispensible tool to understand hot big bang cosmology is finite temperature
field theory. We review and summarise the efforts made by us to use finite
temperature field theory to address issues of current interest to cosmologists.
An introduction to both the real time and the imaginary time formalisms is
provided.
  The imaginary time formalism is illustrated by applying it to understand the
interesting possibilty of Late Time Phase Transitions. Recent observations of
the space distribution of quasars indicate a very notable peak in space density
at a redshift of $2$ to $3$. It is pointed out that this may be the result of a
phase transition which has a critical temperature of roughly a few meV (in the
cosmological units, $~\hbar = c =k = 1$), which is natural in the context of
massive neutrinos. In fact, the neutrino masses required for quasar production
and those required to solve the solar neutrino problem by the MSW mechanism are
consistent with each other. As a bonus, the cosmological constant implied by
this model may also help resolve the discrepancy between the recently measured
value of the Hubble Constant and the age of the universe.
  We illustrate the real time formalism by studying one of the most important
time-dependent and non-equilibrium phenomena associated with phase transitions.
The non-equilibrium dynamics of the first stage of the reheating process, that
is dissipation via particle production is studied in scalar field theories. We
show that a complete understanding of the mechanism of dissipation via particle
production requires a non-perturbative resummation. We then study
","[{""version"":""v1"",""created"":""Thu, 7 Sep 1995 00:10:35 GMT""}]","2016-09-01"
"hep-ph/9509242","Wang","R. D. Peccei and K. Wang","Natural Mass Matrices","28 pages, LaTex, Sec.5 on strong CP revised","Phys.Rev. D53 (1996) 2712-2723","10.1103/PhysRevD.53.2712","UCLA/95/TEP/29","hep-ph",,"  We introduce the idea of natural mass matrices, an organizing principle
useful in the search for GUT scale quark mass matrix patterns that are
consistent with known CKM constraints and quark mass eigenvalues. An
application of this idea is made in the context of SUSY GUTs and some
potentially ``successful'' GUT scale mass patterns are found. The CKM
predictions of these patterns are presented and some relevant strong CP issues
are discussed.
","[{""version"":""v1"",""created"":""Thu, 7 Sep 1995 04:27:13 GMT""},{""version"":""v2"",""created"":""Fri, 17 Nov 1995 04:57:34 GMT""}]","2009-10-28"
"hep-ph/9509243","Owner of the Machine","Takayuki Matsuki (Tokyo Kasei University)","Schr\""odinger Equation for Heavy Mesons Expanded in $1/m_Q$","14 pages, uses REVTeX style files","Mod.Phys.Lett. A11 (1996) 257-266","10.1142/S0217732396000291","TKU-95-2","hep-ph",,"  Operating just once the naive Foldy-Wouthuysen-Tani transformation on the
Schr\""odinger equation for $Q\bar q$ bound states described by a hamiltonian,
we systematically develop a perturbation theory in $1/m_Q$ which enables one to
solve the Schr\""odinger equation to obtain masses and wave functions of the
bound states in any order of $1/m_Q$. It is shown that positive energy
projection with respect to the heavy quark sector of a wave function is, at
each order of perturbation, proportional to the 0-th order solution. There
appear also negative components of the wave function except for the 0-th order,
which contribute also to higher order corrections to masses.
","[{""version"":""v1"",""created"":""Thu, 7 Sep 1995 07:41:09 GMT""}]","2015-06-25"
"hep-ph/9509244","F. Steffens","F. M. Steffens, A. W. Thomas","A Study of Structure Functions for the Bag Beyond Leading Order","15 pages + 5 figures. To appear in Prog. of Theor. Phys","Prog.Theor.Phys.Suppl.120:145-156,1995","10.1143/PTPS.120.145","ADP-94-27/T166","hep-ph",,"  There has recently been surprising progress in understanding the spin and
flavor dependence of deep inelastic structure functions in terms of the same
physics needed in the simple quark models used for hadronic spectroscopy.
However, the corresponding scale is usually very low, casting doubt on the use
of leading order $QCD$ evolution. We show that the conclusions are not
significantly altered if one goes to next-to-leading order. In particular, the
excellent agreement with unpolarized and polarized valence quark distributions
is retained.
","[{""version"":""v1"",""created"":""Thu, 7 Sep 1995 08:39:58 GMT""}]","2010-03-26"
"hep-ph/9509245","Frank Close","Frank Close","Are Glueballs and Hybrids Found?","Style file sprocl.sty required (available from hep-ph). No figs. To
  appear in Proc. of Hadron95",,,"RAL-TR-95-045","hep-ph",,"  The lightest scalar glueball and ground state hybrids may have been found. I
compare signals reported at this conference with theoretical expectations and
highlight the questions that need to be addressed in forthcoming experiments.
","[{""version"":""v1"",""created"":""Thu, 7 Sep 1995 11:11:00 GMT""}]","2007-05-23"
"hep-ph/9509246",,"M.Vysotsky","Implications of Heavy Top","12 pages; ps file can be found at
  http://venus.itep.ru/preprints/1995/95046.ps.gz","Surveys High Energ.Phys. 9 (1996) 237-246","10.1080/01422419608223780","ITEP 46-95","hep-ph",,"  Lecture at 23 ITEP Winter School. Manifestations of heavy top at low energies
(K- and B-mesons) and high energies (Z and W physics) are discussed
","[{""version"":""v1"",""created"":""Thu, 7 Sep 1995 14:42:01 GMT""}]","2015-06-25"
"hep-ph/9509247","Jeff Forshaw","F.E.Close and J.R.Forshaw","Are Diffractive Events at HERA due to a Gluemoron or a Quarkball?","7 pages LATEX plus 1 figure (uuencoded)","Phys.Lett.B369:33-38,1996","10.1016/0370-2693(95)01351-2","RAL-TR-95-046","hep-ph",,"  We propose a means of distinguishing between gluon- and quark-seeded systems
that may in principle be measured in deep inelastic lepton scattering. As a
particular application, we discuss those HERA data on deep inelastic $ep$
scattering which contain a large rapidity gap in the final state. It is
standard to interpret these events as being due to ``pomeron"" exchange,
although precisely what is meant by this remains unclear. Guided by data, we
make some rather general statements about these events and in particular we
discuss the potential for discerning whether the exchanged colour singlet
system can be interpreted as gluonic.
","[{""version"":""v1"",""created"":""Thu, 7 Sep 1995 15:10:46 GMT""}]","2008-11-26"
"hep-th/9509026","Leon Takhtajan","Leon A. Takhtajan","Equivalence of Geometric h<1/2 and Standard c>25 Approaches to
  Two-Dimensional Quantum Gravity","10 pages, latex","Mod.Phys.Lett. A11 (1996) 93-101","10.1142/S0217732396000126",,"hep-th",,"  We show equivalence between the standard weak coupling regime c>25 of the
two-dimensional quantum gravity and regime h<1/2 of the original geometric
approach of Polyakov [1,2], developed in [3,4,5].
","[{""version"":""v1"",""created"":""Wed, 6 Sep 1995 22:35:49 GMT""}]","2015-06-26"
"hep-th/9509027","Alexander Kalloniatis","Alex C. Kalloniatis (Max-Planck Institut fuer Kernphysik, Heidelberg)","On Zero Modes and the Vacuum Problem -- A Study of Scalar Adjoint Matter
  in Two-Dimensional Yang-Mills Theory via Light-Cone Quantisation","LaTeX file, 26 pages. 14 postscript figures","Phys.Rev. D54 (1996) 2876-2888","10.1103/PhysRevD.54.2876","MPI-H-V29-1995","hep-th",,"  SU(2) Yang-Mills Theory coupled to massive adjoint scalar matter is studied
in (1+1) dimensions using Discretised Light-Cone Quantisation. This theory can
be obtained from pure Yang-Mills in 2+1 dimensions via dimensional reduction.
On the light-cone, the vacuum structure of this theory is encoded in the
dynamical zero mode of a gluon and a constrained mode of the scalar field. The
latter satisfies a linear constraint, suggesting no nontrivial vacua in the
present paradigm for symmetry breaking on the light-cone. I develop a
diagrammatic method to solve the constraint equation. In the adiabatic
approximation I compute the quantum mechanical potential governing the
dynamical gauge mode. Due to a condensation of the lowest omentum modes of the
dynamical gluons, a centrifugal barrier is generated in the adiabatic
potential. In the present theory however, the barrier height appears too small
to make any impact in this odel. Although the theory is superrenormalisable on
naive powercounting grounds, the removal of ultraviolet divergences is
nontrivial when the constrained mode is taken into account. The open aspects of
this problem are discussed in detail.
","[{""version"":""v1"",""created"":""Wed, 6 Sep 1995 18:09:09 GMT""}]","2009-10-28"
"hep-th/9509028","Victor Rivelles","Victor O. Rivelles","Comment on ``A New Symmetry for QED'' and ``Relativistically Covariant
  Symmetry in QED''","4 pages, revtex","Phys.Rev.Lett. 75 (1995) 4150","10.1103/PhysRevLett.75.4150","IFUSP-P/1137","hep-th",,"  We show that recently found symmetries in QED are just non-local versions of
standard BRST symmetry.
","[{""version"":""v1"",""created"":""Wed, 6 Sep 1995 20:40:34 GMT""}]","2009-10-28"
"hep-th/9509029","Michael Semenov","M.A.Semenov-Tian-Shansky and A.V.Sevostyanov (Universite de Bourgogne
  and Steklov Mathematical Institute)","Classical and Quantum Nonultralocal Systems on the Lattice","33 pp. Latex. The file is resubmitted since it was spoiled during
  transmission",,,,"hep-th",,"  We classify nonultralocal Poisson brackets for 1-dimensional lattice systems
and describe the corresponding regularizations of the Poisson bracket relations
for the monodromy matrix . A nonultralocal quantum algebras on the lattices for
these systems are constructed.For some class of such algebras an
ultralocalization procedure is proposed.The technique of the modified
Bethe-Anzatz for these algebras is developed.This technique is applied to the
nonlinear sigma model problem.
","[{""version"":""v1"",""created"":""Thu, 7 Sep 1995 08:22:37 GMT""},{""version"":""v2"",""created"":""Mon, 11 Sep 1995 09:06:01 GMT""},{""version"":""v3"",""created"":""Mon, 18 Sep 1995 08:13:39 GMT""},{""version"":""v4"",""created"":""Wed, 20 Sep 1995 10:17:27 GMT""},{""version"":""v5"",""created"":""Thu, 21 Sep 1995 11:38:13 GMT""}]","2008-02-03"
"hep-th/9509030","Michael Semenov","Alexey Sevostyanov (Steklov Mathematical Institute)","The classical r-matrix method for nonlinear sigma-model","18 pages, LaTeX","Int. J. Mod. Phys. A11 (1996) 4241","10.1142/S0217751X96001978",,"hep-th",,"  The canonical Poisson structure of nonlinear sigma-model is presented as a
Lie-Poisson r-matrix bracket on coadjoint orbits. It is shown that the Poisson
structure of this model is determined by some `hidden singularities' of the Lax
matrix.
","[{""version"":""v1"",""created"":""Thu, 7 Sep 1995 08:27:40 GMT""}]","2015-06-26"
"hep-th/9509031","Leonardo Castellani","Leonardo Castellani and Alberto Perotto","Free Differential Algebras: Their Use in Field Theory and Dual
  Formulation","10 pages, latex, no figures. Talk presented at the 4-th Colloquium on
  ""Quantum Groups and Integrable Sysytems"", Prague, June 1995","Lett.Math.Phys.38:321-330,1996","10.1007/BF00398356","DFTT-52/95","hep-th",,"  The gauging of free differential algebras (FDA's) produces gauge field
theories containing antisymmetric tensors. The FDA's extend the Cartan-Maurer
equations of ordinary Lie algebras by incorporating p-form potentials ($p >
1$). We study here the algebra of FDA transformations. To every p-form in the
FDA we associate an extended Lie derivative $\ell$ generating a corresponding
``gauge"" transformation. The field theory based on the FDA is invariant under
these new transformations. This gives geometrical meaning to the antisymmetric
tensors. The algebra of Lie derivatives is shown to close and provides the dual
formulation of FDA's.
","[{""version"":""v1"",""created"":""Thu, 7 Sep 1995 10:45:19 GMT""}]","2011-04-15"
"hep-th/9509032","Xiang Qian Luo","S.H. Guo, Q.Z. Chen, X. Fang, J. Liu, X.Q. Luo, and W. Zheng","Truncated eigenvalue equation and long wavelength behavior of lattice
  gauge theory","Latex file, 4 pages, plus 4 figures encoded with uufiles","Nucl.Phys.Proc.Suppl. 47 (1996) 827-830","10.1016/0920-5632(96)00184-3","HLRZ-95-52","hep-th",,"  We review our new method, which might be the most direct and efficient way
for approaching the continuum physics from Hamiltonian lattice gauge theory. It
consists of solving the eigenvalue equation with a truncation scheme preserving
the continuum limit. The efficiency has been confirmed by the observations of
the scaling behaviors for the long wavelength vacuum wave functions and mass
gaps in (2+1)-dimensional models and (1+1)-dimensional $\sigma$ model even at
very low truncation orders. Most of these results show rapid convergence to the
available Monte Carlo data, ensuring the reliability of our method.
","[{""version"":""v1"",""created"":""Thu, 7 Sep 1995 12:50:30 GMT""}]","2015-06-26"
"hep-th/9509033","Harald Soleng","Harald H. Soleng","Charged black points in General Relativity coupled to the logarithmic
  $U(1)$ gauge theory","7 pages, REVTeX, no figures","Phys.Rev. D52 (1995) 6178-6181","10.1103/PhysRevD.52.6178","CERN-TH/95-110","hep-th",,"  The exact solution for a static spherically symmetric field outside a charged
point particle is found in a non-linear $U(1)$ gauge theory with a logarithmic
Lagrangian. The electromagnetic self-mass is finite, and for a particular
relation between mass, charge, and the value of the non-linearity coupling
constant, $\lambda$, the electromagnetic contribution to the Schwarzschild mass
is equal to the total mass. If we also require that the singularity at the
origin be hidden behind a horizon, the mass is fixed to be slightly less than
the charge. This object is a {\em black point.}
","[{""version"":""v1"",""created"":""Thu, 7 Sep 1995 14:18:09 GMT""}]","2009-10-28"
"hep-th/9509034","Jouko Mickelsson","E. Langmann and J. Mickelsson","Scattering matrix in external field problems","AmsTex file (uses amstex.tex and amsppt.sty) 22 ouput pages","J.Math.Phys. 37 (1996) 3933-3953","10.1063/1.531609",,"hep-th",,"  We discuss several aspects of second quantized scattering operators $\hat S$
for fermions in external time dependent fields. We derive our results on a
general, abstract level having in mind as a main application potentials of the
Yang--Mills type and in various dimensions. We present a new and powerful
method for proving existence of $\hat S$ which is also applicable to other
situations like external gravitational fields. We also give two complementary
derivations of the change of phase of the scattering matrix under generalized
gauge transformations which can be used whenever our method of proving
existence of $\hat S$ applies. The first is based on a causality argument i.e.\
$\hat S$ (including phase) is determined from a time evolution, and the second
exploits the geometry of certain infinite-dimensional group extensions
associated with the second quantization of 1-particle operators. As a special
case we obtain a Hamiltonian derivation of the the axial Fermion-Yang-Mills
anomaly and the Schwinger terms related to it via the descent equations, which
is on the same footing and traces them back to a common root.
","[{""version"":""v1"",""created"":""Thu, 7 Sep 1995 14:58:21 GMT""}]","2009-10-28"
"hep-th/9509036","Alexander Kalloniatis","S.S. Pinsky (The Ohio-State University) and A.C. Kalloniatis
  (Max-Planck Institut fuer Kernphysik, Heidelberg)","Light-Front QCD(1+1) Coupled to Adjoint Scalar Matter","LaTex, 13 pages. Submitted to Physics Letters B","Phys.Lett. B365 (1996) 225-232","10.1016/0370-2693(95)01259-1","OHSTPY-HEP-TH-93-014","hep-th",,"  We consider adjoint scalar matter coupled to QCD(1+1) in light-cone
quantization on a finite `interval' with periodic boundary conditions. We work
with the gauge group SU(2) which is modified to ${\rm{SU(2)/Z_2}}$ by the
non-trivial topology. The model is interesting for various nonperturbative
approaches because it is the sector of zero transverse momentum gluons of pure
glue QCD(2+1), where the scalar field is the remnant of the transverse gluon
component. We use the Hamiltonian formalism in the gauge $\partial_- A^+ = 0$.
What survives is the dynamical zero mode of $A^+$, which in other theories
gives topological structure and degenerate vacua. With a point-splitting
regularization designed to preserve symmetry under large gauge transformations,
an extra $A^+$ dependent term appears in the current $J^+$. This is reminiscent
of an (unwanted) anomaly. In particular, the gauge invariant charge and the
similarly regulated $P^+$ no longer commute with the Hamiltonian. We show that
nonetheless one can construct physical states of definite momentum which are
not {\it invariant} under large gauge transformations but do {\it transform} in
a well-defined way. As well, in the physical subspace we recover vanishing {\it
expectation values} of the commutators between the gauge invariant charge,
momentum and Hamiltonian operators. It is argued that in this theory the vacuum
is nonetheless trivial and the spectrum is consistent with the results of
others who have treated the large N, SU(N), version of this theory in the
continuum limit.
","[{""version"":""v1"",""created"":""Thu, 7 Sep 1995 15:14:05 GMT""}]","2009-10-28"
