"hep-th/9509045","Misha Vasiliev","Lars Brink and Mikhail Vasiliev","Generalized Toda Field Theories","35 pages, latex, no figures; submitted to Nucl. Phys.B","Nucl.Phys.B457:273-308,1995","10.1016/0550-3213(95)00532-3","FIAN/TD/16--95; G\""{o}teborg ITP 95-20","hep-th",,"  In this paper we introduce a unified approach to Toda field theories which
allows us to formulate the classes of $A_n$, $B_n$ and $C_n$ models as unique
models involving an arbitrary continuous parameter $\nu$. For certain values of
$\nu $, the model describes the standard Toda theories. For other values of
$\nu$ it defines a class of models that involve infinitely many fields. These
models interpolate between the various standard Toda field theories. They are
conformally invariant and possess infinitely many conserved higher-spin
currents thus making them candidates for a new set of integrable systems. A
general construction is performed, which can effectively be used for the
derivation of explicit forms of particular higher-spin currents. We also study
the currents in a different representation in which they are linear in the
dynamical variables having, however, a non-linear Poisson bracket algebra. An
explicit formula for this Poisson structure is found.
","[{""version"":""v1"",""created"":""Thu, 7 Sep 1995 15:53:27 GMT""}]","2011-07-19"
"hep-th/9509046","Pradip K. Sahu","Pradip K Sahu","Two-loop QED with External Magnetic Field","12 pages (LaTex) and 5 postscript figures added. Replaced to remove
  blocks of text accidentally copied verbatim from papers by V. Zeitlin
  (hep-ph/9412204 and hep-ph/9507404) and some typos are corrected",,,,"hep-th",,"  In two - loop effective Lagrangian, the low - temperature expansion of the
$QED_{3+1}$ with a constant magnetic field and a finite chemical potential is
performed. We then calculate the total fermion density, some components of
polarization operator and de Hass -van Alphen oscillations. We find that there
is a significant contribution from two-loop expansion to magnetization and
fermion density for higher values of chemical potentials.
","[{""version"":""v1"",""created"":""Thu, 7 Sep 1995 10:14:49 GMT""},{""version"":""v2"",""created"":""Fri, 15 Sep 1995 12:06:38 GMT""},{""version"":""v3"",""created"":""Mon, 23 Oct 1995 13:12:59 GMT""}]","2008-02-03"
"math/9509221",,"Feliks Przytycki","On measure and Hausdorff dimension of Julia sets for holomorphic
  Collet--Eckmann maps",,,,"MSRI 1995-072","math.DS",,"  Let $f:\bar\bold C\to\bar\bold C$ be a rational map on the Riemann sphere ,
such that for every $f$-critical point $c\in J$ which forward trajectory does
not contain any other critical point, $|(f^n)'(f(c))|$ grows exponentially fast
(Collet--Eckmann condition), there are no parabolic periodic points, and else
such that Julia set is not the whole sphere. Then smooth (Riemann) measure of
the Julia set is 0.
  For $f$ satisfying additionally Masato Tsujii's condition that the average
distance of $f^n(c)$ from the set of critical points is not too small, we prove
that Hausdorff dimension of Julia set is less than 2. This is the case for
$f(z)=z^2+c$ with $c$ real, $0\in J$, for a positive line measure set of
parameters $c$.
","[{""version"":""v1"",""created"":""Thu, 7 Sep 1995 00:00:00 GMT""}]","2016-09-06"
"math/9509224","J. Brian Conrey","J. Brian Conrey","A note on the fourth power moment of the Riemann zeta-function",,,,"OSU Math 1995-2","math.NT",,"  We give explicit formulae for all of the terms in the asymptotic expansion of
the mean fourth power of the Riemann zeta-function on the critical line.
","[{""version"":""v1"",""created"":""Thu, 7 Sep 1995 00:00:00 GMT""}]","2016-09-06"
"nucl-th/9509015","Avraham Rinat","A.S. Rinat and M.F. Taragin","Effect of $NN$-correlations on predictions of nuclear transparencies for
  protons, knocked-out in high $Q^2\,(e,e'p)$ reactions","12 pages, uuencoded PS files for text and figs.file part1 of 2 parts","Nucl.Phys. A597 (1996) 636-644","10.1016/0375-9474(95)00454-8","WIS-95/45/Sept-PH","nucl-th",,"  We study the transparency $\cal T$ of nuclei for nucleons knocked-out in
high-energy semi-inclusive $(e,e'p)$ reactions, using an improved theoretical
input, discussed by Nikolaev et al. We establish that neglect of
$NN$-correlations between the knocked-out and core nucleons reduces nuclear
transparencies by $\approx 15 \%$ for light, to $\approx 10\%$ for heavy
nuclei. About the same is predicted for transparencies, integrated over the
transverse or longitudinal momentum of the outgoing proton. Hadron dynamics
predicts a roughly constant $\cal T$ beyond $Q^2\approx $2 GeV$^2$, whereas for
all targets the largest measured data point $Q^2$=6.7 GeV$^2$ appears to lie
above that plateau. Large error bars on those data-points preclude a conclusion
regarding the onset of colour transparency.
","[{""version"":""v1"",""created"":""Thu, 7 Sep 1995 09:58:58 GMT""}]","2009-10-28"
"nucl-th/9509016",,"L. Engvik, G. Bao, M. Hjorth-Jensen, E. Osnes and E. Oestaard","Asymmetric nuclear matter and neutron star properties","Revtex, 16 pages, 6 figures included","Astrophysical Journal 469 1996 794-807","10.1086/177827","ECT*/JUN/95-02","nucl-th",,"  In this work we calculate the total mass, radius, moment of inertia, and
surface gravitational redshift for neutron stars using various equations of
state (EOS). Modern meson-exchange potential models are used to evaluate the
$G$-matrix for asymmetric nuclear matter. We calculate both a non-relativistic
and a relativistic EOS. Of importance here is the fact that relativistic
Brueckner-Hartree-Fock calculations for symmetric nuclear matter fit the
empirical data, which are not reproduced by non-relativistic calculations.
Relativistic effects are known to be important at high densities, giving an
increased repulsion. This leads to a stiffer EOS compared to the EOS derived
with a non-relativistic approach. Both the non-relativistic and the
relativistic EOS yield moments of inertia and redshifts in agreement with the
accepted values. The relativistic EOS yields, however, too large mass and
radius. The implications are discussed.
","[{""version"":""v1"",""created"":""Thu, 7 Sep 1995 11:42:37 GMT""}]","2009-10-28"
"q-alg/9509005","Chongying Dong","Chongying Dong, Haisheng Li and Geoffrey Mason","Twisted representations of vertex operator algebras","AMS-Latex, 30 pages",,,,"q-alg math.QA",,"  Let $V$ be a vertex operator algebra and $g$ an automorphism of finite order.
We construct an associative algebra $A_g(V)$ and a pair of functors between the
category of $A_g(V)$-modules and a certain category of admissible $g$-twisted
$V$-modules. In particular, these functors exhibit a bijection between the
simple modules in each category. We give various applications, including the
fact that the complete reducibility of admissible $g$-twisted modules implies
both the finite-dimensionality of homogeneous spaces and the finiteness of the
number of simple $g$-twisted modules.
","[{""version"":""v1"",""created"":""Wed, 6 Sep 1995 19:48:15 GMT""}]","2008-02-03"
"q-alg/9509006","Trevvie Welsh","T. A. Welsh","Two-Rowed Hecke Algebra Representations at Roots of Unity","LaTeX, 9 pages. Submitted for the Proceedings of the 4th
  International Colloquium ``Quantum Groups and Integrable Systems,'' Prague,
  22-24 June 1995",,"10.1007/BF01688823",,"q-alg math.QA",,"  In this paper, we initiate a study into the explicit construction of
irreducible representations of the Hecke algebra $H_n(q)$ of type $A_{n-1}$ in
the non-generic case where $q$ is a root of unity. The approach is via the
Specht modules of $H_n(q)$ which are irreducible in the generic case, and
possess a natural basis indexed by Young tableaux. The general framework in
which the irreducible non-generic $H_n(q)$-modules are to be constructed is set
up and, in particular, the full set of modules corresponding to two-part
partitions is described. Plentiful examples are given.
","[{""version"":""v1"",""created"":""Thu, 7 Sep 1995 00:06:46 GMT""}]","2009-10-28"
"quant-ph/9509003","Asher Peres","Asher Peres","Quantum Cryptography with Orthogonal States?","3 pages, LaTeX, 1 figure on separate page Final version in Phys Rev
  Lett 77 (1996) 3264",,"10.1103/PhysRevLett.77.3264",,"quant-ph",,"  This is a Comment on Phys Rev Lett 75 (1995) 1239, by Goldenberg and Vaidman
","[{""version"":""v1"",""created"":""Thu, 7 Sep 1995 08:01:41 GMT""},{""version"":""v2"",""created"":""Thu, 8 Oct 1998 11:57:01 GMT""}]","2009-10-28"
"solv-int/9509002","1081","J. F. van Diejen","The relativistic Calogero model in an external field","10 pages, LaTeX, Submitted to the Proceedings of the 4th Wigner
  Symposium, August 5-11, 1995 Guadalajara, Mexico. Third section corrected",,,,"solv-int hep-th nlin.SI",,"  Recent results are surveyed regarding the spectrum and eigenfunctions of the
inverse square Calogero model with harmonic confinement and its relativistic
analogue.
","[{""version"":""v1"",""created"":""Thu, 7 Sep 1995 01:18:25 GMT""},{""version"":""v2"",""created"":""Wed, 13 Sep 1995 04:56:24 GMT""}]","2008-02-03"
