"ao-sci/9509001","Satoh Masaki","Masaki Satoh (Saitama Inst. Tech., Japan)","Hadley circulations and large scale motions of moist convection in the
  two dimensional numerical model","Submitted to J. Meteor. Soc. Japan. 36 pages for text and 16 pages
  for figures. Only LaTeX source files for the text are included in a
  tar-gzipped file. Full paper including postscript figures is requested from
  the author (2.3 MB). Japanese version is also available from the author",,,,"ao-sci physics.ao-ph",,"  As a tool for understanding the meridional circulation of the atmosphere, a
two-dimensional ( latitude -- height ) numerical model is used to clarify the
relationship between the Hadley circulation and large-scale motions associated
with moist convection. The model is based on the primitive equations including
the moist process, and two kinds of coordinates are used: the spherical
coordinate and the Cartesian coordinate with a uniform rotation. The surface
temperature is externally fixed and the troposphere is cooled by the radiation;
unstable stratification generates large-scale convective motions.
  Dependencies on the surface temperature difference from north to south Delta
T_s are investigated. The numerical results show that a systematic multi-cell
structure exists in every experiment. If the surface temperature is constant
(Delta T_s = 0 ), convective motions are organized in the scale of the Rossby
deformation radius and their precipitation patterns have a periodicity of the
advective time tau_D. As Delta T_s becomes larger, the organized convective
system tends to propagate toward warmer regions. The convective cells
calculated in the Cartesian coordinate model is very similar to those of the
mid-latitudes in the spherical coordinate model. In particular, the Hadley cell
can be regarded as the limit of the convective cells in the equatorial
latitudes.
","[{""version"":""v1"",""created"":""Thu, 7 Sep 1995 06:56:59 GMT""},{""version"":""v2"",""created"":""Fri, 8 Sep 1995 09:35:53 GMT""}]","2016-08-30"
"astro-ph/9509032","Jesus Pando","Jesus Pando and Li-Zhi Fang","Wavelet Space-Scale-Decomposition Analysis of QSO's Ly$\alpha$
  Absorption Lines: Spectrum of Density Perturbations","30 pages, 9 figures, in compressed uuencoded postscript file",,,,"astro-ph",,"  A method for measuring the spectrum of a density field by a discrete wavelet
space-scale decomposition (SSD) has been studied. We show how the power
spectrum can effectively be described by the father function coefficients (FFC)
of the wavelet SSD. We demonstrate that the features of the spectrum, such as
the magnitude, the index of a power law, and the typical scales, can be
determined with high precision by the FFC reconstructed spectrum. This method
does not require the mean density, which normally is poorly determined. The
problem of the complex geometry of observed samples can also be easily solved
because the basis are always orthogonal, regardless the geometry of the
samples. Using this method, we examine the spectra inferred from Ly$\alpha$
forests of both simulated and real samples. We find that 1.) the magnitude of
the 1-D spectra is significantly dfferent froma Poisson process; 2) the 1-d
spectra are flat on scales less than 5 h$^{-1}$ Mpc, and increase slowly at
larger ranges; 3.) the reconstructed 3-D spectra have about the same power as
the COBE normalized linear spectrum of the SCDM model on scales less than 40
h$^{-1}$ Mpc, but is larger than the SCDM model on scales larger than 40
h$^{-1}$ Mpc; 4) the magnitudes of high redshift ($z>2.51$) spectra generally
are larger than those of low redshift ($z<2.51$).
","[{""version"":""v1"",""created"":""Wed, 6 Sep 1995 18:26:23 GMT""}]","2007-05-23"
"astro-ph/9509033","Bhuvnesh Jain","Bhuvnesh Jain","Aspects of Scaling in Gravitational Clustering","6 pages; uuencoded compressed postscript file, including 2 figures.
  To appear in the proceedings of the XXXth MORIOND meeting: ""Clustering in the
  Universe""",,,,"astro-ph",,"  The scaling ansatz of Hamilton et al. effectively extends the idea of
self-similar scaling to initial power spectra of any generic shape.
Applications of this ansatz have provided a semi-empirical analytical
description of gravitational clustering which is extremely useful. This
contribution examines the two theoretical ingredients that form the basis of
these applications: self-similar evolution and the stable clustering
hypothesis. A brief summary of work verifying self-similar scaling for scale
free spectra $P(k) \propto k^n$, with $n < -1$ is given. The main results
presented here examine the hypothesis that clustering is statistically stable
in time on small scales, or equivalently that the mean pair velocity in
physical coordinates is zero. The mean pair velocity of particles can be
computed accurately from N-body simulations via the pair conservation equation,
by using the evolution of the autocorrelation function $\xi(x,t)$. The results
thus obtained for scale free spectra with $n = 0, -1, -2$ and for the CDM
spectrum are consistent with the stable clustering prediction on the smallest
resolved scales, on which the amplitude of $\xi \gsim 200-1000$ for $n = -2$
and $n = 0$, respectively.
","[{""version"":""v1"",""created"":""Wed, 6 Sep 1995 18:48:09 GMT""}]","2007-05-23"
"astro-ph/9509034","Ray Carlberg","Carlberg, Yee, Ellingson, Abraham, Gravel, Morris & Pritchet","Galaxy Cluster Virial Masses and Omega","34 page Latex document (no figures) requiring AAS macros. Postscript
  document (or uufile) availble at
  http://manaslu.astro.utoronto.ca/~carlberg/cnoc/general.html","Astrophys.J. 462 (1996) 32","10.1086/177125",,"astro-ph",,"  To re-examine the rich cluster $\Omega$ value the CNOC Cluster Survey has
observed 16 high X-ray luminosity clusters in the redshift range 0.17 to 0.55,
obtaining approximately 2600 velocities in their fields. Directly adding all
the K and evolution corrected $r$ band light to $M_r(0)=-18.5$, about
$0.2L_\ast$, and correcting for the light below the limit, the average
mass-to-light ratio of the clusters is $283\pm27h\msun/\lsun$ and the average
mass per galaxy is $3.5\pm0.4\times10^{12}h^{-1}\msun$. The clusters are
consistent with having a universal $M_v/L$ value (within the errors of about
20\%) independent of their velocity dispersion, mean color of their galaxies,
blue galaxy content, redshift, or mean interior density. Using field galaxies
within the same data set, with the same corrections, we find that the closure
mass-to-light, $\rho_c/j$, is $1160\pm130h\msun/\lsun$ and the closure mass per
galaxy, $\rho_c/\phi(>0.2L_\ast)$, is $13.2\pm1.9\times10^{12}h^{-1}\msun$.
Under the assumptions that the galaxies are distributed like the mass and that
the galaxy luminosities and numbers are statistically conserved, which these
data indirectly support, $\Omega_0=0.20\pm0.04\pm0.09$ where the errors are,
respectively, the $1\sigma$ internal and an estimate of the $1\sigma$
systematic error resulting from the luminosity normalization.
","[{""version"":""v1"",""created"":""Wed, 6 Sep 1995 19:05:52 GMT""}]","2009-10-28"
"astro-ph/9509035","Douglas Scott","Douglas Scott","CMB Anisotropies, Large-Scale Structure and the Future","9 pages, including 4 figures in a uuencoded self-unpacking shell
  script. To appear in Proceedings of the ASP Symposium: Clusters, Lensing and
  the Future, edited by Virginia Trimble",,,"CfPA-95-TH-51","astro-ph",,"  We are now beginning to learn detailed information about cosmological
parameters from the shapes of the matter and radiation power spectra, together
with their relative normalization. As more high quality data are gathered from
galaxy surveys and from microwave anisotropies, the range of allowed models is
expected to get incrementally smaller. The amount of information potentially
available from a high-resolution satellite experiment should allow a
determination of essentially {\it all} currently discussed cosmological
parameters to less than ~10%.
","[{""version"":""v1"",""created"":""Thu, 7 Sep 1995 00:03:23 GMT""}]","2007-05-23"
"astro-ph/9509036",,"H. Dejonghe, V. De Bruyne, P. Vauterin and W.W. Zeilinger","The internal dynamics of very flattened normal galaxies: Stellar
  distribution functions for NGC 4697","18 pages, uuencoded and Z-compressed postscript file without the 25
  figures, complete version in Z-compressed postscript format available at
  ftp://naos.rug.ac.be/pub/N4697paper.ps.Z, accepted for publication in A&A",,,,"astro-ph",,"  Using the photometry and the kinematic data, part of which acquired with the
NTT, we constructed a 2-integral and a 3-integral distribution function for NGC
4697. We detected a nuclear dust lane at $3.4''$ or 0.4 kpc from the centre. A
comparison of the Lucy-deprojection method and the multi-gaussian expansion
method showed that the latter offers a number of advantages, among which a
qualitatively better fit and better controllable convergence. Futhermore, we
show that a 2-integral model cannot be excluded for as far as the Satoh
parameter $k$ is allowed to vary. The 3-integral model is based on a St\""ackel
third integral. The original potential is retained where appropriate, in order
to minimise errors due to the St\""ackel approximation. On the whole, the
3-integral model produces more satisfying results than the 2-integral model,
and is better in handling some peculiarities in the kinematic data. For both
models we show detailed contour plots for all deprojected moments up to order
2. The mass-to-light ratio appears to be a fairly well determined
$(M/L)_B=4.8h_{50}$, and is much better constrained than would be the case for
spherical anisotropic models with comparable data.
","[{""version"":""v1"",""created"":""Thu, 7 Sep 1995 10:20:07 GMT""}]","2007-05-23"
"astro-ph/9509037","Ewa Szuszkiewicz","Ewa Szuszkiewicz (SISSA), Matthew A. Malkan (ULCA), Marek A.
  Abramowicz (Goeteborg University)","The Observational Appearance of Slim Accretion Disks","LaTeX file, 21 pages, 21 figures (on request from ewa@sissa.it)
  accepted by Astrophysical Journal","Astrophys.J. 458 (1996) 474","10.1086/176830","SISSA Ref. 109/95/A","astro-ph",,"  We reexamine the hypothesis that the optical/UV/soft X-ray continuum of
Active Galactic Nuclei is thermal emission from an accretion disk. Previous
studies have shown that fitting the spectra with the standard, optically thick
and geometrically thin accretion disk models often led to luminosities which
contradict the basic assumptions adopted in the standard model. There is no
known reason why the accretion rates in AGN should not be larger than the thin
disk limit. In fact, more general, slim accretion disk models are
self-consistent even for moderately super-Eddington luminosities. We calculate
here spectra from a set of thin and slim, optically thick accretion disks. We
discuss the differences between the thin and slim disk models, stressing the
implications of these differences for the interpretation of the observed
properties of AGN. We found that the spectra can be fitted not only by models
with a high mass and a low accretion rate (as in the case of thin disk fitting)
but also by models with a low mass and a high accretion rate. In the first case
fitting the observed spectra in various redshift categories gives black hole
masses around 10^9 solar masses for a wide range of redshifts, and for
accretion rates ranging from 0.4 to 8 solar masses/year. In the second case the
accretion rate is around 10^2 solar masses/year for all AGN and the mass ranges
from 3*10^6 to 10^8 solar masses. Unlike the disks with a low accretion rate,
the spectra of the high-accretion-rate disks extend into the soft X-rays. A
comparison with observations shows that such disks could produce the soft X-ray
excesses claimed in some AGNs. We show also that the sequence of our models
with fixed mass and different accretion rates can explain the time evolution of
the observed spectra in Fairall 9.
","[{""version"":""v1"",""created"":""Thu, 7 Sep 1995 13:14:39 GMT""}]","2009-10-28"
"astro-ph/9509041","Pradip K. Sahu","Pradip K Sahu","Strange matter and its stability in presence of magnetic field","Revised 14 pages (LaTex), Uuencoded 6 postscript figures and some
  typos are corrected",,,,"astro-ph",,"  We study the effect of a magnetic field on the interacting quark matter and
apply to strange star. We considere the low temperature approximation to
strange matter. We find that the interacting strange quark matter is more
stable compare to free quark gas in presence of strong external magnetic field
with zero and finite temperature. We then calculate strange star structure
parameters such as mass and radius and find that the strange star is more
compact for interacting quark matter than free quark matter in presence of
strong magnetic field.
","[{""version"":""v1"",""created"":""Thu, 7 Sep 1995 10:13:26 GMT""},{""version"":""v2"",""created"":""Mon, 23 Oct 1995 17:54:42 GMT""}]","2008-02-03"
"chao-dyn/9509005","Henrik Bruus","Henrik Bruus (CNRS-CRTBT, Grenoble, France) and Niall D. Whelan (CATS,
  Niels Bohr Institute, Copenhagen, Denmark)","Edge Diffraction, Trace Formulae and the Cardioid Billiard","25 pages, 12 Postscript figures. Published version","Nonlinearity 9, 1023-47 (1996)","10.1088/0951-7715/9/4/012",,"chao-dyn cond-mat nlin.CD",,"  We study the effect of edge diffraction on the semiclassical analysis of two
dimensional quantum systems by deriving a trace formula which incorporates
paths hitting any number of vertices embedded in an arbitrary potential. This
formula is used to study the cardioid billiard, which has a single vertex. The
formula works well for most of the short orbits we analyzed but fails for a few
diffractive orbits due to a breakdown in the formalism for certain geometries.
We extend the symbolic dynamics to account for diffractive orbits and use it to
show that in the presence of parity symmetry the trace formula decomposes in an
elegant manner such that for the cardioid billiard the diffractive orbits have
no effect on the odd spectrum. Including diffractive orbits helps resolve peaks
in the density of even states but does not appear to affect their positions. An
analysis of the level statistics shows no significant difference between
spectra with and without diffraction.
","[{""version"":""v1"",""created"":""Wed, 6 Sep 1995 16:39:31 GMT""},{""version"":""v2"",""created"":""Wed, 10 Jul 1996 16:09:49 GMT""}]","2009-10-28"
"chao-dyn/9509006","Giovanni Gallavotti","G. Benettin, A. Carati, G. Gallavotti","A rigorous implementation of the Jeans--Landau--Teller approximation","23 pages, postscript","Nonlinearity, 10, 479--507, 1997","10.1088/0951-7715/10/2/011","FM95-8","chao-dyn nlin.CD",,"  Rigorous bounds on the rate of energy exchanges between vibrational and
translational degrees of freedom are established in simple classical models of
diatomic molecules. The results are in agreement with an elementary
approximation introduced by Landau and Teller. The method is perturbative
theory ``beyond all orders'', with diagrammatic techniques (tree expansions) to
organize and manipulate terms, and look for compensations, like in recent
studies on KAM theorem homoclinic splitting.
","[{""version"":""v1"",""created"":""Wed, 6 Sep 1995 17:52:35 GMT""}]","2009-10-28"
"chao-dyn/9509007","Chertkov Misha","M. Chertkov and G. Falkovich","Anomalous Scaling Exponents of a White-Advected Passive Scalar","4 pages, RevTex 3.0, Submitted to Phys. Rev. Lett",,"10.1103/PhysRevLett.76.2706",,"chao-dyn cond-mat hep-th nlin.CD",,"  For Kraichnan's problem of passive scalar advection by a velocity field
delta-correlated in time, the limit of large space dimensionality $d\gg1$ is
considered. Scaling exponents of the scalar field are analytically found to be
$\zeta_{2n}=n\zeta_2-2(2-\zeta_2)n(n-1)/d$, while those of the dissipation
field are $\mu_{n}=-2(2-\zeta_2)n(n-1)/d$ for orders $n\ll d$. The refined
similarity hypothesis $\zeta_{2n}=n\zeta_2+\mu_{n}$ is thus established by a
straightforward calculation for the case considered.
","[{""version"":""v1"",""created"":""Thu, 7 Sep 1995 09:36:27 GMT""},{""version"":""v2"",""created"":""Fri, 19 Jan 1996 08:20:08 GMT""}]","2009-10-28"
"chao-dyn/9509008","Luca","R. Benzi, L. Biferale, S. Ciliberto, M.V. Struglia and R. Tripiccione","On the intermittent energy transfer at viscous scales in turbulent flows","10 pages, plain Latex, 6 figures available upon request to
  biferale@roma2.infn.it",,"10.1209/0295-5075/32/9/002","ROM2F/95/19","chao-dyn nlin.CD",,"  In this letter we present numerical and experimental results on the scaling
properties of velocity turbulent fields in the range of scales where viscous
effects are acting. A generalized version of Extended Self Similarity capable
of describing scaling laws of the velocity structure functions down to the
smallest resolvable scales is introduced. Our findings suggest the absence of
any sharp viscous cutoff in the intermittent transfer of energy.
","[{""version"":""v1"",""created"":""Thu, 7 Sep 1995 15:11:28 GMT""}]","2009-10-28"
"cmp-lg/9509001","Mark Curtis Lauer","Mark Lauer (Microsoft Institute, Sydney)","How much is enough?: Data requirements for statistical NLP","9 pages","2nd Conference of the Pacific Association for Computational
  Linguistics, Brisbane, Australia",,,"cmp-lg cs.CL",,"  In this paper I explore a number of issues in the analysis of data
requirements for statistical NLP systems. A preliminary framework for viewing
such systems is proposed and a sample of existing works are compared within
this framework. The first steps toward a theory of data requirements are made
by establishing some results relevant to bounding the expected error rate of a
class of simplified statistical language learners as a function of the volume
of training data.
","[{""version"":""v1"",""created"":""Thu, 7 Sep 1995 07:53:23 GMT""}]","2008-02-03"
"cmp-lg/9509002","Mark Curtis Lauer","Mark Lauer (Microsoft Institute, Sydney)","Conserving Fuel in Statistical Language Learning: Predicting Data
  Requirements","8 pages","Eighth Australian Joint Conference on Artificial Intelligence,
  Canberra, 1995.",,,"cmp-lg cs.CL",,"  In this paper I address the practical concern of predicting how much training
data is sufficient for a statistical language learning system. First, I briefly
review earlier results and show how these can be combined to bound the expected
accuracy of a mode-based learner as a function of the volume of training data.
I then develop a more accurate estimate of the expected accuracy function under
the assumption that inputs are uniformly distributed. Since this estimate is
expensive to compute, I also give a close but cheaply computable approximation
to it. Finally, I report on a series of simulations exploring the effects of
inputs that are not uniformly distributed. Although these results are based on
simplistic assumptions, they are a tentative step toward a useful theory of
data requirements for SLL systems.
","[{""version"":""v1"",""created"":""Thu, 7 Sep 1995 08:12:35 GMT""}]","2008-02-03"
"cond-mat/9509027","Ralf Gawlista","Pavel Exner, Ralf Gawlista","Band spectra of rectangular graph superlattices","16 pages, LaTex",,"10.1103/PhysRevB.53.7275",,"cond-mat",,"  We consider rectangular graph superlattices of sides l1, l2 with the
wavefunction coupling at the junctions either of the delta type, when they are
continuous and the sum of their derivatives is proportional to the common value
at the junction with a coupling constant alpha, or the ""delta-prime-S"" type
with the roles of functions and derivatives reversed; the latter corresponds to
the situations where the junctions are realized by complicated geometric
scatterers. We show that the band spectra have a hidden fractal structure with
respect to the ratio theta := l1/l2. If the latter is an irrational badly
approximable by rationals, delta lattices have no gaps in the weak-coupling
case. We show that there is a quantization for the asymptotic critical values
of alpha at which new gap series open, and explain it in terms of
number-theoretic properties of theta. We also show how the irregularity is
manifested in terms of Fermi-surface dependence on energy, and possible
localization properties under influence of an external electric field.
  KEYWORDS: Schroedinger operators, graphs, band spectra, fractals,
quasiperiodic systems, number-theoretic properties, contact interactions, delta
coupling, delta-prime coupling.
","[{""version"":""v1"",""created"":""Wed, 6 Sep 1995 16:15:11 GMT""}]","2016-08-31"
"cond-mat/9509029","Nandini Trivedi","Nandini Trivedi, Richard T. Scalettar and Mohit Randeria","Superconductor-Insulator Transition in a Disordered Electronic System","PostScript, 4 pages, figures included",,"10.1103/PhysRevB.54.R3756",,"cond-mat",,"  We study an electronic model of a 2D superconductor with onsite randomness
using Quantum Monte Carlo simulations. The superfluid density is used to track
the destruction of superconductivity in the ground state with increasing
disorder. The non-superconducting state is identified as an insulator from the
temperature dependence of its d.c. resistivity. The value of $\sigma_{\rm dc}$
at the superconductor-insulator transition appears to be non-universal.
","[{""version"":""v1"",""created"":""Thu, 7 Sep 1995 09:52:16 GMT""}]","2009-10-28"
"cond-mat/9509031","Juan Jose Palacios","J. J. Palacios and A. H. MacDonald (Indiana University)","Numerical Tests of the Chiral Luttinger Liquid Theory for Fractional
  Hall Edges","12 pages + 1 figure, Revtex",,"10.1103/PhysRevLett.76.118","IUCM95-033","cond-mat",,"  We report on microscopic numerical studies which support the chiral Luttinger
liquid theory of the fractional Hall edge proposed by Wen. Our calculations are
based in part on newly proposed and accurate many-body trial wavefunctions for
the low-energy edge excitations of fractional incompressible states.
","[{""version"":""v1"",""created"":""Wed, 6 Sep 1995 18:23:53 GMT""}]","2009-10-28"
"cond-mat/9509032","Scott Sides","S.W. Sides, R.A. Ramos, P.A. Rikvold, and M.A. Novotny","Response of Kinetic Ising System to Oscillating External Fields:
  Amplitude and Frequency Dependence","uuencoded file containing 5 figures available at
  ftp://scri.fsu.edu/pub/sides/figs.uu . Just execute file and it will unpack
  itself","J.Appl.Phys. 79 (1996) 6482-6484","10.1063/1.361978","FSU-SCRI-95C-86","cond-mat chem-ph hep-lat mtrl-th",,"  The S=1/2, nearest-neighbor, kinetic Ising model has been used to model
magnetization switching in nanoscale ferromagnets. For this model, earlier work
based on the droplet theory of the decay of metastable phases and Monte Carlo
simulations has shown the existence of a size dependent spinodal field which
separates deterministic and stochastic decay regimes. We extend the above work
to study the effects of an oscillating field on the magnetization response of
the kinetic Ising model. We compute the power spectral density of the
time-dependent magnetization for different values of the amplitude and
frequency of the external field, using Monte Carlo simulation data. We also
investigate the amplitude and frequency dependence of the probability
distributions for the hysteresis loop area and the period-averaged
magnetization. The time-dependent response of the system is classified by
analyzing the behavior of these quantities within the framework of the distinct
deterministic and stochastic decay modes mentioned above.
","[{""version"":""v1"",""created"":""Wed, 6 Sep 1995 18:36:30 GMT""}]","2009-10-28"
"cond-mat/9509033","Peter Freund","James A. Feigenbaum and Peter G. O. Freund (University of Chicago)","Discrete Scaling in Stock Markets Before Crashes","7 pages LaTeX, 5 uuencoded Postscript figures",,"10.1142/S021797929600204X","EFI-95-58","cond-mat",,"  We propose a picture of stock market crashes as critical points in a
hierachical system with discrete scaling. The critical exponent is then
complex, leading to log-periodic fluctuations in stock market indexes. We
present ``experimental'' evidence in favor of this prediction. This picture is
in the spirit of the known earthquake-stock market analogy and of recent work
on log-periodic fluctuations associated with earthquakes.
","[{""version"":""v1"",""created"":""Wed, 6 Sep 1995 22:43:24 GMT""}]","2015-06-25"
"cond-mat/9509034","Koichi Kusakabe","K. Kusakabe, H. Aoki","Spin-twist driven persistent current in a strongly correlated
  two-dimensional electron system: a manifestation of the gauge field","11 pages, typeset using Revtex 3.0, Phys. Rev. B in press, 2 figures
  available upon request at kabe@issp.u-tokyo.ac.jp",,"10.1103/PhysRevB.52.R8684","KA-95-09","cond-mat",,"  A persistent current, coupled with the spin state, of purely many-body origin
is shown to exist in Nagaoka's ferromagnetic state in two dimensions (2D). This
we regard as a manifestation of a gauge field, which comes from the surrounding
spin configuration and acts on the hole motion, being coupled to the
Aharonov-Bohm flux. This provides an example where the electron-electron
interaction exerts a profound effect involving the spins in clean
two-dimensional lattice systems in sharp contrast to continuum or spinless
fermion systems.
","[{""version"":""v1"",""created"":""Thu, 7 Sep 1995 00:32:32 GMT""}]","2009-10-28"
