"astro-ph/9509147","Albert Stebbins","Scott Dodelson, Evalyn Gates, Albert Stebbins","Cold + Hot Dark Matter and the Cosmic Microwave Background","Compressed uuencoded postscript, 26 pages including figures. Color
  version available at http://www-astro-theory.fnal.gov/","Astrophys.J. 467 (1996) 10-18","10.1086/177581","FERMILAB-Pub-95/312-A","astro-ph",,"  We examine the cosmic microwave background power spectrum for adiabatic
models with a massive neutrino component. We present the results of a detailed
numerical evolution of cold + hot dark matter (CHDM) models and compare with
the standard cold dark matter (CDM) spectrum. The difference is of order
$5-10%$ for $400 < l < 1000 $ for currently popular CHDM models. With
semi-analytic approximations, we also discuss the relevant physics involved.
Finally we remark on the ability of future experiments to differentiate between
these models. An all-sky experiment with a beam size smaller than 30 arcminutes
can distinguish between CHDM and CDM if other cosmological parameters are
known. Even allowing other parameters to vary, it may be possible to
distinguish CDM from CHDM.
","[{""version"":""v1"",""created"":""Thu, 28 Sep 1995 17:34:01 GMT""}]","2009-10-28"
"astro-ph/9509148","Lori Lubin","Lori M. Lubin, Renyue Cen, Neta A. Bahcall & Jeremiah P. Ostriker
  (Princeton University Observatory)","The Baryon Fraction and Velocity--Temperature Relation in Galaxy
  Clusters : Models versus Observations","17 pages, uuencoded, compressed Postscript file, to appear in
  Astrophysical Journal","Astrophys.J. 460 (1996) 10","10.1086/176948",,"astro-ph",,"  The observed baryon fraction and velocity--temperature relation in clusters
of galaxies are compared with hydrodynamic simulations in two cosmological
models : standard (Omega = 1) and a low-density flat (Omega=0.45 and
\lambda=0.55) CDM models, normalized to the COBE background fluctuations. The
observed properties of clusters include the velocity dispersion versus
temperature relation, the gas mass versus total mass relation, and the gas mass
fraction versus velocity dispersion relation. We find that, while both
cosmological models reproduce well the shape of these observed functions, only
low-density CDM can reproduce the observed amplitudes. The cluster gas mass
fraction reflects approximately the baryon fraction in the models, with a
slight anti-bias. Therefore, due to the low baryon density given by
nucleosynthesis, Omega = 1 models produce too few baryons in clusters compared
with observations. Scaling our results as a function of Omega, we find that a
low-density CDM model, with Omega approximately 0.3 - 0.4, best reproduces the
observed mean baryon fraction in clusters. The observed beta parameter of
clusters, beta = sigma^2/(k T/mu m_p) = 0.94 \pm 0.08 discriminates less well
between the models; it is consistent with that produced by low-density CDM
(1.10 \pm 0.22), while it is slightly larger than expected but still consistent
with Omega = 1 (0.70 \pm 0.14).
","[{""version"":""v1"",""created"":""Thu, 28 Sep 1995 19:56:12 GMT""}]","2009-10-28"
"astro-ph/9509149","Ortwin Gerhard","Ortwin Gerhard (Astron.Inst., Univ.Basel, CH) and Joseph Silk
  (Dpt.Astron.&Phys., Univ.Calif., Berkeley, USA)","Baryonic Dark Halos: Machos and Cold Gas?","13 pages, submitted to ApJ. Uuencoded, gzip-compressed ps-file
  including 2 figures. Also available at
  http://www.astro.unibas.ch/~gerhard/papers/dmmn.ps.gz.uu","Astrophys.J. 472 (1996) 34-45","10.1086/178039","Astr.Inst.Basel Prep.Ser.84","astro-ph",,"  We consider the possibility that the dark matter in the halos of galaxies may
be in the form of clusters of \macho s within which are embedded cold, dense
gas clouds. Microlensing experiments have found evidence that the Galactic halo
contains up to half of its mass in the form of low-mass \macho s. A number of
observational and dynamical arguments point to the existence of hitherto
unobserved cold gas around galaxies. We show that the cold gas can be
stabilized by \macho\ clusters. Within the framework of a simple two-component
model, we derive constraints on the \macho\ clusters and on the halo cold gas
content. Typical cluster masses are $\sim 10 \msun$, typical \macho\ masses are
$\sim 0.01 \msun$, and the gas content could be up to of order 50 \%. Various
predictions are given for testing the hypothesis that such objects could
constitute most of the mass in the dark halos of galaxies. If halos are indeed
baryonic and contain significant amounts of cold gas, they are likely to play a
much more active role in galaxy formation and evolution than is commonly
supposed.
","[{""version"":""v1"",""created"":""Fri, 29 Sep 1995 08:36:43 GMT""}]","2009-10-28"
"astro-ph/9509150","Juri Poutanen","Boris E. Stern (Institute for Nuclear Research, Moscow, Russia, and
  Stockholm Observatory, Sweden)","A Simple Law for the Average Time History of Gamma-Ray Bursts and Their
  Time Dilations","gzip-ed, uuencoded postscript file, 6 pages, 3 figure included;
  Comments to juri@astro.su.se",,"10.1086/310113",,"astro-ph",,"  Individual gamma ray bursts (GRBs) have very diverse time behavior - from a
single pulse to a long complex sequence of chaotic pulses of different
timescales. I studied light curves of GRBs using data from the CGRO's BATSE
experiment and found that the average post-peak time history for a sample of
460 bursts obeys an unique and simple analytical law: $I \sim
\exp(-(t/t_0)^{1/3})$ where $t$ is time measured from the peak of the event and
$t_0$ is a constant ranging from 0.3 sec for strong bursts to $\sim 1$ sec for
weak bursts. The average peak aligned profile follows this law with good
accuracy in the whole range availible for analysis (from fractions of a second
to $\sim$ 150 seconds after the peak). Such a law with a single time constant
characterising the overall sample of GRBs should have important physical
meaning. The dependence of $t_0$ versus brightness of GRBs is presented. The
fact that $t_0$ depends on the brightness apparantly confirms the recently
discovered effect of time dilation of weak bursts which has a possible
cosmological interpretation. The time dilation is detected at a confidence
level of $7\sigma$ and it is slightly larger than was previously reported.
","[{""version"":""v1"",""created"":""Fri, 29 Sep 1995 09:26:30 GMT""}]","2009-10-28"
"astro-ph/9509151",,"A. Kogut, A.J. Banday, C.L. Bennett, K.M. Gorski, G. Hinshaw, and W.T.
  Reach","High-Latitude Galactic Emission in the COBE DMR Two-Year Sky Maps","uuencoded compressed archive with LaTex source code and 4
  encapsulated PostScript figures (using epsf macros). Accepted for publication
  in The Astrophysical Journal",,,"COBE 95-09","astro-ph",,"  We cross-correlate the COBE-DMR 2-year sky maps with spatial templates from
long-wavelength radio surveys and the far-infrared COBE DIRBE maps. We place an
upper limit on the spectral index of synchrotron radiation beta_{synch} < -2.9
between 408 MHz and 31.5 GHz. We obtain a statistically significant
cross-correlation with the DIRBE maps whose dependence on the DMR frequencies
indicates a superposition of dust and free-free emission. The high-latitude
dust emission (|b| > 30 deg) is well fitted by a single dust component with
temperature T = 18 (+3, -7) K and emissivity epsilon ~ nu^beta with beta = 1.9
(+3.0, -0.5). The free-free emission is spatially correlated with the dust on
angular scales larger than the 7 degree DMR beam, with rms variations 5.3 +/-
1.8 uK at 53 GHz and angular power spectrum P ~ ell^{-3}. If this correlation
persists to smaller angular scales, free-free emission should not be a
significant contaminant to measurements of the cosmic microwave anisotropy at
degree angular scales for frequencies above 20 GHz.
","[{""version"":""v1"",""created"":""Fri, 29 Sep 1995 15:09:45 GMT""}]","2007-05-23"
"astro-ph/9509152","Eliot J. Quataert","Eliot Quataert, Pawan Kumar, and Chi On Ao (MIT)","On the Validity of the Classical Apsidal Motion Formula for Tidal
  Distortion","paper is in uuencoded, compressed post-script file: 6 post-script
  figures available via anonymous ftp at ftp://brmha.mit.edu/papers/ftp/",,"10.1086/177240",,"astro-ph",,"  We check the validity of the widely used classical apsidal motion formula as
a function of orbital parameters, stellar structure, and stellar rotation rate
by comparing dynamical calculations of the periastron advance with the static
tidal formula. We find that the classical formula gives very accurate results
when the periods of the low order quadrupole g, f and p modes are smaller than
the periastron passage time by a factor of about 7 or more. However, when this
condition is not satisfied, the difference between the classical formula and
the exact result can be quite large, and even periastron recession can result.
The largest difference arises when one of the low order modes of the star is
nearly resonant with an integer multiple of the orbital frequency minus twice
the rotation rate of the star. The resonance of higher order g-modes (number of
radial nodes $\gta 4$) with the orbit is very unlikely to cause significant
deviation from the classical result because of their weak coupling to the tidal
force and thus their small contribution to the apsidal motion. Resonances
involving rotational modes of the star are also unlikely to make much
contribution to the apsidal motion because of their small overlap with the
tidal force, even though they have periods comparable to the periastron passage
time.
  We apply our work to two famous binary systems (AS Cam and DI Her) which show
abnormally small apsidal motion, and conclude that dynamical effects are
unimportant for these systems, i.e. the static tide assumption is an excellent
approximation.
","[{""version"":""v1"",""created"":""Fri, 29 Sep 1995 15:30:03 GMT""}]","2016-08-30"
"chao-dyn/9509021","Gregory J. Chaitin","G J Chaitin (IBM Research)","The Limits of Mathematics","LaTeX, 45 pages",,,,"chao-dyn nlin.CD",,"  This condensed version of chao-dyn/9509010 will be the main hand-out for a
course on algorithmic information theory to be given 22-29 May 1996 at the
Rovaniemi Institute of Technology, Rovaniemi, Finland (see announcement at
http://www.rotol.fi/ ).
","[{""version"":""v1"",""created"":""Thu, 28 Sep 1995 17:03:18 GMT""}]","2008-02-03"
"cond-mat/9509175","Jorge Jose","T.K. Kope\'c and J.V.Jos\'e","Quantum effects in a superconducting glass model","17 pages REVTEX. Two Postscript figures can be obtained from the
  authors. To appear in PRB",,"10.1103/PhysRevB.52.16140",,"cond-mat",,"  We study disordered Josephson junctions arrays with long-range interaction
and charging effects. The model consists of two orthogonal sets of positionally
disordered $N$ parallel filaments (or wires) Josephson coupled at each crossing
and in the presence of a homogeneous and transverse magnetic field. The large
charging energy (resulting from small self-capacitance of the ultrathin wires)
introduces important quantum fluctuations of the superconducting phase within
each filament. Positional disorder and magnetic field frustration induce
spin-glass like ground state, characterized by not having long-range order of
the phases. The stability of this phase is destroyed for sufficiently large
charging energy. We have evaluated the temperature vs charging energy phase
diagram by extending the methods developed in the theory of infinite-range spin
glasses, in the limit of large magnetic field. The phase diagram in the
different temperature regimes is evaluated by using variety of methods, to wit:
semiclassical WKB and variational methods, Rayleigh-Schr\""{o}dinger
perturbation theory and pseudospin effective Hamiltonians. Possible
experimental consequences of these results are briefly discussed.
","[{""version"":""v1"",""created"":""Thu, 28 Sep 1995 23:05:45 GMT""}]","2016-08-15"
"cond-mat/9509179","Joerg Schmalian","S. Grabowski, M. Langer, J. Schmalian, and K. H. Bennemann","Theory for Superconducting Properties of the Cuprates: Doping Dependence
  of the Electronic Excitations and Shadow States","10 pages (REVTeX) with 5 figures (Postscript)",,"10.1209/epl/i1996-00442-2",,"cond-mat",,"  The superconducting phase of the 2D one-band Hubbard model is studied within
the FLEX approximation and by using an Eliashberg theory. We investigate the
doping dependence of $T_c$, of the gap function $\Delta ({\bf k},\omega)$ and
of the effective pairing interaction. Thus we find that $T_c$ becomes maximal
for $13 \; \%$ doping. In {\it overdoped} systems $T_c$ decreases due to the
weakening of the antiferromagnetic correlations, while in the {\it underdoped}
systems due to the decreasing quasi particle lifetimes. Furthermore, we find
{\it shadow states} below $T_c$ which affect the electronic excitation spectrum
and lead to fine structure in photoemission experiments.
","[{""version"":""v1"",""created"":""Fri, 29 Sep 1995 13:06:45 GMT""}]","2009-10-28"
"cond-mat/9510014","Johannes Voit","Johannes Voit","One-Dimensional Fermi liquids","uuencoded Latex files and postscript figures, one Readme-file approx
  160 pages + 13 figures; to be published by Reports on Progress in Physics",,"10.1088/0034-4885/58/9/002",,"cond-mat",,"  I attempt to give a pedagogical overview of the progress which has occurred
during the past decade in the description of one-dimensional correlated
fermions. Fermi liquid theory based on a quasi-particle picture, breaks down in
one dimension because of the Peierls divergence and because of charge-spin
separation. It is replaced by a Luttinger liquid whose elementary excitations
are collective charge and spin modes, based on the exactly solvable Luttinger
model. I review this model and various solutions with emphasis on bosonization
(and its equivalence to conformal field theory), and its physical properties.
The notion of a Luttinger liquid implies that all gapless 1D systems share
these properties at low energies.
  Chapters 1 and 2 of the article contain an introduction and a discussion of
the breakdown of Fermi liquid theory. Chapter 3 describes in detail the
solution of the Luttinger model both by bosonization and by Green's functions
methods and summarizes the properties of the model, expressed thorugh
correlation functions. The relation to conformal field theory is discussed.
Chapter 4 of the article introduces the notion of a Luttinger liquid. It
describes in much detail the various mappings applied to realistic models of 1D
correlated fermions, onto the Luttinger model, as well as important corrections
to the Luttinger model properties discussed in Ch.3. Chapter 5 describes
situations where the Luttinger liquid is not a stable fixed point, and where
spin or charge gaps open in at least one channel. Chapter 6 discusses
multi-band and multichain problems, in particular the stability of a Luttinger
liquid with respect to interchain hopping. Ch. 7 gives a brief summary of
experimental efforts to uncover Luttinger liquid correlations in quasi-1D
materials.
","[{""version"":""v1"",""created"":""Fri, 29 Sep 1995 09:13:20 GMT""}]","2009-10-28"
"gr-qc/9509055","Joseph David Romano","Joseph D. Romano and Charles G. Torre","Internal Time Formalism for Spacetimes with Two Killing Vectors","36 pages, TeX","Phys.Rev. D53 (1996) 5634-5650","10.1103/PhysRevD.53.5634",,"gr-qc",,"  The Hamiltonian structure of spacetimes with two commuting Killing vector
fields is analyzed for the purpose of addressing the various problems of time
that arise in canonical gravity. Two specific models are considered: (i)
cylindrically symmetric spacetimes, and (ii) toroidally symmetric spacetimes,
which respectively involve open and closed universe boundary conditions. For
each model canonical variables which can be used to identify points of space
and instants of time, {\it i.e.}, internally defined spacetime coordinates, are
identified. To do this it is necessary to extend the usual ADM phase space by a
finite number of degrees of freedom. Canonical transformations are exhibited
that identify each of these models with harmonic maps in the parametrized field
theory formalism. The identifications made between the gravitational models and
harmonic map field theories are completely gauge invariant, that is, no
coordinate conditions are needed. The degree to which the problems of time are
resolved in these models is discussed.
","[{""version"":""v1"",""created"":""Thu, 28 Sep 1995 19:23:42 GMT""}]","2009-10-28"
"hep-ex/9509011","Nicholas Brook","R. Bates et al (University of Glasgow)","Model of charge transport in Semi-Insulating Undoped GaAs microstrip
  detectors","11 pages. 9 postscript figures + 1 postscript preprint logo + 1 LaTeX
  file + 1 non-standard style file. Uses epsfig. Files tarred, gzipped and
  uuencoded into 1 file. Also available at
  http://ppewww.ph.gla.ac.uk/preprints/95/05",,,"GLAS-PPE-95-05","hep-ex",,"  In this paper we present a method for simulating the response of microstrip
detectors to minimum ionizing particles, making use of a program for field
calculation, a program for carrier drift and SPICE for circuit response. A
knowledge of the electric field is essential for any further improvement of the
program. A simple model involving EL2 levels in the metastable state is
proposed to explain some measurements of electric field.
","[{""version"":""v1"",""created"":""Fri, 29 Sep 1995 06:49:34 GMT""}]","2007-05-23"
"hep-ex/9509012","Nicholas Brook","R. Bates et al (RD8 collaboration)","Noise Spectra of SIU-GaAs Pad Detectors With Guard Rings","9 pages. 9 postscript figures + 1 postscript preprint logo + 1 LaTeX
  file + 2 non-standard style files. Uses epsfig. Files tarred, gzipped and
  uuencoded into 1 file. Also available at
  http://ppewww.ph.gla.ac.uk/preprints/95/06",,,"GLAS-PPE-95-06","hep-ex",,"  This paper presents current noise characterization of circular pad Schottky
barrier diodes with guard rings. The diodes were fabricated from undopped
semi-insulating GaAs, SIU-GaAs, at the University of Glasgow. Current noise
spectra were obtained for the detectors for two pad sizes, with reverse bias
applied. Three measurements were also made on one of the detectors under
forward bias. The noise spectra show an excess noise component, with a low
frequency corner at less than 1kHz, and a flat region at higher frequencies.
The magnitude of the white noise is approximately half that expected from shot
noise theory for the given leakage currents. A fall in the magnitude of the
noise was observed at 20kHz which is attributed to the dielectric relaxation
time of the material.
","[{""version"":""v1"",""created"":""Fri, 29 Sep 1995 06:28:06 GMT""}]","2007-05-23"
"hep-lat/9509092","Claude Roiesnel","Claude Roiesnel","On the U(2) Lattice Gauge Theory","15 pages, Postscript file compressed and uuencoded",,,"RR362.0695","hep-lat",,"  We study the U(2) lattice gauge theory in the pure gauge sector using the
simplest action, with determinant and fundamental terms, having the naive
continuum limit of SU(2)$\times$U(1). We determine part of the phase diagram of
the model and find a first-order critical line which goes through the U(1)
critical point. We show how to deduce both the order parameter of the
first-order transition and the U(2) renormalization group flow from the lattice
potential in the determinant and fundamental representations. We give evidence
that a Monte-Carlo simulation of the model is indeed consistent with the
symmetric SU(2)$\times$U(1) continuum limit in the weak coupling pertubative
regime.
","[{""version"":""v1"",""created"":""Thu, 28 Sep 1995 19:57:48 GMT""}]","2009-09-25"
"hep-lat/9509093","Tom Blum","C. Bernard, T. Blum, C. DeTar, Steven Gottlieb, U.M. Heller, J.E.
  Hetrick, L. Karkkainen, K. Rummukainen, R. Sugar, D. Toussaint, and M.
  Wingate","The $N_t=6$ equation of state for two flavor QCD","Contribution to Lattice 95 proceedings (combines talks presented by
  T. Blum and L. Karkkainen). LaTeX, 8 pages, uses espcrc2.sty, postscript
  figures included","Nucl.Phys.Proc.Suppl.47:503-510,1996","10.1016/0920-5632(96)00110-7",,"hep-lat",,"  We improve the calculation of the equation of state for two flavor QCD by
simulating on $N_t=6$ lattices at appropriate values of the couplings for the
deconfinement/chiral symmetry restoration crossover. For $am_q=0.0125$ the
energy density rises rapidly to approximately 1 ${\rm GeV/fm^3}$ just after the
crossover($m_\pi/m_\rho\approx 0.4$ at this point). Comparing with our previous
result for $N_t=4$~\cite{eos}, we find large finite $N_t$ corrections as
expected from free field theory on finite lattices. We also provide formulae
for extracting the speed of sound from the measured quantities.
","[{""version"":""v1"",""created"":""Fri, 29 Sep 1995 04:36:35 GMT""}]","2008-11-26"
"hep-ph/9509408","Hnli","Hsiang-nan Li and Hoi-Lai Yu","PQCD analysis of inclusive semileptonic decays of B mesons","Section 4 on constructing the universal soft function was revised","Phys.Rev.D53:4970-4981,1996","10.1103/PhysRevD.53.4970","CCUTH-95-04, IP-ASTP-14-95","hep-ph",,"  We develop the perturbative QCD formalism for inclusive semileptonic $B$
meson decays, which includes Sudakov suppression from the resummation of large
radiative corrections near the high end of charged lepton energy. Transverse
degrees of freedom of partons are introduced to facilitate the factorization of
$B$ meson decays. Ambiguities appearing in the quark-level analysis are then
avoided. A universal distribution function, arising from the nonperturbative
Fermi motion of the $b$ quark, is constructed according to the heavy quark
effective field theory based operator product expansion, through which the mean
and the width of the distribution function are related to hadronic matrix
elements of local operators. Charged lepton spectra of the $B\to X_u\ell\nu$
decay are presented. We find 50\% suppression near the end point of the
spectrum. The overall suppression on the total decay rate is 8\% for the free
quark model, and is less than 7\% for the use of smooth distribution functions.
With our predictions, it is then possible to extract the
Cabibbo-Kobayashi-Maskawa matrix element $|V_{ub}|$ from experimental data. We
also discuss possible implications of our analysis when confronted with the
rather small observed semileptonic branching ratio in $B$ meson decays.
","[{""version"":""v1"",""created"":""Fri, 29 Sep 1995 01:14:11 GMT""},{""version"":""v2"",""created"":""Tue, 19 Dec 1995 16:08:28 GMT""}]","2014-11-17"
"hep-ph/9509411","John Morris","J.R. Morris","Excitation Fields in a Superconducting Global String","13 pages, revtex, no figures; to appear in Il Nuovo Cimento","NuovoCim.A108:989-1000,1995","10.1007/BF02730850",,"hep-ph astro-ph",,"  A model of a straight superconducting global cosmic string is examined in a
setting wherein the string supports a charge/current pulse described by a
travelling wave along the string. Linearized field equations are obtained for
fluctuations of the scalar and vector fields of the theory, and a set of
approximate particular solutions are found for the case in which the linear
charge density and the current of the string have equal magnitudes. Although
the equations of motion seem to suggest that the scalar and vector excitation
fields are massive inside the string core, the particular solutions show that
they behave as effectively massless fields which propagate at the speed of
light along the string along with the primary charge/current pulse. The effect
of the mass parameter is to modulate the radial profile of the excitation
fields. The vector excitation field generates radial and angular components for
both the electric and magnetic fields, but the particular solutions do not
describe the emission or absorption of electromagnetic radiation from the
string.
","[{""version"":""v1"",""created"":""Thu, 28 Sep 1995 16:38:46 GMT""}]","2008-11-26"
"hep-ph/9509413","Salman Habib","Salman Habib, Yuval Kluger, Emil Mottola, and Juan Pablo Paz","Dissipation and Decoherence in Mean Field Theory","9 pages, LaTeX, figures included","Phys.Rev.Lett. 76 (1996) 4660-4663","10.1103/PhysRevLett.76.4660","LA-UR-95-3393, LBL-37786","hep-ph cond-mat gr-qc hep-th quant-ph",,"  The time evolution of a closed system of mean fields and fluctuations is
Hamiltonian, with the canonical variables parameterizing the general
time-dependent Gaussian density matrix of the system. Yet, the evolution
manifests both quantum decoherence and apparent irreversibility of energy flow
from the coherent mean fields to fluctuating quantum modes. Using scalar QED as
an example we show how this collisionless damping and decoherence may be
understood as the result of {\em dephasing} of the rapidly varying fluctuations
and particle production in the time varying mean field.
","[{""version"":""v1"",""created"":""Thu, 28 Sep 1995 23:15:07 GMT""}]","2009-10-28"
