"nucl-th/9505012","Andres P. Zuker","Andr'es P. Zuker and Marianne Dufour","Separation of the monopole contribution to the nuclear Hamiltonian","20 Pages, RevTeX 3.0",,,,"nucl-th",,"  It is shown that the nuclear Hamiltonian can be separated rigorously as
${\cal H}={\cal H}_m+{\cal H}_M.$ For sufficiently smooth forces the monopole
part ${\cal H}_m $is entirely responsible for Hartree-Fock selfconsistency and
hence saturation properties. The multipole part ${\cal H}_M$ contains the
``residual'' terms - pairing, quadrupole, etc. - that will be analyzed in a
companion paper. We include a review of the basic results often needed when
working with multipole decompositions and average monopole properties.
","[{""version"":""v1"",""created"":""Mon, 8 May 1995 17:33:21 GMT""}]","2007-05-23"
"q-alg/9505009","Jens-UH Petersen","M. Jimbo, R. Kedem, H. Konno, T. Miwa and J.-U. H. Petersen","New Level-0 Action of $U_q(\widehat{sl}_2)$ on Level-1 Modules","24 pages, LaTeX 2.09 or LaTeX2e (and preferably amsfonts).
  Contribution to the Proceedings of the meeting `Statistical Mechanics and
  Quantum Field Theory', USC, May 16-21, 1994. (1st revision: Some technical
  changes regarding the completions and other minor corrections have been
  made.) (new revision: corrections in section 4.2)",,,"RIMS-1016","q-alg hep-th math.QA",,"  A level-0 action of $U_q(\widehat{sl}_2)$ is defined on the sum of level-1
irreducible highest weight modules. With the aid of the affine Hecke algebras,
this action is realized on the basis created by the vertex operators. This is a
$q$-analogue of the Yangian symmetry in conformal field theory.
","[{""version"":""v1"",""created"":""Tue, 9 May 1995 09:15:24 GMT""},{""version"":""v2"",""created"":""Wed, 10 May 1995 05:16:08 GMT""},{""version"":""v3"",""created"":""Mon, 24 Jul 1995 07:27:16 GMT""},{""version"":""v4"",""created"":""Tue, 26 Sep 1995 03:06:31 GMT""}]","2008-02-03"
"quant-ph/9505003","Piotr Garbaczewski","P. Garbaczewski, J. R. Klauder, R. Olkiewicz","The Schroedinger Problem, Levy Processes Noise in Relativistic Quantum
  Mechanics","Latex file","Phys.Rev. E51 (1995) 4114-4131","10.1103/PhysRevE.51.4114",,"quant-ph chem-ph gr-qc hep-th math.PR",,"  The main purpose of the paper is an essentially probabilistic analysis of
relativistic quantum mechanics. It is based on the assumption that whenever
probability distributions arise, there exists a stochastic process that is
either responsible for temporal evolution of a given measure or preserves the
measure in the stationary case. Our departure point is the so-called
Schr\""{o}dinger problem of probabilistic evolution, which provides for a unique
Markov stochastic interpolation between any given pair of boundary probability
densities for a process covering a fixed, finite duration of time, provided we
have decided a priori what kind of primordial dynamical semigroup transition
mechanism is involved. In the nonrelativistic theory, including quantum
mechanics, Feyman-Kac-like kernels are the building blocks for suitable
transition probability densities of the process. In the standard ""free"" case
(Feynman-Kac potential equal to zero) the familiar Wiener noise is recovered.
In the framework of the Schr\""{o}dinger problem, the ""free noise"" can also be
extended to any infinitely divisible probability law, as covered by the
L\'{e}vy-Khintchine formula. Since the relativistic Hamiltonians $|\nabla |$
and $\sqrt {-\triangle +m^2}-m$ are known to generate such laws, we focus on
them for the analysis of probabilistic phenomena, which are shown to be
associated with the relativistic wave (D'Alembert) and matter-wave
(Klein-Gordon) equations, respectively. We show that such stochastic processes
exist and are spatial jump processes. In general, in the presence of external
potentials, they do not share the Markov property, except for stationary
situations. A concrete example of the pseudodifferential Cauchy-Schr\""{o}dinger
evolution is analyzed in detail. The relativistic covariance of related wave
","[{""version"":""v1"",""created"":""Tue, 9 May 1995 13:20:58 GMT""}]","2009-10-28"
