"alg-geom/9505011","Teleman","Ch. Okonek, A. Teleman","Les Invariants de Seiberg-Witten et la Conjecture de Van De Ven","(to appear in Comptes Rendus), 6 pages, LATEX",,,,"alg-geom math.AG",,"  We give a short proof for the fact that rationality of complex surfaces is a
property depending only on the differential structure. Our proof uses the new
Seiberg-Witten invariants.
","[{""version"":""v1"",""created"":""Mon, 8 May 1995 19:02:41 GMT""}]","2008-02-03"
"alg-geom/9505012","Teleman","Ch. Okonek, and A. Teleman","The Coupled Seiberg-Witten Equations, vortices, and Moduli spaces of
  stable pairs","latex",,,,"alg-geom math.AG",,"  We introduce coupled Seiberg-Witten equations, and we prove, using a
generalized vortex equation, that, for Kaehler surfaces, the moduli space of
solutions of these equations can be identified with a moduli space of
holomorphic stable pairs. In the rank 1 case, one recovers Witten's result
identifying the space of irreducible monopoles with a moduli space of divisors.
As application, we give a short proof of the fact that a rational surface
cannot be diffeomorphic to a minimal surface of general type.
","[{""version"":""v1"",""created"":""Mon, 8 May 1995 19:30:12 GMT""}]","2008-02-03"
"alg-geom/9505013","Teleman","Andrei Teleman and Christian Okonek","Seiberg-Witten Invariants and the Van De Ven Conjecture","Duke preprint, LATEX",,,,"alg-geom math.AG",,"  The purpose of this note is to give a short, selfcontained proof of the
following result: A complex surface which is diffeomeorphic to a rational
surface is rational.
","[{""version"":""v1"",""created"":""Mon, 8 May 1995 19:46:17 GMT""},{""version"":""v2"",""created"":""Wed, 10 May 1995 15:48:24 GMT""}]","2008-02-03"
"alg-geom/9505014","Teleman","Andrei Teleman and Christian Okonek","Seiberg-Witten Invariants and Rationality of Complex Surfaces","Duke preprint, LaTeX",,,,"alg-geom math.AG",,"  The purpose of this paper is: 1) to explain the Seiberg-Witten invariants, 2)
to show that - on a K\""ahler surface - the solutions of the monopole equations
can be interpreted as algebraic objects, namely effective divisors, 3) to give
- as an application - a short selfcontained proof for the fact that rationality
of complex surfaces is a ${\cal C}^{\infty}$-property.
","[{""version"":""v1"",""created"":""Mon, 8 May 1995 19:55:24 GMT""},{""version"":""v2"",""created"":""Wed, 10 May 1995 15:53:39 GMT""}]","2008-02-03"
"astro-ph/9505038","Rick Watkins","Richard Watkins (Michigan) and Hume A. Feldman (Princeton)","Interpreting New Data on Large Scale Bulk Flows","13 pages, 2 figures included in a self-unpacking uudecoded gzipped
  postscript file. We changed some of the power spectra analyzed and expanded
  the discussion. The postscript file is available at
  http://pupgga.princeton.edu/disk20/anonymous/feldman/bflows.ps","Astrophys.J. 453 (1995) L73","10.1086/309746","PU--P--GG--95-17, accepted to Astrophysical Journal Letters","astro-ph",,"  We study the implications of a recent estimate of the bulk flow of a sample
of galaxies containing supernovae type Ia by Riess, Press, and Kirshner. We
find that their results are quite consistent with power spectra from several
currently popular models of structure formation, but that the sample is as yet
too sparse to put significant constraints on the power spectrum. We compare
this new result with that of Lauer and Postman, with which there is apparent
disagreement. We find that for the power spectra we consider, the difference in
window functions between the two samples used for the measurements results in a
low level of expected correlation between the estimated bulk flows. We
calculate a $\chi^2$ for the two measurements taken together and find that
their lack of agreement tends to disfavor spectra with excessive power on large
scales, but not at a level sufficient to rule them out. A sample consisting of
other SN type Ia's found in the Asiago catalog is used to study how the
sensitivity of the method used by RPK will improve with increasing sample size.
We conclude that the local group motion should be able to be determined with a
sample of $\sim 100$ SN Ia light curve shapes.
","[{""version"":""v1"",""created"":""Mon, 8 May 1995 21:40:25 GMT""},{""version"":""v2"",""created"":""Mon, 21 Aug 1995 12:12:25 GMT""}]","2009-10-28"
"astro-ph/9505039","Evalyn Gates","E. Gates, G. Gyuk, M. Turner","The Local Halo Density","7 pages, 2 figures. uuencoded postscript file with figures; final
  version (minor revisions) to appear in Astrophysical Journal Letters","Astrophys.J.449:L123-L126,1995","10.1086/309652","FERMILAB-Pub-95/090-A","astro-ph hep-ph",,"  For almost twenty years models of the Galaxy have included a dark halo
responsible for supporting a substantial fraction of the local rotation
velocity and a flat rotation curve at large distances. Estimates of the local
halo density range from $2\times 10^{-25}\gcmm3$ to $10\times 10^{-25}\gcmm3$.
By careful modeling of the Galaxy, taking account of the evidence that dark
halos are flattened and recent microlensing data, we arrive at a more
quantitative estimate, $9.2^{+3.8}_{-3.1}\times 10^{-25}\gcmm3$. Microlensing
toward the LMC indicates that only a small fraction, less than about 30\%, can
be in the form of MACHOs, consistent with the idea that most of the halo
consists of cold dark matter particles.
","[{""version"":""v1"",""created"":""Mon, 8 May 1995 22:16:41 GMT""},{""version"":""v2"",""created"":""Mon, 19 Jun 1995 19:26:29 GMT""}]","2011-09-29"
"astro-ph/9505040","David Alves","David R. Alves and Kem H. Cook","Ground-based Discovery of Cepheids and Miras in M101","28 pages, compressed uuencoded file contains 2 .ps files; finding
  chart not included, available via anonymous ftp at
  ftp://igpp.llnl.gov/pub/alves/m101_fig3.ps ; accepted for publication in AJ",,"10.1086/117506",,"astro-ph",,"  We have identified 4 Cepheids and 5 Miras using KPNO 4m BVRI images of an
outer field in M101. The Cepheid and Mira periods range from 30 to 60 days and
350 to 800 days, respectively. We derive independent Cepheid and Mira distance
moduli that agree within experimental uncertainties. We find a true distance
modulus of 29.08 +- 0.13 mag.
","[{""version"":""v1"",""created"":""Mon, 8 May 1995 22:46:53 GMT""}]","2009-10-28"
"astro-ph/9505041",,"M. Gasperini, M. Giovannini and G. Veneziano","Electromagnetic Origin of the CMB Anisotropy in String Cosmology","11 pages, LATEX","Phys.Rev.D52:6651-6655,1995","10.1103/PhysRevD.52.R6651","CERN-TH/95-102","astro-ph gr-qc hep-ph hep-th",,"  In the inflationary scenarios suggested by string theory, the vacuum
fluctuations of the electromagnetic field can be amplified by the
time-evolution of the dilaton background, and can grow large enough to explain
both the origin of the cosmic magnetic fields and of the observed CMB
anisotropy. The normalization of the perturbation spectrum is fixed, and
implies a relation between the perturbation amplitude at the COBE scale and the
spectral index $n$. Working within a generic two-parameter family of
backgrounds, a large scale anisotropy $\Delta T/T\simeq 10^{-5}$ is found to
correspond to a spectral index in the range $n\simeq 1.11 - 1.17$.
","[{""version"":""v1"",""created"":""Tue, 9 May 1995 08:16:11 GMT""}]","2010-01-06"
"chao-dyn/9505002",,"Daniel Provost (Laurentian University)","Signatures of Classical Periodic Orbits on a Smooth Quantum System","12 pages, uuencoded postscript file (1526 kb)",,"10.1103/PhysRevE.51.5396",,"chao-dyn nlin.CD",,"  Gutzwiller's trace formula and Bogomolny's formula are applied to a
non--specific, non--scalable Hamiltonian system, a two--dimensional anharmonic
oscillator. These semiclassical theories reproduce well the exact quantal
results over a large spatial and energy range.
","[{""version"":""v1"",""created"":""Mon, 8 May 1995 18:41:38 GMT""},{""version"":""v2"",""created"":""Tue, 9 May 1995 14:22:17 GMT""}]","2009-10-28"
"chao-dyn/9505003","Piotr Garbaczewski","P. Garbaczewski, J. R. Klauder, R. Olkiewicz","The Schroedinger Problem, Levy Processes Noise in Relativistic Quantum
  Mechanics","Latex file",,,,"chao-dyn nlin.CD",,"  The main purpose of the paper is an essentially probabilistic analysis of
relativistic quantum mechanics. It is based on the assumption that whenever
probability distributions arise, there exists a stochastic process that is
either responsible for temporal evolution of a given measure or preserves the
measure in the stationary case. Our departure point is the so-called
Schr\""{o}dinger problem of probabilistic evolution, which provides for a unique
Markov stochastic interpolation between any given pair of boundary probability
densities for a process covering a fixed, finite duration of time, provided we
have decided a priori what kind of primordial dynamical semigroup transition
mechanism is involved. In the nonrelativistic theory, including quantum
mechanics, Feyman-Kac-like kernels are the building blocks for suitable
transition probability densities of the process. In the standard ""free"" case
(Feynman-Kac potential equal to zero) the familiar Wiener noise is recovered.
In the framework of the Schr\""{o}dinger problem, the ""free noise"" can also be
extended to any infinitely divisible probability law, as covered by the
L\'{e}vy-Khintchine formula. Since the relativistic Hamiltonians $|\nabla |$
","[{""version"":""v1"",""created"":""Tue, 9 May 1995 13:21:29 GMT""}]","2008-02-03"
"chao-dyn/9505004","Robert Mettin","Robert Mettin (IAP, TH Darmstadt, Germany), and Thomas Kurz
  (3.Phys.Inst., Universit\""at G\""ottingen, Germany)","Optimized Periodic Control of Chaotic Systems","12 pages, uuencoded gzip-compressed postscript file",,"10.1016/0375-9601(95)00644-I",,"chao-dyn nlin.CD",,"  In this work, we demonstrate the open-loop control of chaotic systems by
means of optimized periodic signals. The use of such signals enables us to
reduce control power significantly in comparison to simple harmonic
perturbations. It is found that the stabilized periodic dynamics can be changed
by small, specific alterations of the control signal. Thus, low power switching
between different periodic states can be achieved without feedback. The
robustness of the proposed control method against noise is discussed.
","[{""version"":""v1"",""created"":""Tue, 9 May 1995 14:09:49 GMT""}]","2009-10-28"
"cmp-lg/9505018","Carl de Marcken","Carl de Marcken (MIT AI Laboratory)","Acquiring a Lexicon from Unsegmented Speech","Postscript, 3-pages, to appear in ACL '95 Student Session",,,,"cmp-lg cs.CL",,"  We present work-in-progress on the machine acquisition of a lexicon from
sentences that are each an unsegmented phone sequence paired with a primitive
representation of meaning. A simple exploratory algorithm is described, along
with the direction of current work and a discussion of the relevance of the
problem for child language acquisition and computer speech recognition.
","[{""version"":""v1"",""created"":""Mon, 8 May 1995 17:30:02 GMT""}]","2008-02-03"
"cmp-lg/9505019","Wlodek Zadrozny","Wlodek Zadrozny (IBM Research, T. J. Watson Research Center)","Measuring semantic complexity","11 pp. Latex.. To appear in Proc. BISFAI'95, The Fourth Bar-Ilan
  Symposium on Foundations of Artificial Intelligence, June 20-22, 1995,
  Ramat-Gan and Jerusalem, Israel. Correspondence to wlodz@watson.ibm.com",,,,"cmp-lg cs.CL",,"  We define {\em semantic complexity} using a new concept of {\em meaning
automata}. We measure the semantic complexity of understanding of prepositional
phrases, of an ""in depth understanding system"", and of a natural language
interface to an on-line calendar. We argue that it is possible to measure some
semantic complexities of natural language processing systems before building
them, and that systems that exhibit relatively complex behavior can be built
from semantically simple components.
","[{""version"":""v1"",""created"":""Mon, 8 May 1995 18:27:04 GMT""}]","2008-02-03"
"cmp-lg/9505020","Stephen Soderland","Stephen Soderland, David Fisher, Jonathan Aseltine, Wendy Lehnert
  (University of Massachusetts)","CRYSTAL: Inducing a Conceptual Dictionary","6 pages, Postscript, IJCAI-95
  http://ciir.cs.umass.edu/info/psfiles/tepubs/tepubs.html",,,,"cmp-lg cs.CL",,"  One of the central knowledge sources of an information extraction system is a
dictionary of linguistic patterns that can be used to identify the conceptual
content of a text. This paper describes CRYSTAL, a system which automatically
induces a dictionary of ""concept-node definitions"" sufficient to identify
relevant information from a training corpus. Each of these concept-node
definitions is generalized as far as possible without producing errors, so that
a minimum number of dictionary entries cover the positive training instances.
Because it tests the accuracy of each proposed definition, CRYSTAL can often
surpass human intuitions in creating reliable extraction rules.
","[{""version"":""v1"",""created"":""Tue, 9 May 1995 14:42:41 GMT""}]","2008-02-03"
"cond-mat/9505029","Antonio Castro Neto","J. M. P. Carmelo, A. H. Castro Neto and N. M. R. Peres","Electrons, pseudoparticles, and quasiparticles in one-dimensional
  interacting electronic systems","11 pages, RevTeX, preprint ITP",,,,"cond-mat",,"  We find the singular transformation between the electron operator and the
pseudoparticle operators for the Hubbard chain. We generalize the concept of
quasiparticle to one-dimensional electronic systems which in 1D refers to
many-pseudoparticle objects. We obtain explicit results for the electron
renormalization factor, self energy, and vertex functions at the Fermi points.
We also discuss the possible connection of our results to higher dimensions and
explore the possibilities of instabilities in the interacting problem such as
the formation of Cooper pairs.
","[{""version"":""v1"",""created"":""Mon, 8 May 1995 16:00:06 GMT""}]","2007-05-23"
"cond-mat/9505030","Boldizsar Janko","Boldizsar Janko and Vinay Ambegaokar","Parity Fluctuations Between Coulomb Blockaded Superconducting Islands","4 pages, self-unpacking uuencoded gz-compressed postscript file with
  3 figures included; also available at
  http://www.lassp.cornell.edu/janko/publications.html",,"10.1103/PhysRevLett.75.1154","Cornell Materials Science Center preprint # 7893","cond-mat supr-con",,"  We find that if two superconducting islands of different number parity are
linked by a tunnel junction the unpaired electron in the odd island has a
tendency to tunnel into the even island. This process leads to fluctuations in
time of the number parity of each island, giving rise to a random telegraph
noise spectrum with a characteristic frequency that has an unusual temperature
dependence. This new phenomenon should be observable in a Cooper-pair pump and
similar single-electron tunneling devices.
","[{""version"":""v1"",""created"":""Mon, 8 May 1995 17:15:08 GMT""}]","2009-10-28"
"cond-mat/9505031","Paul Fendley","P. Fendley, A.W.W. Ludwig and H. Saleur","Exact non-equilibrium DC shot noise in Luttinger liquids and fractional
  quantum Hall devices","4 pages in revtex two-column, one figure.","Phys. Rev. Lett. 75 (1995) 2196","10.1103/PhysRevLett.75.2196","USC-95/011","cond-mat",,"  A point contact in a Luttinger liquid couples the left- and right-moving
channels, producing shot noise. We calculate exactly the DC shot noise at zero
temperature in the out-of-equilibrium steady state where current is flowing.
Integrability of the interaction ensures the existence of a quasiparticle basis
where quasiparticles scatter ``one by one'' off the point contact. This enables
us to apply a direct generalization of the Landauer approach to shot noise to
this interacting model. We find a simple relation of the noise to the current
and the differential conductance. Our results should be experimentally-testable
in a fractional quantum Hall effect device, providing a clear signal of the
fractional charge of the Laughlin quasiparticles.
","[{""version"":""v1"",""created"":""Mon, 8 May 1995 17:45:04 GMT""}]","2009-10-28"
"cond-mat/9505032","Alexander V. Balatsky","S.I.Matveenko, A.R.Bishop and A.Balatsky","Superconductivity Fluctuations in a One-dimensional Two Band
  Electron-Phonon Model with Strong Repulsive Interactions","1 figure uufile instead of ps file is attached at the bottom. No
  other changes has been made.",,,,"cond-mat",,"  We study a one-dimensional, two band model with short range electron-electron
repulsions (onsite $U$ and nearest-neighbour $V$ terms) and electron-phonon
coupling. We show that there is a region of $U$,$V$ and band filling in which
singlet superconductivity fluctuations are dominant. This region is absent
without electron-phonon interactions and includes large values of $U$,$V$.
","[{""version"":""v1"",""created"":""Mon, 8 May 1995 18:16:53 GMT""},{""version"":""v2"",""created"":""Tue, 9 May 1995 16:46:24 GMT""}]","2008-02-03"
"cond-mat/9505033","Yue Yu","Yong-Shi Wu and Yue Yu","Bosonization of One-Dimensional Exclusons and Characterization of
  Luttinger Liquids","13 pages, revtex",,"10.1103/PhysRevLett.75.890",,"cond-mat hep-th",,"  We achieve a bosonization of one-dimensional ideal gas of exclusion
statistics $\lambda$ at low temperatures, resulting in a new variant of $c=1$
conformal field theory with compactified radius $R=\sqrt{1/\lambda}$. These
ideal excluson gases exactly reproduce the low-$T$ critical properties of
Luttinger liquids, so they can be used to characterize the fixed points of the
latter. Generalized ideal gases with mutual statistics and non-ideal gases with
Luttinger-type interactions have also similar behavior, controlled by an
effective statistics varying in a fixed-point line.
","[{""version"":""v1"",""created"":""Mon, 8 May 1995 22:00:08 GMT""}]","2009-10-28"
"cond-mat/9505034","Nobuo Furukawa","Nobuo Furukawa (ISSP, Univ. Tokyo)","Magnetoresistance of the Double-Exchange Model in Infinite Dimension","8 pages, LaTeX","J. Phys. Soc. Jpn. 64 (1995) 2734","10.1143/JPSJ.64.2734",,"cond-mat",,"  Double-exchange model in infinite dimension is studied as the strong Hund's
coupling limit $J\to\infty$ of the Kondo lattice model. Several quantities such
as Green's function and the d.c.\ conductivity are calculated in analytical
forms. Magnetoresistance in lightly doped (La,Sr)MnO$_3$ is reproduced very
well.
","[{""version"":""v1"",""created"":""Tue, 9 May 1995 06:00:00 GMT""}]","2009-10-28"
"cond-mat/9505035","Konstantin Matveev","A. Furusaki and K. A. Matveev (MIT)","Coulomb blockade oscillations of conductance in the regime of strong
  tunneling","Revtex, 8 pages, 2 figures",,"10.1103/PhysRevLett.75.709",,"cond-mat",,"  We study the transport through a quantum dot coupled to two leads by
single-mode point contacts. The linear conductance is calculated analytically
as a function of a gate voltage and temperature T in the case when transmission
coefficients of the contacts are close to unity. As a function of the gate
voltage, the conductance shows Coulomb blockade oscillations. At low
temperatures, the off-resonance conductance vanishes as T^2, in agreement with
the theory of inelastic co-tunneling. Near a resonance, the low-energy physics
is governed by a multi-channel Kondo fixed point.
","[{""version"":""v1"",""created"":""Tue, 9 May 1995 06:09:06 GMT""}]","2009-10-28"
"cond-mat/9505036","Deepak Dhar","M. K. Hari Menon and Deepak Dhar","The Irreducible String and an Infinity of Additional Constants of Motion
  in a Deposition-Evaporation Model on a Line","Some minor errors in the first version has been corrected","J. Phys. A28 (1995) 6517.","10.1088/0305-4470/28/23/008","TIFR/TH/95/22","cond-mat",,"  We study a model of stochastic deposition-evaporation with recombination, of
three species of dimers on a line. This model is a generalization of the model
recently introduced by Barma {\it et. al.} (1993 {\it Phys. Rev. Lett.} {\bf
70} 1033) to $q\ge 3$ states per site. It has an infinite number of constants
of motion, in addition to the infinity of conservation laws of the original
model which are encoded as the conservation of the irreducible string. We
determine the number of dynamically disconnected sectors and their sizes in
this model exactly. Using the additional symmetry we construct a class of exact
eigenvectors of the stochastic matrix. The autocorrelation function decays with
different powers of $t$ in different sectors. We find that the spatial
correlation function has an algebraic decay with exponent 3/2, in the sector
corresponding to the initial state in which all sites are in the same state.
The dynamical exponent is nontrivial in this sector, and we estimate it
numerically by exact diagonalization of the stochastic matrix for small sizes.
We find that in this case $z=2.39\pm0.05$.
","[{""version"":""v1"",""created"":""Tue, 9 May 1995 14:02:23 GMT""},{""version"":""v2"",""created"":""Sat, 13 May 1995 07:46:08 GMT""}]","2009-10-28"
"cond-mat/9505037",,"T. Blum and A. J. McKane (University of Manchester)","Variational Schemes in the Fokker-Planck Equation","24 pages, revtex, 2 tables, figure available on request",,"10.1088/0305-4470/29/9/003","MAN-TH-95-17","cond-mat",,"  We investigate variational methods for finding approximate solutions to the
Fokker-Planck equation, especially in cases lacking detailed balance. These
schemes fall into two classes: those in which a Hermitian operator is
constructed from the (non-Hermitian) Fokker-Planck operator, and those which
are based on soluble approximations to this operator. The various approaches
are first tested on a simple quantum-mechanical problem and then applied to a
toy Fokker-Planck equation. The problem of a particle moving in a potential and
subject to external non-white noise is then investigated using the formalism
developed earlier on in the paper.
","[{""version"":""v1"",""created"":""Tue, 9 May 1995 11:45:54 GMT""},{""version"":""v2"",""created"":""Wed, 10 May 1995 08:17:32 GMT""}]","2009-10-28"
"cond-mat/9505038",,"T. Blum and A. J. McKane (University of Manchester)","Improved Perturbation Theory for the Kardar-Parisi-Zhang Equation","12 pages, revtex, 1 table",,"10.1103/PhysRevE.52.4741","MAN-TH-95-18","cond-mat",,"  We apply a number of schemes which variationally improve perturbation theory
for the Kardar-Parisi-Zhang equation in order to extract estimates for the
dynamic exponent z. The results for the various schemes show the same broad
features, giving closer agreement with numerical simulations in low dimensions
than self-consistent methods. They do, however, continue to predict that z=2 in
some critical dimension d_c in disagreement with the findings of simulations.
","[{""version"":""v1"",""created"":""Tue, 9 May 1995 11:48:40 GMT""}]","2009-10-28"
"funct-an/9505001",,"Michael Frank (Univ. Leipzig, Math. Inst., D-04109 Leipzig)","Isomorphisms of Hilbert C*-Modules and $*$-Isomorphisms of Related
  Operator C*-Algebras","5 pages, LaTeX file","Math. Scand. , 80(1997), 313-319",,,"funct-an math.OA",,"  Let $\cal M$ be a Banach C*-module over a C*-algebra $A$ carrying two
$A$-valued inner products $< .,. >_1$, $<.,. >_2$ which induce equivalent to
the given one norms on $\cal M$. Then the appropriate unital C*-algebras of
adjointable bounded $A$-linear operators on the Hilbert $A$-modules $\{ {\cal
M}, < .,. >_1 \}$ and $\{ {\cal M}, < .,. >_2 \}$ are shown to be
$*$-isomorphic if and only if there exists a bounded $A$-linear isomorphism $S$
of these two Hilbert $A$-modules satisfying the identity $< .,. >_2 \equiv <
S(.),S(.) >_1$. This result extends other equivalent descriptions due to
L.~G.~Brown, H.~Lin and E.~C.~Lance. An example of two non-isomorphic Hilbert
C*-modules with $*$-isomorphic C*-algebras of ''compact''/adjointable bounded
module operators is indicated.
","[{""version"":""v1"",""created"":""Tue, 9 May 1995 08:32:08 GMT""}]","2008-02-03"
"gr-qc/9505009","Atsushi Higuchi","R. Camporesi and A. Higuchi","On the eigenfunctions of the Dirac operator on spheres and real
  hyperbolic spaces","45 pages, latex, no figures","J.Geom.Phys. 20 (1996) 1-18","10.1016/0393-0440(95)00042-9","BUTP-95/12","gr-qc",,"  The eigenfunctions of the Dirac operator on spheres and real hyperbolic
spaces of arbitrary dimension are computed by separating variables in geodesic
polar coordinates. These eigenfunctions are used to derive the heat kernel of
the iterated Dirac operator on these spaces. They are then studied as cross
sections of homogeneous vector bundles, and a group-theoretic derivation of the
spinor spherical functions and heat kernel is given based on Harish-Chandra's
formula for the radial part of the Casimir operator.
","[{""version"":""v1"",""created"":""Tue, 9 May 1995 09:07:00 GMT""}]","2009-10-28"
