"hep-th/9505173","Friedemann Brandt","Glenn Barnich, Friedemann Brandt and Marc Henneaux","Local BRST cohomology in Einstein--Yang--Mills theory","68 pages, latex, no figures Misprint corrected in list of dimensions
  where topological anomalies can occur (no such anomaly in 11 dimensions)","Nucl.Phys. B455 (1995) 357-408","10.1016/0550-3213(95)00471-4","KUL-TF-95/16, ULB-TH-95/07","hep-th gr-qc",,"  We analyse in detail the local BRST cohomology in Einstein-Yang-Mills theory
using the antifield formalism. We do not restrict the Lagrangian to be the sum
of the standard Hilbert and Yang-Mills Lagrangians, but allow for more general
diffeomorphism and gauge invariant actions. The analysis is carried out in all
spacetime dimensions larger than 2 and for all ghost numbers. This covers the
classification of all candidate anomalies, of all consistent deformations of
the action, as well as the computation of the (equivariant) characteristic
cohomology, i.e. the cohomology of the spacetime exterior derivative in the
space of (gauge invariant) local differential forms modulo forms that vanish
on-shell. We show in particular that for a semi-simple Yang-Mills gauge group
the antifield dependence can be entirely removed both from the consistent
deformations of the Lagrangian and from the candidate anomalies. Thus, the
allowed deformations of the action necessarily preserve the gauge structure,
while the only candidate anomalies are those provided by previous works not
dealing with antifields, and by ``topological"" candidate anomalies which are
present only in special spacetime dimensions (6,9,10,13,...). This result no
longer holds in presence of abelian factors where new candidate anomalies and
deformations of the action can be constructed out of the conserved Noether
currents (if any). The Noether currents themselves are shown to be
covariantizable, with a few exceptions discussed as well.
","[{""version"":""v1"",""created"":""Mon, 29 May 1995 12:18:21 GMT""},{""version"":""v2"",""created"":""Mon, 12 Jun 1995 08:37:00 GMT""}]","2015-06-26"
"hep-th/9505174","Walter Troost","F. De Jonghe, P. Termonia, W. Troost and S. Vandoren","An alternative BRST operator for topological Landau-Ginzburg models","9 pages, LaTex. 2 references added. elaboration of previous footnote
  at the end of section 2","Phys.Lett. B358 (1995) 246-252","10.1016/0370-2693(95)01008-E","KUL-TF-95/14 and NIKHEF-95/025","hep-th",,"  We propose a new BRST operator for the B-twist of $N=2$ Landau-Ginzburg (LG)
models. It solves the problem of the fractional ghost numbers of Vafa's old
BRST operator and shows how the model is obtained by gauge fixing a zero
action. An essential role is played by the anti-BRST operator,which is given by
one of the supersymmetries of the $N=2$ algebra. Its presence is needed in
proving that the model is indeed a topological field theory. The space of
physical observables, defined by taking the anti-BRST cohomology in the BRST
cohomology groups, is unchanged.
","[{""version"":""v1"",""created"":""Mon, 29 May 1995 15:03:01 GMT""},{""version"":""v2"",""created"":""Thu, 27 Jul 1995 14:10:52 GMT""}]","2009-10-28"
"nucl-th/9505040",,"R.A. Arndt, I.I. Strakovsky, R.L. Workman, and M.M. Pavan","Updated analysis of $\pi$N elastic scattering data to 2.1~GeV: The
  Baryon Spectrum","25 pages of text plus 5 figures. Revtex file and postscript figures
  available via anonymous FTP at ftp://clsaid.phys.vt.edu/pub/pin","Phys.Rev.C52:2120-2130,1995","10.1103/PhysRevC.52.2120","VPI-CAPS-95/2","nucl-th",,"  We present the results of energy-dependent and single-energy partial-wave
analyses of $\pi$N elastic scattering data with laboratory kinetic energies
below 2.1~GeV. Resonance structures have been extracted using Breit-Wigner
fits, speed plots, and a complex plane mapping of the associated poles and
zeroes. This is the first set of resonance parameters from a VPI analysis
constrained by fixed-t dispersion relations. We have searched our solutions for
structures which may have been missed in our previous analyses, finding
candidates in the $S_{11}$ and $F_{15}$ partial-wave amplitudes. Our results
are compared with those found by the Karlsruhe, Carnegie-Mellon$-$Berkeley, and
Kent State groups.
","[{""version"":""v1"",""created"":""Mon, 29 May 1995 14:23:41 GMT""}]","2008-11-26"
"nucl-th/9505041","Munsi Mustafa","M. G. Mustafa and A. Ansari","Temperature dependent Nucleon Mass and entropy bound inequality","Latex file(3 figures obtainable from first author)",,,"IP/BBSR/95-47","nucl-th",,"  Mass of a baryon as a function of temperature is calculated using
colour-singlet partition function for massless quarks (with two flavours) and
abelian gluons confined in a bag with a temperature dependent bag pressure
constant $B(T)$. The non-perturbative aspect of QCD interaction is included
through colour-singlet restriction on quark-gluon partition function in a
phenomenological way. The entropy bound inequality $ S/E \ \leq \ 2\pi R/\hbar
c $, where $S, \ E $ and $R$ are entropy, energy and radius, respectively of
the enclosed system with $\hbar c \ = \ 197.331 $ MeVfm, is found to be
consistent with the equilibrium solutions of the baryon mass upto a temperature
$T_E$. There is a region of temperature $T_E < T < T_C$ ($T_C$ is critical
temperature for quark-gluon plasma formation) in which no admissible
equilibrium states exist for the bag. We say that the system expriences a phase
jump from hadron to quark-gluon plasma through thermodynamic non-equlibrium
processes.
","[{""version"":""v1"",""created"":""Mon, 29 May 1995 04:45:32 GMT""}]","2007-05-23"
"nucl-th/9505044","Munsi Mustafa","M. G. Mustafa and A. Ansari","Strangelets at finite temperature","Revtex file+4 figures(ps files)","Phys.Rev.D53:5136,1996; Erratum-ibid.D54:4694,1996;
  Phys.Rev.D54:4694,1996","10.1103/PhysRevD.53.5136 10.1103/PhysRevD.54.4694","IP/BBSR/95-46","nucl-th",,"  Within the MIT bag model picture of QCD, we have studied the stability of
finite size strangelets at finite temperature with baryon number $A \leq 100$.
The light quarks $u$ and $d$ are considered massless while mass of the $s$
quark is taken as $150$ MeV. Using discrete eigen energies of the
non-interacting quarks in the bag, grand canonical partition function is
constructed and then the free energy is minimized with respect to the bag
radius. In the $T\rightarrow 0$ limit clear shell structures are found which
persist upto about $T=10$ MeV. Infact for $A=6$ the shell structure disappears
only at $T > 20$ MeV.
","[{""version"":""v1"",""created"":""Mon, 29 May 1995 04:47:57 GMT""}]","2014-11-18"
