"adap-org/9505003","Stefan Boettcher","Stefan Boettcher and Maya Paczuski (Brookhaven National Laboratory)","Exact Results for Spatio-Temporal Correlations in a Self-Organized
  Critical Model of Punctuated Equilibrium","4 pages, postscript, uuencoded, (two ps-figures included) Final
  Version, to appear in PRL","Physical Review Letters 76, 348 (1996)","10.1103/PhysRevLett.76.348",,"adap-org cond-mat nlin.AO",,"  We introduce a self-organized critical model of punctuated equilibrium with
many internal degrees of freedom ($M$) per site. We find exact solutions for
$M\rightarrow \infty$ of cascade equations describing avalanche dynamics in the
steady state. This proves the existence of simple power laws with critical
exponents that verify general scaling relations for nonequilibrium phenomena.
Punctuated equilibrium is described by a Devil's staircase with a
characteristic exponent, $\tau_{FIRST}=2-d/4$ where $d$ is the spatial
dimension.
","[{""version"":""v1"",""created"":""Sun, 28 May 1995 21:56:07 GMT""},{""version"":""v2"",""created"":""Fri, 8 Dec 1995 05:05:46 GMT""}]","2009-10-28"
"adap-org/9505004","Kengo Ichiki","Kengo Ichiki (Dept. of Physics, Tohoku Univ.,Sendai 980-77, Japan)","Hydrodynamic effects in density waves of granular flows","REV-TeX file with 2 Postscript figures; submitted to Phys. Rev. E.",,,,"adap-org nlin.AO",,"  Granular flows in a narrow pipe are studied numerically by the model taking
account of hydrodynamic effects of fluid surrounding particles. In the
simulations density waves are observed over the wide range of the Stokes
number, which represents the inertial effect of particles. The mechanisms of
formation of the density waves are considered and two types of density waves,
which are observed in the systems with zero and finite Stokes numbers, are
presented. Power spectra of density waves obtained from the simulations with
non-zero Stokes number show $1/f^\alpha$ power law which is similar to that in
experiments.
","[{""version"":""v1"",""created"":""Mon, 29 May 1995 11:09:01 GMT""},{""version"":""v2"",""created"":""Tue, 30 May 1995 09:58:58 GMT""}]","2012-08-29"
"alg-geom/9505030","Ziv Ran","Ziv Ran","How to tell you're hearing a Calabi-Yau: Universal variations of Hodge
  structure and local Schottky relations for Calabi-Yau manifolds","amstex2.1",,,,"alg-geom math.AG",,"  A revised version with a number of corrections and refinements.
","[{""version"":""v1"",""created"":""Sun, 28 May 1995 21:29:11 GMT""},{""version"":""v2"",""created"":""Wed, 27 Sep 1995 14:30:03 GMT""}]","2008-02-03"
"alg-geom/9505031",,"Atanas Iliev","Minimal sections of conic bundles","Duke preprint, 29 pages. LaTex 2.09",,,,"alg-geom math.AG",,"  Let the threefold X be a general smooth conic bundle over the projective
plane P(2), and let (J(X), Theta) be the intermediate jacobian of X. In this
paper we prove the existence of two natural families C(+) and C(-) of curves on
X, such that the Abel-Jacobi map F sends one of these families onto a copy of
the theta divisor (Theta), and the other -- onto the jacobian J(X). The general
curve C of any of these two families is a section of the conic bundle
projection, and our approach relates such C to a maximal subbundle of a rank 2
vector bundle E(C) on C, or -- to a minimal section of the ruled surface
P(E(C)). The families C(+) and C(-) correspond to the two possible types of
versal deformations of ruled surfaces over curves of fixed genus g(C). As an
application, we find parameterizations of J(X) and (Theta) for certain classes
of Fano threefolds, and study the sets Sing(Theta) of the singularities of
(Theta).
","[{""version"":""v1"",""created"":""Mon, 29 May 1995 10:28:48 GMT""}]","2008-02-03"
"alg-geom/9505032",,"Atanas Iliev","The fiber of the Griffiths map for the non-hyperelliptic Fano threefolds
  of genus 6","Duke preprint, 52 pages, LaTex 2.09",,,,"alg-geom math.AG",,"  Among smooth non-rational Fano 3-folds, the non-hyperelliptic Fano 3-fold
X(10) of genus 6 has the unique property to admit a non-trivial orbit of
birationally isomorphic 3-folds, inside its moduli space. Here we prove that
these orbits are, in fact, the same as the fibers of the Griffiths period map
for X(10). This leads upto the main result of the paper: The general fiber of
the period map for X(10) is a union of two irreducible families of 3-folds:
F(1) + F(2), each F(i) -- isomorphic to the Fano surface of conics of any of
its elements. As an application, we give a negative answer to a Tjurin's
conjecture: The general X(10) is birational to a quartic double solid.
","[{""version"":""v1"",""created"":""Mon, 29 May 1995 10:32:40 GMT""}]","2008-02-03"
"alg-geom/9505033","Bruce Hunt","Bruce Hunt","Symmetric subgroups of rational groups of hermitian type","29 pages (11 pt), ps-file also available at the home page
  http://www.mathematik.uni-kl.de/~wwwagag, preprints. LaTeX v2.09",,,,"alg-geom math.AG",,"  A rational group of hermitian type is an algebraic group over the rational
numbers whose symmetric space is a hermitian symmetric space. We assume such a
group $G$ to be given, which we assume is isotropic. Then, for any rational
parabolic $P$ in the group $G$, we find a reductive rational subgroup $N$
closely related with $P$ by a relation we call incidence. This has implications
to the geometry of arithmetic quotients of the symmetric space by arithmetic
subgroups of $G$, in the sense that $N$ defines a subvariety on such an
arithmetic quotient which has special behaviour at the cusp corresponding to
the parabolic with which $N$ is incident.
","[{""version"":""v1"",""created"":""Mon, 29 May 1995 09:17:24 GMT""}]","2008-02-03"
"astro-ph/9505130","Yukitoshi Kan-ya","Yukitoshi Kan-ya, Ryoichi Nishi and Takashi Nakamura","The Microlensing and Halo Models of the Galaxy","17 pages (including 8 figures), uuencoded gz-compressed postscript",,"10.1093/pasj/48.3.479",,"astro-ph",,"  We investigated the dependence of the optical depth $\tau$ of the
microlensing events on model parameters of the Galactic halo. We only consider
Galactic mass models in which the rotation curve inside the Sun is compatible
with the observation and LMC is bound to the Galaxy. It is found that $\tau$
varies up to a factor 2.5 from the standard spherical and flat rotation halo
model. This implies that only the most centrally concentrated halo model can be
consistent with the observation if the halo consists of only MACHOs. We also
calculate the power $x$ of IMF of MACHO consistent with Tyson's CCD survey as
well as Bahcall \etal's observation by {\em HST}. It is found that $x$ is
greater than 5.
","[{""version"":""v1"",""created"":""Mon, 29 May 1995 07:57:43 GMT""}]","2015-06-24"
"astro-ph/9505131","Stefano Cristiani","S. Cristiani, S. D'Odorico, V. D'Odorico, A. Fontana, E. Giallongo, S.
  Savaglio","CLUSTERING PROPERTIES OF THE LY$\alpha$ CLOUDS","4 pages uuencoded compressed postscript, to appear in the proceedings
  of the XXXth MORIOND meeting: ""Clustering in the Universe""",,,"AKP-95-2","astro-ph",,"  The spectra of the QSOs PKS2126-158 ($z_{em}=3.27$) and Q0055-269
($z_{em}=3.66$) have been observed at high resolution ($2.2 - 2.7 \times
10^4$). Significant clustering, with $\xi \simeq 1$ at $\Delta v=100$ km
s$^{-1}$, is detected in both cases for lines with $\log N_{HI} \geq 13.8$. A
similar result is obtained analysing the data available in the literature for
Q0014+81. An anticlustering signal is also detected on scales $\Delta v \sim
600$ km s$^{-1}$. Two voids of size $\sim 2000$ km s$^{-1}$ are found in the
spectrum of Q0055-269 with a probability of $2\times 10^{-4}$.
","[{""version"":""v1"",""created"":""Mon, 29 May 1995 08:58:32 GMT""}]","2007-05-23"
"astro-ph/9505132","Paola Andreani","P. Andreani, S. Cristiani and F. La Franca (Dip.Astron. Univ.Padova)","THE CLUSTERING OF QUASARS","4p compressed-ps file, XXX Moriond Meeting 'Clustering in the
  Universe'",,,"PD-1995-A13","astro-ph",,"  We have investigated the spatial distribution of quasars and its relationship
with redshift by using the two-point correlation function, the variance of cell
counts and the conditional density as a function of redshift. By comparing our
results with those found by other authors we conclude that quasars have a
correlation function with amplitude similar to or greater than that of
galaxies, but the issue of its evolution still needs to be settled. We discuss
how this can be achieved by adding new observations and comparing real data
with survey simulations.
","[{""version"":""v1"",""created"":""Mon, 29 May 1995 15:13:02 GMT""}]","2007-05-23"
"cond-mat/9505145","Karen Hallberg","K. A. Hallberg, E. Mueller-Hartmann and C. A. Balseiro","Hole dynamics in generalized spin backgrounds in infinite dimensions","Accepted in Phys. Rev. B. 18 pages of text (1 fig. included) in Latex
  + 2 figures in uuencoded form containing the 2 postscripts (mailed
  separately)","Phys. Rev. B 52, 4396 (1995)","10.1103/PhysRevB.52.4396",,"cond-mat",,"  We calculate the dynamical behaviour of a hole in various spin backgrounds in
infinite dimensions, where it can be determined exactly. We consider hypercubic
lattices with two different types of spin backgrounds. On one hand we study an
ensemble of spin configurations with an arbitrary spin probability on each
sublattice. This model corresponds to a thermal average over all spin
configurations in the presence of staggered or uniform magnetic fields. On the
other hand we consider a definite spin state characterized by the angle between
the spins on different sublattices, i.e a classical spin system in an external
magnetic field. When spin fluctuations are considered, this model describes the
physics of unpaired particles in strong coupling superconductors.
","[{""version"":""v1"",""created"":""Mon, 29 May 1995 08:31:21 GMT""}]","2009-10-28"
"cond-mat/9505146",,"H. Frahm and M. P. Pfannm\""uller","On the Hubbard Model in the Limit of Vanishing Interaction","10 pages, LaTeX, 2 uuencoded eps-figures","Phys. Lett. A 204 (1995) 347-352","10.1016/0375-9601(95)00499-S","ITP-UH-16/95","cond-mat",,"  We address the question how a correspondence between the particle like
excitations in the one dimensional Hubbard model (i.e. ``holons'' and
``spinons'') and the free fermionic picture can be established in the limit of
vanishing interaction by studying the finite size spectrum in the framework of
the Bethe Ansatz. Special attention has to be paid to the case of a vanishing
magnetic field where the two bands of excitations in either description are
degenerate. The interaction lifts this degeneracy.
","[{""version"":""v1"",""created"":""Mon, 29 May 1995 08:29:42 GMT""}]","2009-10-28"
"gr-qc/9505048","Paulo Rodrigues Lima Vargas Moniz","P.V. Moniz","Quantization of the Bianchi type-IX model in N=1 Supergravity in the
  Presence of Supermatter","43 pages, TeX (some minor font problems may occur, just press
  Return), TeX macro for table at the end of file","Int.J.Mod.Phys.A11:1763-1796,1996","10.1142/S0217751X96000948","DAMTP R95/21","gr-qc",,"  The general theory of N=1 supergravity with supermatter is applied to a
Bianchi type IX diagonal model. The supermatter is constituted by a complex
scalar field and its spin-$1\over 2$ fermionic partners. The K\""ahler geometry
is chosen to be a two-dimensional flat one. The Lorentz invariant Ansatz for
the wave function of the universe is taken to be as simple as possible in order
to obtain {\it new} solutions. The set of differential equations derived from
the quantum constraints are analysed in two different cases: if the supermatter
terms include an analytical potential or not. In the latter the wave function
is found to have a simple form.
","[{""version"":""v1"",""created"":""Mon, 29 May 1995 11:27:30 GMT""}]","2014-11-17"
"hep-lat/9505023","Thomas reisz","Thomas Reisz","Advanced Linked Cluster Expansion. Scalar Fields at Finite Temperature","36 pages, latex","Nucl.Phys. B450 (1995) 569-602","10.1016/0550-3213(95)00370-8","HD-THEP-95-23","hep-lat",,"  Linked cluster expansions provide a useful tool for both analytical and
numerical investigations of lattice field theories. The expansion parameter(s)
being the interaction strength(s) fields at neighboured lattice sites are
coupled, they result into convergent hopping parameter like series for free
energies, correlation functions and in particular susceptibilities. We consider
scalar fields with O(N) symmetric nearest neighbour interactions on hypercubic
lattices with possibly finite extension in some directions, thus including
field theories at finite temperature T. We improve known and develop new
techniques and algorithms to increase the order n the expansions can be
computed to in such a way that detailed information on critical behaviour can
be extracted from the susceptibility series. This concerns both simple moments
as well as higher correlations such as 4- and 6-point functions used to define
renormalized coupling constants. Particular emphasis is done on finite
temperature field theory. In order to be able to measure finite T critical
behaviour, the order of explicit computation n has to be sufficiently large
compared to 1/T in lattice units. 2- and 4-point susc. series are computed up
to and including the 18th order and beyond.
","[{""version"":""v1"",""created"":""Mon, 29 May 1995 09:56:18 GMT""}]","2009-10-28"
"hep-lat/9505024","Kazuyuki Kanaya","K. Kanaya","FINITE TEMPERATURE PHASE TRANSITION IN QCD WITH STRANGE QUARK: STUDY
  WITH WILSON FERMIONS ON THE LATTICE","uuencoded compressed PS file, 9 pages, 10 figures, Talk given at the
  International Conference {\it Confinement95}, RCNP, Osaka, March 22-24, 1995",,"10.1142/9789814447140_0014","UTHEP-306, UTCCP-P-2","hep-lat",,"  The effect of the strange quark in the finite temperature phase transition of
QCD is studied on the lattice. Using the one-plaquette gauge action and the
Wilson quark action, the transition in the chiral limit is shown to be
continuous for the case of degenerate two flavors, $N_F=2$, while it is of
first order for $N_F \geq 3$. For a more realistic case of massless up and down
quarks and a light strange quark, $N_F=2+1$, clear two state signals are
observed both for $m_s \simeq 150$ and 400 MeV. In contrast to a previous
result with staggered quarks, this suggests a first order transition in the
real world. In order to see the implication of these results to the continuum
limit, we started to study these issues using improved actions. First results
using a RG improved gauge action combined with the standard Wilson quark is
presented for the case of $N_F=2$: With this action the finite temperature
transition is shown to be continuous in the chiral limit confirming the result
of the standard action. Furthermore, not like the case of the standard action
where lattice artifacts make the transition once very strong at intermediate
values of the hopping parameter $K$ on $N_t=4$ and 6 lattices, a smooth
crossover is found for the improved action when we increase $1/K-1/K_c$, in
accord with a naive expectation about the fate of second order chiral
transition at finite $m_q$.
","[{""version"":""v1"",""created"":""Mon, 29 May 1995 11:59:36 GMT""}]","2016-11-03"
"hep-ph/9505397","Nikolai Uraltsev","R. David Dikeman, M. Shifman and N.G. Uraltsev","b -> s +\gamma : A QCD Consistent Analysis of the Photon Energy
  Distribution","40 pages, 5 Figures to be added as uuencoded files; plain LaTeX","Int.J.Mod.Phys.A11:571-612,1996","10.1142/S0217751X96000274","TPI-MINN-95/9-T, UMN-TH-1339-95, UND-HEP-95-BIG05","hep-ph",,"  The photon energy distribution in the inclusive b -> s+\gamma transitions is
a combination of two components: the first component, soft physics, is
determined by the so called primordial distribution function, while the second
component, perturbative physics, is governed by the hard gluon emission. A
simple ansatz is suggested for the primordial distribution function which obeys
the QCD constraints known so far. We then discuss in detail how the hard gluon
emission affects the energy distribution. An extension of the Sudakov
approximation is worked out incorporating the Brodsky-Lepage-Mackenzie
prescription and its generalizations. We explicitly calculate the marriage of
nonperturbative with perturbative effects in the way required by OPE,
introducing separation scale \mu. A few parameters, such as m_b and \mu_\pi^2
affect the shape of the distribution and, thus, can be determined by matching
to the experimental data. The data, still scarce, while not giving precise
values for these parameters, yield consistency with theory: the current values
of the above parameters lie within experimental uncertainty. On the theoretical
side we outline a method allowing one to go beyond the practical version of
OPE.
","[{""version"":""v1"",""created"":""Mon, 29 May 1995 03:40:17 GMT""},{""version"":""v2"",""created"":""Tue, 30 May 1995 16:39:45 GMT""},{""version"":""v3"",""created"":""Wed, 31 May 1995 15:13:33 GMT""}]","2014-11-17"
"hep-ph/9505399",,"Uschi Grandel, Wolfram Weise (TU-Muenchen, Germany)","Non-Perturbative Scales in Soft Hadronic Collisions at High Energies","8 pages,latex, 2 figures uuencoded","Phys.Lett. B356 (1995) 567-572","10.1016/0370-2693(95)00855-F","TUM/T39-95-3","hep-ph",,"  We investigate the role of nonperturbative quark-gluon dynamics in soft high
energy processes. In order to reproduce differential and total cross sections
for elastic proton-proton and proton-antiproton-scattering at high energy and
small momentum transfer it turns out that we need two scales, the gluonic
correlation length and a confinement scale. We find a small gluonic correlation
length, a = 0.2 fm, in accordance with recent lattice QCD results.
","[{""version"":""v1"",""created"":""Mon, 29 May 1995 08:58:49 GMT""}]","2009-10-28"
"hep-ph/9505400","Rey Soo Jong","Junegone Chay and Soo-Jong REY","Normalization of the Perturbative QCD Corrections for $B\to X_s \,
  \gamma$ Decay","13 pages, REVTEX, 2 ps figure-files are attached",,,"SNUTP-95-050","hep-ph",,"  We study the normalization of perturbative QCD corrections to the inclusive
$B \rightarrow X_s \gamma$ decay. We propose to set the renormalization scale
using the Brodsky-Lepage-Mackenzie (BLM) method. In the proposed method the
scale is determined by absorbing the vacuum polarization correction from light
fermions to renormalization scale but not including the anomalous dimensions.
The BLM scale depends in general on the renormalization scheme and the
factorization scale. We find that the BLM scale is insensitive to the
factorization scale. In the heavy-quark potential scheme, we find that the BLM
scale is $\mu_{BLM} \approx (0.315 - 0.334) m_b$ when the factorization scale
varies from $m_b/2$ to $2 m_b$.
","[{""version"":""v1"",""created"":""Mon, 29 May 1995 11:57:22 GMT""},{""version"":""v2"",""created"":""Tue, 30 May 1995 06:46:06 GMT""}]","2008-02-03"
"hep-ph/9505401","My Account","N. Mavromatos and D. Nanopoulos","Non-Critical String Theory Formulation of Microtubule Dynamics and
  Quantum Aspects of Brain Function","40 pages, 4 figures (not included). Minor typographical corrections",,,"ENSLAPP-A-524/95","hep-ph hep-th",,"  Microtubule (MT) networks, subneural paracrystalline cytosceletal structures,
seem to play a fundamental role in the neurons. We cast here the complicated MT
dynamics in the form of a $1+1$-dimensional non-critical string theory, thus
enabling us to provide a consistent quantum treatment of MTs, including
enviromental {\em friction} effects. We suggest, thus, that the MTs are the
microsites, in the brain, for the emergence of stable, macroscopic quantum
coherent states, identifiable with the {\em preconscious states}. Quantum
space-time effects, as described by non-critical string theory, trigger then an
{\em organized collapse} of the coherent states down to a specific or {\em
conscious state}. The whole process we estimate to take ${\cal O}(1\,{\rm
sec})$, in excellent agreement with a plethora of experimental/observational
findings. The {\em microscopic arrow of time}, endemic in non-critical string
theory, and apparent here in the self-collapse process, provides a satisfactory
and simple resolution to the age-old problem of how the, central to our
feelings of awareness, sensation of the progression of time is generated.
","[{""version"":""v1"",""created"":""Mon, 29 May 1995 13:59:46 GMT""},{""version"":""v2"",""created"":""Wed, 31 May 1995 14:23:41 GMT""},{""version"":""v3"",""created"":""Sat, 1 Jul 1995 20:41:16 GMT""}]","2008-02-03"
"hep-ph/9505402","Smaragda Lola","G. K. Leontaris, S. Lola and G. G. Ross","Heavy neutrino threshold effects in low energy phenomenology","22 pages, latex file, including 8 latex figures. Revised version
  (typos corrected, references added), to be published in Nucl. Phys. B","Nucl.Phys. B454 (1995) 25-44","10.1016/0550-3213(95)00377-5","CERN-TH-95-133, HD-HEP-95-8, IOA-95-323","hep-ph",,"  Right handed neutrinos with mass of ${\cal O} \; (10^{12}-10^{13})$ GeV are
required to implement the see-saw mechanism and generate neutrino masses
capable of playing a role in structure formation.
  Moreover models of fermion masses often relate the Yukawa couplings involving
these neutrinos to the up-quark Yukawa couplings. Here we study the effects of
such couplings on the radiative corrections to quark masses. We find that
$b-\tau$ equality at $M_{GUT}$ may still give the correct $m_b/m_{\tau}$--
ratio at low energies, but only if there is large $\mu-\tau$ mixing in the
charged leptonic sector. We propose specific mass matrix ``textures'' dictated
by a $U(1)$ family symmetry whose structure preserves $m_b=m_{\tau}$ at
$M_{GUT}$. In these schemes, due to the large $\nu_{\mu} - \nu_{\tau}$ mixing,
it is possible to give a simultaneous solution to the solar neutrino deficit
and the atmospheric neutrino problem.
","[{""version"":""v1"",""created"":""Mon, 29 May 1995 14:14:43 GMT""},{""version"":""v2"",""created"":""Wed, 23 Aug 1995 17:28:58 GMT""}]","2016-09-01"
"hep-ph/9505403","Ramana","M. V. Ramana (Department of Physics, University of Toronto)","A New Physics Source of Hard Gluons in Top Quark Production","8 pages, 3 Latex figures, Written version of talk given at the 17th
  annual MRST meeting, Rochester, May 8-9, 1995",,,,"hep-ph",,"  We consider the contribution of new strongly interacting sector, with a
characteristic scale of half a TeV, to top quark production at the Tevatron.
The color-octet, isosinglet analog of the $\rho$ meson in this theory is
produced copiously in hadron colliders. If the mass of this resonance is less
than twice the mass of the lightest pseudo-Goldstone bosons, then an important
decay mode could be to the color-octet analog of the $\eta$ and a gluon. The
subsequent decay of this $\eta$ into $\ttbar$ gives rise to top quark events
with a hard gluon.
","[{""version"":""v1"",""created"":""Mon, 29 May 1995 15:20:43 GMT""}]","2007-05-23"
"hep-ph/9505404","Andreas Vogt","W. Vogelsang (Rutherford Appleton Lab), A. Vogt (DESY)","Constraints on the Proton's Gluon Distribution from Prompt Photon
  Production","29 Pages, LaTeX, 9 figures","Nucl.Phys. B453 (1995) 334-354","10.1016/0550-3213(95)00424-Q","CCL-TR-95-004, DESY 95-096","hep-ph",,"  We analyze the capability of prompt photon production in pp and pp(bar)
collisions to constrain the gluon distribution of the proton, considering data
from fixed-target experiments as well as collider measurements. Combined fits
are performed to these large-p_T direct gamma cross sections and lepton-proton
deep-inelastic scattering data in the framework of next-to-leading order
perturbative QCD. Special attention is paid to theoretical uncertainties
originating from the scale dependence of the results and from the fragmentation
contribution to the prompt photon cross section.
","[{""version"":""v1"",""created"":""Mon, 29 May 1995 15:22:39 GMT""}]","2009-10-28"
"hep-th/9505172",,"R. Floreanini and R. Percacci","The heat-kernel and the average effective potential","9 pages, plain-Tex","Phys.Lett. B356 (1995) 205-210","10.1016/0370-2693(95)00799-Q","SISSA 59/95/EP","hep-th",,"  We discuss the definition of the average effective action in terms of the
heat-kernel. As an example we examine a model describing a self-interacting
scalar field, both in flat and curved background, and study the renormalization
group flow of some of the parameters characterizing its effective potential.
Some implications of the running of these parameters for inflationary cosmology
are also briefly discussed.
","[{""version"":""v1"",""created"":""Mon, 29 May 1995 08:13:50 GMT""}]","2009-10-28"
