"astro-ph/9506113","Kim Griest","C.Alcock, R.A.Allsman, T.S.Axelrod, D.P.Bennett, K.H.Cook,
  K.C.Freeman, K.Griest, J.A.Guern, M.J.Lehner, S.L.Marshall, H.-S.Park,
  S.Perlmutter, B.A.Peterson, M.R.Pratt, P.J.Quinn, A.W.Rodgers, C.W.Stubbs,
  W.Sutherland (The MACHO Collaboration)","The MACHO Project First Year LMC Results: The Microlensing Rate and the
  Nature of the Galactic Dark Halo","34 pages, uuencoded compressed tarred postscript, 14 figures
  included; Entire package including large image and important lightcurve
  figures (not included in above package) available via anonymous ftp at
  ftp://igpp.llnl.gov/pub/macho/LMC1/LMC1_all.uu, submitted to Astrophys. J","Astrophys.J. 461 (1996) 84","10.1086/177039",,"astro-ph hep-ph",,"  The MACHO collaboration reports on the analysis of our first year LMC data,
9.5 million light curves with an average of 235 observations each. Automated
selection procedures give 3 events consistent with microlensing. We evaluate
our experimental detection efficiency using a range of Monte- Carlo
simulations. Using a `standard' halo density profile we find that a halo
comprised entirely of Machos in the mass range 3 \ten{-4} to 0.06 \msun would
predict > 15 detected events in this dataset; thus a standard spherical halo
cannot be dominated by objects in this mass range. Assuming all three events
are microlensing of halo objects and fitting a naive spherical halo model to
our data yields a Macho halo fraction f =0.19+0.16-0.10, a total mass in Machos
(inside 50 kpc) of 7.6+6-4 \ten{10} \msun, and a microlensing optical depth
8.8+7-5 \ten{-8} (68\% CL). Exploring a wide range of halo models we find that
our constraints on the Macho fraction are quite model-dependent, but
constraints on the total mass in Machos within 50 kpc are quite secure.
","[{""version"":""v1"",""created"":""Wed, 21 Jun 1995 18:36:35 GMT""}]","2009-10-28"
"astro-ph/9506114","Dave Bennett","C. Alcock, R.A. Allsman, D. Alves, T.S. Axelrod, D.P. Bennett, K.H.
  Cook, K.C. Freeman, K. Griest, J. Guern, M.J. Lehner, S.L. Marshall, B.A.
  Peterson, M.R. Pratt, P.J. Quinn, A.W. Rodgers, C.W. Stubbs, and W.
  Sutherland (The MACHO Collaboration)","First Observation of Parallax in a Gravitational Microlensing Event","11 pages, 3 figs in uuencoded, compressed, tared postscript files","Astrophys. J. 454 (1995) L125","10.1086/309783",,"astro-ph",,"  We present the first detection of parallax effects in a gravitational
microlensing event. Parallax in a gravitational microlensing event observed
only from the Earth appears as a distortion of the lightcurve due to the motion
of the Earth around the Sun. This distortion can be detected if the event
duration is not much less than a year and if the projected velocity of the lens
is not much larger than the orbital velocity of the Earth about the Sun. The
event presented here has a duration of 220 days and clearly shows the
distortion due to the Earth's motion. We find that the projected velocity of
the lens is 75+/-5 km/s at an angle of 28+/-4 deg from the direction of
increasing galactic longitude, as expected for a lens in the galactic disk.
  A likelihood analysis yields estimates of the distance to and mass of the
lens: D_{lens} = 1.7 (+1.1/-0.7) kpc and M = 1.3 (+1.3/-0.6) Msun, suggesting
that the lens is a remnant such as a white dwarf or neutron star. A less likely
possibility is that the lens is a main sequence star. If so, we can add our
upper limit on the observed flux from the lens to the analysis. This modifies
the estimates to: D_{lens} = 2.8 (+1.1/-0.6) kpc, and M = 0.6 (+0.4/-0.2) Msun.
","[{""version"":""v1"",""created"":""Thu, 22 Jun 1995 06:10:42 GMT""}]","2009-10-28"
"astro-ph/9506115","Tiziana Venturi","T. Vneturi, C. Castaldini, W.D. Cotton, L. Feretti, G. Giovannini, L.
  Lara, J.M. Marcaide, A.E. Wehrle","VLBI Observations of a Complete Sample of Radio Galaxies. VI. The Two
  FR-I Radio Galaxies B2 0836+29 and 3C465","28 pages, 4 tables, 8 figures all available under request from
  tventuri@astbo1.bo.cnr.it",,"10.1086/176525","BAP 05-1995-029-IRA","astro-ph",,"  We present 5 GHz global VLBI observations of the two Fanaroff Riley Type I
radio galaxies B2 0836+29 and 3C465 (2335+26). For 3C465 we present also 1.7
GHz and 8.4 GHz global VLBI data. In addition VLA observations were used to
obtain arsecond resolution continuum and polarization maps at 5 GHz. Both
sources are very asymmetric on the parsec-scale, with a core and a one-sided
jet, aligned with the main arcsecond scale jet. We place a limit on the
milliarcsecond jet to counterjet brightness ratio B$_{jet}$/B$_{cjet}$ \gtsim
20 and \gtsim 30 for B2 0836+29 and 3C465 respectively. For 3C465 the strong
asymmetry holds to the kiloparsec scale. The brightness asymmetry and the ratio
between the core radio power and total radio power allow us to constrain the
jet velocity close to the core and the orientation of the radio structure with
respect to the line of sight. The results suggest that the plasma speed is
relativistic on the parsec scale for both sources, i.e. v$_{jet}$ \gtsim 0.75c
for B2 0836+29 and v$_{jet}$ \gtsim 0.6c for 3C465. While v$_{jet}$ decreases
from the parsec to the kiloparsec scale in B2 0836+29, in 3C465 the very high
v$_{jet}$ holds all the way to the kiloparsec-scale {\t bright spot}. Our
results are in agreement with the unification scheme suggestion that FR-I radio
galaxies are the unbeamed poulation of BL-Lac objects. Furthermore, they
reinforce the idea that the central engine in FR-I and FR-II radio galaxies
must be qualitatively similar. The different radio morphology could then be due
either to an intrinsically different nuclear power, which affects the torus
geometry or to different conditions in the region beyond the parsec scale,
where a significant deceleration in the FR-I jets occurs.
","[{""version"":""v1"",""created"":""Thu, 22 Jun 1995 06:19:19 GMT""}]","2015-06-24"
"astro-ph/9506116","Basilio Santiago","Rebecca A.W. Elson and Basilio X. Santiago","The Globular Clusters in M87: A Bimodal Colour Distribution","16 pages + 4 figures, the later submitted in tar, compressed,
  uuencoded form. Fig. 1 not included",,"10.1093/mnras/278.2.617",,"astro-ph",,"  We present $V$ and $I$ photometry for $\sim 150$ globular clusters with $20 <
V < 27$ $\sim 2.5$ arcmin from the centre of M87, the cD galaxy in the Virgo
cluster. The data were acquired with the Hubble Space Telescope which, with
effective resolution 0.1 arcsec, allows us for the first time to distinguish
between globular clusters and most background galaxies on the basis of
morphology, and to obtain accurate photometry even at faint magnitudes. The
$(V-I)$ distribution of the clusters is clearly bimodal, implying a
corresponding bimodality in the metallicity distribution, with peaks at
[Fe/H]$\approx -1.5$ and $-0.5$. We also find that the brightest clusters are
predominantly metal poor, while the fainter clusters are divided roughly
eaually between metal poor and metal rich. Our sample is essentially complete
to $ V\approx 25$, a full magnitude past the expected peak of a ``universal""
luminosity function, and the observed luminosity function is well represented
by the standard gaussian distribution with $<M_V>=-7.2$ and $\sigma = 1.4$.
","[{""version"":""v1"",""created"":""Thu, 22 Jun 1995 15:33:43 GMT""}]","2015-06-24"
"cmp-lg/9506019","David Magerman","David M. Magerman","Review of Charniak's ""Statistical Language Learning""",,"Computational Linguistics 21:1, 103-111",,,"cmp-lg cs.CL",,"  This article is an in-depth review of Eugene Charniak's book, ""Statistical
Language Learning"". The review evaluates the appropriateness of the book as an
introductory text for statistical language learning for a variety of audiences.
It also includes an extensive bibliography of articles and papers which might
be used as a supplement to this book for learning or teaching statistical
language modeling.
","[{""version"":""v1"",""created"":""Wed, 21 Jun 1995 20:10:53 GMT""}]","2016-08-31"
"cmp-lg/9506020","Steffen Staab","Steffen Staab (Universitaet Erlangen-Nuernberg, IMMD 8)","GLR-Parsing of Word Lattices Using a Beam Search Method","4 pages, 61K postscript, compressed, uuencoded, Eurospeech 9/95,
  Madrid",,,,"cmp-lg cs.CL",,"  This paper presents an approach that allows the efficient integration of
speech recognition and language understanding using Tomita's generalized
LR-parsing algorithm. For this purpose the GLRP-algorithm is revised so that an
agenda mechanism can be used to control the flow of computation of the parsing
process. This new approach is used to integrate speech recognition and speech
understanding incrementally with a beam search method. These considerations
have been implemented and tested on ten word lattices.
","[{""version"":""v1"",""created"":""Thu, 22 Jun 1995 14:25:25 GMT""}]","2008-02-03"
"cond-mat/9506095",,"Yong Baek Kim, Akira Furusaki, Derek K. K. Lee","On a Network Model of Localization in a Random Magnetic Field","Revtex, 6 pages, 3 figures appended as an uuencoded file",,"10.1103/PhysRevB.52.16646","MIT-CMT-June-95","cond-mat",,"  We consider a network model of snake states to study the localization problem
of non-interacting fermions in a random magnetic field with zero average. After
averaging over the randomness, the network of snake states is mapped onto $M$
coupled SU$(2N)$ spin chains in the $N \rightarrow 0$ limit. The number of
snake states near the zero-field contour, $M$, is an even integer. In the large
conductance limit $g = M {e^2 \over 2 \pi \hbar}$ ($M \gg 2$), it turns out
that this system is equivalent to a particular representation of the ${\rm
U}(2N) / {\rm U}(N) \times {\rm U}(N)$ sigma model ($N \rightarrow 0$) {\it
without} a topological term. The beta function $\beta (1/M)$ of this sigma
model in the $1/M$ expansion is consistent with the previously known $\beta
(g)$ of the unitary ensemble. These results and further plausible arguments
support the conclusion that all the states are localized.
","[{""version"":""v1"",""created"":""Wed, 21 Jun 1995 18:35:17 GMT""}]","2009-10-28"
"cond-mat/9506096",,"Evandro V.L.de Mello","A Model for High Temperature Superconductors using the Extended Hubbard
  Model","9 pages, RevTex preprint style, 2 figs. packed with uufiles",,"10.1016/0921-4534(96)00012-3",,"cond-mat",,"  We derive a method to study the phase diagram for high temperature
superconductors (HTCS). Our starting point is the Hubbard Hamiltonian with a
weak attractive interaction to obtain the formation of bound pairs. We consider
this attractive potential at different positions for different compounds
accordingly to the experimental results of the coherence length. We then
construct a wave function of the BCS type by a variational method using the
Fourier transform of this extended Hubbard potential and then derive an energy
gap equation. This approach allows us to obtain the critical temperature as
function of the doping concentration which gives very good agreement with the
experimental phase diagrams of YBaCuO and La(Sr,Ba)CuO compounds.
","[{""version"":""v1"",""created"":""Wed, 21 Jun 1995 20:13:51 GMT""}]","2009-10-28"
"cond-mat/9506097","Robert S. Maier","Robert S. Maier and Daniel L. Stein (University of Arizona)","A Scaling Theory of Bifurcations in the Symmetric Weak-Noise Escape
  Problem","LaTeX, 60 pages, 24 Postscript figures. Uses epsf macros to include
  the figures. A file in `uufiles' format containing the figures is separately
  available at ftp://platinum.math.arizona.edu/pub/papers-rsm/paperF/figures.uu
  and a Postscript version of the whole paper (figures included) is available
  at ftp://platinum.math.arizona.edu/pub/papers-rsm/paperF/paperF.ps","J. Stat. Phys. 83 (1996) 291","10.1007/BF02183736",,"cond-mat adap-org nlin.AO",,"  We consider the overdamped limit of two-dimensional double well systems
perturbed by weak noise. In the weak noise limit the most probable
fluctuational path leading from either point attractor to the separatrix (the
most probable escape path, or MPEP) must terminate on the saddle between the
two wells. However, as the parameters of a symmetric double well system are
varied, a unique MPEP may bifurcate into two equally likely MPEP's. At the
bifurcation point in parameter space, the activation kinetics of the system
become non-Arrhenius. In this paper we quantify the non-Arrhenius behavior of a
system at the bifurcation point, by using the Maslov-WKB method to construct an
approximation to the quasistationary probability distribution of the system
that is valid in a boundary layer near the separatrix. The approximation is a
formal asymptotic solution of the Smoluchowski equation. Our analysis relies on
the development of a new scaling theory, which yields `critical exponents'
describing weak-noise behavior near the saddle, at the bifurcation point.
","[{""version"":""v1"",""created"":""Thu, 22 Jun 1995 03:44:36 GMT""}]","2009-10-28"
"cond-mat/9506098","Per Frojdh","Per Frojdh (Univ of Wash, Seattle) and Henrik Johannesson (Chalmers
  Univ of Technology and Goteborg Univ, Sweden)","Interacting Electrons and Localized Spins: Exact Results from Conformal
  Field Theory","6 pages LaTeX. To appear in the Proceedings of the 1995 Schladming
  Winter School on Low-Dimensional Models in Statistical Physics and Quantum
  Field Theory",,"10.1007/BFb0102564",,"cond-mat",,"  We give a brief review of the Kondo effect in a one-dimensional interacting
electron system, and present exact results for the impurity thermodynamic
response based on conformal field theory.
","[{""version"":""v1"",""created"":""Thu, 22 Jun 1995 01:21:22 GMT""}]","2015-06-25"
"cond-mat/9506099","Per Frojdh","Per Frojdh (Univ of Wash, Seattle) and Henrik Johannesson (Chalmers
  Univ of Technology and Goteborg Univ, Sweden)","Magnetic Impurity in a Luttinger Liquid: A Conformal Field Theory
  Approach","57 pages REVTeX (uses amssymb) and 5 postscript figures (uuencoded
  compressed tar file)","Phys. Rev. B 53, 3211 (1996)","10.1103/PhysRevB.53.3211",,"cond-mat",,"  We study the low-temperature properties of a spin-\onehalf\ magnetic impurity
coupled to a one-dimensional interacting electron system. Using the newly
developed formalism by Affleck and Ludwig, with a scale invariant boundary
condition replacing the impurity, we exploit boundary conformal field theory to
deduce the impurity thermal and magnetic response. In the case of only forward
electron scattering off the impurity, we predict the same critical scaling as
for the two-channel Kondo effect for non-interacting electrons, but with a
novel Wilson ratio. Backward electron scattering off the impurity destabilizes
this behavior and drives the system to a new fixed point. In the case of equal
amplitudes for forward- and backward scattering {\em (Kondo interaction)}, we
show that there are only two types of scaling behaviors consistent with the
symmetries of the problem: {\em either} a local Fermi liquid {\em or} a
critical theory with an anomalous specific heat. The latter case agrees with a
recent ``poor-man-scaling'' result proposed by Furusaki and Nagaosa.
","[{""version"":""v1"",""created"":""Thu, 22 Jun 1995 01:22:00 GMT""}]","2009-10-28"
"cond-mat/9506100","Igloi Ferenc","Ferenc Igloi, Peter Lajko and Ferenc Szalma","Critical Behavior of Hierarchical Ising Models","21 pages, plain TeX, 3 figures available on request, to appear in
  Phys. Rev. B",,"10.1103/PhysRevB.52.7159","SZFKI-FI-95-2","cond-mat",,"  We consider the critical behavior of two-dimensional layered Ising models
where the exchange couplings between neighboring layers follow hierarchical
sequences. The perturbation caused by the non-periodicity could be irrelevant,
relevant or marginal. For marginal sequences we have performed a detailed
study, which involved analytical and numerical calculations of different
surface and bulk critical quantities in the two-dimensional classical as well
as in the one-dimensional quantum version of the model. The critical exponents
are found to vary continuously with the strength of the modulation, while close
to the critical point the system is essentially anisotropic: the correlation
length is diverging with different exponents along and perpendicular to the
layers.
","[{""version"":""v1"",""created"":""Thu, 22 Jun 1995 07:13:57 GMT""}]","2009-10-28"
"cond-mat/9506102",,"V.P. Gusynin, V.M. Loktev and I.A. Shovkovy","On the Superconductivity of 2D System with Arbitrary Carrier Density in
  External Magnetic Field","9 pages, LaTeX, no figures, shortened vertion of paper Sov. Phys.
  JETP V.107,No.6,1995",,,"Kiev-ITP-95-20E","cond-mat",,"  Selfconsistent equations which describe the order parameter and chemical
potential behaviour in $2D$ metalic system as functions of external magnetic
field, $H$, temperature, $T$, and carrier density, $n$, are obtained. It is
shown that for the case of the local pairs (low carrier density and negative
chemical potential $\mu$) the derivative $dH_{c_2}(T)/dT$ at $T=T_c$ is
essentially less then that for the system with Cooper pairs (high carrier
density and positive chemical potential $\mu\gg T_c$). It is found that in
magnetic field satisfying the quantum limit criterium the system is
characterized by non-trivial inhomogeneuos order parameter which can exist at
rather high temperatures.
","[{""version"":""v1"",""created"":""Thu, 22 Jun 1995 14:37:20 GMT""}]","2019-08-15"
"cond-mat/9506103",,"Jesus Inarrea and Gloria Platero (Instituto de Ciencia de Materiales
  (CSIC) and Departamento de Fisica de la Materia Condensada C-III, Universidad
  Autonoma de Madrid, Cantoblanco, Madrid, Spain)","Photoassisted sequential resonant tunneling through superlattices","Revtex 3.0 4 pages, 4 figures uuencoded compressed tar-file",,"10.1209/epl/i1996-00413-7",,"cond-mat",,"  We have analyzed theoretically the photoassisted tunneling current through a
superlattice in the presence of an AC potential. For that purpose we have
developed a new model to calculate the sequential resonant currrent trhough a
superlattice based in the TRansfer Hamiltonian Method. The tunneling current
presents new features due to new effective tunneling chanels coming from the
photoside bands induced by the AC field. Our theoretical results are in good
agreement with the available experimental evidence.
","[{""version"":""v1"",""created"":""Thu, 22 Jun 1995 15:56:52 GMT""}]","2009-10-28"
"cond-mat/9506118","Fujimoto Satoshi","S. Fujimoto and N. Kawakami","Weak-Coupling Approach to Hole-Doped S=1 Haldane Systems","4 pages, RevTex, 1 postscript figure (uuencoded and compressed), to
  appear in Phys. Rev. B",,"10.1103/PhysRevB.52.6189",,"cond-mat",,"  As a weak-coupling analogue of hole-doped $S=1$ Haldane systems, we study two
models for coupled chains via Hund coupling; coupled Hubbard chains, and a
Hubbard chain coupled with an $S=1/2$ Heisenberg chain. The fixed point
properties of these models are investigated by using bosonization and
renormalization group methods. The effect of randomness on these fixed points
is also studied. It is found that the presence of the disorder parameter
inherent in the Haldane state in the former model suppresses the Anderson
localization for weak randomness, and stabilizes the Tomonaga-Luttinger liquid
state with the spin gap.
","[{""version"":""v1"",""created"":""Thu, 22 Jun 1995 03:03:47 GMT""}]","2009-10-28"
"funct-an/9506005","Ruy Exel","Ruy Exel and Marcelo Laca","Continuous Fell Bundles Associated to Measurable Twisted Actions","6 pages, plain TeX, no figures",,,"IMEUSP-RE-95-02","funct-an math.OA",,"  Given a measurable twisted action of a second-countable, locally compact
group G on a separable C*-algebra A, we prove the existence of a topology on
AxG making it a continuous bundle, whose cross sectional C*-algebra is
isomorphic to the Busby--Smith--Packer--Raeburn crossed product.
","[{""version"":""v1"",""created"":""Wed, 21 Jun 1995 20:27:07 GMT""}]","2008-02-03"
"gr-qc/9506043","Kiyoshi Ezawa","Kiyoshi Ezawa","Combinatorial solutions to the Hamiltonian constraint in
  (2+1)-dimensional Ashtekar gravity","41 pages Latex (2 figures available as a postscript file)","Nucl.Phys. B459 (1996) 355-392","10.1016/0550-3213(95)00557-9","OU-HET/217","gr-qc",,"  Dirac's quantization of the (2+1)-dimensional analog of Ashtekar's approach
to quantum gravity is investigated. After providing a diffeomorphism-invariant
regularization of the Hamiltonian constraint, we find a set of solutions to
this Hamiltonian constraint which is a generalization of the solution
discovered by Jacobson and Smolin. These solutions are given by particular
linear combinations of the spin network states. While the classical
counterparts of these solutions have degenerate metric, due to a \lq quantum
effect' the area operator has nonvanishing action on these states. We also
discuss how to extend our results to (3+1)-dimensions.
","[{""version"":""v1"",""created"":""Thu, 22 Jun 1995 07:56:08 GMT""},{""version"":""v2"",""created"":""Fri, 23 Jun 1995 13:19:10 GMT""}]","2009-10-28"
"gr-qc/9506044","Rufus Salah Hamade","Rufus S. Hamade and John M. Stewart","The spherically symmetric collapse of a massless scalar field","23 pages, 16 figures, uuencoded gzipped postscript This version omits
  2 pages of figures. This file, the two pages of figures and the complete
  paper are available at ftp://ftp.damtp.cam.ac.uk/pub/gr/rsh1000","Class.Quant.Grav.13:497-512,1996","10.1088/0264-9381/13/3/014","DAMTP R/95/32","gr-qc",,"  We report on a numerical study of the spherically symmetric collapse of a
self-gravitating massless scalar field. Earlier results of Choptuik(1992, 1994)
are confirmed. The field either disperses to infinity or collapses to a black
hole, depending on the strength of the initial data. For evolutions where the
strength is close to but below the strength required to form a black hole, we
argue that there will be a region close to the axis where the scalar curvature
and field energy density can reach arbitrarily large levels, and which is
visible to distant observers
","[{""version"":""v1"",""created"":""Thu, 22 Jun 1995 08:12:14 GMT""}]","2010-11-19"
"gr-qc/9506045","Manuela Campanelli","Manuela Campanelli","Comment on ``Perturbative Method to solve fourth-order Gravity Field
  Equations""","6 pages, Revtex",,,"UAB-FT-371","gr-qc astro-ph hep-th",,"  We reconsider the cosmic string perturbative solution to the classical
fourth-order gravity field equations, obtained in Ref.\cite{CLA94}, and we
obtain that static, cylindricaly symmetric gauge cosmic strings, with constant
energy density, can contain only $\beta$-terms in the first order corrections
to the interior gravitational field, while the exact exterior solution is a
conical spacetime with deficit angle $D=8\pi\mu$.
","[{""version"":""v1"",""created"":""Thu, 22 Jun 1995 11:14:06 GMT""}]","2007-05-23"
"gr-qc/9506046",,"Giampiero Esposito","The Impact of Quantum Cosmology on Quantum Field Theory","14 pages, plain TEX, to appear in Proceedings of the Moscow Quantum
  Gravity Seminar, Moscow, June 12 - June 19, 1995",,,"DSF preprint 95/27","gr-qc",,"  The basic problem of quantum cosmology is the definition of the quantum state
of the universe, with appropriate boundary conditions on Riemannian
three-geometries. This paper describes recent progress in the corresponding
analysis of quantum amplitudes for Euclidean Maxwell theory and linearized
gravity. Within the framework of Faddeev-Popov formalism and zeta-function
regularization, various choices of mixed boundary conditions lead to a deeper
understanding of quantized gauge fields and quantum gravity in the presence of
boundaries.
","[{""version"":""v1"",""created"":""Thu, 22 Jun 1995 14:56:07 GMT""}]","2007-05-23"
"hep-lat/9506026","Christine Davies","C.T.H.Davies, K.Hornbostel, G.P.Lepage, A.J.Lidsey, J.Shigemitsu,
  J.Sloan","Precision Charmonium Spectroscopy From Lattice QCD","23 pages uuencoded latex file. Contains figures in latex","Phys.Rev. D52 (1995) 6519-6529","10.1103/PhysRevD.52.6519",,"hep-lat",,"  We present results for Charmonium spectroscopy using Non-Relativistic QCD
(NRQCD). For the NRQCD action the leading order spin-dependent and next to
leading order spin-independent interactions have been included with
tadpole-improved coefficients. We use multi-exponential fits to multiple
correlation functions to extract ground and excited $S$ states. Splittings
between the lowest $S$, $P$ and $D$ states are given and we have accurate
values for the $S$ state hyperfine splitting and the $\chi_c$ fine structure.
Agreement with experiment is good - the remaining systematic errors are
discussed.
","[{""version"":""v1"",""created"":""Thu, 22 Jun 1995 14:16:51 GMT""}]","2019-08-17"
