"hep-ph/9506380","Gerard Jungman","G. Jungman, M. Kamionkowski, and K. Griest","Supersymmetric Dark Matter","The complete postscript file is available at
  ftp://ftp.npac.syr.edu/pub/users/jungman/susyreview/susyreview.ps.Z The TeX
  source and figures (plain TeX; macros included) are at
  ftp://ftp.npac.syr.edu/pub/users/jungman/susyreview/susyreview.tar.Z Full
  paper NOT submitted to lanl archive: table of contents only. To appear in
  Physics Reports","Phys.Rept. 267 (1996) 195-373","10.1016/0370-1573(95)00058-5","SU-4240-605, UCSD/PTH 95-02, IASSNS-HEP-95/14, CU-TP-677","hep-ph astro-ph nucl-th",,"  There is almost universal agreement among astronomers that most of the mass
in the Universe and most of the mass in the Galactic halo is dark. Many lines
of reasoning suggest that the dark matter consists of some new, as yet
undiscovered, weakly-interacting massive particle (WIMP). There is now a vast
experimental effort being surmounted to detect WIMPS in the halo. The most
promising techniques involve direct detection in low-background laboratory
detectors and indirect detection through observation of energetic neutrinos
from annihilation of WIMPs that have accumulated in the Sun and/or the Earth.
Of the many WIMP candidates, perhaps the best motivated and certainly the most
theoretically developed is the neutralino, the lightest superpartner in many
supersymmetric theories. We review the minimal supersymmetric extension of the
Standard Model and discuss prospects for detection of neutralino dark matter.
We review in detail how to calculate the cosmological abundance of the
neutralino and the event rates for both direct- and indirect-detection schemes,
and we discuss astrophysical and laboratory constraints on supersymmetric
models. We isolate and clarify the uncertainties from particle physics, nuclear
physics, and astrophysics that enter at each step in the calculation. We
briefly review other related dark-matter candidates and detection techniques.
","[{""version"":""v1"",""created"":""Thu, 22 Jun 1995 03:59:24 GMT""}]","2009-10-28"
"hep-ph/9506383","Phil Ratcliffe","Philip G. Ratcliffe","Proton Spin, Sum Rules, QCD and Higher Twist","4 pages, latex, no figures, requires the QCDPARIS.STY style file. One
  minor correction to references made",,,,"hep-ph",,"  We examine the present status of the Bjorken sum rule in the light of recent
data on the spin structure functions of the proton, neutron and deuteron
obtained by the CERN and SLAC experimental groups. We also discuss the role of
possible higher-twist contributions and higher-order PQCD corrections and
comment on the extraction of the necessary parameters, D and F, obtained from
hyperon semi-leptonic decays.
","[{""version"":""v1"",""created"":""Wed, 21 Jun 1995 16:40:02 GMT""},{""version"":""v2"",""created"":""Thu, 29 Jun 1995 12:58:09 GMT""}]","2008-02-03"
"hep-ph/9506384","Claude Roiesnel","L.V. Dung, G. Jikia, C. Roiesnel and T.N. Truong","Study of the Strongly Interacting Higgs Physics Model with Heavy
  Fermions","14 pages, LaTeX+epsfig, 2 figures, uuencoded","Phys.Lett. B357 (1995) 109-118","10.1016/0370-2693(95)00884-N","RR359.0695","hep-ph",,"  We study the effect of a possible fourth heavy generation of fermions on the
Higgs sector of the standard model. We show, from the violation of elastic
unitarity, that the scale of strong interactions is well below 1 TeV even with
a Higgs mass as low as 500 GeV provided the fourth generation fermion mass is
equal or larger than the Higgs mass. The diagonal Pade approximant method is
then used to unitarize the partial wave amplitudes. It is found that, for the
fourth generation fermion masses which are comparable to or larger than the
Higgs mass, the Landau ghosts in the I=0 and I=2 channels of the reconstructed
amplitudes move too close to the physical region to be accepted.
","[{""version"":""v1"",""created"":""Wed, 21 Jun 1995 17:25:25 GMT""}]","2016-09-01"
"hep-ph/9506386","Sasha","Alexander Kusenko (University of Pennsylvania)","Tunneling in quantum field theory with spontaneous symmetry breaking","8 pages, latex, 2 figures appended (uuencoded postscript); complete
  postscript file is available at
  ftp://dept.physics.upenn.edu/pub/Kusenko/UPR671T.ps","Phys.Lett. B358 (1995) 47-50","10.1016/0370-2693(95)00995-W",,"hep-ph cond-mat gr-qc hep-th",,"  Tunneling in quantum field theory is well understood in the case of a single
scalar field. However, in theories with spontaneous symmetry breaking, one has
to take into account the additional zero modes which appear due to the
Goldstone phenomenon. We calculate the false vacuum decay rate in this case.
The result may differ significantly from the tunneling rates in the absence of
symmetry breaking.
","[{""version"":""v1"",""created"":""Wed, 21 Jun 1995 21:18:13 GMT""}]","2009-10-28"
"hep-ph/9506387",,"Chungsik Song, Volker Koch, Su Houng Lee and C. M. Ko","Thermal effects on dilepton production from $\pi-\pi$ annihilation","11 pages + 3 figures (figures are not included but available on
  request), revtex","Phys.Lett. B366 (1996) 379","10.1016/0370-2693(95)01363-6","LBL-37388/SNUTP-95-070","hep-ph nucl-th",,"  We study finite temperature effects on dilepton production from pion-pion
annihilation in hot hadronic matter. The softening of the pion dispersion
relation in a medium is found to enhance the production rate of dileptons with
invariant masses in the region of $2m^*_\pi(T)<M<m_\rho$. On the other hand,
the reduction of the pion electromagnetic form factor at finite temperature
leads to a suppression of the dilepton production rate. Including both effects,
we have found that the dilepton yield is slightly enhanced in the invariant
mass region $M= 270\sim 600$ MeV but is suppressed around the vector meson
resonance. We further discuss the relevance of our results to recent
experimental data from the S+Au collisions at CERN/SPS energies by the CERES
collaboration.
","[{""version"":""v1"",""created"":""Wed, 21 Jun 1995 21:51:14 GMT""}]","2015-06-25"
"hep-ph/9506388","Alon Faraggi","Alon Faraggi","Top Quark Mass Prediction in Superstring Derived Standard--like Models","11 pages. Standard Latex","Phys.Lett. B377 (1996) 43-47","10.1016/0370-2693(96)00310-3","IASSNS--HEP--95/53","hep-ph hep-th",,"  A remarkable achievement of the realistic superstring standard--like models
is the successful prediction of the top quark mass, assuming the Minimal
Supersymmetric Standard Model spectrum below the string scale. Recently it was
shown that string scale unification requires the existence of additional
matter, in vector--like representations, at intermediate energy scales and that
certain string models contain the needed representations in their massless
spectrum. I obtain the top, bottom and tau lepton Yukawa couplings in these
models, by calculating tree level string amplitudes, in terms of the unified
gauge coupling and certain vacuum expectation values that are required for the
consistency of the string models. Using two--loop renormalization group
equations for the gauge and Yukawa couplings, I study the effect of the
intermediate matter thresholds on the top quark mass prediction. Agreement with
the experimental values of $\alpha_{\rm strong}(M_Z)$, $\sin^2\theta_W(M_Z)$
and $\alpha^{-1}_{\rm em}(M_Z)$ is imposed. It is found that the physical top
quark mass prediction is increased to the range $192-200$ GeV and that the
ratio $\lambda_b(M_Z)/\lambda_\tau(M_Z)$ is in agreement with experiment.
","[{""version"":""v1"",""created"":""Thu, 22 Jun 1995 04:17:51 GMT""}]","2009-10-28"
"hep-ph/9506389","Jun Liu","J\`un L\'iu, Nimai C. Mukhopadhyay and Lisheng Zhang","Nucleon to Delta Weak Excitation Amplitudes in the Non-relativistic
  Quark Model","\documentstyle[aps]{revtex}, 21pages; 11 postscript figures. Accepted
  for publication by Phys. Rev. C","Phys.Rev.C52:1630-1647,1995","10.1103/PhysRevC.52.1630",,"hep-ph nucl-th",,"  We investigate the nucleon to Delta(1232) vector and axial vector amplitudes
in the non-relativistic quark model of the Isgur-Karl variety. A particular
interest is to investigate the SU(6) symmetry breaking, due to color hyperfine
interaction. We compare the theoretical estimates to recent experimental
investigation of the Adler amplitudes by neutrino scattering.
","[{""version"":""v1"",""created"":""Thu, 22 Jun 1995 06:29:07 GMT""}]","2016-08-15"
"hep-ph/9506390","Robert Peschanski","R. Peschanski","Two-component colour dipole emission in the central region of
  onium-onium scattering","3 pages, latex, no figures, requires qcdparis.sty; Contribution to
  the PARIS Workshop DIS 95', April 19-24, 1995",,,"Saclay preprint SPhT T95/75","hep-ph",,"  The initial-state radiation of soft colour dipoles produced in the central
region of onium-onium scattering via single QCD Pomeron exchange (BFKL) is
calculated in the framework of Mueller's dipole approach. The resulting dipole
production has a two-component structure. One is constant with energy while the
other grows and possesses a power-law tail at appreciably large transverse
distances from the collision axis. It may be related to the growth of the gluon
distribution at small Bjorken-$x.$
","[{""version"":""v1"",""created"":""Thu, 22 Jun 1995 08:01:37 GMT""}]","2007-05-23"
"hep-ph/9506391","Ard van Sighem","F.A. Berends and A.I. van Sighem","Anomalous four-fermion processes in electron-positron collisions","27 pages, Postscript, compress-ed and uuencode-d","Nucl.Phys.B454:467-484,1995","10.1016/0550-3213(95)00470-D","INLO-PUB-7/95","hep-ph",,"  This paper studies the electroweak production of all possible four-fermion
states in $e^+e^-$ collisions with non-standard triple gauge boson couplings.
All $CP$ conserving couplings are considered. It is an extension of the methods
and strategy, which were recently used for the Standard Model electroweak
production of four-fermion final states. Since the fermions are taken to be
massless the matrix elements can be evaluated efficiently, but certain phase
space cuts have to be imposed to avoid singularities. Experimental cuts are of
a similar nature. With the help of the constructed event generator a number of
illustrative results is obtained for $W$-pair production. These show on one
hand the distortions of the Standard Model angular distributions caused by
either off-shell effects or initial state radiation. On the other hand, also
the modifications of distributions due to anomalous couplings are presented,
considering either signal diagrams or all diagrams.
","[{""version"":""v1"",""created"":""Thu, 22 Jun 1995 09:20:39 GMT""}]","2008-11-26"
"hep-ph/9506392","Fridger Schremp","M. Gibbs, A. Ringwald and F. Schrempp","QCD--Instanton Induced Final States in Deep Inelastic Scattering","10 pages, latex, epsfig, 9 uuencoded figures",,,"DESY 95-119","hep-ph",,"  We report briefly on a broad and systematic study of possible manifestations
of QCD-instantons at HERA. We concentrate on the high multiplicity final state
structure, reminiscent of an isotropically decaying ``fireball''. First results
of a Monte Carlo simulation are presented, with emphasis on the typical
event-structure and the transverse energy, muon and $K^0$ flows.
","[{""version"":""v1"",""created"":""Thu, 22 Jun 1995 13:30:57 GMT""}]","2007-05-23"
"hep-ph/9506393",,"P.H. Chankowski, Z. Pluciennik, S. Pokorski, C.E. Vayonakis","Gauge Coupling Unification in GUT and String Models","13 pages, raw latex, additional file contains uuencoded figures","Phys.Lett. B358 (1995) 264-272","10.1016/0370-2693(95)00965-N","IFT--95/9, MPI--Pth/95-58, SUSX-TH-95/17","hep-ph",,"  The results for the running of the gauge couplings in the MSSM are up-dated
by proper inclusion of all low scale effects. They are presented as predictions
for the strong coupling constant in the scenario with only two parameters at
the GUT scale ~ ($\alpha_{U}$ ~and ~$M_{U}$) ~and as a mismatch of the
couplings at the scales ~$\sim 3 \times 10^{16}$ GeV ~and ~$4\times10^{17}$
GeV, when all three couplings are taken as the experimental input.
","[{""version"":""v1"",""created"":""Thu, 22 Jun 1995 14:35:58 GMT""}]","2009-10-28"
"hep-ph/9506394","Verma Ramesh C.","R. C. Verma and M. P. Khanna","Cabibbo favored hadronic decays of charmed baryons in flavor SU(3)","25 pages, Latex","Phys.Rev. D53 (1996) 3723-3730","10.1103/PhysRevD.53.3723","June 20 - 95","hep-ph",,"  The two body Cabibbo favored hadronic decays of charmed baryons
$\Lambda^{+}_{c}$, $\Xi^{+}_{c}$ and $\Xi_{c}^{0}$ into an octet or decuplet
baryon and a pseudoscalar meson are examined in the SU(3) symmetry scheme. The
numerical estimates for decay widths and branching ratios of some of the modes
are obtained and are in good agreement with experiment.
","[{""version"":""v1"",""created"":""Thu, 22 Jun 1995 14:38:28 GMT""}]","2009-10-28"
"hep-ph/9506395","My Account","N. Mavromatos and T. Ruf (for the collaboration: J. Ellis, J. Lopez,
  N. Mavromatos, D. Nanopoulos, and the CPLEAR Collaboration)","Experimental tests of CPT symmetry and quantum mechanics at CPLEAR","20 pages (LaTeX), 2 figures (uuencoded)",,,"ENSLAPP-A-530/95","hep-ph hep-th",,"  We review a phenomenological parametrization of an open quantum-mechanical
formalism for CPT violation in the neutral kaon system, and constrain the
parameters using fits to recent CPLEAR data.
","[{""version"":""v1"",""created"":""Thu, 22 Jun 1995 15:16:22 GMT""}]","2007-05-23"
"hep-th/9506142","Moretti Walter","V. Moretti (Dept. Phys. Univ. Trento Italy and INFN)","Wightman Functions' Behaviour on the Event Horizon of an Extremal
  Reissner-Nordstr\""om Black Hole","27 pages, standard LaTex, no figures, final version containing the
  results following from Hessling's principle as they appeared in the other
  paper gr-qc/9510016, minor changes in the text and in references, it will
  appear on Class. Quant. Grav","Class.Quant.Grav. 13 (1996) 985-1006; Erratum-ibid. 14 (1997) 825","10.1088/0264-9381/13/5/016","UTF 350","hep-th gr-qc",,"  A weaker Haag, Narnhofer and Stein prescription as well as a weaker Hessling
Quantum Equivalence Principle for the behaviour of thermal Wightman functions
on an event horizon are analysed in the case of an extremal
Reissner-Nordstr\""{o}m black hole in the limit of a large mass. In order to
avoid the degeneracy of the metric in the stationary coordinates on the
horizon, a method is introduced which employs the invariant length of geodesics
which pass the horizon. First the method is checked for a massless scalar field
on the event horizon of the Rindler wedge, extending the original procedure of
Haag, Narnhofer and Stein onto the {\em whole horizon} and recovering the same
results found by Hessling. Afterwards the HNS prescription and Hessling's
prescription for a massless scalar field are analysed on the whole horizon of
an extremal Reissner-Nordstr\""{o}m black hole in the limit of a large mass. It
is proved that the weak form of the HNS prescription is satisfyed for all the
finite values of the temperature of the KMS states, i.e., this principle does
not determine any Hawking temperature. It is found that the
Reissner-Nordstr\""{o}m vacuum, i.e., $T=0$ does satisfy the weak HNS
prescription and it is the only state which satisfies weak Hessling's
prescription, too. Finally, it is suggested that all the previously obtained
results should be valid dropping the requirements of a massless field and of a
large mass black hole.
","[{""version"":""v1"",""created"":""Wed, 21 Jun 1995 16:04:48 GMT""},{""version"":""v2"",""created"":""Thu, 22 Jun 1995 08:02:13 GMT""},{""version"":""v3"",""created"":""Thu, 6 Jul 1995 09:24:09 GMT""},{""version"":""v4"",""created"":""Fri, 7 Jul 1995 09:53:12 GMT""},{""version"":""v5"",""created"":""Fri, 23 Feb 1996 15:01:56 GMT""}]","2009-10-28"
"hep-th/9506143",,"B. Acharya, D, Bailin, A. Love, W.A. Sabra and S. Thomas","Spontaneous breaking of CP symmetry by orbifold moduli","18 pages, uuencoded ps file, (missing figures added)","Phys.Lett. B357 (1995) 387-396","10.1016/0370-2693(95)00945-H","QMW-PH-95-16 / SUSX-TH-95/14","hep-th",,"  CP-violating phases which contribute to the electric dipole moment(EDM) of
the neutron are considered in the context of orbifold compactificationof the
heterotic string. In particular, we study the situation where CP is
spontaneously broken by moduli fields acquiring, in general, complex
expectation values at the minimum of duality invariant low energy effective
potentials. We show, by explicit minimization of such a potential in the case
of the ${\bf Z}_{6}-{\rm IIb}$ orbifold, that it is the presence of so called
Green-Schwarz anomaly coefficients $\delta_{\rm GS}^{i} $, that leads to
significant CP violating expectation values of the moduli. By evaluating the
soft supersymmetry breaking moduli dependent $A$ and $B$ terms in this model,
we find that the experimental bounds $\Phi (A) $, $ \Phi (B) $ $\leq 5 \times
10^{-3} $ are exceeded for a particular range of values of the auxiliary field
of the $S$ modulus.
","[{""version"":""v1"",""created"":""Wed, 21 Jun 1995 17:49:45 GMT""},{""version"":""v2"",""created"":""Thu, 13 Jul 1995 13:20:07 GMT""}]","2009-10-28"
"hep-th/9506144","Anna Ceresole","A.C. Cadavid, A. Ceresole, R. D'Auria and S. Ferrara","11-Dimensional Supergravity Compactified on Calabi-Yau Threefolds","TeX, harvmac, 8 pgs","Phys.Lett. B357 (1995) 76-80","10.1016/0370-2693(95)00891-N","CERN-TH/95-166, POLFIS-TH. 08/95, UCLA/95/TEP/23","hep-th",,"  We consider generic features of eleven dimensional supergravity compactified
down to five dimensions on an arbitrary Calabi-Yau threefold.
","[{""version"":""v1"",""created"":""Wed, 21 Jun 1995 22:04:18 GMT""}]","2009-10-28"
"hep-th/9506145",,"T.E. Clark and S.T. Love","The Supercurrent In Supersymmetric Field Theories","26 pages, LaTeX","Int.J.Mod.Phys. A11 (1996) 2807-2823","10.1142/S0217751X9600136X","PURD-TH-95-02","hep-th",,"  A supercurrent superfield whose components include a conserved
energy-momentum tensor and supersymmetry current as well as a (generally
broken) R-symmetry current is constructed for a generic effective N=1
supersymmetric gauge theory. The general form of the R-symmetry breaking is
isolated. Included within the various special cases considered is the
identification of those models which exhibit an unbroken R-symmetry. One such
example corresponds to a non-linearly realized gauge symmetry where the chiral
field R-weight is required to vanish.
","[{""version"":""v1"",""created"":""Wed, 21 Jun 1995 18:46:18 GMT""}]","2015-06-26"
"hep-th/9506146","Oswaldo Monteiro del Cima","M.A. de Andrade, O.M. Del Cima and L.P. Colatto","N=1 super-Chern-Simons coupled to parity-preserving matter from
  Atiyah-Ward space-time","7 pages, latex, no figures","Phys.Lett. B370 (1996) 59-64","10.1016/0370-2693(95)01562-0","CBPF-NF-026/95","hep-th",,"  In this letter, we present the Parkes-Siegel formulation for the massive
Abelian $N$$=$$1$ super-{\QED} coupled to a self-dual supermultiplet, by
introducing a chiral multiplier superfield. We show that after carrying out a
suitable dimensional reduction from ($2$$+$$2$) to ($1$$+$$2$) dimensions, and
performing some necessary truncations, the simple supersymmetric extension of
the ${\tau}_{3}$QED$_{1+2}$ coupled to a Chern-Simons term naturally comes out.
","[{""version"":""v1"",""created"":""Wed, 21 Jun 1995 18:24:04 GMT""},{""version"":""v2"",""created"":""Wed, 28 Jun 1995 19:54:14 GMT""}]","2009-10-28"
"hep-th/9506147","Edelstein","Jose D. Edelstein, Carlos N\'u\~nez and Fidel A. Schaposnik","Supergravity and a Bogomol'nyi Bound in Three Dimensions","25 pages, latex, no figures","Nucl.Phys. B458 (1996) 165-188","10.1016/0550-3213(95)00571-4","La Plata-Th 95/10","hep-th gr-qc",,"  We discuss the $2+1$ dimensional Abelian Higgs model coupled to $N=2$
supergravity. We construct the supercharge algebra and, from it, we show that
the mass of classical static solutions is bounded from below by the topological
charge. As it happens in the global case, half of the supersymmetry is broken
when the bound is attained and Bogomol'nyi equations, resulting from the
unbroken supersymmetry, hold. These equations, which correspond to gravitating
vortices, include a first order self-duality equation whose integrability
condition reproduces the Einstein equation.
","[{""version"":""v1"",""created"":""Wed, 21 Jun 1995 23:19:07 GMT""}]","2009-10-28"
"hep-th/9506148","Robert Leigh","K. Intriligator, R.G. Leigh, M.J. Strassler (Rutgers Univ.)","New Examples of Duality in Chiral and Non-Chiral Supersymmetric Gauge
  Theories","61 pages, uses harvmac, uses tables.tex (available from hepth via
  ""get tables.tex"")","Nucl.Phys. B456 (1995) 567-621","10.1016/0550-3213(95)00473-1","RU-95-38","hep-th",,"  We present evidence for renormalization group fixed points with dual magnetic
descriptions in fourteen new classes of four-dimensional $N=1$ supersymmetric
models. Nine of these classes are chiral and many involve two or three gauge
groups. These theories are generalizations of models presented earlier by
Seiberg, by Kutasov and Schwimmer, and by the present authors. The different
classes are interrelated; one can flow from one class to another using
confinement or symmetry breaking.
","[{""version"":""v1"",""created"":""Wed, 21 Jun 1995 22:41:59 GMT""}]","2009-10-28"
"hep-th/9506149",,"Mary K. Gaillard","Pauli-Villars Regularization of Supergravity and Field Theory Anomalies","8 pages, Talk given at SUSY95, l'Ecole Polytechnique, Palaiseau,
  France, May 15-19, 1995",,,"LBL-37425, UCB-PTH-95/19","hep-th hep-ph",,"  A procedure for Pauli-Villars regularization of locally and globally
supersymmetric theories is described. Implications for specific theories,
especially those obtained from superstrings, are discussed with emphasis on the
role of field theory anomalies.
","[{""version"":""v1"",""created"":""Wed, 21 Jun 1995 23:13:31 GMT""}]","2007-05-23"
"hep-th/9506150","Paul Townsend","G. Papadopoulos and P.K. Townsend","Compactification of D=11 supergravity on spaces of exceptional holonomy","Minor amendments plus some new references","Phys.Lett.B357:300-306,1995","10.1016/0370-2693(95)00929-F","DAMTP, R/95/31","hep-th",,"  We investigate the compactification of D=11 supergravity to D=5,4,3, on
compact manifolds of holonomy $SU(3)$ (Calabi-Yau), $G_2$, and $Spin(7)$,
respectively, making use of examples of the latter two cases found recently by
Joyce. In each case the lower dimensional theory is a Maxwell/Einstein
supergravity theory. We find evidence for an equivalence, in certain cases,
with heterotic string compactifications from D=10 to D=5,4,3, on compact
manifolds of holonomy $SU(2)$ ($K_3\times S^1$), $SU(3)$, and $G_2$,
respectively. Calabi-Yau manifolds with Hodge numbers $h_{1,1}=h_{1,2}=19$ play
a significant role in the proposed equivalences.
","[{""version"":""v1"",""created"":""Thu, 22 Jun 1995 14:36:11 GMT""},{""version"":""v2"",""created"":""Fri, 30 Jun 1995 17:58:32 GMT""}]","2009-10-09"
"hep-th/9506154",,"Vu B Ho","A metric of Yukawa potential as an exact solution to the field equations
  of general relativity","Latex 4 pages (some changes in notation, and a discussion on a
  repulsive term that may be related to the charge of a particle)",,,,"hep-th gr-qc nucl-th",,"  It is shown that, by defining a suitable energy momentum tensor, the field
equations of general relativity admit a line element of Yukawa potential as an
exact solution. It is also shown that matter that produces strong force may be
negative, in which case there would be no Schwarzschild-like singularity
","[{""version"":""v1"",""created"":""Thu, 22 Jun 1995 10:28:28 GMT""},{""version"":""v2"",""created"":""Sat, 24 Jun 1995 10:16:02 GMT""},{""version"":""v3"",""created"":""Sun, 25 Jun 1995 17:11:58 GMT""}]","2008-02-03"
"hep-th/9506155","Andrea Cappelli","Andrea Cappelli and Paolo Valtancoli","Spontaneous Symmetry Breaking in the Non-Abelian Anyon Fluid","Latex file, 35 pages, 2 Latex figures included","Nucl.Phys.B453:727-758,1995","10.1016/0550-3213(95)00447-Z","preprint DFF 228/5/95","hep-th cond-mat",,"  We study the theory of non-relativistic matter with non-Abelian $U(2)$
Chern-Simons gauge interaction in $(2+1)$ dimensions. We adopt the mean field
approximation in the current-algebra formulation already applied to the Abelian
anyons. We first show that this method is able to describe both ``boson-based''
and ``fermion-based'' anyons and yields consistent results over the whole range
of fractional statistics. In the non-Abelian theory, we find a superfluid (and
superconductive) phase, which is smoothly connected with the Abelian superfluid
phase originally discovered by Laughlin. The characteristic massless excitation
is the Goldstone particle of the specific mechanism of spontaneous symmetry
breaking. An additional massive mode is found by diagonalizing the non-Abelian,
non-local, Hamiltonian in the radial gauge.
","[{""version"":""v1"",""created"":""Thu, 22 Jun 1995 12:13:03 GMT""}]","2011-07-21"
