"hep-th/9506175","Norma Mankoc Borstnik,Dept. of Phys. Jadranska","Norma Manko\v{c} Bor\v{s}tnik and Svjetlana Fajfer","Spins and Charges, the Algebra and Subalgebras of the Group SO(1,14) and
  Grassmann Space","LaTex, 33 pages, the title, the introduction and the conclusions are
  changed and misprints are corrected. To appear in Journal of Physics A",,,"IJS.TP.95/3","hep-th",,"  In a space of $d=15 $ Grassmann coordinates, two types of generators of the
Lorentz transformations, one of spinorial and the other of vectorial character,
both linear operators in Grassmann space, forming the group $ SO(1,14) $ which
contains as subgroups $ SO(1,4) $ and $ SO(10) $ ${\supset SU(3)} { \times
SU(2)} { \times U(1)} $, define the fundamental and the adjoint representations
of the group, respectively. The eigenvalues of the commuting operators can be
identified with spins of fermionic and bosonic fields $ (SO(1,4)) $, as well as
with their Yang-Mills charges $ (SU(3)$, $ SU(2)$, $ U(1)) $, offering the
unification of not only all Yang - Mills charges but of all the internal
degrees of freedom of fermionic and bosonic fields - Yang - Mills charges and
spins - and accordingly of all interactions - gauge fields and gravity. The
theory suggests that elementary particles are either in the ""spinorial""
representations with respect to spins and all charges, or they are in the
""vectorial"" representations with respect to spins and all charges, which indeed
is the case with the quarks, the leptons and the gauge bosons.
  The algebras of the two kinds of generators of Lorentz transformations in
Grassmann space were studied and the representations are commented on.
","[{""version"":""v1"",""created"":""Thu, 22 Jun 1995 10:54:05 GMT""},{""version"":""v2"",""created"":""Mon, 24 Jul 1995 13:32:59 GMT""},{""version"":""v3"",""created"":""Mon, 26 Aug 1996 16:15:49 GMT""}]","2008-02-03"
"mtrl-th/9506006","Dan Sullivan","E. L. Briggs, D. J. Sullivan, and J. Bernholc (North Carolina State
  Univ.)","Large Scale Electronic Structure Calculations with Multigrid
  Acceleration","4 pages, 1 postscript figure",,"10.1103/PhysRevB.52.R5471",,"mtrl-th cond-mat.mtrl-sci",,"  We have developed a set of techniques for performing large scale ab initio
calculations using multigrid accelerations and a real-space grid as a basis.
The multigrid methods permit efficient calculations on ill-conditioned systems
with long length scales or high energy cutoffs. The technique has been applied
to systems containing up to 100 atoms, including a highly elongated diamond
cell, an isolated C$_{60}$ molecule, and a 32-atom cell of GaN with the Ga
d-states in valence. The method is well suited for implementation on both
vector and massively parallel architectures.
","[{""version"":""v1"",""created"":""Wed, 21 Jun 1995 19:10:12 GMT""}]","2009-10-28"
"nucl-th/9506015","Elaine Remillard","K. C. Chase and A. Z. Mekjian","Heated nuclear matter, condensation phenomena and the hadronic equation
  of state","12 pages, revtex, 1 ps file appended (figure 1)","Phys.Rev.Lett. 75 (1995) 4732-4735","10.1103/PhysRevLett.75.4732","RU9542","nucl-th",,"  The thermodynamic properties of heated nuclear matter are explored using an
exactly solvable canonical ensemble model. This model reduces to the results of
an ideal Fermi gas at low temperatures. At higher temperatures, the
fragmentation of the nuclear matter into clusters of nucleons leads to features
that resemble a Bose gas. Some parallels of this model with the phenomena of
Bose condensation and with percolation phenomena are discussed. A simple
expression for the hadronic equation of state is obtained from the model.
","[{""version"":""v1"",""created"":""Wed, 21 Jun 1995 17:50:51 GMT""}]","2009-10-28"
"supr-con/9506003","E. H. Brandt","Ernst Helmut Brandt (Max-Planck-Institut f\""ur Metallforschung,
  Stuttgart)","The Flux-Line Lattice in Superconductors","Review paper for Rep.Prog.Phys., 124 narrow pages. The 30 figures do
  not exist as postscript files",,"10.1088/0034-4885/58/11/003",,"supr-con cond-mat.supr-con",,"  Magnetic flux can penetrate a type-II superconductor in form of Abrikosov
vortices. These tend to arrange in a triangular flux-line lattice (FLL) which
is more or less perturbed by material inhomogeneities that pin the flux lines,
and in high-$T_c$ supercon- ductors (HTSC's) also by thermal fluctuations. Many
properties of the FLL are well described by the phenomenological
Ginzburg-Landau theory or by the electromagnetic London theory, which treats
the vortex core as a singularity. In Nb alloys and HTSC's the FLL is very soft
mainly because of the large magnetic penetration depth: The shear modulus of
the FLL is thus small and the tilt modulus is dispersive and becomes very small
for short distortion wavelength. This softness of the FLL is enhanced further
by the pronounced anisotropy and layered structure of HTSC's, which strongly
increases the penetration depth for currents along the c-axis of these uniaxial
crystals and may even cause a decoupling of two-dimensional vortex lattices in
the Cu-O layers. Thermal fluctuations and softening may melt the FLL and cause
thermally activated depinning of the flux lines or of the 2D pancake vortices
in the layers. Various phase transitions are predicted for the FLL in layered
HTSC's. The linear and nonlinear magnetic response of HTSC's gives rise to
interesting effects which strongly depend on the geometry of the experiment.
","[{""version"":""v1"",""created"":""Thu, 22 Jun 1995 12:35:15 GMT""}]","2009-10-28"
