"gr-qc/9506051","Shinji Hamamoto","C. Dariescu, S. Hamamoto, Marina-Aura Dariescu (Toyama Univ.)","A Toy Model Approach to the Canonical Non-perturbative Quantization of
  the Spatially Flat Robertson-Walker Spacetimes with Cosmological Constant","22 pages, LaTex",,,,"gr-qc",,"  We present a toy model approach to the canonical non-perturbative
quantization of the spatially-flat Robertson-Walker Universes with cosmological
constant, based on the fact that such models are exactly solvable within the
framework of a simple Lagrangian formulation. The essential quantum dynamical
metric-field and the corresponding Hamiltonian, explicitly derived in terms of
annihilation and creation operators, point out that the Wheeler - DeWitt
equation is a natural (quantum) generalization of the $G_{44}$ - Einstein
equation for the classical De Sitter spacetime and selects the physical states
of the quantum De Sitter Universe. As a result of the exponential universal
expansion, the usual Fock states (defined as the eigenstates of the
number-operator) are no longer invariant under the derived Hamiltonian. They
exhibit quantum fluctuation of the energy and of the metric field which lead to
a (geometrical) volume quantization.
","[{""version"":""v1"",""created"":""Fri, 23 Jun 1995 14:41:00 GMT""},{""version"":""v2"",""created"":""Sat, 24 Jun 1995 06:34:00 GMT""}]","2008-02-03"
"hep-ph/9506396","Fawzi Boudjema","M. Baillargeon, F.Boudjema, E. Chopin, V. Lafage","New Physics with three-photon events at LEP","No changes made from previous version, 34 pages, LateX, uses epsf, 11
  .eps figs., full paper (including figs) is also available via WWW at
  http://lapphp0.in2p3.fr/preplapp/psth/lastee3g.ps.gz or via anonymous ftp at
  ftp:///lapphp0.in2p3.fr/pub/preprints-theorie/ftpee3g.uu","Z.Phys.C71:431-442,1996","10.1007/s002880050188","ENSLAPP-A-518/95 and FISIST/6-95/CFIF","hep-ph",,"  The effect of the most general \z3gt vertex in the reaction $e^+e^- \ra
3\gamma$ is studied with a particular attention to LEP searches. We give exact
analytical expressions including realistic cuts for the signal and present a
detailed analysis based on a Monte Carlo that includes the effect of the
irreducible $3\gamma$ QED cross section. As special applications we discuss the
effect of heavy scalars, fermions and gauge bosons and comment on the
``monopole"" connection.
","[{""version"":""v1"",""created"":""Thu, 22 Jun 1995 16:16:02 GMT""},{""version"":""v2"",""created"":""Fri, 8 Mar 1996 16:27:43 GMT""}]","2019-08-15"
"hep-ph/9506397","T. P. Cheng","Ling-Fong Li and T. P. Cheng","Spin and Flavor Contents of the Proton","Corrected a latex error and added report #'s in the revised version.
  Latex and Revtex, 7 pages, Invited talk presented by Ling-Fong Li at the
  International Symposium of Particle Theory and Phenomenology, Ames, Iowa, May
  22-24, 1995",,,,"hep-ph",,"  After a brief review of the experimental results obtained in deep inelastic
lepton-nucleon scatterings and the Drell-Yan processes and their implications
for the spin and flavor contents of the nucleon, we suggest that those
features, that are contrary to the expectations of the naive quark model, can
all be accounted for in the chiral quark model of Georgi and Manohar. In our
formulation of the chiral quark model, the $\eta ^{\prime }$ meson is seen to
play an important role.
","[{""version"":""v1"",""created"":""Thu, 22 Jun 1995 17:04:24 GMT""},{""version"":""v2"",""created"":""Fri, 23 Jun 1995 17:35:44 GMT""}]","2008-02-03"
"hep-ph/9506398","Jonathan Flynn","UKQCD Collaboration, J M Flynn, J Nieves, K C Bowler, N M Hazel, D S
  Henty, H Hoeber, R D Kenway, D G Richards, B J Gough, H P Shanahan and L P
  Lellouch","Lattice Study of the Decay B^0-bar -> rho^+ l^- nu_l-bar:
  Model-Independent Determination of |V_{ub}|","22 pages LaTeX-209 (dependent on settings in a4.sty), 23 PostScript
  figures included with epsf.sty. Complete PostScript file including figures
  available at http://wwwhep.phys.soton.ac.uk/hepwww/papers/shep9518/","Nucl.Phys. B461 (1996) 327-349","10.1016/0550-3213(95)00595-1","Southampton SHEP 95-18, Edinburgh 95/551, Marseille CPT-95/PE.3218","hep-ph",,"  We present results of a lattice computation of the vector and axial-vector
current matrix elements relevant for the semileptonic decay B^0-bar -> rho^+
l^- nu_l-bar. The computations are performed in the quenched approximation of
lattice QCD on a 24^3 x 48 lattice at beta = 6.2, using an O(a) improved
fermionic action. Our principal result is for the differential decay rate,
dGamma/dq^2, for the decay B^0-bar -> rho^+ l^- nu_l-bar in a region beyond the
charm threshold, allowing a model-independent extraction of |V_{ub}| from
experimental measurements. Heavy quark symmetry relations between radiative and
semileptonic decays of B-bar mesons into light vector mesons are also
discussed.
","[{""version"":""v1"",""created"":""Thu, 22 Jun 1995 17:40:44 GMT""}]","2009-10-28"
"hep-ph/9506399",,"Zheng Huang (LBL)","Reinterpretation of Thermal Dilepton Emission Rate by Spectral Functions","12 pages in LaTeX, two uuencoded postscript figures","Phys.Lett. B361 (1995) 131-136","10.1016/0370-2693(95)01036-P","LBL-37426 UCB-PTH-95/20","hep-ph nucl-th",,"  We reinterpret the dilepton emission rate from a hadronic gas expected to be
produced in heavy ion collisions in terms of the spectral functions available
from the $e^+e^-$ annihilation and the $\tau$ lepton decays experiments. We
take into account all possible hadronic state especially the multi-pion
contributions to the dilepton emission and the parity mixing phenomenon due to
the soft final-state corrections. A new compilation of the experimental data
for the spectral functions is presented.
","[{""version"":""v1"",""created"":""Thu, 22 Jun 1995 23:48:16 GMT""}]","2015-06-25"
"hep-ph/9506400","D. P. Roy","D.P. Roy","The Top Story","15 pages, 8 figures available on request. Based on the talks given at
  The Seminar on Recent Advances in Theoretical Physics, Hyderabad, 7-8 Apr
  1995 and The Meeting on Particle Physics, Calcutta, 20-21 Apr 1995",,,"TIFR/TH/95-27","hep-ph",,"  This is an overview of top quark search, with particular emphasis on the more
recent results. After a brief introduction to the basic constituents of matter
and their interactions, I shall discuss the indirect evidences for the
existence of top quark and its mass from LEP and finally the direct observation
of a top quark signal recently reported from the Tevatron collider. I shall try
to put these results in perspective and provide some insight into the physics
issues involved in the top quark search.
","[{""version"":""v1"",""created"":""Fri, 23 Jun 1995 11:26:12 GMT""}]","2009-09-25"
"hep-ph/9506401","Robert Peschanski","R. Peschanski","Is it Possible to Unify the QCD Evolution of Structure Functions in $X$
  and $Q^2$ ?","7 pages, latex, no figures; Contribution to the XXXth Rencontres de
  MORIOND - March, 19-26,1995",,,"Saclay preprint SPhT T95/78","hep-ph",,"  We start from the two existing QCD evolution equations for structure
functions, the BFKL and DGLAP equations, and discuss the theoretical hints for
a unifying picture of the evolution in $x$ and $Q^2.$ The main difficulty is
due to the property of angular ordering of the gluon radiation driving the
evolution and the cancellation of the related collinear singularities. At the
leading $\log\ 1/x$ and leading $\log \ Q^2$ accuracy, we find a unified set of
equations satisfying the constraints.
","[{""version"":""v1"",""created"":""Fri, 23 Jun 1995 09:07:34 GMT""}]","2007-05-23"
"hep-ph/9506403","Johannes Bluemlein","J. Bl\""umlein","On the $k_{\perp}$ dependent gluon density of the proton","4 pages, uuencoded ps file",,,"DESY 95--121","hep-ph",,"  The $k_{\perp}$ dependent gluon distribution is calculated accounting for the
resummation of small~$x$ effects due to the Lipatov equation. It is represented
by a convolution of a gluon density in the collinear limit and a universal
function ${\cal G}(x,k^2,\mu)$ for which an analytic expression is derived.
","[{""version"":""v1"",""created"":""Fri, 23 Jun 1995 10:51:46 GMT""}]","2007-05-23"
"hep-ph/9506404","Jake Lee","C. S. Kim and Jake Lee","Large $p_T$ Hadroproduction of $Z$ as a Probe of Gluon Distribution
  inside Proton","(a) 13 pages(LaTeX) + 1 figure ps file(3 pages):compressed, uuencoded
  (b) accepted by Phys.Lett.B. (c) some figures are combined and one is
  omitted. (d) conclusion part is included into abstract","Phys.Lett. B366 (1996) 293","10.1016/0370-2693(95)01315-6","YUMS 95-014, SNUTP 95-053","hep-ph",,"  The transverse momentum distribution of single vector boson production at
hadron colliders provides useful ways of testing the Standard Model and
searching new physics beyond the Standard Model. We study large $p_{_T}$
hadroproduction of $Z$-boson as a probe of gluon distributions inside proton.
We investigate how to get initial gluon-involving contributions, or how to
subtract quark-quark (or -antiquark) contributions from total cross section. We
also investigated the simultaneous measurement of the rapidity and the
transverse momentum of the produced $Z$ boson, to obtain momentum fractions of
initial partons. And we extracted relevant uncertainties involving in
experimental and theoretical analyses. This large $p_{_T}$ hadroproduction of
$Z$ can be used as constraints on analyses of global parton (gluon and quarks)
distribution functions inside proton.
","[{""version"":""v1"",""created"":""Fri, 23 Jun 1995 12:51:06 GMT""},{""version"":""v2"",""created"":""Tue, 24 Oct 1995 06:05:34 GMT""}]","2009-10-28"
"hep-ph/9506405","Murray Moinester","Murray A. Moinester","How to Search for Doubly Charmed Baryons and Tetraquarks","21 pages text (latex), Review paper, submitted to Zeitschrift fur
  Physik A, Revised 30 June 1995 for additions to intrinsic charm discussion","Z.Phys.A355:349-362,1996","10.1007/s002180050123","Tel Aviv University TAUP-2255-95, 21 June 1995","hep-ph",,"  Possible experimental searches of doubly charmed baryons and tetraquarks at
fixed target experiments with high energy hadron beams and a high intensity
spectrometer are considered here. The baryons considered are: $\Xi_{cc}^{+}$
(ccd), $\Xi_{cc}^{++}$ (ccu), and $\Omega_{cc}^{+}$ (ccs); and the tetraquark
is T ($cc\bar{u}\bar{d}$). Estimates are given of masses, lifetimes, internal
structure, production cross sections, decay modes, branching ratios, and
yields. Experimental requirements are given for optimizing the signal and
minimizing the backgrounds. This paper is designed as an experimental and
theoretical review. It may therefore be of assistance in the planning for a
future state-of-the-art very charming experiment, in the spirit of the aims of
the recent CHARM2000 workshop.
","[{""version"":""v1"",""created"":""Fri, 23 Jun 1995 14:09:36 GMT""},{""version"":""v2"",""created"":""Sat, 24 Jun 1995 14:27:22 GMT""},{""version"":""v3"",""created"":""Fri, 30 Jun 1995 14:38:24 GMT""}]","2014-11-17"
"hep-ph/9506406","Alexander V. Lanyov","A.A.Bel'kov, A.V.Lanyov and S.Scherer","$\gamma\gamma\to\pi^0\pi^0$ and $\eta\to\pi^0\gamma\gamma$ at $O(p^6)$
  in the NJL model","16 pages, LaTeX, 2 figures included. Complete Postscript file is
  available at http://cv.jinr.dubna.su/~lanyov/save/gg-prep.ps","J.Phys.G22:1383-1394,1996","10.1088/0954-3899/22/10/004","JINR E2-95-266, MKPH-T-95-08","hep-ph",,"  We discuss the processes $\gamma\gamma\to\pi^0\pi^0$ and $\eta\to\pi^0
\gamma\gamma$ at $O(p^6)$ in the momentum expansion. The calculation involves
tree--level, one--loop and two--loop diagrams of a chiral effective lagrangian
which is obtained by a bosonization of the NJL model. The importance of
integrating out meson resonances (reduction) is pointed out. Our final results
for the total cross section of $\gamma\gamma\to\pi^0\pi^0$ are in good
agreement with the experimental data of the Crystal Ball Collaboration. For the
width of the $\eta\to\pi^0\gamma\gamma$ decay we obtain the value $0.11$ eV
which has to be compared with the experimental value of $(0.84 \pm 0.18)$ eV.
Alternatively, taking empirical parameters from a vector--meson--dominance
model the prediction for the decay width is $0.35$ eV. We present a prediction
for the differential decay probability as a function of
$m_{\gamma\gamma}^2/m_\eta^2$.
","[{""version"":""v1"",""created"":""Fri, 23 Jun 1995 14:14:07 GMT""},{""version"":""v2"",""created"":""Sat, 24 Jun 1995 14:50:01 GMT""}]","2008-11-26"
"hep-ph/9506407",,"F. Feruglio, A. Masiero, S. Rigolin and R. Strocchi","Bounds on Heavy Chiral Fermions","14 pages, LaTeX, 3 uuencoded postscript figures in additional file","Phys.Lett. B355 (1995) 329-336","10.1016/0370-2693(95)00696-I","DFPD 95/TH/27","hep-ph",,"  We derive the low-energy electroweak effective lagrangian for the case of
additional heavy, unmixed, sequential fermions. Present data still allow for
the presence of a new quark and/or lepton doublet with masses greater than
$M_Z/2$, provided that these multiplets are sufficiently degenerate. Deviations
of the effective lagrangian predictions from a full one-loop computation are
sizeable only for fermion masses close to the threshold $M_Z/2$. Some of the
constraints on new sequential fermions coming from accelerator results and
cosmological considerations are presented. We point out that the new fermions
can significantly affect the production and decay rate into $\gamma \gamma$ of
the intermediate Higgs at LHC.
","[{""version"":""v1"",""created"":""Fri, 23 Jun 1995 13:28:02 GMT""}]","2009-10-28"
"hep-ph/9506408","Ralf Hempfling","Ralf Hempfling","Supersymmetry at Present and Future Colliders","7 pages, LATEX, uses world-sci.sty file required ; talk given at the
  Ringberg Workshop ``Dark Matter in the Universe'', Ringberg, Germany, Mar.
  6-10, 1995, to appear in the proceedings",,,"MPI-PhT/95-56","hep-ph",,"  The theoretical expectations for the supersymmetric particle spectrum is
reviewed and a brief overview on present constraints on supersymmetric models
from collider experiments is presented. Finally, we discuss the discovery
potential of future collider experiments.
","[{""version"":""v1"",""created"":""Fri, 23 Jun 1995 14:04:59 GMT""}]","2007-05-23"
"hep-ph/9506409",,"Andrew Bordner (Kyoto University)","Parameter Bounds in the Supersymmetric Standard Model from Charge/Color
  Breaking Vacua","23 pages, 5 Postscript figures, uses revtex.sty and epsf.sty",,,"KUNS-1351","hep-ph",,"  We calculate limits on the trilinear soft-breaking parameter, $A_{t}$, in the
Minimal Supersymmetric Standard model by requiring the absence of nonzero top
squark vacuum expectation values. Assuming a low $\tan\beta$, which implies a
large top Yukawa coupling, we also calculate one-loop corrections to the
effective potential. The resulting numerical calculations of the charge/color
breaking limits are presented as best-fit surfaces. We compare these results
with the analytical limit, $A_{t}^{2} < 3(m_{2}^{2}+m_{q}^{2}+m_{t}^{2})$, and
find that although this bound is a good estimate of the charge/color breaking
bounds for a simplified model of the top sector, stricter bounds are found by a
numerical minimization of the Minimal Supersymmetric Standard Model potential.
","[{""version"":""v1"",""created"":""Fri, 23 Jun 1995 14:30:44 GMT""}]","2007-05-23"
"hep-th/9506151",,"JM Figueroa-O'Farrill and S Stanciu","Nonreductive WZW models and their CFTs","dvi.uu (34 pages)","Nucl.Phys. B458 (1996) 137-164","10.1016/0550-3213(95)00556-0","QMW-PH-95-16","hep-th",,"  We study two-dimensional WZW models with target space a nonreductive Lie
group. Such models exist whenever the Lie group possesses a bi-invariant
metric. We show that such WZW models provide a lagrangian description of the
nonreductive (affine) Sugawara construction. We investigate the gauged WZW
models and we prove that gauging a diagonal subgroup results in a conformal
field theory which can be identified with a coset construction. A large class
of exact four-dimensional string backgrounds arise in this fashion. We then
study the topological conformal field theory resulting from the $G/G$ coset. We
identify the Kazama algebra extending the BRST algebra, and the BV algebra
structure in BRST cohomology which it induces.
","[{""version"":""v1"",""created"":""Thu, 22 Jun 1995 16:47:18 GMT""},{""version"":""v2"",""created"":""Fri, 23 Jun 1995 09:18:07 GMT""}]","2009-10-28"
"hep-th/9506152",,"JM Figueroa-O'Farrill and S Stanciu","On the structure of symmetric self-dual Lie algebras","19 pages, .dvi.uu (needs AMSFonts 2.1+)","J.Math.Phys. 37 (1996) 4121-4134","10.1063/1.531620","QMW-PH-95-24","hep-th",,"  A finite-dimensional Lie algebra is called (symmetric) self-dual, if it
possesses an invariant nondegenerate (symmetric) bilinear form. Symmetric
self-dual Lie algebras have been studied by Medina and Revoy, who have proven a
very useful theorem about their structure. In this paper we prove a refinement
of their theorem which has wide applicability in Conformal Field Theory, where
symmetric self-dual Lie algebras start to play an important role due to the
fact that they are precisely the Lie algebras which admit a Sugawara
construction. We also prove a few corollaries which are important in Conformal
Field Theory. (This paper provides mathematical details of results used, but
only sketched, in the companion paper hep-th/9506151.)
","[{""version"":""v1"",""created"":""Thu, 22 Jun 1995 16:46:54 GMT""},{""version"":""v2"",""created"":""Fri, 23 Jun 1995 09:18:37 GMT""}]","2009-10-28"
"hep-th/9506153","Ali Mostafazadeh","Ali Mostafazadeh","Topological Aspects of Parasupersymmetry","LaTeX File, 10 pages",,,"ipm-June 1995","hep-th",,"  Parasupersymmetric quantum mechanics is exploited to introduce a topological
invariant associated with a pair of parameter dependent Fredholm (respectively
elliptic differential) operators satisfying two compatibility conditions. An
explicit algebraic expression for this topological invariant is provided. The
latter identifies the parasupersymmetric topological invariant with the sum of
the analytic (Atiyah-Singer) indices of the corresponding operators.
","[{""version"":""v1"",""created"":""Thu, 22 Jun 1995 16:36:36 GMT""}]","2007-05-23"
"hep-th/9506156","Tomas Ortin","Eric Bergshoeff, Bert Janssen, Tomas Ortin","Solution--Generating Transformations and the String Effective Action","latex file, 42 pages (less if you use optional commands) No changes
  at all. Resubmited due to mailer problems","Class.Quant.Grav. 13 (1996) 321-343","10.1088/0264-9381/13/3/002","UG-1/95, QMW-PH-95-1","hep-th",,"  We study exhaustively the solution-generating transformations (dualities)
that occur in the context of the low-energy effective action of superstring
theory. We first consider target-space duality (``T duality'') transformations
in absence of vector fields. We find that for one isometry the full duality
group is (SO^{\uparrow}(1,1))^{3} x D_{4}, the discrete part (D_{4}) being
non-Abelian. We, then, include non-Abelian Yang--Mills fields and find the
corresponding generalization of the T duality transformations. We study the
\alpha^{\prime} corrections to these transformations and show that the T
duality rules considerably simplify if the gauge group is embedded in the
holonomy group. Next, in the case in which there are Abelian vector fields, we
consider the duality group that includes the transformation introduced by Sen
that rotates among themselves components of the metric, axion and vector field.
Finally we list the duality symmetries of the Type II theories with one
isometry.
","[{""version"":""v1"",""created"":""Fri, 23 Jun 1995 01:29:14 GMT""},{""version"":""v2"",""created"":""Sat, 10 Feb 1996 21:33:14 GMT""},{""version"":""v3"",""created"":""Fri, 9 Feb 1996 10:51:29 GMT""},{""version"":""v4"",""created"":""Thu, 15 Feb 1996 11:34:21 GMT""}]","2009-10-28"
"hep-th/9506157","Yao-zhong Zhang","Takeo Inami, Satoru Odake and Yao-Zhong Zhang","Supersymmetric extension of the sine-Gordon theory with integrable
  boundary interactions","Latex 9 pages, submitted to Phys. Lett. B","Phys.Lett. B359 (1995) 118-124","10.1016/0370-2693(95)01072-X","Kyoto University and Shinshu University preprint YITP/K-1109,
  DPSU-95-2","hep-th cond-mat",,"  Integrability and supersymmetry of the supersymmetric extension of the
sine-Gordon theory on a half-line are examined and the boundary potential which
preserves both the integrability and supersymmetry on the bulk is derived. It
appears that unlike the boundary bosonic sine-Gordon theory, integrability and
supersymmetry strongly restrict the form and parameters of the boundary
potential, so that no free parameter in the boundary term is allowed up to a
choice of signs.
","[{""version"":""v1"",""created"":""Fri, 23 Jun 1995 06:36:53 GMT""}]","2009-10-28"
"math/9506213",,"Tomasz Dubejko","Circle Packings in the Unit Disc",,,,"MSRI 1995-054","math.CV",,"  A Bl-packing is a (branched) circle packing that ``properly covers'' the unit
disc. We establish some fundamental properties of such packings. We give
necessary and sufficient conditions for their existence, prove their
uniqueness, and show that their underlying surfaces, known as carriers, are
quasiconformally equivalent to surfaces of classical Blaschke products. We also
extend our earlier approximation results of to general combinatorial patterns
of tangencies in Bl-packings. Finally, a branched version of the Discrete
Uniformization Theorem of Beardon and Stephenson is given.
","[{""version"":""v1"",""created"":""Fri, 23 Jun 1995 00:00:00 GMT""}]","2016-09-06"
"nucl-th/9506016",,"R. Knorren, M. Prakash and P.J. Ellis","Strangeness in Hadronic Stellar Matter","36 pages, revtex, figures by fax/mail from authors","Phys.Rev.C52:3470-3482,1995","10.1103/PhysRevC.52.3470","SUNY-NTG-95-15, NUC-MINN-95-13-T","nucl-th",,"  We examine the presence of strangeness-bearing components, hyperons and
kaons, in dense neutron star matter. Calculations are performed using
relativistic mean field models, in which both the baryon-baryon and kaon-baryon
interactions are mediated by meson exchange. Results of kaon condensation are
found to be qualitatively similar to previous work with chiral models, if
compatibility of the kaon optical potentials is required. The presence of
strangeness, be it in the form of hyperons or kaons, implies a reduction in the
maximum mass and a relatively large number of protons, sufficient to allow
rapid cooling to take place. The need to improve upon the poorly-known
couplings of the strange particles, which determine the composition and
structure of neutron stars, is stressed. We also discuss generic problems with
effective masses in mean field theories.
","[{""version"":""v1"",""created"":""Thu, 22 Jun 1995 18:11:46 GMT""}]","2009-09-25"
"nucl-th/9506017","Silas Beane","S.R. Beane, C.Y. Lee, and U. van Kolck","Neutral Pion Photoproduction on Nuclei in Baryon Chiral Perturbation
  Theory","24 pages, 4 uuencoded postscript figures, uses LaTex and epsf.tex.
  Added footnote and references. Minor changes in text and format","Phys.Rev.C52:2914-2924,1995","10.1103/PhysRevC.52.2914","DUKE-TH-95-88, DOE/ER/40427-06-N95","nucl-th hep-ph",,"  Threshold neutral pion photoproduction on light nuclei is studied in the
framework of baryon chiral perturbation theory. We obtain a general formula for
the electric dipole amplitude in the special case of neutral pion
photoproduction on a nucleus. To third order in small momenta, the amplitude is
a sum of 2- and 3-body interactions with no undetermined parameters. With
reasonable input from the single nucleon sector, our result for neutral pion
photoproduction on the deuteron is in agreement with experiment.
","[{""version"":""v1"",""created"":""Thu, 22 Jun 1995 20:13:51 GMT""},{""version"":""v2"",""created"":""Thu, 7 Dec 1995 22:29:49 GMT""}]","2008-11-26"
"nucl-th/9506019","Elaine Remillard","M.S. Fayache, S. Shelly Sharma and L. Zamick","The Isovector Quadrupole-Quadrupole Interaction Used in Shell Model
  Calculations","12 pages, revtex, 2 figures (available on request)",,"10.1016/0370-2693(95)00899-V","RU9543","nucl-th",,"  An interaction $-\chi Q\cdot Q(1+B\vec{\tau}(1)\cdot \vec{\tau}(2))$ is used
in a shell model calculation for $^{10}Be$. Whereas for $B=0$ the $2_1^+$ state
is two-fold degenerate, introducing a negative $B$ causes an `isovector' $2^+$
state to come down to zero energy at $B=-0.67$ and an $S=1~L=1$ triplet
($J=0^+,~1^+,~2^+$) to come down to zero energy at $B=-0.73$. These are
undesirable properties, but a large negative $B$ is apparently needed to fit
the energy of the isovector giant quadrupole resonance.
","[{""version"":""v1"",""created"":""Fri, 23 Jun 1995 13:50:18 GMT""}]","2009-10-28"
