"q-alg/9506017","Gustav Delius","Gustav W. Delius and Andreas Hueffmann (Dept. Of Mathematics, King's
  College, London)","On Quantum Lie Algebras and Quantum Root Systems","22 pages, latex, version to appear in J. Phys. A. see
  http://www.mth.kcl.ac.uk/~delius/q-lie.html for calculations and further
  information","J.Phys.A29:1703-1722,1996","10.1088/0305-4470/29/8/018","KCL-TH-95-04","q-alg hep-th math.QA",,"  As a natural generalization of ordinary Lie algebras we introduce the concept
of quantum Lie algebras ${\cal L}_q(g)$. We define these in terms of certain
adjoint submodules of quantized enveloping algebras $U_q(g)$ endowed with a
quantum Lie bracket given by the quantum adjoint action. The structure
constants of these algebras depend on the quantum deformation parameter $q$ and
they go over into the usual Lie algebras when $q=1$.
  The notions of q-conjugation and q-linearity are introduced. q-linear
analogues of the classical antipode and Cartan involution are defined and a
generalised Killing form, q-linear in the first entry and linear in the second,
is obtained. These structures allow the derivation of symmetries between the
structure constants of quantum Lie algebras.
  The explicitly worked out examples of $g=sl_3$ and $so_5$ illustrate the
results.
","[{""version"":""v1"",""created"":""Thu, 22 Jun 1995 17:12:46 GMT""},{""version"":""v2"",""created"":""Tue, 6 Feb 1996 16:35:50 GMT""}]","2016-09-08"
"q-alg/9506018","Timothy J. Hodges","Timothy J. Hodges","On the Cremmer-Gervais quantizations of SL(n)","14 pages, AMS-Latex",,,,"q-alg math.QA",,"  Non-standard quantum groups $C_R [GL(n)]$ and $C_R [SL(n)]$ are constructed
for a two parameter version of the Cremmer-Gervais $R$-matrix. An epimorphism
is constructed from $C_R [GL(n)]$ onto the restricted dual
$U_{\bar{R}}(\frak{gl}(n-1))$ associated to a related smaller $R$-matrix of the
same form.
  A related result is proved concerning factorizable Lie bialgebras. For any
such Lie bialgebra, the dual Lie bialgebra has a canonical homomorphic image
which is again factorizable.
","[{""version"":""v1"",""created"":""Thu, 22 Jun 1995 19:27:45 GMT""}]","2008-02-03"
"q-alg/9506019","Yao-zhong Zhang","Mark D. Gould, Jon R. Links and Yao-Zhong Zhang","Eigenvalus of Casimir Invariants for Type-I Quantum Superalgebras","13 pages, AmsTex file; to appear in Lett. Math. Phys","Lett. Math. Phys. 36 (1996) 415-425","10.1007/BF00714406","University of Queensland and Kyoto University preprint YITP/K-1112","q-alg hep-th math.QA",,"  We present the eigenvalues of the Casimir invariants for the type I quantum
superalgebras on any irreducible highest weight module.
","[{""version"":""v1"",""created"":""Fri, 23 Jun 1995 06:41:34 GMT""},{""version"":""v2"",""created"":""Wed, 26 Jul 1995 07:36:31 GMT""}]","2009-10-28"
"quant-ph/9506036","Elaine Remillard","S. Shelly Sharma, N. K. Sharma, and Larry Zamick","Atom in a $q$-Analog Harmonic Oscillator Trap","13 pages, revtex, 4 figures available upon request",,,"RU9544","quant-ph nucl-th",,"  We study the population inversion and Q-function of a two-level atom,
interacting with single-mode laser light field, in a $q$-analog harmonic
oscillator trap for increasing $q$. For $\tau=.003(q=e^{\tau})$ the collapses
and revivals of population inversion become well defined facilitating
experimental observation but for large $\tau \sim 0.1$ the time dependence of
population inversion is completely wiped out.
","[{""version"":""v1"",""created"":""Thu, 22 Jun 1995 20:05:08 GMT""}]","2009-09-25"
"quant-ph/9506037","Peter Nattermann","P. Nattermann","Symmetry, Local Linearization, and Gauge Classification of the
  Doebner-Goldin Equation","17 pages, LaTeX, 1 figure, to appear in Reports on Mathematical
  Physics","Rep. Math. Phys. 36(2/3), 387-402","10.1016/0034-4877(96)83634-2","ASI-TPA/8/95","quant-ph hep-th nlin.SI solv-int",,"  For the family of nonlinear Schr\""odinger equations derived by H.-D.~Doebner
and G.A.~Goldin (J.Phys.A 27, 1771) we calculate the complete set of Lie
symmetries. For various subfamilies we find different finite and infinite
dimensional Lie symmetry algebras. Two of the latter lead to a local
transformation linearizing the particular subfamily. One type of these
transformations leaves the whole family of equations invariant, giving rise to
a gauge classification of the family. The Lie symmetry algebras and their
corresponding subalgebras are finally characterized by gauge invariant
parameters.
","[{""version"":""v1"",""created"":""Fri, 23 Jun 1995 12:51:36 GMT""}]","2009-10-28"
