"gr-qc/9506061",,"Giampiero Esposito, Alexander Yu. Kamenshchik, Igor V. Mishakov,
  Giuseppe Pollifrone","Euclidean Maxwell Theory in the Presence of Boundaries. II","24 pages, plain-tex, recently appearing in Classical and Quantum
  Gravity, volume 11, pages 2939-2950, December 1994. The authors apologize for
  the delay in circulating the file, due to technical problems now fixed","Class.Quant.Grav.11:2939-2950,1994","10.1088/0264-9381/11/12/009",,"gr-qc",,"  Zeta-function regularization is applied to complete a recent analysis of the
quantized electromagnetic field in the presence of boundaries. The quantum
theory is studied by setting to zero on the boundary the magnetic field, the
gauge-averaging functional and hence the Faddeev-Popov ghost field. Electric
boundary conditions are also studied. On considering two gauge functionals
which involve covariant derivatives of the 4-vector potential, a series of
detailed calculations shows that, in the case of flat Euclidean 4-space bounded
by two concentric 3-spheres, one-loop quantum amplitudes are gauge independent
and their mode-by-mode evaluation agrees with the covariant formulae for such
amplitudes and coincides for magnetic or electric boundary conditions. By
contrast, if a single 3-sphere boundary is studied, one finds some
inconsistencies, i.e. gauge dependence of the amplitudes.
","[{""version"":""v1"",""created"":""Tue, 27 Jun 1995 17:44:45 GMT""}]","2010-04-06"
"gr-qc/9506062",,"Giampiero Esposito and Alexander Yu. Kamenshchik","Coulomb Gauge in One-Loop Quantum Cosmology","13 pages, plain-tex, recently appearing in Physics Letters B, volume
  336, pages 324-329, September 1994. The authors apologize for the delay in
  circulating the paper, due to technical problems now fixed","Phys.Lett. B336 (1994) 324-329","10.1016/0370-2693(94)90540-1",,"gr-qc",,"  The well-known discrepancies between covariant and non-covariant formalisms
in quantum field theory and quantum cosmology are analyzed by focusing on the
Coulomb gauge for vacuum Maxwell theory. On studying a flat Euclidean
background with boundaries, the corresponding mode-by-mode analysis of one-loop
quantum amplitudes agrees with the results of the Schwinger-DeWitt technique
and of mode-by-mode calculations in relativistic gauges.
","[{""version"":""v1"",""created"":""Tue, 27 Jun 1995 17:59:14 GMT""}]","2009-10-28"
"gr-qc/9506063","Gilles Esposito-Farese","Thibault Damour and Gilles Esposito-Farese","Testing gravity to second post-Newtonian order: a field-theory approach","63 pages, 11 figures.ps.tar.gz.uu, REVTeX 3.0","Phys.Rev.D53:5541-5578,1996","10.1103/PhysRevD.53.5541","IHES/P/95/57 and CPT-95/P.3167","gr-qc",,"  A new, field-theory-based framework for discussing and interpreting tests of
gravity, notably at the second post-Newtonian (2PN) level, is introduced.
Contrary to previous frameworks which attempted at parametrizing any
conceivable deviation from general relativity, we focus on the best motivated
class of models, in which gravity is mediated by a tensor field together with
one or several scalar fields. The 2PN approximation of these
""tensor-multi-scalar"" theories is obtained thanks to a diagrammatic expansion
which allows us to compute the Lagrangian describing the motion of N bodies. In
contrast with previous studies which had to introduce many phenomenological
parameters, we find that the 2PN deviations from general relativity can be
fully described by only two new 2PN parameters, epsilon and zeta, beyond the
usual (Eddington) 1PN parameters beta and gamma. It follows from the basic
tenets of field theory, notably the absence of negative-energy excitations,
that (beta-1), epsilon and zeta (as well as any new parameter entering higher
post-Newtonian orders) must tend to zero with (gamma-1). It is also found that
epsilon and zeta do not enter the 2PN equations of motion of light. Therefore,
light-deflection or time-delay experiments cannot probe any theoretically
motivated 2PN deviation from general relativity, but they can give a clean
access to (gamma-1), which is of greatest significance as it measures the basic
coupling strength of matter to the scalar fields. Because of the importance of
self-gravity effects in neutron stars, binary-pulsar experiments are found to
constitute a unique testing ground for the 2PN structure of gravity. A
simplified analysis of four binary pulsars already leads to significant
constraints: |epsilon| < 7x10^-2, |zeta| < 6x10^-3.
","[{""version"":""v1"",""created"":""Tue, 27 Jun 1995 19:05:20 GMT""}]","2011-09-09"
"gr-qc/9506064","Wontae Kim","Sung-Won Kim and Won T. Kim","Hawking Radiation and Evaporation of the Black Hole Induced by a
  Klein-Gordon Soliton","13 pages, latex, no figures","Phys.Lett. B361 (1995) 38-44","10.1016/0370-2693(95)01139-H","EWHAGC 101/95, SNUTP 95-069","gr-qc",,"  A two-dimensional dilatonic black hole induced by a topological soliton is
exactly solvable in the scalar field theory coupled to dilaton gravity. The
Hawking radiation of the black hole is studied in the one-loop approximation
with the help of the trace anomaly of energy-momentum tensors which is a
geometrical invariant. The quantum theory can be also soluble in the RST scheme
in order to consider the back reaction of the metric. The energy of the black
hole system is calculated and the classical thunderpop energy corresponding to
the soliton energy is needed to describe the final state of the black hole.
Finally we discuss the possibility of conservation of the topological charge.
","[{""version"":""v1"",""created"":""Wed, 28 Jun 1995 06:16:52 GMT""}]","2009-10-28"
"gr-qc/9506065",,"Giampiero Esposito","Local Supersymmetry in One-Loop Quantum Cosmology","23 pages, plain-tex, recently appearing in Int. J. Mod. Phys. D,
  volume 3, pages 593-607, September 1994. The Author would like to apologize
  for the delay in circulating the paper, due to technical problems now fixed","Int.J.Mod.Phys. D3 (1994) 593-608","10.1142/S0218271894000733","DSF 93/9","gr-qc",,"  The contribution of physical degrees of freedom to the one-loop amplitudes of
Euclidean supergravity is here evaluated in the case of flat Euclidean
backgrounds bounded by a three-sphere, recently considered in perturbative
quantum cosmology. The physical degrees of freedom (denoted by PDF) are picked
out by imposing the supersymmetry constraints and choosing a gauge condition.
Remarkably, for the massless gravitino field the PDF method and local boundary
conditions lead to a result for the trace anomaly which is equal to the PDF
value one obtains using spectral boundary conditions on a 3-sphere.
","[{""version"":""v1"",""created"":""Wed, 28 Jun 1995 06:21:43 GMT""}]","2015-06-25"
"gr-qc/9506066",,"Giampiero Esposito, Alexander Yu. Kamenshchik, Igor V. Mishakov,
  Giuseppe Pollifrone","Gravitons in One-Loop Quantum Cosmology: Correspondence Between
  Covariant and Non-Covariant Formalisms","29 pages, latex, recently appearing in Physical Review D, volume 50,
  pages 6329-6337, November 1994. The authors apologize for the delay in
  circulating the paper, due to technical problems now fixed","Phys.Rev. D50 (1994) 6329-6337","10.1103/PhysRevD.50.6329","DSF 94/14","gr-qc",,"  The discrepancy between the results of covariant and non-covariant one-loop
calculations for higher-spin fields in quantum cosmology is analyzed. A
detailed mode-by-mode study of perturbative quantum gravity about a flat
Euclidean background bounded by two concentric 3-spheres, including
non-physical degrees of freedom and ghost modes, leads to one-loop amplitudes
in agreement with the covariant Schwinger-DeWitt method. This calculation
provides the generalization of a previous analysis of fermionic fields and
electromagnetic fields at one-loop about flat Euclidean backgrounds admitting a
well-defined 3+1 decomposition.
","[{""version"":""v1"",""created"":""Wed, 28 Jun 1995 06:47:27 GMT""}]","2009-10-28"
"gr-qc/9506067","P. R. Brady","Patrick R. Brady and John D. Smith","Black hole singularities: a numerical approach","4 pages Phys. Rev. style including five figures, provided as
  compressed postscript files. To appear in Physical Review Letters","Phys.Rev.Lett. 75 (1995) 1256-1259","10.1103/PhysRevLett.75.1256","NCL95-TP2","gr-qc",,"  The singularity structure of charged spherical collapse is studied by
considering the evolution of the gravity-scalar field system. A detailed
examination of the geometry at late times strongly suggests the validity of the
mass-inflation scenario~\cite{PI:90}. Although the area of the two-spheres
remains finite at the Cauchy horizon, its generators are eventually focused to
zero radius. Thus the null, mass-inflation singularity {\em generally}\/
precedes a crushing $r=0$ singularity deep inside the black hole core. This
central singularity is spacelike.
","[{""version"":""v1"",""created"":""Wed, 28 Jun 1995 11:35:45 GMT""}]","2009-10-28"
"gr-qc/9506068","Nobuyuki Sakai","Nobuyuki Sakai, Hisa-aki Shinkai, Takashi Tachizawa and Kei-ichi Maeda","Dynamics of Topological Defects and Inflation","12 pages, revtex, 13 figures, some discussions are modified, to
  appear in Phys.Rev.D","Phys.Rev.D53:655,1996; Erratum-ibid.D54:2981,1996;
  Phys.Rev.D54:2981,1996","10.1103/PhysRevD.53.655 10.1103/PhysRevD.54.2981","WU-AP/49/95","gr-qc astro-ph hep-th",,"  We study the dynamics of topological defects in the context of ``topological
inflation"" proposed by Vilenkin and Linde independently. Analysing the time
evolution of planar domain walls and of global monopoles, we find that the
defects undergo inflationary expansion if $\eta\stackrel{>}{\sim}0.33m_{Pl}$,
where $\eta$ is the vacuum expectation value of the Higgs field and $m_{Pl}$ is
the Planck mass. This result confirms the estimates by Vilenkin and Linde. The
critical value of $\eta$ is independent of the coupling constant $\lambda$ and
the initial size of the defect. Even for defects with an initial size much
greater than the horizon scale, inflation does not occur at all if $\eta$ is
smaller than the critical value. We also examine the effect of gauge fields for
static monopole solutions and find that the spacetime with a gauge monopole has
an attractive nature, contrary to the spacetime with a global monopole. It
suggests that gauge fields affect the onset of inflation.
","[{""version"":""v1"",""created"":""Wed, 28 Jun 1995 14:24:37 GMT""},{""version"":""v2"",""created"":""Fri, 30 Jun 1995 12:18:23 GMT""},{""version"":""v3"",""created"":""Mon, 23 Oct 1995 08:01:45 GMT""}]","2014-11-17"
"gr-qc/9506070","Dr John W. Barrett","John W. Barrett","Quantum Gravity as Topological Quantum Field Theory","23 pages, amstex, JMP special issue (deadline permitting). (Text not
  changed)","J.Math.Phys. 36 (1995) 6161-6179","10.1063/1.531239",,"gr-qc quant-ph",,"  The physics of quantum gravity is discussed within the framework of
topological quantum field theory. Some of the principles are illustrated with
examples taken from theories in which space-time is three dimensional.
","[{""version"":""v1"",""created"":""Wed, 28 Jun 1995 15:43:52 GMT""},{""version"":""v2"",""created"":""Mon, 24 Jul 1995 12:05:09 GMT""}]","2009-10-28"
"hep-ex/9506014",,"Melvyn J. Shochet (University of Chicago)","Proton-Antiproton Collider Physics","Summary of the 10th Topical Workshop on Proton-Antiproton Collider
  Physics, Fermilab, May 9-13, 1995. Postscript file (34 pages with 82 embedded
  figures; 5.7 MB) available at
  http://www-cdf.fnal.gov/physics/conf95/cdf3225_pbarp_wkshp_summary.ps","AIPConf.Proc.357:685-720,1996","10.1063/1.49657","EFI-95-39","hep-ex",,"  Summary of the 10th Topical Workshop on Proton-Antiproton Collider Physics,
Fermilab, May 9-13, 1995.
","[{""version"":""v1"",""created"":""Tue, 27 Jun 1995 18:41:06 GMT""}]","2009-10-28"
"hep-lat/9506027",,"C. Alexandrou (University of Cyprus) and A. Galli (Paul Scherrer Inst)","The $\bar{s}s$ content of the D-meson at infinite coupling","9 pages Latex file plus 2 uuencoded postscript figures","Phys.Lett. B363 (1995) 93-100","10.1016/0370-2693(95)01182-P","UCY-PHY-95/8, PSI-PR-95-12","hep-lat hep-ph",,"  We calculate the $\bar{s}s$ condensate in the D - and B - mesons using the
unquenched hopping parameter expansion at infinite coupling for the Wilson
lattice action. We discuss the phenomenological relevance of our result.
","[{""version"":""v1"",""created"":""Tue, 27 Jun 1995 17:05:09 GMT""}]","2009-10-28"
"hep-lat/9506030","Peter Hasenfratz","T. DeGrand, A. Hasenfratz, P. Hasenfratz and F. Niedermayer","The classically perfect fixed point action for SU(3) gauge theory","34 pages (latex) + 7 figures (Postscript), uuencoded","Nucl.Phys. B454 (1995) 587-614","10.1016/0550-3213(95)00458-5","BUTP-95/14","hep-lat",,"  In this paper (the first of a series) we describe the construction of fixed
point actions for lattice $SU(3)$ pure gauge theory. Fixed point actions have
scale invariant instanton solutions and the spectrum of their quadratic part is
exact (they are classical perfect actions). We argue that the fixed point
action is even 1--loop quantum perfect, i.e. in its physical predictions there
are no $g^2 a^n$ cut--off effects for any $n$. We discuss the construction of
fixed point operators and present examples. The lowest order $q {\bar q}$
potential $V(\vec{r})$ obtained from the fixed point Polyakov loop correlator
is free of any cut--off effects which go to zero as an inverse power of the
distance $r$.
","[{""version"":""v1"",""created"":""Tue, 27 Jun 1995 18:53:05 GMT""}]","2009-10-28"
"hep-lat/9506031","Peter Hasenfratz","T. DeGrand, A. Hasenfratz, P. Hasenfratz and F. Niedermayer","Non--perturbative tests of the fixed point action for SU(3) gauge theory","28 pages (latex) + 11 figures (Postscript), uuencoded","Nucl.Phys. B454 (1995) 615-637","10.1016/0550-3213(95)00459-6","BUTP-95/15","hep-lat",,"  In this paper (the second of a series) we extend our calculation of a
classical fixed point action for lattice $SU(3)$ pure gauge theory to include
gauge configurations with large fluctuations. The action is parameterized in
terms of closed loops of link variables. We construct a few-parameter
approximation to the classical FP action which is valid for short correlation
lengths. We perform a scaling test of the action by computing the quantity $G =
L \sqrt{\sigma(L)}$ where the string tension $\sigma(L)$ is measured from the
torelon mass $\mu = L \sigma(L)$. We measure $G$ on lattices of fixed physical
volume and varying lattice spacing $a$ (which we define through the
deconfinement temperature). While the Wilson action shows scaling violations of
about ten per cent, the approximate fixed point action scales within the
statistical errors for $ 1/2 \ge aT_c \ge 1/6$. Similar behaviour is found for
the potential measured in a fixed physical volume.
","[{""version"":""v1"",""created"":""Tue, 27 Jun 1995 18:54:23 GMT""}]","2009-10-28"
"hep-lat/9506032","Peter Hasenfratz","F. Farchioni, P. Hasenfratz, F. Niedermayer and A. Papa","The absence of cut--off effects for the fixed point action in 1--loop
  perturbation theory","8 pages (latex) + 1 figure (Postscript), uuencoded","Nucl.Phys. B454 (1995) 638-644","10.1016/0550-3213(95)00460-A","BUTP-95/16","hep-lat",,"  In order to support the formal renormalization group arguments that the fixed
point action of an asymptotically free model gives cut--off independent
physical predictions in 1--loop perturbation theory, we calculate the finite
volume mass--gap $m(L)$ in the non--linear $\sigma$--model. No cut--off effect
of the type $g^4\left(a/L\right)^n$ is seen for any $n$. The results are
compared with those of the standard and tree level improved Symanzik actions.
","[{""version"":""v1"",""created"":""Wed, 28 Jun 1995 10:06:26 GMT""}]","2009-10-28"
"hep-ph/9506438","Edmond Iancu","J.-P. Blaizot and E. Iancu","Non-perturbative aspects of screening phenomena in abelian and non
  abelian gauge theories","29 pages, LaTex, 7 figures (not included, available upon request)","Nucl.Phys. B459 (1996) 559-588","10.1016/0550-3213(95)00547-1","Saclay-T95/055, IPNO/TH 95-28","hep-ph",,"  When computed to one-loop order in resummed perturbation theory, the
non-abelian Debye mass appears to be logarithmically sensitive to the magnetic
scale $g^2T$. More generally, we show that in higher orders power-like infrared
divergences forbid the use of perturbation theory to calculate the corrections
to Debye screening. A similar infrared problem occurs in the determination of
the mass-shell for the scalar propagator in 2+1-dimensional scalar
electrodynamics. In this context, we provide a non-perturbative approach which
solves the infrared problems and allows for an accurate calculation of the
scalar propagator in the vicinity of the mass-shell.
","[{""version"":""v1"",""created"":""Tue, 27 Jun 1995 16:19:49 GMT""}]","2009-10-28"
"hep-ph/9506439","Zepeda","William A. Ponce, Arnulfo Zepeda and Jes\'us M. Mira","Is U(1)$_H$ a Good Family Symmetry?","10 pages, Accepted for publication in Z. Phys. C","Z.Phys. C69 (1996) 683-686",,,"hep-ph",,"  We analyze U(1)$_H$ as a horizontal symmetry and its possibilities to explain
the known elementary-fermion masses. We find that only two candidates, in the
context of SU(3)$_c\otimes$SU(2)$_L\otimes$U(1)$_Y\otimes$U(1)$_H$
nonsupersymmetric, are able to fit the experimental result m$_b<<$m$_t$.
","[{""version"":""v1"",""created"":""Tue, 27 Jun 1995 16:38:56 GMT""}]","2007-05-23"
"hep-ph/9506440","Christo Christov","T. Watabe, Chr.V. Christov and K. Goeke","Axial form factor in the chiral quark soliton model","9 pages, 2 figures included, RevTeX format, no special macros",,,"RUB-TPII-3/95","hep-ph",,"  We calculate the axial form factor in the chiral quark soliton (semibosonized
Nambu - Jona-Lasinio) model using the semiclassical quantization scheme in the
next to leading order in angular velocity. The obtained axial form factor is in
a good absolute (without additional scaling) agreement with the experimental
data. Both the value at the origin and the $q$-dependence of the form factor as
well as the axial m.s.radius are fairly well reproduced.
","[{""version"":""v1"",""created"":""Tue, 27 Jun 1995 18:05:58 GMT""},{""version"":""v2"",""created"":""Wed, 28 Jun 1995 08:49:50 GMT""},{""version"":""v3"",""created"":""Mon, 3 Jul 1995 08:21:38 GMT""}]","2008-02-03"
"hep-ph/9506441","Walter T. Giele","W.T. Giele and E.W.N. Glover","Physics with jets in $p\bar p$ collisions","8 pages, Latex, 8 postscript figures. Also available at
  http://WWW-theory.fnal.gov/people/giele/Papers/Conf-95-168-T.uu",,,"DTP/95/50, FERMILAB-CONF-168-T","hep-ph",,"  We discuss the possibilities for extracting information on the parton density
functions and the strong coupling constant from one- and two-jet events at the
Fermilab TEVATRON. First we study the inclusive two-jet triply differential
cross section $d^3\sigma/dE_Td\eta_1d\eta_2$. Different $\eta_1$ and $\eta_2$
pseudorapidity regions are directly related to the parton momentum fractions at
leading order and the shape of the triply differential distribution at fixed
transverse energy $E_T$ is a particularly powerful tool for constraining the
parton distributions at small to moderate $x$ values. Second, we consider the
one-jet inclusive transverse energy distribution where there is impressive
agreement between theory and experiment over a wide range of transverse energy.
By equating the next-to-leading order theoretical prediction for a given set of
input parton densities with the published CDF data, the evolution of the strong
coupling constant at scale $\mu$ can be studied between $\mu \sim 50~$GeV and
$\mu \sim 400~$GeV. This evolution is in agreement with QCD and corresponds to
$\alpha_s(M_Z)$ = 0.121 for the MRSA parameterisation.
","[{""version"":""v1"",""created"":""Tue, 27 Jun 1995 17:33:57 GMT""}]","2007-05-23"
"hep-ph/9506442","Walter T. Giele","W.T. Giele, E.W.N. Glover and J.Yu","The Determination of $\alpha_S$ at Hadron Colliders","22 pages, Latex, 7 postscript figures. Also available at
  http://WWW-theory.fnal.gov/people/giele/Papers/Pub-95-127-T.uu","Phys.Rev.D53:120-130,1996","10.1103/PhysRevD.53.120","FERMILAB-PUB-127-T, DTP/95/52","hep-ph",,"  Hadron colliders offer a unique opportunity to test perturbative QCD because,
rather than producing events at a specific beam energy, the dynamics of the
hard scattering is probed simultaneously at a wide range of momentum transfers.
This makes the determination of $\al$ and the parton density functions (PDF) at
hadron colliders particularly interesting. In this paper we restrict ourselves
to extracting $\al$ for a given PDF at a scale which is directly related to the
transverse energy produced in the collision. As an example, we focus on the
single jet inclusive transverse energy distribution and use the published
'88-'89 CDF data with an integrated luminosity of 4.2 pb$^{-1}$. The evolution
of the coupling constant over a wide range of scales (from 30~GeV to 500~GeV)
is clearly shown and is in agreement with the QCD expectation. The data to be
obtained in the current Tevatron run (expected to be well in excess 100
pb$^{-1}$ for both the CDF and D\O\ experiments) will significantly decrease
the experimental errors.
","[{""version"":""v1"",""created"":""Tue, 27 Jun 1995 17:34:02 GMT""}]","2008-11-26"
"hep-ph/9506443",,"Ira Z. Rothstein","What Do We Know About the Tau Neutrino?","Talk given at PASCOS 95 (10 pages 2 figures included)",,,,"hep-ph",,"  In this talk I review the present bounds on the tau neutrino, concentrating
on the possibility of bringing the mass bound below an MeV.
","[{""version"":""v1"",""created"":""Tue, 27 Jun 1995 19:17:03 GMT""}]","2007-05-23"
"hep-ph/9506444","Tatsu Takeuchi","Tatsu Takeuchi","The status of the electroweak sector of the standard model","13 pages, uuencoded postscript. Talk presented at the International
  Symposium on Vector Boson Self-Interactions, Feb 1-3, 1995, UCLA, CA",,"10.1063/1.49306","FERMILAB-CONF/173-T","hep-ph",,"  I will discuss the current status of the determination of $\alpha(m_Z)$ and
$\alpha_s(m_Z)$.
","[{""version"":""v1"",""created"":""Tue, 27 Jun 1995 22:41:36 GMT""}]","2009-10-28"
"hep-ph/9506445",,"Reginald T. Cahill and Susan M. Gunner (Department of Physics,
  Flinders University)","Quark and Gluon Propagators from Meson Data","12 pages. Extended text. 3 new figures. Figures also available from
  Reg.Cahill@flinders.edu.au","Phys.Lett. B359 (1995) 281-287","10.1016/0370-2693(95)01106-Z",,"hep-ph nucl-th",,"  We report robust calculations of various low energy QCD hadronic properties.
We use a multi-rank separable expansion for the gluon propagator which greatly
facilitates the numerical computations within the Global Colour Model for QCD.
The parameters for the propagators are determined by fitting experimental
values for $f_{\pi}$ and the $\pi$ and $a_1$ meson masses.
","[{""version"":""v1"",""created"":""Wed, 28 Jun 1995 05:15:51 GMT""},{""version"":""v2"",""created"":""Tue, 22 Aug 1995 00:04:07 GMT""}]","2009-10-28"
"hep-ph/9506446","Johannes Bluemlein","J. Bl\""umlein","On the $k_{\perp}$ dependent gluon density in hadrons and the photon","8 pages, uuencoded ps file",,,"DESY 95--125, Contribution to the Proc. of the 1995 Renc. de Moriond
  (QCD), March 1995","hep-ph",,"  The $k_{\perp}$ dependent gluon distribution for protons, pions,and photons
is calculated accounting for the resummation of small~$x$ effects due to the
Lipatov equation. It is represented by a convolution of a gluon density in the
collinear limit and a universal function ${\cal G}(x,k^2,\mu)$ for which an
analytic expression is derived.
","[{""version"":""v1"",""created"":""Wed, 28 Jun 1995 07:26:40 GMT""}]","2007-05-23"
"hep-ph/9506447",,"W.Buchmuller, A.Hebecker","Calculating the diffractive from the inclusive structure function","talk at Workshop on DIS and QCD, Paris, April 1995, 3 pages LaTeX,
  uses qcdparis.sty, 2 figures (uuencoded)",,,,"hep-ph",,"  It is demonstrated that the global properties of the rapidity gap events at
HERA can be understood based on electron-gluon scattering and a
non-perturbative mechanism of colour neutralization. Using the measured
inclusive structure function $F_2$ to determine the parameters of the parton
model, the diffractive structure function $F_2^D$ is predicted. The ratio of
diffractive and inclusive cross sections, $R_D = \sigma_D/\sigma_{incl}\simeq
1/9$, is determined by the probability of the produced quark-antiquark pair to
evolve into a colour singlet state.
","[{""version"":""v1"",""created"":""Wed, 28 Jun 1995 12:50:21 GMT""}]","2007-05-23"
"hep-ph/9506448","Helmut Neufeld","H. Neufeld and H. Rupertsberger","The Electromagnetic Interaction in Chiral Perturbation Theory","15 pages, latex","Z.Phys.C71:131-138,1996","10.1007/s002880050156","UWThPh-1995-18","hep-ph",,"  We investigate electromagnetic effects in the framework of chiral
perturbation theory. Using a completely independent method, we confirm Urech's
results for the divergences of the one--loop functional in the electromagnetic
sector. We perform a one--loop analysis of all $P_{\ell 2}$ ($P = \pi, K,
\eta$) and the $K_{\ell 3}$ form factors $f_+^{K^+\pi^0}(0)$,
$f_+^{K^0\pi^-}(0)$, including a systematic treatment of the $\cO(e^2p^2)$
contributions in the mesonic part. We illustrate our results by several
numerical estimates.
","[{""version"":""v1"",""created"":""Wed, 28 Jun 1995 14:39:53 GMT""}]","2008-11-26"
