"hep-ph/9506449","Kirsten Buttner","Kirsten B\""uttner and M.R. Pennington","Should the Pomeron and imaginary parts be modelled by two gluons and
  real quarks?","7 pages, latex, 2 figures, replaced ~\epsfig... by \mbox{\epsfig...}","Phys.Lett. B356 (1995) 354-358","10.1016/0370-2693(95)00815-3","DTP-95/54","hep-ph",,"  We illustrate that solution of the Schwinger-Dyson equation for the gluon
propagator in QCD does not support an infrared softened behaviour, but only an
infrared enhancement. This has consequences for the modelling of the Pomeron in
terms of dressed gluon exchange. It highlights that an understanding of the
Pomeron within QCD must take account of the bound state nature of hadrons.
","[{""version"":""v1"",""created"":""Wed, 28 Jun 1995 15:58:58 GMT""},{""version"":""v2"",""created"":""Thu, 29 Jun 1995 10:13:31 GMT""}]","2009-10-28"
"hep-th/9506181",,"M. Matone","Koebe 1/4-Theorem and Inequalities in N=2 Super-QCD","11 pages, LaTex file, Expanded version: new results, technical
  details explained, misprints corrected and references added","Phys.Rev. D53 (1996) 7354-7358","10.1103/PhysRevD.53.7354","DFPD/95/TH/38","hep-th",,"  The critical curve ${\cal C}$ on which ${\rm Im}\,\hat\tau =0$,
$\hat\tau=a_D/a$, determines hyperbolic domains whose Poincar\'e metric is
constructed in terms of $a_D$ and $a$. We describe ${\cal C}$ in a parametric
form related to a Schwarzian equation and prove new relations for $N=2$ Super
$SU(2)$ Yang-Mills. In particular, using the Koebe 1/4-theorem and Schwarz's
lemma, we obtain inequalities involving $u$, $a_D$ and $a$, which seem related
to the Renormalization Group. Furthermore, we obtain a closed form for the
prepotential as function of $a$. Finally, we show that $\partial_{\hat\tau}
\langle {\rm tr}\,\phi^2\rangle_{\hat \tau}={1\over 8\pi i b_1}\langle
\phi\rangle_{\hat\tau}^2$, where $b_1$ is the one-loop coefficient of the beta
function.
","[{""version"":""v1"",""created"":""Tue, 27 Jun 1995 22:32:39 GMT""},{""version"":""v2"",""created"":""Thu, 29 Feb 1996 16:05:28 GMT""}]","2009-10-28"
"hep-th/9506182","Dan Kabat","D. Kabat, S. H. Shenker, and M. J. Strassler","Black Hole Entropy in the O(N) Model","21 pages, uses harvmac and epsf. one additional reference","Phys.Rev.D52:7027-7036,1995","10.1103/PhysRevD.52.7027","RU-95-34","hep-th gr-qc",,"  We consider corrections to the entropy of a black hole from an $O(N)$
invariant linear $\s$-model. We obtain the entropy from a $1/N$ expansion of
the partition function on a cone. The entropy arises from diagrams which are
analogous to those introduced by Susskind and Uglum to explain black hole
entropy in string theory. The interpretation of the \sm entropy depends on
scale. At short distances, it has a state counting interpretation, as the
entropy of entanglement of the $N$ fields $\pa$. In the infrared, the effective
theory has a single composite field $\s \sim \pa \pa$, and the state counting
interpretation of the entropy is lost.
","[{""version"":""v1"",""created"":""Tue, 27 Jun 1995 23:21:38 GMT""},{""version"":""v2"",""created"":""Tue, 18 Jul 1995 18:39:38 GMT""}]","2008-11-26"
"hep-th/9506183","Madore","J. Madore","Linear Connections on Fuzzy Manifolds","10 pages PlainTex; LPTHE Orsay 95/42; ESI Vienna 235","Class.Quant.Grav. 13 (1996) 2109-2120","10.1088/0264-9381/13/8/008",,"hep-th",,"  Linear connections are introduced on a series of noncommutative geometries
which have commutative limits. Quasicommutative corrections are calculated.
","[{""version"":""v1"",""created"":""Wed, 28 Jun 1995 09:27:20 GMT""}]","2009-10-28"
"hep-th/9506184","Savvidy","G.K.Savvidy and K.G.Savvidy","Interaction Hierarchy. Gonihedric String and Quantum Gravity","11 pages,Latex","Modern Physics Letters A 11 (1996) 1379-1396","10.1142/S0217732396001399","Crete-TH-June-1995","hep-th",,"  We have found that the Regge gravity \cite{regge,sorkin}, can be represented
as a $superposition$ of less complicated theory of random surfaces with
$Euler~character$ as an action. This extends to Regge gravity our previous
result \cite{savvidy}, which allows to represent the gonihedric string
\cite{savvidy1} as a superposition of less complicated theory of random paths
with $curvature$ action. We propose also an alternative linear action
$A(M_{4})$ for the four and high dimensional quantum gravity. From these
representations it follows that the corresponding partition functions are equal
to the product of Feynman path integrals evaluated on time slices with
curvature and length action for the gonihedric string and with Euler character
and gonihedric action for the Regge gravity. In both cases the interaction is
proportional to the overlapping sizes of the paths or surfaces on the
neighboring time slices. On the lattice we constructed spin system with local
interaction, which have the same partition function as the quantum gravity. The
scaling limit is discussed.
","[{""version"":""v1"",""created"":""Wed, 28 Jun 1995 11:23:07 GMT""},{""version"":""v2"",""created"":""Thu, 29 Jun 1995 14:26:59 GMT""}]","2009-10-28"
"hep-th/9506185","Filippo Colomo","Luca Lusanna","Aspects of Galilean and Relativistic Particle Mechanics with Dirac's
  Constraints","Talk given at the Conference ``Theories of Fundamental Interactions"",
  Maynooth (Ireland), May 1995. (LaTeX file)",,,,"hep-th gr-qc",,"  Relevant physical models are described by singular Lagrangians, so that their
Hamiltonian description is based on the Dirac theory of constraints. The
qualitative aspects of this theory are now understood, in particular the role
of the Shanmugadhasan canonical transformation in the determination of a
canonical basis of Dirac's observables allowing the elimination of gauge
degrees of freedom from the classical description of physical systems. This
programme was initiated by Dirac for the electromagnetic field with charged
fermions. Now Dirac's observables for Yang-Mills theory with fermions (whose
typical application is QCD) have been found in suitable function spaces where
the Gribov ambiguity is absent. Also the ones for the Abelian Higgs model are
known and those for the $SU(2) \times U(1)$ electroweak theory with fermions
are going to be found with the same method working for the Abelian case. The
main task along these lines will now be the search of Dirac's observables for
tetrad gravity in the case of asymptotically flat 3-manifolds. The philosophy
behind this approach is ``first reduce, then quantize"": this requires a global
symplectic separation of the physical variables from the gauge ones so that the
role of differential geometry applied to smooth field configurations is
dominating, in contrast with the standard approach of ``first quantizing, then
reducing"", where, in the case of gauge field theory, the reduction process
takes place on distributional field configurations, which dominate in quantum
measures. This global separation has been accomplished till now, at least at a
heuristic level, and one is going to have a classical (pseudoclassical for the
fermion) variables basis for the physical description of the $SU(3)\times
SU(2)\times U(1)$ standard model; instead, with tetrad gravity one expects to
","[{""version"":""v1"",""created"":""Wed, 28 Jun 1995 10:46:35 GMT""}]","2007-05-23"
"hep-th/9506186","Peter Bantay","P. Bantay and P. Vecsernyes","Mapping Class Group Representations and Generalized Verlinde Formula","10 pages, PlainTex, 1 figure appended","Int.J.Mod.Phys. A14 (1999) 1325-1336","10.1142/S0217751X99000683","KL-TH 95/14","hep-th",,"  Unitary representations of centrally extended mapping class groups $\tilde
M_{g,1}, g\geq 1$ are given in terms of a rational Hopf algebra $H$, and a
related generalization of the Verlinde formula is presented. Formulae
expressing the traces of mapping class group elements in terms of the fusion
rules, quantum dimensions and statistics phases are proposed.
","[{""version"":""v1"",""created"":""Wed, 28 Jun 1995 14:01:14 GMT""},{""version"":""v2"",""created"":""Wed, 5 Jul 1995 12:40:28 GMT""}]","2009-10-28"
"hep-th/9506187","Luis J. Garay","Maximo Banados, Luis J. Garay and Marc Henneaux","The local degrees of freedom of higher dimensional pure Chern-Simons
  theories","9 pages, RevTeX3.0 (LaTeX2.09), no figures","Phys.Rev.D53:593-596,1996","10.1103/PhysRevD.53.593","Imperial/TP/94--95/45","hep-th",,"  The canonical structure of higher dimensional pure Chern-Simons theories is
analysed. It is shown that these theories have generically a non-vanishing
number of local degrees of freedom, even though they are obtained by means of a
topological construction. This number of local degrees of freedom is computed
as a function of the spacetime dimension and the dimension of the gauge group.
","[{""version"":""v1"",""created"":""Wed, 28 Jun 1995 14:26:24 GMT""}]","2009-12-30"
"math/9506205",,"Ilya Kapovich","Detecting quasiconvexity: algorithmic aspects","AMS-Tex, 7 pages, no figures. To appear in the Proceedings of the
  DIMACS meeting on Computational Group Theory (March 1994)",,,"MAGNUS preprint #95-06-27A","math.GR",,"  The main result of this paper states that for any group $G$ with an automatic
structure $L$ with unique representatives one can construct a uniform partial
algorithm which detects $L$-rational subgroups and gives their preimages in
$L$. This provides a practical, not just theoretical, procedure for solving the
occurrence problem for such subgroups.
","[{""version"":""v1"",""created"":""Tue, 27 Jun 1995 20:46:27 GMT""}]","2008-02-03"
"nucl-th/9506024","Kim Maltman","Kim Maltman","Two Model-Independent Results for the Momentum Dependence of Rho-Omega
  Mixing","14 pages, uses REVTEX Entire manuscript available as a ps file at
  http://www.physics.adelaide.edu.au/theory/home.html Also available via
  anonymous ftp at ftp://adelphi.adelaide.edu.au/pub/theory/ADP-95-35.T189.ps","Phys.Lett. B362 (1995) 11-16","10.1016/0370-2693(95)01208-8","ADP-95-35/T189","nucl-th",,"  Two model-independent results on the momentum-dependence of $\rho$-$\omega$
mixing are described. First, an explicit choice of interpolating fields for the
vector mesons is displayed for which both the mixing in the propagator and the
isospin-breaking at the nucleon-vector meson vertices (and hence also the
one-vector-meson-exchange contribution to NN charge symmetry breaking) vanish
identically at $q^2=0$. Second, it is shown, using the constraints of unitarity
and analyticity on the spectral function of the vector meson propagator, that
there is no possible choice of interpolating fields for the $\rho^0$,
$\omega^0$ mesons such that, with the $\rho\omega$ element of the propagator
defined by $\Delta^{\rho\omega}_{\mu\nu}(q^2)= (g_{\mu\nu}-q_\mu q_\nu
/q^2)$$\theta (q^2)/(q^2-m^2_\rho )(q^2- m^2_\omega )$, $\theta (q^2)$ is
independent of momentum. It follows that the standard treatment of charge
symmetry breaking in few-body systems cannot be interpreted as arising from any
realizable effective meson-baryon Lagrangian and must, therefore, be considered
purely phenomenological in content.
","[{""version"":""v1"",""created"":""Wed, 28 Jun 1995 03:51:58 GMT""}]","2009-10-28"
"nucl-th/9506025","Richard Davidson","H.W.L. Naus (Institute for Theoretical Physics, University of
  Heidelberg, Heidelberg, Germany) and R.M. Davidson (National Institute for
  Nuclear Physics and High Energy Physics, Amsterdam, The Netherlands)","Analysis of the Low-Energy Theorem for \gamma p \to p \pi^0","5 pages, Revtex, no figures, no tables","Z.Phys. A354 (1996) 329-332","10.1007/s002180050053",,"nucl-th",,"  The derivation of the `classical' low-energy theorem (LET) for \gamma p
\rightarrow p\pi^0 is re-examined and compared to chiral perturbation theory.
Both results are correct and are not contradictory; they differ because
different expansions of the same quantity are involved. Possible modifications
of the extended partially conserved axial-vector current relation, one of the
starting points in the derivation of the LET, are discussed. An alternate, more
transparent form of the LET is presented.
","[{""version"":""v1"",""created"":""Wed, 28 Jun 1995 11:08:01 GMT""}]","2015-06-26"
"nucl-th/9506026","Sergey Akulinichev","S.V.Akulinichev","Rescaling of Nuclear Structure Functions","9 pages, Latex, 2 figures appended (compressed and uuencoded)","Phys.Lett. B357 (1995) 451-455","10.1016/0370-2693(95)00880-T","Preprint INR-0900/95","nucl-th hep-ph",,"  It is shown that nucleonic structure functions are $x-$ and $Q^{2}-$rescaled
in nuclei. The $x-$rescaling accounts for nuclear effects in the case of exact
scaling, while the $Q^{2}-$rescaling is responsible for a corresponding
modification of quantum corrections. This result is obtained in the leading
order for all flavour combinations and connects the two known models for the
EMC-effect. Electroproduction and gluonic nuclear structure functions are
calculated.
","[{""version"":""v1"",""created"":""Wed, 28 Jun 1995 14:05:49 GMT""}]","2009-10-28"
"quant-ph/9506040","Laszlo E. Szabo","Laszlo E. Szabo","Does Quantum Mechanics Save Free Will?","9 pages, LaTeX, 3 Figures",,,,"quant-ph",,"  According to the widely accepted opinion, classical (statistical) physics
does not support objective indeterminism, since the statistical laws of
classical physics allow a deterministic hidden background, while --- as Arthur
Fine writes polemizing with Gr\""unbaum --- ""{\sl the antilibertarian position
finds little room to breathe in a statistical world if we take laws of the
quantum theory as exemplars of the statistical laws in such a world. So, it
appears that, contrary to what Gr\""unbaum claims, the libertarians' 'could have
done otherwise' does indeed find support from indeterminism if we take the
indeterministic laws to be of the sort found in the quantum theory.}"" In this
paper I will show that, quite the contrary, quantum mechanics does not save
free will. For instance, the EPR experiments are compatible with a
deterministic world. They admit a deterministic local hidden parameter
description if the deterministic model is 'allowed' to describe not only the
measurement outcomes, but also the outcomes of the 'decisions' whether this or
that measurement will be performed. So, the derivation of the freedom of the
will from quantum mechanics is a tautology: from the assumption that the world
is indeterministic it is derived that the world cannot be deterministic.
","[{""version"":""v1"",""created"":""Wed, 28 Jun 1995 14:34:29 GMT""}]","2007-05-23"
