"alg-geom/9506024","David Cox","Eduardo Cattani, David Cox, and Alicia Dickenstein","Residues in Toric Varieties","35 pages, manuscript dated June 22, 1995, TeX, C Version 3.14t3",,,,"alg-geom math.AG",,"  We study residues on a complete toric variety X, which are defined in terms
of the homogeneous coordinate ring of X. We first prove a global transformation
law for toric residues. When the fan of the toric variety has a simplicial cone
of maximal dimension, we can produce an element with toric residue equal to 1.
We also show that in certain situations, the toric residue is an isomorphism on
an appropriate graded piece of the quotient ring. When X is simplicial, we
prove that the toric residue is a sum of local residues. In the case of equal
degrees, we also show how to represent X as a quotient (Y-{0})/C* such that the
toric residue becomes the local residue at 0 in Y.
","[{""version"":""v1"",""created"":""Tue, 27 Jun 1995 18:02:59 GMT""}]","2008-02-03"
"astro-ph/9506129","Ed Turner","M. Fukugita and E. L. Turner","QSO's from Galaxy Collisions with Naked Black Holes","plain TeX file, no figures, submitted to Nature","Astrophys.J. 460 (1996) L81","10.1086/309987",,"astro-ph",,"  In the now well established conventional view (see Rees [1] and references
therein), quasi-stellar objects (QSOs) and related active galactic nuclei (AGN)
phenomena are explained as the result of accretion of plasma onto giant black
holes which are postulated to form via gravitational collapse of the high
density regions in the centers of massive host galaxies. This model is
supported by a wide variety of indirect evidence and seems quite likely to
apply at least to some observed AGN phenomena. However, one surprising set of
new Hubble Space Telescope (HST) observations [2-4] directly challenges the
conventional model, and the well known evolution of the QSO population raises
some additional, though not widely recognized, difficulties. We propose here an
alternative possibility: the Universe contains a substantial independent
population of super-massive black holes, and QSO's are a phenomenon that occurs
due to their collisions with galaxies or gas clouds in the intergalactic medium
(IGM). This hypothesis would naturally explain why the QSO population declines
very rapidly towards low redshift, as well as the new HST data.
","[{""version"":""v1"",""created"":""Tue, 27 Jun 1995 16:52:09 GMT""}]","2009-10-28"
"astro-ph/9506130",,"M. G. Baring and A. K. Harding","Photon Splitting in Magnetar Models of Soft Gamma Repeaters","5 pages including 3 encapsulated figures, as a compressed, uuencoded,
  Postscript file. To appear in Proc. of the 1995 La Jolla workshop ``High
  Velocity Neutron Stars and Gamma-Ray Bursts'' eds. Rothschild, R. et al.,
  AIP, New York",,"10.1063/1.50239",,"astro-ph",,"  The recent association of soft gamma repeaters (SGRs) with counterparts in
other wavebands has sparked much interest in these sources. One of the recent
models for these objects is that they originate in the environs of neutron
stars with fields much stronger than the quantum critical field
\teq{B_{cr}=4.413\times 10^{13}} Gauss. Near such neutron stars, dubbed
magnetars, the exotic quantum process of magnetic photon splitting becomes
prolific. Its principal effect is to degrade photon energies and thereby soften
gamma-ray spectra from neutron stars; it has recently been suggested that
splitting may be responsible for limiting the hardness of emission in SGRs, if
these sources originate in neutron stars with supercritical surface fields.
Seed photons in supercritical fields efficiently generate soft gamma-ray
spectra, typical of repeaters. In this paper, the influence of the curved
dipole field geometry of a neutron star magnetosphere on the photon splitting
rate is investigated. The dependence of the attenuation length on the location
and angular direction of the seed photons is explored.
","[{""version"":""v1"",""created"":""Tue, 27 Jun 1995 18:25:50 GMT""}]","2009-10-28"
"astro-ph/9506131",,"Keith A. Olive and Sean T. Scully","Big Bang Nucleosynthesis: An Update","21 pages, latex, 9 uuencoded, tarred, compressed, ps figures minor
  error in eq. 5 corrected","Int.J.Mod.Phys.A11:409-428,1996","10.1142/S0217751X96000213","UMN-TH-1341/95","astro-ph hep-ph",,"  WThe current status of big bang nucleosynthesis is reviewed with an emphasis
on the comparison between the observational determination of the light element
abundances of \D, \he3, \he4 and \li7 and the predictions from theory. In
particular, we present new analyses for \he4 and \li7. Implications for physics
beyond the standard model are also discussed. Limits on the effective number of
neutrino flavors are also updated.
","[{""version"":""v1"",""created"":""Tue, 27 Jun 1995 21:04:51 GMT""},{""version"":""v2"",""created"":""Wed, 16 Aug 1995 20:47:13 GMT""}]","2009-09-15"
"astro-ph/9506132","Konstantinos Dimopoulos","A. C. Davis and K. Dimopoulos","Primordial Magnetic Fields in False Vacuum Inflation","31 pages, standard LaTeX file, 1 figure. Replaced. Important changes
  in the content and the results","Phys.Rev.D55:7398-7414,1997","10.1103/PhysRevD.55.7398","CERN-TH/95-175, DAMTP-95-31","astro-ph hep-ph",,"  We show that, during false vacuum inflation, a primordial magnetic field can
be created, sufficiently strong to seed the galactic dynamo and generate the
observed galactic magnetic fields. Considering the inflaton dominated regime,
our field is produced by the Higgs-field gradients, resulting from a grand
unified phase transition. The evolution of the field is followed from its
creation through to the epoch of structure formation, subject to the relevant
constraints. We find that it is possible to create a magnetic field of
sufficient magnitude, provided the phase transition occurs during the final 5
e-foldings of the inflationary period.
","[{""version"":""v1"",""created"":""Wed, 28 Jun 1995 14:11:19 GMT""},{""version"":""v2"",""created"":""Fri, 25 Oct 1996 13:39:56 GMT""}]","2010-11-30"
"astro-ph/9506134","Yipeng Jing","Y.P. Jing (MPA), G. Boerner (MPA), R. Valdarnini (SISSA)","Three-point correlation function of galaxy clusters in cosmological
  models: a strong dependence on triangle shape","11 pages, uuencoded compressed tar ps-file. 2 tables and 8 figures
  included. The ps file (without uuencoding compressing) can also be obtained
  by anonymous ftp at ftp://ibm-3.mpa-garching.mpg.de/pub/jing/9506134.ps","Mon.Not.Roy.Astron.Soc. 277 (1995) 630","10.1093/mnras/277.2.630","Accepted for publication in MNRAS","astro-ph",,"  In this paper, we use large $\pppm$ N-body simulations to study the
three-point correlation function $\zeta$ of clusters in two theoretical models.
The first model (LCDM) is a low-density flat model of $\Omega_0=0.3$,
$\Lambda_0=0.7$ and $h=0.75$, and the second model (PIM) is an
Einstein-de-Sitter model with its linear power spectrum obtained from
observations. We found that the scaled function $Q(r,u,v)$, which is defined as
the ratio of $\zeta (r, ru, ru+rv)$ to the hierarchical sum $\xi (r)\xi (ru)+
\xi (ru) \xi (ru+rv) +\xi (ru+rv)\xi (r)$ (where $\xi$ is the two-point
correlation function of clusters), depends weakly on $r$ and $u$, but very
strongly on $v$. $Q(r,u,v)$ is about 0.2 at $v=0.1$ and 1.8 at $v=0.9$. A model
of $Q(r,u,v)=\Theta 10^{1.3v^2}$ can fit the data of $\zeta$ very nicely with
$\Theta\approx 0.14$. This model is found to be universal for the LCDM clusters
and for the PIM clusters. Furthermore, $Q(r,u,v)$ is found to be insensitive to
the cluster richness. We have compared our N-body results with simple
analytical theories of cluster formation, like the peak theories or the local
maxima theories. We found that these theories do not provide an adequate
description for the three-point function of clusters. We have also examined the
observational data of $\zeta$ presently available, and have not found any
contradiction between the observations and our model predictions. The
$v$-dependence of $q$ in a projected catalogue of clusters is shown to be much
weaker than the $v$-dependence of $Q$ found in the three-dimensional case. It
would be important to search for the $v$-dependence of $Q$ in redshift samples
of rich clusters.
","[{""version"":""v1"",""created"":""Wed, 28 Jun 1995 15:31:06 GMT""}]","2015-06-24"
"astro-ph/9506135","Alice Harding","Alice K. Harding (NASA GSFC)","The Nature of Plerions Surrounding Soft Gamma-Ray Repeaters","5 pages, compressed, uuencoded postscript file. To appear in Proc. of
  1995 La Jolla Workshop ""High Velocity Neutron Stars and Gamma-Ray Bursts"" ed.
  R. Rothschild et al. (AIP: New York)",,"10.1063/1.50236",,"astro-ph",,"  Compact steady sources of X-ray emission have been detected at the positions
of at least two soft gamma-ray repeaters (SGRs). These sources have been
interpreted as synchrotron nebulae powered by the neutron star that is causing
the bursts. We explore a plerion model for the sources surrounding SGRs where
the steady observed emission is powered by the SGR bursts rather than by the
spin-down of a pulsar. In this case there is no limit on the neutron star
magnetic field. We find that the synchrotron lifetime of the particles injected
into the plerion around SGR1806-20 is long enough to smear out nebular emission
from individual bursts. Transient nebular emission would therefore not be
detected following an SGR burst. The combined radio emission from multiple
burst injections is expected to have a steeper spectrum than that of a typical
plerion.
","[{""version"":""v1"",""created"":""Wed, 28 Jun 1995 14:50:38 GMT""}]","2009-10-28"
"astro-ph/9506148","Brian McLeod","B. A. McLeod and M. J. Rieke","The Effects of Starbursts and Low-Surface-Brightness Galaxies on Faint
  Galaxy Models","uuencoded compressed tar file, AAS LaTeXv3.0 includes 14 EPS figures
  (32 pages), separate Latex file for tables (4 pages), to appear in ApJ",,"10.1086/176515",,"astro-ph",,"  We present models predicting the magnitude, redshift, and color distributions
of field galaxies. We explore whether a fading starburst scenario can account
for the observations of faint blue galaxies. We marginally rule out a starburst
scenario with a local IMF because the models predict too many nearby faint
galaxies that are not observed. A burst model with a truncated IMF reproduces
the counts and redshift distributions well but produces too blue a population.
We show that surface brightness selection has a significant effect on the
distributions. In particular, adding a population of low-surface brightness
galaxies, known to exist locally, can explain the counts for $B_J<23$. They do
not, however, account for the steepness of the counts at fainter magnitudes.
Finally we show that the colors of galaxies in a $K$-band selected sample are
too blue to be consistent with a constant star-formation rate,
passive-evolution model.
","[{""version"":""v1"",""created"":""Wed, 28 Jun 1995 15:40:25 GMT""}]","2009-10-28"
"chao-dyn/9506008","Ruediger Schack","R. Schack and C. M. Caves (University of New Mexico)","Information-theoretic characterization of quantum chaos","23 pages in REVTEX, 7 uuencoded postscript figures, submitted to
  Phys. Rev. E",,"10.1103/PhysRevE.53.3257",,"chao-dyn nlin.CD quant-ph",,"  Hypersensitivity to perturbation is a criterion for chaos based on the
question of how much information about a perturbing environment is needed to
keep the entropy of a Hamiltonian system from increasing. We demonstrate
numerically that hypersensitivity to perturbation is present in the following
quantum maps: the quantum kicked top, the quantum baker's map, the quantum lazy
baker's map, and the quantum sawtooth and cat maps.
","[{""version"":""v1"",""created"":""Wed, 28 Jun 1995 14:33:00 GMT""}]","2016-08-31"
"cmp-lg/9506024","Christine Thielen","Christine Thielen (SfS, University of T""ubingen)","An Approach to Proper Name Tagging for German","6 pages, LaTeX, 2 uuencoded tar-compressed eps-figures added,
  EACL-SIGDAT 95",,,,"cmp-lg cs.CL",,"  This paper presents an incremental method for the tagging of proper names in
German newspaper texts. The tagging is performed by the analysis of the
syntactic and textual contexts of proper names together with a morphological
analysis. The proper names selected by this process supply new contexts which
can be used for finding new proper names, and so on. This procedure was applied
to a small German corpus (50,000 words) and correctly disambiguated 65% of the
capitalized words, which should improve when it is applied to a very large
corpus.
","[{""version"":""v1"",""created"":""Wed, 28 Jun 1995 11:52:18 GMT""},{""version"":""v2"",""created"":""Thu, 29 Jun 1995 12:22:08 GMT""}]","2008-02-03"
"cond-mat/9506123","Jack","Ph. Jacquod and D.L.Shepelyansky","Hidden Breit-Wigner distribution and other properties of random matrices
  with preferential basis","4 pages, 4 postscript figures appended, new version with minor
  changes",,"10.1103/PhysRevLett.75.3501","NEIP-95-010","cond-mat",,"  We study statistical properties of a class of band random matrices which
naturally appears in systems of interacting particles. The local spectral
density is shown to follow the Breit-Wigner distribution in both localized and
delocalized regimes with width independent on the band/system size. We analyse
the implications of this distribution to the inverse participation ratio, level
spacing statistics and the problem of two interacting particles in a random
potential.
","[{""version"":""v1"",""created"":""Tue, 27 Jun 1995 18:44:19 GMT""},{""version"":""v2"",""created"":""Fri, 15 Sep 1995 07:24:10 GMT""},{""version"":""v3"",""created"":""Mon, 18 Sep 1995 11:08:28 GMT""}]","2009-10-28"
"cond-mat/9506124","Tatsuya Nakajima","T. Nakajima and H. Aoki","Composite-Fermion Analysis of the Double-Layer Fractional Quantum Hall
  System","11 pages, revtex, 2 figures available from
  nakajima@qua.crl.melco.co.jp",,"10.1103/PhysRevB.52.13780","NA95b","cond-mat",,"  Effect of interlayer tunneling in the double-layer fractional quantum Hall
system at the total Landau level filling of $\nu=1/m$ ($m$: odd integer) is
analyzed with the composite-fermion approach in which the flux attachment is
directly applied to the electron-electron interaction. A comparison with a
numerical result indicates that the vertically coupled Laughlin liquids may be
regarded as a system of composite fermions with {\em reduced} interparticle
interactions and {\em unchanged} interlayer tunneling, which makes the
quantum-Hall regime, identified by a gap in the pseudospin-wave excitation
mode, wider as $\nu$ becomes $1/3,1/5,\ldots$.
","[{""version"":""v1"",""created"":""Wed, 28 Jun 1995 04:23:15 GMT""}]","2009-10-28"
"cond-mat/9506125","Bill Atkinson","W. A. Atkinson and J. P. Carbotte","Effect of Proximity Coupling of Chains and Planes on the Penetration
  Depth Anisotropy in Y_1Ba_2Cu_3O_7","24 Pages, Submitted to Phys. Rev. B",,"10.1103/PhysRevB.52.10601","BE5774","cond-mat",,"  We calculate the penetration depth $\lambda$ in the $a$, $b$ and $c$
directions for a simple model of YBa$_2$Cu$_3$O$_7$. In this model there are
two layers---representing a CuO$_2$ plane and a CuO chain---per unit cell.
There is a BCS--like pairing (both $s$ wave and $d$ wave are considered)
interaction localised in the CuO$_2$ planes. The CuO chains become
superconducting at temperatures lower than $T_c$ because of their proximity to
the planes, and there is an induced gap in the chains. Since the temperature
dependence of the penetration depth in the $b$ direction (along the chains) is
sensitive to the size of the induced gap, the difference between the shapes of
the penetration depth curves in the $a$ and $b$ directions reveals a great deal
about the nature of the condensate in the chains. We find that in our proximity
model there are always regions of the chain Fermi surface on which the induced
gap is much smaller than $T_c$, so that the temperature dependence of
$\lambda_b$ is always different than that of $\lambda_a$. Experimental
observations of the of the $ab$ anisotropy show nearly identical temperature
dependences. The main result of our paper, then, is that a simple proximity
model in which the pairing interaction is localized to the planes, and the
planes are coherently coupled to the chains cannot account for the superfluid
on the chains.
","[{""version"":""v1"",""created"":""Wed, 28 Jun 1995 03:22:00 GMT""}]","2009-10-28"
"cond-mat/9506127","Han-Yong Choi","Han-Yong Choi (Sung Kyun Kwan University)","Finite-Band-width Effects on the Transition Temperature and NMR
  Relaxation Rate of Impure Superconductors","10 pages. REVTeX. 5 postscript figures. Scheduled to be published in
  Physical Review B, March 1. The previous submission is revised and two
  figures are added",,"10.1103/PhysRevB.53.8591",,"cond-mat supr-con",,"  We study the thermodynamic properties of impure superconductors by explicitly
taking into consideration the finiteness of electronic bandwidths within the
phonon-mediated Eliashberg formalism. For a finite electronic bandwidth, the
superconducting transition temperature, $T_c$, is suppressed by nonmagnetic
impurity scatterings. This is a consequence of a reduction in the effective
electron-phonon coupling, $\lambda_{eff}$. The reduced $\lambda_{eff}$ is
reflected in the observation that the coherence peak in $1/(T_1 T)$, where
$T_1$ is the nuclear spin-lattice relaxation time and $T$ is the temperature,
is enhanced by impurity scatterings for a finite bandwidth. Calculations are
presented for $T_c$ and $1/(T_1 T)$ as bandwidths and impurity scattering rates
are varied. Implications for doped C$_{60}$ superconductors are discussed in
connection with $T_c$ and $1/T_1$ measurements.
","[{""version"":""v1"",""created"":""Wed, 28 Jun 1995 06:14:12 GMT""},{""version"":""v2"",""created"":""Tue, 23 Jan 1996 06:14:42 GMT""}]","2009-10-28"
"cond-mat/9506128","Kikuo Harigaya","Kikuo Harigaya (ETL in Tsukuba)","Strongly-interacting model for antiferromagnetism in one-dimensional
  C60-polymers: A1C60","Phys. Rev. B (1996) Rapid Commun., Feb. 15 (to be published)","Phys. Rev. B 53 (1996) R4197-R4200","10.1103/PhysRevB.53.R4197",,"cond-mat chem-ph mtrl-th",,"  We study the antiferromagnetic phase of the C60-polymer doped with one
electron per one C60 by using a tight-binding model with long-range Coulomb
interactions. The model is solved by the unrestricted Hartree-Fock
approximation, and a phase diagram is obtained by changing Coulomb interaction
strengths and a conjugation parameter between C60 molecules. We find that the
antiferromagnetism is well described by the present model. The comparison with
the photoemission studies shows that the new band around the Fermi energy of
the A1C60 phase can be explaind by the extremely large intrusion of an energy
level into the gap of the neutral system. This indicates that the interaction
effects among electrons are important in doped C60-polymers.
","[{""version"":""v1"",""created"":""Wed, 28 Jun 1995 12:39:57 GMT""},{""version"":""v2"",""created"":""Thu, 19 Oct 1995 05:34:45 GMT""},{""version"":""v3"",""created"":""Tue, 19 Dec 1995 05:12:23 GMT""}]","2008-02-03"
"cond-mat/9506129","Julia Yeomans","J.M. Yeomans","Splitting the multiphase point","14 pages, Revtex, 3 Figs. available upon request Oxford University",,,"Theoretical Physics preprint no. OUTP-95-33S","cond-mat",,"  Models with competing interactions, for example the ANNNI model, can have
special points at which the ground state is infinitely degenerate, so-called
multiphase points. Small perturbations can lift this degeneracy and give rise
to infinite sequences of long-period phases. This paper compares the effect of
three possible perturbations, quantum fluctuations, thermal fluctuations and
the softening of the spins from their quantised positions.
","[{""version"":""v1"",""created"":""Wed, 28 Jun 1995 13:25:43 GMT""}]","2007-05-23"
"cond-mat/9506130","Kurt Broderix","Kurt Broderix, Reiner Kree","Comment on ``Monte Carlo Algorithms with Absorbing Markov Chains: Fast
  Local Algorithms for Slow Dynamics``","One page LaTeX2e, one uuencoded gz-compressed eps-figure",,,,"cond-mat",,"  We give a corrected version of the algorithm presented within the commented
paper by M.A. Novotny, Phys. Rev. Lett. Vol. 74, 1 (1995) (cond-mat/9411086)
","[{""version"":""v1"",""created"":""Wed, 28 Jun 1995 15:29:15 GMT""}]","2016-08-31"
"cond-mat/9506132","Peter Kopietz","Peter Kopietz","Calculation of the single-particle Green's function of interacting
  fermions in arbitrary dimension via functional bosonization","compressed postscript file, 4 figures included. This is a written
  version of a talk I gave at the Raymond L. Orbach Symposium, Riverside, Ca,
  March 18, 1995. To be published in the Proceedings of the Orbach Symposium,
  World Scientific. Editor: D. Hone","Proceedings of the Raymond L. Orbach Symposium, p. 101-119, edited
  by D. Hone (World Scientific, Singapore, 1996)",,,"cond-mat",,"  The single-particle Green's function of an interacting Fermi system with
dominant forward scattering is calculated by decoupling the interaction by
means of a Hubbard-Stratonowich transformation involving a bosonic auxiliary
field $\phi^{\alpha}$. We obtain a higher dimensional generalization of the
well-known one-dimensional bosonization result for the Green's function by
first calculating the Green's function for a fixed configuration of the
$\phi^{\alpha}$-field and then averaging the resulting expression with respect
to the probability distribution ${\cal{P}} \{ \phi^{\alpha} \} \propto \exp [ -
S_{eff} \{ \phi^{\alpha} \} ]$, where $S_{eff} \{ \phi^{\alpha} \}$ is the
effective action of the $\phi^{\alpha}$-field. We emphasize the approximations
inherent in the higher-dimensional bosonization approach and clarify its
relation with diagrammatic perturbation theory.
","[{""version"":""v1"",""created"":""Wed, 28 Jun 1995 14:28:11 GMT""}]","2007-05-23"
"funct-an/9506007","N. Christopher Phillips","Gerard J. Murphy and N. Christopher Phillips","C*-Algebras with the Approximate Positive Factorization Property","plain TeX; 19 pages",,,,"funct-an math.OA",,"  We say that a unital C*-algrebra A has the approximate positive factorization
property (APFP) if every element of A is a norm limit of products of positive
elements of A. (There is also a definition for the nonunital case.) T. Quinn
has recently shown that a unital AF algebra has the APFP if and only if it has
no finite dimensional quotients. This paper is a more systematic investigation
of C*-algebras with the APFP. We prove various properties of such algebras. For
example: They have connected invertible group, trivial K_1, and stable rank 1.
In the unital case, the K_0 group separates the tracial states. The APFP passes
to matrix algebras. and if I is an ideal in A such that I and A/I have the
APFP, then so does A. We also give some new examples of C*-algebras with the
APFP, including type II_1 factors and infinite-dimensional simple unital direct
limits with slow dimension growth, real rank zero, and trivial K_1 group. An
infinite- dimensional simple unital direct limit with slow dimension growth and
with the APFP must have real rank zero, but we also give examples of unital
algebras with the APFP which do not have real rank zero.
  Our analysis also leads to the introduction of a new concept of rank for a
C*-algebra that may be of interest in the future.
","[{""version"":""v1"",""created"":""Wed, 28 Jun 1995 02:50:10 GMT""}]","2016-08-31"
"funct-an/9506008","N. Christopher Phillips","Huaxin Lin and N. Christopher Phillips","Approximate Unitary Equivalence of Homomorphisms from O_infinity","LaTeX, 16 pages (in 10pt type)",,,,"funct-an math.OA",,"  We prove that if two nonzero homomorphisms from the Cuntz algebra O_infinity
to a purely infinite simple C*-algebra have the same class in KK-theory, and if
either both are unital or both are nonunital, then they are approximately
unitarily equivalent. It follows that O_infinity is classifiable in the sense
of Rordam. In particular, Rordam's classification theorem for direct limits of
matrix algebras over even Cuntz algebras extends to direct limits involving
both matrix algebras over even Cuntz algebras and corners of O_infinity for
which the K_0 group can be an arbitrary countable abelian group with no even
torsion.
","[{""version"":""v1"",""created"":""Wed, 28 Jun 1995 02:55:27 GMT""}]","2008-02-03"
"gr-qc/9506060",,"Giampiero Esposito","Gauge-Averaging Functionals for Euclidean Maxwell Theory in the Presence
  of Boundaries","41 pages, plain-tex, recently appearing in Classical and Quantum
  Gravity, volume 11, pages 905-926, April 1994. The author wants to apologize
  for the delay in circulating the file, due to technical problems now fixed","Class.Quant.Grav.11:905-926,1994","10.1088/0264-9381/11/4/010",,"gr-qc",,"  This paper studies the one-loop expansion of the amplitudes of
electromagnetism about flat Euclidean backgrounds bounded by a 3-sphere,
recently considered in perturbative quantum cosmology, by using zeta-function
regularization. For a specific choice of gauge-averaging functional, the
contributions to the full zeta value owed to physical degrees of freedom,
decoupled gauge mode, coupled gauge modes and Faddeev-Popov ghost field are
derived in detail, and alternative choices for such a functional are also
studied. This analysis enables one to get a better understanding of different
quantization techniques for gauge fields and gravitation in the presence of
boundaries.
","[{""version"":""v1"",""created"":""Tue, 27 Jun 1995 17:23:44 GMT""}]","2010-04-06"
