"hep-ph/9501286","Markus Finkemeier","Markus Finkemeier (Harvard University)","Radiative Corrections to $\pi_{l2}$ and $K_{l2}$ Decays","8 pages, Latex, uses epsfig. Revised version: Major changes in the
  presentaion, but no changes in the results. To appear in Phys. Lett. B",,,"HUTP-96/A027","hep-ph",,"  We reexamine radiative corrections to $\pi_{l2}$ and $K_{l2}$ decays. We
perform a matching calculation, including vector and axial vector resonances as
explicit degrees of freedom in the long distance part. By considering the
dependence on the matching scale and on the hadronic parameters, and by
comparing with model independent estimates, we scrutinize the model dependence
of the results. For the pseudoscalar meson decay constants, we extract the
values f_pi = (92.1 \pm 0.3) MeV and f_K = (112.4 \pm 0.9) MeV. For the ratios
R_pi and R_K of the electronic and muonic decay modes, we predict R_pi =
(1.2354 \pm 0.0002) 10^{-4} and R_K = (2.472 \pm 0.001) 10^{-5}.
","[{""version"":""v1"",""created"":""Thu, 12 Jan 1995 15:19:32 GMT""},{""version"":""v2"",""created"":""Tue, 3 Sep 1996 20:29:53 GMT""}]","2016-09-01"
"hep-th/9501035","David J. Fernandez C.","David J. Fern\'andez C., Luis M. Nieto and Oscar Rosas-Ortiz","Distorted Heisenberg Algebra and Coherent States for Isospectral
  Oscillator Hamiltonians","21 pages, Latex, 3 figures available as hard copies upon request from
  the first Author","J. Phys. A: Math. Gen. 28 (1995) 2693-2708","10.1088/0305-4470/28/9/026",,"hep-th quant-ph",,"  The dynamical algebra associated to a family of isospectral oscillator
Hamiltonians is studied through the analysis of its representation in the basis
of energy eigenstates. It is shown that this representation becomes similar to
that of the standard Heisenberg algebra, and it is dependent of a parameter
$w\geq 0$. We name it {\it distorted Heisenberg algebra}, where $w$ is the
distortion parameter. The corresponding coherent states for an arbitrary $w$
are derived, and some particular examples are discussed in full detail. A
prescription to produce the squeezing, by adequately selecting the initial
state of the system, is given.
","[{""version"":""v1"",""created"":""Wed, 11 Jan 1995 20:46:00 GMT""}]","2009-09-25"
"hep-th/9501036","Yo","C. Gomez and E. Lopez","On the String Interpretation of the $t{\bar t}$-geometry","Latex, 20 pages, no figures","Nucl.Phys. B444 (1995) 265-286","10.1016/0550-3213(95)00140-N","IMAFF-95/1","hep-th",,"  We derive the $t{\bar t}$-equations for generic $N\!=\!2$ topological field
theories as consistency conditions for the contact term algebra of topological
strings. A generalization of the holomorphic anomaly equation, known for the
critical ${\hat c}\!=\!3$ case, to arbitrary non critical topological strings
is presented. The interplay between the non trivial cohomology of the
$b$-antighost, gravitational descendants and $\bar t$-dependence is discussed.
The physical picture emerging from this study is that the $\bar t$ (background)
dependence of topological strings with non trivial cohomology for the
$b$-antighost, is determined by gravitational descendants.
","[{""version"":""v1"",""created"":""Wed, 11 Jan 1995 20:37:44 GMT""}]","2016-09-06"
"hep-th/9501037","Weiss Nathan","Lori Paniak (University of British Columbia), and Nathan Weiss
  (Weizmann Institute and University of British Columbia)","Kazakov--Migdal Model with Logarithmic Potential and the Double Penner
  Matrix Model","31 pages and one figure in uufile format","J.Math.Phys. 36 (1995) 2512-2530","10.1063/1.531048",,"hep-th hep-lat",,"  The Kazakov--Migdal (KM) Model is a U(N) Lattice Gauge Theory with a Scalar
Field in the adjoint representation but with no kinetic term for the Gauge
Field. This model is formally soluble in the limit $N\rightarrow \infty$ though
explicit solutions are available for a very limited number of scalar
potentials. A ``Double Penner'' Model in which the potential has two
logarithmic singularities provides an example of a explicitly soluble model. We
begin by reviewing the formal solution to this Double Penner KM Model. We pay
special attention to the relationship of this model to an ordinary (one) matrix
model whose potential has two logarithmic singularities (the Double Penner
Model). We present a detailed analysis of the large N behavior of this Double
Penner Model. We describe the various one cut and two cut solutions and we
discuss cases in which ``eigenvalue condensation'' occurs at the singular
points of the potential. We then describe the consequences of our study for the
KM Model described above. We present the phase diagram of the model and
describe its critical regions.
","[{""version"":""v1"",""created"":""Thu, 12 Jan 1995 07:21:15 GMT""}]","2016-09-06"
"hep-th/9501042","Dr N. Tetradis","D. Litim and N. Tetradis","Approximate solutions of exact renormalization group equations","14 pages, 3 uuencoded figures",,,"OUTP-94-17P, HD-THEP-94-29","hep-th",,"  We study exact renormalization group equations in the framework of the
effective average action. We present analytical approximate solutions for the
scale dependence of the potential in a variety of models. These solutions
display a rich spectrum of physical behaviour such as fixed points governing
the universal behaviour near second order phase transitions, critical
exponents, first order transitions (some of which are radiatively induced) and
tricritical behaviour.
","[{""version"":""v1"",""created"":""Thu, 12 Jan 1995 15:05:54 GMT""},{""version"":""v2"",""created"":""Fri, 13 Jan 1995 10:02:52 GMT""},{""version"":""v3"",""created"":""Thu, 12 Jan 1995 15:18:03 GMT""}]","2016-09-06"
"hep-th/9501043","Piljin Yi","Kimyeong Lee and Piljin Yi","SELF-DUAL ANYONS IN UNIFORM BACKGROUND FIELDS","LaTeX, 20 pages, 4 uuencoded figures included.","Phys.Rev. D52 (1995) 2412-2421","10.1103/PhysRevD.52.2412","CU-TP-668","hep-th cond-mat",,"  We study relativistic self-dual Chern-Simons-Higgs systems in the presence of
uniform background fields that explicitly break CTP. A rich, but discrete
vacuum structure is found when the gauge symmetry is spontaneously broken,
while the symmetric phase can have an infinite vacuum degeneracy at tree level.
The latter is due to the proliferation of neutral solitonic states that cost
zero energy. Various novel self-dual solitons, such as these, are found in both
the symmetric and the asymmetric phases. Also by considering a similar system
on a two-sphere and the subsequent large sphere limit, we isolate sensible and
finite expressions for the conserved angular and linear momenta, which satisfy
anomalous commutation relations. We conclude with a few remarks on unresolved
issues.
","[{""version"":""v1"",""created"":""Thu, 12 Jan 1995 15:30:55 GMT""}]","2016-09-06"
"hep-th/9501044","Didina Serban","D.Bernard. V.Pasquier and D.Serban","Exact Solution of Long-Range Interacting Spin Chains with Boundaries","10 pages, uuencoded, 1 figure","Euro. Phys. Lett. 30, 301, (1995)","10.1209/0295-5075/30/5/009","SPhT/95/003","hep-th cond-mat",,"  We consider integrable models of the Haldane-Shastry type with open boundary
conditions. We define monodromy matrices, obeying the reflection equation,
which generate the symmetries of these models. Using a map to the
Calogero-Sutherland Hamiltonian of BC type, we derive the spectrum and the
highest weight eigenstates.
","[{""version"":""v1"",""created"":""Thu, 12 Jan 1995 15:50:07 GMT""}]","2023-04-10"
"nucl-th/9501006",,"Hilmar Forkel and A.D. Jackson","Chiral Phase Structure of Hot and Dense Nuclear Matter","12p., 2 figures available via e-mail or FAX",,,"U of MD PP\#95--009 and SUNY-NTG 94-52","nucl-th",,"  The description of nuclear matter bulk properties in the framework of
quark-based hadron models in curved unit cells is extended to finite
temperature. We discuss the analogy and interplay of density and temperature
effects in this formulation and study, as an application, the temperature and
density dependence of chiral vacuum properties in the Nambu-Jona-Lasinio (NJL)
model.
","[{""version"":""v1"",""created"":""Wed, 11 Jan 1995 18:39:41 GMT""}]","2016-09-08"
"nucl-th/9501007","Bertrand Giraud","B.G. Giraud, Y. Hahn","Efimov Effect Revisited with Inclusion of Distortions","17 pages, TeX Email contact= giraud@amoco.saclay.cea.fr",,"10.1016/0375-9474(95)00059-A","Saclay-T94/106","nucl-th",,"  An elementary proof of the 3-body Efimov effect is provided in the case of a
separable 2-body potential which binds at zero energy a light particle to a
heavy one. The proof proceeds by two steps, namely {\it i)} a projection of the
Hamiltonian in a subspace and the observation that the projected Hamiltonian
generates an arbitrarily large number of bound states, and {\it ii)} a use of
the Hylleraas-Undheim theorem to recover the unprojected Hamiltonian. The
definition of the projectors we use can include mean field distortions.
","[{""version"":""v1"",""created"":""Thu, 12 Jan 1995 11:00:38 GMT""}]","2016-09-08"
"q-alg/9501009","Javier Mas","Javier Mas and Eduardo Ramos","The Constrained KP Hierarchy and the Generalised Miura Transformation","10 pages, Plain TeX. Some statements more precisely rephrased;
  expanded reference list",,"10.1016/0370-2693(95)00357-Q","USC-FT-1/95, PM/95-03","q-alg hep-th math.QA",,"  Recently much attention has been paid to the restriction of KP to the
submanifold of operators which can be represented as a ratio of two purely
differential operators L=AB^{-1}. Whereas most of the aspects concerning this
reduced hierarchy, like the Lax flows and the Hamiltonians, are by now well
understood, there still lacks a clear and conclusive statement about the
associated Poisson structure. We fill this gap by placing the problem in a more
general framework and then showing how the required result follows from an
interesting property of the second Gelfand-Dickey brackets under multiplication
and inversion of Lax operators. As a byproduct we give an elegant and simple
proof of the generalised Kupershmidt-Wilson theorem.
","[{""version"":""v1"",""created"":""Thu, 12 Jan 1995 15:19:36 GMT""},{""version"":""v2"",""created"":""Tue, 31 Jan 1995 05:04:38 GMT""}]","2009-10-28"
"q-alg/9501010","Jan Sobczyk","P. Kosi{\'n}ski, J. Lukierski, P. Ma{\'s}lanka and J. Sobczyk","Bicrossproduct Hopf Superalgebras and $D=4$ $\kappa$-deformed Poincar\'e
  Supergroup.","11 pages Latex, mssymb",,,"IFT UWr 887/95","q-alg math.QA",,"  The general framework of bicrossproduct Hopf algebras given by Majid is
extended to $Z_2$-graded bicrossproduct Hopf superalgebras. As examples of
bicrossproduct Hopf superalgebras we provide the graded algebras of functions
on undeformed as well as $\kappa$-deformed $D=4$ Poincar\'e supergroups.
","[{""version"":""v1"",""created"":""Thu, 12 Jan 1995 12:56:56 GMT""}]","2016-09-08"
"q-alg/9501011",,"S. Giller, C. Gonera, P. Kosinski, P. Maslanka","Differential calculus on deformed E(2) group","8 pages, amstex",,,,"q-alg math.QA",,"  Fourdimensional bicovariant differential calculus on quantum E(2) group is
constructed.
","[{""version"":""v1"",""created"":""Thu, 12 Jan 1995 15:04:26 GMT""}]","2016-09-08"
"q-alg/9501012",,"P. Kosinski, M. Majewski, P. Maslanka","Representations of generalized oscillator algebra","8 pages, amstex",,,,"q-alg math.QA",,"  The representations of the oscillator algebra introduced by Brzezinski et al.
(Phys. Lett. B 311 (1993), 202) are classified.
","[{""version"":""v1"",""created"":""Thu, 12 Jan 1995 15:05:52 GMT""}]","2016-09-08"
"solv-int/9501002","Piotr Grinevich","P.G.Grinevich, S.P.Novikov","String equation--2. Physical solution","32 pages, LaTex, 4 pictures in separate files. Subj-class and
  Journal-ref added","Algebra and Analysis v. 6 No. 3 (1994) 118-140 (in russian);
  english translation -- St. Petersburg Math. J. v. 6 No. 3 (1995) 553-574",,,"solv-int hep-th nlin.SI",,"  This paper is a continuation of the paper by S.P.Novikov in Funct.Anal.Appl.,
v.24(1990), No 4, pp 196-206. String equation is by definition the equation
$[L,A]=1$ for the coefficients of two linear ordinary differential operators
$L$ and $A$. For the ``double scaling limit'' of the matrix model we always
have $L=-\partial_x^2+u(x)$, $A$ is some differential operator of the odd order
$2k+1$. In the first nontrivial case $k=1$ we have the Painelev\'e-1 (P-1)
equation. Only special real ``separatrix'' solutions of P-1 are important in
the quantum field theory. By the conjecture of Novikov these ``physical''
solutions, which are analytically exceptional probably have much stronger
symmetry then the other solutions but it is not proved until now. Two
asymptotic methods were developed in the previous paper -- nonlinear
semiclassics (or the Bogolubov-Whitham averaging method) and the linear
semiclassics for the ``Isomonodromic'' method. The nonlinear semiclassics gives
a good approximation for the general (``non-physical'') solutions of P-1 but
fails in the ``physical'' case. In our paper the linear semiclasics for the
``physical'' solutions of the P-1 equations is studied. In particular
connection between the semiclassics on Riemann surfaces and Hamiltonian
foliations on these surfaces is established.
","[{""version"":""v1"",""created"":""Wed, 11 Jan 1995 20:16:04 GMT""},{""version"":""v2"",""created"":""Fri, 11 Aug 1995 13:58:54 GMT""},{""version"":""v3"",""created"":""Thu, 20 Apr 2000 15:00:52 GMT""}]","2008-02-03"
"solv-int/9501003","Fabian Essler","Fabian H.L. Essler (Univ. Bonn) and Vladimir E. Korepin (ITP Stony
  Brook)","Dual Field Approach to Correlation Functions in the Heisenberg Xxz Spin
  Chain","19 pages LaTeX, to appear in the proceedings of SMQFT, Los Angeles
  1994",,,,"solv-int nlin.SI",,"  We study zero temperature correlation functions of the spin-$1\over 2$
Heisenberg XXZ model in the critical regime $-1< \Delta\leq 1$ in a magnetic
field by means of the {\tenit Dual Field Approach}. We show for one particular
example how to derive determinant representations for correlation functions and
how to use these to embed the correlation functions in integrable systems of
integro-difference equations (IDE). These IDE are associated with a
Riemann-Hilbert problem.
","[{""version"":""v1"",""created"":""Wed, 11 Jan 1995 23:10:09 GMT""}]","2008-02-03"
"solv-int/9501004","Mark Mineev","Mark B. Mineev-Weinstein","Conservation Laws in Field Dynamics or Why Boundary Motion is Exactly
  Integrable?","LaTeX file, 12 pages",,,,"solv-int nlin.SI",,"  An infinite number of conserved quantities in the field dynamics $\phi_t = L
U(\phi) + \rho$ for a linear Hermitian (or anti-Hermitian) operator $L$, an
arbitrary function $U$ and a given source $\rho$ are presented. These integrals
of motion are the multipole moments of the potential created by $\phi$ in the
far-field. In the singular limit of a bistable scalar field $\phi = \phi_{\pm}$
(i.e. Ising limit) this theory describes a dissipative boundary motion (such as
Stefan or Saffman-Taylor problem that is the continuous limit of the
DLA-fractal growth) and can be exactly integrable. These conserved quantities
are the polynomial conservation laws attributed to the integrability. The
criterion for integrability is the uniqueness of the inverse potential
problem's solution.
","[{""version"":""v1"",""created"":""Wed, 11 Jan 1995 23:32:14 GMT""}]","2008-02-03"
