"hep-th/9501102",,"A.L. Larsen (Obs. de Paris, DEMIRM), N. Sanchez (Obs. de Paris,
  DEMIRM)","The Effect of Spatial Curvature on the Classical and Quantum Strings","30 pages Latex + three tables and five figures (not included)","Int.J.Mod.Phys.A11:4005-4030,1996","10.1142/S0217751X96001887","DEMIRM-Obs. de Paris-95004","hep-th astro-ph gr-qc",,"  We study the effects of the spatial curvature on the classical and quantum
string dynamics. We find the general solution of the circular string motion in
static Robertson-Walker spacetimes with closed or open sections. This is given
closely and completely in terms of elliptic functions. The physical properties,
string length, energy and pressure are computed and analyzed. We find the {\it
back-reaction} effect of these strings on the spacetime: the self-consistent
solution to the Einstein equations is a spatially closed $(K>0)$ spacetime with
a selected value of the curvature index $K$ (the scale f* is normalized to
unity). No self-consistent solutions with $K\leq 0$ exist. We semi-classically
quantize the circular strings and find the mass $m$ in each case. For $K>0,$
the very massive strings, oscillating on the full hypersphere, have $m^2\sim K
n^2\;\;(n\in N_0)$ {\it independent} of $\alpha'$ and the level spacing {\it
grows} with $n,$ while the strings oscillating on one hemisphere (without
crossing the equator) have $m^2\alpha'\sim n$ and a {\it finite} number of
states $N\sim 1/(K\alpha').$ For $K<0,$ there are infinitely many string states
with masses $m\log m\sim n,$ that is, the level spacing grows {\it slower} than
$n.$ The stationary string solutions as well as the generic string fluctuations
around the center of mass are also found and analyzed in closed form.
","[{""version"":""v1"",""created"":""Mon, 23 Jan 1995 15:26:39 GMT""}]","2010-11-01"
"hep-th/9501103","Ulrich Quaade","N. K. Nielsen, U. J. Quaade","The relativistic top: An application of the BFV quantization procedure
  for systems with degenerate constraints","12 pages of Latex file","Phys.Rev.D52:1204,1995; Erratum-ibid.D53:1009,1996;
  Phys.Rev.D53:1009,1996","10.1103/PhysRevD.52.1204 10.1103/PhysRevD.53.1009",,"hep-th",,"  The physical phase space of the relativistic top, as defined by Hanson and
Regge, is expressed in terms of canonical coordinates of the Poincar\'e group
manifold. The system is described in the Hamiltonian formalism by the mass
shell condition and constraints that reduce the number of spin degrees of
freedom. The constraints are second class and are modified into a set of first
class constraints by adding combinations of gauge fixing functions. The
Batalin-Fradkin-Vilkovisky (BFV) method is then applied to quantize the system
in the path integral formalism in Hamiltonian form. It is finally shown that
different gauge choices produce different equivalent forms of the constraints.
","[{""version"":""v1"",""created"":""Mon, 23 Jan 1995 14:42:00 GMT""}]","2014-11-18"
"hep-th/9501104","Stefano Vinti","Paolo Provero and Stefano Vinti","The 2D effective field theory of interfaces derived from 3D field theory","latex, 9 pages, no figures","Nucl.Phys. B441 (1995) 562-568","10.1016/0550-3213(95)00109-6","DFTT 8/95","hep-th cond-mat hep-lat",,"  The one--loop determinant computed around the kink solution in the 3D
$\phi^4$ theory, in cylindrical geometry, allows one to obtain the partition
function of the interface separating coexisting phases. The quantum
fluctuations of the interface around its equilibrium position are described by
a $c=1$ two--dimensional conformal field theory, namely a 2D free massless
scalar field living on the interface. In this way the capillary wave model
conjecture for the interface free energy in its gaussian approximation is
proved.
","[{""version"":""v1"",""created"":""Mon, 23 Jan 1995 15:22:54 GMT""}]","2016-09-06"
"math/9501202","Pablo Gastesi","Pablo Ares-Gastesi","The Bers-Greenberg Theorem and the Maskit Embedding for Teichm\""{u}ller
  spaces","15 pages, plain LaTeX, bf for Bbb, 2 figures in plain LaTeX, hard
  copies available under request",,,"formerly cd-hg/9501001","math.GT math.AG math.DG",,"  The Bers-Greenberg theorem tells that the Teichm\""{u}ller space of a Riemann
surface with branch points (orbifold) depends only on the genus and the number
of special points, but not on the particular ramification values. On the other
hand, the Maskit embedding provides a mapping from the Teichm\""{u}ller space of
an orbifold, into the product of one dimensional Teichm\""{u}ller spaces. In
this paper we prove that there is a set of isomorphisms between one dimensional
Teichm\""{u}ller spaces that, when restricted to the image of the
Teichm\""{u}ller space of an orbifold under the Maskit embedding, provides the
Bers-Greenberg isomorphism.
","[{""version"":""v1"",""created"":""Sun, 22 Jan 1995 17:09:49 GMT""}]","2008-02-03"
"math/9501234","Maggie McLoughlin","Donald E. Knuth","Aztec diamonds, checkerboard graphs, and spanning trees",,"J. Algebraic Combin. 6 (1997), no. 3, 253--257",,"Knuth migration 11/2004","math.CO",,"  This note derives the characteristic polynomial of a graph that represents
nonjump moves in a generalized game of checkers. The number of spanning trees
is also determined.
","[{""version"":""v1"",""created"":""Mon, 23 Jan 1995 00:00:00 GMT""}]","2008-02-03"
"mtrl-th/9501004","Kurt Mader","K. A. Mader, L.-W. Wang, and A. Zunger (National Renewable Energy
  Laboratory, Golden, Colorado)","Electronic structure of intentionally disordered AlAs/GaAs superlattices","10 pages, REVTeX and EPSF macros, 4 figures in postscript. e-mail to
  mader@cecam.fr",,"10.1103/PhysRevLett.74.2555",,"mtrl-th cond-mat.mtrl-sci",,"  We use realistic pseudopotentials and a plane-wave basis to study the
electronic structure of non-periodic, three-dimensional, 2000-atom
(AlAs)_n/(GaAs)_m (001) superlattices, where the individual layer thicknesses
n,m = {1,2,3} are randomly selected. We find that while the band gap of the
equivalent (n = m = 2) ordered superlattice is indirect, random fluctuations in
layer thicknesses lead to a direct gap in the planar Brillouin zone, strong
wavefunction localization along the growth direction, short radiative
lifetimes, and a significant band-gap reduction, in agreement with experiments
on such intentionally grown disordered superlattices.
","[{""version"":""v1"",""created"":""Mon, 23 Jan 1995 10:46:16 GMT""},{""version"":""v2"",""created"":""Tue, 24 Jan 1995 08:33:00 GMT""}]","2016-09-07"
"quant-ph/9501018",,"N.Brunner, K.Svozil and M.Baaz","Effective Quantum Observables","TeX-file, 32 pages","NuovoCim.B110:1397-1414,1995","10.1007/BF02849839",,"quant-ph",,"  Thought experiments about the physical nature of set theoretical
counterexamples to the axiom of choice motivate the investigation of peculiar
constructions, e.g. an infinite dimensional Hilbert space with a modular
quantum logic. Applying a concept due to BENIOFF, we identify the intrinsically
effective Hamiltonians with those observables of quantum theory which may
coexist with a failure of the axiom of choice. Here a self adjoint operator is
intrinsically effective, iff the Schroedinger equation of its generated
semigroup is soluble by means of eigenfunction series expansions.
","[{""version"":""v1"",""created"":""Mon, 23 Jan 1995 11:45:36 GMT""}]","2016-09-08"
