"astro-ph/9501078","Hans J. Haubold","R.W. Fairbridge, G. Windelius, H.J. Haubold","Potential of Interplanetary Torques and Solar Modulation for Triggering
  Terrestrial Atmospheric and Lithospheric Events","Invited Paper at the Fourth UN/ESA Workshop on Basic Space Science,
  Cairo, Egypt, July 1994. 7 pages LaTeX. Accepted for publication in the
  journal Earth, Moon, and Planets","Earth Moon Planets 70:179-181,1995","10.1007/BF00619462",,"astro-ph",,"  The Sun is forced into an orbit around the barycenter of the solar system
because of the changing mass distribution of the planets. Solar-planetary-lunar
dynamic relationships may form a new basis for understanding and predicting
cyclic solar forcing functions on the Earth's climate.
","[{""version"":""v1"",""created"":""Sun, 22 Jan 1995 21:47:28 GMT""}]","2011-03-17"
"astro-ph/9501080","Asher Yahalom","Asher Yahalom","STABILITY IN THE WEAK VARIATIONAL PRINCIPLE OF BAROTROPIC FLOWS",,,,,"astro-ph",,"  I find conditions under which the ""Weak Energy Principle"" of Katz, Inagaki
and Yahalom (1993) gives necessary and sufficient conditions. My conclusion is
that, necessary and sufficient conditions of stability are obtained when we
have only two mode coupling in the gyroscopic terms of the perturbed
Lagrangian. To illustrate the power of this new energy principle, I have
calculated the stability limits of two dimensional configurations such as
ordinary Maclaurin disk, an infinite self gravitating rotating sheet, and a two
dimensional Rayleigh flow which has well known sufficient conditions of
stability. All perturbations considered are in the same plane as the
configurations. The limits of stability are identical with those given by a
dynamical analysis when available, and with the results of the strong energy
principle analysis when given. Thus although the ""Weak Energy"" method is
mathematically more simple than the ""Strong Energy"" method of Katz, Inagaki and
Yahalom )1993) since it does not involve solving second order partial
differential equations, it is by no means less effective.
","[{""version"":""v1"",""created"":""Sun, 22 Jan 1995 17:53:44 GMT""}]","2016-08-30"
"astro-ph/9501081","Shemi Amotz","Amotz Shemi","COSMIC RAYS FROM ACCRETING ISOLATED NEUTRON STARS","11 pages, simple TEX; to be published in MNRAS","Mon.Not.Roy.Astron.Soc. 275 (1995) 115","10.1093/mnras/275.1.115",,"astro-ph",,"  Interstellar matter that is accreted onto isolated magnetic neutron stars in
the Galaxy ($\sim 10^9$ by number) is accelerated and reflected back by MHD
shocks, which envelope the stars. The integrated power in the Galaxy
$L_{cr,ns}$ is $ \sgreat 10^{40} {\rm erg \ s^{-1} }$, the energy distribution
is a power law of spectral index $> 2$, and the particle energy can be raised
to $10^6$ GeV, consistent with the power and spectrum of primary cosmic rays in
the Galaxy. The major contribution for $L_{cr,ns}$ comes from a minority of
$\sim 10^7$ isolated neutron stars which are located within dense clouds.
Sources in these clouds, that are generally spread within the Galactic disk,
can explain the concentration of high-energy cosmic rays in the Galactic plane,
as deduced from pion decay spectra in gamma-ray observations. The soft X-ray
luminosity from these neutron stars is consistent with the Galactic X-ray
background. The accretion may be associated with ion-neutral bias, that is
further enhanced by ion confinement in frozen-in magnetic fields, which can
raise the relative abundance of first ionization potential (FIP) elements in
the cosmic rays.
","[{""version"":""v1"",""created"":""Mon, 23 Jan 1995 08:29:28 GMT""}]","2015-06-24"
"astro-ph/9501082","Malbet Fabien","Claude Bertout, Bo Reipurth, Fabien Malbet","Star Formation Studies at the VLT","13 pages including 7 figures and tables, uuencoded postscript;
  Invited talk, Proceedings of the ESO Workshop ``Science with the VLT'', eds.
  Danziger \& J., Walsh, J., Garching, June 1994.",,,,"astro-ph",,"  We present an overview of what can be done in the field of star formation
using the VLT and its advanced instrumentation, and especially with the very
high angular resolution provided by the VLT in the VLTI mode. Herbig-Haro
objects and early stellar evolution, pre-main sequence binaries, circumstellar
disks and surface properties of young stars are investigated. We show that the
VLT and VISA will be not only very useful to better understand star formation
processes, but indeed necessary in order to advance in certain subjects.
","[{""version"":""v1"",""created"":""Mon, 23 Jan 1995 14:34:53 GMT""}]","2016-08-30"
"astro-ph/9501084","Eduardo Telles","Eduardo Telles and Roberto Terlevich","The environment of HII galaxies","7 pages, uuencoded, compressed, postscript file. (three figures
  included). Also available via anonymous ftp from
  ftp://cast0.ast.cam.ac.uk/pub/etelles/environ.ps.Z",,"10.1093/mnras/275.1.1","IOA-ETELLES95","astro-ph",,"  Recent morphological studies (Telles \& Terlevich 1994) of HII galaxies, i.e.
dwarf galaxies dominated by a very luminous starburst, have indicated that
luminous HII galaxies tend to show distorted morphology suggestive of tidal
interactions triggering the present starburst while low luminosity HII galaxies
tend to be instead symmetric and regular. To check the tidal origin of the
starburst in HII galaxies, we have searched for companions in the neighbourhood
of a sample of 51 HII galaxies. We found that only 12 HII galaxies have a
neighbour within a projected distance of 1 Mpc and 250 \kmsec~ in velocity
difference, and of these 12, only 4 have a luminous (M$_B <$ --19) neighbour.
Surprisingly, isolated HII galaxies tend to be of high luminosity and disturbed
morphology while HII galaxies with neighbours tend to be low luminosity regular
HII galaxies. Furthermore, the metal abundance and the equivalent width of the
emission lines in HII galaxies do not depend on the presence of a companion.
These results are opposed to simple expectations if interaction with a bright
companion is the main mechanism triggering the starbursts. We have also found a
loose group of HII galaxies with no luminous companion. For this, there is the
additional difficulty of understanding how these starbursts are synchronized on
time scales of less than $10^7$ yrs in systems separated by $\sim$ 1-2 Mpc.
","[{""version"":""v1"",""created"":""Mon, 23 Jan 1995 15:27:00 GMT""}]","2015-06-24"
"chem-ph/9501002","Martin Vossen","M. Vossen, F. Forstmann (Institut f\""ur Theoretische Physik, Freie
  Universit\""at Berlin, Arnimallee 14, 14195 Berlin, Germany)","Integral equation theory for the electrode-electrolyte interface with
  the central force water model. Results for an aqueous solution of sodium
  chloride","Submitted to the Journal of Chemical Physics, REVTeX, 34 pages, 9
  figures",,"10.1080/00268979500102881",,"chem-ph physics.chem-ph",,"  The structure of an aqueous solution of sodium chloride at a planar electrode
is investigated by integral equation techniques. With the central force water
model the aqueous electrolyte is modelled as a mixture of sodium and chloride
ions and partially charged hydrogen and oxygen atoms interacting via effective
spherically symmetric pair potentials. The bulk correlation functions are
obtained from the Ornstein-Zernike equation. With the Wertheim-Lovett-Mou-Buff
equation we have calculated the density profiles at the uncharged and charged
electrode. Steric interactions between the differently sized ions and the
ice-like water structure near the electrode dominates the ionic distribution.
This model electrolyte also responds differently to opposite charges on the
electrode.
","[{""version"":""v1"",""created"":""Mon, 23 Jan 1995 15:32:31 GMT""},{""version"":""v2"",""created"":""Wed, 25 Jan 1995 08:14:30 GMT""}]","2009-10-28"
"cond-mat/9501103","P. Singh Deo","A. M. Jayannavar and P. Singha Deo","Persistent Currents in the Presence of a Transport Current","To appear in Phys. Rev. B. Three figures available on request",,"10.1103/PhysRevB.51.10175",,"cond-mat",,"  We have considered a system of a metallic ring coupled to two electron
reservoirs. We show that in the presence of a transport current, the persistent
current can flow in a ring, even in the absence of magnetic field. This is
purely a quantum effect and is related to the current magnification in the
loop. These persistent currents can be observed if one tunes the Fermi energy
near the antiresonances of the total transmission coefficient or the two port
conductance.
","[{""version"":""v1"",""created"":""Sun, 22 Jan 1995 17:12:48 GMT""}]","2009-10-28"
"cond-mat/9501104","P. Singh Deo","A. M. Jayannavar, P. Singha Deo and T. P. Pareek","CURRENT MAGNIFICATION AND CIRCULATING CURRENTS IN MESOSCOPIC RINGS","On the basis of talk given by A. M. Jayannavar at ""International
  Workshop on Novel Physics in Low Dimensional Systems"" in Madras(India). Four
  figures available on request",,"10.1016/0921-4526(95)00041-7",,"cond-mat",,"  We show that several novel effects related to persistent currents can arise
in open systems, which have no analogue in closed or isolated systems. We have
considered a system of a metallic ring coupled to two electron reservoirs. We
show that in the presence of a transport current, persistent currents can flow
in a ring even in the absence of magnetic field. This is related to the current
magnification effect in the ring. In the presence of magnetic field we show
that the amplitude of persistent currents is sensitive to the direction of
current flow from one reservoir to another. Finally we briefly discuss the
persistent currents arising due to two nonclassical effects namely,
Aharonov-Bohm effect and quantum tunneling.
","[{""version"":""v1"",""created"":""Sun, 22 Jan 1995 17:13:03 GMT""}]","2009-10-28"
"cond-mat/9501105","Daijiro Yoshioka","D. Yoshioka and H. Kato","The effect of the Coulomb interaction on the mesoscopic persistent
  current","10 pages, Revtex, figures upon request paper given at Workshop on
  Novel Physics in Low-Dimensional Electron Systems, January 9-14, 1995, at
  Madras","Physica B 212 (1995) 251","10.1016/0921-4526(95)00039-C","UTKOMCMT-1","cond-mat",,"  The persistent current in three-dimensional mesoscopic rings is investigated
numerically. The model is tight-binding one with random site-energies and
interaction between electrons. The self-consistent Hartree-Fock approximation
is adopted for the interaction between electrons, and models with up to
$6\times 6\times 20$ sites are investigated. It is shown that the long-range
Coulomb interaction enhances the persistent current for rings with finite
width. The origin of the enhancement is discussed.
","[{""version"":""v1"",""created"":""Mon, 23 Jan 1995 11:16:31 GMT""}]","2016-08-31"
"cond-mat/9501106","Bodo Huckestein","Bodo Huckestein","Scaling Theory of the Integer Quantum Hall Effect","96 pages, REVTeX 3, 28 figures, Figs. 8-24, 26-28 appended as
  uuencoded compressed tarred PostScript files. Submitted to Rev. Mod. Phys.","Rev. Mod. Phys. 67, 357-396 (1995)","10.1103/RevModPhys.67.357","MPIH-V18-1994","cond-mat",,"  The scaling theory of the transitions between plateaus of the Hall
conductivity in the integer Quantum Hall effect is reviewed. In the model of
two-dimensional noninteracting electrons in strong magnetic fields the
transitions are disorder-induced localization-delocalization transitions. While
experimental and analytical approaches are surveyed, the main emphasis is on
numerical studies, which successfully describe the experiments. The theoretical
models for disordered systems are described in detail. An overview of the
finite-size scaling theory and its relation to Anderson localization is given.
The field-theoretical approach to the localization problem is outlined.
Numerical methods for the calculation of scaling quantities, in particular the
localization length, are detailed. The properties of local observables at the
localization-delocalization transition are discussed in terms of multifractal
measures. Finally, the results of extensive numerical investigations are
compared with experimental findings.
","[{""version"":""v1"",""created"":""Mon, 23 Jan 1995 14:24:23 GMT""}]","2016-08-31"
"cond-mat/9501107","Steve Simon","Leon Balents and Steven H. Simon","Problems With the Vortex-Boson Mapping in 1+1 Dimensions","4 Pages (REVTeX 3.0). Postscript file for this paper is available on
  the World Wide Web at http://cmtw.harvard.edu/~simon/ ;",,"10.1103/PhysRevB.51.15610","ITP preprint NSF-ITP-95-03.","cond-mat",,"  Using the well known boson mapping, we relate the transverse magnetic
susceptibility of a system of flux vortices in 1+1 dimensions to an
appropriately defined conductivity of a one-dimensional boson system. The tilt
response for a system free of disorder is calculated directly, and it is found
that a subtle order of limits is required to avoid deceptive results.
","[{""version"":""v1"",""created"":""Mon, 23 Jan 1995 15:02:32 GMT""}]","2016-08-31"
"gr-qc/9501026","Lloyd Alty","L. J. Alty and C. J. Fewster","Initial Value Problems and Signature Change","33 pages, LaTeX The introduction has been altered, and new work
  (relating our previous results to continuous signature change) has been
  included","Class.Quant.Grav.13:1129-1148,1996","10.1088/0264-9381/13/5/024","DAMTP R95/1","gr-qc",,"  We make a rigorous study of classical field equations on a 2-dimensional
signature changing spacetime using the techniques of operator theory. Boundary
conditions at the surface of signature change are determined by forming
self-adjoint extensions of the Schr\""odinger Hamiltonian. We show that the
initial value problem for the Klein--Gordon equation on this spacetime is
ill-posed in the sense that its solutions are unstable. Furthermore, if the
initial data is smooth and compactly supported away from the surface of
signature change, the solution has divergent $L^2$-norm after finite time.
","[{""version"":""v1"",""created"":""Sun, 22 Jan 1995 17:19:00 GMT""},{""version"":""v2"",""created"":""Sun, 2 Jul 1995 20:34:05 GMT""}]","2008-11-26"
"gr-qc/9501027","P. Suntharothok-Priesmeyer","Luc Blanchet, Thibault Damour, Bala R. Iyer, Clifford M. Will, and
  Alan G. Wiseman","Gravitational-Radiation Damping of Compact Binary Systems to Second
  Post-Newtonian order","12 pages, RevTeX 3.0. Direct all correspondence to
  cmw@howdy.wustl.edu, FAX 314-935-6219","Phys.Rev.Lett.74:3515-3518,1995","10.1103/PhysRevLett.74.3515",,"gr-qc",,"  The rate of gravitational-wave energy loss from inspiralling binary systems
of compact objects of arbitrary mass is derived through second post-Newtonian
(2PN) order $O[(Gm/rc^2)^2]$ beyond the quadrupole approximation. The result
has been derived by two independent calculations of the (source) multipole
moments. The 2PN terms, and in particular the finite mass contribution therein
(which cannot be obtained in perturbation calculations of black hole
spacetimes), are shown to make a significant contribution to the accumulated
phase of theoretical templates to be used in matched filtering of the data from
future gravitational-wave detectors.
","[{""version"":""v1"",""created"":""Mon, 23 Jan 1995 13:03:38 GMT""}]","2011-07-19"
"hep-lat/9501027","Randjbar Daemi Seif","S. Randjbar-Daemi and J. Strathdee (ICTP- Trieste)","Chiral Fermions on the Lattice","40 pages, Latex","Nucl.Phys. B443 (1995) 386-416","10.1016/0550-3213(95)00118-C","IC/95/6","hep-lat hep-th",,"  The overlap approach to chiral gauge theories on arbitrary $D$--dimensional
lattices is studied. The doubling problem and its relation to chiral anomalies
for $D=2$ and 4 is examined. In each case it is shown that the doublers can be
eliminated and the well known perturbative results for chiral anomalies can be
recovered. We also consider the multi--flavour case and give the general
criteria for the construction of anomaly free chiral gauge theories on
arbitrary lattices. We calculate the second order terms in a continuum
approximation to the overlap formula in $D$ dimensions and show that they
coincide with the bilinear part of the effective action of $D$--dimensional
Weyl fermions coupled to a background gauge field. Finally, using the same
formalism we reproduce the correct Lorentz, diffeomorphism and gauge anomalies
in the coupling of a Weyl fermion to 2--dimensional gravitational and Maxwell
fields.
","[{""version"":""v1"",""created"":""Mon, 23 Jan 1995 15:06:44 GMT""}]","2016-08-31"
"hep-ph/9501356","Yongseok Oh","Yongseok Oh and Byung-Yoon Park","Energy levels of the soliton--heavy-meson bound states","24 pages, REVTeX v3.0, 6 figures are available upon request.","Phys.Rev.D51:5016-5029,1995","10.1103/PhysRevD.51.5016","SNUTP-94/131","hep-ph",,"  We investigate the bound states of heavy mesons with finite masses to a
classical soliton solution in the Skyrme model. For a given model Lagrangian we
solve the equations of motion exactly so that the heavy vector mesons are
treated on the same footing as the heavy pseudoscalar mesons. All the energy
levels of higher grand spin states as well as the ground state are given over a
wide range of the heavy meson masses. We also examine the validity of the
approximations used in the literatures. The recoil effect of finite mass
soliton is naively estimated.
","[{""version"":""v1"",""created"":""Mon, 23 Jan 1995 06:28:42 GMT""}]","2011-07-19"
"hep-ph/9501357","G. Ecker","Gerhard Ecker","Chiral perturbation theory","84 pages, Latex, 11 PostScript figures (in separate file) embedded
  with epsfig.sty, complete ps file (compressed, uuencoded, 0.6 MB) available
  via email on request; to appear in Progr. Part. Nucl. Phys., vol. 35","Prog.Part.Nucl.Phys.35:1-80,1995","10.1016/0146-6410(95)00041-G","UWThPh-1994-49","hep-ph nucl-th",,"  The main elements and methods of chiral perturbation theory, the effective
field theory of the Standard Model below the scale of spontaneous chiral
symmetry breaking, are summarized. Applications to the interactions of mesons
and baryons at low energies are reviewed, with special emphasis on developments
of the last three years. Among the topics covered are the strong,
electromagnetic and semileptonic weak interactions of mesons at and beyond
next--to--leading order in the chiral expansion, nonleptonic weak interactions
of mesons, virtual photon corrections and the meson--baryon system. The
discussion is limited to processes at zero temperature, for infinite volume and
with at most one baryon.
","[{""version"":""v1"",""created"":""Mon, 23 Jan 1995 10:32:54 GMT""}]","2010-12-02"
"hep-ph/9501358",,"K. Melnikov and O. Yakovlev","Final state interaction in the production of heavy unstable particles","33 pages, latex, 6 figures (added), version accepted for publication
  in Nuc. Phys. B, substantial revision","Nucl.Phys. B471 (1996) 90-120","10.1016/0550-3213(96)00151-4","MZ-TH/95-01, Budker INP-96-06","hep-ph",,"  We make an attempt to discuss in detail the effects originating from the
final state interaction in the processes involving production of unstable
elementary particles and their subsequent decay. Two complementary scenarios
are considered: the single resonance production and the production of two
resonances. We argue that part of the corrections due to the final state
interaction can be connected with the Coulomb phases of the involved charge
particles; the presence of the unstable particle in the problem makes the
Coulomb phase ``visible''. It is shown how corrections due to the final state
interaction disappear when one proceeds to the total cross-sections. We derive
one-loop non-factorizable radiative corrections to the lowest order matrix
element of both single and double resonance production. We discuss how the
infrared limit of the theories with the unstable particles is modified. In
conclusion we briefly discuss our results in the context of the forthcoming
experiments on the $W^+W^-$ and the $t\bar t$ production at LEP $2$ and NLC.
","[{""version"":""v1"",""created"":""Mon, 23 Jan 1995 15:43:49 GMT""},{""version"":""v2"",""created"":""Wed, 20 Mar 1996 15:24:17 GMT""}]","2009-10-28"
"hep-th/9501094","Tomas Ortin","T. Ortin","TIME-SYMMETRIC INITIAL DATA SETS IN 4--D DILATON GRAVITY","latex file, 38 pages.","Phys. Rev. D 52, 3392 (1995)","10.1103/PhysRevD.52.3392","QMW-PH-94-14","hep-th",,"  I study the time--symmetric initial--data problem in theories with a massless
scalar field (dilaton), free or coupled to a Maxwell field in the stringy way,
finding different initial--data sets describing an arbitrary number of black
holes with arbitrary masses, charges and asymptotic value of the dilaton. The
presence of the scalar field gives rise to a number of interesting effects. The
mass and charges of a single black hole are different in its two asymptotically
flat regions across the Einstein--Rosen bridge. The same happens to the value
of the dilaton at infinity. This forbids the identification of these asymptotic
regions in order to build (Misner) wormholes in the most naive way. Using
different techniques, I find regular initial data for stringy wormholes. The
price payed is the existence singularities in the dilaton field. The presence
of a single--valued scalar seems to constrain strongly the allowed topologies
of the initial space--like surface. Other kinds of scalar fields (taking values
on a circle or being defined up to an additive constant) are also briefly
considered.
","[{""version"":""v1"",""created"":""Mon, 23 Jan 1995 00:58:33 GMT""}]","2016-08-24"
"hep-th/9501100","Changhyun Ahn","C. Ahn, S. Krivonos and A. Sorin","The Full Structure of Quantum $N=2$ Super-$W_3^{(2)}$ Algebra","8 pages, latex, no figures","Mod.Phys.Lett. A10 (1995) 1299-1308","10.1142/S0217732395001423","JINR-E2-95-27","hep-th",,"  We present the complete structure of the nonlinear $N=2$ super extension of
Polyakov-Bershadsky, $W_3^{(2)}$, algebra with the generic central charge, $c$,
at the {\it quantum} level. It contains extra two pairs of fermionic currents
with integer spins 1 and 2, besides the currents of $N=2$ superconformal and
$W_3^{(2)}$ algebras. For $c\rightarrow \infty$ limit, the algebra reduces to
the classical one, which has been studied previously. The 'hybrid' field
realization of this algebra is also discussed.
","[{""version"":""v1"",""created"":""Mon, 23 Jan 1995 14:21:03 GMT""},{""version"":""v2"",""created"":""Tue, 24 Jan 1995 13:53:45 GMT""},{""version"":""v3"",""created"":""Mon, 30 Jan 1995 19:21:21 GMT""}]","2016-09-06"
"hep-th/9501101",,"A.L. Larsen (Obs. de Paris, DEMIRM), N. Sanchez (Obs. de Paris,
  DEMIRM)","New Classes of Exact Multi-String Solutions in Curved Spacetimes","43 pages Latex + one table and seven figures (not included).","Phys.Rev. D51 (1995) 6929-6948","10.1103/PhysRevD.51.6929","DEMIRM-Obs. de Paris-95003","hep-th astro-ph gr-qc",,"  We find new classes of {\it exact} string solutions in a variety of curved
backgrounds. They include stationary and dynamical (open, closed, straight,
finitely and infinitely long) strings as well as {\it multi-string} solutions,
in terms of elliptic functions. The physical properties, string length, energy
and pressure are computed and analyzed. In anti de Sitter spacetime, the
solutions describe an {\it infinite} number of infinitely long stationary
strings of equal energy but different pressures. In de Sitter spacetime,
outside the horizon, they describe infinitely many {\it dynamical} strings
infalling non-radially, scattering at the horizon and going back to spatial
infinity in different directions. For special values of the constants of
motion, there are families of solutions with {\it selected finite} numbers of
different and independent strings. In black hole spacetimes (without
cosmological constant), {\it no} multi-string solutions are found. In the
Schwarzschild black hole, inside the horizon, we find one straight string
infalling non-radially, with {\it indefinetely} growing size, into the $r=0$
singularity. In the $2+1$ black hole anti de Sitter background, the string
stops at $r=0$ with {\it finite} length.
","[{""version"":""v1"",""created"":""Mon, 23 Jan 1995 15:26:11 GMT""}]","2016-09-06"
