"cond-mat/9510052","Thomas Guhr","T. Guhr (MPI Heidelberg)","Transitions toward Quantum Chaos: with Supersymmetry from Poisson to
  Gauss","49 pages, one figure in one postscript file",,"10.1006/aphy.1996.0091",,"cond-mat",,"  The transition from arbitrary to chaotic fluctuation properties in quantum
systems is studied in a random matrix model. It is assumed that the Hamiltonian
can be written as the sum of an arbitrary and a chaos producing part. The
Gaussian ensembles are used to model the chaotic part. A closed integral
representation for all correlations in the case of broken time reversal
invariance is derived by employing supersymmetry and the graded eigenvalue
method. In particular, the two level correlation function is expressed as a
double integral. For a correlation index, exact diffusion equations are derived
for all three universality classes which describe the transition to the chaotic
regime from arbitrary initial conditions. As an application, the transition
from Poisson regularity to chaos is discussed. The two level correlation
function becomes a double integral for all values of the transition parameter.
","[{""version"":""v1"",""created"":""Wed, 11 Oct 1995 15:22:56 GMT""}]","2009-10-28"
"cond-mat/9510053","Mr M. Howard","Martin Howard","Fluctuation Kinetics in a Multispecies Reaction-Diffusion System","LaTeX file (41 pages) + 13 postscript figures, uuencoded",,"10.1088/0305-4470/29/13/016","OUTP95-58S","cond-mat",,"  We study fluctuation effects in a two species reaction-diffusion system, with
three competing reactions $A+A\rightarrow\emptyset$, $B+B\rightarrow\emptyset$,
and $A+B\rightarrow\emptyset$. Asymptotic density decay rates are calculated
for $d\leq 2$ using two separate methods - the Smoluchowski approximation, and
also field theoretic/renormalisation group (RG) techniques. Both approaches
predict power law decays, with exponents which asymptotically depend only on
the ratio of diffusion constants, and not on the reaction rates. Furthermore,
we find that, for $d<2$, the Smoluchowski approximation and the RG improved
tree level give identical exponents. However, whereas the Smoluchowski approach
cannot easily be improved, we show that the RG provides a systematic method for
incorporating additional fluctuation effects. We demonstrate this advantage by
evaluating one loop corrections for the exponents in $d<2$, and find good
agreement with simulations and exact results.
","[{""version"":""v1"",""created"":""Wed, 11 Oct 1995 15:58:22 GMT""}]","2009-10-28"
"gr-qc/9510018","Claes Cramer","Claes R Cramer","Photon propagation in a stationary warp drive space-time","The model and the conclusions in the paper are not accurate!",,,,"gr-qc",,"  We simplify the warp drive space-time so that it becomes stationary and the
distorsion becomes one-dimensional and static. We use this simplified warp
drive space-time as a background for a photon field. We shall especially use
the Drummond\&Hathrell action in order to investigate the velocity effects on
photons in this background. Finally, we discuss the limitations of this model.
","[{""version"":""v1"",""created"":""Tue, 10 Oct 1995 16:02:43 GMT""},{""version"":""v2"",""created"":""Tue, 10 Oct 1995 22:13:54 GMT""},{""version"":""v3"",""created"":""Wed, 1 Nov 1995 01:12:31 GMT""},{""version"":""v4"",""created"":""Sat, 27 May 2023 04:40:36 GMT""}]","2023-05-30"
"gr-qc/9510019","Kiyoshi Ezawa","Kiyoshi Ezawa","Multi-plaquette solutions for discretized Ashtekar gravity","11 pages Latex (2 figures available as a postscript file, the rough
  discussion on the non-normalizability has been made exact. )","Mod.Phys.Lett. A11 (1996) 349-356","10.1142/S0217732396000394","OU-HET/223","gr-qc",,"  A discretized version of canonical quantum gravity proposed by Loll is
investigated. After slightly modifying Loll's discretized Hamiltonian
constraint, we encode its action on the spin network states in terms of
combinatorial topological manipulations of the lattice loops. Using this
topological formulation we find new solutions to the discretized Wheeler-Dewitt
equation. These solutions have their support on the connected set of
plaquettes. We also show that these solutions are not normalizable with respect
to the induced heat-kernel measure on $SL(2,{\bf C})$ gauge theories.
","[{""version"":""v1"",""created"":""Wed, 11 Oct 1995 03:33:43 GMT""},{""version"":""v2"",""created"":""Thu, 19 Oct 1995 13:19:46 GMT""}]","2009-10-28"
"gr-qc/9510020",,"Giampiero Esposito, Hugo A. Morales-Tecotl and Luis O. Pimentel","Essential self-adjointness in one-loop quantum cosmology","14 pages, plain Tex. An Erratum has been added to the end, which
  corrects section 3","Class.Quant.Grav. 13 (1996) 957-963; Erratum-ibid. 17 (2000) 3091","10.1088/0264-9381/13/5/014","DSF preprint 95/41","gr-qc",,"  The quantization of closed cosmologies makes it necessary to study squared
Dirac operators on closed intervals and the corresponding quantum amplitudes.
This paper proves self-adjointness of these second-order elliptic operators.
","[{""version"":""v1"",""created"":""Wed, 11 Oct 1995 08:24:39 GMT""},{""version"":""v2"",""created"":""Tue, 19 Dec 2000 18:03:43 GMT""}]","2009-10-28"
"gr-qc/9510021",,"Marcelo Alves","Dilaton Gravity with a Non-Minimally Coupled Scalar Field","Latex, 11 pages",,,"CERN-TH/95-259","gr-qc hep-th",,"  We discuss the two-dimensional dilaton gravity with a scalar field as the
source matter. The coupling between the gravity and the scalar, massless, field
is presented in an unusual form. We work out two examples of these couplings,
and solutions with black-hole behaviour are discussed and compared with those
found in the literature.
","[{""version"":""v1"",""created"":""Wed, 11 Oct 1995 09:48:24 GMT""}]","2007-05-23"
"hep-ph/9510259",,"Dongsheng Du and Libo Guo","Electroweak Penguin Contributions in $B^-(\overline {B_d^0}) \to PP$ and
  $PV$ decays Beyond Leading Logarithms","12 pages, latex","Z.Phys.C75:9-15,1997","10.1007/s002880050441","BIHEP-TH-95-28","hep-ph",,"  Using the next-to-leading order low energy effective Hamiltonian for $|\Delta
B|=1$, $\Delta C=\Delta U=0$ transitions, the contributions of electroweak
penguin operators in $ B^-(\overline {B_d^0})\rightarrow PP$ and $PV$ decays
are estimated in the standard model. We find that, for some channels, the
electroweak penguin effects can enhance or reduce the QCD penguin and/or tree
level contributions by at least $30\%$, and can even play dominant role.
","[{""version"":""v1"",""created"":""Wed, 11 Oct 1995 02:37:48 GMT""}]","2014-11-17"
"hep-ph/9510260","Paul Frampton","Paul H. Frampton","Flavors and Horizontal Symmetries","10 pages, latex","Prog.Theor.Phys.Suppl.123:327-336,1996","10.1143/PTPS.123.327","IFP-718-UNC","hep-ph",,"  After a brief introduction to what are the basic flavor questions to be
addressed, I introduce the underlying ideas of horizontal symmetries, with
group $G_H$. For the purposes of specific model building, it is useful to
classify models according to the scale at which $G_H$ is broken. I consider the
three cases: below $m_t$; somewhat above $m_t$; and at $M_{GUT}$. After a
discussion of the shadow sector in the $E_6 \times E_8'$ superstring, there is
a summary.
","[{""version"":""v1"",""created"":""Tue, 10 Oct 1995 19:36:39 GMT""}]","2011-03-02"
"hep-ph/9510261","Paul Frampton","Paul H. Frampton","Influence of Additional Fermions and Gauge Bosons on
  $Re(\epsilon'/epsilon)$","3 pages, latex",,,"IFP-717-UNC","hep-ph",,"  The CP violation parameter $Re(\epsilon'/\epsilon)$ has previously been
calculated in the standard model and the result depends on the top quark mass
in an exciting way. We consider how the result is modified in two specific
extensions of the standard model. The first adds only fermions, an extra
vector-like quark doublet, and tends to reduce $Re(\epsilon'/\epsilon)$. The
second contains three extended families with the third family treated
differently and additional gauge bosons - the 331 model - and can accommodate
larger values of $Re(\epsilon'/\epsilon)$ for a given $m_t$. When the
experimental values of $m_t$ and $Re(\epsilon'/ \epsilon)$ are known more
accurately, it will allow discrimination between theories. If the lower
experimental number $Re(\epsilon'/\epsilon) = (0.74 \pm 0.60) \times 10^{-3}$
(Fermilab, E731) is confirmed and $m_t$ is near the value 175GeV the standard
model is acceptable. But, if the higher value $Re(\epsilon'/\epsilon) = (2.3
\pm 0.65) \times 10^{-3}$ (CERN, NA31) persists, a dynamics like the 331 model
where the third family is treated differently from the first two and there
exist additional gauge bosons seems to be favored.
","[{""version"":""v1"",""created"":""Tue, 10 Oct 1995 19:42:08 GMT""}]","2007-05-23"
"hep-ph/9510262","Rodolfo Sassot","D. de Florian, C.A. Garcia Canal, R. Sassot","Factorization in Semi-Inclusive Polarized Deep Inelastic Scattering","16 pages, figures included using FEYNMAN macro","Nucl.Phys. B470 (1996) 195-210","10.1016/0550-3213(96)00159-9",,"hep-ph",,"  We calculate and analize the ${\cal{O}}(\alpha_s)$ one-particle inclusive
cross section in polarized deep inelastic lepton-hadron scattering, using
dimensional regularization and the HVBM prescription for $\gamma_5$. We discuss
the factorization of all the collinear singularities related to the process,
particularly those which are absorbed in the redefinition of the spin dependent
analogue of the recently introduced fracture functions. This is done in the
usual $\overline{MS}$ scheme and in another one, called $\overline{MS_p}$,
which factorizes soft contributions and guarantees the axial current
(non)conservation properties.
","[{""version"":""v1"",""created"":""Tue, 10 Oct 1995 20:00:13 GMT""}]","2009-10-28"
"hep-ph/9510263","John Collins","John Collins (Penn State)","Polarized Beam Jets","7 pages, LaTeX, no figures",,,,"hep-ph",,"  Handedness and a left-right asymmetry have been proposed as methods of
probing the polarization of hard jets. If the analyzing powers for these
observables are substantial they would provide useful tools for probing
polarized hard scattering. This paper proposes that comparing these to the
corresponding quantities in beam jets in polarized hadron-hadron collisions
would be useful. These would shed light on the similarities and differences
between the fragmentation of hard and soft jets. They would also suggest
whether there is any useful possibility of measuring jet polarization. The
left-right asymmetry of beam jets has already been measured and is large. But
measurements of the handedness of beam jets have still to be done. They could
be done in an upgraded HERMES detector at HERA.
","[{""version"":""v1"",""created"":""Tue, 10 Oct 1995 21:36:27 GMT""}]","2007-05-23"
"hep-ph/9510264",,"Matthias Burkardt","Confinement and the Transverse Lattice","5 pages, LATEX, 1 postscript figure",,,,"hep-ph hep-lat hep-th nucl-th",,"  The status of the transverse lattice formulation of light-front QCD is
reviewed. It is explained how confinement arises in this formulation for large
lattice spacing. The nonperturbative renormalization procedure is outlined in
general and a more detailed discussion is given for the case of
$QCD_{2+1}(N_C\rightarrow \infty)$.
","[{""version"":""v1"",""created"":""Wed, 11 Oct 1995 00:12:44 GMT""}]","2007-05-23"
"hep-ph/9510265",,"U. Baur (SUNY Buffalo)","Self-Couplings of Electroweak Bosons: Theoretical Aspects and Tests at
  Hadron Colliders","LaTeX file, uses wstwocl.sty (available from hep-ph archive), 5
  pages, 2 embedded postscript figures submitted separately as tarred
  compressed file",,,"UB-HET-95-04","hep-ph",,"  The current theoretical understanding of anomalous gauge boson couplings is
reviewed, and the direct measurement of these couplings in present and future
hadron collider experiments is briefly discussed.
","[{""version"":""v1"",""created"":""Wed, 11 Oct 1995 00:36:53 GMT""}]","2007-05-23"
"hep-ph/9510268","Yongseok Oh","Yongseok Oh and Byung-Yoon Park","Excited states of heavy baryons in the Skyrme model","24 pages, REVTeX, epsf.sty, 7 figures in uuencoded file","Phys.Rev.D53:1605-1615,1996","10.1103/PhysRevD.53.1605","SNUTP-95/107","hep-ph",,"  We obtain the spectra of excited heavy baryons containing one heavy quark by
quantizing the exactly-solved heavy meson bound states to Skyrme soliton. The
results are comparable to the recent experimental observations and quark model
predictions, and are consistent with the heavy quark spin symmetry. However,
somewhat large dependence of the results on the heavy quark mass strongly calls
for the incorporation of the soliton-recoil effects.
","[{""version"":""v1"",""created"":""Wed, 11 Oct 1995 05:10:22 GMT""}]","2011-07-19"
"hep-ph/9510269","Z. Hioki","Zenr\=o Hioki","EW Precision Analysis and the Higgs Mass","15 pages, latex, Invited Talk at the second German--Polish Symposium
  ``New Ideas in the Theory of Fundamental Interactions'', Zakopane, Poland,
  September 11-15, 1995 (to appear in the Proceedings)","Acta Phys.Polon. B27 (1996) 2573-2582",,"TOKUSHIMA 95-04","hep-ph",,"  Two topics on the standard electroweak theory are discussed based on its
remarkable success in precision analyses. One is a test of structure of the
radiative corrections to the weak-boson masses as a further precision analysis.
The other is an indirect Higgs-boson search through the radiative corrections
to the various quantities measured at LEP.
","[{""version"":""v1"",""created"":""Wed, 11 Oct 1995 05:30:14 GMT""}]","2007-05-23"
"hep-ph/9510270",,"Stephan Narison (Univ. Montpellier II-France)","Heavy flavours from QCD spectral sum rules","10 pages on Latex file. published version: minor modifications
  compared with the previous version. Contribution to the session on
  non-perturbative methods, EPS conference HEP (July 1995) Brussells",,,"Montpellier preprint 95/43","hep-ph",,"  We present a summary update of the QCD spectral sum rule (QSSR) results for
the running and {\it perturbative pole} quark masses, the $f_D$ and $f_B$
leptonic decay constants, the heavy-to-light and heavy-to-heavy exclusive
transition-form factors. Analytic expressions of these latter quantities are
presented, which give a deeper understanding of their $q^2$- and infinite
mass-behaviours. A short comparison of the QSSR results with alternative
approaches is done.
","[{""version"":""v1"",""created"":""Wed, 11 Oct 1995 10:17:08 GMT""},{""version"":""v2"",""created"":""Tue, 21 Nov 1995 13:23:27 GMT""}]","2008-02-03"
"hep-ph/9510271",,"Antonio Riotto","Towards a Nonequilibrium Quantum Field Theory Approach to Electroweak
  Baryogenesis","19 pages, 1 figure available upon e-mail request","Phys.Rev. D53 (1996) 5834-5841","10.1103/PhysRevD.53.5834","SISSA/AP/95-117 preprint","hep-ph",,"  We propose a general method to compute $CP$-violating observables from
extensions of the standard model in the context of electroweak baryogenesis. It
is alternative to the one recently developed by Huet and Nelson and relies on a
nonequilibrium quantum field theory approach. The method is valid for all
shapes and sizes of the bubble wall expanding in the thermal bath during a
first-order electroweak phase transition. The quantum physics of $CP$-violation
and its suppression coming from the incoherent nature of thermal processes are
also made explicit.
","[{""version"":""v1"",""created"":""Wed, 11 Oct 1995 11:43:11 GMT""}]","2009-10-28"
"hep-ph/9510272",,"M. Bawin, J. Cugnon, and H. Sazdjian","Strongly coupled positronium in a chiral phase","30 pages, Revtex, plus five figures available from the authors","Int. J. Mod. Phys. A 11 (1996) 5303","10.1142/S0217751X96002431","IPNO/TH 95-38","hep-ph",,"  Strongly coupled positronium, considered in its pseudoscalar sector, is
studied in the framework of relativistic quantum constraint dynamics. Case's
method of self-adjoint extension of singular potentials, which avoids explicit
introduction of regularization cut-offs, is adopted. It is found that, as the
coupling constant \alpha increases, the bound state spectrum undergoes an
abrupt change at the critical value \alpha = \alpha_c = 1/2. For \alpha >
\alpha_c, the mass spectrum displays, in addition to the existing states for
\alpha < \alpha_c, a new set of an infinite number of bound states concentrated
in a narrow band starting at mass W=0. In the limit \alpha going to \alpha_c
from above, these states shrink to a single massless state with a mass gap with
the rest of the spectrum. This state has the required properties to represent a
Goldstone boson and to signal a spontaneous breakdown of chiral symmetry. It is
suggested that the critical coupling constant \alpha_c be viewed as a possible
candidate for an ultra- violet stable fixed point of QED, with a distinction
between two phases, joined to each other by a first-order chiral phase
transition.
","[{""version"":""v1"",""created"":""Wed, 11 Oct 1995 12:44:55 GMT""}]","2015-06-25"
"hep-ph/9510273","Frank Krueger","M. Gremm, G. K\""opp, F. Kr\""uger and L. M. Sehgal","Remarks on the Inclusive Decays $\Lambda_b \to X_s \gamma$ and
  $\Lambda_b \to X_c l \bar{\nu}_l$","3 pages, LaTeX, 4 eps figures, uses epsfig.sty, subeqn.sty and
  wstwocl.sty. Presented by L. M. Sehgal at the EPS-HEP conference, Brussels,
  1995. To appear in the proceedings",,,"PITHA 95/28","hep-ph",,"  We consider the effects of quark-binding on the angular distribution and
polarization characteristics of the inclusive decays $\Lambda_b \to X_s \gamma$
and $\Lambda_b \to X_c l \bar{\n}_l$ $(l=e, \tau)$, using the methods of heavy
quark effective theory.
","[{""version"":""v1"",""created"":""Wed, 11 Oct 1995 13:21:24 GMT""}]","2007-05-23"
"hep-th/9510058",,"I.J.R. Aitchison and N.E. Mavromatos","Deviations from Fermi-Liquid behaviour in (2+1)-dimensional Quantum
  Electrodynamics and the normal phase of high-$T_c$ Superconductors","Latex file, 35 pages, Two figures not included, available upon
  request",,"10.1103/PhysRevB.53.9321","OUTP-95-32P","hep-th cond-mat supr-con",,"  We argue that the gauge-fermion interaction in multiflavour quantum
electrodynamics in $(2 + 1)$-dimensions is responsible for non-fermi liquid
behaviour in the infrared, in the sense of leading to the existence of a
non-trivial (quasi) fixed point that lies between the trivial fixed point (at
infinite momenta) and the region where dynamical symmetry breaking and mass
generation occurs. This quasi-fixed point structure implies slowly varying,
rather than fixed, couplings in the intermediate regime of momenta, a situation
which resembles that of (four-dimensional) `walking technicolour' models of
particle physics. The inclusion of wave-function renormalization yields
marginal $O(1/N)$-corrections to the `bulk' non-fermi liquid behaviour caused
by the gauge interaction in the limit of infinite flavour number. Such
corrections lead to the appearance of modified critical exponents. In
particular, at low temperatures there appear to be logarithmic scaling
violations of the linear resistivity of the system of order $O(1/N)$.
Connection with the anomalous normal-state properties of certain condensed
matter systems relevant for high-temperature superconductivity is briefly
discussed. The relevance of the large (flavour) $N$ expansion to the
fermi-liquid problem is emphasized. As a partial result of our analysis, we
point out the absence of Charge-Density-Wave Instabilities from the effective
low-energy theory, as a consequence of gauge invariance.
","[{""version"":""v1"",""created"":""Tue, 10 Oct 1995 19:35:46 GMT""}]","2009-10-28"
"hep-th/9510060","Max welling","Max Welling (Institute of Theoretical Physics Utrecht)","Gravity in 2+1 dimensions as a Riemann-Hilbert problem","32 pages Latex, 4 figures (uuencoded)","Class.Quant.Grav. 13 (1996) 653-680","10.1088/0264-9381/13/4/007","THU95/24","hep-th gr-qc",,"  In this paper we consider 2+1-dimensional gravity coupled to N
point-particles. We introduce a gauge in which the $z$- and
$\bar{z}$-components of the dreibein field become holomorphic and
anti-holomorphic respectively. As a result we can restrict ourselves to the
complex plane. Next we show that solving the dreibein-field: $e^a_z(z)$ is
equivalent to solving the Riemann-Hilbert problem for the group $SO(2,1)$. We
give the explicit solution for 2 particles in terms of hypergeometric
functions. In the N-particle case we give a representation in terms of
conformal field theory. The dreibeins are expressed as correlators of 2 free
fermion fields and twistoperators at the position of the particles.
","[{""version"":""v1"",""created"":""Tue, 10 Oct 1995 21:30:45 GMT""}]","2009-10-28"
"hep-th/9510061","Jens Ole Madsen","J.O. Madsen and E. Ragoucy (Laboratoire de Physique Theorique ENSLAPP)
  (one extra reference added)","Linearization of W algebras and W superalgebras","23 pages, LaTex",,,"ENSLAPP-A-520/95","hep-th",,"  In a recent paper, the authors have shown that the secondary reduction of
W-algebras provides a natural framework for the linearization of W-algebras. In
particular, it allows in a very simple way the calculation of the linear
algebra $W(G,H)_{\geq0}$ associated to a wide class of W(G,H) algebras, as well
as the expression of the W generators of W(G,H) in terms of the generators of
$W(G,H)_{\geq0}$. In this paper, we present the extension of the above
technique to W-superalgebras, i.e. W-algebras containing fermions and bosons of
arbitrary (positive) spins. To be self-contained the paper recall the
linearization of W-algebras. We include also examples such as the linearization
of W_n algebras; W(sl(3|1),sl(3)) and W(osp(1|4),sp(4)) = WB_2 superalgebras.
","[{""version"":""v1"",""created"":""Tue, 10 Oct 1995 16:31:04 GMT""},{""version"":""v2"",""created"":""Mon, 16 Oct 1995 11:36:49 GMT""}]","2008-02-03"
"hep-th/9510062","Achilles D. Speliotopoulos","B. Rosenstein and A. D. Speliotopoulos","Strong Coupling Hadron Masses in $1/d$ Expansion for Wilson fermions","13 pages, one figure, written in Revtex 3.0, one figure available
  upon request to baruch@phys.nthu.edu.tw","Phys.Lett.B365:252-258,1996","10.1016/0370-2693(95)01306-7",,"hep-th hep-lat hep-ph",,"  Motivated by the weak-strong coupling expansion \cite{Rosenstein}, we
calculate the spectrum of hadrons using a systematic $1/d$ ($d$ -
dimensionality of spacetime) in addition to a strong coupling expansion in
$\beta$. The $1/d$ expansion is pushed to the next to leading order in ($1/d$)
for mesons and next to next to leading order for baryons. We do the calculation
using Wilson fermions with arbitrary $r$ and show that doublers decouple from
the spectrum only when $r$ is close to the Wilson's value $r=1$. For these $r$
the spectrum is much closer to the lattice results and the phenomenological
values than those obtained by using either the (nonsystematic) ""randomwalk""
approximation or the hopping parameter expansion. In particular, the value of
the nucleon to $\rho$ - meson mass ratio is lowered to $\frac {3 \log d -1/4}{2
{\rm arccosh} 2}+O(1/d)\approx 1.48$. The result holds even for $\beta$ as
large as 5, where the weak-strong coupling expansion is applicable and
therefore these results are expected to be reasonable.
","[{""version"":""v1"",""created"":""Tue, 10 Oct 1995 17:27:33 GMT""}]","2014-11-18"
"hep-th/9510063","Ed Stoeffhaas","O.J.P. Eboli and H.C. Reis","Quantum evolution of scalar fields in Robertson-Walker space-time","Revtex file, 19 pages, no figures. Compressed ps version available at
  http://phenom.physics.wisc.edu/pub/preprints/1995/madph-95-912.ps.Z or at
  ftp://phenom.physics.wisc.edu/pub/preprints/1995/madph-95-912.ps.Z","Int.J.Mod.Phys.A11:3957-3972,1996","10.1142/S0217751X96001851","MADPH-95-912 IFUSP-P 1135","hep-th",,"  We study the $\lambda \phi^4$ field theory in a flat Robertson-Walker
space-time using the functional Sch\""odinger picture. We introduce a simple
Gaussian approximation to analyze the time evolution of pure states and we
establish the renormalizability of the approximation. We also show that the
energy-momentum tensor in this approximation is finite once we consider the
usual mass and coupling constant renormalizations.
","[{""version"":""v1"",""created"":""Tue, 10 Oct 1995 18:37:24 GMT""}]","2011-08-11"
"hep-th/9510064",,"J. M. Isidro, J. P. Nunes, H. J. Schnitzer","BF Theories and Group-Level Duality",,"Nucl.Phys. B465 (1996) 315-328","10.1016/0550-3213(96)00053-3","BRX-TH-383, US-FT-25-95","hep-th",,"  It is known that the partition function and correlators of the
two-dimensional topological field theory $G_K(N)/ G_K(N)$ on the Riemann
surface $\Sigma_{g,s}$ is given by Verlinde numbers, dim($V_{g,s,K}$) and that
the large $K$ limit of dim($V_{g,s,K}$) gives Vol(${\cal M}_s$), the volume of
the moduli space of flat connections of gauge group $G(N)$ on $\Sigma_{g,s}$,
up to a power of $K$. Given this relationship, we complete the computation of
Vol(${\cal M}_s$) using only algebraic results from conformal field theory. The
group-level duality of $G(N)_K$ is used to show that if $G(N)$ is a classical
group, then $\displaystyle \lim_{N\rightarrow \infty} G_K(N) / G_K(N)$ is a BF
theory with gauge group $G(K)$. Therefore this limit computes Vol(${\cal
M}^\prime_s$), the volume of the moduli space of flat connections of gauge
group $G(K)$.
","[{""version"":""v1"",""created"":""Tue, 10 Oct 1995 20:56:39 GMT""}]","2009-10-28"
