"hep-th/9510065","Chris Radford","Chris Radford (University of New England, Australia)","Localised Solutions of the Maxwell-Dirac Equations","LaTex, 18 pages with psfig; 3 .ps files encoded with uufiles","J.Math.Phys.37:4418-4433,1996","10.1063/1.531663","95-113","hep-th",,"  The full ``classical"" Dirac-Maxwell equations are considered under various
simplifying assumptions. A reduction of the equations is performed in the case
when the Dirac field is {\em static} and a further reduction is performed in
the case of {\em spherical symmetry}. These static spherically symmetric
equations are examined in some detail and a numerical solution presented. Some
surprising results emerge:
  * Spherical symmetry necessitates the existence of a magnetic monopole.
  * There exists a uniquely defined solution, determined only by the demand
that the solution be analytic at infinity.
  * The equations describe highly compact objects with an inner onion-like
shell structure.
","[{""version"":""v1"",""created"":""Wed, 11 Oct 1995 01:26:40 GMT""}]","2010-11-19"
"hep-th/9510066","Gianni Cicuta","G.M.Cicuta, S.Stramaglia, A.G.Ushveridze","Quartic Anharmonic Oscillator and Random Matrix Theory","12 pages in Latex","Mod.Phys.Lett. A11 (1996) 119-129","10.1142/S021773239600014X",,"hep-th",,"  In this paper the relationship between the problem of constructing the ground
state energy for the quantum quartic oscillator and the problem of computing
mean eigenvalue of large positively definite random hermitean matrices is
established. This relationship enables one to present several more or less
closed expressions for the oscillator energy. One of such expressions is given
in the form of simple recurrence relations derived by means of the method of
orthogonal polynomials which is one of the basic tools in the theory of random
matrices.
","[{""version"":""v1"",""created"":""Wed, 11 Oct 1995 07:39:31 GMT""}]","2015-06-26"
"hep-th/9510067","Strathdee John A.","S. Randjbar--Daemi and J. Strathdee","Vacuum Polarization and Chiral Lattice Fermions","23 pages, LaTeX","Nucl.Phys. B461 (1996) 305-326","10.1016/0550-3213(95)00668-0","IC/95/305","hep-th hep-lat",,"  The vacuum polarization due to chiral fermions on a 4--dimensional Euclidean
lattice is calculated according to the overlap prescription. The fermions are
coupled to weak and slowly varying background gauge and Higgs fields, and the
polarization tensor is given by second order perturbation theory. In this order
the overlap constitutes a gauge invariant regularization of the fermion vacuum
amplitude. Its low energy -- long wavelength behaviour can be computed
explicitly and we verify that it coincides with the Feynman graph result
obtainable, for example, by dimensional regularization of continuum gauge
theory. In particular, the Standard Model Callan--Symanzik RG functions are
recovered. Moreover, there are no residual lattice artefacts such as a
dependence on Wilson--type mass parameters.
","[{""version"":""v1"",""created"":""Wed, 11 Oct 1995 09:41:44 GMT""}]","2009-10-28"
"hep-th/9510068","Andrzej Herdegen","Andrzej Herdegen","Asymptotic algebra for charged particles and radiation","28 pages, LaTeX; minor corrections, a reference added","J.Math.Phys. 37 (1996) 100-120","10.1063/1.531378",,"hep-th",,"  A C*-algebra of asymptotic fields which properly describes the infrared
structure in quantum electrodynamics is proposed. The algebra is generated by
the null asymptotic of electromagnetic field and the time asymptotic of charged
matter fields which incorporate the corresponding Coulomb fields. As a
consequence Gauss' law is satisfied in the algebraic setting. Within this
algebra the observables can be identified by the principle of gauge invariance.
A class of representations of the asymptotic algebra is constructed which
resembles the Kulish-Faddeev treatment of electrically charged asymptotic
fields.
","[{""version"":""v1"",""created"":""Wed, 11 Oct 1995 12:28:10 GMT""},{""version"":""v2"",""created"":""Mon, 26 Feb 1996 15:24:04 GMT""}]","2009-10-28"
"hep-th/9510069","Jutta Kunz","Burkhard Kleihaus, Jutta Kunz and Abha Sood","SU(3) Einstein-Yang-Mills-Dilaton Sphalerons and Black Holes","LATEX, 21 pages, including 6 figures","Phys.Lett. B372 (1996) 204-211","10.1016/0370-2693(96)00108-6",,"hep-th gr-qc",,"  SU(3) Einstein-Yang-Mills-dilaton theory possesses sequences of static
spherically symmetric sphaleron and black hole solutions for the SU(2) and the
SO(3) embedding. The solutions depend on the dilaton coupling constant
$\gamma$, approaching the corresponding Einstein-Yang-Mills solutions for
$\gamma \rightarrow 0$, and Yang-Mills-dilaton solutions in flat space for
$\gamma \rightarrow \infty$. The sequences of solutions tend to
Einstein-Maxwell-dilaton solutions with different magnetic charges. The
solutions satisfy analogous relations between the dilaton field and the metric
for general $\gamma$. Thermodynamic properties of the black hole solutions are
discussed.
","[{""version"":""v1"",""created"":""Wed, 11 Oct 1995 12:58:08 GMT""}]","2009-10-28"
"hep-th/9510070","Fujii Akira","Akira Fujii","Toda Lattice Models with Boundary","9 pages, latex, no figures","J.Phys.Soc.Jap. 66 (1997) 507-510","10.1143/JPSJ.66.507","BONN-TH-95-18","hep-th",,"  We consider the soliton solutions in 1- and (1+1)-dimensional Toda lattice
models with a boundary. We make use of the solutions already known on a full
line by means of the Hirota's method. We explicitly construct the solutions
satisfying the boundary conditions. The ${\bf Z}_{\infty}$-symmetric boundary
condition can be introduced by the two-soliton solutions naturally.
","[{""version"":""v1"",""created"":""Wed, 11 Oct 1995 13:51:27 GMT""}]","2015-06-26"
"hep-th/9510071","Ed Corrigan","P. Bowcock, E. Corrigan and R.H. Rietdijk","Background field boundary conditions for affine Toda field theories","21 pages, harvmac","Nucl.Phys. B465 (1996) 350-364","10.1016/0550-3213(96)00050-8","DTP-95/41","hep-th",,"  Classical integrability is investigated for affine Toda field theories in the
presence of a constant background tensor field. This leads to a further set of
discrete possibilities for integrable boundary conditions depending upon the
time-derivative of the fields at the boundary but containing no free parameters
other than the bulk coupling constant.
","[{""version"":""v1"",""created"":""Wed, 11 Oct 1995 13:38:56 GMT""}]","2009-10-28"
"hep-th/9510072","Sorin Aleksandr","S. Krivonos and A. Sorin","Conformal Linearization Versus Nonlinearity of $W$-Algebras","23 pages, LaTeX, report-no added, some misprints corrected",,,"JINR E2-95-427","hep-th",,"  We review the new approach to the theory of nonlinear $W$-algebras which is
developed recently and called {\it conformal linearization}. In this approach
$W$-algebras are embedded as subalgebras into some {\it linear conformal}
algebras with a finite set of currents and most of their properties could be
understood in a much simpler way by studing their linear counterpart. The
general construction is illustrated by the examples of $u(N)$-superconformal,
$W(sl(N),sl(2))$, $W(sl(N),sl(N))$ as well as $W(sl(N),sl(3))$ algebras.
Applications to the construction of realizations (included modulo null fields
realizations) as well as central charge spectrum for minimal models of
nonlinear algebras are discussed. (To appear in ``Geometry and Integrable
Models'', Eds.: P.N.Pyatov & S.N.Solodukhin, World Scientific Publ. Co. (in
press)).
","[{""version"":""v1"",""created"":""Wed, 11 Oct 1995 15:47:22 GMT""},{""version"":""v2"",""created"":""Sun, 15 Oct 1995 11:08:19 GMT""}]","2008-02-03"
"hep-th/9510075","Sudhakar Panda","Ashok Das and Sudhakar Panda","Gelfand-Dikii Brackets for Nonstandard Supersymmetric Systems","Plain Tex file, no figures","Mod.Phys.Lett. A11 (1996) 723-730","10.1142/S0217732396000722","MRI-PHYS/20/95, UR-1437","hep-th",,"  We show how a general nonstandard Lax equation (supersymmetric or otherwise)
can be expressed as a standard Lax equation. This enables us to define the
Gelfand-Dikii brackets for a nonstandard supersymmetric equation. We discuss
the Hamiltonian structures for the nonstandard super KP system and work out
explicitly the two Hamiltonian structures of the supersymmetric Two Boson
system from this point of view.
","[{""version"":""v1"",""created"":""Wed, 11 Oct 1995 15:14:31 GMT""}]","2015-06-26"
"nucl-th/9510019","Evan Reidell","Herman Feshbach (MIT)","Nuclear Physics --- at the frontiers of knowledge","9 pages in LaTeX. (Hardcopy of 21 figs can be requested via email.)",,,"MIT-CTP-2474","nucl-th",,"  (transcript of a talk given by Prof.~Feshbach:) Nuclear physics has been and
will be a major factor in science and technology. It makes unique and important
contributions to medicine, to industry and to other sciences. Interaction with
other physics has been strong. Astrophysics and mesoscopic physics are notable
examples. But what I shall talk about today are labeled {\bf``universals""}.
This refers to results which transcend the limits of a given subject providing
fundamental principles which inform not only nuclear physics but all of
science. It is the universals which take nuclear physics research from the
parochial albeit fascinating studies of nuclear reactions and structure to the
development and formulation of concepts of significance for all of the physical
sciences.
","[{""version"":""v1"",""created"":""Tue, 10 Oct 1995 20:54:40 GMT""}]","2009-09-25"
"nucl-th/9510020","Maria Barbaro","M.B. Barbaro (Dipartimento di Fisica Teorica, Universita' di Torino),
  A. De Pace (Istituto Nazionale di Fisica Nucleare, Sezione di Torino), T.W.
  Donnelly (Center for Theoretical Physics, MIT) and A. Molinari (Dipartimento
  di Fisica Teorica, Universita' di Torino)","Parity-violating longitudinal response","13 pages, uses REVTeX and epsfig, 10 postscript figures; a postscript
  version of the paper is available by anonymous ftp at
  ftp://carmen.to.infn.it/pub/barbaro/papers/9510","Nucl.Phys. A598 (1996) 503-514","10.1016/0375-9474(96)00010-3","CTP#2424","nucl-th",,"  The longitudinal quasielastic parity-violating electron scattering response
is explored within the context of a model that builds antisymmetrized RPA-HF
correlations on a relativistic Fermi gas basis. The large sensitivity to
nuclear dynamics of this observable, found in previous studies where only
pionic correlations were included, is shown to survive in the present model
where the effects from pion, rho, sigma and omega exchange in a version of the
Bonn potential are incorporated. Through an intricate diagrammatic
cancellation/filtration mechanism the longitudinal parity-violating response
turns out to be close to the one obtained in first-order perturbation theory
with the pion alone. Finally, in accord with our previous work, the
parity-violating response is seen to display appreciable sensitivity to the
electric strangeness content of the nucleon, especially at high momentum
transfer.
","[{""version"":""v1"",""created"":""Wed, 11 Oct 1995 09:16:34 GMT""}]","2009-10-28"
"nucl-th/9510021","Arturo De Pace","A. De Pace (Istituto Nazionale di Fisica Nucleare, Sezione di Torino)","Parity-violating longitudinal response","11 pages, uses sprocl and epsfig (available from the archive), 7
  postscript figures; a postscript version of the paper is available by
  anonymous ftp at ftp://carmen.to.infn.it/pub/depace/papers/9510","Perspective in Nuclear Physics at Intermediate Energies, eds. S.
  Boffi et al., (World Scientific, Singapore, 1996) , 166",,,"nucl-th",,"  The parity-violating quasielastic electron scattering response is explored
within the context of a model that builds antisymmetrized random phase
approximation and Hartree-Fock correlations on a relativistic Fermi gas basis.
Particular emphasis is put on the weak-neutral longitudinal response function,
since this observable displays a strong sensitivity to isospin correlations:
specifically, it is shown how, through a diagrammatic cancellation/filtration
mechanism, this response acts as a magnifier of pionic correlations in the
nuclear medium. The parity-violating longitudinal response function also
displays appreciable sensitivity to the electric strangeness content of the
nucleon, thus making quasielastic electron scattering a possible candidate to
measure the nucleon electric strange form factor at relatively high momentum
transfers. Finally, we discuss how observables, related to the asymmetry, can
be constructed to disentangle the nuclear and nucleonic effects.
","[{""version"":""v1"",""created"":""Wed, 11 Oct 1995 13:41:49 GMT""}]","2007-05-23"
"patt-sol/9510002","Komatsu T. S.","Teruhisa S. Komatsu (Department of Physics, Tohoku University,Sendai,
  Japan), Shin-ichi Sasa (Department of Pure and Applied Sciences, College of
  Arts and Sciences, University of Tokyo, Tokyo, Japan; Present address:
  Department of Physics, University of Illinois at Urbana-Champaign, Urbana,
  IL, USA)","Pattern selection of cracks in directionally drying fracture","12 pages, REVTeX with 3 figures (uuencoded tar-compressed postscript)",,,,"patt-sol nlin.PS",,"  We study pattern selection of cracks in directionally drying fractures by
analyzing the experimental systems recently devised by C. Allain and L. Limat.
[Phys. Rev. Lett. {\bf 74}, 2981 (1995).] Proposing a simple picture of crack
formation, we clarify the mechanism of how cracks array regularly and find that
the interval between neighboring cracks is proportional to the $2/3$ power of
the cell thickness. This result explains well the experimental data of Allain
and Limat.
","[{""version"":""v1"",""created"":""Wed, 11 Oct 1995 07:09:03 GMT""}]","2008-02-03"
"q-alg/9510010","Tatsuhiro Nakajima 0426-77-1111x3376","Tatsuhiro Nakajima and Hiro-Fumi Yamada (Tokyo Met. Univ.)","On Reduced Q-Functions","10 pages, Latex",,,,"q-alg math.QA",,"  Schur's $Q$-functions with reduced variables are discussed by employing a
combinatorics of strict partitions. They are called reduced $Q$-functions. We
give a description of the linear relations among reduced $Q$-functions.
","[{""version"":""v1"",""created"":""Wed, 11 Oct 1995 08:24:12 GMT""}]","2008-02-03"
"q-alg/9510011",,"J. A. de Azcarraga and F. Rodenas","Deformed Minkowski spaces: clasification and properties","Some comments/misprints have been added/corrected, to appear in
  Journal of Physics A (1996)","J.Phys.A29:1215-1226,1996","10.1088/0305-4470/29/6/009","FTUV/95-45, IFIC/95-47","q-alg hep-th math.QA",,"  Using general but simple covariance arguments, we classify the `quantum'
Minkowski spaces for dimensionless deformation parameters. This requires a
previous analysis of the associated Lorentz groups, which reproduces a previous
classification by Woronowicz and Zakrzewski. As a consequence of the unified
analysis presented, we give the commutation properties, the deformed (and
central) length element and the metric tensor for the different spacetime
algebras.
","[{""version"":""v1"",""created"":""Wed, 11 Oct 1995 11:09:11 GMT""},{""version"":""v2"",""created"":""Thu, 28 Dec 1995 13:13:31 GMT""}]","2008-11-26"
"quant-ph/9510010","Jose Acacio de Barros","Patrick Suppes (Stanford University), Adonai S. Sant'Anna (Federal
  University of Parana), J. Acacio de Barros (Federal University of Juiz de
  Fora)","A Particle Theory of the Casimir Effect","LaTeX file, 11 pages, no figures. Key words: photon, trajectories,
  QED, Casimir effect, quantum vacuum","Found.Phys.Lett. 9 (1996) 213-223","10.1007/BF02186404",,"quant-ph",,"  In previous works Suppes and de Barros used a pure particle model to derive
interference effects, where individual photons have well-defined trajectories,
and hence no wave properties. In the present paper we extend that description
to account for the Casimir effect. We consider that the linear momentum
$\sum\frac{1}{2}\hbar {\bf k}$ of the vacuum state in quantum electrodynamics
corresponds to the linear momentum of virtual photons. The Casimir effect, in
the cases of two parallel plates and the solid ball, is explained in terms of
the pressure caused by the photons. Contrary to quantum electrodynamics, we
assume a finite number of virtual photons.
","[{""version"":""v1"",""created"":""Tue, 10 Oct 1995 22:39:44 GMT""}]","2009-10-28"
"quant-ph/9510011","John Klauder","John R. Klauder (University of Florida)","Isolation and Expulsion of Divergences in Quantum Field Theory","Latex, 13 pages, no figures",,"10.1142/S0217979296000581",,"quant-ph",,"  Divergences that arise in the quantization of scalar quantum field models by
means of a lattice-space functional integration may be attributed to a single
integration variable, and this fact is demonstrated by showing that if the
integrand for that single integration variable is appropriately changed, then a
perturbation expansion becomes order-by-order finite and divergence free. The
paper concludes with a brief review of a current proposal of how an auxiliary,
nonclassical potential added to the lattice action of a relativistic scalar
field quantization may automatically render an analogous change of the
integrand, and thus may lead, as well, to nontrivial and divergence-free
results.
","[{""version"":""v1"",""created"":""Wed, 11 Oct 1995 15:56:47 GMT""}]","2015-06-26"
"quant-ph/9510012","M. Czachor","Marek Czachor","Simple Proof of Invariance of the Bargmann-Wigner Scalar Products","revtex, 8 pages, no figures",,,,"quant-ph",,"  An explicitly covariant formalism for dealing with Bargmann-Wigner fields is
developed. An invariance of the Barmann-Wigner norm can be proved in a unified
way for both massive and massless fields. It is shown that there exists some
freedom in the choice of the form of the Bargmann-Wigner scalar product.
","[{""version"":""v1"",""created"":""Wed, 11 Oct 1995 13:42:53 GMT""}]","2007-05-23"
"quant-ph/9510013","Matteo G. A. Paris","Matteo G. A. Paris (I.N.F.M.--Pavia, Italy)","Squeezed Vacuum Interferometry","Latex, 7 Pages, 5 PostScript figures available from the author","Mod.Phys.Lett.B9:1141,1995","10.1142/S0217984995001133",,"quant-ph",,"  A high-sensitive interferometric scheme is presented. It is based on homodyne
detection and squeezed vacuum phase properties. The resulting phase sensitivity
scales as $\delta\phi \simeq {1/4} \bar{n}^{-1}$ with respect to input photons
number.
","[{""version"":""v1"",""created"":""Wed, 11 Oct 1995 14:55:12 GMT""}]","2009-10-28"
"quant-ph/9510014","Ole Steuernagel","Ole Steuernagel and John A. Vaccaro","Reconstructing the density operator via simple projectors","RevTex, picture not included - see remark, 5 pages","Phys.Rev.Lett. 75 (1995) 3201-3205","10.1103/PhysRevLett.75.3201","Paper accepted for publication in PRL","quant-ph",,"  We describe the representation of arbitrary density operators in terms of
expectation values of simple projection operators. Two representations are
presented which yield non--recursive schemes for experimentally determining the
density operator of any quantum system. We suggest a possible experimental
implementation in quantum optics.
","[{""version"":""v1"",""created"":""Wed, 11 Oct 1995 14:52:00 GMT""}]","2009-10-28"
"solv-int/9510002","Benjamin Enriquez","B. Enriquez, A.Yu. Orlov, V.N. Rubtsov","Dispersionful analogues of Benney's equations and $N$-wave systems","12 pages, latex, no figures",,"10.1088/0266-5611/12/3/005",,"solv-int hep-th nlin.SI",,"  We recall Krichever's construction of additional flows to Benney's hierarchy,
attached to poles at finite distance of the Lax operator. Then we construct a
``dispersionful'' analogue of this hierarchy, in which the role of poles at
finite distance is played by Miura fields. We connect this hierarchy with
$N$-wave systems, and prove several facts about the latter (Lax representation,
Chern-Simons-type Lagrangian, connection with Liouville equation,
$\tau$-functions).
","[{""version"":""v1"",""created"":""Wed, 11 Oct 1995 14:02:59 GMT""}]","2009-10-28"
"supr-con/9510001","Vladimir Dzhunushaliev","V.D.Dzhunushaliev","The string model of the Cooper pair in the anisotropic superconductor","final version, Latex, 9p, to be published in Phys. Rev. B","Phys.Rev.B, 54, 10121(1996)","10.1103/PhysRevB.54.10121",,"supr-con cond-mat.supr-con hep-th",,"  The analogy between the Cooper pair in high temperature superconductor and
the quark-antiquark pair in quantum chromodynamics (QCD) is proposed. In QCD
the nonlinear chromodynamical field between a quark and an antiquark is
confined to a tube. So we assume that there is the strong interaction between
phonons which can confine them to some tube too. This tube is described using
the nonlinear Schr\""odinger equation. We show that it has an infinite spectrum
of axially symmetric (string) solutions with negative finite linear energy
density. The one-dimensional nonlinear Schr\""odinger equation has a finite
spectrum (hence, it has a steady-state) which describes the Cooper pair
squezeed between anisotropy planes in the superconductor. It is shown that in
this model the transition temperature is approximately 45 K.
","[{""version"":""v1"",""created"":""Wed, 11 Oct 1995 10:18:24 GMT""},{""version"":""v2"",""created"":""Tue, 17 Oct 1995 10:39:16 GMT""},{""version"":""v3"",""created"":""Thu, 4 Jul 1996 06:35:28 GMT""}]","2009-10-28"
