"ao-sci/9508001","Eli Tziperman","Eli Tziperman, Steve Zebiak, Mark Cane","Mechanisms of Seasonal - ENSO interaction","compressed postscript file, figures included Directions for
  uncompressing are pre-pended to the paper",,,,"ao-sci physics.ao-ph",,"  The mechanisms of interaction between the seasonal cycle and ENSO are
investigated using the Zebiak and Cane ENSO prediction model. The most dominant
seasonal effect is found to be due to the wind divergence field, as determined
by the seasonal motion of the ITCZ, through its effect on the atmospheric
heating. The next order seasonal effects are due to the seasonality of the
background SST and ocean upwelling velocity, and the corresponding mechanisms
are analyzed. It is suggested that the seasonal forcing has a first order
effect on ENSO's dynamics. Important aspects of the seasonal forcing may be
included in idealized delayed oscillator ENSO models by making the model
background seasonally shift from stable to unstable states.
","[{""version"":""v1"",""created"":""Thu, 10 Aug 1995 19:17:15 GMT""}]","2008-02-03"
"astro-ph/9508052","Jane Charlton","Jane C. Charlton, Christopher W. Churchill, and Suzanne M. Linder","Probing Lyman-alpha Absorbers with Double Lines of Sight","7 pages with figures included, gzipped postscript; also available at
  http://ucowww.ucsc.edu/~cwc/qso/abstract.html ; Astrophysical Journal Letters
  (in press)","Astrophys.J. 452 (1995) L81","10.1086/309727","PSU-CCL95-1","astro-ph",,"  Study of Lyman-alpha absorption lines in the spectra of double line of sight
(DLOS) quasars holds the promise of diagnosing the nature of the structures
that give rise to Lyman-alpha absorption. Based on simulations of DLOS with
various separations through a single population of absorbers, four tests have
been designed to diagnose absorber mass distributions (smoothly varying with
radius or irregular), geometries (spherical or disk/slab--like), and kinematics
(isotropic or systematic velocities). Applying the tests to existing data at
redshifts around two we find that: (1) The observed neutral hydrogen column
density (N(HI)) distributions of Lyman-alpha lines coincident to both LOS are
consistent with a smooth mass distribution. (2) Observed large anticoincident
N(HI) are not consistent with a single population of smooth spherical
absorbers, which should exhibit sharp cut--offs at small N(HI) in the N(HI)
distribution. (3) There is marginal evidence that the observed RMS value of
velocity differences between coincident lines increases with DLOS separation as
is expected for disk/slab--like absorbers that have systematic velocity fields.
(4) The observed velocity dispersion along a single LOS is small compared to
the RMS difference between widely separated LOS, which is not consistent with
models of cloudlets moving isotropically within a spherical structure. Overall,
only a smooth disk/slab--like model with systematic velocities remains
consistent with the inferred properties of a single population of Lyman-alpha
absorbers.
","[{""version"":""v1"",""created"":""Thu, 10 Aug 1995 23:48:34 GMT""}]","2009-10-28"
"astro-ph/9508053","Rashid Faizullin","Rashid Faizullin","Symmetry for Nearest Stars and N-body Problem with Delay for Interaction","LaTeX, 5 figures in LaTex, in the Proceedings of Int.Conf. ""Groups in
  analisys and geometry"" Omsk 1995",,,,"astro-ph",,"  In the present paper some geometrical and mechanical regularities are
introduced, which constitute certain puzzles of distribution of the nearest
stars of $O,B,AO$ classes (brighter than $6.0^m$) and of the brightest galactic
objects; the regularities appear when considering in the natural, moment
related ($l,b$), ($\alpha,\delta$), ($\lambda,\beta$) coordinate planes. Also,
there are some efforts for deduction these cases from Newton law with delay for
gravitational interaction.
","[{""version"":""v1"",""created"":""Fri, 11 Aug 1995 12:09:53 GMT""}]","2007-05-23"
"astro-ph/9508054","Kris Sellgren","K. Sellgren (Ohio State University), M. W. Werner (Jet Propulsion
  Laboratory), and L. J. Allamandola (NASA Ames Research Center)","A Survey of Near Infrared Emission in Visual Reflection Nebulae","38 pages (87 kB), AASTex format. Also 7 Postscript figures (80 kB),
  tarred, compressed and uuencoded, added with 'figure' command. Postscript
  file or hardcopy available upon request to sellgren@payne.mps.ohio-state.edu.
  ** Sep. 13, 1995: revised Fig. 1. Compressed postscript text+figs now
  available at ftp://bessel.mps.ohio-state.edu/pub/sellgren/survey.ps.Z **
  Accepted, ApJS (Feb. 1996)",,"10.1086/192262",,"astro-ph",,"  We present a survey for extended 2.2 $\mu$m emission in 20 new visual
reflection nebulae, illuminated by stars with temperatures of 3,600 --- 33,000
K. We detect extended 2.2 $\mu$m emission in 13 new nebulae, illuminated by
stars with temperatures of 6,800 -- 33,000 K. For most of these 13 nebulae we
have measured $J-K$, $H-K$, and $K-L'$, as well as obtaining surface brightness
measurements at the wavelength of the 3.3 $\mu$m emission feature. All of the
reflection nebulae with extended near infrared emission in excess over
scattered starlight have very similar near infrared colors and show the 3.3
$\mu$m feature in emission with similar feature-to-continuum ratios. The 3.3
$\mu$m feature-to-continuum ratio ranges from $\sim$3 to $\sim$9, both within
individual nebulae and from nebula to nebula, which suggests that the 3.3
$\mu$m feature and its underlying continuum arise from different materials, or
from different ranges of sizes within a size distribution of particles. No
dependence on the temperature of the illuminating star is seen in the near
infrared colors or 3.3 $\mu$m feature-to-continuum ratio, over a factor of two
in stellar temperature. This is similar to our previous IRAS results, in which
we found no dependence of the ratio of 12 $\mu$m to 100 $\mu$m surface
brightnesses in reflection nebulae illuminated by stars with temperatures of
5,000--33,000 K.
","[{""version"":""v1"",""created"":""Fri, 11 Aug 1995 15:56:47 GMT""},{""version"":""v2"",""created"":""Wed, 13 Sep 1995 17:42:23 GMT""}]","2009-10-28"
"chao-dyn/9508003","Asher Peres","Asher Peres","Chaotic Evolution in Quantum Mechanics","8 pages (LaTeX 16 kB, followed by PostScript 2 kB for figure)",,"10.1103/PhysRevE.53.4524",,"chao-dyn nlin.CD",,"  A quantum system is described, whose wave function has a complexity which
increases exponentially with time. Namely, for any fixed orthonormal basis, the
number of components required for an accurate representation of the wave
function increases exponentially.
","[{""version"":""v1"",""created"":""Fri, 11 Aug 1995 06:21:45 GMT""}]","2009-10-28"
"chao-dyn/9508004","Richard Huveneers","R.J.A.G. Huveneers (University of Utrecht), F. Verhulst (University of
  Utrecht)","A metaphor for adiabatic evolution to symmetry","27 pages, LaTeX 2e, 8 figures included",,,"919","chao-dyn nlin.CD",,"  In this paper we study a Hamiltonian system with a spatially asymmetric
potential. We are interested in the effects on the dynamics when the potential
becomes symmetric slowly in time. We focus on a highly simplified non-trivial
model problem (a metaphor) to be able to pursue explicit calculations as far as
possible. Using the techniques of averaging and adiabatic invariants, we are
able to study all bounded solutions, which reveals significant asymmetric
dynamics even when the asymmetric contributions to the potential have become
negligibly small.
","[{""version"":""v1"",""created"":""Fri, 11 Aug 1995 09:20:50 GMT""}]","2008-02-03"
"chem-ph/9508002","Gerhard Hummer","Gerhard Hummer (Los Alamos National Laboratory)","Electrostatic potential of a homogeneously charged square and cube in
  two and three dimensions","5 pages, 1 Postscript figure, uses revtex.sty",,,"LA-UR 95-2409","chem-ph physics.chem-ph",,"  A closed form of the electrostatic potential of a homogeneously charged cube
is derived by integration. The exact result is compared with multipole
expansions for the exterior and interior of the cube. The electrostatic
potential of a homogeneously charged square in two-dimensional electrostatics
is also determined.
","[{""version"":""v1"",""created"":""Fri, 11 Aug 1995 14:00:56 GMT""}]","2008-02-03"
"cond-mat/9508038","Bruce Elrick","B.M. Elrick and A.E. Jacobs","Single-hole properties in the $t$-$J$ and strong-coupling models","1 RevTeX file with epsf directives to include 8 .eps figures 8 figure
  files encoded using uufiles",,"10.1103/PhysRevB.52.10369",,"cond-mat",,"  We report numerical results for the single-hole properties in the $t$-$J$
model and the strong-coupling approximation to the Hubbard model in two
dimensions. Using the hopping basis with over $10^6$ states we discuss (for an
infinite system) the bandwidth, the leading Fourier coefficients in the
dispersion, the band masses, and the spin-spin correlations near the hole. We
compare our results with those obtained by other methods. The band minimum is
found to be at ($\pi/2,\pi/2$) for the $t$-$J$ model for $0.1 \leq t/J \leq
10$, and for the strong-coupling model for $1 \leq t/J \leq 10$. The bandwidth
in both models is approximately $2J$ at large $t/J$, in rough agreement with
loop-expansion results but in disagreement with other results. The
strong-coupling bandwidth for $t/J\agt6$ can be obtained from the $t$-$J$ model
by treating the three-site terms in first-order perturbation theory. The
dispersion along the magnetic zone face is flat, giving a large
parallel/perpendicular band mass ratio.
","[{""version"":""v1"",""created"":""Thu, 10 Aug 1995 16:09:02 GMT""}]","2009-10-28"
"cond-mat/9508039","Joao A. Filipe","Joao A. N. Filipe and Geoff J. Rodgers (Brunel University)","Theoretical and numerical studies of chemisorption on a line with
  precursor layer diffusion","17 pages(LaTeX), 11 figures(1 PS file, uuencoded), submmited to Phys.
  Rev. E",,"10.1103/PhysRevE.52.6044",,"cond-mat",,"  We consider a model for random deposition of monomers on a line with
extrinsic precursor states. As the adsorbate coverage increases, the system
develops non-trivial correlations due to the diffusion mediated deposition
mechanism. In a numeric simulation, we study various quantities describing the
evolution of the island structure. We propose a simple, self-consistent theory
which incorporates pair correlations. The results for the correlations, island
density number, average island size and probabilities of island nucleation,
growth and coagulation show good agreement with the simulation data.
","[{""version"":""v1"",""created"":""Thu, 10 Aug 1995 18:27:00 GMT""}]","2009-10-28"
"cond-mat/9508040","Gordon Baym","Gordon Baym and Christopher Pethick","Ground-State Properties of Magnetically Trapped Bose-Condensed Rubidium
  Gas","Minor modification of numbers; 9 pages, RevTex, no figures",,"10.1103/PhysRevLett.76.6",,"cond-mat",,"  We give a quantitative account of the ground-state properties of the dilute
magnetically trapped $^{87}$Rb gas recently cooled and Bose-Einstein condensed
at nanokelvin-scale temperatures. Using simple scaling arguments, we show that
at large particle number the kinetic energy is a small perturbation, and find a
spatial structure of the cloud of atoms and its momentum distribution dependent
in an essential way on particle interactions. We also estimate the superfluid
coherence length and the critical angular velocity at which vortex lines become
energetically favorable.
","[{""version"":""v1"",""created"":""Fri, 11 Aug 1995 01:43:03 GMT""},{""version"":""v2"",""created"":""Thu, 24 Aug 1995 23:22:08 GMT""}]","2009-10-28"
"cond-mat/9508041","Batrouni","G. George Batrouni, Alex Hansen and Brond Larson","Current Distribution in the Three-Dimensional Random Resistor Network at
  the Percolation Threshold","10 pages, latex, 8 figures in separate uuencoded file",,"10.1103/PhysRevE.53.2292",,"cond-mat",,"  We study the multifractal properties of the current distribution of the
three-dimensional random resistor network at the percolation threshold. For
lattices ranging in size from $8^3$ to $80^3$ we measure the second, fourth and
sixth moments of the current distribution, finding {\it e.g.\/} that
$t/\nu=2.282(5)$ where $t$ is the conductivity exponent and $\nu$ is the
correlation length exponent.
","[{""version"":""v1"",""created"":""Fri, 11 Aug 1995 09:24:13 GMT""}]","2009-10-28"
"cond-mat/9508042","Jean-Claude LE Guillou","J.C. Le Guillou and E. Ragoucy","Slave-particle quantization and sum rules in the t-J model","24 pages, Plain TeX",,"10.1103/PhysRevB.52.2403",,"cond-mat",,"  In the framework of constrained systems, we give the classical Hamiltonian
formulation of slave-particle models and their correct quantization. The
electron-momentum distribution function in the t-J and Hubbard models is then
studied in the framework of slave-particle approaches and within the decoupling
scheme. We show that criticisms that have been addressed in this context coming
from a violation of the sum rule for the physical electron are not valid. Due
to the correct quantization rules for the slave-particles, the sum rule for the
physical electron is indeed obeyed, both exactly and within the decoupling
scheme.
","[{""version"":""v1"",""created"":""Fri, 11 Aug 1995 09:53:46 GMT""}]","2009-10-28"
"cond-mat/9508043","T. Xiang","T. Xiang and J. M. Wheatley","Superfluid anisotropy in YBCO: Evidence for pair tunneling
  superconductivity","4 pages RevTex + 3 figures (compressed uuencoded postscripts)",,"10.1103/PhysRevLett.76.134","irc9508","cond-mat",,"  Proximity effect and pair tunneling models are applied as alternative
scenarios to explain the recently measured $ab$-plane and $c$-axis components
of the superfluid tensor in Copper-Oxide superconductors which contain chains,
such as $YBa_2Cu_3O_{6.95}$. It is argued that conventional proximity effect
models, which couple chains and planes via single electron tunneling only, are
incompatible with the experimental observations. On the other hand several
surprising features of the experimental data are readily explained by the
presence of a microscopic pair tunneling process.
","[{""version"":""v1"",""created"":""Fri, 11 Aug 1995 13:02:20 GMT""}]","2009-10-28"
"gr-qc/9508027","Yoav Peleg","Sukanta Bose, Leonard Parker and Yoav Peleg (UWM)","Hawking Radiation and Unitary evolution","LaTex file + uuencoded ps version including 4 figures","Phys.Rev.Lett. 76 (1996) 861-864","10.1103/PhysRevLett.76.861","WISC-MILW-95-TH-17","gr-qc hep-th",,"  We find a family of exact solutions to the semi-classical equations
(including back-reaction) of two-dimensional dilaton gravity, describing
infalling null matter that becomes outgoing and returns to infinity without
forming a black hole. When a black hole almost forms, the radiation reaching
infinity in advance of the original outgoing null matter has the properties of
Hawking radiation. The radiation reaching infinity after the null matter
consists of a brief burst of negative energy that preserves unitarity and
transfers information faster than the theoretical bound for positive energy.
","[{""version"":""v1"",""created"":""Thu, 10 Aug 1995 21:55:43 GMT""},{""version"":""v2"",""created"":""Fri, 11 Aug 1995 16:10:39 GMT""}]","2009-10-28"
"gr-qc/9508028","Stephen R. Lau","Stephen R. Lau (Technische Universitaet Wien)","On the Canonical Reduction of Spherically Symmetric Gravity","Revtex, 35 pages, no figures","Class.Quant.Grav.13:1541-1570,1996","10.1088/0264-9381/13/6/020","TUW-95-21. Revised version contains (1) much improved notation, (2)
  several repaired minus signs, (3) new references, and (4) some extra
  discussion devoted to previously overlooked points concerning this work and
  its main reference. To appear in Classical and Quantum Gravity","gr-qc",,"  In a thorough paper Kuchar has examined the canonical reduction of the most
general action functional describing the geometrodynamics of the maximally
extended Schwarzschild geometry. This reduction yields the true degrees of
freedom for (vacuum) spherically symmetric general relativity. The essential
technical ingredient in Kuchar's analysis is a canonical transformation to a
certain chart on the gravitational phase space which features the Schwarzschild
mass parameter $M_{S}$, expressed in terms of what are essentially
Arnowitt-Deser-Misner variables, as a canonical coordinate. In this paper we
discuss the geometric interpretation of Kuchar's canonical transformation in
terms of the theory of quasilocal energy-momentum in general relativity given
by Brown and York. We find Kuchar's transformation to be a ``sphere-dependent
boost to the rest frame,"" where the ``rest frame'' is defined by vanishing
quasilocal momentum. Furthermore, our formalism is general enough to cover the
case of (vacuum) two-dimensional dilaton gravity. Therefore, besides reviewing
Kucha\v{r}'s original work for Schwarzschild black holes from the framework of
hyperbolic geometry, we present new results concerning the canonical reduction
of Witten-black-hole geometrodynamics.
","[{""version"":""v1"",""created"":""Fri, 11 Aug 1995 13:42:13 GMT""},{""version"":""v2"",""created"":""Fri, 18 Aug 1995 17:19:08 GMT""},{""version"":""v3"",""created"":""Wed, 14 Feb 1996 19:05:43 GMT""}]","2010-11-19"
"hep-ex/9508012",,"Lawrence Gibbons (CLEO Collaboration)","Preliminary Results For Exclusive $b\to u\ell\nu$ Decays From CLEO","Latex (world_sci and epsf macros), 8 pages, 3 figures. Talk presented
  at 30th Rencontres de Moriond: Electroweak Interactions and Unified Theories,
  Les Arcs, France, March, 1995",,,"UR-1427","hep-ex",,"  A preliminary analysis of exclusive $\btou$ decays to the final states
$\pi^\pm\ell\nu$, $\pi^0\ell\nu$, $\rho^\pm\ell\nu$, $\rho^0\ell\nu$\ and
$\omega\ell\nu$ based on $2.2\e{6}$ $\bbar$ decays collected at CLEO is
presented. We have measured the first exclusive $\btou$ branching fraction
$\bbpi=[1.19\pm0.41\pm0.21\pm0.19]\e{-4}$
($[1.70\pm0.51\pm0.31\pm0.27]\e{-4}$), with the ISGW (WSB) model used for
efficiency determination. A 90\% C.L. upper limit on $\bbrho$ similar to the
previous CLEO limit is obtained. The ratio $\gamrho/\gampi<3.4$ at the 90\%
confidence level for both the ISGW and WSB models. This ratio provides some
discrimination between form factor models.
","[{""version"":""v1"",""created"":""Thu, 10 Aug 1995 18:58:47 GMT""}]","2007-05-23"
"hep-lat/9508014","Erhard Seiler","Adrian Patrascioiu and Erhard Seiler","Universality Class of $O(N)$ Models","8 pages, with 3 figures included, postscript. An error concerning the
  errors has been corrected",,"10.1103/PhysRevB.54.7177","MPI-PhT/95/73, AZPH-TH/95-18","hep-lat",,"  We point out that existing numerical data on the correlation length and
magnetic susceptibility suggest that the two dimensional $O(3)$ model with
standard action has critical exponent $\eta=1/4$, which is inconsistent with
asymptotic freedom. This value of $\eta$ is also different from the one of the
Wess-Zumino-Novikov-Witten model that is supposed to correspond to the $O(3)$
model at $\theta=\pi$.
","[{""version"":""v1"",""created"":""Fri, 11 Aug 1995 08:46:38 GMT""},{""version"":""v2"",""created"":""Mon, 21 Aug 1995 15:26:29 GMT""}]","2009-10-28"
"hep-ph/9508276",,"D. Kharzeev and H. Satz","Charmonium Composition and Nuclear Suppression","Plain TeX, 8 pages, 5 figures available upon request","Phys.Lett.B366:316-322,1996","10.1016/0370-2693(95)01328-8","CERN-TH/95-214, BI-TP 95/30","hep-ph nucl-th",,"  We study charmonium production in hadron-nucleus collisions through the
intermediate next-to-leading Fock space component $|(\bar{c}c)_8 g>$, formed by
a colour octet $\bar{c}c$ pair and a gluon. We estimate the size of this state
and show that its interaction with nucleons accounts for the observed
charmonium suppression in nuclear interactions.
","[{""version"":""v1"",""created"":""Thu, 10 Aug 1995 16:35:40 GMT""}]","2010-11-19"
"hep-ph/9508279","Karl Westerberg","Igor R. Klebanov and Karl M. Westerberg","A Simple Description of Strange Dibaryons in the Skyrme Model","LaTeX format, 9 pages. No figures","Phys. Rev. D 53, 2804 (1996)","10.1103/PhysRevD.53.2804","PUPT-1555","hep-ph hep-th",,"  We study strange dibaryons based on the SU(2)-embedded B=2 toroidal soliton.
Treating the excursions of the soliton into strange directions as small rigid
oscillations, we obtain a good approximation to the bound state approach. We
calculate the dibaryon mass formula to order 1/N and find that the doubly
strange I=J=0 dibaryon is bound by about 90 MeV.
","[{""version"":""v1"",""created"":""Thu, 10 Aug 1995 17:40:46 GMT""}]","2016-08-24"
"hep-ph/9508280","Peter Arnold","Peter Arnold and Laurence G. Yaffe (Univ. of Washington)","The non-Abelian Debye screening length beyond leading order","30 pages, revtex format, 9 postscript figures included using epsf.sty","Phys.Rev.D52:7208-7219,1995","10.1103/PhysRevD.52.7208","UW/PT-95-06","hep-ph",,"  In quantum electrodynamics, static electric fields are screened at non-zero
temperatures by charges in the plasma. The inverse screening length, or Debye
mass, may be analyzed in perturbation theory and is of order $eT$ at
relativistic temperatures. An analogous situation occurs when non-Abelian gauge
theories are studied perturbatively, but the perturbative analysis breaks down
when corrections of order $e^2 T$ are considered. At this order, the Debye mass
depends on the non-perturbative physics of confinement, and a perturbative
``definition'' of the Debye mass as the pole of a gluon propagator does not
even make sense. In this work, we show how the Debye mass can be defined
non-perturbatively in a manifestly gauge invariant manner (in vector-like gauge
theories with zero chemical potential). In addition, we show how the $O(e^2 T)$
correction could be determined by a fairly simple, three-dimensional, numerical
lattice calculation of the perimeter-law behavior of large, adjoint-charge
Wilson loops.
","[{""version"":""v1"",""created"":""Thu, 10 Aug 1995 23:25:14 GMT""}]","2010-02-16"
"hep-ph/9508283","Tadashi Kon","A.Bartl, H.Eberl, K.Hidaka, T.Kon, W.Majerotto and Y.Yamada","QCD corrections to the decay $H^+ \to \st \bar{\sb}$ in the Minimal
  Supersymmetric Standard Model","15 pages, Latex, 2 figures","Phys.Lett.B373:117-124,1996","10.1016/0370-2693(96)00150-5","UWThPh-1995-26, HEPHY-PUB 626/95, TGU-15, ITP-SU-95/02, KEK-TH-447","hep-ph",,"  We calculate the supersymmetric ${\cal O}(\alpha_s)$ QCD corrections to the
width of the decay $H^+ \rightarrow \st\bar{\sb}$ within the Minimal
Supersymmetric Standard Model. We find that the QCD corrections are
significant, but that they do not invalidate our previous conclusionat
tree-level on the dominance of the $\st\bar{\sb}$ mode in a wide parameter
region.
","[{""version"":""v1"",""created"":""Fri, 11 Aug 1995 06:55:24 GMT""},{""version"":""v2"",""created"":""Fri, 18 Aug 1995 07:02:28 GMT""}]","2011-01-27"
"hep-ph/9508284","Alexander Yelkhovsky","A. Yelkhovsky","Order (Z\alpha)^4 m/M Ry Correction to Hydrogen Levels","14 pages, LaTeX. Extended version with updated references. Minor
  errors corrected, final results unchanged",,,"BudkerINP-95-63","hep-ph",,"  The first in m/M and fourth in Z\alpha (pure recoil) correction to a hydrogen
energy level is found. This correction comprises two contributions, one coming
from the atomic scale, the other from distances of the Compton wavelength
order. Two different perturbation schemes are used to calculate the former. One
of them exploits as unperturbed the solution to the Dirac-Coulomb problem, the
nucleus' slow motion being the source of the perturbation. The alternative
scheme treats both the electron and the nucleus as slow, while relativistic
effects are considered perturbatively. The short-distance contribution is found
in the Feynman and Coulomb gauges. Recent results for P levels are confirmed,
in contrast with those for S levels. Numerically, the shift equals 2.77 kHz for
the ground state and 0.51 kHz for 2S state.
","[{""version"":""v1"",""created"":""Fri, 11 Aug 1995 07:35:01 GMT""},{""version"":""v2"",""created"":""Sat, 25 Nov 1995 06:46:32 GMT""}]","2008-02-03"
"hep-ph/9508285","Ingo Bojak","I. Bojak, M. Ernst (Univ. Dortmund)","BFKL versus HERA","26 pages, 6 eps figures, LaTeX2e using epsfig.sty and amssymb.sty","Phys.Rev. D53 (1996) 80-88","10.1103/PhysRevD.53.80","DO-TH 95/14","hep-ph",,"  The BFKL equation and the kT-factorization theorem are used to obtain
predictions for F2 in the small Bjorken-x region over a wide range of Q**2. The
dependence on the parameters, especially on those concerning the infrared
region, is discussed. After a background fit to recent experimental data
obtained at HERA and at Fermilab (E665 experiment), we find that the predicted,
almost Q**2 independent BFKL slope lambda >= 0.5 appears to be too steep at
lower Q**2 values. Thus there seems to be a chance that future HERA data can
distinguish between pure BFKL and conventional field theoretic renormalization
group approaches.
","[{""version"":""v1"",""created"":""Fri, 11 Aug 1995 12:15:50 GMT""}]","2009-10-28"
