"hep-ph/9508286",,"R. Ragazzon and D. Treleani","Multiparton interactions and production of minijets in high energy
  hadronic collisions","TeX file, 20 pages, 4 figures available on request","Phys.Rev. D53 (1996) 55-62","10.1103/PhysRevD.53.55","UTS-DFT-95-06","hep-ph",,"  We discuss the inclusive cross section to produce two minijets with a large
separation in rapidity in high energy hadronic collisions. The contribution to
the inclusive cross section from the exchange of a BFKL Pomeron is compared
with the contribution from the exchange of two BFKL Pomerons, which is induced
by the unitarization of the semi-hard interaction. The effect of the multiple
exchange is studied both as a function of the azimuthal correlation and as a
function of the transverse momentum of the observed minijets.
","[{""version"":""v1"",""created"":""Fri, 11 Aug 1995 12:41:44 GMT""}]","2009-10-28"
"hep-th/9508046","Qmw Theory Group","B. S. Acharya","N=1 Heterotic-Supergravity Duality and Joyce Manifolds","Minor Latex Error Corrected, 7 pages, Latex file",,,"QMW-Th-95-28","hep-th",,"  We construct the heterotic dual theory in four dimensions of eleven
dimensional supergravity compactified on a particular Joyce manifold, $J$. In
particular, $J$ is constructed from resolving fixed point singularities of
orbifolds of the seven torus in such a way that one is forced to consider a
generalised orbifold on the heterotic side. We conjecture that a heterotic dual
exists for all the compact 7-manifolds of $G_{2}$ holonomy constructed by
Joyce.
","[{""version"":""v1"",""created"":""Thu, 10 Aug 1995 17:33:32 GMT""},{""version"":""v2"",""created"":""Fri, 11 Aug 1995 16:32:54 GMT""}]","2008-02-03"
"hep-th/9508047",,"Gaetano Fiore, Peter Schupp","Identical Particles and Quantum Symmetries","latex, 30 pages; final version (Nucl. Phys. B, in print)","Nucl.Phys. B470 (1996) 211-235","10.1016/0550-3213(96)00157-5","LMU-TPW 95-10","hep-th math.QA q-alg",,"  We propose a solution to the problem of compatibility of Bose-Fermi
statistics with symmetry transformations implemented by compact quantum groups
of Drinfel'd type. We use unitary transformations to conjugate multi-particle
symmetry postulates, so as to obtain a twisted realization of the symmetric
groups S_n.
","[{""version"":""v1"",""created"":""Thu, 10 Aug 1995 19:06:21 GMT""},{""version"":""v2"",""created"":""Wed, 6 Sep 1995 19:05:48 GMT""},{""version"":""v3"",""created"":""Mon, 20 May 1996 13:47:58 GMT""}]","2009-10-28"
"hep-th/9508048","Fernando Tadeu Brandt","Fernando T Brandt and Josif Frenkel","Multiparticle tree amplitudes in scalar field theory","uuencoded gz-compressed file created by csh script uufiles","Phys.Rev. D53 (1996) 2256-2259","10.1103/PhysRevD.53.2256",,"hep-th hep-ph",,"  Following an argument advanced by Feynman, we consider a method for obtaining
the effective action which generates the sum of tree diagrams with external
physical particles. This technique is applied, in the unbroken \lambda \phi^4
theory, to the derivation of the threshold amplitude for the production of $n$
scalar particles by $n$ initial particles. The leading contributions to the
tree amplitude, which become singular in the threshold limit, exhibit a
factorial growth with n.
","[{""version"":""v1"",""created"":""Fri, 11 Aug 1995 14:14:26 GMT""}]","2009-10-28"
"hep-th/9508051","Carlos Laciana","Carlos E. Laciana","Particle Creation Amplification in Curved Space due to Thermal Effects","7 pages; Plain Tex","Nuovo Cim. B112 (1997) 805-810",,,"hep-th",,"  A physical system composed by a scalar field minimally coupled to gravity and
a thermal reservoir, as in thermo field dynamics, all of them in curved space
time, is considered. When the formalism of thermo field dynamics is generalized
to the above mentioned case, an amplification in the number of created
particles is predicted.
","[{""version"":""v1"",""created"":""Fri, 11 Aug 1995 11:29:00 GMT""}]","2007-05-23"
"nucl-th/9508021","Ch. Schuetz","C. Sch\""utz and K. Holinde (Institut f\""ur Kernphysik,
  Forschungszentrum J\""ulich GmbH, D-52425 J\""ulich, Germany)","$\pi NN$ and $\pi N\Delta$ formfactors determined from a microscopic
  model for $\pi N$ scattering","7 pages, 4 postscript figures","Phys.Rev.C54:1561-1565,1996","10.1103/PhysRevC.54.1561","KFA-IKP(TH)-1995-17","nucl-th",,"  We determine the $\pi NN$ and $\pi N\Delta$ formfactors from the $P_{11}$
resp. $P_{33}$ partial wave of $\pi N$ scattering by dressing corresponding
bare vertices with the help of $\pi N$ non--pole contributions. The underlying
model is based on meson exchange, and involves nucleon and delta--isobar pole
and crossed--pole terms together with correlated $\pi\pi$--exchange in the
$J^P=0^+$ ($\sigma$) and $1^-$ ($\rho$) channel. The results are very similar
for $\pi NN$ and $\pi N\Delta$ and can be roughly parametrized by a monopole
with cutoff mass $>$ 500 MeV, with some variation due to model dependencies.
Thus the formfactors are much less soft than derived before for the $\pi NN$
case by Saito and Afnan using the same procedure but different $\pi N$
interaction models.
","[{""version"":""v1"",""created"":""Fri, 11 Aug 1995 13:24:34 GMT""}]","2008-11-26"
"nucl-th/9508022","A. Reuber","G. Janssen, K. Holinde, and J. Speth (IKP, Forschungszentrum J\""ulich)","Correlated $\bbox{\pi \rho}$ Exchange in the $\bbox{NN}$ Interaction","16 pages, REVTeX, 21 Postscript figures",,,"KFA-IKP(TH)-1995-18","nucl-th",,"  We evaluate the contribution to the nucleon-nucleon interaction due to
correlated $\pi\rho$ exchange in the $\pi$, $\omega$, and $A_1$/$H_1$ channels
by means of dispersion-theoretic methods based on a realistic meson exchange
model for the interaction between $\pi$ and $\rho$ mesons. These processes have
substantial effects: In the pionic channel it counterbalances the suppression
generated by a soft $\pi NN$ form factor of monopole type with a cutoff mass of
about 1 GeV; in the $\omega$-channel it provides nearly half of the empirical
repulsion, leaving little room for explicit quark-gluon effects.
","[{""version"":""v1"",""created"":""Fri, 11 Aug 1995 14:31:33 GMT""}]","2016-08-15"
"q-alg/9508004","Vyjayanthi Chari","Vyjayanthi Chari and Andrew Pressley","Yangians: their Representations and Characters",,,,,"q-alg math.QA",,"  We give several formulas for the character of an arbitrary irreducible
finite--dimensional representation for the Yangian of sl_2.
","[{""version"":""v1"",""created"":""Thu, 10 Aug 1995 22:13:29 GMT""}]","2008-02-03"
"solv-int/9508001","Troy Shinbrot","Troy Shinbrot (Rutgers University, Piscataway, NJ)","Integer spin particles necessarily produce half-integer angular momentum
  in a simple complex and periodic Hamiltonian","9 pgs, 2 figures",,,,"solv-int nlin.SI",,"  Exact wave functions are is derived from an azimuthally periodic a
self-consistent quantum Hamiltonian in 2+1 dimensions using both the
Klein-Gordon and the Schroedinger equations. It isWe shown that, curiously, for
both relativistic and non-relativistic equations, integer spin wave equations
necessarily produce half-integer angular momentum in this potential. We find
additionally that the higher energy, relativistic, solutions require an
asymptotically free potential, while the lower energy, Schroedinger, solutions
can exist in a potential that grows linearly with r. These are purely
mathematical results, however we speculate on possible physical
interpretations.
","[{""version"":""v1"",""created"":""Thu, 10 Aug 1995 17:24:03 GMT""},{""version"":""v2"",""created"":""Wed, 9 Aug 2006 19:58:45 GMT""}]","2009-09-25"
